,category_id,description,category_path
0,100,28 James Jeans Maternity Skinny External Maternity Jeans havana,Apparel & Accessories > Apparel > Maternity
1,100,27 James Jeans Maternity Jules Maternity Flared Jean provocateur,Apparel & Accessories > Apparel > Maternity
2,100,Medium Wash Mid-Belly Maternity Skinny Jeans M,Apparel & Accessories > Apparel > Maternity
3,100,Liz Lange® for Target® Maternity Medium Wash Denim Jeans - Blue 16,Apparel & Accessories > Apparel > Maternity
4,100,maternity over the belly ankle skinny jean - medium wash xxl - liz lange® for target,Apparel & Accessories > Apparel > Maternity
5,100,Maternity Under-the-belly Denim Jeans - Dark Blue Wash 6 Long,Apparel & Accessories > Apparel > Maternity
6,100,Liz Lange for Target Maternity Over-the-Belly Bootcut Denim Jeans - Blue Wash 12L,Apparel & Accessories > Apparel > Maternity
7,100,maternity inset under the belly ankle skinny jean - medium wash l - liz lange® for target,Apparel & Accessories > Apparel > Maternity
8,100,Oh Mamma Maternity FullPanel Super Soft Skinny Jeans,Apparel & Accessories > Apparel > Maternity
9,100,oh! mamma maternity plus-size full-panel basic super soft skinny jeans,Apparel & Accessories > Apparel > Maternity
10,100,Tala Maternity Overbelly Skinny Bootcut Jeans Blue Wash Large,Apparel & Accessories > Apparel > Maternity
11,100,tala maternity horseshoe skinny jeans,Apparel & Accessories > Apparel > Maternity
12,100,maternity underbelly skinny jeans dark indigo small,Apparel & Accessories > Apparel > Maternity
13,100,tala maternity embellished pocket skinny jeans - plus,Apparel & Accessories > Apparel > Maternity
14,100,Tala Maternity Manny Overbelly Flap-Pocket Bootcut Jeans - Plus Dark Indigo 1x,Apparel & Accessories > Apparel > Maternity
15,100,maternity overbelly boyfriend jeans - plus,Apparel & Accessories > Apparel > Maternity
16,100,tala maternity bling pocket skinny jeans,Apparel & Accessories > Apparel > Maternity
17,100,Motherhood Maternity Slim Bootcut Jeans Dark Wash XL,Apparel & Accessories > Apparel > Maternity
18,100,Motherhood Maternity Skinny Jeans Modern Rinse PL,Apparel & Accessories > Apparel > Maternity
19,100,"jessica simpson plus size boot-cut maternity jeans, dark wash dark wash 2x",Apparel & Accessories > Apparel > Maternity
20,100,"a pea in the pod distressed maternity skinny jeans, light wash light wash 27",Apparel & Accessories > Apparel > Maternity
21,100,Motherhood Maternity Cropped Straight-Leg Jeans Light Wash M,Apparel & Accessories > Apparel > Maternity
22,100,"fade to blue maternity skinny jeans, dark wash dark wash xs",Apparel & Accessories > Apparel > Maternity
23,100,"Indigo Blue Maternity Distressed Skinny Jeans, Deep Sea Wash Deep Sea Wash S",Apparel & Accessories > Apparel > Maternity
24,100,"A Pea In The Pod Maternity Skinny Jeans, Black Wash Black 27",Apparel & Accessories > Apparel > Maternity
25,100,"motherhood maternity secret fit belly® skinny jeans, dark wash rinse wash m",Apparel & Accessories > Apparel > Maternity
26,100,"motherhood maternity tall skinny jeans, rinse wash rinse wash xl",Apparel & Accessories > Apparel > Maternity
27,100,"Motherhood Maternity Distressed Skinny Jeans, True Blue Wash True Blue Wash S",Apparel & Accessories > Apparel > Maternity
28,100,"motherhood maternity secret fit belly skinny jeans, dark wash rinse wash xl",Apparel & Accessories > Apparel > Maternity
29,100,"jessica simpson maternity petite skinny jeans, dark wash dark wash pxl",Apparel & Accessories > Apparel > Maternity
30,100,"motherhood maternity skinny jeans, dark wash dark wash xs",Apparel & Accessories > Apparel > Maternity
31,100,maternity full-panel cropped dark wash 10 regu,Apparel & Accessories > Apparel > Maternity
32,100,maternity full-panel denim b medium wash 16,Apparel & Accessories > Apparel > Maternity
33,100,maternity the rockstar full- dark wash 10 shor,Apparel & Accessories > Apparel > Maternity
34,100,maternity side-panel boyfrie medium wash 12,Apparel & Accessories > Apparel > Maternity
35,100,maternity smooth-panel skinn dark wash 8,Apparel & Accessories > Apparel > Maternity
36,100,maternity full-panel skinny dark wash 4 long,Apparel & Accessories > Apparel > Maternity
37,100,maternity low-panel straight dark wash 8,Apparel & Accessories > Apparel > Maternity
38,100,maternity full-panel flare-l medium wash 2 long,Apparel & Accessories > Apparel > Maternity
39,100,maternity the rockstar full- dark wash 6 short,Apparel & Accessories > Apparel > Maternity
40,100,maternity full-panel super s rinse 2 regul,Apparel & Accessories > Apparel > Maternity
41,100,Maternity Bootcut Side-Panel Dark Wash 2,Apparel & Accessories > Apparel > Maternity
42,100,maternity side-panel rocksta rinse 14 shor,Apparel & Accessories > Apparel > Maternity
43,100,maternity full-panel/real-wa medium wash 4 regul,Apparel & Accessories > Apparel > Maternity
44,100,maternity the rockstar denim dark wash m,Apparel & Accessories > Apparel > Maternity
45,100,maternity side-panel rocksta medium wash 14 regu,Apparel & Accessories > Apparel > Maternity
46,100,maternity the rockstar full- dark wash 10 regu,Apparel & Accessories > Apparel > Maternity
47,100,maternity side-panel denim s bright white 4,Apparel & Accessories > Apparel > Maternity
48,100,maternity full-panel jeans medium wash 18 shor,Apparel & Accessories > Apparel > Maternity
49,100,maternity full-panel boot-cu medium wash 6 short,Apparel & Accessories > Apparel > Maternity
50,100,maternity full-panel the roc rinse 18 regu,Apparel & Accessories > Apparel > Maternity
51,100,maternity low-panel cuffed d medium wash 10,Apparel & Accessories > Apparel > Maternity
52,100,maternity full-panel boot-cu medium wash 12 shor,Apparel & Accessories > Apparel > Maternity
53,100,maternity full-panel denim s medium wash 16,Apparel & Accessories > Apparel > Maternity
54,100,maternity full-panel boot-cu medium wash 10 regu,Apparel & Accessories > Apparel > Maternity
55,100,maternity full-panel jeans medium wash 10 shor,Apparel & Accessories > Apparel > Maternity
56,100,maternity full-panel/real-wa medium wash 12 regu,Apparel & Accessories > Apparel > Maternity
57,100,maternity basic denim shorts dark wash 8,Apparel & Accessories > Apparel > Maternity
58,100,maternity side-panel boyfrie medium wash 14,Apparel & Accessories > Apparel > Maternity
59,100,maternity smooth-panel every black jack 18 long,Apparel & Accessories > Apparel > Maternity
60,100,maternity full-panel/real-wa medium wash 10 regu,Apparel & Accessories > Apparel > Maternity
61,100,maternity smooth-panel every black jack 12 shor,Apparel & Accessories > Apparel > Maternity
62,100,maternity side-panel boyfrie medium wash 4,Apparel & Accessories > Apparel > Maternity
63,100,maternity low-panel slim boo dark wash 18 shor,Apparel & Accessories > Apparel > Maternity
64,100,maternity pull-on jeggings rinse 6,Apparel & Accessories > Apparel > Maternity
65,100,maternity smooth-panel denim rinse 12 regu,Apparel & Accessories > Apparel > Maternity
66,100,maternity full-panel boot-cu medium wash 4 long,Apparel & Accessories > Apparel > Maternity
67,100,maternity low-panel slim boo dark wash 1 regul,Apparel & Accessories > Apparel > Maternity
68,100,maternity full-panel cropped dark wash 8 regul,Apparel & Accessories > Apparel > Maternity
69,100,maternity the rockstar full- dark wash 6 long,Apparel & Accessories > Apparel > Maternity
70,100,Maternity Full-Panel Skinny Dark Wash 8,Apparel & Accessories > Apparel > Maternity
71,100,maternity denim pull-on short in patina wash / 28 / patina wash,Apparel & Accessories > Apparel > Maternity
72,100,petite maternity pull-on toothpick jean in rinse wash / petite 26 / classic rinse,Apparel & Accessories > Apparel > Maternity
73,100,7 for all mankind secret fit belly(r) signature pocket maternity jeans,Apparel & Accessories > Apparel > Maternity
74,100,Paige Premium Denim Secret Fit Belly(r) 5 Pocket Skinny Leg Maternity Jeans,Apparel & Accessories > Apparel > Maternity
75,100,27 James Jeans Maternity Skinny External Maternity Jeans havana,Apparel & Accessories > Apparel > Maternity
76,100,Dark Wash Skinny Capri Maternity Jeans XL,Apparel & Accessories > Apparel > Maternity
77,100,Liz Lange® for Target® Maternity Under-the-Belly Bootcut Denim Jeans - Blue Wash 8,Apparel & Accessories > Apparel > Maternity
78,100,maternity over the belly distressed ankle skinny jean - medium wash xl - liz lange® for target,Apparel & Accessories > Apparel > Maternity
79,100,Maternity Bootcut Denim Jeans Dark Blue Wash 8 Long,Apparel & Accessories > Apparel > Maternity
80,100,Maternity Inset Under the Belly Bootcut Jean - Dark Wash 8 - Liz Lange® for Target,Apparel & Accessories > Apparel > Maternity
81,100,maternity inset under the belly ankle skinny jean - dark wash xs - liz lange® for target,Apparel & Accessories > Apparel > Maternity
82,100,denim diva maternity full panel bling flap pocket skinny jeans,Apparel & Accessories > Apparel > Maternity
83,100,Denim Diva Maternity Full-Panel Fleur-de-Lis Embellished Bootcut Jeans with Flap Back Pocket:Color:Dark Wash:Size:XL,Apparel & Accessories > Apparel > Maternity
84,100,denim diva maternity plussize full panel bling loop embellished pocket bootcut jeans,Apparel & Accessories > Apparel > Maternity
85,100,tala maternity overbelly super soft basic skinny jeans dark blue large,Apparel & Accessories > Apparel > Maternity
86,100,tala maternity overbelly super soft skinny ankle jeans,Apparel & Accessories > Apparel > Maternity
87,100,maternity overbelly distressed skinny jeans medium wash medium,Apparel & Accessories > Apparel > Maternity
88,100,Tala Maternity Overbelly Skinny Bootcut Jeans Black Wash Medium,Apparel & Accessories > Apparel > Maternity
89,100,tala maternity overbelly butt-lifting skinny jeans - plus,Apparel & Accessories > Apparel > Maternity
90,100,maternity overbelly skinny jeans dark indigo large,Apparel & Accessories > Apparel > Maternity
91,100,tala maternity boyfriend jeans,Apparel & Accessories > Apparel > Maternity
92,100,tala maternity overbelly butt-lifting skinny jeans,Apparel & Accessories > Apparel > Maternity
93,100,tala maternity overbelly butt-lifting skinny jeans - plus platinum 1x,Apparel & Accessories > Apparel > Maternity
94,100,"Indigo Blue Maternity Distressed Skinny Jeans, Bright Blue Wash Bright Blue M",Apparel & Accessories > Apparel > Maternity
95,100,Motherhood Maternity Slim Bootcut Maternity Jeans Dark Wash Denim S,Apparel & Accessories > Apparel > Maternity
96,100,Motherhood Maternity Petite Bootcut Maternity Jeans Midnight Dark PM,Apparel & Accessories > Apparel > Maternity
97,100,"Luxe Essentials Maternity Straight-Leg Jeans, Dark Wash Dark Wash 28",Apparel & Accessories > Apparel > Maternity
98,100,"A Pea In The Pod Maternity Jeggings, Dark Wash Dark Wash 26",Apparel & Accessories > Apparel > Maternity
99,100,"jessica simpson maternity skinny maternity jeans, dark wash dark wash l",Apparel & Accessories > Apparel > Maternity
100,100,"Motherhood Maternity Skinny Jeans, Dark Wash Modern Rinse L",Apparel & Accessories > Apparel > Maternity
101,100,"Wallflower Maternity Ripped Skinny Jeans, Medium Wash Dusted Medium Wash S",Apparel & Accessories > Apparel > Maternity
102,100,"A Pea In The Pod Maternity Skinny Jeans, White Wash",Apparel & Accessories > Apparel > Maternity
103,100,"Jessica Simpson Petite Maternity Skinny Jeans, Medium Wash Medium Wash PM",Apparel & Accessories > Apparel > Maternity
104,100,maternity side-panel rocksta medium wash 6 regul,Apparel & Accessories > Apparel > Maternity
105,100,maternity the rockstar denim dark wash s,Apparel & Accessories > Apparel > Maternity
106,100,maternity full-panel boot-cu medium wash 18 long,Apparel & Accessories > Apparel > Maternity
107,100,maternity low-panel boyfrien medium wash 4,Apparel & Accessories > Apparel > Maternity
108,100,maternity side-panel rocksta rinse 16 shor,Apparel & Accessories > Apparel > Maternity
109,100,Maternity Low-Panel Jeggings Light Wash 2 Regul,Apparel & Accessories > Apparel > Maternity
110,100,maternity full-panel cuffed dark wash 16,Apparel & Accessories > Apparel > Maternity
111,100,maternity full-panel cuffed medium wash 14,Apparel & Accessories > Apparel > Maternity
112,100,maternity side-panel rocksta light wash 18 regu,Apparel & Accessories > Apparel > Maternity
113,100,maternity side-panel skinny dark wash 1,Apparel & Accessories > Apparel > Maternity
114,100,maternity smooth-panel skinn dark wash 16,Apparel & Accessories > Apparel > Maternity
115,100,maternity full-panel boot-cu dark wash 18 long,Apparel & Accessories > Apparel > Maternity
116,100,maternity full-panel skinny dark wash 10 long,Apparel & Accessories > Apparel > Maternity
117,100,maternity full-panel cropped dark wash 4 regul,Apparel & Accessories > Apparel > Maternity
118,100,maternity woven-waist boot-c dark wash 4 regul,Apparel & Accessories > Apparel > Maternity
119,100,maternity full-panel jeans medium wash 12 shor,Apparel & Accessories > Apparel > Maternity
120,100,maternity full-panel denim b medium wash 12,Apparel & Accessories > Apparel > Maternity
121,100,maternity full-panel cuffed medium wash 4,Apparel & Accessories > Apparel > Maternity
122,100,maternity full panel everyda classic navy 12 shor,Apparel & Accessories > Apparel > Maternity
123,100,maternity full-panel flare-l medium wash 12 long,Apparel & Accessories > Apparel > Maternity
124,100,maternity low-panel slim boo dark wash 18,Apparel & Accessories > Apparel > Maternity
125,100,maternity full-panel jeans medium wash 6 short,Apparel & Accessories > Apparel > Maternity
126,100,maternity full-panel cuffed dark wash 12,Apparel & Accessories > Apparel > Maternity
127,100,Maternity Low-Panel The Rock Medium Wash 18,Apparel & Accessories > Apparel > Maternity
128,100,maternity low-panel jeggings light wash 6 regul,Apparel & Accessories > Apparel > Maternity
129,100,maternity the rockstar full- dark wash 4 regul,Apparel & Accessories > Apparel > Maternity
130,100,maternity side-panel cuffed medium wash 16,Apparel & Accessories > Apparel > Maternity
131,100,maternity woven-waist boot-c dark wash 1 regul,Apparel & Accessories > Apparel > Maternity
132,100,maternity low-panel straight dark wash 2,Apparel & Accessories > Apparel > Maternity
133,100,maternity the rockstar full- dark wash 18 regu,Apparel & Accessories > Apparel > Maternity
134,100,maternity full-panel skinny dark wash 8 long,Apparel & Accessories > Apparel > Maternity
135,100,maternity low-panel straight dark wash 4,Apparel & Accessories > Apparel > Maternity
136,100,maternity low-panel slim boo dark wash 14,Apparel & Accessories > Apparel > Maternity
137,100,maternity full-panel skinny dark wash 14 shor,Apparel & Accessories > Apparel > Maternity
138,100,maternity full-panel skinny dark wash 6 short,Apparel & Accessories > Apparel > Maternity
139,100,maternity full-panel jeans medium wash 4 long,Apparel & Accessories > Apparel > Maternity
140,100,maternity the rockstar full- dark wash 12 regu,Apparel & Accessories > Apparel > Maternity
141,100,maternity full-panel denim s medium wash 8,Apparel & Accessories > Apparel > Maternity
142,100,maternity woven-waist boot-c dark wash 6 short,Apparel & Accessories > Apparel > Maternity
143,100,maternity side-panel cuffed dark wash 8 regul,Apparel & Accessories > Apparel > Maternity
144,100,maternity low panel cropped dark wash 10 regu,Apparel & Accessories > Apparel > Maternity
145,100,maternity slim broken-in boyfriend jean in michel wash / 26 / michel wash,Apparel & Accessories > Apparel > Maternity
146,100,tall maternity matchstick jean in black / tall 31 / pitch black wash,Apparel & Accessories > Apparel > Maternity
147,100,maternity pull-on toothpick jean in rinse wash / 32 / classic rinse,Apparel & Accessories > Apparel > Maternity
148,100,maternity toothpick jean in rinse / 32 / classic rinse,Apparel & Accessories > Apparel > Maternity
149,100,stretch maternity toothpick jean in chalk / 27 / white,Apparel & Accessories > Apparel > Maternity
150,100,maternity matchstick jean in pitch black wash / 29 / pitch black wash,Apparel & Accessories > Apparel > Maternity
151,100,petite maternity pull-on toothpick jean in chalk / petite 26 / white,Apparel & Accessories > Apparel > Maternity
152,100,maternity pull-on toothpick jean in rinse wash / 28 / classic rinse,Apparel & Accessories > Apparel > Maternity
153,100,Petite maternity toothpick jean in black PETITE 25 TRUE BLACK,Apparel & Accessories > Apparel > Maternity
154,100,Paige Denim 'Verdugo' Skinny Maternity Jeans (Armstrong) Armstrong 32,Apparel & Accessories > Apparel > Maternity
155,100,Paige Denim 'Jimmy Jimmy' Skinny Maternity Jeans (Blue) Blue 26,Apparel & Accessories > Apparel > Maternity
156,100,paige denim 'skyline' maternity ankle skinny jeans (carson) carson 30 maternity,Apparel & Accessories > Apparel > Maternity
157,100,paige denim 'verdugo' skinny maternity jeans (black shadow) black shadow 25 maternity,Apparel & Accessories > Apparel > Maternity
158,100,paige denim 'jimmy jimmy' skinny boyfriend maternity jeans (tawni destruction) tawni destruction 32,Apparel & Accessories > Apparel > Maternity
159,100,Olian Flare Maternity Jeans Dark Denim Large Maternity,Apparel & Accessories > Apparel > Maternity
160,100,topshop 'leigh' maternity skinny jeans black 10 maternity,Apparel & Accessories > Apparel > Maternity
161,100,paige denim 'skyline' skinny maternity jeans (mona) mona 29 maternity,Apparel & Accessories > Apparel > Maternity
162,100,Paige Denim 'Transcend - Verdugo' Skinny Maternity Jeans (Armstrong) Cassie 27 Maternity,Apparel & Accessories > Apparel > Maternity
163,100,Paige Denim 'Transcend - Verdugo' Maternity Jeans (Nottingham) Nottingham 29 Maternity,Apparel & Accessories > Apparel > Maternity
164,100,DL1961 'Angel' Ankle Cigarette Maternity Jeans (Lily) Lily 30 Maternity,Apparel & Accessories > Apparel > Maternity
165,100,paige denim 'transcend - verdugo' maternity ankle jeans with side gussets (mae) mae blue 25 maternity,Apparel & Accessories > Apparel > Maternity
166,100,paige denim 'skyline' maternity bootcut jeans (twilight) carson 32 maternity,Apparel & Accessories > Apparel > Maternity
167,100,Paige Denim 'Transcend - Verdugo' Skinny Maternity Jeans (Black Shadow Destructed) Black Shadow Destructed 30 Maternity,Apparel & Accessories > Apparel > Maternity
168,100,Paige Denim 'Jimmy Jimmy' Skinny Boyfriend Maternity Jeans (Penelope) Penelope 28 Maternity,Apparel & Accessories > Apparel > Maternity
169,100,Paige Denim 'Jimmy Jimmy' Straight Leg Crop Maternity Jeans (Penelope) Penelope 26 Maternity,Apparel & Accessories > Apparel > Maternity
170,100,paige denim 'skyline' maternity bootcut jeans (twilight) carson 29 maternity,Apparel & Accessories > Apparel > Maternity
171,100,paige denim 'skyline' ankle peg maternity jeans with side gussets (ringo) ringo blue 28 maternity,Apparel & Accessories > Apparel > Maternity
172,100,paige denim 'skyline' maternity ankle skinny jeans (carson) carson 31 maternity,Apparel & Accessories > Apparel > Maternity
173,100,DL1961 Cindy Maternity Slim Bootcut Jean Celtic 29,Apparel & Accessories > Apparel > Maternity
174,100,James Jeans Skinny Bodega Maternity Jean Bodega 31,Apparel & Accessories > Apparel > Maternity
175,100,James Jeans Skinny Maternity Jean Atlas 28,Apparel & Accessories > Apparel > Maternity
176,100,james jeans ankle skinny maternity jean pure black 28,Apparel & Accessories > Apparel > Maternity
177,100,paige premium denim verdugo ultra skinny maternity jean twilight 28,Apparel & Accessories > Apparel > Maternity
178,100,Madeleine Maternity Vintage Wash Skinny Jean VINTAGE 30,Apparel & Accessories > Apparel > Maternity
179,100,paige premium denim paige premium denim verdugo coated skinny maternity jean plum coated 28,Apparel & Accessories > Apparel > Maternity
180,100,Madeleine Maternity Vintage Destroyed Skinny Underbelly Jean Vintage 28,Apparel & Accessories > Apparel > Maternity
181,100,Paige Premium Denim Skyline Skinny Elastic Maternity Jean LEX 28,Apparel & Accessories > Apparel > Maternity
182,100,james jeans maternity skinny external maternity jeans eiffel 31,Apparel & Accessories > Apparel > Maternity
183,100,james jeans maternity skinny crop maternity jean fiore 29,Apparel & Accessories > Apparel > Maternity
184,100,j brand straight leg maternity jean polish 28,Apparel & Accessories > Apparel > Maternity
185,100,james jeans maternity twiggy 5-pocket leggings smoked diamond 26,Apparel & Accessories > Apparel > Maternity
186,100,james jeans maternity twiggy 5-pocket leggings azure 31,Apparel & Accessories > Apparel > Maternity
187,100,james jeans maternity color: provocateur,Apparel & Accessories > Apparel > Maternity
188,100,madeleine maternity skinny denim pant indigo 26,Apparel & Accessories > Apparel > Maternity
189,100,"dl1961 emma maternity distressed jeans, dove, 26",Apparel & Accessories > Apparel > Maternity
190,100,"james jeans neo beau maternity jeans, fetch, 27",Apparel & Accessories > Apparel > Maternity
191,100,mama j maternity legging jeans,Apparel & Accessories > Apparel > Maternity
192,100,"j brand 3401 maternity legging jeans, olympia, 31",Apparel & Accessories > Apparel > Maternity
193,100,"citizens of humanity maternity koi denim leggings, dust, 28",Apparel & Accessories > Apparel > Maternity
194,100,"james jeans twiggy maternity legging jeans, frost white, 29",Apparel & Accessories > Apparel > Maternity
195,100,"James Jeans Twiggy Maternity Skinny Jeans, China Doll, 32",Apparel & Accessories > Apparel > Maternity
196,100,"dl1961 angel maternity ankle jeans, mariner, 32",Apparel & Accessories > Apparel > Maternity
197,100,avedon skinny maternity jeans,Apparel & Accessories > Apparel > Maternity
198,100,"citizens of humanity avedon skinny maternity jeans, cruz, 30",Apparel & Accessories > Apparel > Maternity
199,100,"James Jeans Twiggy Maternity Jeans, Oil Slick, 28",Apparel & Accessories > Apparel > Maternity
200,100,"paige denim jimmy jimmy maternity skinny jeans, rebel, 26",Apparel & Accessories > Apparel > Maternity
201,100,"james jeans twiggy 5 pocket maternity jeans, slate ii, 28",Apparel & Accessories > Apparel > Maternity
202,100,"james jeans twiggy maternity legging jeans, frost white, 25",Apparel & Accessories > Apparel > Maternity
203,100,"James Jeans Twiggy Maternity Legging Jeans, Black Clean II, 28",Apparel & Accessories > Apparel > Maternity
204,100,"dl1961 angel maternity ankle jeans, riker, 26",Apparel & Accessories > Apparel > Maternity
205,100,"citizens of humanity avedon skinny maternity jeans, cruz, 29",Apparel & Accessories > Apparel > Maternity
206,100,"Paige Denim Transcend Verdugo Ultra Skinny Maternity Jeans, Black Shadow, 24",Apparel & Accessories > Apparel > Maternity
207,100,"DL1961 Florence Insta Sculpt Maternity Jeans, Boston, 27",Apparel & Accessories > Apparel > Maternity
208,100,"j brand 3401 maternity legging jeans, starless, 26",Apparel & Accessories > Apparel > Maternity
209,100,"citizens of humanity avedon skinny maternity jeans, star, 26",Apparel & Accessories > Apparel > Maternity
210,100,"dl1961 emma maternity jeans, heath, 25",Apparel & Accessories > Apparel > Maternity
211,100,"James Jeans Maternity Twiggy Legging Jeans, China Doll, 31",Apparel & Accessories > Apparel > Maternity
212,100,"James Jeans Twiggy Maternity Skinny Jeans, Black Jeather, 32",Apparel & Accessories > Apparel > Maternity
213,100,"j brand 3411 maternity skinny jeans, ink, 32",Apparel & Accessories > Apparel > Maternity
214,100,maternity denim pull-on short in patina wash / 26 / patina wash,Apparel & Accessories > Apparel > Maternity
215,100,maternity toothpick jean in pitch black wash / 30 / pitch black wash,Apparel & Accessories > Apparel > Maternity
216,100,maternity pull-on toothpick jean in black / 26 / true black,Apparel & Accessories > Apparel > Maternity
217,100,stretch maternity toothpick jean in chalk / 26 / white,Apparel & Accessories > Apparel > Maternity
218,100,maternity pull-on toothpick jean in chalk 26 white,Apparel & Accessories > Apparel > Maternity
219,100,maternity toothpick jean in classic rinse / 30 / classic rinse,Apparel & Accessories > Apparel > Maternity
220,100,stretch maternity toothpick jean in chalk / 31 / white,Apparel & Accessories > Apparel > Maternity
221,100,Maternity Side-Panel Pixie P Medium Wash 16 Regu,Apparel & Accessories > Apparel > Maternity
222,100,paige denim 'skyline' maternity skinny jeans (carson) carson 32 maternity,Apparel & Accessories > Apparel > Maternity
223,100,Topshop Maternity Skinny Moto Jeans Blue 6S Maternity,Apparel & Accessories > Apparel > Maternity
224,100,paige denim 'transcend - verdugo' skinny maternity jeans (black shadow) black shadow 28 maternity,Apparel & Accessories > Apparel > Maternity
225,100,paige denim 'jimmy jimmy' skinny boyfriend maternity jeans (penelope) penelope 30 maternity,Apparel & Accessories > Apparel > Maternity
226,100,Paige Denim 'Verdugo' Maternity Ankle Jeans with Side Gussets (Mae) Mae Blue 33 Maternity,Apparel & Accessories > Apparel > Maternity
227,100,paige denim 'jimmy jimmy' skinny boyfriend maternity jeans (penelope) penelope 31 maternity,Apparel & Accessories > Apparel > Maternity
228,100,paige denim 'transcend - verdugo' ultra skinny maternity jeans (armstrong) armstrong 29 maternity,Apparel & Accessories > Apparel > Maternity
229,100,Paige Denim 'Jimmy Jimmy' Boyfriend Skinny Maternity Jeans (Rebel Destructed) Rebel Destructed 30 Maternity,Apparel & Accessories > Apparel > Maternity
230,100,paige denim 'skyline' skinny maternity jeans (mona) mona 31 maternity,Apparel & Accessories > Apparel > Maternity
231,100,Paige Denim 'Union Skyline' Skinny Leg Maternity Jeans (Twilight) Twilight 29 Maternity,Apparel & Accessories > Apparel > Maternity
232,100,topshop 'leigh' maternity skinny jeans black 6r maternity,Apparel & Accessories > Apparel > Maternity
