,category_id,description,category_path
2475,100,maternity the rockstar low-p rinse 2,Apparel & Accessories > Apparel > Maternity
2476,100,maternity smooth-panel denim rinse 8 regul,Apparel & Accessories > Apparel > Maternity
2477,100,maternity woven-waist boot-c dark wash 6 long,Apparel & Accessories > Apparel > Maternity
2478,100,maternity full-panel boot-cu dark wash 8 short,Apparel & Accessories > Apparel > Maternity
2479,100,maternity the rockstar full- dark wash 14 shor,Apparel & Accessories > Apparel > Maternity
2480,100,maternity full-panel flare-l medium wash 4 short,Apparel & Accessories > Apparel > Maternity
2481,100,maternity side-panel harper light gray 12 regu,Apparel & Accessories > Apparel > Maternity
2482,100,Maternity Full-Panel The Roc Rinse 16 Regu,Apparel & Accessories > Apparel > Maternity
2483,100,maternity full-panel denim s medium wash 14,Apparel & Accessories > Apparel > Maternity
2484,100,maternity the rockstar low-p rinse 8,Apparel & Accessories > Apparel > Maternity
2485,100,Maternity Full-Panel The Roc Rinse 16 Shor,Apparel & Accessories > Apparel > Maternity
2486,100,maternity full-panel/real-wa medium wash 16 regu,Apparel & Accessories > Apparel > Maternity
2487,100,maternity demi-panel zip-leg alpine tundra 16,Apparel & Accessories > Apparel > Maternity
2488,100,james jeans maternity twiggy 5-pocket leggings slate 29,Apparel & Accessories > Apparel > Maternity
2489,100,madeleine maternity destroyed skinny denim pant indigo 29,Apparel & Accessories > Apparel > Maternity
2490,100,james jeans maternity color: fiore,Apparel & Accessories > Apparel > Maternity
2491,100,madeleine maternity skinny denim pant indigo 28,Apparel & Accessories > Apparel > Maternity
2492,100,james jeans maternity reboot skinny bootcut jeans drakko 28,Apparel & Accessories > Apparel > Maternity
2493,100,james jeans maternity twiggy 5-pocket leggings smoked diamond 29,Apparel & Accessories > Apparel > Maternity
2494,100,Emerson Maternity Boyfriend Jeans,Apparel & Accessories > Apparel > Maternity
2495,100,"DL1961 Angel Maternity Ankle Jeans, Riker, 31",Apparel & Accessories > Apparel > Maternity
2496,100,"citizens of humanity avedon skinny maternity jeans, star, 32",Apparel & Accessories > Apparel > Maternity
2497,100,"Paige Denim Verdugo Ultra Skinny Maternity Jeans, Black Overdye, 28",Apparel & Accessories > Apparel > Maternity
2498,100,"DL1961 Angel Ankle Maternity Jeans, Zeppelin, 28",Apparel & Accessories > Apparel > Maternity
2499,100,"Paige Denim Jimmy Jimmy Maternity Skinny jeans, Rebel, 25",Apparel & Accessories > Apparel > Maternity
2500,100,"paige denim skyline ankle peg maternity jeans, carson, 26",Apparel & Accessories > Apparel > Maternity
2501,100,"j brand 3401 maternity legging jeans, hewson, 29",Apparel & Accessories > Apparel > Maternity
2502,100,"citizens of humanity emmanuel slim boot cut maternity jeans, secret, 30",Apparel & Accessories > Apparel > Maternity
2503,100,"Citizens of Humanity Emerson Maternity Boyfriend Jeans, Amuse, 30",Apparel & Accessories > Apparel > Maternity
2504,100,avedon skinny maternity ankle jeans,Apparel & Accessories > Apparel > Maternity
2505,100,"Paige Denim Skyline Ankle Peg Maternity Jeans, Optic White, 31",Apparel & Accessories > Apparel > Maternity
2506,100,"citizens of humanity avedon skinny maternity jeans, cruz, 25",Apparel & Accessories > Apparel > Maternity
2507,100,maternity racer skinny jeans,Apparel & Accessories > Apparel > Maternity
2508,100,"citizens of humanity avedon skinny maternity ankle jeans, distressed bombay, 26",Apparel & Accessories > Apparel > Maternity
2509,100,"J Brand 3401 Maternity Legging Jeans, Pitch, 25",Apparel & Accessories > Apparel > Maternity
2510,100,"james jeans twiggy maternity skinny jeans, frost white, 32",Apparel & Accessories > Apparel > Maternity
2511,100,"j brand 3401 mama j super skinny maternity jeans, blue bird, 31",Apparel & Accessories > Apparel > Maternity
2512,100,"Citizens of Humanity Racer Maternity Jeans, Santorini, 31",Apparel & Accessories > Apparel > Maternity
2513,100,"j brand 3401 maternity legging jeans, pitch, 26",Apparel & Accessories > Apparel > Maternity
2514,100,racer low rise maternity skinny jeans,Apparel & Accessories > Apparel > Maternity
2515,100,"citizens of humanity avedon maternity jeans, sea isle, 26",Apparel & Accessories > Apparel > Maternity
2516,100,James Jeans Maternity Jeans - Skinny Legging 26 Black,Apparel & Accessories > Apparel > Maternity
2517,100,DL1961 Maternity Jeans - Amanda Skinny in Wooster 29 Wooster,Apparel & Accessories > Apparel > Maternity
2518,100,DL1961 Maternity Jeans - Amanda Skinny in Wooster 24 Wooster,Apparel & Accessories > Apparel > Maternity
2519,100,j brand jeans - 3401 maternity legging in olympia 27 olympia,Apparel & Accessories > Apparel > Maternity
2520,100,paige maternity jeans - verdugo ultra skinny in black shadow 28 black shadow,Apparel & Accessories > Apparel > Maternity
2521,100,James Jeans Twiggy Maternity Legging Jeans 24 Black Swan,Apparel & Accessories > Apparel > Maternity
2522,100,DL1961 Maternity Jeans - Angel Ankle Cigarette in Lily 26 Lily,Apparel & Accessories > Apparel > Maternity
2523,100,petite maternity straight leg jeans in dark rinse wash 8 petite maternity dark rinse,Apparel & Accessories > Apparel > Maternity
2524,100,Maternity Skinny Jeans in Dark Rinse Wash 00 Maternity Proper Blue Wash,Apparel & Accessories > Apparel > Maternity
2525,100,maternity denim leggings in dark indigo wash 16 maternity dark indigo wash,Apparel & Accessories > Apparel > Maternity
2526,100,Maternity Boyfriend Jeans in Pioneer Blue Wash 18 Maternity Pioneer Blue Wash,Apparel & Accessories > Apparel > Maternity
2527,100,maternity modern flare leg jeans in rinse wash 10 maternity dark rinse,Apparel & Accessories > Apparel > Maternity
2528,100,maternity modern straight leg jeans in dark rinse wash 12 maternity dark rinse,Apparel & Accessories > Apparel > Maternity
2529,100,maternity modern skinny jeans in dark rinse wash 8 maternity dark rinse,Apparel & Accessories > Apparel > Maternity
2530,100,maternity sexy boot jeans in saturated rinse wash 8 maternity saturated rinse wash,Apparel & Accessories > Apparel > Maternity
2531,100,petite maternity straight leg jeans in white 4 petite maternity white,Apparel & Accessories > Apparel > Maternity
2532,100,Maternity Skinny Jeans in Solstice Wash 8 Regular Solstice Wash,Apparel & Accessories > Apparel > Maternity
2533,100,maternity skinny ankle jeans in dark rinse wash 4 maternity twilight blue wash,Apparel & Accessories > Apparel > Maternity
2534,100,Maternity Modern Straight Leg Jeans in Venice Blue Wash 8 Maternity Venice Blue Wash,Apparel & Accessories > Apparel > Maternity
2535,100,maternity boyfriend jeans in tempt blue wash 00 maternity tempt blue wash,Apparel & Accessories > Apparel > Maternity
2536,100,maternity modern trouser leg jeans in saturated rinse wash 12 maternity saturated rinse wash,Apparel & Accessories > Apparel > Maternity
2537,100,maternity straight leg jeans in white 4 maternity white,Apparel & Accessories > Apparel > Maternity
2538,100,maternity modern flare leg jeans in rinse wash 8 maternity dark rinse,Apparel & Accessories > Apparel > Maternity
2539,100,petite maternity skinny ankle jeans in puddle blue wash 10 petite maternity puddle blue wash,Apparel & Accessories > Apparel > Maternity
2540,100,maternity cropped jeans in saturated rinse wash 6 maternity saturated rinse wash,Apparel & Accessories > Apparel > Maternity
2541,100,Petite Maternity Skinny Jeans in Dark Rinse Wash 0 Maternity Dark Rinse,Apparel & Accessories > Apparel > Maternity
2542,100,petite maternity skinny jeans in black 0 p maternity black,Apparel & Accessories > Apparel > Maternity
2543,100,maternity modern skinny jeans in dark rinse wash 4 maternity dark rinse,Apparel & Accessories > Apparel > Maternity
2544,100,maternity boyfriend jeans in dark rinse wash 6 maternity academy blue wash,Apparel & Accessories > Apparel > Maternity
2545,100,maternity skinny jeans in dark rinse wash 12 maternity proper blue wash,Apparel & Accessories > Apparel > Maternity
2546,100,maternity skinny jeans in dark rinse wash 2 maternity dark rinse,Apparel & Accessories > Apparel > Maternity
2547,100,Maternity Cropped Jeans in Residual Blue Wash 10 Maternity Residual Blue Wash,Apparel & Accessories > Apparel > Maternity
2548,100,maternity skinny jeans in solstice wash 10 maternity rich dark indigo wash,Apparel & Accessories > Apparel > Maternity
2549,100,Petite Maternity Straight Cuffed Cropped Jeans in Lagoon Blue Wash 0 P Maternity Lagoon Blue Wash,Apparel & Accessories > Apparel > Maternity
2550,100,maternity skinny jeans in dark rinse wash 8 regular dark rinse,Apparel & Accessories > Apparel > Maternity
2551,100,Petite Maternity Demi Panel Skinny Jeans in White 00 P Maternity White,Apparel & Accessories > Apparel > Maternity
2552,100,petite maternity straight leg jeans in black 2 petite maternity black,Apparel & Accessories > Apparel > Maternity
2553,100,maternity skinny ankle jeans in white 8 maternity white,Apparel & Accessories > Apparel > Maternity
2554,100,petite maternity roll panel skinny jeans in white 6 petite maternity white,Apparel & Accessories > Apparel > Maternity
2555,100,Tall maternity toothpick jean in rinse / TALL 26 / CLASSIC RINSE,Apparel & Accessories > Apparel > Maternity
2556,100,maternity pull-on toothpick jean in chalk / 27 / white,Apparel & Accessories > Apparel > Maternity
2557,100,maternity denim pull-on short in patina wash / 30 / patina wash,Apparel & Accessories > Apparel > Maternity
2558,100,maternity toothpick jean in rinse / 25 / classic rinse,Apparel & Accessories > Apparel > Maternity
2559,100,maternity pull-on toothpick jean in black / 29 / true black,Apparel & Accessories > Apparel > Maternity
2560,100,Tall maternity pull-on toothpick jean in rinse wash / TALL 32 / CLASSIC RINSE,Apparel & Accessories > Apparel > Maternity
2561,100,maternity denim pull-on short in patina wash / 31 / patina wash,Apparel & Accessories > Apparel > Maternity
2562,100,maternity toothpick jean in classic rinse / 26 / classic rinse,Apparel & Accessories > Apparel > Maternity
2563,100,maternity toothpick jean in pitch black wash / 27 / pitch black wash,Apparel & Accessories > Apparel > Maternity
2564,100,maternity pull-on toothpick jean in chalk / 31 / white,Apparel & Accessories > Apparel > Maternity
2565,100,maternity pull-on toothpick jean in black / 25 / true black,Apparel & Accessories > Apparel > Maternity
2566,100,maternity pull-on toothpick jean in chalk / 25 / white,Apparel & Accessories > Apparel > Maternity
2567,100,maternity toothpick jean in rinse / 26 / classic rinse,Apparel & Accessories > Apparel > Maternity
2568,100,tall maternity pull-on toothpick jean in rinse wash / tall 31 / classic rinse,Apparel & Accessories > Apparel > Maternity
2569,100,maternity pull-on toothpick jean in rinse wash / 29 / classic rinse,Apparel & Accessories > Apparel > Maternity
2570,100,maternity toothpick jean in classic rinse / 25 / classic rinse,Apparel & Accessories > Apparel > Maternity
2571,100,DL1961 'Nicky' Cigarette Maternity Jeans (Wooster) Wooster 27 Maternity,Apparel & Accessories > Apparel > Maternity
2572,100,Paige Denim 'Skyline' Bootcut Maternity Jeans (Mona) Mona 31 Maternity,Apparel & Accessories > Apparel > Maternity
2573,100,maternal america maternity skinny jeans classic wash medium maternity,Apparel & Accessories > Apparel > Maternity
2574,100,Paige Denim 'Jimmy Jimmy' Maternity Skinny Jeans (Tawni Destruction) Tawni Destruction 31 Maternity,Apparel & Accessories > Apparel > Maternity
2575,100,Paige Denim 'Jimmy Jimmy' Boyfriend Skinny Maternity Jeans (Rebel Destructed) Rebel Destructed 24 Maternity,Apparel & Accessories > Apparel > Maternity
2576,100,Paige Denim 'Verdugo' Maternity Jeans (Quinnley Destructed) Quinnley Destructed 27 Maternity,Apparel & Accessories > Apparel > Maternity
2577,100,Paige Denim 'Verdugo' Skinny Maternity Jeans (Black Shadow) Black Shadow 32 Maternity,Apparel & Accessories > Apparel > Maternity
2578,100,Topshop Moto 'Joni' High Rise Maternity Skinny Jeans (Aubergine) Burgundy 8 Short,Apparel & Accessories > Apparel > Maternity
2579,100,paige denim 'jimmy jimmy' maternity skinny jeans (tawni destruction) tawni destruction 33 maternity,Apparel & Accessories > Apparel > Maternity
2580,100,paige denim 'skyline' maternity skinny jeans (carson) carson 31 maternity,Apparel & Accessories > Apparel > Maternity
2581,100,Paige Denim 'Kylie' Crop Maternity Skinny Jeans (Alexis) Alexis 30 Maternity,Apparel & Accessories > Apparel > Maternity
2582,100,paige denim 'transcend - skyline' bootcut maternity jeans (mona) mona 30 maternity,Apparel & Accessories > Apparel > Maternity
2583,100,topshop moto 'joni' high rise skinny maternity jeans (black) black 6r maternity,Apparel & Accessories > Apparel > Maternity
2584,100,Paige Denim 'Skyline' Ankle Peg Skinny Maternity Jeans (Alanis) Alanis 30,Apparel & Accessories > Apparel > Maternity
2585,100,paige denim 'skyline' bootcut maternity jeans (mona) mona 26 maternity,Apparel & Accessories > Apparel > Maternity
2586,100,Paige Denim 'Skyline' Ankle Peg Maternity Jeans with Side Gussets (Ringo) Ringo Blue 30 Maternity,Apparel & Accessories > Apparel > Maternity
2587,100,Paige Denim 'Transcend - Verdugo' Skinny Maternity Jeans (Armstrong) Armstrong 28 Maternity,Apparel & Accessories > Apparel > Maternity
2588,100,Paige Denim 'Skyline' Ankle Peg Maternity Jeans with Side Gussets (Ringo) Ringo Blue 32 Maternity,Apparel & Accessories > Apparel > Maternity
2589,100,paige denim 'skyline' maternity ankle skinny stretch jeans (optic white) optic white 33 maternity,Apparel & Accessories > Apparel > Maternity
2590,100,Paige Denim 'Jimmy Jimmy' Boyfriend Skinny Maternity Jeans (Rebel Destructed) Rebel Destructed 26 Maternity,Apparel & Accessories > Apparel > Maternity
2591,100,paige denim 'transcend - verdugo' skinny maternity jeans (black shadow) black shadow 32 maternity,Apparel & Accessories > Apparel > Maternity
2592,100,Paige Denim 'Verdugo' Maternity Ankle Jeans with Side Gussets (Mae) Mae Blue 30 Maternity,Apparel & Accessories > Apparel > Maternity
2593,100,paige denim 'jimmy jimmy' skinny boyfriend maternity jeans (tawni destruction) tawni destruction 26,Apparel & Accessories > Apparel > Maternity
2594,100,Paige Denim 'Verdugo' Maternity Ultra Skinny Jeans (Twilight) Twilight 33 Maternity,Apparel & Accessories > Apparel > Maternity
2595,100,paige denim 'transcend - verdugo' maternity jeans (tonal mona) tonal mona 28 maternity,Apparel & Accessories > Apparel > Maternity
2596,100,Modern Eternity Skinny Maternity Jeans Dark Blue Wash 26 Maternity,Apparel & Accessories > Apparel > Maternity
2597,100,DL1961 Maternity Amanda Jeans - Wooster-24,Apparel & Accessories > Apparel > Maternity
2598,100,paige premium denim skyline bootcut maternity jean paris 26,Apparel & Accessories > Apparel > Maternity
2599,100,James Jeans Skinny Maternity Jean Atlas 30,Apparel & Accessories > Apparel > Maternity
2600,100,James Jeans Twiggy Maternity Skinny Jean Ext Black / 27,Apparel & Accessories > Apparel > Maternity
2601,100,Paige Premium Denim Verdugo Elastic Jean Ankle Maternity Jean LEX 29,Apparel & Accessories > Apparel > Maternity
2602,100,Paige Premium Denim Paige Premium Denim Kylie Crop Maternity Jean ALEXIS 28,Apparel & Accessories > Apparel > Maternity
2603,100,paige premium denim kylie crop maternity jean alexis 27,Apparel & Accessories > Apparel > Maternity
2604,100,James Jeans James Jeans Skinny Maternity Jean Eiffel 28,Apparel & Accessories > Apparel > Maternity
2605,100,james jeans ankle skinny maternity jean atlas 30,Apparel & Accessories > Apparel > Maternity
2606,100,james jeans maternity reboot skinny bootcut jeans atlas 28,Apparel & Accessories > Apparel > Maternity
2607,100,james jeans maternity reboot skinny bootcut jeans atlas 27,Apparel & Accessories > Apparel > Maternity
2608,100,j brand straight leg maternity jean heritage 25,Apparel & Accessories > Apparel > Maternity
2609,100,james jeans maternity boyfriend maternity jean calypso clean 28,Apparel & Accessories > Apparel > Maternity
2610,100,james jeans maternity skinny maternity jean white 26,Apparel & Accessories > Apparel > Maternity
2611,100,james jeans maternity twiggy velveteen leggings smoked diamond 31,Apparel & Accessories > Apparel > Maternity
2612,100,james jeans maternity skinny maternity jean atlas 27,Apparel & Accessories > Apparel > Maternity
2613,100,"Citizens of Humanity Maternity Racer Skinny Jeans, Star Struck, 25",Apparel & Accessories > Apparel > Maternity
2614,100,"James Jeans Twiggy Maternity Jeans, Oil Slick, 25",Apparel & Accessories > Apparel > Maternity
2615,100,"dl1961 angel maternity ankle jeans, riker, 28",Apparel & Accessories > Apparel > Maternity
2616,100,"Citizens of Humanity Drew Maternity Flare Jeans, Summer Of Love, 25",Apparel & Accessories > Apparel > Maternity
2617,100,"Citizens of Humanity Avedon Maternity Jeans, Sea Isle, 29",Apparel & Accessories > Apparel > Maternity
2618,100,"J Brand 3401 Mama J Super Skinny Maternity Jeans, Blue Bird, 32",Apparel & Accessories > Apparel > Maternity
2619,100,"J Brand 3401 Maternity Legging Jeans, Pitch, 24",Apparel & Accessories > Apparel > Maternity
2620,100,racer ultra maternity skinny jeans,Apparel & Accessories > Apparel > Maternity
2621,100,Avedon Coated Maternity Jeans,Apparel & Accessories > Apparel > Maternity
2622,100,"james jeans twiggy maternity skinny jeans, black jeather, 27",Apparel & Accessories > Apparel > Maternity
2623,100,"DL1961 Florence Maternity Skinny Jeans, Thorton, 26",Apparel & Accessories > Apparel > Maternity
2624,100,"Citizens of Humanity Avendon Ultra Skinny Maternity Jeans, Byron Bay, 25",Apparel & Accessories > Apparel > Maternity
2625,100,"j brand 3411 maternity skinny jeans, ink, 26",Apparel & Accessories > Apparel > Maternity
2626,100,"DL1961 Emma Maternity Jeans, Heath, 27",Apparel & Accessories > Apparel > Maternity
2627,100,"Paige Denim Skyline Bootcut Panel Maternity Jean, Carson, 27",Apparel & Accessories > Apparel > Maternity
2628,100,Skinny Denim Maternity Jeggings MEDIUM N/A BLACKS5,Apparel & Accessories > Apparel > Maternity
2629,100,Dark Wash Bootcut Jeans - Maternity M N/A FLAPEAGLEDK,Apparel & Accessories > Apparel > Maternity
2630,100,j brand jeans - 3401 maternity legging in starless 29 starless,Apparel & Accessories > Apparel > Maternity
2631,100,paige maternity jeans - verdugo ultra skinny in nottingham 27 nottingham,Apparel & Accessories > Apparel > Maternity
2632,100,j brand jeans - 3401 maternity legging in starless 30 starless,Apparel & Accessories > Apparel > Maternity
2633,100,Paige Denim Verdugo Ankle Maternity Jeans in Mae 31 Mae,Apparel & Accessories > Apparel > Maternity
2634,100,paige maternity jeans - union skyline ankle peg in carson 31 carson,Apparel & Accessories > Apparel > Maternity
2635,100,James Jeans - Twiggy Maternity Legging in Dark Indigo 26 Dark Indigo,Apparel & Accessories > Apparel > Maternity
2636,100,DL1961 Maternity Jeans - Angel Ankle Cigarette in Zeppelin 26 Zeppelin,Apparel & Accessories > Apparel > Maternity
2637,100,Paige Maternity Jeans - Verdugo Skinny in Reina 30 Reina,Apparel & Accessories > Apparel > Maternity
2638,100,Paige Denim Verdugo Ankle Maternity Jeans in Mae 28 Mae,Apparel & Accessories > Apparel > Maternity
2639,100,paige maternity jeans - union skyline ankle peg in carson 29 carson,Apparel & Accessories > Apparel > Maternity
2640,100,Paige Maternity Jeans - Verdugo Ultra Skinny in Black Shadow 24 Black Shadow,Apparel & Accessories > Apparel > Maternity
2641,100,dl1961 maternity jeans - kate straight leg in liberty 28 liberty,Apparel & Accessories > Apparel > Maternity
2642,100,Maternity Skinny Jeans in Solstice Wash 12 Maternity Solstice Wash,Apparel & Accessories > Apparel > Maternity
2643,100,maternity cropped jeans in dark rinse wash with demi panel waist 0 maternity dark rinse,Apparel & Accessories > Apparel > Maternity
2644,100,Petite Maternity Demi Panel Skinny Jeans in Dark Rinse Wash 8 Petite Maternity Dark Rinse,Apparel & Accessories > Apparel > Maternity
2645,100,maternity roll panel skinny jeans in white 0 maternity white,Apparel & Accessories > Apparel > Maternity
2646,100,maternity modern boot cut jeans in white 10 maternity white,Apparel & Accessories > Apparel > Maternity
2647,100,maternity roll panel skinny jeans in dark rinse wash 0 maternity dark rinse,Apparel & Accessories > Apparel > Maternity
2648,100,Petite Maternity Skinny Jeans in Solstice Wash 4 Petite Maternity Rich Dark Indigo Wash,Apparel & Accessories > Apparel > Maternity
2649,100,maternity skinny jeans in spectral blue 12 maternity spectral blue wash,Apparel & Accessories > Apparel > Maternity
2650,100,Maternity Cropped Jeans in Dark Rinse Wash with Demi Panel Waist 2 Maternity Dark Rinse,Apparel & Accessories > Apparel > Maternity
2651,100,Maternity Skinny Jeans in Ornate Blue 4 Maternity Ornate Blue Wash,Apparel & Accessories > Apparel > Maternity
2652,100,Petite Maternity Demi Panel Skinny Jeans in Dark Rinse Wash 6 Petite Maternity Dark Rinse,Apparel & Accessories > Apparel > Maternity
2653,100,maternity boyfriend jeans in supreme blue wash 2 maternity supreme blue wash,Apparel & Accessories > Apparel > Maternity
2654,100,petite maternity denim leggings in blue rinse wash 6 petite maternity glamour blue wash,Apparel & Accessories > Apparel > Maternity
2655,100,maternity denim leggings in vivid mid indigo wash 4 regular vivid mid indigo wash,Apparel & Accessories > Apparel > Maternity
2656,100,maternity straight leg jeans in dark rinse wash 10 maternity dark rinse,Apparel & Accessories > Apparel > Maternity
2657,100,maternity skinny jeans in spectral blue 10 maternity spectral blue wash,Apparel & Accessories > Apparel > Maternity
2658,100,maternity cropped jeans in dark rinse wash with demi panel waist 12 maternity dark rinse,Apparel & Accessories > Apparel > Maternity
2659,100,petite maternity straight cuffed cropped jeans in lagoon blue wash 2 petite maternity lagoon blue wash,Apparel & Accessories > Apparel > Maternity
2660,100,maternity kick cropped jeans in dark rinse wash 12 maternity dark rinse,Apparel & Accessories > Apparel > Maternity
2661,100,maternity straight leg jeans in black 14 maternity black,Apparel & Accessories > Apparel > Maternity
2662,100,petite maternity skinny jeans in black 8 petite maternity black,Apparel & Accessories > Apparel > Maternity
2663,100,maternity straight cuffed cropped jeans in offshore blue wash 10 maternity offshore blue wash,Apparel & Accessories > Apparel > Maternity
2664,100,maternity skinny jeans in black 16 maternity black,Apparel & Accessories > Apparel > Maternity
2665,100,Maternity Sexy Boot Jeans in Ornate Blue 14 Maternity Ornate Blue Wash,Apparel & Accessories > Apparel > Maternity
2666,100,Maternity Super Skinny Moto Jeans in Shadow Grey 14 Maternity Shadow Grey Wash,Apparel & Accessories > Apparel > Maternity
2667,100,maternity straight leg jeans in venice blue wash 6 maternity venice blue wash,Apparel & Accessories > Apparel > Maternity
2668,100,Petite Maternity Modern Skinny Jeans in Dark Rinse Wash 0 Maternity Dark Rinse,Apparel & Accessories > Apparel > Maternity
2669,100,maternity denim leggings in blue rinse wash 16 maternity glamour blue wash,Apparel & Accessories > Apparel > Maternity
2670,100,Maternity Skinny Ankle Jeans in Puddle Blue Wash 0 Maternity Puddle Blue Wash,Apparel & Accessories > Apparel > Maternity
2671,100,Petite Maternity Skinny Jeans in Dark Rinse Wash 10 Maternity Dark Rinse,Apparel & Accessories > Apparel > Maternity
2672,100,Maternity Kick Cropped Jeans in Dark Rinse Wash 4 Maternity Dark Rinse,Apparel & Accessories > Apparel > Maternity
2673,100,petite maternity boyfriend jeans in pioneer blue wash 8 petite maternity pioneer blue wash,Apparel & Accessories > Apparel > Maternity
2674,100,petite maternity kick cropped jeans in dark rinse wash 2 petite maternity dark rinse,Apparel & Accessories > Apparel > Maternity
2675,100,maternity super skinny moto jeans in shadow grey 8 maternity shadow grey wash,Apparel & Accessories > Apparel > Maternity
2676,100,Petite Maternity Roll Panel Skinny Jeans in Dark Rinse Wash 0 P Maternity Dark Rinse,Apparel & Accessories > Apparel > Maternity
2677,100,Maternity Sexy Boot Jeans in Black 4 Maternity Black,Apparel & Accessories > Apparel > Maternity
2678,100,maternity skinny jeans in white 00 maternity white,Apparel & Accessories > Apparel > Maternity
2679,100,maternity super skinny jeans in black 8 maternity black,Apparel & Accessories > Apparel > Maternity
2680,100,maternity demi panel skinny jeans in dark rinse wash 0 maternity dark rinse,Apparel & Accessories > Apparel > Maternity
2681,100,maternity boyfriend jeans in mid blue wash small maternity jardin blue wash,Apparel & Accessories > Apparel > Maternity
2682,100,petite maternity boot cut jeans in black 10 petite maternity black,Apparel & Accessories > Apparel > Maternity
2683,100,maternity modern skinny jeans in dark rinse wash 6 maternity dark rinse,Apparel & Accessories > Apparel > Maternity
2684,100,"j brand 3411 maternity skinny jeans, ink, 31",Apparel & Accessories > Apparel > Maternity
2685,100,"dl1961 amanda maternity skinny jeans, flatiron, 26",Apparel & Accessories > Apparel > Maternity
2686,100,"dl1961 angel maternity ankle jeans, onyx, 26",Apparel & Accessories > Apparel > Maternity
2687,100,"James Jeans Twiggy Maternity Under Belly Pull On Jeans, Blue Velvet, 28",Apparel & Accessories > Apparel > Maternity
2688,100,"Paige Denim Verdugo Ultra Skinny Maternity Jeans, Fountain, 26",Apparel & Accessories > Apparel > Maternity
2689,100,"paige denim skyline ankle peg maternity jeans, optic white, 25",Apparel & Accessories > Apparel > Maternity
2690,100,"DL1961 Florence Maternity Skinny Jeans, Thorton, 28",Apparel & Accessories > Apparel > Maternity
