,category_id,description,category_path
1805,100,Paige Denim 'Transcend - Verdugo' Maternity Jeans (Tonal Mona) Tonal Mona Maternity 28,Apparel & Accessories > Apparel > Maternity
1806,100,citizens of humanity 'kelly' maternity bootcut stretch jeans (new pacific blue) new pacific blue 32 maternity,Apparel & Accessories > Apparel > Maternity
1807,100,Paige Denim 'Skyline' Maternity Bootcut Jeans (Twilight) Carson 30 Maternity,Apparel & Accessories > Apparel > Maternity
1808,100,T.B.D. DEN: UNION SKYLINE SKINNY Carson Maternity 26,Apparel & Accessories > Apparel > Maternity
1809,100,Paige Denim 'Verdugo' Skinny Maternity Jeans (Black Shadow) Black Shadow 31 Maternity,Apparel & Accessories > Apparel > Maternity
1810,100,Paige Denim 'Jimmy Jimmy' Straight Leg Maternity Jeans (Blue) Blue 28,Apparel & Accessories > Apparel > Maternity
1811,100,paige denim 'skyline' maternity skinny jeans (carson) carson 29 maternity,Apparel & Accessories > Apparel > Maternity
1812,100,Paige Denim 'Jimmy Jimmy' Skinny Boyfriend Maternity Jeans (Penelope) Penelope 24 Maternity,Apparel & Accessories > Apparel > Maternity
1813,100,Paige Denim 'Union Skyline' Skinny Leg Maternity Jeans (Twilight) Twilight 32 Maternity,Apparel & Accessories > Apparel > Maternity
1814,100,Paige Denim 'JJ' Maternity Boyfriend Jeans with Side Gussets (Rebecca) Rebecca Blue 27 Maternity,Apparel & Accessories > Apparel > Maternity
1815,100,paige denim 'skyline' maternity skinny jeans (carson) carson 25 maternity,Apparel & Accessories > Apparel > Maternity
1816,100,paige denim 'verdugo' maternity ultra skinny jeans (fountain) fountain 30 maternity,Apparel & Accessories > Apparel > Maternity
1817,100,james jeans skinny maternity jean azure 30,Apparel & Accessories > Apparel > Maternity
1818,100,Madeleine Maternity Indigo Wash Skinny Jean INDIGO / 28,Apparel & Accessories > Apparel > Maternity
1819,100,madeleine maternity black vintage wash skinny jean black vintage 27,Apparel & Accessories > Apparel > Maternity
1820,100,James Jeans Ankle Skinny Maternity Jean White 29,Apparel & Accessories > Apparel > Maternity
1821,100,Paige Premium Denim Verdugo Skinny Maternity Jean REINA 30,Apparel & Accessories > Apparel > Maternity
1822,100,paige premium denim kylie crop maternity jean alexis 29,Apparel & Accessories > Apparel > Maternity
1823,100,paige premium denim skyline bootcut maternity jean paris 31,Apparel & Accessories > Apparel > Maternity
1824,100,James Jeans Skinny Deconstructed Maternity Jean Black Destructed 27,Apparel & Accessories > Apparel > Maternity
1825,100,James Jeans Boyfriend Maternity Jean Atlas 27,Apparel & Accessories > Apparel > Maternity
1826,100,James Jeans Boyfriend Maternity Jean Atlas 29,Apparel & Accessories > Apparel > Maternity
1827,100,James Jeans Ankle Skinny Maternity Jean Atlas 27,Apparel & Accessories > Apparel > Maternity
1828,100,Paige Premium Denim Skyline Straight Maternity Jean TWILIGHT 28,Apparel & Accessories > Apparel > Maternity
1829,100,Paige Premium Denim Skyline Bootcut Maternity Jean ALEXIS 25,Apparel & Accessories > Apparel > Maternity
1830,100,james jeans boyfriend maternity jean sonar 27,Apparel & Accessories > Apparel > Maternity
1831,100,James Jeans Skinny Azure Maternity Jean Azure 30,Apparel & Accessories > Apparel > Maternity
1832,100,james jeans maternity boyfriend maternity jean calypso clean 29,Apparel & Accessories > Apparel > Maternity
1833,100,james jeans maternity skinny maternity jean white 30,Apparel & Accessories > Apparel > Maternity
1834,100,james jeans maternity straight external maternity jeans shadow blue,Apparel & Accessories > Apparel > Maternity
1835,100,madeleine maternity destroyed skinny denim pant vintage 29,Apparel & Accessories > Apparel > Maternity
1836,100,Phoebe Skinny Maternity Jeans 28 (4-6) SANTORINI,Apparel & Accessories > Apparel > Maternity
1837,100,Paige: Maternity Union Jegging in Dusk Dusk 25 30,Apparel & Accessories > Apparel > Maternity
1838,100,"citizens of humanity racer ultra maternity skinny jeans, distressed weekend, 27",Apparel & Accessories > Apparel > Maternity
1839,100,"Citizens of Humanity Emerson Maternity Boyfriend Jeans, Madera Light, 28",Apparel & Accessories > Apparel > Maternity
1840,100,"Paige Denim Verdugo Ultra Skinny Maternity Jeans, Black Shadow, 25",Apparel & Accessories > Apparel > Maternity
1841,100,"j brand 34112 maternity rail jeans, blanc, 25",Apparel & Accessories > Apparel > Maternity
1842,100,"DL1961 Florence Maternity Skinny Jeans, Thorton, 29",Apparel & Accessories > Apparel > Maternity
1843,100,"Citizens of Humanity Kelly Boot Cut Maternity Jeans, Pacific, 28",Apparel & Accessories > Apparel > Maternity
1844,100,"Citizens of Humanity Racer Maternity Jeans, Santorini, 30",Apparel & Accessories > Apparel > Maternity
1845,100,"paige denim transcend verdugo ultra skinny maternity jeans, nottingham, 26",Apparel & Accessories > Apparel > Maternity
1846,100,"DL1961 Riley Maternity Boyfriend Jeans, Chambers, 28",Apparel & Accessories > Apparel > Maternity
1847,100,Jimmy Jimmy Maternity Skinny jeans,Apparel & Accessories > Apparel > Maternity
1848,100,"citizens of humanity avedon maternity jeans, sea isle, 25",Apparel & Accessories > Apparel > Maternity
1849,100,"Paige Denim Verdugo Ultra Skinny Maternity Jeans, Fountain, 31",Apparel & Accessories > Apparel > Maternity
1850,100,Medium Wash & Black Over-Belly Maternity Skinny Jeans - Plus Too 3X,Apparel & Accessories > Apparel > Maternity
1851,100,PajamaJeans - Boot Cut Indigo Maternity,Apparel & Accessories > Apparel > Maternity
1852,100,Maternity Bootcut Denim Jeans Dark Blue Wash 6,Apparel & Accessories > Apparel > Maternity
1853,100,medium wash mid-belly maternity skinny jeans l,Apparel & Accessories > Apparel > Maternity
1854,100,Rinse Over-Belly Maternity Skinny Jeans - Plus Too 1X,Apparel & Accessories > Apparel > Maternity
1855,100,Maternity Bootcut Denim Jeans Dark Blue Wash 14 Short,Apparel & Accessories > Apparel > Maternity
1856,100,Maternity Bootcut Denim Jeans Dark Blue Wash 12 Short,Apparel & Accessories > Apparel > Maternity
1857,100,maternity inset under the belly straight leg jean - medium wash s - liz lange® for target,Apparel & Accessories > Apparel > Maternity
1858,100,Liz Lange for Target Maternity Over-the-Belly Bootcut Denim Jeans - Blue Wash 4L,Apparel & Accessories > Apparel > Maternity
1859,100,tala maternity overbelly flap-pocket bootcut jeans,Apparel & Accessories > Apparel > Maternity
1860,100,tala maternity overbelly patch pocket skinny jeans - plus,Apparel & Accessories > Apparel > Maternity
1861,100,Maternity Overbelly Roll Cuff Skinny Jeans - Plus Medium Wash 3x,Apparel & Accessories > Apparel > Maternity
1862,100,jessica simpson maternity petite bootcut jeans dark wash pxl,Apparel & Accessories > Apparel > Maternity
1863,100,"A Pea In The Pod Jeans Maternity Secret Fit Belly Skinny Jeans, White Wash",Apparel & Accessories > Apparel > Maternity
1864,100,"Fade To Blue Maternity Skinny Jeans, Dark Wash Dark Wash M",Apparel & Accessories > Apparel > Maternity
1865,100,"AG Jeans Maternity Jeans, Stella Dark Wash Stella Dark Wash 25",Apparel & Accessories > Apparel > Maternity
1866,100,"a pea in the pod maternity skinny jeans, dark blue wash dark wash 29",Apparel & Accessories > Apparel > Maternity
1867,100,motherhood maternity maternity cuffed straight-leg jeans indigo denim s,Apparel & Accessories > Apparel > Maternity
1868,100,"Indigo Blue Maternity Straight-Leg Jeans, Dusted Medium Wash Dusted Medium Wash M",Apparel & Accessories > Apparel > Maternity
1869,100,"jessica simpson maternity skinny maternity jeans, dark wash dark m",Apparel & Accessories > Apparel > Maternity
1870,100,"Luxe Essentials Maternity Skinny Jeans, Dark Wash Rinse Dark Wash Rinse 28",Apparel & Accessories > Apparel > Maternity
1871,100,maternity low-panel slim boo dark wash 2 regul,Apparel & Accessories > Apparel > Maternity
1872,100,Maternity Pull-On Jeggings Rinse 2,Apparel & Accessories > Apparel > Maternity
1873,100,maternity full-panel jeans medium wash 12 long,Apparel & Accessories > Apparel > Maternity
1874,100,maternity low-panel boyfrien medium wash 6,Apparel & Accessories > Apparel > Maternity
1875,100,maternity full-panel boot-cu dark wash 4 regul,Apparel & Accessories > Apparel > Maternity
1876,100,Maternity Smooth-Panel Every In The Navy 14 Regu,Apparel & Accessories > Apparel > Maternity
1877,100,maternity low-panel slim boo dark wash 2 long,Apparel & Accessories > Apparel > Maternity
1878,100,maternity full-panel skinny dark wash 12 regu,Apparel & Accessories > Apparel > Maternity
1879,100,maternity low-panel skinny j dark wash 8,Apparel & Accessories > Apparel > Maternity
1880,100,maternity low-panel cuffed d dark wash 12,Apparel & Accessories > Apparel > Maternity
1881,100,maternity full-panel jeans medium wash 8 short,Apparel & Accessories > Apparel > Maternity
1882,100,maternity full-panel denim b medium wash 8,Apparel & Accessories > Apparel > Maternity
1883,100,maternity low-panel slim boo dark wash 10 long,Apparel & Accessories > Apparel > Maternity
1884,100,maternity full-panel jeans medium wash 8 long,Apparel & Accessories > Apparel > Maternity
1885,100,maternity side-panel rocksta rinse 16 regu,Apparel & Accessories > Apparel > Maternity
1886,100,maternity full-panel boot-cu medium wash 2 regul,Apparel & Accessories > Apparel > Maternity
1887,100,maternity full-panel denim s dark wash 4,Apparel & Accessories > Apparel > Maternity
1888,100,maternity rockstar side-pane dark wash 14,Apparel & Accessories > Apparel > Maternity
1889,100,maternity low-panel jeggings light wash 14 regu,Apparel & Accessories > Apparel > Maternity
1890,100,Maternity Full-Panel The Roc Rinse 10 Regu,Apparel & Accessories > Apparel > Maternity
1891,100,maternity full-panel jeans medium wash 4 regul,Apparel & Accessories > Apparel > Maternity
1892,100,maternity low-panel jeggings light wash 16 regu,Apparel & Accessories > Apparel > Maternity
1893,100,maternity full-panel cuffed medium wash 8,Apparel & Accessories > Apparel > Maternity
1894,100,maternity demi-panel the roc medium wash 8,Apparel & Accessories > Apparel > Maternity
1895,100,maternity smooth-panel every black jack 4 short,Apparel & Accessories > Apparel > Maternity
1896,100,maternity smooth-panel every black jack 12 regu,Apparel & Accessories > Apparel > Maternity
1897,100,maternity side-panel cuffed medium wash 10 regu,Apparel & Accessories > Apparel > Maternity
1898,100,maternity full-panel denim b medium wash 18,Apparel & Accessories > Apparel > Maternity
1899,100,Maternity Full-Panel Flare J Medium Wash 16,Apparel & Accessories > Apparel > Maternity
1900,100,maternity full-panel/real-wa medium wash 18 regu,Apparel & Accessories > Apparel > Maternity
1901,100,maternity full-panel boot-cu dark wash 16 regu,Apparel & Accessories > Apparel > Maternity
1902,100,maternity demi-panel zip-leg alpine tundra 2,Apparel & Accessories > Apparel > Maternity
1903,100,maternity full-panel boot-cu medium wash 1 regul,Apparel & Accessories > Apparel > Maternity
1904,100,maternity side-panel cuffed medium wash 4 regul,Apparel & Accessories > Apparel > Maternity
1905,100,Maternity Full-Panel Flare J Medium Wash 14,Apparel & Accessories > Apparel > Maternity
1906,100,maternity full-panel jeans medium wash 6 regul,Apparel & Accessories > Apparel > Maternity
1907,100,maternity low-panel skinny j dark wash 12,Apparel & Accessories > Apparel > Maternity
1908,100,maternity side-panel rocksta light wash 2 regul,Apparel & Accessories > Apparel > Maternity
1909,100,maternity low-panel slim boo dark wash 4 regul,Apparel & Accessories > Apparel > Maternity
1910,100,maternity low panel cropped dark wash 4 regul,Apparel & Accessories > Apparel > Maternity
1911,100,maternity smooth-panel denim rinse 2 regul,Apparel & Accessories > Apparel > Maternity
1912,100,maternity low-panel cuffed d medium wash 6,Apparel & Accessories > Apparel > Maternity
1913,100,Maternity Side-Panel Denim S Bright White 18,Apparel & Accessories > Apparel > Maternity
1914,100,tall maternity toothpick jean in pitch black wash / tall 31 / pitch black wash,Apparel & Accessories > Apparel > Maternity
1915,100,Petite maternity toothpick jean in black / PETITE 24 / TRUE BLACK,Apparel & Accessories > Apparel > Maternity
1916,100,maternity pull-on toothpick jean in chalk / 28 / white,Apparel & Accessories > Apparel > Maternity
1917,100,maternity matchstick jean in black / 31 / pitch black wash,Apparel & Accessories > Apparel > Maternity
1918,100,maternity toothpick jean in classic rinse / 31 / classic rinse,Apparel & Accessories > Apparel > Maternity
1919,100,maternity toothpick jean in black / 24 / true black,Apparel & Accessories > Apparel > Maternity
1920,100,tall maternity toothpick jean in classic rinse / tall 28 / classic rinse,Apparel & Accessories > Apparel > Maternity
1921,100,stretch maternity matchstick jean in dark rinse / 29 / classic rinse,Apparel & Accessories > Apparel > Maternity
1922,100,tall maternity pull-on toothpick jean in rinse wash / tall 28 / classic rinse,Apparel & Accessories > Apparel > Maternity
1923,100,tall stretch maternity matchstick jean in pitch black wash / tall 30 / pitch black wash,Apparel & Accessories > Apparel > Maternity
1924,100,26 J Brand Maternity Skinny Jean nirvana blue,Apparel & Accessories > Apparel > Maternity
1925,100,Joe's Jeans Provocateur Petite Secret Fit Belly(r) 5 Pocket Boot Cut Maternity Jeans,Apparel & Accessories > Apparel > Maternity
1926,100,31 J Brand Maternity Skinny Jean nirvana blue,Apparel & Accessories > Apparel > Maternity
1927,100,ag jeans stilt secret fit belly(r) signature pocket slim leg maternity jeans,Apparel & Accessories > Apparel > Maternity
1928,100,dark wash skinny capri maternity jeans m,Apparel & Accessories > Apparel > Maternity
1929,100,motherhood indigo blue secret fit bellyr cuffed maternity crop jeans,Apparel & Accessories > Apparel > Maternity
1930,100,31 James Jeans Maternity Skinny External Maternity Jeans jewel blue,Apparel & Accessories > Apparel > Maternity
1931,100,Liz Lange for Target Maternity Under-the-Belly Bootcut Denim Jeans - Blue Wash 16,Apparel & Accessories > Apparel > Maternity
1932,100,maternity over the belly distressed ankle skinny jean - medium wash l - liz lange® for target,Apparel & Accessories > Apparel > Maternity
1933,100,Maternity Bootcut Denim Jeans Dark Blue Wash 4 Long,Apparel & Accessories > Apparel > Maternity
1934,100,maternity inset under the belly straight leg jean - medium wash xl - liz lange® for target,Apparel & Accessories > Apparel > Maternity
1935,100,Maternity Bootcut Denim Jeans Dark Blue Wash 6 Long,Apparel & Accessories > Apparel > Maternity
1936,100,oh mamma maternity demipanel super soft denim capris,Apparel & Accessories > Apparel > Maternity
1937,100,denim diva maternity full panel bling loop embellished pocket bootcut jeans,Apparel & Accessories > Apparel > Maternity
1938,100,paris blues maternity full panel rolled cuff lift love skinny jeans,Apparel & Accessories > Apparel > Maternity
1939,100,"thyme maternity skinny jean with whiskering, medium no color medium",Apparel & Accessories > Apparel > Maternity
1940,100,Tala Maternity Overbelly Patch Pocket Skinny Jeans Light Denim Medium,Apparel & Accessories > Apparel > Maternity
1941,100,Maternity Overbelly Bootcut Jeans - Plus Medium Wash 2x,Apparel & Accessories > Apparel > Maternity
1942,100,Maternity Overbelly Bootcut Jeans Medium Vintage Small,Apparel & Accessories > Apparel > Maternity
1943,100,Maternity Overbelly Bootcut Jeans - Plus Medium Wash 1x,Apparel & Accessories > Apparel > Maternity
1944,100,tala maternity overbelly super-soft acid-washed skinny jeans - plus,Apparel & Accessories > Apparel > Maternity
1945,100,maternity rolled-cuff stretch denim skinny jeans,Apparel & Accessories > Apparel > Maternity
1946,100,Tala Maternity Overbelly Stitched Skinny Jeans - Plus,Apparel & Accessories > Apparel > Maternity
1947,100,tala maternity patch pocket black skinny jeans,Apparel & Accessories > Apparel > Maternity
1948,100,maternity overbelly roll cuff skinny jeans - plus medium wash 1x,Apparel & Accessories > Apparel > Maternity
1949,100,"Motherhood Maternity Destructed Cropped Jeans, Light Wash Light Wash M",Apparel & Accessories > Apparel > Maternity
1950,100,Motherhood Maternity Plus Size Bootcut Jeans Dark 1X,Apparel & Accessories > Apparel > Maternity
1951,100,"Jessica Simpson Maternity Skinny Maternity Jeans, Dark Wash Dark S",Apparel & Accessories > Apparel > Maternity
1952,100,"jessica simpson maternity skinny maternity jeans, dark wash dark wash s",Apparel & Accessories > Apparel > Maternity
1953,100,"Indigo Rein Maternity Secret Fit Belly Bootcut Jeans, Dark Wash Rinse Wash S",Apparel & Accessories > Apparel > Maternity
1954,100,"jessica simpson maternity distressed skinny jeans, light wash light wash l",Apparel & Accessories > Apparel > Maternity
1955,100,"A Pea In The Pod Jeans Maternity Secret Fit Belly Skinny Jeans, White Wash White 29",Apparel & Accessories > Apparel > Maternity
1956,100,"Motherhood Maternity Distressed Cropped Jeans, Light Wash Light Wash M",Apparel & Accessories > Apparel > Maternity
1957,100,maternity elastic-waist jegg stretch rinse 18,Apparel & Accessories > Apparel > Maternity
1958,100,maternity full-panel the roc dark wash 10,Apparel & Accessories > Apparel > Maternity
1959,100,maternity full-panel twill s black 10 regu,Apparel & Accessories > Apparel > Maternity
1960,100,maternity smooth-panel every black jack 18 regu,Apparel & Accessories > Apparel > Maternity
1961,100,maternity smooth-panel every black jack 2 regul,Apparel & Accessories > Apparel > Maternity
1962,100,maternity the rockstar full- dark wash 6,Apparel & Accessories > Apparel > Maternity
1963,100,maternity full-panel/real-wa medium wash 6 regul,Apparel & Accessories > Apparel > Maternity
1964,100,maternity side-panel rocksta rinse 12 shor,Apparel & Accessories > Apparel > Maternity
1965,100,maternity full-panel boot-cu dark wash 2 long,Apparel & Accessories > Apparel > Maternity
1966,100,maternity side-panel rocksta rinse 18 long,Apparel & Accessories > Apparel > Maternity
1967,100,maternity full-panel/real-wa medium wash 2 regul,Apparel & Accessories > Apparel > Maternity
1968,100,maternity full-panel boot-cu medium wash 18 shor,Apparel & Accessories > Apparel > Maternity
1969,100,maternity full-panel jeans medium wash 18 regu,Apparel & Accessories > Apparel > Maternity
1970,100,maternity full-panel the roc dark wash 14,Apparel & Accessories > Apparel > Maternity
1971,100,maternity the rockstar full- dark wash 6 regul,Apparel & Accessories > Apparel > Maternity
1972,100,maternity full-panel jeans medium wash 10 long,Apparel & Accessories > Apparel > Maternity
1973,100,maternity full-panel skinny dark wash 8 regul,Apparel & Accessories > Apparel > Maternity
1974,100,maternity side-panel rocksta rinse 10 regu,Apparel & Accessories > Apparel > Maternity
1975,100,maternity smooth-panel denim rinse 18 regu,Apparel & Accessories > Apparel > Maternity
1976,100,maternity full-panel boot-cu medium wash 16 shor,Apparel & Accessories > Apparel > Maternity
1977,100,maternity side-panel rocksta rinse 6 short,Apparel & Accessories > Apparel > Maternity
1978,100,maternity side-panel rocksta medium wash 4 regul,Apparel & Accessories > Apparel > Maternity
1979,100,maternity demi-panel cuffed medium wash 6,Apparel & Accessories > Apparel > Maternity
1980,100,maternity low-panel skinny j bright white 18,Apparel & Accessories > Apparel > Maternity
1981,100,maternity full-panel the roc rinse 12 shor,Apparel & Accessories > Apparel > Maternity
1982,100,maternity full-panel cuffed medium wash 10,Apparel & Accessories > Apparel > Maternity
1983,100,Maternity The Rockstar Full- Black Jack 14,Apparel & Accessories > Apparel > Maternity
1984,100,maternity full-panel flare-l medium wash 10 regu,Apparel & Accessories > Apparel > Maternity
1985,100,maternity woven-waist boot-c dark wash 4 long,Apparel & Accessories > Apparel > Maternity
1986,100,maternity side-panel cuffed medium wash 18,Apparel & Accessories > Apparel > Maternity
1987,100,maternity low-panel cuffed d medium wash 8,Apparel & Accessories > Apparel > Maternity
1988,100,maternity full-panel jeans medium wash 14 shor,Apparel & Accessories > Apparel > Maternity
1989,100,maternity side-panel rocksta light wash 8 regul,Apparel & Accessories > Apparel > Maternity
1990,100,maternity woven-waist boot-c dark wash 10 shor,Apparel & Accessories > Apparel > Maternity
1991,100,maternity the rockstar denim dark wash xxl,Apparel & Accessories > Apparel > Maternity
1992,100,maternity full-panel skinny dark wash 6 long,Apparel & Accessories > Apparel > Maternity
1993,100,maternity full-panel cuffed medium wash 12,Apparel & Accessories > Apparel > Maternity
1994,100,maternity side-panel cuffed dark wash 14 regu,Apparel & Accessories > Apparel > Maternity
1995,100,maternity smooth-panel every black jack 6 regul,Apparel & Accessories > Apparel > Maternity
1996,100,maternity full-panel cuffed dark wash 18,Apparel & Accessories > Apparel > Maternity
1997,100,"Paige Denim Jimmy Jimmy Maternity Skinny jeans, Rebel, 29",Apparel & Accessories > Apparel > Maternity
1998,100,"Paige Denim Skyline Bootcut Panel Maternity Jean, Carson, 26",Apparel & Accessories > Apparel > Maternity
1999,100,"dl1961 angel maternity ankle jeans, mariner, 29",Apparel & Accessories > Apparel > Maternity
2000,100,"citizens of humanity racer low rise maternity skinny jeans, patina, 30",Apparel & Accessories > Apparel > Maternity
2001,100,"j brand 34112 maternity rail jeans, blanc, 28",Apparel & Accessories > Apparel > Maternity
2002,100,"dl1961 emma maternity jeans, heath, 30",Apparel & Accessories > Apparel > Maternity
2003,100,"citizens of humanity maternity racer skinny jeans, spritzer, 28",Apparel & Accessories > Apparel > Maternity
2004,100,"DL1961 Florence Maternity Skinny Jeans, Thorton, 30",Apparel & Accessories > Apparel > Maternity
2005,100,"DL1961 Angel Ankle Maternity Jeans, Lansing, 28",Apparel & Accessories > Apparel > Maternity
2006,100,"j brand 34112 maternity rail jeans, blanc, 31",Apparel & Accessories > Apparel > Maternity
2007,100,Skinny Jeggings - Maternity MEDIUM N/A SFT GRY,Apparel & Accessories > Apparel > Maternity
2008,100,Skinny Jeans - Maternity MEDIUM N/A SD RINSE,Apparel & Accessories > Apparel > Maternity
2009,100,Paige Maternity Jeans - Verdugo Skinny in Reina 29 Reina,Apparel & Accessories > Apparel > Maternity
2010,100,J Brand Maternity Jeans - Mama J Photo Ready Skinny Legging in Bluebird 25 Bluebird,Apparel & Accessories > Apparel > Maternity
2011,100,Paige Maternity Jeans - Verdugo Skinny in Reina 25 Reina,Apparel & Accessories > Apparel > Maternity
2012,100,j brand maternity jeans - mama j photo ready skinny legging in bluebird 27 bluebird,Apparel & Accessories > Apparel > Maternity
2013,100,Citizens of Humanity Jeans - Maternity Avedon Skinny in Secret 27 Secret,Apparel & Accessories > Apparel > Maternity
2014,100,DL1961 Maternity Jeans - DLX Angel Ankle in Lily 25 Lily,Apparel & Accessories > Apparel > Maternity
2015,100,dl1961 maternity jeans - angel skinny in zeppelin 27 zeppelin,Apparel & Accessories > Apparel > Maternity
2016,100,James Jeans - Twiggy Maternity Legging in Blue Velvet 25 Blue Velvet,Apparel & Accessories > Apparel > Maternity
2017,100,Maternity Modern Trouser Leg Jeans in Winded Blue Wash 14 Maternity Winded Blue Wash,Apparel & Accessories > Apparel > Maternity
2018,100,maternity super skinny moto jeans in black 4 maternity black,Apparel & Accessories > Apparel > Maternity
2019,100,petite maternity sexy boot cut jeans in mid blue wash 8 maternity ornate blue,Apparel & Accessories > Apparel > Maternity
2020,100,maternity denim leggings in blue rinse wash 12 maternity glamour blue wash,Apparel & Accessories > Apparel > Maternity
2021,100,maternity boyfriend jeans in tempt blue wash 10 maternity tempt blue wash,Apparel & Accessories > Apparel > Maternity
2022,100,maternity skinny ankle jeans in puddle blue wash 8 maternity puddle blue wash,Apparel & Accessories > Apparel > Maternity
2023,100,petite maternity demi panel skinny jeans in white 0 p maternity white,Apparel & Accessories > Apparel > Maternity
2024,100,Maternity Super Skinny Moto Jeans in Shadow Grey 12 Maternity Shadow Grey Wash,Apparel & Accessories > Apparel > Maternity
2025,100,maternity demi panel skinny jeans in dark rinse wash 6 maternity dark rinse,Apparel & Accessories > Apparel > Maternity
2026,100,maternity sexy boot cut jeans in black 8 maternity black,Apparel & Accessories > Apparel > Maternity
2027,100,Petite Maternity Skinny Jeans in Dark Rinse Wash 12 Maternity Dark Rinse,Apparel & Accessories > Apparel > Maternity
2028,100,maternity boot cut jeans in dark rinse wash 10 maternity dark rinse,Apparel & Accessories > Apparel > Maternity
2029,100,maternity skinny jeans in solstice wash 4 maternity rich dark indigo wash,Apparel & Accessories > Apparel > Maternity
2030,100,petite maternity skinny jeans in dark rinse wash 00 p maternity proper blue wash,Apparel & Accessories > Apparel > Maternity
2031,100,maternity sexy boot jeans in saturated rinse wash 6 maternity saturated rinse wash,Apparel & Accessories > Apparel > Maternity
2032,100,maternity boot cut jeans in dark rinse wash 0 maternity dark rinse,Apparel & Accessories > Apparel > Maternity
2033,100,Maternity Boot Cut Jeans in Scale Blue Wash 2 Maternity Scale Blue Wash,Apparel & Accessories > Apparel > Maternity
2034,100,maternity modern flare leg jeans in rinse wash 6 maternity dark rinse,Apparel & Accessories > Apparel > Maternity
2035,100,maternity skinny ankle jeans in puddle blue wash 6 maternity puddle blue wash,Apparel & Accessories > Apparel > Maternity
2036,100,Maternity Boot Cut Jeans in Black 2 Maternity Black,Apparel & Accessories > Apparel > Maternity
2037,100,maternity sexy boot jeans in black 6 maternity black,Apparel & Accessories > Apparel > Maternity
