,category_id,description,category_path
927,100,"j brand mama j super skinny maternity jeans, blue bird, 27",Apparel & Accessories > Apparel > Maternity
928,100,Skinny Denim Maternity Jeggings MEDIUM N/A SPR DK RNSE,Apparel & Accessories > Apparel > Maternity
929,100,Embellished Straight Leg Maternity Jeans LARGE DRK,Apparel & Accessories > Apparel > Maternity
930,100,james jeans maternity ankle skinny jean havana 29,Apparel & Accessories > Apparel > Maternity
931,100,paige denim distressed maternity skinny jeans in black shadow destructed 25 black shadow destructed,Apparel & Accessories > Apparel > Maternity
932,100,j brand jeans - 3401 maternity legging in starless 26 starless,Apparel & Accessories > Apparel > Maternity
933,100,paige maternity jeans - verdugo ultra skinny in armstrong 27 armstrong,Apparel & Accessories > Apparel > Maternity
934,100,James Jeans Maternity Jeans - Skinny Legging 28 Dark Indigo,Apparel & Accessories > Apparel > Maternity
935,100,James Jeans - Twiggy Maternity Legging in Oil Slicked 26 Oil Slicked,Apparel & Accessories > Apparel > Maternity
936,100,James Jeans - Twiggy Maternity Legging in Oil Slicked 27 Oil Slicked,Apparel & Accessories > Apparel > Maternity
937,100,paige maternity jeans - union skyline ankle peg in carson 32 carson,Apparel & Accessories > Apparel > Maternity
938,100,James Jeans - Twiggy Maternity Legging in Dark Indigo 29 Dark Indigo,Apparel & Accessories > Apparel > Maternity
939,100,paige maternity jeans - union skyline ankle peg in carson 24 carson,Apparel & Accessories > Apparel > Maternity
940,100,dl1961 maternity jeans - amanda skinny in flatiron 27 flatiron,Apparel & Accessories > Apparel > Maternity
941,100,James Jeans - Twiggy Maternity Legging in Dark Indigo 32 Dark Indigo,Apparel & Accessories > Apparel > Maternity
942,100,Paige Maternity Jeans - Verdugo Ultra Skinny in Nottingham 29 Nottingham,Apparel & Accessories > Apparel > Maternity
943,100,J Brand Maternity Jeans - Skinny Legging in Ink 27 Ink,Apparel & Accessories > Apparel > Maternity
944,100,maternity sexy boot jeans in ornate blue 6 maternity ornate blue wash,Apparel & Accessories > Apparel > Maternity
945,100,maternity kick cropped jeans in dark rinse wash 6 maternity dark rinse,Apparel & Accessories > Apparel > Maternity
946,100,maternity skinny ankle zip jeans in washed black 16 maternity washed black wash,Apparel & Accessories > Apparel > Maternity
947,100,maternity skinny ankle jeans in puddle blue wash 2 maternity puddle blue wash,Apparel & Accessories > Apparel > Maternity
948,100,Maternity Skinny Jeans in Ornate Blue 12 Maternity Ornate Blue,Apparel & Accessories > Apparel > Maternity
949,100,Petite Maternity Boot Cut Jeans in Neptune Blue Wash 14 Petite Maternity Neptune Blue Wash,Apparel & Accessories > Apparel > Maternity
950,100,maternity roll panel skinny jeans in white 12 maternity white,Apparel & Accessories > Apparel > Maternity
951,100,maternity straight leg jeans in scale blue wash 8 maternity scale blue wash,Apparel & Accessories > Apparel > Maternity
952,100,petite maternity skinny jeans in dark rinse wash 4 petite maternity proper blue wash,Apparel & Accessories > Apparel > Maternity
953,100,maternity straight leg jeans in vintage mid indigo wash 14 maternity classic blue wash,Apparel & Accessories > Apparel > Maternity
954,100,petite maternity boot cut jeans in luxurious blue 4 petite maternity luxurious blue wash,Apparel & Accessories > Apparel > Maternity
955,100,maternity modern skinny jeans in dark rinse wash 2 maternity dark rinse,Apparel & Accessories > Apparel > Maternity
956,100,maternity kick crop jeans in dark rinse wash 8 regular dark rinse,Apparel & Accessories > Apparel > Maternity
957,100,petite maternity skinny ankle jeans in white 2 petite maternity white,Apparel & Accessories > Apparel > Maternity
958,100,petite maternity boot cut jeans in dark rinse wash 0 p maternity dark rinse,Apparel & Accessories > Apparel > Maternity
959,100,maternity skinny jeans in scale blue wash 12 maternity scale blue wash,Apparel & Accessories > Apparel > Maternity
960,100,petite maternity skinny jeans in scale blue wash 0 p maternity scale blue wash,Apparel & Accessories > Apparel > Maternity
961,100,maternity demi panel skinny jeans in dark rinse wash 2 maternity dark rinse,Apparel & Accessories > Apparel > Maternity
962,100,maternity denim leggings in blue rinse wash 10 maternity glamour blue wash,Apparel & Accessories > Apparel > Maternity
963,100,Maternity Cropped Jeans in Residual Blue Wash 4 Maternity Residual Blue Wash,Apparel & Accessories > Apparel > Maternity
964,100,petite maternity straight leg jeans in dark rinse wash 4 petite maternity dark rinse,Apparel & Accessories > Apparel > Maternity
965,100,maternity demi panel skinny jeans in dark rinse wash 14 maternity dark rinse,Apparel & Accessories > Apparel > Maternity
966,100,petite maternity boot cut jeans in luxurious blue 6 petite maternity luxurious blue wash,Apparel & Accessories > Apparel > Maternity
967,100,maternity skinny ankle jeans in white 6 maternity white,Apparel & Accessories > Apparel > Maternity
968,100,Maternity Sexy Boot Jeans in Ornate Blue 2 Maternity Ornate Blue Wash,Apparel & Accessories > Apparel > Maternity
969,100,Maternity Skinny Jeans in White 14 Maternity White,Apparel & Accessories > Apparel > Maternity
970,100,maternity super skinny jeans in black 6 maternity black,Apparel & Accessories > Apparel > Maternity
971,100,maternity demi panel skinny jeans in dark rinse wash 8 maternity dark rinse,Apparel & Accessories > Apparel > Maternity
972,100,maternity sexy boot jeans in winded blue wash 0 maternity winded blue wash,Apparel & Accessories > Apparel > Maternity
973,100,maternity trouser leg jeans in winded blue wash 12 maternity winded blue wash,Apparel & Accessories > Apparel > Maternity
974,100,maternity boyfriend jeans in pioneer blue wash 4 maternity pioneer blue wash,Apparel & Accessories > Apparel > Maternity
975,100,Maternity Sexy Boot Cut Jeans in Black 6 Maternity Black,Apparel & Accessories > Apparel > Maternity
976,100,petite maternity modern skinny jeans in dark rinse wash 10 maternity dark rinse,Apparel & Accessories > Apparel > Maternity
977,100,maternity modern straight leg jeans in black 4 maternity black,Apparel & Accessories > Apparel > Maternity
978,100,"paige denim transcend verdugo ultra skinny maternity jeans, nottingham, 25",Apparel & Accessories > Apparel > Maternity
979,100,"dl1961 angel maternity ankle jeans, mariner, 25",Apparel & Accessories > Apparel > Maternity
980,100,"james jeans twiggy maternity skinny jeans, black clean ii, 28",Apparel & Accessories > Apparel > Maternity
981,100,"James Jeans Twiggy Maternity Skinny Jeans, Black Clean II, 25",Apparel & Accessories > Apparel > Maternity
982,100,Maternity Bootcut Jeans MEDIUM CARBON STN,Apparel & Accessories > Apparel > Maternity
983,100,dl1961 maternity jeans - amanda skinny in flatiron 25 flatiron,Apparel & Accessories > Apparel > Maternity
984,100,dl1961 maternity jeans - dlx angel ankle in lily 27 lily,Apparel & Accessories > Apparel > Maternity
985,100,paige maternity jeans - transcend verdugo ultra skinny in nottingham 29 nottingham,Apparel & Accessories > Apparel > Maternity
986,100,dl1961 maternity jeans - kate straight leg in liberty 27 liberty,Apparel & Accessories > Apparel > Maternity
987,100,J Brand Jeans - 34112 Maternity Rail in Blanc 32 Blanc,Apparel & Accessories > Apparel > Maternity
988,100,paige maternity jeans - verdugo ultra skinny in armstrong 30 armstrong,Apparel & Accessories > Apparel > Maternity
989,100,James Jeans Maternity Jeans - Skinny Legging 25 Black,Apparel & Accessories > Apparel > Maternity
990,100,James Jeans Maternity Jeans - Skinny Legging 29 Dark Indigo,Apparel & Accessories > Apparel > Maternity
991,100,James Jeans - Twiggy Maternity Legging in Blue Velvet 26 Blue Velvet,Apparel & Accessories > Apparel > Maternity
992,100,Petite Maternity Skinny Ankle Jeans in Dark Rinse Wash 14 Petite Maternity Twilight Blue Wash,Apparel & Accessories > Apparel > Maternity
993,100,petite maternity skinny jeans in spectral blue 16 petite maternity spectral blue wash,Apparel & Accessories > Apparel > Maternity
994,100,maternity boot cut jeans in black 12 maternity black,Apparel & Accessories > Apparel > Maternity
995,100,maternity sexy boot jeans in winded blue wash 4 maternity winded blue wash,Apparel & Accessories > Apparel > Maternity
996,100,maternity skinny ankle jeans in white 12 maternity white,Apparel & Accessories > Apparel > Maternity
997,100,maternity modern skinny jeans in black 12 maternity black,Apparel & Accessories > Apparel > Maternity
998,100,petite maternity sexy boot cut jeans in mid blue wash 6 maternity ornate blue,Apparel & Accessories > Apparel > Maternity
999,100,maternity boyfriend jeans in tempt blue wash 12 maternity tempt blue wash,Apparel & Accessories > Apparel > Maternity
1000,100,maternity boyfriend jeans in pioneer blue wash 12 maternity pioneer blue wash,Apparel & Accessories > Apparel > Maternity
1001,100,maternity cropped jeans in residual blue wash 2 maternity residual blue wash,Apparel & Accessories > Apparel > Maternity
1002,100,maternity denim leggings in dark indigo wash 12 maternity dark indigo wash,Apparel & Accessories > Apparel > Maternity
1003,100,petite maternity roll panel skinny jeans in dark rinse wash 8 petite maternity dark rinse,Apparel & Accessories > Apparel > Maternity
1004,100,Maternity Denim Leggings in Dark Indigo Wash 16 Regular Dark Indigo Wash,Apparel & Accessories > Apparel > Maternity
1005,100,Maternity Cropped Jeans in Residual Blue Wash 6 Maternity Residual Blue Wash,Apparel & Accessories > Apparel > Maternity
1006,100,Maternity Boot Cut Jeans in Neptune Blue Wash 16 Maternity Neptune Blue Wash,Apparel & Accessories > Apparel > Maternity
1007,100,petite maternity roll panel skinny jeans in white 4 petite white,Apparel & Accessories > Apparel > Maternity
1008,100,Petite Maternity Sexy Boot Cut Jeans in Mid Blue Wash 10 Maternity Ornate Blue Wash,Apparel & Accessories > Apparel > Maternity
1009,100,Petite Maternity Skinny Jeans in Spectral Blue 4 Petite Maternity Spectral Blue Wash,Apparel & Accessories > Apparel > Maternity
1010,100,maternity demi panel skinny jeans in white 6 maternity white,Apparel & Accessories > Apparel > Maternity
1011,100,Maternity Straight Leg Jeans in Black 0 Maternity Black,Apparel & Accessories > Apparel > Maternity
1012,100,petite maternity skinny ankle jeans in dark rinse wash 6 petite maternity twilight blue wash,Apparel & Accessories > Apparel > Maternity
1013,100,petite maternity roll panel skinny jeans in white 8 petite maternity white,Apparel & Accessories > Apparel > Maternity
1014,100,maternity sexy boot jeans in winded blue wash 6 maternity winded blue wash,Apparel & Accessories > Apparel > Maternity
1015,100,petite maternity skinny jeans in dark rinse wash 12 petite maternity dark rinse,Apparel & Accessories > Apparel > Maternity
1016,100,maternity boyfriend jeans in mid blue wash medium maternity jardin blue wash,Apparel & Accessories > Apparel > Maternity
1017,100,Petite Maternity Skinny Jeans in Solstice Wash 10 Petite Maternity Rich Dark Indigo Wash,Apparel & Accessories > Apparel > Maternity
1018,100,Maternity Boot Cut Jeans in Black 0 Maternity Black,Apparel & Accessories > Apparel > Maternity
1019,100,maternity denim shorts in rinse wash 14 maternity rinse wash,Apparel & Accessories > Apparel > Maternity
1020,100,petite maternity boot cut jeans in black 12 petite maternity black,Apparel & Accessories > Apparel > Maternity
1021,100,maternity skinny ankle zip jeans in washed black 4 maternity washed black wash,Apparel & Accessories > Apparel > Maternity
1022,100,maternity boot cut jeans in scale blue wash 6 maternity scale blue wash,Apparel & Accessories > Apparel > Maternity
1023,100,Maternity Cropped Jeans in Saturated Rinse Wash 12 Maternity Saturated Rinse Wash,Apparel & Accessories > Apparel > Maternity
1024,100,maternity modern straight leg jeans in dark rinse wash 8 maternity dark rinse,Apparel & Accessories > Apparel > Maternity
1025,100,maternity modern boot cut jeans in white 8 maternity white,Apparel & Accessories > Apparel > Maternity
1026,100,maternity straight leg jeans in white 12 maternity white,Apparel & Accessories > Apparel > Maternity
1027,100,maternity super skinny moto jeans in black 2 maternity black,Apparel & Accessories > Apparel > Maternity
1028,100,maternity skinny jeans in white 4 maternity white,Apparel & Accessories > Apparel > Maternity
1029,100,maternity denim leggings in vivid dark indigo wash 14 maternity glamour blue wash,Apparel & Accessories > Apparel > Maternity
1030,100,Maternity Boyfriend Jeans in Dark Rinse Wash 2 Maternity Academy Blue Wash,Apparel & Accessories > Apparel > Maternity
1031,100,maternity kick crop jeans in white 8 regular white,Apparel & Accessories > Apparel > Maternity
1032,100,Madeleine Maternity — Madeleine Black Vintage Milano Maternity Skinny Jeans,Apparel & Accessories > Apparel > Maternity
1033,100,Bella Vida Jeans — Dark Wash Distressed Over-Belly Maternity Bootcut Jeans L,Apparel & Accessories > Apparel > Maternity
1034,100,Paige Maternity Denim — McKinley Laurel Canyon Maternity Jeans Size 26,Apparel & Accessories > Apparel > Maternity
1035,100,Blue Medium Wash Maternity Skinny Jeans - Size 32,Apparel & Accessories > Apparel > Maternity
1036,100,Paige Maternity Denim Pacific Dusk Verdugo Under-Belly Maternity Ankle Jeans 30,Apparel & Accessories > Apparel > Maternity
1037,100,Citizens of Humanity Maternity — New Faith Thompson Maternity Crop Jeans,Apparel & Accessories > Apparel > Maternity
1038,100,asos maternity ridley skinny jean in mid wash with over the bump waistband - mid wash / uk 14,Apparel & Accessories > Apparel > Maternity
1039,100,ASOS Maternity Exclusive Ridley Skinny Jean In Indigo With Stretch Waistband - Indigo / US W32 L34,Apparel & Accessories > Apparel > Maternity
1040,100,new look maternity skinny jean in rinse wash - navy / 28in reg,Apparel & Accessories > Apparel > Maternity
1041,100,tall stretch maternity matchstick jean in pitch black wash / tall 26 / pitch black wash,Apparel & Accessories > Apparel > Maternity
1042,100,maternity slim broken-in boyfriend jean in michel wash / 27 / michel wash,Apparel & Accessories > Apparel > Maternity
1043,100,Maternity matchstick jean in pitch black wash / 28 / PITCH BLACK WASH,Apparel & Accessories > Apparel > Maternity
1044,100,Petite maternity slim broken-in boyfriend jean in Michel wash / PETITE 23 / MICHEL WASH,Apparel & Accessories > Apparel > Maternity
1045,100,Maternity pull-on toothpick jean in black / 23 / TRUE BLACK,Apparel & Accessories > Apparel > Maternity
1046,100,maternity toothpick jean in classic rinse / 28 / classic rinse,Apparel & Accessories > Apparel > Maternity
1047,100,maternity pull-on toothpick jean in rinse wash / 31 / classic rinse,Apparel & Accessories > Apparel > Maternity
1048,100,Maternity toothpick jean in rinse / 24 / CLASSIC RINSE,Apparel & Accessories > Apparel > Maternity
1049,100,tall maternity toothpick jean in pitch black wash / tall 32 / pitch black wash,Apparel & Accessories > Apparel > Maternity
1050,100,tall maternity toothpick jean in classic rinse / tall 27 / classic rinse,Apparel & Accessories > Apparel > Maternity
1051,100,maternity denim pull-on short in patina wash / 29 / patina wash,Apparel & Accessories > Apparel > Maternity
1052,100,stretch maternity matchstick jean in dark rinse / 27 / classic rinse,Apparel & Accessories > Apparel > Maternity
1053,100,paige denim 'transcend - verdugo' skinny maternity jeans (black shadow) black shadow 30 maternity,Apparel & Accessories > Apparel > Maternity
1054,100,Paige Denim 'Verdugo' Maternity Ankle Jeans with Side Gussets (Lex) Lex Blue 26 Maternity,Apparel & Accessories > Apparel > Maternity
1055,100,Paige Denim 'Jimmy Jimmy' Skinny Boyfriend Maternity Jeans (Tawni Destruction) Tawni Destruction 25 Maternity,Apparel & Accessories > Apparel > Maternity
1056,100,paige denim 'jimmy jimmy' skinny boyfriend maternity jeans (penelope) penelope 32 maternity,Apparel & Accessories > Apparel > Maternity
1057,100,Topshop 'Leigh' Maternity Skinny Jeans (Short) Mid Stone 16 S Maternity,Apparel & Accessories > Apparel > Maternity
1058,100,paige denim 'skyline' maternity skinny jeans (carson) carson 30 maternity,Apparel & Accessories > Apparel > Maternity
1059,100,paige denim 'transcend - verdugo' crop skinny maternity jeans (valor blue) valor blue 32 maternity,Apparel & Accessories > Apparel > Maternity
1060,100,Paige Denim 'Jimmy Jimmy' Maternity Skinny Jeans (Tawni Destruction) Tawni Destruction 29 Maternity,Apparel & Accessories > Apparel > Maternity
1061,100,Paige Denim 'Transcend - Skyline' Bootcut Maternity Jeans (Mona) Mona 32 Maternity,Apparel & Accessories > Apparel > Maternity
1062,100,paige denim 'skyline' maternity ankle skinny stretch jeans (optic white) optic white 25 maternity,Apparel & Accessories > Apparel > Maternity
1063,100,Paige Denim 'Verdugo' Skinny Maternity Jeans (Black Shadow) Black Shadow Maternity 3001_28,Apparel & Accessories > Apparel > Maternity
1064,100,topshop moto 'joni' high rise skinny maternity jeans (black) black 4r maternity,Apparel & Accessories > Apparel > Maternity
1065,100,paige denim 'skyline' maternity ankle skinny jeans (carson) carson 27 maternity,Apparel & Accessories > Apparel > Maternity
1066,100,Paige Maternity 'Union Skyline' Ankle Skinny Jeans (Carson) Carson Maternity 25,Apparel & Accessories > Apparel > Maternity
1067,100,paige denim 'union skyline' skinny leg maternity jeans (twilight) twilight 33 maternity,Apparel & Accessories > Apparel > Maternity
1068,100,Paige Denim 'Transcend - Verdugo' Maternity Jeans (Tonal Mona) Tonal Mona 26 Maternity,Apparel & Accessories > Apparel > Maternity
1069,100,paige denim 'skyline' ankle peg skinny maternity jeans (alanis) alanis 27,Apparel & Accessories > Apparel > Maternity
1070,100,Paige Denim 'Transcend - Verdugo' Skinny Maternity Jeans (Armstrong) Cassie 26 Maternity,Apparel & Accessories > Apparel > Maternity
1071,100,paige denim 'verdugo' skinny maternity jeans (black shadow) black shadow 27 maternity,Apparel & Accessories > Apparel > Maternity
1072,100,paige denim 'skyline' skinny maternity jeans (mona) mona 32 maternity,Apparel & Accessories > Apparel > Maternity
1073,100,Paige Denim 'Transcend - Skyline' Bootcut Maternity Jeans (Mona) Mona 34 Maternity,Apparel & Accessories > Apparel > Maternity
1074,100,james jeans skinny bootcut maternity jean blue black 31,Apparel & Accessories > Apparel > Maternity
1075,100,James Jeans Twiggy Maternity Skinny Jean Ext Black / 29,Apparel & Accessories > Apparel > Maternity
1076,100,Paige Premium Denim Skyline Bootcut Maternity Jean AUGUSTA 31,Apparel & Accessories > Apparel > Maternity
1077,100,james jeans skinny bootcut orion maternity jean orion 27,Apparel & Accessories > Apparel > Maternity
1078,100,James Jeans Boyfriend Maternity Jean Atlas 30,Apparel & Accessories > Apparel > Maternity
1079,100,Paige Premium Denim Skyline Bootcut Maternity Jean PARIS 33,Apparel & Accessories > Apparel > Maternity
1080,100,Paige Premium Denim Paige Premium Denim Kylie Crop Maternity Jean ALEXIS 30,Apparel & Accessories > Apparel > Maternity
1081,100,paige premium denim verdugo skinny maternity jean reina 32,Apparel & Accessories > Apparel > Maternity
1082,100,paige premium denim skyline bootcut maternity jean twilight 31,Apparel & Accessories > Apparel > Maternity
1083,100,DL1961 DL1961 Angel Ankle Skinny Maternity Jean Ruby 27,Apparel & Accessories > Apparel > Maternity
1084,100,James Jeans Denim Maternity Short Atlas 31,Apparel & Accessories > Apparel > Maternity
1085,100,Madeleine Maternity Milano Black Vintage Wash Skinny Jean Black Vintage 26,Apparel & Accessories > Apparel > Maternity
1086,100,Madeleine Maternity Black Vintage Wash Skinny Jean Black Vintage 29,Apparel & Accessories > Apparel > Maternity
1087,100,James Jeans Ankle Skinny Maternity Jean Pure Black 29,Apparel & Accessories > Apparel > Maternity
1088,100,dl1961 angel skinny ankle maternity jean charleston 26,Apparel & Accessories > Apparel > Maternity
1089,100,James Jeans Boyfriend Maternity Jean Calypso Clean / 28,Apparel & Accessories > Apparel > Maternity
1090,100,James Jeans Skinny Maternity Jean Eiffel 29,Apparel & Accessories > Apparel > Maternity
1091,100,Paige Premium Denim Paige Premium Denim Skyline Bootcut Maternity Jean PARIS 27,Apparel & Accessories > Apparel > Maternity
1092,100,paige premium denim kylie crop maternity jean alexis 31,Apparel & Accessories > Apparel > Maternity
1093,100,James Jeans Twiggy Maternity Skinny Jean Atlas / 26,Apparel & Accessories > Apparel > Maternity
1094,100,james jeans maternity skinny maternity jean bodega 27,Apparel & Accessories > Apparel > Maternity
1095,100,james jeans maternity skinny maternity jean black 27,Apparel & Accessories > Apparel > Maternity
1096,100,james jeans maternity twiggy 5-pocket leggings dark wash 25,Apparel & Accessories > Apparel > Maternity
1097,100,james jeans maternity skinny maternity jean atlas 28,Apparel & Accessories > Apparel > Maternity
1098,100,"DL1961 Florence Maternity Skinny Jeans, Thorton, 24",Apparel & Accessories > Apparel > Maternity
1099,100,"James Jeans Twiggy Maternity Under Belly Pull On Jeans, Blue Velvet, 31",Apparel & Accessories > Apparel > Maternity
1100,100,"Paige Denim Skyline Ankle Peg Maternity Jeans, Carson, 25",Apparel & Accessories > Apparel > Maternity
1101,100,"james jeans twiggy maternity skinny jeans, black clean ii, 27",Apparel & Accessories > Apparel > Maternity
1102,100,"Paige Denim Transcend Verdugo Ultra Skinny Maternity Jeans, Nottingham, 24",Apparel & Accessories > Apparel > Maternity
1103,100,"dl1961 florence maternity skinny jeans, thorton, 25",Apparel & Accessories > Apparel > Maternity
1104,100,"James Jeans Twiggy Maternity Legging Jeans, Frost White, 28",Apparel & Accessories > Apparel > Maternity
1105,100,"James Jeans Twiggy Maternity Jeans, Oil Slick, 26",Apparel & Accessories > Apparel > Maternity
1106,100,maternity full-panel denim s dark wash 10,Apparel & Accessories > Apparel > Maternity
1107,100,maternity full panel everyda black 12 shor,Apparel & Accessories > Apparel > Maternity
1108,100,maternity full-panel jeans medium wash 10 regu,Apparel & Accessories > Apparel > Maternity
1109,100,stretch maternity toothpick jean in chalk / 32 / white,Apparel & Accessories > Apparel > Maternity
1110,100,maternity toothpick jean in pitch black wash / 28 / pitch black wash,Apparel & Accessories > Apparel > Maternity
1111,100,maternity pull-on toothpick jean in rinse wash / 24 / classic rinse,Apparel & Accessories > Apparel > Maternity
1112,100,maternity pull-on toothpick jean in rinse wash / 26 / classic rinse,Apparel & Accessories > Apparel > Maternity
1113,100,maternity pull-on toothpick jean in black / 27 / true black,Apparel & Accessories > Apparel > Maternity
1114,100,tall maternity toothpick jean in black / tall 27 / true black,Apparel & Accessories > Apparel > Maternity
1115,100,pre-order maternity toothpick jean in rinse / 28 / classic rinse,Apparel & Accessories > Apparel > Maternity
1116,100,tall stretch maternity toothpick jean in chalk / tall 31 / white,Apparel & Accessories > Apparel > Maternity
1117,100,petite maternity pull-on toothpick jean in chalk / petite 30 / white,Apparel & Accessories > Apparel > Maternity
1118,100,stretch maternity matchstick jean in pitch black wash / 25 / pitch black wash,Apparel & Accessories > Apparel > Maternity
1119,100,maternity toothpick jean in pitch black wash / 24 / pitch black wash,Apparel & Accessories > Apparel > Maternity
1120,100,stretch maternity matchstick jean in dark rinse 31 classic rinse,Apparel & Accessories > Apparel > Maternity
1121,100,Petite maternity pull-on toothpick jean in rinse wash / PETITE 29 / CLASSIC RINSE,Apparel & Accessories > Apparel > Maternity
1122,100,paige denim 'skyline' maternity ankle skinny stretch jeans (optic white) optic white 28 maternity,Apparel & Accessories > Apparel > Maternity
1123,100,paige denim 'skyline' ankle peg maternity jeans with side gussets (ringo) ringo blue 33 maternity,Apparel & Accessories > Apparel > Maternity
1124,100,paige denim 'verdugo' skinny maternity jeans (armstrong) armstrong 28 maternity,Apparel & Accessories > Apparel > Maternity
1125,100,paige denim 'skyline' maternity ankle skinny jeans (carson) carson 32 maternity,Apparel & Accessories > Apparel > Maternity
1126,100,Paige Denim 'Jimmy Jimmy' Skinny Boyfriend Maternity Jeans (Penelope) Penelope Maternity 3001_29,Apparel & Accessories > Apparel > Maternity
1127,100,Paige Denim 'Skyline' Skinny Maternity Jeans (Mona) Mona Maternity 27,Apparel & Accessories > Apparel > Maternity
1128,100,Maternal America Maternity Skinny Ankle Stretch Jeans White Large Maternity,Apparel & Accessories > Apparel > Maternity
1129,100,Paige Denim 'Transcend - Verdugo' Maternity Ankle Jeans with Side Gussets (Mae) Mae Blue 29 Maternity,Apparel & Accessories > Apparel > Maternity
1130,100,Paige Denim 'Jimmy Jimmy' Skinny Boyfriend Maternity Jeans (Tawni Destruction) Tawni Destruction 29,Apparel & Accessories > Apparel > Maternity
1131,100,topshop 'leigh' maternity skinny jeans black 8r maternity,Apparel & Accessories > Apparel > Maternity
1132,100,paige denim 'verdugo' maternity jeans (nottingham) nottingham 25 maternity,Apparel & Accessories > Apparel > Maternity
1133,100,Paige Denim 'Jimmy Jimmy' Straight Leg Crop Maternity Jeans (Penelope) Penelope 27 Maternity,Apparel & Accessories > Apparel > Maternity
1134,100,Paige Denim 'Transcend - Verdugo' Skinny Maternity Jeans (Black Shadow) Black Shadow 33 Maternity,Apparel & Accessories > Apparel > Maternity
1135,100,paige denim 'kylie' crop maternity skinny jeans (alexis) alexis 27 maternity,Apparel & Accessories > Apparel > Maternity
