,category_id,description,category_path
1354,115,"CLASSROOM Big Girls' Plus-Size Kick Pleat Jumper, Khaki, 10.5",Apparel & Accessories > Apparel > Skirts > Girls
1355,115,Hairbows Unlimited Dark Pink Dance or Ballet Tutu,Apparel & Accessories > Apparel > Skirts > Girls
1356,115,"Sunny Fashion Little Girls Skirt Tutu Dancing Multi Tulle Layers, White, 4-5",Apparel & Accessories > Apparel > Skirts > Girls
1357,115,"CLASSROOM Big Girls' Plus-Size Plus Jean Pocket Scooter, Denim Navy, 16 Husky",Apparel & Accessories > Apparel > Skirts > Girls
1358,115,Capezio Little Girls' Tutu,Apparel & Accessories > Apparel > Skirts > Girls
1359,115,French Toast Uniforms Girls' Scooter Skort (Navy 18),Apparel & Accessories > Apparel > Skirts > Girls
1360,115,"Dollie & Me Little Girls' Holofoil Bodice with Tulle Skirted Dress, Royal/Grey, 6",Apparel & Accessories > Apparel > Skirts > Girls
1361,115,DA93 Kids Girls Cake Skirt Tutu Dancing Multi Tulle Layers Size 7-8 White,Apparel & Accessories > Apparel > Skirts > Girls
1362,115,French Toast School Uniforms Two Tab Scooter Girls khaki 5,Apparel & Accessories > Apparel > Skirts > Girls
1363,115,"French Toast Big Girls Polka Dot Belted Scooter, Khaki, 10",Apparel & Accessories > Apparel > Skirts > Girls
1364,115,"Dickies Big Girls' Faux Wrap Skort - School Uniform,Dark Navy,8 Regular",Apparel & Accessories > Apparel > Skirts > Girls
1365,115,Houston Astros - Vintage,Apparel & Accessories > Apparel > Skirts > Girls
1366,115,Girls Sequin Ballet Tutu,Apparel & Accessories > Apparel > Skirts > Girls
1367,115,"Capezio Little Girls' Romantic Tutu, Royal, One Size",Apparel & Accessories > Apparel > Skirts > Girls
1368,115,French Toast School Uniforms Two Tab Scooter Girls burgundy 14,Apparel & Accessories > Apparel > Skirts > Girls
1369,115,"Eddie Bauer Big Girls Twill Scooter with Reversible Belt, Khaki,7",Apparel & Accessories > Apparel > Skirts > Girls
1370,115,"Tai523 Baby Girls Tutu Skirt Child Pettiskirts Dance Ball Party Ballet Skirts (10-11 Years, Pink1)",Apparel & Accessories > Apparel > Skirts > Girls
1371,115,Trienawear Big Girls,Apparel & Accessories > Apparel > Skirts > Girls
1372,115,"Eddie Bauer Big Girls' Twill Scooter with Reversible Belt, Khaki, 10",Apparel & Accessories > Apparel > Skirts > Girls
1373,115,Bienzoe Big Girl's Twill School Uniforms Pocket Pleated Scooter Skirt Size 12,Apparel & Accessories > Apparel > Skirts > Girls
1374,115,"CLASSROOM Juniors Stretch Fly Front Scooter, Dark Navy, 17/18",Apparel & Accessories > Apparel > Skirts > Girls
1375,115,French Toast School Uniforms Plaid Pleated Skirt Girls blue gold plaid 16,Apparel & Accessories > Apparel > Skirts > Girls
1376,115,"Hartstrings Girls 2-6X Cotton Seersucker Check and Eyelet Ruffle Skort, Blue/White Check, 6",Apparel & Accessories > Apparel > Skirts > Girls
1377,115,"French Toast Two Tab Pleated Skort - gray, 6x",Apparel & Accessories > Apparel > Skirts > Girls
1378,115,DA94 Kids Girls Cake Skirt Tutu Dancing Multi Tulle Layers Size 9-10 White,Apparel & Accessories > Apparel > Skirts > Girls
1379,115,French Toast Uniforms Girls' Scooter Skort (Black 12),Apparel & Accessories > Apparel > Skirts > Girls
1380,115,French Toast Plaid Two-Tab,Apparel & Accessories > Apparel > Skirts > Girls
1381,115,French Toast School Uniforms Kick Pleat Scooter Girls,Apparel & Accessories > Apparel > Skirts > Girls
1382,115,"French Toast Big Girls' Pleated Scooter with Square Buckle Belt, Khaki, 12",Apparel & Accessories > Apparel > Skirts > Girls
1383,115,Tulle Tutu Rainbow Color 4 Layers Red Waistband - PT1733R (Small),Apparel & Accessories > Apparel > Skirts > Girls
1384,115,"Curio+Kind Big Girls' Short Sleeve Screen Tee with Silver Motorcycle, Black, 8",Apparel & Accessories > Apparel > Skirts > Girls
1385,115,French Toast School Uniforms Plaid Pleated Skirt brown plaid 14,Apparel & Accessories > Apparel > Skirts > Girls
1386,115,Celebrity Pink Girls' Denim Skirtalls White Denim 8,Apparel & Accessories > Apparel > Skirts > Girls
1387,115,"CLASSROOM Juniors Tab Pleat Scooter Skirt, Khaki, 13/14",Apparel & Accessories > Apparel > Skirts > Girls
1388,115,"Capezio Little Girls' Pull-On Georgette Skirt, Black, Small",Apparel & Accessories > Apparel > Skirts > Girls
1389,115,Pleated Scooter with,Apparel & Accessories > Apparel > Skirts > Girls
1390,115,"Tractr Big Girls' Acid Washed Denim Skirt with Studs, Indigo, 10",Apparel & Accessories > Apparel > Skirts > Girls
1391,115,"Sansha Girls 2-6x Serenity Pull-on Skirt, Light Pink, Intermediate 6-8(D)",Apparel & Accessories > Apparel > Skirts > Girls
1392,115,French Toast Uniforms Girls' Scooter Skort (Khaki 10),Apparel & Accessories > Apparel > Skirts > Girls
1393,115,"Classroom Girls 7-16 Kick Pleat Skirt, Navy Blue, 8",Apparel & Accessories > Apparel > Skirts > Girls
1394,115,Leg Avenue Reversible Ribbon Trimmed Tutu Skirt,Apparel & Accessories > Apparel > Skirts > Girls
1395,115,"CLASSROOM Big Girls' Pleated Tab Scooter,Khaki,8",Apparel & Accessories > Apparel > Skirts > Girls
1396,115,French Toast School Uniforms Pleated Skirt Girls heather grey 7,Apparel & Accessories > Apparel > Skirts > Girls
1397,115,Gymboree Girls' Dressy,Apparel & Accessories > Apparel > Skirts > Girls
1398,115,"CLASSROOM Big Girls' Plus-Size Plus Stretch Fly Front Scooter, Khaki, 16 1/2 Husky",Apparel & Accessories > Apparel > Skirts > Girls
1399,115,"Amy Byer Big Girls' Knee Length, Gored Skirt With Patent Leather Belt,Black,16",Apparel & Accessories > Apparel > Skirts > Girls
1400,115,French Toast Plaid Two-Tab Scooter Girls Burgundy Plaid 4,Apparel & Accessories > Apparel > Skirts > Girls
1401,115,"Dickies Big Girls' Faux Wrap Skort - School Uniform,Khaki,10 Regular",Apparel & Accessories > Apparel > Skirts > Girls
1402,115,Imixcity Girl Tutu Skirt Ballet Dancewear (Black),Apparel & Accessories > Apparel > Skirts > Girls
1403,115,XUNYU Baby Girls Pleated,Apparel & Accessories > Apparel > Skirts > Girls
1404,115,American Apparel Youth Cotton Spandex Jersey Wide Waistband Skirt - Lavender / 12 Years,Apparel & Accessories > Apparel > Skirts > Girls
1405,115,French Toast Double Pleated Scooter Girls Navy 7,Apparel & Accessories > Apparel > Skirts > Girls
1406,115,"Capezio Big Girls' Tactel Collection Pull-On Skirt, Pink, Medium (8-10)",Apparel & Accessories > Apparel > Skirts > Girls
1407,115,French Toast School Uniforms Kick Pleat Scooter Girls navy 3T,Apparel & Accessories > Apparel > Skirts > Girls
1408,115,Carter's Little Girls' Lace,Apparel & Accessories > Apparel > Skirts > Girls
1409,115,Wholesale Princess Aqua Chevron Cotton Skirt Fits 1-4 years,Apparel & Accessories > Apparel > Skirts > Girls
1410,115,French Toast School Uniforms Two Tab Scooter Girls black 16,Apparel & Accessories > Apparel > Skirts > Girls
1411,115,"Eddie Bauer Little Girls' Pleated Skirt Jumper, Navy, 4",Apparel & Accessories > Apparel > Skirts > Girls
1412,115,"CLASSROOM Juniors Kick Pleat Skirt, Khaki, 3/4",Apparel & Accessories > Apparel > Skirts > Girls
1413,115,"Takara Big Girls' Maxi Skirt with Fold-Over Waist, Blue, X-Large",Apparel & Accessories > Apparel > Skirts > Girls
1414,115,"Capezio Little Girls' Children's Collection Pull-On Skirt, Lavender Butterfly, Small",Apparel & Accessories > Apparel > Skirts > Girls
1415,115,OshKosh B'gosh Little Girls' Knit Skirt (Toddler/Kid) - Navy - 2T,Apparel & Accessories > Apparel > Skirts > Girls
1416,115,French Toast School Uniforms Two Tab Scooter Girls Khaki 3T,Apparel & Accessories > Apparel > Skirts > Girls
1417,115,"Sansha Big Girls' Serenity Pull-on Skirt, White, X Large 12-14(G)",Apparel & Accessories > Apparel > Skirts > Girls
1418,115,EX92 Sunny Fashion Little Girls' Skirt Light Yellow Lace Tulle Tutu Dancing 3T,Apparel & Accessories > Apparel > Skirts > Girls
1419,115,"Danskin Little Girls' Leotard with Attached Glitter Tutu, Lavender, Toddler/2-4",Apparel & Accessories > Apparel > Skirts > Girls
1420,115,French Toast School Uniforms Two Tab Scooter Girls heather grey 14,Apparel & Accessories > Apparel > Skirts > Girls
1421,115,"French Toast - Big Girls' Plaid Two-Tab Scooter, Burgundy 35145-18",Apparel & Accessories > Apparel > Skirts > Girls
1422,115,Capezio Little Girls,Apparel & Accessories > Apparel > Skirts > Girls
1423,115,"Girls Tulle Ballet Tutu Skirt Fairy Angel ""Little Mystique Legs"" (Black)",Apparel & Accessories > Apparel > Skirts > Girls
1424,115,"French Toast Big Girls' Plaid Pleated Skirt, Blue/Gold, 8",Apparel & Accessories > Apparel > Skirts > Girls
1425,115,French Toast School Uniforms Zipper Waistband Pleated Scooter Girls navy 16,Apparel & Accessories > Apparel > Skirts > Girls
1426,115,French Toast Plaid Pleated Skirt Girls Brown Plaid 14,Apparel & Accessories > Apparel > Skirts > Girls
1427,115,"Capezio Big Girls' Children's Collection Circular Pull-On Skirt, Pink, Medium",Apparel & Accessories > Apparel > Skirts > Girls
1428,115,"Danskin Little Girls' Leotard with Iridescent Faux Mesh Wrap, Petal Pink, Toddler/2-4",Apparel & Accessories > Apparel > Skirts > Girls
1429,115,Black 5 Layer Dance or Ballet Tutu,Apparel & Accessories > Apparel > Skirts > Girls
1430,115,"Red Dance or Ballet Tutu, One Size",Apparel & Accessories > Apparel > Skirts > Girls
1431,115,"Capezio Big Girls' Tactel Collection Pull-On Skirt, Black, Intermediate (6-8)",Apparel & Accessories > Apparel > Skirts > Girls
1432,115,Rajasthali Indian Ethnic Hand Embroidery Decorative Silk Pillow Cushion Cover Set of 5 Pcs Size 16 X 16 Inches,Apparel & Accessories > Apparel > Skirts > Girls
1433,115,French Toast School Uniforms Pleated Skirt Girls heather grey 12,Apparel & Accessories > Apparel > Skirts > Girls
1434,115,"French Toast - Girls Plus Short Sleeve Peter Pan Blouse, White 33154-16.5Plus",Apparel & Accessories > Apparel > Skirts > Girls
1435,115,"KHQ Girls 7-16 Drop Waist Scooter, Khaki, 14",Apparel & Accessories > Apparel > Skirts > Girls
1436,115,Miss MeMe Girls Black Denim,Apparel & Accessories > Apparel > Skirts > Girls
1437,115,"Capezio Big Girls' Pull-On Georgette Skirt, White, Large",Apparel & Accessories > Apparel > Skirts > Girls
1438,115,French Toast Girls Front Pleated Skirt with Tabs Navy - Size 4,Apparel & Accessories > Apparel > Skirts > Girls
1439,115,French Toast Girls Kick Pleat Scooter Skirt,Apparel & Accessories > Apparel > Skirts > Girls
1440,115,Cherokee Juniors School Uniform Kick Pleat Skirt - Pita Bread 1,Apparel & Accessories > Apparel > Skirts > Girls
1441,115,Cherokee® Girls' School Uniform Pleated Scooter - Ebony 4,Apparel & Accessories > Apparel > Skirts > Girls
1442,115,Girls' Denim Skirt S - Xhilaration™,Apparel & Accessories > Apparel > Skirts > Girls
1443,115,Dickies® Girls' Faux Wrap Skort - Dark Navy 16,Apparel & Accessories > Apparel > Skirts > Girls
1444,115,Dickies® Girls' Faux Wrap Skort Khaki 6,Apparel & Accessories > Apparel > Skirts > Girls
1445,115,French Toast® Girls' Two Tab Scooter Khaki 10,Apparel & Accessories > Apparel > Skirts > Girls
1446,115,French Toast® Girls' Two Tab Scooter Khaki 16,Apparel & Accessories > Apparel > Skirts > Girls
1447,115,"George Girls' School Uniforms, Pleated Scooter with Side Buttons:Color:DARK NAVY:Size:8",Apparel & Accessories > Apparel > Skirts > Girls
1448,115,Journey Girls Scooter,Apparel & Accessories > Apparel > Skirts > Girls
1449,115,Chaps Corduroy School Uniform Scooter - Girls 7-16 Khaki 12,Apparel & Accessories > Apparel > Skirts > Girls
1450,115,Chaps Drop-Waist School Uniform Scooter - Girls 7-16 12 Navy,Apparel & Accessories > Apparel > Skirts > Girls
1451,115,Chaps Drop-Waist School Uniform Scooter - Girls 7-16 12 Khaki,Apparel & Accessories > Apparel > Skirts > Girls
1452,115,SO Denim Scooter - Girls 7-16 10 Medium Denim,Apparel & Accessories > Apparel > Skirts > Girls
1453,115,Boys 4-7x SONOMA Goods for Life™ Striped Pocket Hoodie Blue Stripe 6,Apparel & Accessories > Apparel > Skirts > Girls
1454,115,NAVAdeal Organza Teen & Adult Rainbow Dance or Ballet Tutu,Apparel & Accessories > Apparel > Skirts > Girls
1455,115,"Capezio Circular Pull-On Skirt, Pink-Toddler",Apparel & Accessories > Apparel > Skirts > Girls
1456,115,"Derek Heart Girl Girls 7-16 Tiered Pull-On Skirt with Attached Undershorts, White, Medium",Apparel & Accessories > Apparel > Skirts > Girls
1457,115,Ella Closets Girls Skirt,Apparel & Accessories > Apparel > Skirts > Girls
1458,115,American Apparel Youth Cotton Spandex Jersey Wide Waistband Skirt - Black / 12 Years,Apparel & Accessories > Apparel > Skirts > Girls
1459,115,Cocobla Girl Tutu Skirt Ballet Dancewear (Deep Purple),Apparel & Accessories > Apparel > Skirts > Girls
1460,115,"French Toast Big Girls' Plaid Pleated Scooter, Blue/Gold, 7",Apparel & Accessories > Apparel > Skirts > Girls
1461,115,French Toast Pleated Scooter with Square Buckle Belt Black - Size 12,Apparel & Accessories > Apparel > Skirts > Girls
1462,115,Cherokeea® Girls' School Uniform Pleated Scooter - Xavier Navy 4,Apparel & Accessories > Apparel > Skirts > Girls
1463,115,French Toast® Girls' School Uniform 2-Tab Scooter - Khaki 6,Apparel & Accessories > Apparel > Skirts > Girls
1464,115,French Toast® Girls' Scooter with Belt 6 - Khaki,Apparel & Accessories > Apparel > Skirts > Girls
1465,115,Cherokee Girls' School Uniform Pleated Scooter - Pita Bread 14 PLUS,Apparel & Accessories > Apparel > Skirts > Girls
1466,115,Cherokee Girls' School Uniform Pleated Scooter - Ebony 12,Apparel & Accessories > Apparel > Skirts > Girls
1467,115,French Toast® Girls' Scooter with Belt 4 - Navy,Apparel & Accessories > Apparel > Skirts > Girls
1468,115,French Toast® Girls' Two Tab Scooter Khaki 14,Apparel & Accessories > Apparel > Skirts > Girls
1469,115,Dickies® Girls' Faux Wrap Skort Dark Navy 7,Apparel & Accessories > Apparel > Skirts > Girls
1470,115,"George Girls' School Uniforms, Pleated Scooter with Side Buttons; Color: WARM BEIGE; Size: 8 1"" x 6"" x 6""",Apparel & Accessories > Apparel > Skirts > Girls
1471,115,Girls 3 Tier Skirt,Apparel & Accessories > Apparel > Skirts > Girls
1472,115,"Kardashian Kids Girls Coral Fringe Boot, PINK, 5 PINK 5",Apparel & Accessories > Apparel > Skirts > Girls
1473,115,Girls 4-7 SONOMA Goods for Life™ Short Sleeve Graphic Tee Sunshine Oatmeal 6,Apparel & Accessories > Apparel > Skirts > Girls
1474,115,Girls 4-7 SONOMA Goods for Life™ Sweater Knit Lace Hem Tee Glitter Ivory 6,Apparel & Accessories > Apparel > Skirts > Girls
1475,115,Girls 4-7 SONOMA Goods for Life™ Sweater Tunic Gray 7,Apparel & Accessories > Apparel > Skirts > Girls
1476,115,Girls 4-7 SONOMA Goods for Life™ Striped Boyfriend Cardigan Ash Heather 6,Apparel & Accessories > Apparel > Skirts > Girls
1477,115,Chaps Flounce School Uniform Scooter - Girls 4-6x 6X Khaki,Apparel & Accessories > Apparel > Skirts > Girls
1478,115,Chaps Pleated School Uniform Scooter - Girls 4-16 SU KHAKI 4,Apparel & Accessories > Apparel > Skirts > Girls
1479,115,Chaps Button Pleated School Uniform Scooter - Girls 4-6x 4 Khaki,Apparel & Accessories > Apparel > Skirts > Girls
1480,115,Chaps Pleated School Uniform Scooter - Girls 7-16 12 Navy,Apparel & Accessories > Apparel > Skirts > Girls
1481,115,Girls 4-8 Jumping Beans® Skater Skort Dark Denim 8,Apparel & Accessories > Apparel > Skirts > Girls
1482,115,SONOMA Goods for Life™ Braided Belt Brown MEDIUM,Apparel & Accessories > Apparel > Skirts > Girls
1483,115,Chaps Pleated School Uniform Scooter - Girls 4-16 Navy 8,Apparel & Accessories > Apparel > Skirts > Girls
1484,115,SONOMA Goods for Life™ Woven Skort - Girls 4-10 Soft Flower Pink 6X,Apparel & Accessories > Apparel > Skirts > Girls
1485,115,Girls 4-16 Chaps Pleated School Uniform Skort Navy 12,Apparel & Accessories > Apparel > Skirts > Girls
1486,115,SONOMA Goods for Life™ Cheyenne Oversized Crossbody Bag Black NO SIZE,Apparel & Accessories > Apparel > Skirts > Girls
1487,115,SONOMA Goods for Life™ Woven Skort - Girls 4-10 Flower Border Navy 5,Apparel & Accessories > Apparel > Skirts > Girls
1488,115,Dollie & Me Floral Top & Skirt Set - Girls 4-14 Blue 4,Apparel & Accessories > Apparel > Skirts > Girls
1489,115,Chaps Pleated Corduroy School Uniform Scooter - Girls 4-6x 6 Khaki,Apparel & Accessories > Apparel > Skirts > Girls
1490,115,Girls 4-7 SONOMA Goods for Life™ Short Sleeve Graphic Tee Fabulous Coral 7,Apparel & Accessories > Apparel > Skirts > Girls
1491,115,Girls 4-7 SONOMA Goods for Life™ Short Sleeve Sequin Graphic Tee Heart Pink 7,Apparel & Accessories > Apparel > Skirts > Girls
1492,115,Chaps Ruffled School Uniform Scooter - Girls 7-16,Apparel & Accessories > Apparel > Skirts > Girls
1493,115,SONOMA Goods for Life™ 6-pk. Ankle Socks White 9-11,Apparel & Accessories > Apparel > Skirts > Girls
1494,115,Chaps Pleated Twill School Uniform Scooter - Girls 7-16 Navy 10,Apparel & Accessories > Apparel > Skirts > Girls
1495,115,Girls 4-7 SONOMA Goods for Life™ Sequined Sweater Fairisle Gray 4,Apparel & Accessories > Apparel > Skirts > Girls
1496,115,Girls 4-7 DreamWorks Trolls Glitter Rosette Tulle Tutu Skirt Black 4,Apparel & Accessories > Apparel > Skirts > Girls
1497,115,Chaps Twill Pleated School Uniform Scooter - Girls 4-6x 5 Navy,Apparel & Accessories > Apparel > Skirts > Girls
1498,115,Dreampop® Tulle Mesh Skirt with Belt - Girls 7-16,Apparel & Accessories > Apparel > Skirts > Girls
1499,115,IZOD® Pleated Tab Scooter 5003022 Khaki 7,Apparel & Accessories > Apparel > Skirts > Girls
1500,115,Dance Skirt - Girls 4-14 4159101 Black Medium,Apparel & Accessories > Apparel > Skirts > Girls
1501,115,IZOD® Pleated Scooter Skirt - Girls 4-16 and Girls Plus,Apparel & Accessories > Apparel > Skirts > Girls
1502,115,French Toast® Pleated Jumper- Girls 4-20,Apparel & Accessories > Apparel > Skirts > Girls
1503,115,French Toast® Two-Tab Scooter Skirt - Girls 7-20 and Plus 5001071 Navy 20 Plus,Apparel & Accessories > Apparel > Skirts > Girls
1504,115,IZOD Pleated Twill Skort - Girls 7-16,Apparel & Accessories > Apparel > Skirts > Girls
1505,115,French Toast® Pleated Jumper- Girls 7-20 5001059 Khaki 10,Apparel & Accessories > Apparel > Skirts > Girls
1506,115,French Toast® Pleated Jumper- Girls 7-20 5001059 Khaki 7,Apparel & Accessories > Apparel > Skirts > Girls
1507,115,Nautica Girls' Uniform Circle Scooter Skirt Navy 16,Apparel & Accessories > Apparel > Skirts > Girls
1508,115,Carter's Little Girls' Striped Scooter Skirt Mint 6,Apparel & Accessories > Apparel > Skirts > Girls
1509,115,Nautica Girls' Uniform Pleated Scooter Skirt Navy 12,Apparel & Accessories > Apparel > Skirts > Girls
1510,115,"Nautica Kids Skirt, Little Girls Pleated Uniform Scooter",Apparel & Accessories > Apparel > Skirts > Girls
1511,115,"Nautica Uniform Contrast-Ribbon Scooter Skirt, Girls",Apparel & Accessories > Apparel > Skirts > Girls
1512,115,"Ralph Lauren Girls Skirt, Little Girls Tiered Chiffon Skirt Holiday Cream 5",Apparel & Accessories > Apparel > Skirts > Girls
1513,115,French Toast Little Girls' Uniform Pleated Ribbon Scooter Skirt Navy 6X,Apparel & Accessories > Apparel > Skirts > Girls
1514,115,"Nautica Uniform Pleated Scooter Skirt, Girls Khaki 6",Apparel & Accessories > Apparel > Skirts > Girls
1515,115,Nautica Little Girls' Drop-Waist Scooter Skirt Khaki 6X,Apparel & Accessories > Apparel > Skirts > Girls
1516,115,Nautica Little Girls' Uniform Pleated Scooter Skirt Navy 6X,Apparel & Accessories > Apparel > Skirts > Girls
1517,115,"Nautica Kids Skirt, Girls Pleated Uniform Scooter Navy 16",Apparel & Accessories > Apparel > Skirts > Girls
1518,115,Girl's Denim Skirt,Apparel & Accessories > Apparel > Skirts > Girls
1519,115,Girl's Pleated Skirt Girls 7-16 Blue,Apparel & Accessories > Apparel > Skirts > Girls
1520,115,Girl's Knit Skort,Apparel & Accessories > Apparel > Skirts > Girls
1521,115,Girl's Velvet Pleated Scooter,Apparel & Accessories > Apparel > Skirts > Girls
1522,115,Girl's Pleated Uniform Scooter - Navy,Apparel & Accessories > Apparel > Skirts > Girls
1523,115,"Capezio Little Girls' Children's Collection Circular Pull-On Skirt, Pink, Toddler",Apparel & Accessories > Apparel > Skirts > Girls
1524,115,French Toast School Uniforms Plaid Two-Tab Scooter Girls blue red plaid 20,Apparel & Accessories > Apparel > Skirts > Girls
1525,115,French Toast Girls' School Uniform 2-Tab Scooter - Khaki 8,Apparel & Accessories > Apparel > Skirts > Girls
1526,115,Eddie Bauer® Girls' Twill Scooter 6 - Navy,Apparel & Accessories > Apparel > Skirts > Girls
1527,115,French Toast Girls' School Uniform 2-Tab Scooter - Khaki 5,Apparel & Accessories > Apparel > Skirts > Girls
1528,115,French Toast Girls' School Uniform 2-Tab Scooter - Khaki 6X,Apparel & Accessories > Apparel > Skirts > Girls
1529,115,Dickies® Big Girls' Faux Wrap Skort - Dark Navy 12,Apparel & Accessories > Apparel > Skirts > Girls
1530,115,Girls' Tutu Skirt Ebony XL - Circo™,Apparel & Accessories > Apparel > Skirts > Girls
1531,115,Toddler Girls' Metallic Tweed Skirt - Nightfall Blue 6X,Apparel & Accessories > Apparel > Skirts > Girls
1532,115,Eddie Bauer® Girls' Pleated Scooter with Belt Navy 14,Apparel & Accessories > Apparel > Skirts > Girls
1533,115,Girls' Denim Skirt XS - Xhilaration™,Apparel & Accessories > Apparel > Skirts > Girls
1534,115,Dickies® Girls' Faux Wrap Skort Khaki 10,Apparel & Accessories > Apparel > Skirts > Girls
1535,115,Eddie Bauer® Girls' Pleated Scooter with Belt Khaki 7,Apparel & Accessories > Apparel > Skirts > Girls
1536,115,Cherokeea® Girls' School Uniform Pleated Scooter - Pita Bread 7,Apparel & Accessories > Apparel > Skirts > Girls
1537,115,Girls' Tutu Skirt - Ebony XL,Apparel & Accessories > Apparel > Skirts > Girls
1538,115,Girls 4-7 SONOMA Goods for Life™ Striped Boyfriend Cardigan Hot Shot Pink 6X,Apparel & Accessories > Apparel > Skirts > Girls
1539,115,Girls 4-7 SONOMA Goods for Life™ Slubbed Short Sleeve Graphic Tee Butterfly Ivory 7,Apparel & Accessories > Apparel > Skirts > Girls
1540,115,Dollie & Me Sleeveless Skirted Leotard - Girls SMALL Pink,Apparel & Accessories > Apparel > Skirts > Girls
1541,115,Girls 4-10 Jumping Beans® Contrast Waistband Skort Pink Express 10,Apparel & Accessories > Apparel > Skirts > Girls
1542,115,SONOMA Goods for Life™ Braided Belt Black LARGE,Apparel & Accessories > Apparel > Skirts > Girls
1543,115,French Toast School Uniform Scooter - Girls 7-14 Navy 14,Apparel & Accessories > Apparel > Skirts > Girls
1544,115,SONOMA Goods for Life™ Woven Sea Grass Decorative Bowl Multi/None BOWL,Apparel & Accessories > Apparel > Skirts > Girls
1545,115,SONOMA Goods for Life™ Girls 4-7 High-Low Tee Daisy Purple 6X,Apparel & Accessories > Apparel > Skirts > Girls
1546,115,Chaps Ruffled School Uniform Scooter - Girls 7-16 14 AVE/MED Khaki,Apparel & Accessories > Apparel > Skirts > Girls
1547,115,Chaps Twill Pleated School Uniform Scooter - Girls 4-6x Navy 5,Apparel & Accessories > Apparel > Skirts > Girls
1548,115,Girls 4-7 SONOMA Goods for Life™ Popcorn Yarn Bolero Sweater Black Tie 6,Apparel & Accessories > Apparel > Skirts > Girls
1549,115,Girls 4-6x Chaps Pleated School Uniform Skort Khaki 6,Apparel & Accessories > Apparel > Skirts > Girls
1550,115,Chaps Pleated School Uniform Scooter - Girls 4-16 8 Navy,Apparel & Accessories > Apparel > Skirts > Girls
1551,115,Girls 4-8 Jumping Beans® Printed Skater Skort Dots Gray 7,Apparel & Accessories > Apparel > Skirts > Girls
1552,115,Girls 4-7 SONOMA Goods for Life™ Short Sleeve Graphic Tee Sunshine Oatmeal 5,Apparel & Accessories > Apparel > Skirts > Girls
1553,115,Unionbay Plaid Skater Skirt - Girls 7-16,Apparel & Accessories > Apparel > Skirts > Girls
1554,115,Chaps Pleated School Uniform Scooter - Girls 7-16 8 Khaki,Apparel & Accessories > Apparel > Skirts > Girls
1555,115,Chaps Button Pleated School Uniform Skort - Girls 4-6x Khaki 5,Apparel & Accessories > Apparel > Skirts > Girls
1556,115,French Toast School Uniform Scooter - Girls 7-14 BEIG/KHAKI 8,Apparel & Accessories > Apparel > Skirts > Girls
1557,115,Chaps Drop-Waist School Uniform Scooter - Girls 4-6x 6 Navy,Apparel & Accessories > Apparel > Skirts > Girls
1558,115,SONOMA Goods for Life™ 6-pk. No-Show Socks OVRFL OTH 9-11,Apparel & Accessories > Apparel > Skirts > Girls
1559,115,Chaps Pleated School Uniform Scooter - Girls 4-6x 6X Khaki,Apparel & Accessories > Apparel > Skirts > Girls
1560,115,Girls 4-16 Chaps School Uniform Pleated Skort Khaki 5,Apparel & Accessories > Apparel > Skirts > Girls
1561,115,Boys 4-7 SONOMA Goods for Life™ Slubbed Short Sleeve Tee Charcoal 5,Apparel & Accessories > Apparel > Skirts > Girls
1562,115,SONOMA Goods for Life™ 6-pk. Ankle Socks Black 9-11,Apparel & Accessories > Apparel > Skirts > Girls
1563,115,SONOMA Goods for Life™ Girls 4-7 High-Low Tee Heart Purple 6,Apparel & Accessories > Apparel > Skirts > Girls
1564,115,Girls 4-7 SONOMA Goods for Life™ Bow Sweater Bows Ivory 4,Apparel & Accessories > Apparel > Skirts > Girls
1565,115,SONOMA Goods for Life™ Girls 4-7 Graphic Tee Butterfly Blue 5,Apparel & Accessories > Apparel > Skirts > Girls
1566,115,Girls 4-7 SONOMA Goods for Life™ Sweater Tunic Ivory 6,Apparel & Accessories > Apparel > Skirts > Girls
1567,115,Chaps Pleated School Uniform Scooter - Girls 4-16 Navy 7,Apparel & Accessories > Apparel > Skirts > Girls
1568,115,SONOMA Goods for Life™ Girls 4-7 Graphic Tee Butterfly Blue 6X,Apparel & Accessories > Apparel > Skirts > Girls
1569,115,Girls 4-16 Chaps Pleated School Uniform Skort Khaki 10,Apparel & Accessories > Apparel > Skirts > Girls
1570,115,Xersion™ Skort - Girls 7-16,Apparel & Accessories > Apparel > Skirts > Girls
1571,115,French Toast® Two-Tab Scooter Skirt - Preschool Girls 4-6x Khaki 4,Apparel & Accessories > Apparel > Skirts > Girls
1572,115,by&by Girl Tiered Skirt - Girls,Apparel & Accessories > Apparel > Skirts > Girls
1573,115,French Toast® Belted Uniform Skirt - Girls 3749203 Khaki 14,Apparel & Accessories > Apparel > Skirts > Girls
1574,115,French Toast Pleated Skort - Preschool Girls 4-6x,Apparel & Accessories > Apparel > Skirts > Girls
