,category_id,description,category_path
2268,115,Girls' pull-on skirt with tulle hem / 4-5 / ROSE DUST,Apparel & Accessories > Apparel > Skirts > Girls
2269,115,Girls' sequin pull-on skirt / 10 / AQUA,Apparel & Accessories > Apparel > Skirts > Girls
2270,115,"Girls Uniform Pleated Drop Waist Jumper SESAME regular,6X/7",Apparel & Accessories > Apparel > Skirts > Girls
2271,115,"Girls Uniform Pleated Skort TIDAL slim,8S",Apparel & Accessories > Apparel > Skirts > Girls
2272,115,Girls Denim Apron Skirt DENIM 6,Apparel & Accessories > Apparel > Skirts > Girls
2273,115,"Uniform Pleated Skort BISQUIT slim,8S",Apparel & Accessories > Apparel > Skirts > Girls
2274,115,"Girls Uniform Pleated Skort SESAME regular,16",Apparel & Accessories > Apparel > Skirts > Girls
2275,115,"Girls Uniform Pleated Skort SESAME slim,14S",Apparel & Accessories > Apparel > Skirts > Girls
2276,115,Girls Denim Apron Skirt DENIM 14,Apparel & Accessories > Apparel > Skirts > Girls
2277,115,"Uniform Pleated Skort SESAME regular,5",Apparel & Accessories > Apparel > Skirts > Girls
2278,115,"Girls Uniform Pleated Skort SESAME regular,5",Apparel & Accessories > Apparel > Skirts > Girls
2279,115,"Uniform Pleated Drop Waist Jumper SESAME regular,6X/7",Apparel & Accessories > Apparel > Skirts > Girls
2280,115,Plaid Skirt Lavender Plaid 5,Apparel & Accessories > Apparel > Skirts > Girls
2281,115,Neon Scooter Skirt 31258215 6 Purple,Apparel & Accessories > Apparel > Skirts > Girls
2282,115,Skooter Skirt Navy 6X,Apparel & Accessories > Apparel > Skirts > Girls
2283,115,Printed Scooter Skirt 278A974 4 Navy,Apparel & Accessories > Apparel > Skirts > Girls
2284,115,PLUSH NUMBER SWEATER 0/0547/773/625/14 13-14 years (164 cm),Apparel & Accessories > Apparel > Skirts > Girls
2285,115,Quilted cardigan 0/5992/701/401/14 13-14 years (164 cm),Apparel & Accessories > Apparel > Skirts > Girls
2286,115,Multicolored sequin sweater 0/1473/601/300/14 13-14 years (164 cm),Apparel & Accessories > Apparel > Skirts > Girls
2287,115,Furry waistcoat with belt 0/3791/704/800/26 13-14 years (164 cm),Apparel & Accessories > Apparel > Skirts > Girls
2288,115,CHECKED TROUSERS WITH ZIP POCKETS 0/0371/724/400/14 13-14 years (164 cm),Apparel & Accessories > Apparel > Skirts > Girls
2289,115,Fringed cardigan 0/1822/602/712/14 13-14 years (164 cm),Apparel & Accessories > Apparel > Skirts > Girls
2290,115,FRINGED JACKET 0/4341/502/707/14 13-14 years (164 cm),Apparel & Accessories > Apparel > Skirts > Girls
2291,115,Jacquard kimono top 0/0594/700/442/26 13-14 years (164 cm),Apparel & Accessories > Apparel > Skirts > Girls
2292,115,TEXTURED KNIT SWEATER 0/9841/603/621/14 13-14 years (164 cm),Apparel & Accessories > Apparel > Skirts > Girls
2293,115,girls' circle skirt 14 pastries print,Apparel & Accessories > Apparel > Skirts > Girls
2294,115,STARLA HALFMANN-PLATTER,Apparel & Accessories > Apparel > Skirts > Girls
2295,115,Tulle Tutu Skirt (Girls),Apparel & Accessories > Apparel > Skirts > Girls
2296,115,Girls' Pre-School UA Feather Camo Skooter FLAX 6,Apparel & Accessories > Apparel > Skirts > Girls
2297,115,Girls’ UA Pre-School Court Skooter Skort 4 CRUSH,Apparel & Accessories > Apparel > Skirts > Girls
2298,115,eloges — Teal Tutu Skirt,Apparel & Accessories > Apparel > Skirts > Girls
2299,115,Eddie Bauer — Khaki Belted Pleated Skirt - Girls,Apparel & Accessories > Apparel > Skirts > Girls
2300,115,JoyRiders — Blue Maxi Scooter,Apparel & Accessories > Apparel > Skirts > Girls
2301,115,French Toast Navy Pull-On Kick Pleat Scooter Skirt - Kids & Tween L,Apparel & Accessories > Apparel > Skirts > Girls
2302,115,IZOD — Navy Pleated Skort - Girls 5,Apparel & Accessories > Apparel > Skirts > Girls
2303,115,French Toast Navy Pull-On Kick Pleat Scooter Skirt - Toddler S,Apparel & Accessories > Apparel > Skirts > Girls
2304,115,IZOD Khaki Button Pleated Skort - Girls 12,Apparel & Accessories > Apparel > Skirts > Girls
2305,115,French Toast — Navy Double-Buckle Pleated Skort - Girls 7,Apparel & Accessories > Apparel > Skirts > Girls
2306,115,French Toast — Khaki Double-Button Pleated Skirt - Girls 12,Apparel & Accessories > Apparel > Skirts > Girls
2307,115,French Toast — Khaki Zip-Pocket Pleated Skirt - Girls 6,Apparel & Accessories > Apparel > Skirts > Girls
2308,115,Kiki Riki — White Skirt - Toddler & Girls l,Apparel & Accessories > Apparel > Skirts > Girls
2309,115,IZOD — Khaki Drop-Waist Scooter Skirt - Girls 5,Apparel & Accessories > Apparel > Skirts > Girls
2310,115,French Toast — Khaki Tab Pleated Skirt - Girls 10,Apparel & Accessories > Apparel > Skirts > Girls
2311,115,French Toast — Khaki Double-Button Pleated Skirt - Girls 4,Apparel & Accessories > Apparel > Skirts > Girls
2312,115,Nautica — Navy Belted Tab Scooter Skirt - Girls 10,Apparel & Accessories > Apparel > Skirts > Girls
2313,115,"Hello Kitty Girl's Denim Skinny Jean, Dark Indigo Denim, 8 US",Apparel & Accessories > Apparel > Skirts > Girls
2314,115,Little Girls' Box Pleat Skirt (Above The Knee) 6 Classic Navy,Apparel & Accessories > Apparel > Skirts > Girls
2315,115,Girls' Plus Elastic Waist Corduroy Tiered Skirt,Apparel & Accessories > Apparel > Skirts > Girls
2316,115,Little Girls' Print Full Gathered Woven Skirt,Apparel & Accessories > Apparel > Skirts > Girls
2317,115,Girls' Box Pleat Skirt (Above The Knee) 14 Gray,Apparel & Accessories > Apparel > Skirts > Girls
2318,115,Girls' Plus Eyelet Full Gathered Woven Skirt,Apparel & Accessories > Apparel > Skirts > Girls
2319,115,Little Girls' Full Ruffle Pattern Tiered Skort,Apparel & Accessories > Apparel > Skirts > Girls
2320,115,Girls Denim Mini Sheri 12,Apparel & Accessories > Apparel > Skirts > Girls
2321,115,Girls' gauze pull-on skirt / 8 / NAVY,Apparel & Accessories > Apparel > Skirts > Girls
2322,115,Girls' pull-on skirt in minnows 6-7 BROCADE PURPLE,Apparel & Accessories > Apparel > Skirts > Girls
2323,115,Girls' pull-on skirt in artsy floral / 3 / BLUE,Apparel & Accessories > Apparel > Skirts > Girls
2324,115,Girls' pull-on skirt with tulle hem 12 NEON DAHLIA,Apparel & Accessories > Apparel > Skirts > Girls
2325,115,Girls' pull-on eyelet skirt 14 WHITE,Apparel & Accessories > Apparel > Skirts > Girls
2326,115,Girls' pull-on skirt in mini heart / 12 / NEON PAPAYA,Apparel & Accessories > Apparel > Skirts > Girls
2327,115,Girls' pull-on skirt in minnows / 8 / BROCADE PURPLE,Apparel & Accessories > Apparel > Skirts > Girls
2328,115,Girls' pull-on skirt in neon hearts / 16 / NEON DAHLIA,Apparel & Accessories > Apparel > Skirts > Girls
2329,115,Girls' pull-on skirt with tulle hem / 14 / NAVY,Apparel & Accessories > Apparel > Skirts > Girls
2330,115,Girls' pull-on skirt in splatter floral 6-7 AZALEA MULTI,Apparel & Accessories > Apparel > Skirts > Girls
2331,115,matchables striped skort VIVID 4T,Apparel & Accessories > Apparel > Skirts > Girls
2332,115,"Girls Uniform Pleated Skort SESAME slim,8S",Apparel & Accessories > Apparel > Skirts > Girls
2333,115,"Uniform Pleated Skort BISQUIT slim,5S",Apparel & Accessories > Apparel > Skirts > Girls
2334,115,"Girls Uniform Pleated Skort SESAME slim,16S",Apparel & Accessories > Apparel > Skirts > Girls
2335,115,5-Layer Tulle TuTu Skirt Pink 5,Apparel & Accessories > Apparel > Skirts > Girls
2336,115,French Terry Scooter Skirt Mint 4,Apparel & Accessories > Apparel > Skirts > Girls
2337,115,Shiny patch top 0/5350/710/828/14 13-14 years (164 cm),Apparel & Accessories > Apparel > Skirts > Girls
2338,115,Hand embroidered knit sweater 0/6888/707/800/14 13-14 years (164 cm),Apparel & Accessories > Apparel > Skirts > Girls
2339,115,Pocket loose-fit trousers 0/1075/887/505/14 13-14 years (164 cm),Apparel & Accessories > Apparel > Skirts > Girls
2340,115,Large lace blouse 0/5584/605/250/14 13-14 years (164 cm),Apparel & Accessories > Apparel > Skirts > Girls
2341,115,PEARLIZED KNIT SWEATER 0/6458/702/420/14 13-14 years (164 cm),Apparel & Accessories > Apparel > Skirts > Girls
2342,115,FURRY CHECKED SWEATER 0/1473/705/097/14 13-14 years (164 cm),Apparel & Accessories > Apparel > Skirts > Girls
2343,115,FINE PLEATS TOP WITH BUTTERFLY 0/6208/601/251/14 13-14 years (164 cm),Apparel & Accessories > Apparel > Skirts > Girls
2344,115,Large lace blouse 0/5767/713/703/14 13-14 years (164 cm),Apparel & Accessories > Apparel > Skirts > Girls
2345,115,ZIP SHOULDER SWEATER 0/5561/600/620/14 13-14 years (164 cm),Apparel & Accessories > Apparel > Skirts > Girls
2346,115,TEXTURED TEARDROP SWEATER 0/0367/705/703/14 13-14 years (164 cm),Apparel & Accessories > Apparel > Skirts > Girls
2347,115,PRINTED TROUSERS WITH ZIP 0/5516/701/679/14 13-14 years (164 cm),Apparel & Accessories > Apparel > Skirts > Girls
2348,115,French Toast School Uniforms Two Tab Scooter Girls khaki 7,Apparel & Accessories > Apparel > Skirts > Girls
2349,115,"French Toast Girls 10-20 Plus Size Two Tab Pleated Skort (14.5 Plus, Navy)",Apparel & Accessories > Apparel > Skirts > Girls
2350,115,French Toast School Uniforms Pleated Skirt Girls black 16,Apparel & Accessories > Apparel > Skirts > Girls
2351,115,KHQ Big Girls' Plus-Size,Apparel & Accessories > Apparel > Skirts > Girls
2352,115,French Toast Plaid Two-Tab Scooter Girls,Apparel & Accessories > Apparel > Skirts > Girls
2353,115,French Toast School Uniforms Two Tab Scooter Girls black 7,Apparel & Accessories > Apparel > Skirts > Girls
2354,115,French Toast Uniforms Girls' Scooter Skort (Black 05),Apparel & Accessories > Apparel > Skirts > Girls
2355,115,"French Toast Big Girls' Pleated Scooter with Square Buckle Belt, Black, 12",Apparel & Accessories > Apparel > Skirts > Girls
2356,115,French Toast School Uniforms Plaid Two-Tab Scooter Girls blue red plaid 7,Apparel & Accessories > Apparel > Skirts > Girls
2357,115,French Toast Kick Pleat Scooter Girls Khaki 18-1/2 Plus,Apparel & Accessories > Apparel > Skirts > Girls
2358,115,French Toast Uniforms Girls' Scooter Skort (Khaki 06X),Apparel & Accessories > Apparel > Skirts > Girls
2359,115,French Toast School Uniforms Two Tab Scooter Girls khaki 6x by Various,Apparel & Accessories > Apparel > Skirts > Girls
2360,115,"Sansha Girls 2-6x Serenity Pull-on Skirt, Black, Intermediate 6-8(D)",Apparel & Accessories > Apparel > Skirts > Girls
2361,115,"French Toast Little Girls' Pleated Scooter With Grosgrain Ribbon, Black, 6X",Apparel & Accessories > Apparel > Skirts > Girls
2362,115,"Dickies Little Girls' Faux Wrap Skort - School Uniform,Dark Navy,6X Regular",Apparel & Accessories > Apparel > Skirts > Girls
2363,115,French Toast Uniforms Girls' Scooter Skort (Khaki 08),Apparel & Accessories > Apparel > Skirts > Girls
2364,115,"Capezio Little Girls' Children's Collection Circular Pull-On Skirt, Garnet, Toddler",Apparel & Accessories > Apparel > Skirts > Girls
2365,115,My Lello Big Girls 10-Layer Short Ballet Tulle Tutu Skirt (4T-8yr) -White,Apparel & Accessories > Apparel > Skirts > Girls
2366,115,"Capezio Little Girls' Children's Collection Circular Pull-On Skirt, Black, Small",Apparel & Accessories > Apparel > Skirts > Girls
2367,115,"U.S. POLO ASSN. Little Girls' Twill Skirt with Tiered Ruffle Trim, Pink Kite, 5",Apparel & Accessories > Apparel > Skirts > Girls
2368,115,"Genuine Big Girls' Classic Pleated Skirt, Khaki, 16",Apparel & Accessories > Apparel > Skirts > Girls
2369,115,French Toast School Uniforms Kick Pleat Scooter Girls khaki 8,Apparel & Accessories > Apparel > Skirts > Girls
2370,115,"Dollie & Me Little Girls' Sleeveless Skirted Leotard with Flowers, Pink, Small",Apparel & Accessories > Apparel > Skirts > Girls
2371,115,"Billabong Girls 7-16 Ever N Always Denim, Dark Rinse, 8",Apparel & Accessories > Apparel > Skirts > Girls
2372,115,Chloe Noel Figure Skating Circle York Sparkle Velvet Skirt K04 Sparkle Purple Child Small,Apparel & Accessories > Apparel > Skirts > Girls
2373,115,French Toast Pleated Hem Jumper(Toddler Sizes) Girls Khaki 3T,Apparel & Accessories > Apparel > Skirts > Girls
2374,115,Wholesale Princess Hot Pink Mini Chevron Cotton Skirt Fits 6-9 years,Apparel & Accessories > Apparel > Skirts > Girls
2375,115,Miss MeMe Girls Solid Black,Apparel & Accessories > Apparel > Skirts > Girls
2376,115,"Columbia Sportswear Girl's Silver Ridge III Short Sleeve Tech Tee (Youth), Whitened Violet, X-Small",Apparel & Accessories > Apparel > Skirts > Girls
2377,115,Tortoise & Rabbit Big Girls' Clothes Chiffon Fluffy Pettiskirts Tutu L Gray,Apparel & Accessories > Apparel > Skirts > Girls
2378,115,French Toast Plaid Pleated Skirt Girls Navy Red Plaid 18-1/2 Plus,Apparel & Accessories > Apparel > Skirts > Girls
2379,115,French Toast Plaid Pleated Skirt Girls Blue Gold Plaid 14,Apparel & Accessories > Apparel > Skirts > Girls
2380,115,French Toast School Uniforms Kick Pleat Scooter Girls navy 10,Apparel & Accessories > Apparel > Skirts > Girls
2381,115,Tortoise & Rabbit Girls' Clothes Chiffon Fluffy Pettiskirts Tutu S Hot Pink,Apparel & Accessories > Apparel > Skirts > Girls
2382,115,French Toast Plaid Two-Tab Scooter Girls Blue Gold Plaid 12,Apparel & Accessories > Apparel > Skirts > Girls
2383,115,Sansha Big Girls' Shanice Tank Leotard,Apparel & Accessories > Apparel > Skirts > Girls
2384,115,Amy Byer Big Girls' Gauze High Low Skirt,Apparel & Accessories > Apparel > Skirts > Girls
2385,115,Richie House Little Girls' Tutu with Gold Bow and Trim RH0290-1/2-FBA,Apparel & Accessories > Apparel > Skirts > Girls
2386,115,DA92 Kids Girls Cake Skirt Tutu Dancing Multi Tulle Layers Size 6 White,Apparel & Accessories > Apparel > Skirts > Girls
2387,115,French Toast School Uniforms Pleated Hem Jumper Girls navy 6x,Apparel & Accessories > Apparel > Skirts > Girls
2388,115,ABC(TM) Womens Elastic,Apparel & Accessories > Apparel > Skirts > Girls
2389,115,"Capezio Little Girls' Tutu Skirt W/ Glitter Tulle,Pink, Intermediate ( 6-8)",Apparel & Accessories > Apparel > Skirts > Girls
2390,115,"Dollie & Me Little Girls' Top and Cardi with Plaid Skirt Set, Red, 6X",Apparel & Accessories > Apparel > Skirts > Girls
2391,115,"French Toast Big Girls' Two-Tab Pleated Scooter, Burgundy, 12",Apparel & Accessories > Apparel > Skirts > Girls
2392,115,"French Toast Little Girls' Plaid Pleated Scooter, Navy/Red Plaid, 6X",Apparel & Accessories > Apparel > Skirts > Girls
2393,115,French Toast Two Tab Scooter Girls Navy 5,Apparel & Accessories > Apparel > Skirts > Girls
2394,115,"CLASSROOM Girls 7-16 Pleated Tab Scooter,Khaki,12",Apparel & Accessories > Apparel > Skirts > Girls
2395,115,Sweet Beige Girls Pleated Floral Chiffon Mini Skirt with Belt,Apparel & Accessories > Apparel > Skirts > Girls
2396,115,"French Toast Big Girls' Pleated Scooter with Gross Grain Ribbon, Navy, 7",Apparel & Accessories > Apparel > Skirts > Girls
2397,115,French Toast School Uniforms Two Tab Scooter Girls khaki 10,Apparel & Accessories > Apparel > Skirts > Girls
2398,115,"Capezio Girls 2-6X Tactel Collection Pull-On Skirt, Black, Toddler",Apparel & Accessories > Apparel > Skirts > Girls
2399,115,"Girls Tulle Ballet Tutu Skirt Fairy Angel ""Little Mystique Legs"" (White)",Apparel & Accessories > Apparel > Skirts > Girls
2400,115,Kate Mack Girl's 7-16 Denim Basics Jean,Apparel & Accessories > Apparel > Skirts > Girls
2401,115,French Toast Pleated Skirt Girls Heather Grey 10,Apparel & Accessories > Apparel > Skirts > Girls
2402,115,French Toast School Uniforms Plaid Two-Tab Scooter Girls navy red plaid 10,Apparel & Accessories > Apparel > Skirts > Girls
2403,115,"Sansha Big Girls' Serenity Pull-on Skirt, Black, Large 10-12(F)",Apparel & Accessories > Apparel > Skirts > Girls
2404,115,0-9 Years Baby Girls Tutu,Apparel & Accessories > Apparel > Skirts > Girls
2405,115,Miss MeMe Girls Solid Navy,Apparel & Accessories > Apparel > Skirts > Girls
2406,115,"Clementine Little Girls' Chiffon Pull-On Dance Skirt, Light Pink, Tall/Small",Apparel & Accessories > Apparel > Skirts > Girls
2407,115,Sweet Blue Girls Pleated Floral Chiffon Mini Skirt with Belt,Apparel & Accessories > Apparel > Skirts > Girls
2408,115,Arshiner Girls' Dance Basic Classics Chiffon Wrap Skirt,Apparel & Accessories > Apparel > Skirts > Girls
2409,115,Kosher Casual Girls' Modest Knee Length Stretchy Viscose Pencil Skirt Large Black,Apparel & Accessories > Apparel > Skirts > Girls
2410,115,French Toast® Girls' Scooter with Belt 6 - Navy,Apparel & Accessories > Apparel > Skirts > Girls
2411,115,French Toast® Girls' Scooter with Belt 6X- Khaki,Apparel & Accessories > Apparel > Skirts > Girls
2412,115,Xhilaration Junior's Scooter - Navy S(3-5),Apparel & Accessories > Apparel > Skirts > Girls
2413,115,Toddler Girls' Mini Skirt - Washed Indigo 3T,Apparel & Accessories > Apparel > Skirts > Girls
2414,115,Cherokee® Girls' School Uniform Pleated Scooter - Pita Bread 8,Apparel & Accessories > Apparel > Skirts > Girls
2415,115,French Toast® Girls' Scooter with Belt 6X - Navy,Apparel & Accessories > Apparel > Skirts > Girls
2416,115,Cherokee Girls' School Uniform Pleated Scooter - Ebony 10,Apparel & Accessories > Apparel > Skirts > Girls
2417,115,Girls' Tutu Skirt - Ebony XS,Apparel & Accessories > Apparel > Skirts > Girls
2418,115,Cherokee Juniors School Uniform Kick Pleat Skirt - Xavier Navy 1,Apparel & Accessories > Apparel > Skirts > Girls
2419,115,Dickies® Big Girls' Faux Wrap Skort - Dark Navy 16,Apparel & Accessories > Apparel > Skirts > Girls
2420,115,SONOMA Goods for Life™ Girls 4-7 Woven Eyelet Skort Pink Express 6,Apparel & Accessories > Apparel > Skirts > Girls
2421,115,SONOMA Goods for Life™ Woven Skort - Girls 4-10 Paint Stripe 6,Apparel & Accessories > Apparel > Skirts > Girls
2422,115,Girls 4-7 SONOMA Goods for Life™ Glitter Tulle Skort Floral Gray 6X,Apparel & Accessories > Apparel > Skirts > Girls
2423,115,Chaps Corduroy Pleated School Uniform Scooter - Girls 7-16 Navy 10 AVE/MED,Apparel & Accessories > Apparel > Skirts > Girls
2424,115,Chaps Pleated School Uniform Scooter - Girls 4-16 4 Khaki,Apparel & Accessories > Apparel > Skirts > Girls
2425,115,Chaps Girls 4-6x Pleated School Uniform Skort Khaki 6,Apparel & Accessories > Apparel > Skirts > Girls
2426,115,Chaps Pleated School Uniform Scooter - Girls 4-6x 5 Navy,Apparel & Accessories > Apparel > Skirts > Girls
2427,115,Jumping Beans® Scooter - Girls 4-10 RED FLOWR 5,Apparel & Accessories > Apparel > Skirts > Girls
2428,115,Chaps Corduroy Pleated School Uniform Scooter - Girls 7-16 Khaki 8 AVE/MED,Apparel & Accessories > Apparel > Skirts > Girls
2429,115,SONOMA Goods for Life™ Girls 4-7 High-Low Tee Heart Purple 5,Apparel & Accessories > Apparel > Skirts > Girls
2430,115,Jumping Beans® Printed Scooter - Girls 4-10 WT CHTAFLR 6,Apparel & Accessories > Apparel > Skirts > Girls
2431,115,Girls 4-7 SONOMA Goods for Life™ Slubbed Short Sleeve Graphic Tee Flower Girl Pink 6X,Apparel & Accessories > Apparel > Skirts > Girls
2432,115,SONOMA Goods for Life™ Woven Skort - Girls 4-10 Butterfly Teal 5,Apparel & Accessories > Apparel > Skirts > Girls
2433,115,Chaps Pleated Corduroy School Uniform Scooter - Girls 7-16 10 Navy,Apparel & Accessories > Apparel > Skirts > Girls
2434,115,SONOMA Goods for Life™ Embossed Belt Brown LARGE,Apparel & Accessories > Apparel > Skirts > Girls
2435,115,Girls 7-16 SO® Knit Waist Denim Skort Passenger 12,Apparel & Accessories > Apparel > Skirts > Girls
2436,115,Chaps Pleated Tab School Uniform Scooter - Girls 7-16 10 AVE/MED Khaki,Apparel & Accessories > Apparel > Skirts > Girls
2437,115,Girls 4-7 SONOMA Goods for Life™ Short Sleeve Graphic Tee Safari White 4,Apparel & Accessories > Apparel > Skirts > Girls
2438,115,Chaps Pleated School Uniform Scooter - Girls 7-16 12 Khaki,Apparel & Accessories > Apparel > Skirts > Girls
2439,115,Girls 4-7 SONOMA Goods for Life™ Slubbed Short Sleeve Graphic Tee Dragonfly Gray 4,Apparel & Accessories > Apparel > Skirts > Girls
2440,115,Chaps Pleated School Uniform Scooter - Girls 4-16 NAVY 12,Apparel & Accessories > Apparel > Skirts > Girls
2441,115,Dollie & Me Floral Top & Skirt Set - Girls 4-14 Blue 6,Apparel & Accessories > Apparel > Skirts > Girls
2442,115,Chaps Pleated School Uniform Scooter - Girls 4-6x,Apparel & Accessories > Apparel > Skirts > Girls
2443,115,SONOMA Goods for Life™ Woven Skort - Girls 4-10 Butterfly Teal 6,Apparel & Accessories > Apparel > Skirts > Girls
2444,115,Girls 4-7 SONOMA Goods for Life™ Sweater Knit Lace Hem Tee Bird Ivory 6,Apparel & Accessories > Apparel > Skirts > Girls
2445,115,French Toast School Uniform Scooter - Girls 7-14 Navy 10,Apparel & Accessories > Apparel > Skirts > Girls
2446,115,SONOMA Goods for Life™ Woven Skort - Girls 4-10 Paint Stripe 4,Apparel & Accessories > Apparel > Skirts > Girls
2447,115,Girls 4-7 SONOMA Goods for Life™ Sequined Sweater Fairisle Gray 7,Apparel & Accessories > Apparel > Skirts > Girls
2448,115,Chaps Pleated Corduroy School Uniform Scooter - Girls 4-6x 5 Khaki,Apparel & Accessories > Apparel > Skirts > Girls
2449,115,SONOMA Goods for Life™ Girls 4-7 Graphic Tee Daisy Girl White 7,Apparel & Accessories > Apparel > Skirts > Girls
2450,115,Girls 4-7 SONOMA Goods for Life™ Glitter Tulle Skort Floral Gray 6,Apparel & Accessories > Apparel > Skirts > Girls
2451,115,Chaps Button Pleated School Uniform Scooter - Girls 4-6x Khaki 6,Apparel & Accessories > Apparel > Skirts > Girls
2452,115,Girls 4-7 SONOMA Goods for Life™ Short Sleeve Graphic Tee SUNSHINEOT 7,Apparel & Accessories > Apparel > Skirts > Girls
2453,115,Chaps Twill School Uniform Scooter - Girls 7-16,Apparel & Accessories > Apparel > Skirts > Girls
2454,115,Chaps Drop-Waist School Uniform Scooter - Girls 7-16 10 Black,Apparel & Accessories > Apparel > Skirts > Girls
2455,115,French Toast® Pleated Skort - Girls 7-20 and Plus Khaki 20,Apparel & Accessories > Apparel > Skirts > Girls
2456,115,IZOD Belted Scooter Skirt - Girls 4-16,Apparel & Accessories > Apparel > Skirts > Girls
2457,115,IZOD® Pleated Plaid Skirt - Girls 7-16 5004510,Apparel & Accessories > Apparel > Skirts > Girls
2458,115,French Toast® Pleated Tab Skirt - Girls 7-20 and Plus Khaki 14.5 Plus,Apparel & Accessories > Apparel > Skirts > Girls
2459,115,IZOD® Basic Scooter Skirt - Girls 4-16 Plus,Apparel & Accessories > Apparel > Skirts > Girls
2460,115,French Toast® Two-Tab Scooter Skirt - Girls 7-20 and Plus 5001051,Apparel & Accessories > Apparel > Skirts > Girls
2461,115,by&by Girl Pleather-Trimmed Ponte Skirt - Girls 7-16,Apparel & Accessories > Apparel > Skirts > Girls
2462,115,IZOD® Pleated Tab Scooter 5003022 Navy 12,Apparel & Accessories > Apparel > Skirts > Girls
2463,115,OshKosh B'gosh® Plaid Twill Skirt - Girls 4-6x,Apparel & Accessories > Apparel > Skirts > Girls
2464,115,IZOD® Bow Skater Skort - Girls 7-16,Apparel & Accessories > Apparel > Skirts > Girls
2465,115,IZOD Flat-Front Skirt - Girls 4-16,Apparel & Accessories > Apparel > Skirts > Girls
2466,115,Nautica Girls' Uniform Pleated Scooter Skirt Navy 10,Apparel & Accessories > Apparel > Skirts > Girls
2467,115,"Epic Threads Little Girls' Polka Dot Tulle Skirt, Only at Macy's Violet Tul 4T",Apparel & Accessories > Apparel > Skirts > Girls
2468,115,"Nautica Uniform Pleated Scooter Skirt, Big Girls (7-16) Khaki 7",Apparel & Accessories > Apparel > Skirts > Girls
2469,115,Nautica Girls' Uniform Circle Scooter Skirt Navy 14,Apparel & Accessories > Apparel > Skirts > Girls
2470,115,Nautica Girls' Uniform Pleated Scooter Skirt Khaki 14,Apparel & Accessories > Apparel > Skirts > Girls
2471,115,Nautica Girls' Uniform Pleated Scooter Skirt Khaki 7,Apparel & Accessories > Apparel > Skirts > Girls
2472,115,Nautica Little Girls' Uniform Belted Pleated Skort Khaki 5,Apparel & Accessories > Apparel > Skirts > Girls
2473,115,"Ideology Girls' Tulle Ballet Tutu Skirt, Only at Macy's Noir XL",Apparel & Accessories > Apparel > Skirts > Girls
2474,115,Girl's Denim Skirt Girls 4-6X Medium Wash,Apparel & Accessories > Apparel > Skirts > Girls
2475,115,"Girls No Fuze ""Glitz & Glamour"" Skirt (Sizes 7 - 16)",Apparel & Accessories > Apparel > Skirts > Girls
2476,115,"Dockers Girl's Pleated Uniform Scooter - Navy Color:Navy,Size:10,Fit:Girls 7-16",Apparel & Accessories > Apparel > Skirts > Girls
2477,115,Girl's Tiered Scooter Skirt - Striped Girls 7-16 Multi-color,Apparel & Accessories > Apparel > Skirts > Girls
2478,115,Girl's Twill Scooter Skirt - Starburst Print,Apparel & Accessories > Apparel > Skirts > Girls
2479,115,Splendid Indigo Knit Mini Skirt (Toddler/Kid) - Indigo-5/6,Apparel & Accessories > Apparel > Skirts > Girls
2480,115,OshKosh B'gosh Corduroy Skirt (Toddler/Kid) - Multicolor-3T,Apparel & Accessories > Apparel > Skirts > Girls
2481,115,Llum Reversible Skirt vineyard,Apparel & Accessories > Apparel > Skirts > Girls
2482,115,Beautees Plaid Skirt Girls 7-16 Jade,Apparel & Accessories > Apparel > Skirts > Girls
2483,115,Boucle Skirt French Blue5,Apparel & Accessories > Apparel > Skirts > Girls
2484,115,Boucle Skirt French Blue10,Apparel & Accessories > Apparel > Skirts > Girls
2485,115,French Toast Navy Pull-On Kick Pleat Scooter Skirt - Toddler M,Apparel & Accessories > Apparel > Skirts > Girls
2486,115,French Toast — Navy Blue Pleated Skirt - Girls 10,Apparel & Accessories > Apparel > Skirts > Girls
2487,115,Dreamstar — White Lace Skirt - Girls 7/8,Apparel & Accessories > Apparel > Skirts > Girls
2488,115,OshKosh B'gosh — Denim Pencil Skirt - Girls 6x,Apparel & Accessories > Apparel > Skirts > Girls
2489,115,Genuine School Uniform — Navy Belted Skort - Girls 7,Apparel & Accessories > Apparel > Skirts > Girls
2490,115,Nautica Navy Pleated Scooter Skirt - Kids 6,Apparel & Accessories > Apparel > Skirts > Girls
2491,115,Capezio — Pink Twirl Skirt - Girls I,Apparel & Accessories > Apparel > Skirts > Girls
2492,115,French Toast — Purple 'OMG' Ruffle Skirt - Girls 6,Apparel & Accessories > Apparel > Skirts > Girls
2493,115,No Fuze — Denim Floral Ruffle Skirt - Girls Size 7,Apparel & Accessories > Apparel > Skirts > Girls
2494,115,French Toast Navy Pull-On Kick Pleat Scooter Skirt - Kids & Tween S,Apparel & Accessories > Apparel > Skirts > Girls
