,category_id,description,category_path
676,115,"Capezio Little Girls' Pull-On Georgette Skirt, Pink, Small",Apparel & Accessories > Apparel > Skirts > Girls
677,115,French Toast Uniforms Girls' Scooter Skort (Navy 12),Apparel & Accessories > Apparel > Skirts > Girls
678,115,"Hartstrings Little Girls' Little Girl Cotton Corduroy Skirt, Pink, 3T",Apparel & Accessories > Apparel > Skirts > Girls
679,115,"CLASSROOM Little Girls' Bow Pocket Scooter, Dark Navy, 5",Apparel & Accessories > Apparel > Skirts > Girls
680,115,"French Toast - Girls Scooter Skort School Uniform, Hunter 32861-5",Apparel & Accessories > Apparel > Skirts > Girls
681,115,French Toast Girls' Short Sleeve Pique Stretch Polo (Light Blue 06),Apparel & Accessories > Apparel > Skirts > Girls
682,115,French Toast School Uniforms Plaid Two-Tab Scooter Girls blue gold plaid 16,Apparel & Accessories > Apparel > Skirts > Girls
683,115,"Eddie Bauer Big Girls' Twill Scooter with Reversible Belt, Navy, 10",Apparel & Accessories > Apparel > Skirts > Girls
684,115,LittleSpring Little Girls' Skirt Set Birthday Size 5 Sky-blue,Apparel & Accessories > Apparel > Skirts > Girls
685,115,"Capezio Little Girls' Pull-On Sequined Skirt, Pink, T (2-4)",Apparel & Accessories > Apparel > Skirts > Girls
686,115,Jessica Simpson Little Girls' Bitsy Utility Short,Apparel & Accessories > Apparel > Skirts > Girls
687,115,Genuine Big Girls' Twill Pleated Scooter with Hip Tab Detail,Apparel & Accessories > Apparel > Skirts > Girls
688,115,Ruum Big Girls' Pleather Moto Skirt Black Size 6,Apparel & Accessories > Apparel > Skirts > Girls
689,115,American Apparel Youth Cotton Spandex Jersey Wide Waistband Skirt - Black / 10 Years,Apparel & Accessories > Apparel > Skirts > Girls
690,115,French Toast School Uniforms Plaid Two-Tab Scooter Girls navy red plaid 6,Apparel & Accessories > Apparel > Skirts > Girls
691,115,"French Toast Big Girls' Pleated Skirt, Black, 8",Apparel & Accessories > Apparel > Skirts > Girls
692,115,"Sansha Little Girls' Serenity Pull-on Skirt, White, Small 4-6",Apparel & Accessories > Apparel > Skirts > Girls
693,115,Lucky Brand Little Girls' Sofia Denim Mini,Apparel & Accessories > Apparel > Skirts > Girls
694,115,Kosher Casual Girls' Modest Knee Length Flared Denim Skirt Size 10 Stonewash Black,Apparel & Accessories > Apparel > Skirts > Girls
695,115,"Dickies Big Girls' Faux Wrap Skort - School Uniform,Dark Navy,10 Regular",Apparel & Accessories > Apparel > Skirts > Girls
696,115,ZEBRA PETTISKIRT,Apparel & Accessories > Apparel > Skirts > Girls
697,115,"No Fuze Little Girls' ""X-Wave"" Skirt",Apparel & Accessories > Apparel > Skirts > Girls
698,115,"CLASSROOM Juniors Kick Pleat Skirt, Dark Navy, 15/16",Apparel & Accessories > Apparel > Skirts > Girls
699,115,Tortoise & Rabbit® Little,Apparel & Accessories > Apparel > Skirts > Girls
700,115,French Toast Two Tab Scooter Girls Khaki 14,Apparel & Accessories > Apparel > Skirts > Girls
701,115,"CLASSROOM Juniors Tab Pleat Scooter, Dark Navy, 15/16",Apparel & Accessories > Apparel > Skirts > Girls
702,115,French Toast School Uniforms Plaid Two-Tab Scooter Girls green plaid 12,Apparel & Accessories > Apparel > Skirts > Girls
703,115,"KHQ Big Girls' Poly Scooter, Khaki, 12",Apparel & Accessories > Apparel > Skirts > Girls
704,115,"Capezio Girl's 2-6X Children's Collection Circular Pull-On Skirt, Black, Toddler",Apparel & Accessories > Apparel > Skirts > Girls
705,115,"Capezio Little Girls' Romantic Tutu, Turquoise, One Size",Apparel & Accessories > Apparel > Skirts > Girls
706,115,"Capezio Little Girls' Romantic Tutu, Black, One Size",Apparel & Accessories > Apparel > Skirts > Girls
707,115,"Genuine Big Girls' Scooter with Side Pleats, Khaki, 8",Apparel & Accessories > Apparel > Skirts > Girls
708,115,Dickies Big Girls' Pleated Skooter,Apparel & Accessories > Apparel > Skirts > Girls
709,115,"Amy Byer Big Girls' Pleather Skirt with Laser Cut Outs, Pink, Large",Apparel & Accessories > Apparel > Skirts > Girls
710,115,Tortoise & Rabbit® Baby Girls' Clothes Chiffon Fluffy Princess Pettiskirt Tutu,Apparel & Accessories > Apparel > Skirts > Girls
711,115,French Toast Uniforms Girls' Scooter Skort (Black 06X),Apparel & Accessories > Apparel > Skirts > Girls
712,115,"Capezio Little Girls' Children's Collection Pull-On Skirt, Light Blue Hearts, Toddler",Apparel & Accessories > Apparel > Skirts > Girls
713,115,French Toast School Uniforms Pleated Hem Jumper Girls black 6,Apparel & Accessories > Apparel > Skirts > Girls
714,115,Big Girls' Two Tone Square,Apparel & Accessories > Apparel > Skirts > Girls
715,115,"French Toast - Girls Plaid Two-Tab Scooter, Blue, Red 35141-12",Apparel & Accessories > Apparel > Skirts > Girls
716,115,Somo Lite Girl's Cute Elastic Waist Pleated Mini Skirt Takedown Belt,Apparel & Accessories > Apparel > Skirts > Girls
717,115,"Capezio Big Girls' Tutu Skirt W/ Glitter Tulle,Black,M (8-10)",Apparel & Accessories > Apparel > Skirts > Girls
718,115,French Toast School Uniforms Pleated Skirt Girls,Apparel & Accessories > Apparel > Skirts > Girls
719,115,Tortoise & Rabbit® Little Girls' Ballet Tutu Dance Skirts Tutu,Apparel & Accessories > Apparel > Skirts > Girls
720,115,"The Children's Place Big Girls' Tiered Skirt, Cloud, X-Large/14",Apparel & Accessories > Apparel > Skirts > Girls
721,115,"Capezio Little Girls' Children's Collection Pull-On Skirt, Lavender Butterfly, Toddler",Apparel & Accessories > Apparel > Skirts > Girls
722,115,Girls Tulle Fluffy Pleated,Apparel & Accessories > Apparel > Skirts > Girls
723,115,"Adult Teens Ballet Tutu Skirt By ""Little Mystique Legs"" (Adult, Lavender)",Apparel & Accessories > Apparel > Skirts > Girls
724,115,"French Toast Big Girls' Front Pleated Skirt with Tabs, Black, 7",Apparel & Accessories > Apparel > Skirts > Girls
725,115,Augusta Sportswear Girls poly/spandex team skort,Apparel & Accessories > Apparel > Skirts > Girls
726,115,"Girls Tulle Ballet Tutu Skirt Fairy Angel ""Little Mystique Legs"" (Kelly Green)",Apparel & Accessories > Apparel > Skirts > Girls
727,115,"Danskin Big Girls' Wrap Skirt, Theatrical Pink, Medium/Large",Apparel & Accessories > Apparel > Skirts > Girls
728,115,Tortoise & Rabbit Big Girls' Pettiskirts Tutu L Yellow,Apparel & Accessories > Apparel > Skirts > Girls
729,115,"Amy Byer Girls 7-16 Pleather Skirt with Laser Cut Outs, Pink, Medium",Apparel & Accessories > Apparel > Skirts > Girls
730,115,Puma Little Girls' Pleated Skort Set,Apparel & Accessories > Apparel > Skirts > Girls
731,115,belababy Girls Tutu Skirts,Apparel & Accessories > Apparel > Skirts > Girls
732,115,"Capezio Little Girls' Tutu Skirt W/ Glitter Tulle,Pink,S (4-6)",Apparel & Accessories > Apparel > Skirts > Girls
733,115,Imixshopcs Organza Womens Girls Pettiskirt Tutu Adult Ballet Dance Party Skirt,Apparel & Accessories > Apparel > Skirts > Girls
734,115,"Eddie Bauer Little Girls' Pleated Skirt Jumper, Navy, 6",Apparel & Accessories > Apparel > Skirts > Girls
735,115,French Toast School Uniforms Plaid Two-Tab Scooter Girls brown plaid 18,Apparel & Accessories > Apparel > Skirts > Girls
736,115,"French Toast - Girls Plus Scooter Skort School Uniform, Gray 32882-16Plus",Apparel & Accessories > Apparel > Skirts > Girls
737,115,"No Fuze Big Girls' ""Tab Pocket"" Skirt - black, 12",Apparel & Accessories > Apparel > Skirts > Girls
738,115,"Kids Young Girl Ballet Tutu Skirt By ""Little Mystique Legs"" (Girls, Red)",Apparel & Accessories > Apparel > Skirts > Girls
739,115,Neon Orange Black Seven Layer Pointed Tutu Skirt,Apparel & Accessories > Apparel > Skirts > Girls
740,115,"Miss MeMe Girls Solid Black Pencil Skirt, Kids Size S, gs-1943-blk-s",Apparel & Accessories > Apparel > Skirts > Girls
741,115,"Tortoise & Rabbit Big Girls' Pettiskirts Tutu Skirts (L, purple)",Apparel & Accessories > Apparel > Skirts > Girls
742,115,Baby'O GIRL'S Light Blue Layered ITY Knit Apron Skirt,Apparel & Accessories > Apparel > Skirts > Girls
743,115,mobo Big Girls Jean Skirt,Apparel & Accessories > Apparel > Skirts > Girls
744,115,French Toast Kick Pleat Scooter Girls Navy 18-1/2 Plus,Apparel & Accessories > Apparel > Skirts > Girls
745,115,"No Fuze Big Girls' ""Tara"" Denim Skirt - dark denim, 12",Apparel & Accessories > Apparel > Skirts > Girls
746,115,"French Toast Big Girls' Front Pleated Skirt with Tabs, Black, 12",Apparel & Accessories > Apparel > Skirts > Girls
747,115,"Danskin Big Girls' Wrap Skirt, Ethereal Blue, Medium/Large",Apparel & Accessories > Apparel > Skirts > Girls
748,115,Hot Baby Kids Girls Princess Stars Sequins Party Dance Ballet Tutu Skirts Dress,Apparel & Accessories > Apparel > Skirts > Girls
749,115,"Columbia Sportswear Girl's Silver Ridge III Skort (Youth), Nocturnal, Medium",Apparel & Accessories > Apparel > Skirts > Girls
750,115,Scout + Ro Girls' Scooter Skirt with Shorts Underneath,Apparel & Accessories > Apparel > Skirts > Girls
751,115,Turquoise Dance or Ballet Tutu for Girls Tutu Skirts,Apparel & Accessories > Apparel > Skirts > Girls
752,115,French Toast Two Tab Scooter Girls Black 4,Apparel & Accessories > Apparel > Skirts > Girls
753,115,Girls Ballet Tutu Orange,Apparel & Accessories > Apparel > Skirts > Girls
754,115,French Toast School Uniforms Pleated Scooter with Grosgrain Ribbon Girls khaki 6,Apparel & Accessories > Apparel > Skirts > Girls
755,115,French Toast Little Girls' Pleated Scooter with Ribbon,Apparel & Accessories > Apparel > Skirts > Girls
756,115,French Toast School Uniforms Kick Pleat Scooter Girls khaki 16,Apparel & Accessories > Apparel > Skirts > Girls
757,115,French Toast School Uniforms Two Tab Scooter Girls navy 5,Apparel & Accessories > Apparel > Skirts > Girls
758,115,French Toast® Girls' Two Tab Scooter Khaki 4,Apparel & Accessories > Apparel > Skirts > Girls
759,115,Cherokeea® Girls' School Uniform Pleated Scooter - Pita Bread 6X,Apparel & Accessories > Apparel > Skirts > Girls
760,115,Cherokee® Girls' School Uniform Pleated Scooter - Pita Bread 10,Apparel & Accessories > Apparel > Skirts > Girls
761,115,Cherokee® Girls' School Uniform Pleated Scooter - Pita Bread 4,Apparel & Accessories > Apparel > Skirts > Girls
762,115,French Toast® Girls' Two Tab Scooter Khaki 6,Apparel & Accessories > Apparel > Skirts > Girls
763,115,Cherokee Toddler Girls' School Uniform Pleated Scooter - Pita Bread 2T,Apparel & Accessories > Apparel > Skirts > Girls
764,115,Dickies® Girls' Faux Wrap Skort Khaki 4,Apparel & Accessories > Apparel > Skirts > Girls
765,115,REAL SCHOOL Girls Pleat Front Scooter Skirt School Uniform Approved,Apparel & Accessories > Apparel > Skirts > Girls
766,115,"George Girls' School Uniforms, Pleated Scooter with Side Buttons 1"" x 6"" x 6""",Apparel & Accessories > Apparel > Skirts > Girls
767,115,Levis Signature Girls Denim Skirt,Apparel & Accessories > Apparel > Skirts > Girls
768,115,Girls 4-6x Chaps Pleated School Uniform Skort NAVY 6X,Apparel & Accessories > Apparel > Skirts > Girls
769,115,SONOMA Goods for Life™ Print Knit Skirt - Girls 4-7 Pink Hearts 4,Apparel & Accessories > Apparel > Skirts > Girls
770,115,Girls 4-7 SONOMA Goods for Life™ Sweater Tunic Gray 6,Apparel & Accessories > Apparel > Skirts > Girls
771,115,French Toast School Uniform Pleated Skirt - Girls 7-20 Khaki 7,Apparel & Accessories > Apparel > Skirts > Girls
772,115,Girls 4-16 Chaps Pleated School Uniform Skort Navy 7,Apparel & Accessories > Apparel > Skirts > Girls
773,115,Chaps Twill Pleated School Uniform Scooter - Girls 7-16 Navy 10,Apparel & Accessories > Apparel > Skirts > Girls
774,115,French Toast School Uniform Pleated Skirt - Girls 4-6x Navy 5,Apparel & Accessories > Apparel > Skirts > Girls
775,115,Boys 4-7 SONOMA Goods for Life™ Slubbed Short Sleeve Tee Gum Drop Green 6,Apparel & Accessories > Apparel > Skirts > Girls
776,115,Women's SONOMA Goods for Life™ Woven Wide Stretch Belt Brown L-XL,Apparel & Accessories > Apparel > Skirts > Girls
777,115,Jumping Beans® Denim Tiered Scooter - Girls 4-7 PURPLE 6,Apparel & Accessories > Apparel > Skirts > Girls
778,115,Girls 4-7 SONOMA Goods for Life™ Sweater Tunic Gray 4,Apparel & Accessories > Apparel > Skirts > Girls
779,115,Girls 4-7 SONOMA Goods for Life™ Bow Sweater BOWS IV 7,Apparel & Accessories > Apparel > Skirts > Girls
780,115,SONOMA Goods for Life™ Printed Wristlet Multi Chevron NO SIZE,Apparel & Accessories > Apparel > Skirts > Girls
781,115,Chaps Pleated School Uniform Scooter - Girls 4-6x 6 Khaki,Apparel & Accessories > Apparel > Skirts > Girls
782,115,Chaps Pleated School Uniform Scooter - Girls 7-16 8 Navy,Apparel & Accessories > Apparel > Skirts > Girls
783,115,Girls 4-7 SONOMA Goods for Life™ Short Sleeve Graphic Tee Strawberry Aqua 5,Apparel & Accessories > Apparel > Skirts > Girls
784,115,Chaps Pleated School Uniform Scooter - Girls 7-16 14 Khaki,Apparel & Accessories > Apparel > Skirts > Girls
785,115,SONOMA life + style® Woven Skort - Girls 4-10 Ditzy Purple 8,Apparel & Accessories > Apparel > Skirts > Girls
786,115,Chaps Pleated School Uniform Scooter - Girls 4-16 5 Navy,Apparel & Accessories > Apparel > Skirts > Girls
787,115,SONOMA Goods for Life™ Girls 4-7 Tiered Floral Skort Rose Pink 6,Apparel & Accessories > Apparel > Skirts > Girls
788,115,French Toast School Uniform Plaid Pleated Skirt - Girls 4-6x Green 4,Apparel & Accessories > Apparel > Skirts > Girls
789,115,Chaps Drop-Waist School Uniform Scooter - Girls 4-6x 4 Khaki,Apparel & Accessories > Apparel > Skirts > Girls
790,115,Chaps Twill Pleated School Uniform Scooter - Girls 4-6x 6 Khaki,Apparel & Accessories > Apparel > Skirts > Girls
791,115,Girls 4-7 SONOMA Goods for Life™ Popcorn Yarn Bolero Sweater Black Tie 5,Apparel & Accessories > Apparel > Skirts > Girls
792,115,SONOMA Goods for Life™ Woven Skort - Girls 4-10 Ditzy Purple 5,Apparel & Accessories > Apparel > Skirts > Girls
793,115,SONOMA Goods for Life™ Lexy Fringed Crossbody Bag Cognac NO SIZE,Apparel & Accessories > Apparel > Skirts > Girls
794,115,Girls 4-7 SONOMA Goods for Life™ Striped Boyfriend Cardigan Ash Heather 4,Apparel & Accessories > Apparel > Skirts > Girls
795,115,French Toasta® Two-Tab Scooter Skirt - Girls 7-20 and Plus,Apparel & Accessories > Apparel > Skirts > Girls
796,115,French Toast® Two-Tab Scooter Skirt - Girls 7-20 and Plus 5001051 Khaki 14,Apparel & Accessories > Apparel > Skirts > Girls
797,115,French Toast® 2-Tab Scooter Skirt Khaki 16,Apparel & Accessories > Apparel > Skirts > Girls
798,115,French Toast® Pleated Jumper - Girls 7-16,Apparel & Accessories > Apparel > Skirts > Girls
799,115,IZOD® Pleated Skort - Preschool Girls 4-6x 5008003 Khaki 5,Apparel & Accessories > Apparel > Skirts > Girls
800,115,by&by Girl Printed Maxi Skirt - Girls 7-16,Apparel & Accessories > Apparel > Skirts > Girls
801,115,French Toast® Pleated Jumper- Girls 7-20 5001059 Black 10,Apparel & Accessories > Apparel > Skirts > Girls
802,115,IZOD® Pleated Tab Scooter 5003022 Navy 7,Apparel & Accessories > Apparel > Skirts > Girls
803,115,OshKosh B'gosh® Polka Dot Twill Skirt - Girls 4-6x,Apparel & Accessories > Apparel > Skirts > Girls
804,115,"Nautica Uniform Pleated Scooter Skirt, Girls Navy 16",Apparel & Accessories > Apparel > Skirts > Girls
805,115,"Nautica Uniform Pleated Scooter Skirt, Plus Girls Khaki 18.5",Apparel & Accessories > Apparel > Skirts > Girls
806,115,"Nautica Uniform Pleated Scooter Skirt, Girls Navy 6X",Apparel & Accessories > Apparel > Skirts > Girls
807,115,"Nautica Kids Skirt, Girls Pleated Uniform Scooter Navy 14",Apparel & Accessories > Apparel > Skirts > Girls
808,115,"Nautica Uniform Pleated Scooter Skirt, Girls Navy 14",Apparel & Accessories > Apparel > Skirts > Girls
809,115,Nautica Girls' Uniform Circle Scooter Skirt Navy 7,Apparel & Accessories > Apparel > Skirts > Girls
810,115,Hello Kitty Little Girls' Skirt,Apparel & Accessories > Apparel > Skirts > Girls
811,115,"Epic Threads Little Girls' Mix & Match Ruffle Scooter Skirt, Only at Macy's Sunset Coral 3T",Apparel & Accessories > Apparel > Skirts > Girls
812,115,French Toast Little Girls' Uniform Pleated Ribbon Scooter Skirt Khaki 2T,Apparel & Accessories > Apparel > Skirts > Girls
813,115,Nautica Girls' Uniform Pleated Scooter Skirt,Apparel & Accessories > Apparel > Skirts > Girls
814,115,Girl's Denim Scooter Skirt Girls 4-6X M Dark Wash,Apparel & Accessories > Apparel > Skirts > Girls
815,115,Girl's Denim Scooter Skirt - Floral,Apparel & Accessories > Apparel > Skirts > Girls
816,115,Two Tab Scooter,Apparel & Accessories > Apparel > Skirts > Girls
817,115,NIC+ZOE Panel Twirl Skirt SILVER CLOUD M,Apparel & Accessories > Apparel > Skirts > Girls
818,115,Capezio Tutu Skirt Color: pink,Apparel & Accessories > Apparel > Skirts > Girls
819,115,French Toast Girls’ Pleated Tab Skirt 7 to 20,Apparel & Accessories > Apparel > Skirts > Girls
820,115,Tippy Green Cotton Scooter - Girls 14 Pink Mini Dot,Apparel & Accessories > Apparel > Skirts > Girls
821,115,Tulle-Trimmed Knit Skirt - Girls 06 Teal Ponies,Apparel & Accessories > Apparel > Skirts > Girls
822,115,Tippy Green Cotton Scooter - Girls 08 Pink Mini Dot,Apparel & Accessories > Apparel > Skirts > Girls
823,115,Royalty Jeanswear DENIM 3 BUTTON SKIRT,Apparel & Accessories > Apparel > Skirts > Girls
824,115,MAX JEANS Easy Denim Skirt,Apparel & Accessories > Apparel > Skirts > Girls
825,115,KYODAN Pleated Skort,Apparel & Accessories > Apparel > Skirts > Girls
826,115,Amy Byer Girls' 7-16 Metallic Striped Skater Skirt Silver M (10),Apparel & Accessories > Apparel > Skirts > Girls
827,115,Zara lace skirt,Apparel & Accessories > Apparel > Skirts > Girls
828,115,French Toast Girls Front Pleated Skirt with Tabs,Apparel & Accessories > Apparel > Skirts > Girls
829,115,French Toast® Girls' Two Tab Scooter Navy 14,Apparel & Accessories > Apparel > Skirts > Girls
830,115,Girls' Tutu Skirt - Pink M,Apparel & Accessories > Apparel > Skirts > Girls
831,115,Dickies® Girls' Faux Wrap Skort - Dark Navy 8,Apparel & Accessories > Apparel > Skirts > Girls
832,115,Cherokee® Girls' School Uniform Pleated Scooter - Ebony 14,Apparel & Accessories > Apparel > Skirts > Girls
833,115,Cherokee Juniors School Uniform Kick Pleat Skirt - Xavier Navy 9,Apparel & Accessories > Apparel > Skirts > Girls
834,115,French Toast® Girls' Two Tab Scooter Khaki 8,Apparel & Accessories > Apparel > Skirts > Girls
835,115,French Toast Girls' Two Tab Scooter Khaki 7,Apparel & Accessories > Apparel > Skirts > Girls
836,115,French Toast Girls' School Uniform 2-Tab Scooter - Khaki 4,Apparel & Accessories > Apparel > Skirts > Girls
837,115,Chaps Pleated School Uniform Scooter - Girls 4-16 Khaki 10,Apparel & Accessories > Apparel > Skirts > Girls
838,115,Girls 4-7 SONOMA Goods for Life™ Sequined Sweater Shine Black 4,Apparel & Accessories > Apparel > Skirts > Girls
839,115,Girls 4-7 SONOMA Goods for Life™ Sequined Sweater Geo Ivory 5,Apparel & Accessories > Apparel > Skirts > Girls
840,115,French Toast School Uniform Pleated Skort - Girls 7-20 Khaki 8,Apparel & Accessories > Apparel > Skirts > Girls
841,115,SONOMA Goods for Life™ Woven Skort - Girls 4-10 Paint Stripe 5,Apparel & Accessories > Apparel > Skirts > Girls
842,115,Girls 4-10 Jumping Beans® Contrast Waistband Skort Pink Express 6,Apparel & Accessories > Apparel > Skirts > Girls
843,115,Girls 4-16 Chaps School Uniform Pleated Skort Navy 5,Apparel & Accessories > Apparel > Skirts > Girls
844,115,SONOMA Goods for Life™ Girls 4-7 High-Low Tee Butterfly White 7,Apparel & Accessories > Apparel > Skirts > Girls
845,115,Girls 4-6x Chaps Pleated School Uniform Button-Accent Skort Navy 6X,Apparel & Accessories > Apparel > Skirts > Girls
846,115,Girls 4-16 & Plus Chaps Pleated School Uniform Button-Accent Skort Khaki 6X,Apparel & Accessories > Apparel > Skirts > Girls
847,115,Chaps Pleated School Uniform Scooter - Girls 4-16 MED BEIGE 8,Apparel & Accessories > Apparel > Skirts > Girls
848,115,Girls 4-7 SONOMA Goods for Life™ Sparkle Velvet Skater Skort Black 4,Apparel & Accessories > Apparel > Skirts > Girls
849,115,Mudd Skater Skirt - Girls 7-16 12 Indigo Acid,Apparel & Accessories > Apparel > Skirts > Girls
850,115,Jumping Beans Scooter - Girls 4-7 6 Coral Dots,Apparel & Accessories > Apparel > Skirts > Girls
851,115,French Toast School Uniform Scooter - Girls 7-14 BEIG/KHAKI 14,Apparel & Accessories > Apparel > Skirts > Girls
852,115,Girls 4-7 SONOMA Goods for Life™ Short Sleeve Graphic Tee Shells White 5,Apparel & Accessories > Apparel > Skirts > Girls
853,115,Girls 4-7 SONOMA Goods for Life™ Sweater Knit Lace Hem Tee Bird Ivory 7,Apparel & Accessories > Apparel > Skirts > Girls
854,115,SONOMA Goods for Life™ Girls 4-7 Graphic Tee Daisy Girl White 5,Apparel & Accessories > Apparel > Skirts > Girls
855,115,Chaps Pleated Tab School Uniform Scooter - Girls 7-16 7 AVE/MED Khaki,Apparel & Accessories > Apparel > Skirts > Girls
856,115,Girls 4-20 French Toast School Uniform Kick Pleat Skort Navy 18-20,Apparel & Accessories > Apparel > Skirts > Girls
857,115,French Toast School Uniform Scooter - Girls 7-14 Khaki 10,Apparel & Accessories > Apparel > Skirts > Girls
858,115,Girls 4-16 & Plus Chaps Pleated School Uniform Button-Accent Skort Navy 4,Apparel & Accessories > Apparel > Skirts > Girls
859,115,Girls 4-7 SONOMA Goods for Life™ Sparkle Velvet Skater Skort Black 7,Apparel & Accessories > Apparel > Skirts > Girls
860,115,Chaps Flounce School Uniform Scooter - Girls 4-6x 4 Navy,Apparel & Accessories > Apparel > Skirts > Girls
861,115,Chaps Button Pleated School Uniform Scooter - Girls 4-6x Navy 6X,Apparel & Accessories > Apparel > Skirts > Girls
862,115,Girls 4-7 SONOMA Goods for Life™ Glitter Tulle Skort Tutu Gold 5,Apparel & Accessories > Apparel > Skirts > Girls
863,115,SO Cheetah Scooter - Girls 7-16,Apparel & Accessories > Apparel > Skirts > Girls
864,115,SO Rhinestone Denim Scooter - Girls 7-16,Apparel & Accessories > Apparel > Skirts > Girls
865,115,Girls 4-7 SONOMA Goods for Life™ Striped Boyfriend Cardigan Hot Shot Pink 7,Apparel & Accessories > Apparel > Skirts > Girls
866,115,Girls 4-7 SONOMA Goods for Life™ Tiered Printed Skort Stripe Turquoise 4,Apparel & Accessories > Apparel > Skirts > Girls
867,115,Girls 4-7 SONOMA Goods for Life™ Slubbed Short Sleeve Graphic Tee Flower Girl Pink 4,Apparel & Accessories > Apparel > Skirts > Girls
868,115,Girls 4-7 SONOMA Goods for Life™ Sequined Sweater Snowflake Aqua 7,Apparel & Accessories > Apparel > Skirts > Girls
869,115,French Toast® Pleated Skort - Girls 7-20 and Plus Khaki 14,Apparel & Accessories > Apparel > Skirts > Girls
870,115,French Toast® Pleated Jumper- Girls 7-20 5001059,Apparel & Accessories > Apparel > Skirts > Girls
871,115,French Toast® Pleated Skirt - Girls 7-20 and Plus 5001079 Black 14 Plus,Apparel & Accessories > Apparel > Skirts > Girls
872,115,IZODa® Basic Scooter Skirt - Girls 4-16 and Plus,Apparel & Accessories > Apparel > Skirts > Girls
873,115,French Toast Two-Tab Scooter Skirt - Girls 7-20 and Plus,Apparel & Accessories > Apparel > Skirts > Girls
874,115,French Toast® Pleated Skirt - Girls 7-20 and Plus 5001060 Heather Gray 8,Apparel & Accessories > Apparel > Skirts > Girls
875,115,French Toast® Pleated Skirt - Girls 7-20 and Plus 5001079 Black 20 Plus,Apparel & Accessories > Apparel > Skirts > Girls
876,115,Nautica Girls' Uniform Circle Scooter Skirt Khaki 16,Apparel & Accessories > Apparel > Skirts > Girls
877,115,Nautica Girls' Uniform Pleated Scooter Skirt Navy 14,Apparel & Accessories > Apparel > Skirts > Girls
878,115,Nautica Girls' Uniform Circle Scooter Skirt Khaki 7,Apparel & Accessories > Apparel > Skirts > Girls
879,115,Girl's Scooter Skirt Girls 7-16 Blue Heather,Apparel & Accessories > Apparel > Skirts > Girls
880,115,Girls Navy Uniform Skirt with Buckle,Apparel & Accessories > Apparel > Skirts > Girls
881,115,OshKosh B'gosh Striped Woven Skirt (Toddler/Kid) - Coral-3T,Apparel & Accessories > Apparel > Skirts > Girls
882,115,Design History Sequined Heart Skirt - Gray-5,Apparel & Accessories > Apparel > Skirts > Girls
883,115,"Capezio Toddler Pull-on Skirt, Pink Flowers-2/4T",Apparel & Accessories > Apparel > Skirts > Girls
884,115,"Capezio Circular Pull-On Skirt, Black-Infant",Apparel & Accessories > Apparel > Skirts > Girls
885,115,Eddie Bauer Twill Kick Pleat Scooter navy 4,Apparel & Accessories > Apparel > Skirts > Girls
886,115,Diamante trousers 0/0327/701/800/14 13-14 years (164 cm),Apparel & Accessories > Apparel > Skirts > Girls
887,115,J Khaki™ Chambray Skirt Girls 4-6X Light Wash,Apparel & Accessories > Apparel > Skirts > Girls
888,115,Zara Striped Skirt,Apparel & Accessories > Apparel > Skirts > Girls
889,115,Express sequined skirt,Apparel & Accessories > Apparel > Skirts > Girls
890,115,Zara denim skirt,Apparel & Accessories > Apparel > Skirts > Girls
891,115,Zara | Gathered Blue Circle Skirt,Apparel & Accessories > Apparel > Skirts > Girls
892,115,Zara midi denim skirt,Apparel & Accessories > Apparel > Skirts > Girls
893,115,Brynn Chambray Skirt,Apparel & Accessories > Apparel > Skirts > Girls
894,115,Girls 4-20 Pleated Skirt,Apparel & Accessories > Apparel > Skirts > Girls
895,115,Toddler Kick Pleat Scooter (Khaki),Apparel & Accessories > Apparel > Skirts > Girls
896,115,"Two Tab Scooter Girls 4-6X,Size:6",Apparel & Accessories > Apparel > Skirts > Girls
897,115,"Girls Blue-Gold Plaid Two Tab Scooter Girls 7-16,Size:10",Apparel & Accessories > Apparel > Skirts > Girls
898,115,Brooks Brothers Girls' Two Tone Eyelet Skirt - Sizes 4-16 6 Turquoise,Apparel & Accessories > Apparel > Skirts > Girls
899,115,"French Toast Big Girls' Front Pleated Skirt with Tabs, Grey, 12",Apparel & Accessories > Apparel > Skirts > Girls
900,115,Taiycyxgan Girl's Black Waist Tutu Assorted Colors Ballet Dance Mini Skirts,Apparel & Accessories > Apparel > Skirts > Girls
901,115,Genuine Big Girls' Brushed Twill Zip Front Jumper,Apparel & Accessories > Apparel > Skirts > Girls
902,115,French Toast Big Girls' Two Tab Pleated Skirt - Burgundy - 8,Apparel & Accessories > Apparel > Skirts > Girls
