,category_id,description,category_path
473,324,fee brothers old fashioned,Grocery & Gourmet Food > Beverages > Cocktail Mixers
474,324,"adam elmegirab, aphrodite bitters",Grocery & Gourmet Food > Beverages > Cocktail Mixers
475,324,tomr's handcrafted 200 ml,Grocery & Gourmet Food > Beverages > Cocktail Mixers
476,324,Janna Salak Designs Food and Drink - Beer Lover Series Pint - 10x10 inch quilt square (qs_217259_1),Grocery & Gourmet Food > Beverages > Cocktail Mixers
477,324,"Mr & Mrs T, Margarita Mix, 5.5 Ounce Cans (Pack of 4)",Grocery & Gourmet Food > Beverages > Cocktail Mixers
478,324,"Pat O'Brien's World Famous Hurricane Cocktail Mix, Set of 3",Grocery & Gourmet Food > Beverages > Cocktail Mixers
479,324,tabasco bloody mary mix,Grocery & Gourmet Food > Beverages > Cocktail Mixers
480,324,"stirrings, simple syrup, 12 oz (pack of 2)",Grocery & Gourmet Food > Beverages > Cocktail Mixers
481,324,Molecule-R Gin And Tonic Mixology Kit Set,Grocery & Gourmet Food > Beverages > Cocktail Mixers
482,324,"Roses Cocktail Infusions Blue Raspberry Drink Mix, 20 Ounce -- 9 per case.",Grocery & Gourmet Food > Beverages > Cocktail Mixers
483,324,mr & mrs t margarita mix,Grocery & Gourmet Food > Beverages > Cocktail Mixers
484,324,go cocktails! sugar free margarita cocktail mix (box of 8 single packets),Grocery & Gourmet Food > Beverages > Cocktail Mixers
485,324,"bar-tenders martini cocktail mix apple-tini, cosmo, & lemon drop 3 pack",Grocery & Gourmet Food > Beverages > Cocktail Mixers
486,324,"the modern cocktail toppers variety pack, champagne, 11.8 ounce",Grocery & Gourmet Food > Beverages > Cocktail Mixers
487,324,"Mr. & Mrs. T Mai Tai Mix, 33.81-Ounce Bottles (Pack of 6)",Grocery & Gourmet Food > Beverages > Cocktail Mixers
488,324,Zing Zang 64 Oz Bloody Mary Mix (Pack of 2),Grocery & Gourmet Food > Beverages > Cocktail Mixers
489,324,fee brothers jasmine flower water - 4 oz,Grocery & Gourmet Food > Beverages > Cocktail Mixers
490,324,fee brothers cherry bitters - 4 oz - pack of 2,Grocery & Gourmet Food > Beverages > Cocktail Mixers
491,324,"cocktail rx shaker, blue hawaiian, 8-ounce",Grocery & Gourmet Food > Beverages > Cocktail Mixers
492,324,bloody halloween 16 oz,Grocery & Gourmet Food > Beverages > Cocktail Mixers
493,324,the bitter end thai cocktail bitters - 2 oz,Grocery & Gourmet Food > Beverages > Cocktail Mixers
494,324,stirrings blood orange,Grocery & Gourmet Food > Beverages > Cocktail Mixers
495,324,bloody mary mixer sampler pack - set of 3,Grocery & Gourmet Food > Beverages > Cocktail Mixers
496,324,master of mixes big bucket,Grocery & Gourmet Food > Beverages > Cocktail Mixers
497,324,lemon drop rimming sugar,Grocery & Gourmet Food > Beverages > Cocktail Mixers
498,324,houdini electric cocktail mixer,Grocery & Gourmet Food > Beverages > Cocktail Mixers
499,324,master of mixes strawberry daiquirimargarita mixer 175,Grocery & Gourmet Food > Beverages > Cocktail Mixers
500,324,"master of mixes margarita mixer, 1.75 l (pack of 6)",Grocery & Gourmet Food > Beverages > Cocktail Mixers
501,324,"clamato original tomato cocktail, 5.5 fl oz, 6 pack",Grocery & Gourmet Food > Beverages > Cocktail Mixers
502,324,"fat and juicy bloody mary mix, 32 fl oz, (pack of 12)",Grocery & Gourmet Food > Beverages > Cocktail Mixers
503,324,fee brothers falernum cocktail mixer: 32 oz,Grocery & Gourmet Food > Beverages > Cocktail Mixers
504,324,"cocktail rx shaker, cranberry, 8-ounce",Grocery & Gourmet Food > Beverages > Cocktail Mixers
505,324,cocktail mix franco's lemon bar mix 6 oz.single pouch/ 1 quart,Grocery & Gourmet Food > Beverages > Cocktail Mixers
506,324,fat tuesday,Grocery & Gourmet Food > Beverages > Cocktail Mixers
507,324,fee brothers limited run bitters 2 pack - gin barrel-aged orange & whiskey barrel-aged aromatic bitters - 5 oz,Grocery & Gourmet Food > Beverages > Cocktail Mixers
508,324,demitri's bloody mary seasoning classic recipe (6x8oz),Grocery & Gourmet Food > Beverages > Cocktail Mixers
509,324,shrub & co. wildflower honey cocktail shrub syrup - 16 oz,Grocery & Gourmet Food > Beverages > Cocktail Mixers
510,324,bittermens orchard street celery shrub cocktail bitters - 5 oz,Grocery & Gourmet Food > Beverages > Cocktail Mixers
511,324,el guapo bitters orgeat,Grocery & Gourmet Food > Beverages > Cocktail Mixers
512,324,filthy olive brine juice,Grocery & Gourmet Food > Beverages > Cocktail Mixers
513,324,"bittermens hopped grapefruit bitters from brooklyn, ny",Grocery & Gourmet Food > Beverages > Cocktail Mixers
514,324,"bittercube, orange bitters",Grocery & Gourmet Food > Beverages > Cocktail Mixers
515,324,Powell & Mahoney Sriracha Bloody Mary Cocktail Mixer 36190,Grocery & Gourmet Food > Beverages > Cocktail Mixers
516,324,bloody mary mixer sampler,Grocery & Gourmet Food > Beverages > Cocktail Mixers
517,324,fee bros. peach bitters,Grocery & Gourmet Food > Beverages > Cocktail Mixers
518,324,"rose's lime juice, 25-ounce",Grocery & Gourmet Food > Beverages > Cocktail Mixers
519,324,fernet - branca - unici,Grocery & Gourmet Food > Beverages > Cocktail Mixers
520,324,Bloody Amazing Mary Mix,Grocery & Gourmet Food > Beverages > Cocktail Mixers
521,324,bloody buna by lida mayo,Grocery & Gourmet Food > Beverages > Cocktail Mixers
522,324,"cocktail mixer, cosmoplitn, 25.36 oz (pack of 6 )",Grocery & Gourmet Food > Beverages > Cocktail Mixers
523,324,powell & mahoney margarita vintage original cocktail mixer - 750 ml,Grocery & Gourmet Food > Beverages > Cocktail Mixers
524,324,"Finest Call Premium Lime Sour Drink Mix, 1 Liter Bottle",Grocery & Gourmet Food > Beverages > Cocktail Mixers
525,324,demitri's bloody mary mixes,Grocery & Gourmet Food > Beverages > Cocktail Mixers
526,324,jack rudy tonic syrup,Grocery & Gourmet Food > Beverages > Cocktail Mixers
527,324,ready to use frusheez slush mix - margarita - 1/2 gallon,Grocery & Gourmet Food > Beverages > Cocktail Mixers
528,324,bar-tender's martini cocktail drink mixes 6 ct (pack of 2) (lemon drop),Grocery & Gourmet Food > Beverages > Cocktail Mixers
529,324,W&P Design Bloody Mary Carry On Cocktail Kit MAS CARRY KIT BM,Grocery & Gourmet Food > Beverages > Cocktail Mixers
530,324,"amoretti pomegranate martini cocktail mix, 28 fl oz",Grocery & Gourmet Food > Beverages > Cocktail Mixers
531,324,bittermens hellfire habanero shrub bitters - 5oz,Grocery & Gourmet Food > Beverages > Cocktail Mixers
532,324,bare organic mixers - margarita - 1 l,Grocery & Gourmet Food > Beverages > Cocktail Mixers
533,324,"Finest Call Strawberry Puree Premium Mix, 33.8 Oz 1 Bottle",Grocery & Gourmet Food > Beverages > Cocktail Mixers
534,324,Fee Brothers Falernum Cocktail Mixer: 12.7 oz,Grocery & Gourmet Food > Beverages > Cocktail Mixers
535,324,"American Beverage Marketers Margarita Mix, 96 Ounce",Grocery & Gourmet Food > Beverages > Cocktail Mixers
536,324,finest call premium passion,Grocery & Gourmet Food > Beverages > Cocktail Mixers
537,324,City Martini Cocktail Glasses 6oz / 175ml - Set of 6,Grocery & Gourmet Food > Beverages > Cocktail Mixers
538,324,urban moonshine organic bitters collection - set of 3,Grocery & Gourmet Food > Beverages > Cocktail Mixers
539,324,"Molecule-R Cuisine R-Evolution 2nd Generation Kit, 0.12 lb",Grocery & Gourmet Food > Beverages > Cocktail Mixers
540,324,señor pepino series,Grocery & Gourmet Food > Beverages > Cocktail Mixers
541,324,pat o'brien's world famous,Grocery & Gourmet Food > Beverages > Cocktail Mixers
542,324,Whiskey Willy's Original Bloody Mary Mix - (2 Pack of 32 Fl. Oz. Bottles),Grocery & Gourmet Food > Beverages > Cocktail Mixers
543,324,fee brothers rhubarb cocktail bitters - 5 oz - 2 pack,Grocery & Gourmet Food > Beverages > Cocktail Mixers
544,324,fee brothers orange bitters 5oz.,Grocery & Gourmet Food > Beverages > Cocktail Mixers
545,324,fee brothers bar cocktail bitters - set of 3,Grocery & Gourmet Food > Beverages > Cocktail Mixers
546,324,angostura bitters drink,Grocery & Gourmet Food > Beverages > Cocktail Mixers
547,324,"master of mixes martini mix sour apple, 33.81-ounce",Grocery & Gourmet Food > Beverages > Cocktail Mixers
548,324,Fee bros. Orange Bitters,Grocery & Gourmet Food > Beverages > Cocktail Mixers
549,324,RIPE Classic Lemon Sour Bar Juice®,Grocery & Gourmet Food > Beverages > Cocktail Mixers
550,324,"Master of Mixes Strawberry Daiquiri Mix, 33.81-Ounce (Pack of 6)",Grocery & Gourmet Food > Beverages > Cocktail Mixers
551,324,"wine-a-rita mix-it-up: five delicious margarita flavor packets - make a great drink with mix, ice, wine and a blender",Grocery & Gourmet Food > Beverages > Cocktail Mixers
552,324,"salsacrazy habanero bloody mary mix - dominate the dance floor by salsacrazy, 25 fl. oz.",Grocery & Gourmet Food > Beverages > Cocktail Mixers
553,324,Stirrings Dirty Martini Mixer 12 Oz -Pack of 6,Grocery & Gourmet Food > Beverages > Cocktail Mixers
554,324,pinckney bend classic tonic syrup,Grocery & Gourmet Food > Beverages > Cocktail Mixers
555,324,Fat Mama's Knock-You-Naked Strawberry Margarita Mix,Grocery & Gourmet Food > Beverages > Cocktail Mixers
556,324,fat mama's knock-you naked margarita mix - set of 2,Grocery & Gourmet Food > Beverages > Cocktail Mixers
557,324,"Cavendish & Harvey Sour Cherry Drops, 5.3 oz Tins in a BlackTie Box (Pack of 3)",Grocery & Gourmet Food > Beverages > Cocktail Mixers
558,324,Baja Bob's Sugar Free Mai Tai Mix - 32 oz.,Grocery & Gourmet Food > Beverages > Cocktail Mixers
559,324,Jigger 1 oz. X 2 oz. Stainless Steel,Grocery & Gourmet Food > Beverages > Cocktail Mixers
560,324,mr & mrs t bold & spicy,Grocery & Gourmet Food > Beverages > Cocktail Mixers
561,324,The Bitter Truth Cocktail Bitters Traveler`s Set,Grocery & Gourmet Food > Beverages > Cocktail Mixers
562,324,"powell and mahoney margarita cocktail mixer, 25.36 ounce -- 6 per case.",Grocery & Gourmet Food > Beverages > Cocktail Mixers
563,324,scrappy's bitters classic gift box,Grocery & Gourmet Food > Beverages > Cocktail Mixers
564,324,margarita,Grocery & Gourmet Food > Beverages > Cocktail Mixers
565,324,powell & mahoney cocktail mixer bloody mary sriracha,Grocery & Gourmet Food > Beverages > Cocktail Mixers
566,324,scrappy's bitters sampler #1,Grocery & Gourmet Food > Beverages > Cocktail Mixers
567,324,"fee brothers ""fee foam"" cocktail foamer - 4 oz",Grocery & Gourmet Food > Beverages > Cocktail Mixers
568,324,demitri's bloody mary,Grocery & Gourmet Food > Beverages > Cocktail Mixers
569,324,fee brothers aztec chocolate cocktail bitters 5oz,Grocery & Gourmet Food > Beverages > Cocktail Mixers
570,324,the modern cocktail toppers,Grocery & Gourmet Food > Beverages > Cocktail Mixers
571,324,dr. swami & bone daddy's top shelf margarita mix 32 oz.,Grocery & Gourmet Food > Beverages > Cocktail Mixers
572,324,Clear Flint 1/2 Gallon Glass Jug,Grocery & Gourmet Food > Beverages > Cocktail Mixers
573,324,v8 original bloody mary mix 46oz,Grocery & Gourmet Food > Beverages > Cocktail Mixers
574,324,"skinny cocktail mix, raspberry rhubarb",Grocery & Gourmet Food > Beverages > Cocktail Mixers
575,324,"williams-sonoma skinny margarita mix, mango passion",Grocery & Gourmet Food > Beverages > Cocktail Mixers
576,324,williams-sonoma white peach bellini mix,Grocery & Gourmet Food > Beverages > Cocktail Mixers
577,324,"Gold Medal Ready to Use Frusheez Slush Mix Half Gallon, Margarita, 6 Pound",Grocery & Gourmet Food > Beverages > Cocktail Mixers
578,324,fee brothers old fashion aromatic bitters 5oz misc.,Grocery & Gourmet Food > Beverages > Cocktail Mixers
579,324,dailys fruit mixers grenadine syrup,Grocery & Gourmet Food > Beverages > Cocktail Mixers
580,324,bittermilk no.1 bourbon,Grocery & Gourmet Food > Beverages > Cocktail Mixers
581,324,fee brothers cherry cocktail bitters - 5 oz - 2 pack,Grocery & Gourmet Food > Beverages > Cocktail Mixers
582,324,BG Reynolds' Original Orgeat Cocktail Syrup 375 ml,Grocery & Gourmet Food > Beverages > Cocktail Mixers
583,324,"regan's orange bitters no. 6, 10 ounces",Grocery & Gourmet Food > Beverages > Cocktail Mixers
584,324,stirrings lemon drop (6x25.4 oz),Grocery & Gourmet Food > Beverages > Cocktail Mixers
585,324,stirrings cosmopolitan 25.4,Grocery & Gourmet Food > Beverages > Cocktail Mixers
586,324,El Guapo Lime Cordial Syrup plastic bottle (8.5oz),Grocery & Gourmet Food > Beverages > Cocktail Mixers
587,324,"Mr & Mrs T Mai Tai Mix, 1 L bottles (Pack of 12)",Grocery & Gourmet Food > Beverages > Cocktail Mixers
588,324,"angostura aromatic bitters, 16oz",Grocery & Gourmet Food > Beverages > Cocktail Mixers
589,324,tomr's handcrafted 750 ml tonic artisanal quinine syrup concentrate,Grocery & Gourmet Food > Beverages > Cocktail Mixers
590,324,"master of mixes lite sweet n' sour no sugar added, 33.8 fl. oz. 1 bottle",Grocery & Gourmet Food > Beverages > Cocktail Mixers
591,324,liber & co. real grenadine (17oz),Grocery & Gourmet Food > Beverages > Cocktail Mixers
592,324,Keurig Kold Rita's & Tina's Classic Margarita,Grocery & Gourmet Food > Beverages > Cocktail Mixers
593,324,fee brothers old fashion,Grocery & Gourmet Food > Beverages > Cocktail Mixers
594,324,pat o'brien's hurricane cocktail mix,Grocery & Gourmet Food > Beverages > Cocktail Mixers
595,324,"Amoretti Premium Martini Cocktail Mix, Key Lime, 28 Ounce",Grocery & Gourmet Food > Beverages > Cocktail Mixers
596,324,powell & mahoney lemon sour with bitters vintage original cocktail mixer - 750 ml,Grocery & Gourmet Food > Beverages > Cocktail Mixers
597,324,liber & co. classic gum,Grocery & Gourmet Food > Beverages > Cocktail Mixers
598,324,fee brothers west indian,Grocery & Gourmet Food > Beverages > Cocktail Mixers
599,324,mixer cosmopolitan cocktail (6 bottles) 25.40 ounces,Grocery & Gourmet Food > Beverages > Cocktail Mixers
600,324,pat o'brien's hurricane mix (5 pack),Grocery & Gourmet Food > Beverages > Cocktail Mixers
601,324,"finest call sweet n sour, 33.8-ounce (pack of 6)",Grocery & Gourmet Food > Beverages > Cocktail Mixers
602,324,zing zang 64 oz bloody mary mix,Grocery & Gourmet Food > Beverages > Cocktail Mixers
603,324,"Finest Call Premium Grenadine Syrup Drink Mix, 1 Liter Bottle",Grocery & Gourmet Food > Beverages > Cocktail Mixers
604,324,KraftKote Kit - 1/2 Gallon,Grocery & Gourmet Food > Beverages > Cocktail Mixers
605,324,bar brasilia,Grocery & Gourmet Food > Beverages > Cocktail Mixers
606,324,"stirrings authentic grenadine cocktail mixer, 12 ounce -- 6 per case.",Grocery & Gourmet Food > Beverages > Cocktail Mixers
607,324,fee brothers rhubarb cocktail bitters - 4 oz (pack of 2),Grocery & Gourmet Food > Beverages > Cocktail Mixers
608,324,baja bob's rainbow pack (6 bottles),Grocery & Gourmet Food > Beverages > Cocktail Mixers
609,324,mr & mrs t daiquiri,Grocery & Gourmet Food > Beverages > Cocktail Mixers
610,324,Finest Call Zesty Bloody Mary Drink Mix 1 Litre (33.8 Fl. Oz),Grocery & Gourmet Food > Beverages > Cocktail Mixers
611,324,lucas chamoy sweet and sour,Grocery & Gourmet Food > Beverages > Cocktail Mixers
612,324,"bittermens, boston bittahs, cocktail bitters 4 oz",Grocery & Gourmet Food > Beverages > Cocktail Mixers
613,324,fee brothers grenadine syrup: 375ml. (12.7 oz.),Grocery & Gourmet Food > Beverages > Cocktail Mixers
614,324,"Jello Shot Recipes: 55 Fun & Creative Jello Shot Recipes for your Party (Jello Shots, Jelly Shots, Party Recipes",Grocery & Gourmet Food > Beverages > Cocktail Mixers
615,324,"trader tiki's, falernum bitters - 5 oz.",Grocery & Gourmet Food > Beverages > Cocktail Mixers
616,324,"Scrappy's Exotic Cocktail Bitters Collection, Full Size Bottles, Set of 4 -",Grocery & Gourmet Food > Beverages > Cocktail Mixers
617,324,"Stirrings Traditional Margarita Cocktail Mixer, 750 ml, 6 ct",Grocery & Gourmet Food > Beverages > Cocktail Mixers
618,324,Liber & Co. Pineapple Gum Syrup (17oz),Grocery & Gourmet Food > Beverages > Cocktail Mixers
619,324,Baja Bob's Sugar Free Original Margarita Mix - Singles,Grocery & Gourmet Food > Beverages > Cocktail Mixers
620,324,Powell & Mahoney Clarified Lime Juice 375ml (12.68oz),Grocery & Gourmet Food > Beverages > Cocktail Mixers
621,324,bittermilk cocktail mixer,Grocery & Gourmet Food > Beverages > Cocktail Mixers
622,324,"gold medal ready to use frusheez slush mix half gallon, lemon, 6 pound (pack of 6)",Grocery & Gourmet Food > Beverages > Cocktail Mixers
623,324,mcclures bloody mary mix 1 gallon,Grocery & Gourmet Food > Beverages > Cocktail Mixers
624,324,pickles bloody mary mixer,Grocery & Gourmet Food > Beverages > Cocktail Mixers
625,324,fee brothers grenadine syrup: 4 oz,Grocery & Gourmet Food > Beverages > Cocktail Mixers
626,324,"mr. & mrs. t bloody mary mix, 5.5-ounce (pack of 24) grocery",Grocery & Gourmet Food > Beverages > Cocktail Mixers
627,324,baja bob's pina colada mix,Grocery & Gourmet Food > Beverages > Cocktail Mixers
628,324,fee brothers orange bitters - 4 oz pack of 2,Grocery & Gourmet Food > Beverages > Cocktail Mixers
629,324,daily's 64 oz. peach,Grocery & Gourmet Food > Beverages > Cocktail Mixers
630,324,finest call premium triple,Grocery & Gourmet Food > Beverages > Cocktail Mixers
631,324,demitri's chipotle-habanero,Grocery & Gourmet Food > Beverages > Cocktail Mixers
632,324,master of mixes martini lemon drop martini mix - 375 ml bottle,Grocery & Gourmet Food > Beverages > Cocktail Mixers
633,324,"Master Of Mixes Tom Collins Mix, 33.81 oz, 3 pk",Grocery & Gourmet Food > Beverages > Cocktail Mixers
634,324,Janna Salak Designs Food and Drink - Beer Lover Series Tulip - 16x16 inch Pillow Case (pc_217261_1),Grocery & Gourmet Food > Beverages > Cocktail Mixers
635,324,aromatic cocktail bitters,Grocery & Gourmet Food > Beverages > Cocktail Mixers
636,324,Hella Bitter Salt and Pepper 2 Pack,Grocery & Gourmet Food > Beverages > Cocktail Mixers
637,324,"angostura orange bitter, 4 ounce -- 12 per case.",Grocery & Gourmet Food > Beverages > Cocktail Mixers
638,324,mr. & mrs. envelopes,Grocery & Gourmet Food > Beverages > Cocktail Mixers
639,324,"bitters xl ""triple play"" variety 3-pack: angostura, peychauds and regans",Grocery & Gourmet Food > Beverages > Cocktail Mixers
640,324,Fee Brothers Peach Cocktail Bitters - 5 oz - 2 Pack,Grocery & Gourmet Food > Beverages > Cocktail Mixers
641,324,dr. heather duncan's christmas cocktail bitters by adam elmegirab - 3.38 oz,Grocery & Gourmet Food > Beverages > Cocktail Mixers
642,324,fee brothers grapefruit,Grocery & Gourmet Food > Beverages > Cocktail Mixers
643,324,Fee Brothers Orange,Grocery & Gourmet Food > Beverages > Cocktail Mixers
644,324,Bittermilk Cocktail Mixer Variety Pack - Includes Bittermilk No.1 No.2 No.3,Grocery & Gourmet Food > Beverages > Cocktail Mixers
645,324,el guapo mojo cubano bitters - bright citrus flavors,Grocery & Gourmet Food > Beverages > Cocktail Mixers
646,324,Jordan's Skinny Mixes - Sugar Free Mojito,Grocery & Gourmet Food > Beverages > Cocktail Mixers
647,324,Margarita Mix - Delicious Frozen Drinks Made with Wine - Peach Bellini - By Wine-A-Rita 12 oz (340 g),Grocery & Gourmet Food > Beverages > Cocktail Mixers
648,324,"master of mixes pina colada mixer, 1 l",Grocery & Gourmet Food > Beverages > Cocktail Mixers
649,324,mr mrs t bold spicy bloody mary mix 175 l,Grocery & Gourmet Food > Beverages > Cocktail Mixers
650,324,"Margaritaville, Margarita Mix, 1.75 Liter (Pack of 6)",Grocery & Gourmet Food > Beverages > Cocktail Mixers
651,324,skinny blackberry margarita,Grocery & Gourmet Food > Beverages > Cocktail Mixers
652,324,"stirrings margarita drink rimmer, 3.5-ounce tin",Grocery & Gourmet Food > Beverages > Cocktail Mixers
653,324,"Margaritaville Margarita Mix, 1.75 L bottles (Pack of 6)",Grocery & Gourmet Food > Beverages > Cocktail Mixers
654,324,bittercube bitters sampler,Grocery & Gourmet Food > Beverages > Cocktail Mixers
655,324,wine-a-rita mix - delicious frozen drinks made with wine - senorita - by wine-a-rita,Grocery & Gourmet Food > Beverages > Cocktail Mixers
656,324,master of mixes tom collins,Grocery & Gourmet Food > Beverages > Cocktail Mixers
657,324,bradley's kina tonic syrup,Grocery & Gourmet Food > Beverages > Cocktail Mixers
658,324,"Mr & Mrs T Horseradish Bloody Mary Mix, 1 L bottles (Pack of 12)",Grocery & Gourmet Food > Beverages > Cocktail Mixers
659,324,shrub & co. spicy ginger cocktail shrub syrup - 16 oz,Grocery & Gourmet Food > Beverages > Cocktail Mixers
660,324,"Bittermilk No.3 Smoked Honey Whiskey Sour Cocktail Mix, 16.9 oz",Grocery & Gourmet Food > Beverages > Cocktail Mixers
661,324,Cocktail Classics&reg; 5-Flavor Jelly Bean Gift Box,Grocery & Gourmet Food > Beverages > Cocktail Mixers
662,324,lefty o'doul's margarita mix,Grocery & Gourmet Food > Beverages > Cocktail Mixers
663,324,Dirty Martini Olive Juice 12.7 Ounce,Grocery & Gourmet Food > Beverages > Cocktail Mixers
664,324,dirty martini party pack of,Grocery & Gourmet Food > Beverages > Cocktail Mixers
665,324,wasska mexican margarita mixer limon 4.4 3 pack,Grocery & Gourmet Food > Beverages > Cocktail Mixers
666,324,the skinny mixes - strawberry daiquiri,Grocery & Gourmet Food > Beverages > Cocktail Mixers
667,324,fee brothers black walnut bitters 5oz misc.,Grocery & Gourmet Food > Beverages > Cocktail Mixers
668,324,"hella bitters, citrus,5 ounce",Grocery & Gourmet Food > Beverages > Cocktail Mixers
669,324,Pumpkin Caramel- Jordan's Skinny Mixes,Grocery & Gourmet Food > Beverages > Cocktail Mixers
670,324,fee brothers gin barrel-aged orange bitters 5oz,Grocery & Gourmet Food > Beverages > Cocktail Mixers
671,324,demitri's bloody mary mixes 8 oz variety pack - set of 4,Grocery & Gourmet Food > Beverages > Cocktail Mixers
672,324,fee brothers black walnut bitters 5oz,Grocery & Gourmet Food > Beverages > Cocktail Mixers
673,324,Fee Brothers Cranberry Bitters 4oz,Grocery & Gourmet Food > Beverages > Cocktail Mixers
674,324,trader tiki's/b.g,Grocery & Gourmet Food > Beverages > Cocktail Mixers
675,324,"SuckerPunch Gourmet Bloody Mary Mix 32 Ounce, Pack of 3",Grocery & Gourmet Food > Beverages > Cocktail Mixers
676,324,pink drink camouflage,Grocery & Gourmet Food > Beverages > Cocktail Mixers
677,324,"master of mixes rim sugar martini gold cosmo, 3.5 ounce",Grocery & Gourmet Food > Beverages > Cocktail Mixers
678,324,"Berg & Hauck's, lemon Bitters",Grocery & Gourmet Food > Beverages > Cocktail Mixers
679,324,liber & co. real grenadine (8.5oz),Grocery & Gourmet Food > Beverages > Cocktail Mixers
680,324,fee brothers lemon cocktail bitters - pack of 2,Grocery & Gourmet Food > Beverages > Cocktail Mixers
681,324,Margaritaville Margarita Mix - 33.8 oz (1L),Grocery & Gourmet Food > Beverages > Cocktail Mixers
682,324,purplicious wine slushie mix,Grocery & Gourmet Food > Beverages > Cocktail Mixers
683,324,shrub & co. grapefruit,Grocery & Gourmet Food > Beverages > Cocktail Mixers
684,324,daily's 64 oz. strawberry daiquiri & margarita mix,Grocery & Gourmet Food > Beverages > Cocktail Mixers
685,324,"Scrappy's Bitters, Classic Sampler Pack, 4 count, 0.5 ounce each",Grocery & Gourmet Food > Beverages > Cocktail Mixers
686,324,salsacrazy habanero bloody,Grocery & Gourmet Food > Beverages > Cocktail Mixers
687,324,fee brothers gin,Grocery & Gourmet Food > Beverages > Cocktail Mixers
688,324,margaritaville ad1200,Grocery & Gourmet Food > Beverages > Cocktail Mixers
689,324,Blue Mai Tai EZ-Jello Shot Mix 6.78 oz,Grocery & Gourmet Food > Beverages > Cocktail Mixers
690,324,dailys 64 oz. raspberry mix,Grocery & Gourmet Food > Beverages > Cocktail Mixers
691,324,Fee Brothers Aztec Chocolate Cocktail Bitters - 5 oz - 2 Pack,Grocery & Gourmet Food > Beverages > Cocktail Mixers
692,324,Bg Reynolds Falernum 750 Ml,Grocery & Gourmet Food > Beverages > Cocktail Mixers
693,324,"Tabasco Bloody Mary Mix, Original, 32 Ounce",Grocery & Gourmet Food > Beverages > Cocktail Mixers
694,324,msrf bar plus+ party,Grocery & Gourmet Food > Beverages > Cocktail Mixers
695,324,fee brothers bar cocktail bitters - set of 6,Grocery & Gourmet Food > Beverages > Cocktail Mixers
696,324,"gold medal ready to use frusheez slush mix half gallon, cherry, 6 pound (pack of 6)",Grocery & Gourmet Food > Beverages > Cocktail Mixers
697,324,fee brothers plum cocktail bitters - 5 oz - 2 pack,Grocery & Gourmet Food > Beverages > Cocktail Mixers
698,324,fee brothers west indian orange bitters 4oz,Grocery & Gourmet Food > Beverages > Cocktail Mixers
699,324,mr. & mrs. wrapped,Grocery & Gourmet Food > Beverages > Cocktail Mixers
700,324,Baja Bob's Rainbow 6-Pack (6 bottles),Grocery & Gourmet Food > Beverages > Cocktail Mixers
701,324,the bitter side of sweet,Grocery & Gourmet Food > Beverages > Cocktail Mixers
702,324,urban moonshine organic,Grocery & Gourmet Food > Beverages > Cocktail Mixers
703,324,"stirrings, simple syrup, 12 oz (6-pack)",Grocery & Gourmet Food > Beverages > Cocktail Mixers
704,324,"Finest Call Premium Sweet and Sour Lite Drink Mix, 1 Liter Bottle",Grocery & Gourmet Food > Beverages > Cocktail Mixers
705,324,peychauds bitters 5 oz,Grocery & Gourmet Food > Beverages > Cocktail Mixers
706,324,Angostura Bitters Aromatic & Orange,Grocery & Gourmet Food > Beverages > Cocktail Mixers
707,324,wigle organic rosemary lavender cocktail bitters (3.4 fl oz),Grocery & Gourmet Food > Beverages > Cocktail Mixers
708,324,daily's pina colada mix 64oz,Grocery & Gourmet Food > Beverages > Cocktail Mixers
709,324,"mr & mrs t, original bloody",Grocery & Gourmet Food > Beverages > Cocktail Mixers
710,324,"pickles, bloody mary mixer, 32 oz (pack of 6 )",Grocery & Gourmet Food > Beverages > Cocktail Mixers
711,324,Hella Bitters Smoked Chili Cocktail Bitters - 5 oz,Grocery & Gourmet Food > Beverages > Cocktail Mixers
712,324,fee,Grocery & Gourmet Food > Beverages > Cocktail Mixers
713,324,"3.5oz Stirrings Lemon Drop Martini Rimmer Cocktail Garnish, Pack of 2",Grocery & Gourmet Food > Beverages > Cocktail Mixers
714,324,ready to use frusheez slush mix - strawberry daiquiri - 1/2 gallon,Grocery & Gourmet Food > Beverages > Cocktail Mixers
715,324,hurricane mix gallon pat,Grocery & Gourmet Food > Beverages > Cocktail Mixers
716,324,haag 4/09 and 12/1 shingle,Grocery & Gourmet Food > Beverages > Cocktail Mixers
