,category_id,description,category_path
956,324,mr & mrs t margarita mix - 59.00 fl oz,Grocery & Gourmet Food > Beverages > Cocktail Mixers
957,324,rose's cocktail mix - traditi - 21.00 fl oz,Grocery & Gourmet Food > Beverages > Cocktail Mixers
958,324,stirrings simple syrup (12 oz),Grocery & Gourmet Food > Beverages > Cocktail Mixers
959,324,bloody bold bloody mary mix 32oz,Grocery & Gourmet Food > Beverages > Cocktail Mixers
960,324,10. pasta margarita,Grocery & Gourmet Food > Beverages > Cocktail Mixers
961,324,6. red snapper,Grocery & Gourmet Food > Beverages > Cocktail Mixers
962,324,slice of margarita,Grocery & Gourmet Food > Beverages > Cocktail Mixers
963,324,BITTERMILK NO2 TOM COLLIN WHITE M,Grocery & Gourmet Food > Beverages > Cocktail Mixers
964,324,"be mixed zero-calorie cocktail mixer, margarita - (4ct, 4fl oz ea)",Grocery & Gourmet Food > Beverages > Cocktail Mixers
965,324,"powell & mahoney 1937 original recipe margarita, handcrafted all-natural cocktail mixer - (750ml)",Grocery & Gourmet Food > Beverages > Cocktail Mixers
966,324,tres agaves organic margarita mix - 1 liter,Grocery & Gourmet Food > Beverages > Cocktail Mixers
967,324,mr & mrs t bloody mary mix original - 4-5.5 fl. oz.,Grocery & Gourmet Food > Beverages > Cocktail Mixers
968,324,jose cuervo strawberry margarita mix - 1 liter,Grocery & Gourmet Food > Beverages > Cocktail Mixers
969,324,dr swami & bone daddys margarita mix - 1 liter,Grocery & Gourmet Food > Beverages > Cocktail Mixers
970,324,master of mixes mixer gourmet bloody mary 5 pepper - 1.75 liter,Grocery & Gourmet Food > Beverages > Cocktail Mixers
971,324,"powell & mahoney powell & mahoney cocktail mixer, lemon sour & bitters, 75...",Grocery & Gourmet Food > Beverages > Cocktail Mixers
972,324,mr & mrs t mr & mrs t original bloody mary mix 1.75 lt,Grocery & Gourmet Food > Beverages > Cocktail Mixers
973,324,"powell & mahone powell & mahoney peach bellini cocktail mixer, 25.36 oz",Grocery & Gourmet Food > Beverages > Cocktail Mixers
974,324,master of mixes master of mixes masters of mixers cosmopolitan martini mi...,Grocery & Gourmet Food > Beverages > Cocktail Mixers
975,324,powell & mahoney powell & mahoney medium heat jalapeno margarita cocktail ...,Grocery & Gourmet Food > Beverages > Cocktail Mixers
976,324,dr. swami & bone daddy's top shelf top shelf margarita mix 32 oz.,Grocery & Gourmet Food > Beverages > Cocktail Mixers
977,324,finest call margarita mix - 33.8 fl oz bottle,Grocery & Gourmet Food > Beverages > Cocktail Mixers
978,324,"jose cuervo margarita mix, light, classic lime - 59.2 fl oz",Grocery & Gourmet Food > Beverages > Cocktail Mixers
979,324,stirrings simple syrup - 12 fl oz bottle,Grocery & Gourmet Food > Beverages > Cocktail Mixers
980,324,mr & mrs t mai tai mix - 33.8 fl oz bottle,Grocery & Gourmet Food > Beverages > Cocktail Mixers
981,324,finest call grenadine syrup - 1 l bottle,Grocery & Gourmet Food > Beverages > Cocktail Mixers
982,324,lefty o'doul's bloody mary mix - 3...,Grocery & Gourmet Food > Beverages > Cocktail Mixers
983,324,fee brothers orange flower water - 4 fl oz bottle,Grocery & Gourmet Food > Beverages > Cocktail Mixers
984,324,"tres agaves margarita mix, organic - 33.8 fl oz bottle",Grocery & Gourmet Food > Beverages > Cocktail Mixers
985,324,"master of mixes sweet n' sour mixer, lite - 33.8 fl oz",Grocery & Gourmet Food > Beverages > Cocktail Mixers
986,324,- tres agaves organic margarita mix,Grocery & Gourmet Food > Beverages > Cocktail Mixers
987,324,master of mixes sweetened lime juice from concentrate cocktail essentials,Grocery & Gourmet Food > Beverages > Cocktail Mixers
988,324,bloody mary mix,Grocery & Gourmet Food > Beverages > Cocktail Mixers
989,324,aromatic bitters,Grocery & Gourmet Food > Beverages > Cocktail Mixers
990,324,bacardi margarita mixers,Grocery & Gourmet Food > Beverages > Cocktail Mixers
991,324,jose cuervo margarita mix,Grocery & Gourmet Food > Beverages > Cocktail Mixers
992,324,"mr & mrs t horseradish bloody mary mix, 33.8 fl oz",Grocery & Gourmet Food > Beverages > Cocktail Mixers
993,324,"peychauds bitters 35.0% abv, 5 fl oz",Grocery & Gourmet Food > Beverages > Cocktail Mixers
994,324,"suckerpunch, spicy bloody mary mix, 32 fl oz",Grocery & Gourmet Food > Beverages > Cocktail Mixers
995,324,bacardi mixers margarita,Grocery & Gourmet Food > Beverages > Cocktail Mixers
996,324,"powell & mahoney cocktail mixer, margarita, 25.36 ounce",Grocery & Gourmet Food > Beverages > Cocktail Mixers
997,324,"mcilhenny tabasco spicy bloody mary mix, 32 oz",Grocery & Gourmet Food > Beverages > Cocktail Mixers
998,324,margaritaville foo margarita mix - 59.17 fl oz,Grocery & Gourmet Food > Beverages > Cocktail Mixers
999,324,master of mixes pina colada mixer - 59.20 fl oz,Grocery & Gourmet Food > Beverages > Cocktail Mixers
1000,324,peychaud bitters,Grocery & Gourmet Food > Beverages > Cocktail Mixers
1001,324,scrappy's orange bitters,Grocery & Gourmet Food > Beverages > Cocktail Mixers
1002,324,jack rudy small grenadine (503 ml),Grocery & Gourmet Food > Beverages > Cocktail Mixers
1003,324,mcclure's bloody mary mixer - 32 oz,Grocery & Gourmet Food > Beverages > Cocktail Mixers
1004,324,jose cuervo margarita mix 1l,Grocery & Gourmet Food > Beverages > Cocktail Mixers
1005,324,virgin pina colada,Grocery & Gourmet Food > Beverages > Cocktail Mixers
1006,324,ohconcept collection — multipurpose shaker bottle set size one-size,Grocery & Gourmet Food > Beverages > Cocktail Mixers
1007,324,r-evolution variety pack,Grocery & Gourmet Food > Beverages > Cocktail Mixers
1008,324,powell & mahoney 4-pack bloody mary cocktail mixers,Grocery & Gourmet Food > Beverages > Cocktail Mixers
1009,324,Joy Martini 8oz.,Grocery & Gourmet Food > Beverages > Cocktail Mixers
1010,324,Small Batch Tonic,Grocery & Gourmet Food > Beverages > Cocktail Mixers
1011,324,Bloody Mary Drink Mix,Grocery & Gourmet Food > Beverages > Cocktail Mixers
1012,324,"skinny williams-sonoma margarita mix, key lime, set of 6",Grocery & Gourmet Food > Beverages > Cocktail Mixers
1013,324,"williams-sonoma ginger mule cocktail mix, pomegranate",Grocery & Gourmet Food > Beverages > Cocktail Mixers
1014,324,urban moonshine organic bitters gluten free citrus -- 2 fl oz,Grocery & Gourmet Food > Beverages > Cocktail Mixers
1015,324,powell & mahoney essential entertaining bar se,Grocery & Gourmet Food > Beverages > Cocktail Mixers
1016,324,"powell & mahoney 1945 original recipe peach bellini, handcrafted all-natural cocktail mixer - (750ml)",Grocery & Gourmet Food > Beverages > Cocktail Mixers
1017,324,master of mixes sweet'n sour mixer - (1.75l),Grocery & Gourmet Food > Beverages > Cocktail Mixers
1018,324,master of mixes classic bloody mary mixer - (1750ml),Grocery & Gourmet Food > Beverages > Cocktail Mixers
1019,324,"powell & mahoney simple syrup, handcrafted all-natural cocktail mixer - (375ml)",Grocery & Gourmet Food > Beverages > Cocktail Mixers
1020,324,mr & mrs t horseradish bloody mary mix 1 ltr btl,Grocery & Gourmet Food > Beverages > Cocktail Mixers
1021,324,master of mixes sweet 'n sour mixer 1 ltr btl,Grocery & Gourmet Food > Beverages > Cocktail Mixers
1022,324,lefty o douls margarita mix - 1 liter,Grocery & Gourmet Food > Beverages > Cocktail Mixers
1023,324,mr & mrs t margarita mix - 1 liter,Grocery & Gourmet Food > Beverages > Cocktail Mixers
1024,324,mr & mrs t original bloody mary mix - 1.75 liter,Grocery & Gourmet Food > Beverages > Cocktail Mixers
1025,324,"stirrings stirrings all natural cocktail mix, pomegranate martini, ...",Grocery & Gourmet Food > Beverages > Cocktail Mixers
1026,324,mr & mrs t mr & mrs t original bloody mary mix 1.75 lt 1.75 liter original bloody,Grocery & Gourmet Food > Beverages > Cocktail Mixers
1027,324,"roland roland dirty martini olive juice, 25.4 oz",Grocery & Gourmet Food > Beverages > Cocktail Mixers
1028,324,"angostura angostura aromatic bitters, 4 oz",Grocery & Gourmet Food > Beverages > Cocktail Mixers
1029,324,"powell & mahoney powell & mahoney cocktail mixer peach bellini, 25.36 flui...",Grocery & Gourmet Food > Beverages > Cocktail Mixers
1030,324,powell & mahone powell & mahoney margarita vintage original cocktail mixe...,Grocery & Gourmet Food > Beverages > Cocktail Mixers
1031,324,angostura angostura aromatic cocktail bitters - 4 ounce bottle,Grocery & Gourmet Food > Beverages > Cocktail Mixers
1032,324,modern cocktails margarita variety pack,Grocery & Gourmet Food > Beverages > Cocktail Mixers
1033,324,molecule-r molecular mixology kit,Grocery & Gourmet Food > Beverages > Cocktail Mixers
1034,324,rose's cocktail infusions sour apple mix - 20 fl oz bottle,Grocery & Gourmet Food > Beverages > Cocktail Mixers
1035,324,stirrings simple margarita cocktail mixer - 25.4 fl oz bottle,Grocery & Gourmet Food > Beverages > Cocktail Mixers
1036,324,peychauds aromatic cocktail bitters - 5 fl oz bottle - [35.0 %/1/5 fl oz],Grocery & Gourmet Food > Beverages > Cocktail Mixers
1037,324,"mr & mrs t bloody mary mix, horseradish - 33.8 fl oz bottle",Grocery & Gourmet Food > Beverages > Cocktail Mixers
1038,324,finest call margarita mix - 1 lt,Grocery & Gourmet Food > Beverages > Cocktail Mixers
1039,324,"master mixes margarita mixer, lite - 59.2 fl oz",Grocery & Gourmet Food > Beverages > Cocktail Mixers
1040,324,"master of mixes mixer, pina colada - 33.8 fl oz",Grocery & Gourmet Food > Beverages > Cocktail Mixers
1041,324,"la paz triple sec mix, non-alcohol...",Grocery & Gourmet Food > Beverages > Cocktail Mixers
1042,324,"demitris bloody mary seasoning, cl...",Grocery & Gourmet Food > Beverages > Cocktail Mixers
1043,324,finest call premium passion fruit puree drink mixer 1 liter,Grocery & Gourmet Food > Beverages > Cocktail Mixers
1044,324,master of mixes real cherry & pomegranate juice grenadine syrup cocktail essentials,Grocery & Gourmet Food > Beverages > Cocktail Mixers
1045,324,margaritaville margarita mix 1.75 liter bottle,Grocery & Gourmet Food > Beverages > Cocktail Mixers
1046,324,"jose cuervo margarita mix, 1000 ml",Grocery & Gourmet Food > Beverages > Cocktail Mixers
1047,324,"mcclure's bloody mary mixer, 32 ounce",Grocery & Gourmet Food > Beverages > Cocktail Mixers
1048,324,"stirrings, simple margarita cocktail mix, 25.4 fl oz",Grocery & Gourmet Food > Beverages > Cocktail Mixers
1049,324,master of mixes mango daquiri margarit - 33.80 fl oz,Grocery & Gourmet Food > Beverages > Cocktail Mixers
1050,324,mr. & mrs. bag,Grocery & Gourmet Food > Beverages > Cocktail Mixers
1051,324,dr swami bloody mary mix (32 oz),Grocery & Gourmet Food > Beverages > Cocktail Mixers
1052,324,jose cuervo margarita mix lite,Grocery & Gourmet Food > Beverages > Cocktail Mixers
1053,324,big daddy's bloody mary mix,Grocery & Gourmet Food > Beverages > Cocktail Mixers
1054,324,zing zang bloody mary mix 64oz,Grocery & Gourmet Food > Beverages > Cocktail Mixers
1055,324,dr swami bloody mary mix,Grocery & Gourmet Food > Beverages > Cocktail Mixers
1056,324,rose's lime juice (12 oz),Grocery & Gourmet Food > Beverages > Cocktail Mixers
1057,324,rose's lime juice (25 oz),Grocery & Gourmet Food > Beverages > Cocktail Mixers
1058,324,mr & mrs t's margarita mix,Grocery & Gourmet Food > Beverages > Cocktail Mixers
1059,324,3. meat samosa (2pc),Grocery & Gourmet Food > Beverages > Cocktail Mixers
1060,324,alotta piña colada,Grocery & Gourmet Food > Beverages > Cocktail Mixers
1061,324,127. pina colada,Grocery & Gourmet Food > Beverages > Cocktail Mixers
1062,324,classic margarita,Grocery & Gourmet Food > Beverages > Cocktail Mixers
1063,324,6. samosa (2pc),Grocery & Gourmet Food > Beverages > Cocktail Mixers
1064,324,Molecule-R Flavors Mixology Kit CUISINE REVOLUTION ONE SIZE,Grocery & Gourmet Food > Beverages > Cocktail Mixers
1065,324,Bittermilk Gingerbread Old Fashioned Mix bright red One Size,Grocery & Gourmet Food > Beverages > Cocktail Mixers
1066,324,adams & co. — patchwork 'believe' tile sign set size one-size,Grocery & Gourmet Food > Beverages > Cocktail Mixers
1067,324,Nightmarket Candle Hot Buttered Rum One Size,Grocery & Gourmet Food > Beverages > Cocktail Mixers
1068,324,Owl's Brew Cocktail Mixer OXFORD ONE SIZE,Grocery & Gourmet Food > Beverages > Cocktail Mixers
1069,324,"powell & mahoney sriracha bloody mary, handcrafted all-natural cocktail mixer - (750ml)",Grocery & Gourmet Food > Beverages > Cocktail Mixers
1070,324,master of mixes strawberry daiquiri margarita mixer 1.5 ltr btl,Grocery & Gourmet Food > Beverages > Cocktail Mixers
1071,324,cosmopolitan city cocktail mixer (12/ca,Grocery & Gourmet Food > Beverages > Cocktail Mixers
1072,324,powell & mahoney mixer ccktail cosmo,Grocery & Gourmet Food > Beverages > Cocktail Mixers
1073,324,"master of mixes master of mixes cosmopolitan martini mixer, l (pack of 6)",Grocery & Gourmet Food > Beverages > Cocktail Mixers
1074,324,stirrings stirrings mojito 25.4 oz,Grocery & Gourmet Food > Beverages > Cocktail Mixers
1075,324,master of mixes cocktail mix - margarita - 1 lt,Grocery & Gourmet Food > Beverages > Cocktail Mixers
1076,324,tres agaves margarita 1l,Grocery & Gourmet Food > Beverages > Cocktail Mixers
1077,324,mr & mrs t original bloody mary mix 1 l bottle,Grocery & Gourmet Food > Beverages > Cocktail Mixers
1078,324,"master of mixes bloody mary mix, 5 pepper - 59.2 fl oz bottle",Grocery & Gourmet Food > Beverages > Cocktail Mixers
1079,324,finest call bloody mary mix - 750 ml bottle,Grocery & Gourmet Food > Beverages > Cocktail Mixers
1080,324,powell & mahoney margarita mix,Grocery & Gourmet Food > Beverages > Cocktail Mixers
1081,324,stirrings dirty martini imported olive brine cocktail mixer,Grocery & Gourmet Food > Beverages > Cocktail Mixers
1082,324,kroger brand natural beef burgers 6 in a box,Grocery & Gourmet Food > Beverages > Cocktail Mixers
1083,324,bold & spicy bloody mary mix,Grocery & Gourmet Food > Beverages > Cocktail Mixers
1084,324,tabasco extra spicy bloody mary mix,Grocery & Gourmet Food > Beverages > Cocktail Mixers
1085,324,margaritaville margarita mix,Grocery & Gourmet Food > Beverages > Cocktail Mixers
1086,324,bacardi strawberry daiquiri mix,Grocery & Gourmet Food > Beverages > Cocktail Mixers
1087,324,zing zang not just another bloody mary mix,Grocery & Gourmet Food > Beverages > Cocktail Mixers
1088,324,"urban moonshine, organic original bitters, 2 fl oz",Grocery & Gourmet Food > Beverages > Cocktail Mixers
1089,324,bacardi mixers - pina colada - 10.00 fl oz,Grocery & Gourmet Food > Beverages > Cocktail Mixers
1090,324,master of mixes margarita mix - 59.00 fl oz,Grocery & Gourmet Food > Beverages > Cocktail Mixers
1091,324,jose cuervo margarita mix - light - 59.00 fl oz,Grocery & Gourmet Food > Beverages > Cocktail Mixers
1092,324,the murph's famous bloody mary mix - 33.80 fl oz,Grocery & Gourmet Food > Beverages > Cocktail Mixers
1093,324,master mix bloody mary classic,Grocery & Gourmet Food > Beverages > Cocktail Mixers
1094,324,scrappy's lavender bitters (5 oz),Grocery & Gourmet Food > Beverages > Cocktail Mixers
1095,324,finest call mango puree,Grocery & Gourmet Food > Beverages > Cocktail Mixers
1096,324,trader vic's macadamia,Grocery & Gourmet Food > Beverages > Cocktail Mixers
1097,324,sonoma classic simple syrup,Grocery & Gourmet Food > Beverages > Cocktail Mixers
1098,324,finest call bar syrup (1 ltr),Grocery & Gourmet Food > Beverages > Cocktail Mixers
1099,324,american juice,Grocery & Gourmet Food > Beverages > Cocktail Mixers
1100,324,Jack Rudy Cocktail Co. Aromatic Bitters bitters One Size,Grocery & Gourmet Food > Beverages > Cocktail Mixers
1101,324,mojito,Grocery & Gourmet Food > Beverages > Cocktail Mixers
1102,324,powell & mahoney 6-pack champagne cocktail mixers,Grocery & Gourmet Food > Beverages > Cocktail Mixers
1103,324,Hella Bitters,Grocery & Gourmet Food > Beverages > Cocktail Mixers
1104,324,STU'S BLOODY MARY KIT,Grocery & Gourmet Food > Beverages > Cocktail Mixers
1105,324,Owl's Brew Cocktail Mixer CARBON ONE,Grocery & Gourmet Food > Beverages > Cocktail Mixers
1106,324,peychaud's bitters - 5 ounce,Grocery & Gourmet Food > Beverages > Cocktail Mixers
1107,324,"Wine-A-Rita Mix-It-Up: Five Delicious Margarita Flavor Packets - Make a Great Drink with Mix, Ice, Wine and a",Grocery & Gourmet Food > Beverages > Cocktail Mixers
1108,324,fee brothers west indian orange bitters,Grocery & Gourmet Food > Beverages > Cocktail Mixers
1109,324,Hurricane Cocktail Mix,Grocery & Gourmet Food > Beverages > Cocktail Mixers
1110,324,major peters' original bloody mary mix - 1 liter,Grocery & Gourmet Food > Beverages > Cocktail Mixers
1111,324,pat o'brien's hurricane mix and 2 hurricane glasses,Grocery & Gourmet Food > Beverages > Cocktail Mixers
1112,324,Hot Buttered Rum Batter Mix,Grocery & Gourmet Food > Beverages > Cocktail Mixers
1113,324,fee brothers orange flower,Grocery & Gourmet Food > Beverages > Cocktail Mixers
1114,324,"Stirrings, Mixer Bitters Blood Orng, 12 OZ (Pack of 6)",Grocery & Gourmet Food > Beverages > Cocktail Mixers
1115,324,fee brothers mint cocktail bitters - 5 oz - 2 pack,Grocery & Gourmet Food > Beverages > Cocktail Mixers
1116,324,jack rudy tonic syrup (2 - pack),Grocery & Gourmet Food > Beverages > Cocktail Mixers
1117,324,LAVA Premium Bloody Mary Mix,Grocery & Gourmet Food > Beverages > Cocktail Mixers
1118,324,crusty clam bloody mix - 1 liter,Grocery & Gourmet Food > Beverages > Cocktail Mixers
1119,324,"Master Mix Essentials Simple Cocktail Syrup, 12.7 Ounce -- 12 per case.",Grocery & Gourmet Food > Beverages > Cocktail Mixers
1120,324,"lt. blender's wine freezer, sangria, 9.7-ounce pouches (pack of 3)",Grocery & Gourmet Food > Beverages > Cocktail Mixers
1121,324,Bittermens Boston Bittahs - 5oz,Grocery & Gourmet Food > Beverages > Cocktail Mixers
1122,324,Jack Rudy Cocktail Grenadine Syrup 17 OZ,Grocery & Gourmet Food > Beverages > Cocktail Mixers
1123,324,Mai Tai Mix Variety Three Pack,Grocery & Gourmet Food > Beverages > Cocktail Mixers
1124,324,bob's bitters - abbott's,Grocery & Gourmet Food > Beverages > Cocktail Mixers
1125,324,Fat Mama's Knock You Naked Margarita Mix 8 Pack,Grocery & Gourmet Food > Beverages > Cocktail Mixers
1126,324,fee brothers black walnut cocktail bitters - 5 oz - 2 pack,Grocery & Gourmet Food > Beverages > Cocktail Mixers
1127,324,don robertos premium michelada mix goes great with beer (case 12 x 5 floz bottles),Grocery & Gourmet Food > Beverages > Cocktail Mixers
1128,324,"angostura aromatic bitters, 16oz (pack of 3)",Grocery & Gourmet Food > Beverages > Cocktail Mixers
1129,324,SalsaCrazy Habanero Bloody Mary Mix - Dominate the Dance Floor by SalsaCrazy,Grocery & Gourmet Food > Beverages > Cocktail Mixers
1130,324,gold medal 1056ga sour,Grocery & Gourmet Food > Beverages > Cocktail Mixers
1131,324,Master Distillers Hydrometer Test Jar (All Glass),Grocery & Gourmet Food > Beverages > Cocktail Mixers
1132,324,"stirrings cosmopolitan cocktail mixer, 750 milliliter -- 6 per case.",Grocery & Gourmet Food > Beverages > Cocktail Mixers
1133,324,angostura aromatic bitters,Grocery & Gourmet Food > Beverages > Cocktail Mixers
1134,324,"master of mixes big bucket premium margarita mixer, 96 oz",Grocery & Gourmet Food > Beverages > Cocktail Mixers
1135,324,peychauds aromatic cocktail bitters: 5 oz,Grocery & Gourmet Food > Beverages > Cocktail Mixers
1136,324,Maple Organic Bitters 8.4oz liquid by Urban Moonshine,Grocery & Gourmet Food > Beverages > Cocktail Mixers
1137,324,molecule-r mojito,Grocery & Gourmet Food > Beverages > Cocktail Mixers
1138,324,"Stirrings All-Natural, Simple Syrup Bar Ingredient, 12 Ounce Bottle",Grocery & Gourmet Food > Beverages > Cocktail Mixers
1139,324,"cocktail rx shaker, margarita flavor, 8 ounce",Grocery & Gourmet Food > Beverages > Cocktail Mixers
1140,324,"Baja Bob's Original Margarita Cocktail Mix, Sugar Free & Low Carb - 1.75 Liter",Grocery & Gourmet Food > Beverages > Cocktail Mixers
1141,324,Finest Call Premium Sweet & Sour Ready to Use,Grocery & Gourmet Food > Beverages > Cocktail Mixers
1142,324,the orange cocktail bitters,Grocery & Gourmet Food > Beverages > Cocktail Mixers
1143,324,stirrings cosmopolitan,Grocery & Gourmet Food > Beverages > Cocktail Mixers
1144,324,Cocktail Punk Enthusiast Cocktail Bitters Set - (3 x 2 oz),Grocery & Gourmet Food > Beverages > Cocktail Mixers
1145,324,fee brothers celery bitters 4oz,Grocery & Gourmet Food > Beverages > Cocktail Mixers
1146,324,Bar-Tenders Tom Collins Instant Cocktail Mix: Box - 8 Pouches,Grocery & Gourmet Food > Beverages > Cocktail Mixers
1147,324,fee brothers blue curacao,Grocery & Gourmet Food > Beverages > Cocktail Mixers
1148,324,daddy's favorite juice,Grocery & Gourmet Food > Beverages > Cocktail Mixers
1149,324,Bittermilk No 1 Cocktail Mixer,Grocery & Gourmet Food > Beverages > Cocktail Mixers
1150,324,whiskey sour bar-tenders,Grocery & Gourmet Food > Beverages > Cocktail Mixers
1151,324,"Mr & Mrs T Sweet & Sour Mix, 1.75 L bottles (Pack of 6)",Grocery & Gourmet Food > Beverages > Cocktail Mixers
1152,324,"amoretti martini cocktail mix 6 pack (28 fl oz) (blueberry, cosmopolitan, lemon drop, passion fruit, pomegranate, sour apple)",Grocery & Gourmet Food > Beverages > Cocktail Mixers
1153,324,"hella bitters, aromatic bitters, 1.7 ounce",Grocery & Gourmet Food > Beverages > Cocktail Mixers
1154,324,stu's this is bloody mary,Grocery & Gourmet Food > Beverages > Cocktail Mixers
1155,324,angostura aromatic cocktail,Grocery & Gourmet Food > Beverages > Cocktail Mixers
1156,324,urban moonshine organic bitters gluten free original -- 2 fl oz,Grocery & Gourmet Food > Beverages > Cocktail Mixers
1157,324,fee brothers cocktail sour powdered mix (10 oz.),Grocery & Gourmet Food > Beverages > Cocktail Mixers
1158,324,fee brothers celery bitters 5oz,Grocery & Gourmet Food > Beverages > Cocktail Mixers
1159,324,bar-tender's instant tom,Grocery & Gourmet Food > Beverages > Cocktail Mixers
1160,324,aromatic cocktail bitters collection - set of 5,Grocery & Gourmet Food > Beverages > Cocktail Mixers
1161,324,The Bitter Season (Kovac / Liska),Grocery & Gourmet Food > Beverages > Cocktail Mixers
1162,324,"b.g. reynold's, hibiscus grenadine drink syrup 375ml",Grocery & Gourmet Food > Beverages > Cocktail Mixers
1163,324,Bittermilk No.5 Charred Grapefruit Tonic Cocktail Mixer with Bulls Bay Sea,Grocery & Gourmet Food > Beverages > Cocktail Mixers
1164,324,Finest Call Premium Bloody Mary Drink Mixer 1 Liter,Grocery & Gourmet Food > Beverages > Cocktail Mixers
1165,324,fee brothers botanical flower water sample pack - set of 5,Grocery & Gourmet Food > Beverages > Cocktail Mixers
1166,324,"Mr & Mrs T Original Bloody Mary Mix, 11.5 fl oz cans (Pack of 24)",Grocery & Gourmet Food > Beverages > Cocktail Mixers
1167,324,el guapo bitters tonic syrup - british colonial style 16oz,Grocery & Gourmet Food > Beverages > Cocktail Mixers
1168,324,"slimrock low calorie bar mixer, mango margarita, 32 oz",Grocery & Gourmet Food > Beverages > Cocktail Mixers
1169,324,"Hella Bitters,Bundle Set, 5 Ounce",Grocery & Gourmet Food > Beverages > Cocktail Mixers
1170,324,Ready to Use Frusheez Slush Mix - Cherry - 1/2 Gallon,Grocery & Gourmet Food > Beverages > Cocktail Mixers
1171,324,bar-tenders instant cosmopolitan martini cocktail mix (6 pouches),Grocery & Gourmet Food > Beverages > Cocktail Mixers
1172,324,Zing Zang Bloody Mary Mix in 64 Oz Bottle (Case of 6),Grocery & Gourmet Food > Beverages > Cocktail Mixers
1173,324,"mr & mrs t, original bloody mary, 4 count, 5.5 ounce",Grocery & Gourmet Food > Beverages > Cocktail Mixers
1174,324,"pat o'brien's world famous hurricane cocktail mix, set of 2",Grocery & Gourmet Food > Beverages > Cocktail Mixers
1175,324,fee brothers grapefruit cocktail bitters - 5 oz - 2 pack new,Grocery & Gourmet Food > Beverages > Cocktail Mixers
1176,324,berg & hauck's original celery cocktail bitters - 4 oz,Grocery & Gourmet Food > Beverages > Cocktail Mixers
1177,324,vino ice wine and cocktail,Grocery & Gourmet Food > Beverages > Cocktail Mixers
1178,324,wine-a-rita mix-it-up: five,Grocery & Gourmet Food > Beverages > Cocktail Mixers
1179,324,mr & mrs t sweet & sour mix 1 ltr btl,Grocery & Gourmet Food > Beverages > Cocktail Mixers
1180,324,the murph's famous bloody mary mix 1 ltr btl,Grocery & Gourmet Food > Beverages > Cocktail Mixers
1181,324,master of mixes cosmopolitan martini mixer 375 ml btl,Grocery & Gourmet Food > Beverages > Cocktail Mixers
1182,324,mr & mrs t mixer sweet sour,Grocery & Gourmet Food > Beverages > Cocktail Mixers
1183,324,stirrings stirrings bloody mary 25.4 oz,Grocery & Gourmet Food > Beverages > Cocktail Mixers
1184,324,"powell & mahoney powell & mahoney cocktail mixer, low calorie margarita, 7...",Grocery & Gourmet Food > Beverages > Cocktail Mixers
1185,324,"recategorize powell & mahoney cocktail mixer, old ballycastle ginger, ...",Grocery & Gourmet Food > Beverages > Cocktail Mixers
1186,324,"master of mixes whiskey sour drink mixer, 33.8 fl oz",Grocery & Gourmet Food > Beverages > Cocktail Mixers
1187,324,lemon drop bar-tenders instant cocktail mix: box - 6 pouches,Grocery & Gourmet Food > Beverages > Cocktail Mixers
1188,324,mr & mrs t sweet & sour mix - 1 l bottle,Grocery & Gourmet Food > Beverages > Cocktail Mixers
1189,324,"la paz margarita/daiquiri mix, strawberry - 59.2 fl oz bottle",Grocery & Gourmet Food > Beverages > Cocktail Mixers
1190,324,montecito margarita mix - 1 gal bottle,Grocery & Gourmet Food > Beverages > Cocktail Mixers
1191,324,stirrings simple syrup - 12 fl oz ...,Grocery & Gourmet Food > Beverages > Cocktail Mixers
1192,324,"lefty o'doul's bloody mary mix, san francisco original - 33.8 fl oz bottle",Grocery & Gourmet Food > Beverages > Cocktail Mixers
1193,324,master of mixes pina colada mixer - 59.2 fl oz bottle,Grocery & Gourmet Food > Beverages > Cocktail Mixers
1194,324,stonewall kitchen bloody mary mixer 24oz,Grocery & Gourmet Food > Beverages > Cocktail Mixers
1195,324,mr & mrs t bloody mary mix 1 l,Grocery & Gourmet Food > Beverages > Cocktail Mixers
