,category_id,description,category_path
0,324,"Bittermilk No.1 Bourbon Barrel Aged Old Fashioned Cocktail Mix, 8.5 oz",Grocery & Gourmet Food > Beverages > Cocktail Mixers
1,324,white whale the filthy liar bold gin cocktail mixer - 8 oz,Grocery & Gourmet Food > Beverages > Cocktail Mixers
2,324,scrappy's aromatic cocktail bitters - 5 oz,Grocery & Gourmet Food > Beverages > Cocktail Mixers
3,324,"Shake, Stir, Pour-Fresh Homegrown Cocktails: Make Syrups, Mixers, Infused Spirits, and Bitters with Farm-Fresh",Grocery & Gourmet Food > Beverages > Cocktail Mixers
4,324,fat tuesday drink mix margarita mix 32oz sold each #ftmarg32-s,Grocery & Gourmet Food > Beverages > Cocktail Mixers
5,324,Demitri's Bloody Mary Seasoning Classic Recipe (Single Bottle) 8oz,Grocery & Gourmet Food > Beverages > Cocktail Mixers
6,324,el guapo lime cordial syrup,Grocery & Gourmet Food > Beverages > Cocktail Mixers
7,324,"Mr & Mrs T, Original Bloody Mary Mix, 5.5 Ounce Cans (Pack of 4)",Grocery & Gourmet Food > Beverages > Cocktail Mixers
8,324,"stu's, bloody mary",Grocery & Gourmet Food > Beverages > Cocktail Mixers
9,324,"Rose's Lime Juice, 25 Fluid Ounce (Pack of 12)",Grocery & Gourmet Food > Beverages > Cocktail Mixers
10,324,boscoli dirty martini olive,Grocery & Gourmet Food > Beverages > Cocktail Mixers
11,324,Major Peters' Original Bloody Mary Mix - 64oz,Grocery & Gourmet Food > Beverages > Cocktail Mixers
12,324,Jack Rudy Cocktail Co ~ The Tonic Trio,Grocery & Gourmet Food > Beverages > Cocktail Mixers
13,324,"bitters ""triple play"" variety 3-pack: angostura, peychauds and regans",Grocery & Gourmet Food > Beverages > Cocktail Mixers
14,324,"Gold Medal Ready to Use Frusheez Slush Mix Half Gallon, Cherry, 6 Pound (Pack",Grocery & Gourmet Food > Beverages > Cocktail Mixers
15,324,jack rudy tonic syrup (2,Grocery & Gourmet Food > Beverages > Cocktail Mixers
16,324,"mr and mrs t margarita cocktail mix, 5.5 fluid ounce - 4 per pack -- 6 packs per case.",Grocery & Gourmet Food > Beverages > Cocktail Mixers
17,324,fire and damnation bitters 4oz.,Grocery & Gourmet Food > Beverages > Cocktail Mixers
18,324,fee brothers whiskey barrel-aged bitters 5oz,Grocery & Gourmet Food > Beverages > Cocktail Mixers
19,324,world's best bloody mary mix - 4 ounce try me bottle,Grocery & Gourmet Food > Beverages > Cocktail Mixers
20,324,margarita mix - delicious frozen drinks made with wine - berry pom-a-rita - by wine-a-rita,Grocery & Gourmet Food > Beverages > Cocktail Mixers
21,324,rose's mojito passionfruit,Grocery & Gourmet Food > Beverages > Cocktail Mixers
22,324,pat o'brien's world famous hurricane cocktail mix 9 ounce - pack of 3,Grocery & Gourmet Food > Beverages > Cocktail Mixers
23,324,finest call premium mango,Grocery & Gourmet Food > Beverages > Cocktail Mixers
24,324,"Mr & Mrs T Whiskey Sour Mix, 1 L bottles (Pack of 12)",Grocery & Gourmet Food > Beverages > Cocktail Mixers
25,324,"the original dirty sue premium olive juice, 12.69-ounce bottle",Grocery & Gourmet Food > Beverages > Cocktail Mixers
26,324,shrub & co. blood orange,Grocery & Gourmet Food > Beverages > Cocktail Mixers
27,324,glass the original dirty,Grocery & Gourmet Food > Beverages > Cocktail Mixers
28,324,"cocktail candy the big apple cocktail sugar, 4-ounce tins (pack of 3)",Grocery & Gourmet Food > Beverages > Cocktail Mixers
29,324,"don chelada michelada mix cups 24-pack mix with three flavor: (original, spicy, lemon lime) just add beer",Grocery & Gourmet Food > Beverages > Cocktail Mixers
30,324,dr. adam elmegirab's teapot cocktail bitters - 3.38 oz,Grocery & Gourmet Food > Beverages > Cocktail Mixers
31,324,bittermens® xocolatl mole bitters - 5oz,Grocery & Gourmet Food > Beverages > Cocktail Mixers
32,324,powell & mahoney cocktail,Grocery & Gourmet Food > Beverages > Cocktail Mixers
33,324,fee brothers celery cocktail bitters - 5 oz - 2 pack,Grocery & Gourmet Food > Beverages > Cocktail Mixers
34,324,"Finest Call Premium Prickly Pear Drink Mix, 1 Liter Bottle",Grocery & Gourmet Food > Beverages > Cocktail Mixers
35,324,wasska pisco sour mix 4.4 oz. (3-pack),Grocery & Gourmet Food > Beverages > Cocktail Mixers
36,324,Pat O'Briens Hurricane Cocktail Mix New Orleans,Grocery & Gourmet Food > Beverages > Cocktail Mixers
37,324,"skinny mixes - cocktail variety pack , 33.8 ounce (pack of 6)",Grocery & Gourmet Food > Beverages > Cocktail Mixers
38,324,dr. adam elmegirab's,Grocery & Gourmet Food > Beverages > Cocktail Mixers
39,324,fee brothers peach bitters 5oz,Grocery & Gourmet Food > Beverages > Cocktail Mixers
40,324,"Mr & Mrs T, Original Bloody Mary Mix, 11.5 Ounce Cans (Pack of 24)",Grocery & Gourmet Food > Beverages > Cocktail Mixers
41,324,amoretti cosmopolitan martini cocktail mix (28 fl oz),Grocery & Gourmet Food > Beverages > Cocktail Mixers
42,324,The Bitter Truth Creole Bitters 200ml (6.76oz),Grocery & Gourmet Food > Beverages > Cocktail Mixers
43,324,BENDER Charleston Mix Bloody Mary Bold & Spicy 32-oz. (4 bottles & FREE Koozie!),Grocery & Gourmet Food > Beverages > Cocktail Mixers
44,324,shrub & co. tart apple cocktail shrub syrup - 16 oz,Grocery & Gourmet Food > Beverages > Cocktail Mixers
45,324,"angostura aromatic cocktail bitters, 4 oz",Grocery & Gourmet Food > Beverages > Cocktail Mixers
46,324,mr & mrs t original bloody mary mix 1.75 lt (pack of 6),Grocery & Gourmet Food > Beverages > Cocktail Mixers
47,324,"amoretti premium martini cocktail mix minis, 2 pound",Grocery & Gourmet Food > Beverages > Cocktail Mixers
48,324,molecule-r cuisine r-evolution kit 07262,Grocery & Gourmet Food > Beverages > Cocktail Mixers
49,324,skinny nite out lemon drop,Grocery & Gourmet Food > Beverages > Cocktail Mixers
50,324,slimstix sugar free mojito cocktail mix 8pk box,Grocery & Gourmet Food > Beverages > Cocktail Mixers
51,324,"Hella Bitters, Citrus Bitters, 1.7 Ounce",Grocery & Gourmet Food > Beverages > Cocktail Mixers
52,324,erica sakurazawa: the aromatic bitters,Grocery & Gourmet Food > Beverages > Cocktail Mixers
53,324,Bittermens Cocktail Bitters Collection - Set of 8 Flavors,Grocery & Gourmet Food > Beverages > Cocktail Mixers
54,324,"mr & mrs t bold and spicy bloody mary mix, 59.18 ounce (pack of 6)",Grocery & Gourmet Food > Beverages > Cocktail Mixers
55,324,the skinny mixes - margarita,Grocery & Gourmet Food > Beverages > Cocktail Mixers
56,324,"Finest Call Premium Blood Orange Sour Drink Mix, 1 Liter Bottle",Grocery & Gourmet Food > Beverages > Cocktail Mixers
57,324,"mr & mrs t original bloody mary mix, 1.75 l",Grocery & Gourmet Food > Beverages > Cocktail Mixers
58,324,the modern cocktail modern martini variety pack 1.0 ea,Grocery & Gourmet Food > Beverages > Cocktail Mixers
59,324,jalapeno-lime cocktail mix,Grocery & Gourmet Food > Beverages > Cocktail Mixers
60,324,"williams-sonoma skinny margarita mix, key lime",Grocery & Gourmet Food > Beverages > Cocktail Mixers
61,324,"skinny williams-sonoma margarita mix, pineapple habanero",Grocery & Gourmet Food > Beverages > Cocktail Mixers
62,324,williams-sonoma sweet white peach bellini mix,Grocery & Gourmet Food > Beverages > Cocktail Mixers
63,324,"williams-sonoma skinny margarita mix, strawberry-watermelon, set of 2",Grocery & Gourmet Food > Beverages > Cocktail Mixers
64,324,"powell & mahoney dirty martini, handcrafted all-natural cocktail mixer - (375ml)",Grocery & Gourmet Food > Beverages > Cocktail Mixers
65,324,jack rudy cocktail company small batch tonic syrup - (17fl oz),Grocery & Gourmet Food > Beverages > Cocktail Mixers
66,324,mr & mrs t bold & spicy bloody mary mix 1 ltr btl,Grocery & Gourmet Food > Beverages > Cocktail Mixers
67,324,margaritaville party in paradise premium margarita mix non-alcoholic 1.75 ltr,Grocery & Gourmet Food > Beverages > Cocktail Mixers
68,324,suckerpunch gourmet bloody mary mix spicy 32 oz btl,Grocery & Gourmet Food > Beverages > Cocktail Mixers
69,324,mr & mrs t bold & spicy bloody mary mix - 1.75 liter,Grocery & Gourmet Food > Beverages > Cocktail Mixers
70,324,fee brothers old fashioned aromatic bitters pack of 2,Grocery & Gourmet Food > Beverages > Cocktail Mixers
71,324,"magnoberta - fernet italian bitters, (4)- 16.9 oz. bottles",Grocery & Gourmet Food > Beverages > Cocktail Mixers
72,324,"baja bob's sugar free margarita mix, triple citrus, 32-ounce bottles (pack of 6)",Grocery & Gourmet Food > Beverages > Cocktail Mixers
73,324,"boscoli dirty martini olive juice mix, 12.7 ounce -- 12 per case.",Grocery & Gourmet Food > Beverages > Cocktail Mixers
74,324,Don Robertos Premium Michelada Mix goes Great with Beer - (CANTINERO 750ml /32 OZ Bottle),Grocery & Gourmet Food > Beverages > Cocktail Mixers
75,324,Scrappy's Bitters Classic and Exotic Gift Set Bundle,Grocery & Gourmet Food > Beverages > Cocktail Mixers
76,324,"baja bob's sugar free martini mix, sour apple, 32-ounce bottle",Grocery & Gourmet Food > Beverages > Cocktail Mixers
77,324,"Finest Call Premium Sweet & Sour Ready to Use, 1Liter (33.8 FL OZ.)",Grocery & Gourmet Food > Beverages > Cocktail Mixers
78,324,mcclures spicy bloody mary,Grocery & Gourmet Food > Beverages > Cocktail Mixers
79,324,"BG Reynolds Falernum Syrup (375ml, 1 Bottle)",Grocery & Gourmet Food > Beverages > Cocktail Mixers
80,324,"angostura orange bitters, 4-ounce(pack of 12)",Grocery & Gourmet Food > Beverages > Cocktail Mixers
81,324,"Vino Ice Wine And Cocktail Slushie Mixes in a Bag-Also makes Margaritas, Cosmos",Grocery & Gourmet Food > Beverages > Cocktail Mixers
82,324,"baja bob's original margarita mix, sugar free, 2.1-ounce packets (pack of 4)",Grocery & Gourmet Food > Beverages > Cocktail Mixers
83,324,"scales margarita mix, 0",Grocery & Gourmet Food > Beverages > Cocktail Mixers
84,324,the orange cocktail bitters collection - 3 bottles,Grocery & Gourmet Food > Beverages > Cocktail Mixers
85,324,bittermilk no.1 bourbon barrel aged old fashioned cocktail mixer - 8.5 oz,Grocery & Gourmet Food > Beverages > Cocktail Mixers
86,324,"jose cuervo margarita mix, 33.8 fl oz",Grocery & Gourmet Food > Beverages > Cocktail Mixers
87,324,"Pomegranate Margarita- Jordan's Skinny Mixes, 1 Liter( 33.8 fl oz)",Grocery & Gourmet Food > Beverages > Cocktail Mixers
88,324,fee brothers orgeat almond,Grocery & Gourmet Food > Beverages > Cocktail Mixers
89,324,wasska pisco sour mix 4.4 oz.,Grocery & Gourmet Food > Beverages > Cocktail Mixers
90,324,"Powell & Mahoney Cocktail Mixer, Bloody Mary, 25.36 Ounce Glass",Grocery & Gourmet Food > Beverages > Cocktail Mixers
91,324,demitri's bloody mary seasoning classic recipe (single bottle),Grocery & Gourmet Food > Beverages > Cocktail Mixers
92,324,fee brothers cherry bitters,Grocery & Gourmet Food > Beverages > Cocktail Mixers
93,324,"Rose's, Lime Juice, 1 Liter Bottles (Pack of 12)",Grocery & Gourmet Food > Beverages > Cocktail Mixers
94,324,bittermens orchard street celery shrub cocktail bitters - 4 oz,Grocery & Gourmet Food > Beverages > Cocktail Mixers
95,324,"angostura aromatic bitters, 4-ounce (pack of 3)",Grocery & Gourmet Food > Beverages > Cocktail Mixers
96,324,"baja beans coffee, baja",Grocery & Gourmet Food > Beverages > Cocktail Mixers
97,324,bittermens burlesque,Grocery & Gourmet Food > Beverages > Cocktail Mixers
98,324,Lot 24 Don Chelada Michelada Mix Lemon Lime Chelada 24oz cups,Grocery & Gourmet Food > Beverages > Cocktail Mixers
99,324,scrappy's habanero firewater cocktail bitters - 5 oz,Grocery & Gourmet Food > Beverages > Cocktail Mixers
100,324,"Wine Slushie Mix - Add Flavor to Your Next Party, Picnic or Girls Night Out - Three Pouches of Frozen Wine Mix",Grocery & Gourmet Food > Beverages > Cocktail Mixers
101,324,fat mama's knock-you naked margarita mix - set of 4,Grocery & Gourmet Food > Beverages > Cocktail Mixers
102,324,red eye® horseradish texas,Grocery & Gourmet Food > Beverages > Cocktail Mixers
103,324,Underberg 12 Bottle Crate,Grocery & Gourmet Food > Beverages > Cocktail Mixers
104,324,"Aromatic Cocktail Bitters, 4 Oz",Grocery & Gourmet Food > Beverages > Cocktail Mixers
105,324,Margaritaville Margarita Singles to Go 6 Packets X 4 Boxes =24 Packets,Grocery & Gourmet Food > Beverages > Cocktail Mixers
106,324,The Bitter End Moroccan Cocktail Aromatic Bitters - 2 oz,Grocery & Gourmet Food > Beverages > Cocktail Mixers
107,324,skinny mixes all natural jalapeno margarita,Grocery & Gourmet Food > Beverages > Cocktail Mixers
108,324,employees only all-natural bloody mary - 25oz,Grocery & Gourmet Food > Beverages > Cocktail Mixers
109,324,Bob's Original Peppermint Candy Canes - 18 ct,Grocery & Gourmet Food > Beverages > Cocktail Mixers
110,324,powell & mahoney margarita,Grocery & Gourmet Food > Beverages > Cocktail Mixers
111,324,mixer bloody mary cocktail,Grocery & Gourmet Food > Beverages > Cocktail Mixers
112,324,4-Pack Dirty Sue Premium Olive Juice Martini Mix 375ML (12.69oz),Grocery & Gourmet Food > Beverages > Cocktail Mixers
113,324,scrappy's bitters exotic,Grocery & Gourmet Food > Beverages > Cocktail Mixers
114,324,liber & co. classic gum syrup (17oz),Grocery & Gourmet Food > Beverages > Cocktail Mixers
115,324,"Clamato Original Tomato Cocktail, 5.5 fl oz cans (Pack of 24)",Grocery & Gourmet Food > Beverages > Cocktail Mixers
116,324,"jordans bikini appletini skinny mix, 33.8 fluid ounce -- 6 per case.",Grocery & Gourmet Food > Beverages > Cocktail Mixers
117,324,poolside bar margarita mix collection,Grocery & Gourmet Food > Beverages > Cocktail Mixers
118,324,major & mrs holt's,Grocery & Gourmet Food > Beverages > Cocktail Mixers
119,324,"Powell & Mahoney Cocktail Mixer, Cosmopolitan, 25.36 Ounce",Grocery & Gourmet Food > Beverages > Cocktail Mixers
120,324,"SuckerPunch Spicy Ghost Pepper Bloody Mary Mix 32 Ounce, Pack of 3",Grocery & Gourmet Food > Beverages > Cocktail Mixers
121,324,wigle organic mol cocktail bitters (3.4 fl oz),Grocery & Gourmet Food > Beverages > Cocktail Mixers
122,324,"Amoretti Premium Martini Cocktail Mix, Sour Apple, 28 Ounce",Grocery & Gourmet Food > Beverages > Cocktail Mixers
123,324,ready to use frusheez slush mix - pina colada - 1/2 gallon,Grocery & Gourmet Food > Beverages > Cocktail Mixers
124,324,Bittercube Trinity Bitters 5oz,Grocery & Gourmet Food > Beverages > Cocktail Mixers
125,324,bittermens new orleans coffee cocktail bitters - 4 oz,Grocery & Gourmet Food > Beverages > Cocktail Mixers
126,324,baja bob's sugar free,Grocery & Gourmet Food > Beverages > Cocktail Mixers
127,324,finest call premium peach,Grocery & Gourmet Food > Beverages > Cocktail Mixers
128,324,Stirrings Mojito Cocktail Mixer 25.4 Oz - Pack of 1,Grocery & Gourmet Food > Beverages > Cocktail Mixers
129,324,scrappy's grapefruit cocktail bitters - 5 oz,Grocery & Gourmet Food > Beverages > Cocktail Mixers
130,324,"stonewall kitchen mixer, pomegranate cosmo, 16 ounce",Grocery & Gourmet Food > Beverages > Cocktail Mixers
131,324,bloody mary gift box,Grocery & Gourmet Food > Beverages > Cocktail Mixers
132,324,angostura aromatic cocktail bitters - 4 oz bottle new,Grocery & Gourmet Food > Beverages > Cocktail Mixers
133,324,"All Natural Easy Blender Ultimate Frozen Peach Bellini Cocktail Mix (6 Servings Box), 6 Oz.",Grocery & Gourmet Food > Beverages > Cocktail Mixers
134,324,"Mr. & Mrs. T Bold & Spicy Bloody Mary Mix, 1 Liter Bottle",Grocery & Gourmet Food > Beverages > Cocktail Mixers
135,324,hurricane mix gallon pat o'brien's,Grocery & Gourmet Food > Beverages > Cocktail Mixers
136,324,daily's margarita mix ltr,Grocery & Gourmet Food > Beverages > Cocktail Mixers
137,324,the original dirty sue,Grocery & Gourmet Food > Beverages > Cocktail Mixers
138,324,Urban Moonshine Citrus Organic Bitters - 2 oz,Grocery & Gourmet Food > Beverages > Cocktail Mixers
139,324,The Bitter Truth Old Time Aromatic Bitters 200ml (6.76oz),Grocery & Gourmet Food > Beverages > Cocktail Mixers
140,324,Strawberry Daiquiri EZ-Jello Shot Mix 6.78 oz,Grocery & Gourmet Food > Beverages > Cocktail Mixers
141,324,fee brothers plum bitters 5oz,Grocery & Gourmet Food > Beverages > Cocktail Mixers
142,324,"Amoretti Martini Cocktail Mix 6 Pack (28 fl oz) (Blueberry, Cosmopolitan, Lemon",Grocery & Gourmet Food > Beverages > Cocktail Mixers
143,324,bar-tenders instant lemon drop martini cocktail mix (6 pouches),Grocery & Gourmet Food > Beverages > Cocktail Mixers
144,324,"amoretti premium martini cocktail mix, lemon drop, 28 ounce",Grocery & Gourmet Food > Beverages > Cocktail Mixers
145,324,jordans bikini appletini,Grocery & Gourmet Food > Beverages > Cocktail Mixers
146,324,"Mr & Mrs T Strawberry Daiquiri-Margarita Mix, 1.75 L bottles (Pack of 6)",Grocery & Gourmet Food > Beverages > Cocktail Mixers
147,324,"Angostura Aromatic Bitters, 4 Ounce",Grocery & Gourmet Food > Beverages > Cocktail Mixers
148,324,Baja Bob's Sugar Free Original Margarita Mix - 32 oz.,Grocery & Gourmet Food > Beverages > Cocktail Mixers
149,324,aftershock pina colada 2.64lb,Grocery & Gourmet Food > Beverages > Cocktail Mixers
150,324,fee brothers orange flower water - 4 oz,Grocery & Gourmet Food > Beverages > Cocktail Mixers
151,324,Vino Ice Organic Wine Margarita Cosmo Martini Freezer & Cocktail Slush-Slushie Mix in a Bag-10 Ounce Pouches (,Grocery & Gourmet Food > Beverages > Cocktail Mixers
152,324,fee brothers whiskey,Grocery & Gourmet Food > Beverages > Cocktail Mixers
153,324,dirty martini olive juice,Grocery & Gourmet Food > Beverages > Cocktail Mixers
154,324,on the border strawberry margarita or daiquiri mix 60 oz.,Grocery & Gourmet Food > Beverages > Cocktail Mixers
155,324,stirrings simple bloody,Grocery & Gourmet Food > Beverages > Cocktail Mixers
156,324,Dr. Adam Elmegirab's The Dead Rabbit Orinoco Bitters,Grocery & Gourmet Food > Beverages > Cocktail Mixers
157,324,shrub & co. spicy ginger,Grocery & Gourmet Food > Beverages > Cocktail Mixers
158,324,el guapo bitters ginger,Grocery & Gourmet Food > Beverages > Cocktail Mixers
159,324,angostura bitters set,Grocery & Gourmet Food > Beverages > Cocktail Mixers
160,324,fee brothers cherry bitters 5oz,Grocery & Gourmet Food > Beverages > Cocktail Mixers
161,324,"margaritaville margarita mix, 33.81 ounce bottle (pack of 12)",Grocery & Gourmet Food > Beverages > Cocktail Mixers
162,324,RIPE® Agave Margarita Bar Juice,Grocery & Gourmet Food > Beverages > Cocktail Mixers
163,324,employees only grenadine syrup - 12 oz,Grocery & Gourmet Food > Beverages > Cocktail Mixers
164,324,longbranch margarita mix,Grocery & Gourmet Food > Beverages > Cocktail Mixers
165,324,"mr. & mrs. t margarita mix, 33.81 ounce bottle (pack of 12)",Grocery & Gourmet Food > Beverages > Cocktail Mixers
166,324,"Bradley's Kina Tonic, 8 oz",Grocery & Gourmet Food > Beverages > Cocktail Mixers
167,324,"Vino Ice Wine And Cocktail Slushie Mix Pouches (Pack of 2)- Make Margaritas, Cosmos, Mimosa, Peach Bellini And Sangria -Recipes Included",Grocery & Gourmet Food > Beverages > Cocktail Mixers
168,324,longbranch zinger bloody,Grocery & Gourmet Food > Beverages > Cocktail Mixers
169,324,fee brothers peach cocktail bitters - 4 oz pack of 2,Grocery & Gourmet Food > Beverages > Cocktail Mixers
170,324,dutch's boomtown cocktail bitters - 4 oz,Grocery & Gourmet Food > Beverages > Cocktail Mixers
171,324,stu's this is bloody mary mixology kit,Grocery & Gourmet Food > Beverages > Cocktail Mixers
172,324,Dillon's Small Batch Ginger Cocktail Bitters - 100 ml,Grocery & Gourmet Food > Beverages > Cocktail Mixers
173,324,"mr & mrs t premium horseradish bloody mary mix, 33.8-ounce (pack of 12)",Grocery & Gourmet Food > Beverages > Cocktail Mixers
174,324,fee brothers olive juice brine - 12.8 oz,Grocery & Gourmet Food > Beverages > Cocktail Mixers
175,324,FULL CASE Charleston Mix Bloody Mary Bold & Spicy 8-oz. (12 bottles),Grocery & Gourmet Food > Beverages > Cocktail Mixers
176,324,Prima Donna Pina Colada Full Cup Underwire Bikini Swim Top (40-003-0),Grocery & Gourmet Food > Beverages > Cocktail Mixers
177,324,wigle organic aromatic bitters (3.4 fl oz),Grocery & Gourmet Food > Beverages > Cocktail Mixers
178,324,fat mama's knock-you naked margarita mix,Grocery & Gourmet Food > Beverages > Cocktail Mixers
179,324,fee brothers sarsaparilla soda mix - 32 oz,Grocery & Gourmet Food > Beverages > Cocktail Mixers
180,324,scrappy's habanero,Grocery & Gourmet Food > Beverages > Cocktail Mixers
181,324,"lt. blender's strawberry daquiri in a bag, 33.8100-ounces (pack of3)",Grocery & Gourmet Food > Beverages > Cocktail Mixers
182,324,bittermens new england spiced cranberry bitters - 5oz,Grocery & Gourmet Food > Beverages > Cocktail Mixers
183,324,monin south seas blend cocktail syrup - 1 liter,Grocery & Gourmet Food > Beverages > Cocktail Mixers
184,324,major peters' original,Grocery & Gourmet Food > Beverages > Cocktail Mixers
185,324,master of mixes margarita,Grocery & Gourmet Food > Beverages > Cocktail Mixers
186,324,bittermens hopped grapefruit cocktail bitters - 4 oz,Grocery & Gourmet Food > Beverages > Cocktail Mixers
187,324,1 pc 3 tier bar glass rimmer (salt & sugar) margarita cocktail,Grocery & Gourmet Food > Beverages > Cocktail Mixers
188,324,fee fi fo fum!,Grocery & Gourmet Food > Beverages > Cocktail Mixers
189,324,Dirty Sue Martini Mix Two Pack,Grocery & Gourmet Food > Beverages > Cocktail Mixers
190,324,finest call premium banana,Grocery & Gourmet Food > Beverages > Cocktail Mixers
191,324,12-Pack Mucho Macho Michelada Mix in a 24oz Cup Ready to Use - Limon Flavor,Grocery & Gourmet Food > Beverages > Cocktail Mixers
192,324,3bar picante dirty martini,Grocery & Gourmet Food > Beverages > Cocktail Mixers
193,324,gin tonic infusion kit 60,Grocery & Gourmet Food > Beverages > Cocktail Mixers
194,324,Pat O'briens Hurricane Mix - Gallon Size - (6 Pack),Grocery & Gourmet Food > Beverages > Cocktail Mixers
195,324,slimritas margarita mix,Grocery & Gourmet Food > Beverages > Cocktail Mixers
196,324,molecular mixology kit - cocktail r-evolution,Grocery & Gourmet Food > Beverages > Cocktail Mixers
197,324,Natureworks Swedish Bitters 3.38 OZ,Grocery & Gourmet Food > Beverages > Cocktail Mixers
198,324,tomr's handcrafted tonic artisanal quinine syrup concentrate - 200 ml,Grocery & Gourmet Food > Beverages > Cocktail Mixers
199,324,"Scrappy's Bitters, Seville Orange, 5 OZ Bottle",Grocery & Gourmet Food > Beverages > Cocktail Mixers
200,324,urban moonshine organic joy tonic -- 2 fl oz,Grocery & Gourmet Food > Beverages > Cocktail Mixers
201,324,"Baja Bob's Mojito Mix, Sugar Free & Low Carb - 32 oz.",Grocery & Gourmet Food > Beverages > Cocktail Mixers
202,324,cavendish and harvey sour,Grocery & Gourmet Food > Beverages > Cocktail Mixers
203,324,fee brothers old fashion aromatic bitters 5oz,Grocery & Gourmet Food > Beverages > Cocktail Mixers
204,324,powell & mahoney mojito 750ml to: powell & mahoney mojito vintage original cocktail mixer - 750 ml,Grocery & Gourmet Food > Beverages > Cocktail Mixers
205,324,Cocktail Punk Alpino Cocktail Bitters - 2 oz,Grocery & Gourmet Food > Beverages > Cocktail Mixers
206,324,"angostura orange bitters, 4 fl oz, (pack of 12)",Grocery & Gourmet Food > Beverages > Cocktail Mixers
207,324,"master of mixes 5 pepper bloody mary mix, 59.2 oz (pack of 6)",Grocery & Gourmet Food > Beverages > Cocktail Mixers
208,324,"williams-sonoma margarita mix, strawberry watermelon",Grocery & Gourmet Food > Beverages > Cocktail Mixers
209,324,williams-sonoma bloody mary mix,Grocery & Gourmet Food > Beverages > Cocktail Mixers
210,324,"williams-sonoma bellini cocktail mix, strawberry rhubarb",Grocery & Gourmet Food > Beverages > Cocktail Mixers
211,324,"williams-sonoma cocktail mix, jalapeno-lime",Grocery & Gourmet Food > Beverages > Cocktail Mixers
212,324,hella bitters bitters aromatic bitters one size,Grocery & Gourmet Food > Beverages > Cocktail Mixers
213,324,master of mixes strawberry daiquiri/margarita mixer - (1750ml),Grocery & Gourmet Food > Beverages > Cocktail Mixers
214,324,Master of Mixes Drink Mixers 33.8oz/1L Bottle (Pack of 3) (Choose Flavor Below,Grocery & Gourmet Food > Beverages > Cocktail Mixers
215,324,"Mr & Mrs T Bold & Spicy Bloody Mary Mix, 1.75 L bottles (Pack of 6)",Grocery & Gourmet Food > Beverages > Cocktail Mixers
216,324,pat o'brien's world famous hurricane cocktail mix - pack of 2,Grocery & Gourmet Food > Beverages > Cocktail Mixers
217,324,fee brothers gin barrel-aged orange bitters - 5 oz - 2 pack,Grocery & Gourmet Food > Beverages > Cocktail Mixers
218,324,"Amoretti Premium Martini Cocktail Mix Minis, Pear, 3.4 Fluid Ounce",Grocery & Gourmet Food > Beverages > Cocktail Mixers
219,324,stirrings authentic,Grocery & Gourmet Food > Beverages > Cocktail Mixers
220,324,tomr's handcrafted 200 ml tonic artisanal quinine syrup concentrate,Grocery & Gourmet Food > Beverages > Cocktail Mixers
221,324,Finest Call Premium Mojito Drink Mix 1 Litre 33.8 FL OZ.,Grocery & Gourmet Food > Beverages > Cocktail Mixers
222,324,Fee Brothers Set of 6,Grocery & Gourmet Food > Beverages > Cocktail Mixers
223,324,Finest Call Premium Raspberry Puree Drink Mixer 1 Liter,Grocery & Gourmet Food > Beverages > Cocktail Mixers
224,324,Fee Brothers Molasses Bitters Cocktail Flavoring,Grocery & Gourmet Food > Beverages > Cocktail Mixers
225,324,"angostura bitters, 4-ounce bottles (pack of 4)",Grocery & Gourmet Food > Beverages > Cocktail Mixers
226,324,fee brothers limited run,Grocery & Gourmet Food > Beverages > Cocktail Mixers
227,324,the bitter end jamaican jerk cocktail aromatic bitters - 2 oz,Grocery & Gourmet Food > Beverages > Cocktail Mixers
228,324,stirrings dirty martini,Grocery & Gourmet Food > Beverages > Cocktail Mixers
229,324,wine-a-rita mix - delicious frozen drinks made with wine - wine glace - by wine-a-rita,Grocery & Gourmet Food > Beverages > Cocktail Mixers
230,324,Powell & Mahoney Symple Syrup 375ml (12.68oz),Grocery & Gourmet Food > Beverages > Cocktail Mixers
231,324,"Wine-A-Rita Mix Delicious Frozen Drinks Made With Wine, Wine Glace",Grocery & Gourmet Food > Beverages > Cocktail Mixers
232,324,"mary, bloody mary",Grocery & Gourmet Food > Beverages > Cocktail Mixers
233,324,msrf bar plus+ party starters just add rum variety pack,Grocery & Gourmet Food > Beverages > Cocktail Mixers
