,category_id,description,category_path
2202,361,open nature peanut butter old fashioned crunchy - 16 oz,"Grocery & Gourmet Food > Canned, Dry & Packaged Foods > Jams, Jellies & Sweet Spreads > Nut Butters"
2203,361,"hormel skippy peanut butter, super chunk natural, 15 oz","Grocery & Gourmet Food > Canned, Dry & Packaged Foods > Jams, Jellies & Sweet Spreads > Nut Butters"
2204,361,"bell plantation pb2 powdered peanut butter with chocolate, 6.5 ounce","Grocery & Gourmet Food > Canned, Dry & Packaged Foods > Jams, Jellies & Sweet Spreads > Nut Butters"
2205,361,"jif peanut butter, simply jif, creamy, 15.5 oz","Grocery & Gourmet Food > Canned, Dry & Packaged Foods > Jams, Jellies & Sweet Spreads > Nut Butters"
2206,361,"justin's all natural honey almond butter, 1.15 oz","Grocery & Gourmet Food > Canned, Dry & Packaged Foods > Jams, Jellies & Sweet Spreads > Nut Butters"
2207,361,"jif, creamy peanut butter, 28 oz","Grocery & Gourmet Food > Canned, Dry & Packaged Foods > Jams, Jellies & Sweet Spreads > Nut Butters"
2208,361,skippy natural peanut butter,"Grocery & Gourmet Food > Canned, Dry & Packaged Foods > Jams, Jellies & Sweet Spreads > Nut Butters"
2209,361,maranatha all natural no stir - - 12.00 oz,"Grocery & Gourmet Food > Canned, Dry & Packaged Foods > Jams, Jellies & Sweet Spreads > Nut Butters"
2210,361,skippy peanut butter - natura - 26.50 oz,"Grocery & Gourmet Food > Canned, Dry & Packaged Foods > Jams, Jellies & Sweet Spreads > Nut Butters"
2211,361,jif extra crunchy peanut b - 16.00 oz,"Grocery & Gourmet Food > Canned, Dry & Packaged Foods > Jams, Jellies & Sweet Spreads > Nut Butters"
2212,361,smucker's natural natural chunky peanut - 16.00 oz,"Grocery & Gourmet Food > Canned, Dry & Packaged Foods > Jams, Jellies & Sweet Spreads > Nut Butters"
2213,361,i.m. healthy soynut butter - origin - 15.00 oz,"Grocery & Gourmet Food > Canned, Dry & Packaged Foods > Jams, Jellies & Sweet Spreads > Nut Butters"
2214,361,crazy richard's cashew butter - 11.00 oz,"Grocery & Gourmet Food > Canned, Dry & Packaged Foods > Jams, Jellies & Sweet Spreads > Nut Butters"
2215,361,skippy natural super chunky p - 26.50 oz,"Grocery & Gourmet Food > Canned, Dry & Packaged Foods > Jams, Jellies & Sweet Spreads > Nut Butters"
2216,361,nutella hazelnut spread with c - 13.00 oz,"Grocery & Gourmet Food > Canned, Dry & Packaged Foods > Jams, Jellies & Sweet Spreads > Nut Butters"
2217,361,wowbutter creamy peanut free spr - 17.60 oz,"Grocery & Gourmet Food > Canned, Dry & Packaged Foods > Jams, Jellies & Sweet Spreads > Nut Butters"
2218,361,peter pan simply ground original - 15.00 oz,"Grocery & Gourmet Food > Canned, Dry & Packaged Foods > Jams, Jellies & Sweet Spreads > Nut Butters"
2219,361,jif peanut butter - creamy - 80.00 oz,"Grocery & Gourmet Food > Canned, Dry & Packaged Foods > Jams, Jellies & Sweet Spreads > Nut Butters"
2220,361,shoprite hazelnut spread with m - 3.60 oz,"Grocery & Gourmet Food > Canned, Dry & Packaged Foods > Jams, Jellies & Sweet Spreads > Nut Butters"
2221,361,smart balance all natural rich roast - 16.00 oz,"Grocery & Gourmet Food > Canned, Dry & Packaged Foods > Jams, Jellies & Sweet Spreads > Nut Butters"
2222,361,creamy peanut butter - dark roasted,"Grocery & Gourmet Food > Canned, Dry & Packaged Foods > Jams, Jellies & Sweet Spreads > Nut Butters"
2223,361,earth balance creamy coconut & peanut butter spread,"Grocery & Gourmet Food > Canned, Dry & Packaged Foods > Jams, Jellies & Sweet Spreads > Nut Butters"
2224,361,classic almond butter squeeze pack,"Grocery & Gourmet Food > Canned, Dry & Packaged Foods > Jams, Jellies & Sweet Spreads > Nut Butters"
2225,361,nuttzo dark chocolate crunchy nut & seed butter,"Grocery & Gourmet Food > Canned, Dry & Packaged Foods > Jams, Jellies & Sweet Spreads > Nut Butters"
2226,361,"kevala, almond butter, classic creamy, 12 oz (340 g)","Grocery & Gourmet Food > Canned, Dry & Packaged Foods > Jams, Jellies & Sweet Spreads > Nut Butters"
2227,361,"maranatha, organic no stir peanut butter, crunchy, 16 oz (454 g)","Grocery & Gourmet Food > Canned, Dry & Packaged Foods > Jams, Jellies & Sweet Spreads > Nut Butters"
2228,361,"justin's nut butter, honey peanut butter blend, 10 squeeze packs, 1.15 oz (32 g) per pack","Grocery & Gourmet Food > Canned, Dry & Packaged Foods > Jams, Jellies & Sweet Spreads > Nut Butters"
2229,361,"maranatha, no stir peanut butter, creamy, 16 oz (454 g)","Grocery & Gourmet Food > Canned, Dry & Packaged Foods > Jams, Jellies & Sweet Spreads > Nut Butters"
2230,361,nuts 'n more — chocolate peanut butter,"Grocery & Gourmet Food > Canned, Dry & Packaged Foods > Jams, Jellies & Sweet Spreads > Nut Butters"
2231,361,barney butter — flavored almond butter variety pack one-size,"Grocery & Gourmet Food > Canned, Dry & Packaged Foods > Jams, Jellies & Sweet Spreads > Nut Butters"
2232,361,apple dip soft candy diy 1.19 oz,"Grocery & Gourmet Food > Canned, Dry & Packaged Foods > Jams, Jellies & Sweet Spreads > Nut Butters"
2233,361,"Justin's All Natural Nut Butters 7-Flavor Variety: One 1.15 oz Packet Each of Classic Peanut Butter, Honey Peanut Butter Blend, Classic Almond Butter,","Grocery & Gourmet Food > Canned, Dry & Packaged Foods > Jams, Jellies & Sweet Spreads > Nut Butters"
2234,361,"skippy peanut butter, creamy, 48 ounce","Grocery & Gourmet Food > Canned, Dry & Packaged Foods > Jams, Jellies & Sweet Spreads > Nut Butters"
2235,361,peanut butter & co the bee's knees -- 15 oz,"Grocery & Gourmet Food > Canned, Dry & Packaged Foods > Jams, Jellies & Sweet Spreads > Nut Butters"
2236,361,"pb2 powdered peanut butter with chocolate, jar - 6.5 oz","Grocery & Gourmet Food > Canned, Dry & Packaged Foods > Jams, Jellies & Sweet Spreads > Nut Butters"
2237,361,sunbutter® natural sunflower spread 16 oz,"Grocery & Gourmet Food > Canned, Dry & Packaged Foods > Jams, Jellies & Sweet Spreads > Nut Butters"
2238,361,jif extra crunchy peanut butter 40 oz,"Grocery & Gourmet Food > Canned, Dry & Packaged Foods > Jams, Jellies & Sweet Spreads > Nut Butters"
2239,361,skippy natural creamy peanut butter 40 oz,"Grocery & Gourmet Food > Canned, Dry & Packaged Foods > Jams, Jellies & Sweet Spreads > Nut Butters"
2240,361,"jif crunchy cashew butter, 12 oz","Grocery & Gourmet Food > Canned, Dry & Packaged Foods > Jams, Jellies & Sweet Spreads > Nut Butters"
2241,361,"planters creamy peanut butter, 28 oz","Grocery & Gourmet Food > Canned, Dry & Packaged Foods > Jams, Jellies & Sweet Spreads > Nut Butters"
2242,361,great value creamy peanut butter 40 ounces 6 count,"Grocery & Gourmet Food > Canned, Dry & Packaged Foods > Jams, Jellies & Sweet Spreads > Nut Butters"
2243,361,"jif natural creamy peanut butter, 40 oz","Grocery & Gourmet Food > Canned, Dry & Packaged Foods > Jams, Jellies & Sweet Spreads > Nut Butters"
2244,361,nutella hazelnut spread 26.5 oz.,"Grocery & Gourmet Food > Canned, Dry & Packaged Foods > Jams, Jellies & Sweet Spreads > Nut Butters"
2245,361,justin's chocolate nut butter,"Grocery & Gourmet Food > Canned, Dry & Packaged Foods > Jams, Jellies & Sweet Spreads > Nut Butters"
2246,361,artisana 100% organic raw cashew butter -- 16 oz,"Grocery & Gourmet Food > Canned, Dry & Packaged Foods > Jams, Jellies & Sweet Spreads > Nut Butters"
2247,361,maranatha natural raw almond butter creamy -- 16 oz,"Grocery & Gourmet Food > Canned, Dry & Packaged Foods > Jams, Jellies & Sweet Spreads > Nut Butters"
2248,361,jem raw sprouted almond butter superberry maqui camu -- 6 oz,"Grocery & Gourmet Food > Canned, Dry & Packaged Foods > Jams, Jellies & Sweet Spreads > Nut Butters"
2249,361,vitacost powdered peanut butter slim(tm) - non-gmo - gluten free -- 6.5 oz (184 g),"Grocery & Gourmet Food > Canned, Dry & Packaged Foods > Jams, Jellies & Sweet Spreads > Nut Butters"
2250,361,justin's natural hazelnut butter chocolate -- 16 oz,"Grocery & Gourmet Food > Canned, Dry & Packaged Foods > Jams, Jellies & Sweet Spreads > Nut Butters"
2251,361,crazy richard's pure pb™ powdered peanut butter -- 5.64 oz,"Grocery & Gourmet Food > Canned, Dry & Packaged Foods > Jams, Jellies & Sweet Spreads > Nut Butters"
2252,361,barney butter almond butter squeeze pack -- 1.06 oz,"Grocery & Gourmet Food > Canned, Dry & Packaged Foods > Jams, Jellies & Sweet Spreads > Nut Butters"
2253,361,barney butter almond butter crunchy gluten free -- 16 oz,"Grocery & Gourmet Food > Canned, Dry & Packaged Foods > Jams, Jellies & Sweet Spreads > Nut Butters"
2254,361,once again natural almond butter salt free crunchy -- 16 oz,"Grocery & Gourmet Food > Canned, Dry & Packaged Foods > Jams, Jellies & Sweet Spreads > Nut Butters"
2255,361,betty lou's just great stuff organic powdered peanut butter -- 6.43 oz,"Grocery & Gourmet Food > Canned, Dry & Packaged Foods > Jams, Jellies & Sweet Spreads > Nut Butters"
2256,361,artisana organic raw almond butter -- 16 oz,"Grocery & Gourmet Food > Canned, Dry & Packaged Foods > Jams, Jellies & Sweet Spreads > Nut Butters"
2257,361,wild friends almond butter chocolate sunflower seed -- 16 oz,"Grocery & Gourmet Food > Canned, Dry & Packaged Foods > Jams, Jellies & Sweet Spreads > Nut Butters"
2258,361,crazy richard's peanut butter creamy -- 16 oz,"Grocery & Gourmet Food > Canned, Dry & Packaged Foods > Jams, Jellies & Sweet Spreads > Nut Butters"
2259,361,sunbutter natural sunflower spread -- 16 oz,"Grocery & Gourmet Food > Canned, Dry & Packaged Foods > Jams, Jellies & Sweet Spreads > Nut Butters"
2260,361,i.m. healthy soynut butter creamy unsweetened -- 15 oz,"Grocery & Gourmet Food > Canned, Dry & Packaged Foods > Jams, Jellies & Sweet Spreads > Nut Butters"
2261,361,once again crunchy no salt almond butter -- 16 oz,"Grocery & Gourmet Food > Canned, Dry & Packaged Foods > Jams, Jellies & Sweet Spreads > Nut Butters"
2262,361,purely elizabeth grain-free granola gluten free banana nut butter -- 8 oz,"Grocery & Gourmet Food > Canned, Dry & Packaged Foods > Jams, Jellies & Sweet Spreads > Nut Butters"
2263,361,justin's nut butter squeeze pack classic peanut butter -- 1.15 oz,"Grocery & Gourmet Food > Canned, Dry & Packaged Foods > Jams, Jellies & Sweet Spreads > Nut Butters"
2264,361,"barney butter crunchy almond butter, 16 oz","Grocery & Gourmet Food > Canned, Dry & Packaged Foods > Jams, Jellies & Sweet Spreads > Nut Butters"
2265,361,artisana organic raw cashew butter - 14 oz,"Grocery & Gourmet Food > Canned, Dry & Packaged Foods > Jams, Jellies & Sweet Spreads > Nut Butters"
2266,361,"maranatha creamy almond butter, no stir, 12 oz","Grocery & Gourmet Food > Canned, Dry & Packaged Foods > Jams, Jellies & Sweet Spreads > Nut Butters"
2267,361,justin's all-natural maple almond butter - (16oz),"Grocery & Gourmet Food > Canned, Dry & Packaged Foods > Jams, Jellies & Sweet Spreads > Nut Butters"
2268,361,just freshdirect freshly ground almond butter - (12oz),"Grocery & Gourmet Food > Canned, Dry & Packaged Foods > Jams, Jellies & Sweet Spreads > Nut Butters"
2269,361,justin's all-natural honey almond butter - (16oz),"Grocery & Gourmet Food > Canned, Dry & Packaged Foods > Jams, Jellies & Sweet Spreads > Nut Butters"
2270,361,ferrero nutella hazelnut spread with skim milk and cocoa - (26.5oz),"Grocery & Gourmet Food > Canned, Dry & Packaged Foods > Jams, Jellies & Sweet Spreads > Nut Butters"
2271,361,"freshdirect freshly ground peanut butter, chunky (16oz)","Grocery & Gourmet Food > Canned, Dry & Packaged Foods > Jams, Jellies & Sweet Spreads > Nut Butters"
2272,361,"manischewitz roasted almond butter, creamy - (10oz)","Grocery & Gourmet Food > Canned, Dry & Packaged Foods > Jams, Jellies & Sweet Spreads > Nut Butters"
2273,361,"jif extra crunchy peanut butter (40 oz. jar, 2 pk.)","Grocery & Gourmet Food > Canned, Dry & Packaged Foods > Jams, Jellies & Sweet Spreads > Nut Butters"
2274,361,powdered peanut butter,"Grocery & Gourmet Food > Canned, Dry & Packaged Foods > Jams, Jellies & Sweet Spreads > Nut Butters"
2275,361,wowbutter toasted soy spread peanut free creamy gluten free 17.6 oz jar,"Grocery & Gourmet Food > Canned, Dry & Packaged Foods > Jams, Jellies & Sweet Spreads > Nut Butters"
2276,361,jif peanut butter extra crunchy 28 oz jar,"Grocery & Gourmet Food > Canned, Dry & Packaged Foods > Jams, Jellies & Sweet Spreads > Nut Butters"
2277,361,nature's promise naturals almond butter natural 16 oz jar,"Grocery & Gourmet Food > Canned, Dry & Packaged Foods > Jams, Jellies & Sweet Spreads > Nut Butters"
2278,361,nutella spread hazelnut with skim milk & cocoa 7.7 oz jar,"Grocery & Gourmet Food > Canned, Dry & Packaged Foods > Jams, Jellies & Sweet Spreads > Nut Butters"
2279,361,jif peanut butter creamy natural 28 oz jar,"Grocery & Gourmet Food > Canned, Dry & Packaged Foods > Jams, Jellies & Sweet Spreads > Nut Butters"
2280,361,peapod peanut butter creamy reduced fat 16.3 oz jar,"Grocery & Gourmet Food > Canned, Dry & Packaged Foods > Jams, Jellies & Sweet Spreads > Nut Butters"
2281,361,nature's promise organic peanut butter creamy no-stir 16 oz jar,"Grocery & Gourmet Food > Canned, Dry & Packaged Foods > Jams, Jellies & Sweet Spreads > Nut Butters"
2282,361,"justin's hazelnut chocolate butter blend, 16 oz","Grocery & Gourmet Food > Canned, Dry & Packaged Foods > Jams, Jellies & Sweet Spreads > Nut Butters"
2283,361,barney butter almond butter,"Grocery & Gourmet Food > Canned, Dry & Packaged Foods > Jams, Jellies & Sweet Spreads > Nut Butters"
2284,361,maranatha almond butter,"Grocery & Gourmet Food > Canned, Dry & Packaged Foods > Jams, Jellies & Sweet Spreads > Nut Butters"
2285,361,jif natural crunchy peanut - 16.00 oz,"Grocery & Gourmet Food > Canned, Dry & Packaged Foods > Jams, Jellies & Sweet Spreads > Nut Butters"
2286,361,jif peanut butter spread - - 28.00 oz,"Grocery & Gourmet Food > Canned, Dry & Packaged Foods > Jams, Jellies & Sweet Spreads > Nut Butters"
2287,361,smucker's peanut butter - natura - 12.00 oz,"Grocery & Gourmet Food > Canned, Dry & Packaged Foods > Jams, Jellies & Sweet Spreads > Nut Butters"
2288,361,shoprite peanut butter - creamy - 16.30 oz,"Grocery & Gourmet Food > Canned, Dry & Packaged Foods > Jams, Jellies & Sweet Spreads > Nut Butters"
2289,361,smucker's natural peanut butter - 16.00 oz,"Grocery & Gourmet Food > Canned, Dry & Packaged Foods > Jams, Jellies & Sweet Spreads > Nut Butters"
2290,361,jif peanut butter - creamy - 16.00 oz,"Grocery & Gourmet Food > Canned, Dry & Packaged Foods > Jams, Jellies & Sweet Spreads > Nut Butters"
2291,361,smucker's peanut butter - creamy - 16.00 oz,"Grocery & Gourmet Food > Canned, Dry & Packaged Foods > Jams, Jellies & Sweet Spreads > Nut Butters"
2292,361,peanut butter & co white chocolate wonder - 16.00 oz,"Grocery & Gourmet Food > Canned, Dry & Packaged Foods > Jams, Jellies & Sweet Spreads > Nut Butters"
2293,361,jif to go - natural peanut - 12.00 oz,"Grocery & Gourmet Food > Canned, Dry & Packaged Foods > Jams, Jellies & Sweet Spreads > Nut Butters"
2294,361,peter pan natural peanut butter - 16.30 oz,"Grocery & Gourmet Food > Canned, Dry & Packaged Foods > Jams, Jellies & Sweet Spreads > Nut Butters"
2295,361,maple almond butter squeeze pack,"Grocery & Gourmet Food > Canned, Dry & Packaged Foods > Jams, Jellies & Sweet Spreads > Nut Butters"
2296,361,santa cruz organic crunchy peanut butter - dark roasted,"Grocery & Gourmet Food > Canned, Dry & Packaged Foods > Jams, Jellies & Sweet Spreads > Nut Butters"
2297,361,justin's nut butter maple almond butter,"Grocery & Gourmet Food > Canned, Dry & Packaged Foods > Jams, Jellies & Sweet Spreads > Nut Butters"
2298,361,justin's vanilla almond butter,"Grocery & Gourmet Food > Canned, Dry & Packaged Foods > Jams, Jellies & Sweet Spreads > Nut Butters"
2299,361,yumbutter superfood cashew butter,"Grocery & Gourmet Food > Canned, Dry & Packaged Foods > Jams, Jellies & Sweet Spreads > Nut Butters"
2300,361,jem raw organics cinnamon red maca almond butter,"Grocery & Gourmet Food > Canned, Dry & Packaged Foods > Jams, Jellies & Sweet Spreads > Nut Butters"
2301,361,nutiva dark hazelnut spread,"Grocery & Gourmet Food > Canned, Dry & Packaged Foods > Jams, Jellies & Sweet Spreads > Nut Butters"
2302,361,nocciolata organic hazelnut spread with cocoa and milk,"Grocery & Gourmet Food > Canned, Dry & Packaged Foods > Jams, Jellies & Sweet Spreads > Nut Butters"
2303,361,"walden farms, whipped peanut spread, 12 oz (340 g)","Grocery & Gourmet Food > Canned, Dry & Packaged Foods > Jams, Jellies & Sweet Spreads > Nut Butters"
2304,361,"maranatha, organic no stir peanut butter, creamy, 16 oz (454 g)","Grocery & Gourmet Food > Canned, Dry & Packaged Foods > Jams, Jellies & Sweet Spreads > Nut Butters"
2305,361,nutella hazelnut spread with c - 5.20 oz,"Grocery & Gourmet Food > Canned, Dry & Packaged Foods > Jams, Jellies & Sweet Spreads > Nut Butters"
2306,361,crunchy almond butter,"Grocery & Gourmet Food > Canned, Dry & Packaged Foods > Jams, Jellies & Sweet Spreads > Nut Butters"
2307,361,vanilla almond butter,"Grocery & Gourmet Food > Canned, Dry & Packaged Foods > Jams, Jellies & Sweet Spreads > Nut Butters"
2308,361,nuttzo original peanut smooth,"Grocery & Gourmet Food > Canned, Dry & Packaged Foods > Jams, Jellies & Sweet Spreads > Nut Butters"
2309,361,organic creamy almond butter - lightly toasted,"Grocery & Gourmet Food > Canned, Dry & Packaged Foods > Jams, Jellies & Sweet Spreads > Nut Butters"
2310,361,nuttzo original crunchy nut butter,"Grocery & Gourmet Food > Canned, Dry & Packaged Foods > Jams, Jellies & Sweet Spreads > Nut Butters"
2311,361,crunch spicy kani,"Grocery & Gourmet Food > Canned, Dry & Packaged Foods > Jams, Jellies & Sweet Spreads > Nut Butters"
2312,361,"chocolate peanut butter, 16 oz 16 oz no color","Grocery & Gourmet Food > Canned, Dry & Packaged Foods > Jams, Jellies & Sweet Spreads > Nut Butters"
2313,361,"kevala, almond butter, classic crunchy, 12 oz (340 g)","Grocery & Gourmet Food > Canned, Dry & Packaged Foods > Jams, Jellies & Sweet Spreads > Nut Butters"
2314,361,"justin's nut butter, maple almond butter, 16 oz (454 g)","Grocery & Gourmet Food > Canned, Dry & Packaged Foods > Jams, Jellies & Sweet Spreads > Nut Butters"
2315,361,"betty lou's, just great stuff, powdered organic peanut butter, the original, 6.35 oz (180 g)","Grocery & Gourmet Food > Canned, Dry & Packaged Foods > Jams, Jellies & Sweet Spreads > Nut Butters"
2316,361,"artisana, organics, raw almond nut butter, 16 oz (454 g)","Grocery & Gourmet Food > Canned, Dry & Packaged Foods > Jams, Jellies & Sweet Spreads > Nut Butters"
2317,361,"justin's nut butter, chocolate hazelnut butter blend, 10 squeeze packs, 1.15 oz (32 g) per pack","Grocery & Gourmet Food > Canned, Dry & Packaged Foods > Jams, Jellies & Sweet Spreads > Nut Butters"
2318,361,"dastony, hazelnut butter, 100% organic, 8 oz (227 g)","Grocery & Gourmet Food > Canned, Dry & Packaged Foods > Jams, Jellies & Sweet Spreads > Nut Butters"
2319,361,"peanut butter & co., cinnamon raisin swirl, peanut butter blended, 16 oz (454 g)","Grocery & Gourmet Food > Canned, Dry & Packaged Foods > Jams, Jellies & Sweet Spreads > Nut Butters"
2320,361,"bell plantation, pb2, powdered peanut butter with premium chocolate, 6.5 oz (184 g)","Grocery & Gourmet Food > Canned, Dry & Packaged Foods > Jams, Jellies & Sweet Spreads > Nut Butters"
2321,361,nuts 'n more — almond butter,"Grocery & Gourmet Food > Canned, Dry & Packaged Foods > Jams, Jellies & Sweet Spreads > Nut Butters"
2322,361,boxed — 10-ct. almond butter squeeze packs,"Grocery & Gourmet Food > Canned, Dry & Packaged Foods > Jams, Jellies & Sweet Spreads > Nut Butters"
2323,361,"p28 high protein bread high protein spread white chocolate, 16 oz. high protein peanut butter!","Grocery & Gourmet Food > Canned, Dry & Packaged Foods > Jams, Jellies & Sweet Spreads > Nut Butters"
2324,361,"betty lou's organic powdered peanut butter peanut butter, 6.35 oz. 100% organic, with low fat & carbs","Grocery & Gourmet Food > Canned, Dry & Packaged Foods > Jams, Jellies & Sweet Spreads > Nut Butters"
2325,361,"meijer creamy peanut butter, 80 oz","Grocery & Gourmet Food > Canned, Dry & Packaged Foods > Jams, Jellies & Sweet Spreads > Nut Butters"
2326,361,"justin's justin's all natural almond butter, vanilla, 16 oz","Grocery & Gourmet Food > Canned, Dry & Packaged Foods > Jams, Jellies & Sweet Spreads > Nut Butters"
2327,361,woodstock woodstock farms all-natural raw almond butter smooth unsa...,"Grocery & Gourmet Food > Canned, Dry & Packaged Foods > Jams, Jellies & Sweet Spreads > Nut Butters"
2328,361,"jif jif peanut butter, extra crunchy, 28 oz","Grocery & Gourmet Food > Canned, Dry & Packaged Foods > Jams, Jellies & Sweet Spreads > Nut Butters"
2329,361,"barney butter barney butter cocoa and coconut, 10 ounce","Grocery & Gourmet Food > Canned, Dry & Packaged Foods > Jams, Jellies & Sweet Spreads > Nut Butters"
2330,361,"bell plantation pb2 powdered peanut butter, 6.5 ounce jar 6.5 oz regular","Grocery & Gourmet Food > Canned, Dry & Packaged Foods > Jams, Jellies & Sweet Spreads > Nut Butters"
2331,361,"peter pan honey roast creamy peanut & natural honey spread, 40 oz","Grocery & Gourmet Food > Canned, Dry & Packaged Foods > Jams, Jellies & Sweet Spreads > Nut Butters"
2332,361,"peanut butter & co. the bee'sknees peanut butter, 16 oz","Grocery & Gourmet Food > Canned, Dry & Packaged Foods > Jams, Jellies & Sweet Spreads > Nut Butters"
2333,361,"great value crunchy peanut butter, 18 oz","Grocery & Gourmet Food > Canned, Dry & Packaged Foods > Jams, Jellies & Sweet Spreads > Nut Butters"
2334,361,"maranatha butter organic no stir peanut butter creamy, 16 oz","Grocery & Gourmet Food > Canned, Dry & Packaged Foods > Jams, Jellies & Sweet Spreads > Nut Butters"
2335,361,"peter pan crunchy peanut butter, 40 oz","Grocery & Gourmet Food > Canned, Dry & Packaged Foods > Jams, Jellies & Sweet Spreads > Nut Butters"
2336,361,"smucker's grape stripes goober peanut butter & jelly, 18 oz","Grocery & Gourmet Food > Canned, Dry & Packaged Foods > Jams, Jellies & Sweet Spreads > Nut Butters"
2337,361,"jif whips peanut butter, creamy - 15 oz tub","Grocery & Gourmet Food > Canned, Dry & Packaged Foods > Jams, Jellies & Sweet Spreads > Nut Butters"
2338,361,"justin's almond butter, honey - 1.15 oz pouch","Grocery & Gourmet Food > Canned, Dry & Packaged Foods > Jams, Jellies & Sweet Spreads > Nut Butters"
2339,361,"365 peanut butter, no salt - 16 oz jar","Grocery & Gourmet Food > Canned, Dry & Packaged Foods > Jams, Jellies & Sweet Spreads > Nut Butters"
2340,361,skippy creamy peanut butter 1/3 less sodium and sugar 15oz,"Grocery & Gourmet Food > Canned, Dry & Packaged Foods > Jams, Jellies & Sweet Spreads > Nut Butters"
2341,361,"maranatha no stir almond butter, creamy - 12 oz jar","Grocery & Gourmet Food > Canned, Dry & Packaged Foods > Jams, Jellies & Sweet Spreads > Nut Butters"
2342,361,"skippy peanut butter, extra crunchy - 16.3 oz jar","Grocery & Gourmet Food > Canned, Dry & Packaged Foods > Jams, Jellies & Sweet Spreads > Nut Butters"
2343,361,jif crunchy peanut butter to go 12 oz 8 ct,"Grocery & Gourmet Food > Canned, Dry & Packaged Foods > Jams, Jellies & Sweet Spreads > Nut Butters"
2344,361,honeyville organic powder peanut butter 32 oz (2 lbs),"Grocery & Gourmet Food > Canned, Dry & Packaged Foods > Jams, Jellies & Sweet Spreads > Nut Butters"
2345,361,"santa cruz organic light roasted peanut butter, creamy - 16 oz jar","Grocery & Gourmet Food > Canned, Dry & Packaged Foods > Jams, Jellies & Sweet Spreads > Nut Butters"
2346,361,rigoni di asiago nocciolata organic hazelnut spread with cocoa & milk - 9.52 oz jar,"Grocery & Gourmet Food > Canned, Dry & Packaged Foods > Jams, Jellies & Sweet Spreads > Nut Butters"
2347,361,"skippy reduced fat peanut butter, creamy - 16.3 oz jar","Grocery & Gourmet Food > Canned, Dry & Packaged Foods > Jams, Jellies & Sweet Spreads > Nut Butters"
2348,361,"earth balance organic buttery spread, whipped - 13 oz tub","Grocery & Gourmet Food > Canned, Dry & Packaged Foods > Jams, Jellies & Sweet Spreads > Nut Butters"
2349,361,justin's nut butter - almond butter squeeze pack classic - 1.15 oz.,"Grocery & Gourmet Food > Canned, Dry & Packaged Foods > Jams, Jellies & Sweet Spreads > Nut Butters"
2350,361,100% natural creamy peanut butter,"Grocery & Gourmet Food > Canned, Dry & Packaged Foods > Jams, Jellies & Sweet Spreads > Nut Butters"
2351,361,jif creamy peanut butter flavored granola bars,"Grocery & Gourmet Food > Canned, Dry & Packaged Foods > Jams, Jellies & Sweet Spreads > Nut Butters"
2352,361,nut n better organic creamy peanut butter,"Grocery & Gourmet Food > Canned, Dry & Packaged Foods > Jams, Jellies & Sweet Spreads > Nut Butters"
2353,361,creamy whipped peanut butter,"Grocery & Gourmet Food > Canned, Dry & Packaged Foods > Jams, Jellies & Sweet Spreads > Nut Butters"
2354,361,peter pan 100% natural crunchy peanut butter,"Grocery & Gourmet Food > Canned, Dry & Packaged Foods > Jams, Jellies & Sweet Spreads > Nut Butters"
2355,361,central market crunchy peanut butter,"Grocery & Gourmet Food > Canned, Dry & Packaged Foods > Jams, Jellies & Sweet Spreads > Nut Butters"
2356,361,simple truth organic frozen blueberries,"Grocery & Gourmet Food > Canned, Dry & Packaged Foods > Jams, Jellies & Sweet Spreads > Nut Butters"
2357,361,simple truth organic frozen strawberries,"Grocery & Gourmet Food > Canned, Dry & Packaged Foods > Jams, Jellies & Sweet Spreads > Nut Butters"
2358,361,publix reduced fat creamy peanut butter,"Grocery & Gourmet Food > Canned, Dry & Packaged Foods > Jams, Jellies & Sweet Spreads > Nut Butters"
2359,361,justin's all natural peanut butter blend,"Grocery & Gourmet Food > Canned, Dry & Packaged Foods > Jams, Jellies & Sweet Spreads > Nut Butters"
2360,361,barney butter crunchy almond butter spread,"Grocery & Gourmet Food > Canned, Dry & Packaged Foods > Jams, Jellies & Sweet Spreads > Nut Butters"
2361,361,peter pan peter pan peanut butter crunchy,"Grocery & Gourmet Food > Canned, Dry & Packaged Foods > Jams, Jellies & Sweet Spreads > Nut Butters"
