,category_id,description,category_path
783,361,pb2 powdered peanut butter - (6.5oz),"Grocery & Gourmet Food > Canned, Dry & Packaged Foods > Jams, Jellies & Sweet Spreads > Nut Butters"
784,361,"skippy creamy peanut butter (40 oz., 2 pk.)","Grocery & Gourmet Food > Canned, Dry & Packaged Foods > Jams, Jellies & Sweet Spreads > Nut Butters"
785,361,"jif extra crunchy peanut butter (48 oz. jar, 2 pk.)","Grocery & Gourmet Food > Canned, Dry & Packaged Foods > Jams, Jellies & Sweet Spreads > Nut Butters"
786,361,giant peanut butter creamy no salt added 18 oz jar,"Grocery & Gourmet Food > Canned, Dry & Packaged Foods > Jams, Jellies & Sweet Spreads > Nut Butters"
787,361,parkers farm peanut butter creamy all natural 16 oz tub,"Grocery & Gourmet Food > Canned, Dry & Packaged Foods > Jams, Jellies & Sweet Spreads > Nut Butters"
788,361,nature's promise free from almond butter smooth unsalted 16 oz jar,"Grocery & Gourmet Food > Canned, Dry & Packaged Foods > Jams, Jellies & Sweet Spreads > Nut Butters"
789,361,peanut butter & co mighty nut peanut butter original powdered 6.5 oz jar,"Grocery & Gourmet Food > Canned, Dry & Packaged Foods > Jams, Jellies & Sweet Spreads > Nut Butters"
790,361,jif peanut butter creamy - 2 pk 40 oz jar,"Grocery & Gourmet Food > Canned, Dry & Packaged Foods > Jams, Jellies & Sweet Spreads > Nut Butters"
791,361,teddie old fashioned peanut butter unsalted smooth all natural 16 oz jar,"Grocery & Gourmet Food > Canned, Dry & Packaged Foods > Jams, Jellies & Sweet Spreads > Nut Butters"
792,361,woodstock almond butter raw all natural 16 oz jar,"Grocery & Gourmet Food > Canned, Dry & Packaged Foods > Jams, Jellies & Sweet Spreads > Nut Butters"
793,361,o organics organic peanut butter old fashioned crunchy - 28 oz,"Grocery & Gourmet Food > Canned, Dry & Packaged Foods > Jams, Jellies & Sweet Spreads > Nut Butters"
794,361,im healthy soynut butter creamy - 15 oz,"Grocery & Gourmet Food > Canned, Dry & Packaged Foods > Jams, Jellies & Sweet Spreads > Nut Butters"
795,361,o organics organic peanut butter no stir crunchy - 18 oz,"Grocery & Gourmet Food > Canned, Dry & Packaged Foods > Jams, Jellies & Sweet Spreads > Nut Butters"
796,361,justin's® chocolate hazelnut butter blend - 10 oz,"Grocery & Gourmet Food > Canned, Dry & Packaged Foods > Jams, Jellies & Sweet Spreads > Nut Butters"
797,361,"jif creamy almond butter, 12 oz","Grocery & Gourmet Food > Canned, Dry & Packaged Foods > Jams, Jellies & Sweet Spreads > Nut Butters"
798,361,"skippy natural super chunk extra crunchy peanut butter spread, 40 oz","Grocery & Gourmet Food > Canned, Dry & Packaged Foods > Jams, Jellies & Sweet Spreads > Nut Butters"
799,361,"smart balance all natural rich roast chunky real peanut butter, 16 oz","Grocery & Gourmet Food > Canned, Dry & Packaged Foods > Jams, Jellies & Sweet Spreads > Nut Butters"
800,361,"smart balance: omega extra creamy natural peanut butter, 16 oz","Grocery & Gourmet Food > Canned, Dry & Packaged Foods > Jams, Jellies & Sweet Spreads > Nut Butters"
801,361,"peter pan crunchy honey roast peanut spread, 16.3 oz","Grocery & Gourmet Food > Canned, Dry & Packaged Foods > Jams, Jellies & Sweet Spreads > Nut Butters"
802,361,"nutella hazelnut spread, 10 count, 5.2 oz","Grocery & Gourmet Food > Canned, Dry & Packaged Foods > Jams, Jellies & Sweet Spreads > Nut Butters"
803,361,"skippy natural creamy peanut butter spread, 26.5 oz","Grocery & Gourmet Food > Canned, Dry & Packaged Foods > Jams, Jellies & Sweet Spreads > Nut Butters"
804,361,great value creamy peanut butter 28 ounces 12 count,"Grocery & Gourmet Food > Canned, Dry & Packaged Foods > Jams, Jellies & Sweet Spreads > Nut Butters"
805,361,"jif to go creamy peanut butter, 1.5 oz, box of 8","Grocery & Gourmet Food > Canned, Dry & Packaged Foods > Jams, Jellies & Sweet Spreads > Nut Butters"
806,361,nuts 'n more (3) 16 oz. jars of peanut butter,"Grocery & Gourmet Food > Canned, Dry & Packaged Foods > Jams, Jellies & Sweet Spreads > Nut Butters"
807,361,"skippy super chunk peanut butter, 48 oz, 2 ct","Grocery & Gourmet Food > Canned, Dry & Packaged Foods > Jams, Jellies & Sweet Spreads > Nut Butters"
808,361,justin's all-natural nut butter blend - 1.15 oz.,"Grocery & Gourmet Food > Canned, Dry & Packaged Foods > Jams, Jellies & Sweet Spreads > Nut Butters"
809,361,peanut butter bonbons,"Grocery & Gourmet Food > Canned, Dry & Packaged Foods > Jams, Jellies & Sweet Spreads > Nut Butters"
810,361,nuts n more high protein + almond spread chocolate almond -- 16 oz,"Grocery & Gourmet Food > Canned, Dry & Packaged Foods > Jams, Jellies & Sweet Spreads > Nut Butters"
811,361,once again almond smooth ns -- 16 oz,"Grocery & Gourmet Food > Canned, Dry & Packaged Foods > Jams, Jellies & Sweet Spreads > Nut Butters"
812,361,justin's hazelnut butter blend chocolate -- 16 oz,"Grocery & Gourmet Food > Canned, Dry & Packaged Foods > Jams, Jellies & Sweet Spreads > Nut Butters"
813,361,wild friends peanut butter chocolate coconut -- 16 oz,"Grocery & Gourmet Food > Canned, Dry & Packaged Foods > Jams, Jellies & Sweet Spreads > Nut Butters"
814,361,once again tahini -- 16 oz,"Grocery & Gourmet Food > Canned, Dry & Packaged Foods > Jams, Jellies & Sweet Spreads > Nut Butters"
815,361,justin's nut butter squeeze pack classic almond -- 1.15 oz,"Grocery & Gourmet Food > Canned, Dry & Packaged Foods > Jams, Jellies & Sweet Spreads > Nut Butters"
816,361,sunbutter organic sunflower seed spread creamy -- 16 oz,"Grocery & Gourmet Food > Canned, Dry & Packaged Foods > Jams, Jellies & Sweet Spreads > Nut Butters"
817,361,nuttzo organic seven nut and seed butter crunchy peanut free -- 16 oz,"Grocery & Gourmet Food > Canned, Dry & Packaged Foods > Jams, Jellies & Sweet Spreads > Nut Butters"
818,361,wild friends almond butter squeeze pack vanilla espresso -- 1.15 oz,"Grocery & Gourmet Food > Canned, Dry & Packaged Foods > Jams, Jellies & Sweet Spreads > Nut Butters"
819,361,justin's nut butter blend squeeze pack peanut butter honey -- 1.15 oz,"Grocery & Gourmet Food > Canned, Dry & Packaged Foods > Jams, Jellies & Sweet Spreads > Nut Butters"
820,361,yumbutter organic superfood almond butter creamy -- 7 oz,"Grocery & Gourmet Food > Canned, Dry & Packaged Foods > Jams, Jellies & Sweet Spreads > Nut Butters"
821,361,barney butter almond butter crunchy -- 10 oz,"Grocery & Gourmet Food > Canned, Dry & Packaged Foods > Jams, Jellies & Sweet Spreads > Nut Butters"
822,361,once again organic almond butter lightly toasted crunchy -- 16 oz,"Grocery & Gourmet Food > Canned, Dry & Packaged Foods > Jams, Jellies & Sweet Spreads > Nut Butters"
823,361,woodstock farms almond butter smooth unsalted -- 16 oz,"Grocery & Gourmet Food > Canned, Dry & Packaged Foods > Jams, Jellies & Sweet Spreads > Nut Butters"
824,361,organic traditions cacao butter gluten free -- 16 oz,"Grocery & Gourmet Food > Canned, Dry & Packaged Foods > Jams, Jellies & Sweet Spreads > Nut Butters"
825,361,santa cruz organic peanut butter dark roasted crunchy -- 16 oz,"Grocery & Gourmet Food > Canned, Dry & Packaged Foods > Jams, Jellies & Sweet Spreads > Nut Butters"
826,361,artisana organic cashew butter squeeze pack -- 1.19 oz,"Grocery & Gourmet Food > Canned, Dry & Packaged Foods > Jams, Jellies & Sweet Spreads > Nut Butters"
827,361,artisana organic raw pecan butter with cashews -- 8 oz,"Grocery & Gourmet Food > Canned, Dry & Packaged Foods > Jams, Jellies & Sweet Spreads > Nut Butters"
828,361,vitacost whole food certified organic acacia fiber - non-gmo -- 10 oz (283 grams),"Grocery & Gourmet Food > Canned, Dry & Packaged Foods > Jams, Jellies & Sweet Spreads > Nut Butters"
829,361,"maranatha all natural crunchy almond butter, no stir, 12 oz","Grocery & Gourmet Food > Canned, Dry & Packaged Foods > Jams, Jellies & Sweet Spreads > Nut Butters"
830,361,"nutella hazelnut spread, 26.5oz","Grocery & Gourmet Food > Canned, Dry & Packaged Foods > Jams, Jellies & Sweet Spreads > Nut Butters"
831,361,"smucker's creamy natural peanut butter, 16 oz","Grocery & Gourmet Food > Canned, Dry & Packaged Foods > Jams, Jellies & Sweet Spreads > Nut Butters"
832,361,"peanut butter & co. crunch time peanut butter, 14 oz","Grocery & Gourmet Food > Canned, Dry & Packaged Foods > Jams, Jellies & Sweet Spreads > Nut Butters"
833,361,skippy peanut butter - creamy - 64 oz,"Grocery & Gourmet Food > Canned, Dry & Packaged Foods > Jams, Jellies & Sweet Spreads > Nut Butters"
834,361,almond butter - crunchy 10 oz jar,"Grocery & Gourmet Food > Canned, Dry & Packaged Foods > Jams, Jellies & Sweet Spreads > Nut Butters"
835,361,sunbutter natural crunch sunflower seed spread (16oz),"Grocery & Gourmet Food > Canned, Dry & Packaged Foods > Jams, Jellies & Sweet Spreads > Nut Butters"
836,361,nutella 35.3 oz,"Grocery & Gourmet Food > Canned, Dry & Packaged Foods > Jams, Jellies & Sweet Spreads > Nut Butters"
837,361,nature's promise free from cashew butter smooth unsalted 16 oz jar,"Grocery & Gourmet Food > Canned, Dry & Packaged Foods > Jams, Jellies & Sweet Spreads > Nut Butters"
838,361,skippy peanut butter super chunk extra crunchy natural 15 oz jar,"Grocery & Gourmet Food > Canned, Dry & Packaged Foods > Jams, Jellies & Sweet Spreads > Nut Butters"
839,361,giant peanut butter creamy 16.3 oz jar,"Grocery & Gourmet Food > Canned, Dry & Packaged Foods > Jams, Jellies & Sweet Spreads > Nut Butters"
840,361,peapod peanut butter creamy 28 oz jar,"Grocery & Gourmet Food > Canned, Dry & Packaged Foods > Jams, Jellies & Sweet Spreads > Nut Butters"
841,361,giant peanut butter creamy natural 16 oz jar,"Grocery & Gourmet Food > Canned, Dry & Packaged Foods > Jams, Jellies & Sweet Spreads > Nut Butters"
842,361,ginger chopped christopher ranch 4.25 oz jar,"Grocery & Gourmet Food > Canned, Dry & Packaged Foods > Jams, Jellies & Sweet Spreads > Nut Butters"
843,361,justin's peanut butter classic all natural 1.15 oz pkt,"Grocery & Gourmet Food > Canned, Dry & Packaged Foods > Jams, Jellies & Sweet Spreads > Nut Butters"
844,361,jif to go natural peanut butter spread creamy low sodium - 12 oz,"Grocery & Gourmet Food > Canned, Dry & Packaged Foods > Jams, Jellies & Sweet Spreads > Nut Butters"
845,361,laura scudders natural old fashioned nutty peanut butter - 16 oz,"Grocery & Gourmet Food > Canned, Dry & Packaged Foods > Jams, Jellies & Sweet Spreads > Nut Butters"
846,361,jif to go peanut butter creamy - 12 oz,"Grocery & Gourmet Food > Canned, Dry & Packaged Foods > Jams, Jellies & Sweet Spreads > Nut Butters"
847,361,wild harvest organic crunchy peanut butter - (18oz),"Grocery & Gourmet Food > Canned, Dry & Packaged Foods > Jams, Jellies & Sweet Spreads > Nut Butters"
848,361,skippy roasted honey nut creamy peanut butter - (16.3oz),"Grocery & Gourmet Food > Canned, Dry & Packaged Foods > Jams, Jellies & Sweet Spreads > Nut Butters"
849,361,"freshdirect freshly ground almond butter, smooth - (12oz)","Grocery & Gourmet Food > Canned, Dry & Packaged Foods > Jams, Jellies & Sweet Spreads > Nut Butters"
850,361,"jif creamy peanut butter to go cups - (1.5oz cups, 8pk)","Grocery & Gourmet Food > Canned, Dry & Packaged Foods > Jams, Jellies & Sweet Spreads > Nut Butters"
851,361,artisana organics raw walnut butter with cashews - (8oz),"Grocery & Gourmet Food > Canned, Dry & Packaged Foods > Jams, Jellies & Sweet Spreads > Nut Butters"
852,361,peanut butter & co. white chocolate wonderful - (16oz),"Grocery & Gourmet Food > Canned, Dry & Packaged Foods > Jams, Jellies & Sweet Spreads > Nut Butters"
853,361,stop & shop peanut butter creamy no salt added 16.3 oz jar,"Grocery & Gourmet Food > Canned, Dry & Packaged Foods > Jams, Jellies & Sweet Spreads > Nut Butters"
854,361,giant peanut butter chunky 40 oz jar,"Grocery & Gourmet Food > Canned, Dry & Packaged Foods > Jams, Jellies & Sweet Spreads > Nut Butters"
855,361,peapod hazelnut spread with cocoa 13 oz jar,"Grocery & Gourmet Food > Canned, Dry & Packaged Foods > Jams, Jellies & Sweet Spreads > Nut Butters"
856,361,nature's promise organics almond butter 16 oz jar,"Grocery & Gourmet Food > Canned, Dry & Packaged Foods > Jams, Jellies & Sweet Spreads > Nut Butters"
857,361,giant peanut butter creamy reduced fat 18 oz jar,"Grocery & Gourmet Food > Canned, Dry & Packaged Foods > Jams, Jellies & Sweet Spreads > Nut Butters"
858,361,nature's promise organics peanut butter crunchy 16 oz jar,"Grocery & Gourmet Food > Canned, Dry & Packaged Foods > Jams, Jellies & Sweet Spreads > Nut Butters"
859,361,just great stuff peanut butter powdered organic 6.43 oz jar,"Grocery & Gourmet Food > Canned, Dry & Packaged Foods > Jams, Jellies & Sweet Spreads > Nut Butters"
860,361,jif peanut butter extra crunchy - 28 oz,"Grocery & Gourmet Food > Canned, Dry & Packaged Foods > Jams, Jellies & Sweet Spreads > Nut Butters"
861,361,signature kitchens peanut butter chunky - 64 oz,"Grocery & Gourmet Food > Canned, Dry & Packaged Foods > Jams, Jellies & Sweet Spreads > Nut Butters"
862,361,adams 100% unsalted natural crunchy peanut butter - 16 oz,"Grocery & Gourmet Food > Canned, Dry & Packaged Foods > Jams, Jellies & Sweet Spreads > Nut Butters"
863,361,peter pan peanut butter creamy - 16.3 oz,"Grocery & Gourmet Food > Canned, Dry & Packaged Foods > Jams, Jellies & Sweet Spreads > Nut Butters"
864,361,adams peanut butter 100% natural creamy no stir - 16 oz,"Grocery & Gourmet Food > Canned, Dry & Packaged Foods > Jams, Jellies & Sweet Spreads > Nut Butters"
865,361,earth balance coconut & peanut spread creamy - 16 oz,"Grocery & Gourmet Food > Canned, Dry & Packaged Foods > Jams, Jellies & Sweet Spreads > Nut Butters"
866,361,smart balance natural peanut butter rich roast creamy - 16 oz,"Grocery & Gourmet Food > Canned, Dry & Packaged Foods > Jams, Jellies & Sweet Spreads > Nut Butters"
867,361,smart balance rich roast creamy peanut butter - 16 oz,"Grocery & Gourmet Food > Canned, Dry & Packaged Foods > Jams, Jellies & Sweet Spreads > Nut Butters"
868,361,smuckers peanut butter natural chunky - 16 oz,"Grocery & Gourmet Food > Canned, Dry & Packaged Foods > Jams, Jellies & Sweet Spreads > Nut Butters"
869,361,signature kitchens peanut butter creamy - 18 oz,"Grocery & Gourmet Food > Canned, Dry & Packaged Foods > Jams, Jellies & Sweet Spreads > Nut Butters"
870,361,adams peanut butter 100% natural creamy - 16 oz,"Grocery & Gourmet Food > Canned, Dry & Packaged Foods > Jams, Jellies & Sweet Spreads > Nut Butters"
871,361,"meijer crunchy peanut butter, 16 oz","Grocery & Gourmet Food > Canned, Dry & Packaged Foods > Jams, Jellies & Sweet Spreads > Nut Butters"
872,361,"justin's classic almond butter, 16 oz","Grocery & Gourmet Food > Canned, Dry & Packaged Foods > Jams, Jellies & Sweet Spreads > Nut Butters"
873,361,"jif to go natural creamy peanut butter, 8 oz","Grocery & Gourmet Food > Canned, Dry & Packaged Foods > Jams, Jellies & Sweet Spreads > Nut Butters"
874,361,"meijer creamy peanut butter, 16 oz","Grocery & Gourmet Food > Canned, Dry & Packaged Foods > Jams, Jellies & Sweet Spreads > Nut Butters"
875,361,jif natural creamy peanut butter - 16 oz.,"Grocery & Gourmet Food > Canned, Dry & Packaged Foods > Jams, Jellies & Sweet Spreads > Nut Butters"
876,361,"skippy skippy super chunk extra crunchy peanut butter, 28 ounce","Grocery & Gourmet Food > Canned, Dry & Packaged Foods > Jams, Jellies & Sweet Spreads > Nut Butters"
877,361,"jif jif natural peanut butter, creamy, low sodium, 16 oz","Grocery & Gourmet Food > Canned, Dry & Packaged Foods > Jams, Jellies & Sweet Spreads > Nut Butters"
878,361,"bell plantation cpb2 powdered chocolate peanut butter, 16 oz","Grocery & Gourmet Food > Canned, Dry & Packaged Foods > Jams, Jellies & Sweet Spreads > Nut Butters"
879,361,better n peanut butter better n peanut butter original creamy -- 16 ounce,"Grocery & Gourmet Food > Canned, Dry & Packaged Foods > Jams, Jellies & Sweet Spreads > Nut Butters"
880,361,pb2 bell plantation pb2 powdered peanut butter with chocolate...,"Grocery & Gourmet Food > Canned, Dry & Packaged Foods > Jams, Jellies & Sweet Spreads > Nut Butters"
881,361,smart balance smart balance peanut butter rich roast and chunky -- 16 oz,"Grocery & Gourmet Food > Canned, Dry & Packaged Foods > Jams, Jellies & Sweet Spreads > Nut Butters"
882,361,"peter pan peter pan peanut butter, creamy, honey roast, 28 oz","Grocery & Gourmet Food > Canned, Dry & Packaged Foods > Jams, Jellies & Sweet Spreads > Nut Butters"
883,361,"bell plantation pb2 powdered peanut butter, 16 ounce jar","Grocery & Gourmet Food > Canned, Dry & Packaged Foods > Jams, Jellies & Sweet Spreads > Nut Butters"
884,361,"jif jif extra crunchy peanut butter, 40 ounce","Grocery & Gourmet Food > Canned, Dry & Packaged Foods > Jams, Jellies & Sweet Spreads > Nut Butters"
885,361,"skippy skippy peanut butter, creamy, 40 oz","Grocery & Gourmet Food > Canned, Dry & Packaged Foods > Jams, Jellies & Sweet Spreads > Nut Butters"
886,361,"peter pan peter pan peanut butter, creamy, 16.3 oz","Grocery & Gourmet Food > Canned, Dry & Packaged Foods > Jams, Jellies & Sweet Spreads > Nut Butters"
887,361,"justin's all-natural maple almond butter, 16 oz","Grocery & Gourmet Food > Canned, Dry & Packaged Foods > Jams, Jellies & Sweet Spreads > Nut Butters"
888,361,"adams crunchy 100% natural peanut butter, 36 oz","Grocery & Gourmet Food > Canned, Dry & Packaged Foods > Jams, Jellies & Sweet Spreads > Nut Butters"
889,361,"adams creamy 100% natural peanut butter, 36 oz","Grocery & Gourmet Food > Canned, Dry & Packaged Foods > Jams, Jellies & Sweet Spreads > Nut Butters"
890,361,"smucker's natural creamy peanut butter, 26 oz","Grocery & Gourmet Food > Canned, Dry & Packaged Foods > Jams, Jellies & Sweet Spreads > Nut Butters"
891,361,"maranatha butter all natural no stir almond crunchy, 12 oz","Grocery & Gourmet Food > Canned, Dry & Packaged Foods > Jams, Jellies & Sweet Spreads > Nut Butters"
892,361,"justin's maple almond butter, 12 oz","Grocery & Gourmet Food > Canned, Dry & Packaged Foods > Jams, Jellies & Sweet Spreads > Nut Butters"
893,361,"justin's all-natural chocolate hazelnut butter blend, 16 oz","Grocery & Gourmet Food > Canned, Dry & Packaged Foods > Jams, Jellies & Sweet Spreads > Nut Butters"
894,361,"skippy chunky peanut butter, 2-cou...","Grocery & Gourmet Food > Canned, Dry & Packaged Foods > Jams, Jellies & Sweet Spreads > Nut Butters"
895,361,"skippy creamy peanut butter, 2-cou...","Grocery & Gourmet Food > Canned, Dry & Packaged Foods > Jams, Jellies & Sweet Spreads > Nut Butters"
896,361,"laura scudder's old fashioned peanut butter, smooth, unsalted - 16 oz jar","Grocery & Gourmet Food > Canned, Dry & Packaged Foods > Jams, Jellies & Sweet Spreads > Nut Butters"
897,361,skippy creamy peanut butter - 28 oz plastic jar,"Grocery & Gourmet Food > Canned, Dry & Packaged Foods > Jams, Jellies & Sweet Spreads > Nut Butters"
898,361,Powdered Peanut Butter - 12,"Grocery & Gourmet Food > Canned, Dry & Packaged Foods > Jams, Jellies & Sweet Spreads > Nut Butters"
899,361,"justins peanut butter squeeze packets, natural, 1.15 ounce (pack of 10)","Grocery & Gourmet Food > Canned, Dry & Packaged Foods > Jams, Jellies & Sweet Spreads > Nut Butters"
900,361,"teddie all natural peanut butter, super chunky, 26-ounce jar (pack of 3)","Grocery & Gourmet Food > Canned, Dry & Packaged Foods > Jams, Jellies & Sweet Spreads > Nut Butters"
901,361,"barney butter almond butter single serve packs,1.06 ounce, 12-count (pack of 2)","Grocery & Gourmet Food > Canned, Dry & Packaged Foods > Jams, Jellies & Sweet Spreads > Nut Butters"
902,361,"nutella hazelnut spread, 13 oz","Grocery & Gourmet Food > Canned, Dry & Packaged Foods > Jams, Jellies & Sweet Spreads > Nut Butters"
903,361,"bell plantation pb2 peanut butter, 1 lb jar (1-pack)","Grocery & Gourmet Food > Canned, Dry & Packaged Foods > Jams, Jellies & Sweet Spreads > Nut Butters"
904,361,kevala cashew butter 12oz,"Grocery & Gourmet Food > Canned, Dry & Packaged Foods > Jams, Jellies & Sweet Spreads > Nut Butters"
905,361,pb2 powdered peanut butter bundle - 2 items: powdered peanut butter 16 oz. and powdered chocolate peanut butter 16 oz new,"Grocery & Gourmet Food > Canned, Dry & Packaged Foods > Jams, Jellies & Sweet Spreads > Nut Butters"
906,361,"Justin's Almond Butter, Chocolate Squeeze Packs, 1.15 Ounce (Pack of 10)","Grocery & Gourmet Food > Canned, Dry & Packaged Foods > Jams, Jellies & Sweet Spreads > Nut Butters"
907,361,gel sticks - 12 ct.,"Grocery & Gourmet Food > Canned, Dry & Packaged Foods > Jams, Jellies & Sweet Spreads > Nut Butters"
908,361,bell plantation powdered peanut butter 16 oz - 2 pack,"Grocery & Gourmet Food > Canned, Dry & Packaged Foods > Jams, Jellies & Sweet Spreads > Nut Butters"
909,361,"Wild Friends Foods Seasonal Peanut Butter Pumpkin Spice 16 oz, Pack of 3","Grocery & Gourmet Food > Canned, Dry & Packaged Foods > Jams, Jellies & Sweet Spreads > Nut Butters"
910,361,Good Spread All-natural Peanut Butter + Honey - 16 Oz Jar (3 Pack) .. Healthy Snack with a Delicious,"Grocery & Gourmet Food > Canned, Dry & Packaged Foods > Jams, Jellies & Sweet Spreads > Nut Butters"
911,361,"PB Trimmed Powdered Peanut Butter (Salted Caramel, 16 Oz)","Grocery & Gourmet Food > Canned, Dry & Packaged Foods > Jams, Jellies & Sweet Spreads > Nut Butters"
912,361,"jif whipped creamy peanut butter, 15 ounce","Grocery & Gourmet Food > Canned, Dry & Packaged Foods > Jams, Jellies & Sweet Spreads > Nut Butters"
913,361,pb2 chocolate powdered peanut butter - 1lb - 2 pack,"Grocery & Gourmet Food > Canned, Dry & Packaged Foods > Jams, Jellies & Sweet Spreads > Nut Butters"
914,361,"peanut butter powder by hoosier hill farm, 1 lb.","Grocery & Gourmet Food > Canned, Dry & Packaged Foods > Jams, Jellies & Sweet Spreads > Nut Butters"
915,361,"i.m. healthy unsweetened creamy soynut butter, 15 -ounce jars (pack of 6)","Grocery & Gourmet Food > Canned, Dry & Packaged Foods > Jams, Jellies & Sweet Spreads > Nut Butters"
916,361,"Jif To Go Chocolate Silk Peanut Butter and Chocolate Flavored Spread, 4.5 Ounce","Grocery & Gourmet Food > Canned, Dry & Packaged Foods > Jams, Jellies & Sweet Spreads > Nut Butters"
917,361,Nuts 'N More White Chocolate Peanut Butter - 16 Oz,"Grocery & Gourmet Food > Canned, Dry & Packaged Foods > Jams, Jellies & Sweet Spreads > Nut Butters"
918,361,"Legendary Foods Almond Nut Butter - Add Protein to Your Favorite Snacks with this Raw, Healthy Spread - No Sugar","Grocery & Gourmet Food > Canned, Dry & Packaged Foods > Jams, Jellies & Sweet Spreads > Nut Butters"
919,361,Barney Butter Bare Almond,"Grocery & Gourmet Food > Canned, Dry & Packaged Foods > Jams, Jellies & Sweet Spreads > Nut Butters"
920,361,Trader Joe's Crunchy Salted Peanut Butter with Flax and Chia Seeds 2 Pack 16 Oz Jars,"Grocery & Gourmet Food > Canned, Dry & Packaged Foods > Jams, Jellies & Sweet Spreads > Nut Butters"
921,361,Better N Peanut Butter Low Sodium Creamy Peanut Butter -- 16 oz,"Grocery & Gourmet Food > Canned, Dry & Packaged Foods > Jams, Jellies & Sweet Spreads > Nut Butters"
922,361,Skippy Super Chunk Peanut,"Grocery & Gourmet Food > Canned, Dry & Packaged Foods > Jams, Jellies & Sweet Spreads > Nut Butters"
923,361,Go Lo Dark Hazelnut Spread 11oz,"Grocery & Gourmet Food > Canned, Dry & Packaged Foods > Jams, Jellies & Sweet Spreads > Nut Butters"
924,361,"justin's almond butter, vanilla squeeze packs, 1.15 ounce (pack of 10)","Grocery & Gourmet Food > Canned, Dry & Packaged Foods > Jams, Jellies & Sweet Spreads > Nut Butters"
925,361,"pb2 powdered peanut butter,6.5 oz","Grocery & Gourmet Food > Canned, Dry & Packaged Foods > Jams, Jellies & Sweet Spreads > Nut Butters"
926,361,peanut butter & co. - dark chocolate dreams peanut butter blended with rich dark chocolate - 16 oz.,"Grocery & Gourmet Food > Canned, Dry & Packaged Foods > Jams, Jellies & Sweet Spreads > Nut Butters"
927,361,"Skippy Peanut Butter, Creamy, 16.3 Ounce","Grocery & Gourmet Food > Canned, Dry & Packaged Foods > Jams, Jellies & Sweet Spreads > Nut Butters"
928,361,zinke orchards crunchy almond butter (12 pack),"Grocery & Gourmet Food > Canned, Dry & Packaged Foods > Jams, Jellies & Sweet Spreads > Nut Butters"
929,361,"nuts 'n more peanut butter, 16 ounce","Grocery & Gourmet Food > Canned, Dry & Packaged Foods > Jams, Jellies & Sweet Spreads > Nut Butters"
930,361,Justins Honey Peanut Butter 16oz (3 Pack),"Grocery & Gourmet Food > Canned, Dry & Packaged Foods > Jams, Jellies & Sweet Spreads > Nut Butters"
931,361,artisana raw organic cashew butter - 11.9oz box (travel packs).,"Grocery & Gourmet Food > Canned, Dry & Packaged Foods > Jams, Jellies & Sweet Spreads > Nut Butters"
932,361,"maranatha natural almond butter, lightly roasted, 26-ounce (pack of 3)","Grocery & Gourmet Food > Canned, Dry & Packaged Foods > Jams, Jellies & Sweet Spreads > Nut Butters"
933,361,"barney butter all natural almond butter, smooth - 16 oz","Grocery & Gourmet Food > Canned, Dry & Packaged Foods > Jams, Jellies & Sweet Spreads > Nut Butters"
934,361,skippy natural creamy peanut butter twin pack 40 oz each,"Grocery & Gourmet Food > Canned, Dry & Packaged Foods > Jams, Jellies & Sweet Spreads > Nut Butters"
935,361,pb2 powdered peanut butter 6.5 oz,"Grocery & Gourmet Food > Canned, Dry & Packaged Foods > Jams, Jellies & Sweet Spreads > Nut Butters"
936,361,jif natural creamy peanut butter 16 oz,"Grocery & Gourmet Food > Canned, Dry & Packaged Foods > Jams, Jellies & Sweet Spreads > Nut Butters"
937,361,skippy natural 15-oz. creamy peanut butter,"Grocery & Gourmet Food > Canned, Dry & Packaged Foods > Jams, Jellies & Sweet Spreads > Nut Butters"
938,361,smuckers natural creamy peanut butter 26 oz,"Grocery & Gourmet Food > Canned, Dry & Packaged Foods > Jams, Jellies & Sweet Spreads > Nut Butters"
939,361,great value peanut butter trail mix 26 oz,"Grocery & Gourmet Food > Canned, Dry & Packaged Foods > Jams, Jellies & Sweet Spreads > Nut Butters"
940,361,"skippy creamy peanut butter spread, 64 oz","Grocery & Gourmet Food > Canned, Dry & Packaged Foods > Jams, Jellies & Sweet Spreads > Nut Butters"
