,category_id,description,category_path
1573,361,"maranatha creamy coconut almond butter, 12 oz","Grocery & Gourmet Food > Canned, Dry & Packaged Foods > Jams, Jellies & Sweet Spreads > Nut Butters"
1574,361,"peter pan 100% natural creamy peanut butter spread, 28 oz","Grocery & Gourmet Food > Canned, Dry & Packaged Foods > Jams, Jellies & Sweet Spreads > Nut Butters"
1575,361,"peter pan 100% natural crunchy peanut butter spread, 16.3 oz","Grocery & Gourmet Food > Canned, Dry & Packaged Foods > Jams, Jellies & Sweet Spreads > Nut Butters"
1576,361,justin's all natural maple almond butter 16 oz,"Grocery & Gourmet Food > Canned, Dry & Packaged Foods > Jams, Jellies & Sweet Spreads > Nut Butters"
1577,361,"jif peanut butter, extra crunchy - 16 oz jar","Grocery & Gourmet Food > Canned, Dry & Packaged Foods > Jams, Jellies & Sweet Spreads > Nut Butters"
1578,361,skippy natural 15-oz. creamy peanu...,"Grocery & Gourmet Food > Canned, Dry & Packaged Foods > Jams, Jellies & Sweet Spreads > Nut Butters"
1579,361,market pantry reduced fat creamy peanut butter 18 oz,"Grocery & Gourmet Food > Canned, Dry & Packaged Foods > Jams, Jellies & Sweet Spreads > Nut Butters"
1580,361,"justins peanut butter, classic - 16 oz jar","Grocery & Gourmet Food > Canned, Dry & Packaged Foods > Jams, Jellies & Sweet Spreads > Nut Butters"
1581,361,"jif peanut butter, extra crunchy - 40 oz jar","Grocery & Gourmet Food > Canned, Dry & Packaged Foods > Jams, Jellies & Sweet Spreads > Nut Butters"
1582,361,"justins peanut butter blend, honey - 1.15 oz","Grocery & Gourmet Food > Canned, Dry & Packaged Foods > Jams, Jellies & Sweet Spreads > Nut Butters"
1583,361,"justin's all-natural almond butter, maple - 16 oz jar","Grocery & Gourmet Food > Canned, Dry & Packaged Foods > Jams, Jellies & Sweet Spreads > Nut Butters"
1584,361,"skippy peanut butter, creamy - 64 oz jar","Grocery & Gourmet Food > Canned, Dry & Packaged Foods > Jams, Jellies & Sweet Spreads > Nut Butters"
1585,361,"adams 100% natural peanut butter, creamy - 36 oz jar","Grocery & Gourmet Food > Canned, Dry & Packaged Foods > Jams, Jellies & Sweet Spreads > Nut Butters"
1586,361,nutella hazelnut spread 1kg,"Grocery & Gourmet Food > Canned, Dry & Packaged Foods > Jams, Jellies & Sweet Spreads > Nut Butters"
1587,361,"adams 100% natural peanut butter, creamy - 16 oz jar","Grocery & Gourmet Food > Canned, Dry & Packaged Foods > Jams, Jellies & Sweet Spreads > Nut Butters"
1588,361,"laura scudder's old fashioned peanut butter, smooth - 26 oz jar","Grocery & Gourmet Food > Canned, Dry & Packaged Foods > Jams, Jellies & Sweet Spreads > Nut Butters"
1589,361,"santa cruz organic light roasted peanut butter, crunchy - 16 oz jar","Grocery & Gourmet Food > Canned, Dry & Packaged Foods > Jams, Jellies & Sweet Spreads > Nut Butters"
1590,361,market pantry reduced fat crunchy peanut butter spread 18 oz,"Grocery & Gourmet Food > Canned, Dry & Packaged Foods > Jams, Jellies & Sweet Spreads > Nut Butters"
1591,361,peter pan creamy whipped peanut butter,"Grocery & Gourmet Food > Canned, Dry & Packaged Foods > Jams, Jellies & Sweet Spreads > Nut Butters"
1592,361,smooth almond butter,"Grocery & Gourmet Food > Canned, Dry & Packaged Foods > Jams, Jellies & Sweet Spreads > Nut Butters"
1593,361,jif creamy peanut butter to go,"Grocery & Gourmet Food > Canned, Dry & Packaged Foods > Jams, Jellies & Sweet Spreads > Nut Butters"
1594,361,smart balance omega creamy natural peanut butter,"Grocery & Gourmet Food > Canned, Dry & Packaged Foods > Jams, Jellies & Sweet Spreads > Nut Butters"
1595,361,hill country fare crunchy peanut butter,"Grocery & Gourmet Food > Canned, Dry & Packaged Foods > Jams, Jellies & Sweet Spreads > Nut Butters"
1596,361,smart balance all natural rich roast chunky peanut butter,"Grocery & Gourmet Food > Canned, Dry & Packaged Foods > Jams, Jellies & Sweet Spreads > Nut Butters"
1597,361,earth balance natural buttery spread soy free,"Grocery & Gourmet Food > Canned, Dry & Packaged Foods > Jams, Jellies & Sweet Spreads > Nut Butters"
1598,361,maranatha no stir crunchy almond butter spread,"Grocery & Gourmet Food > Canned, Dry & Packaged Foods > Jams, Jellies & Sweet Spreads > Nut Butters"
1599,361,"nutella, hazelnut spread, 13 ounce","Grocery & Gourmet Food > Canned, Dry & Packaged Foods > Jams, Jellies & Sweet Spreads > Nut Butters"
1600,361,"maranatha all natural creamy peanut butter, no stir, 16 oz","Grocery & Gourmet Food > Canned, Dry & Packaged Foods > Jams, Jellies & Sweet Spreads > Nut Butters"
1601,361,Jif Natural Creamy Peanut Butter Spread - 28 oz,"Grocery & Gourmet Food > Canned, Dry & Packaged Foods > Jams, Jellies & Sweet Spreads > Nut Butters"
1602,361,"almond butter crunchy, kevala, 7 lbs pail","Grocery & Gourmet Food > Canned, Dry & Packaged Foods > Jams, Jellies & Sweet Spreads > Nut Butters"
1603,361,"nuts n more pumpkin peanut butter, 16 ounce","Grocery & Gourmet Food > Canned, Dry & Packaged Foods > Jams, Jellies & Sweet Spreads > Nut Butters"
1604,361,"Artisana Organic Raw Cashew Butter, 16 oz","Grocery & Gourmet Food > Canned, Dry & Packaged Foods > Jams, Jellies & Sweet Spreads > Nut Butters"
1605,361,jif peanut butter creamy 40 oz jar (2 pack),"Grocery & Gourmet Food > Canned, Dry & Packaged Foods > Jams, Jellies & Sweet Spreads > Nut Butters"
1606,361,"Justin's Almond Butter, Honey, 16 Ounce","Grocery & Gourmet Food > Canned, Dry & Packaged Foods > Jams, Jellies & Sweet Spreads > Nut Butters"
1607,361,"Skippy 2-48 Oz Natural Peanut Butter Spread Creamy, 6 Lb","Grocery & Gourmet Food > Canned, Dry & Packaged Foods > Jams, Jellies & Sweet Spreads > Nut Butters"
1608,361,"Peanut Butter & Co. Peanut Butter, Cinnamon Raisin Swirl, 16 Ounce Jars (Pack of 2)","Grocery & Gourmet Food > Canned, Dry & Packaged Foods > Jams, Jellies & Sweet Spreads > Nut Butters"
1609,361,"Nutella Hazelnut Spread, 13","Grocery & Gourmet Food > Canned, Dry & Packaged Foods > Jams, Jellies & Sweet Spreads > Nut Butters"
1610,361,nutella chocolate hazelnut spread 35.3oz jar,"Grocery & Gourmet Food > Canned, Dry & Packaged Foods > Jams, Jellies & Sweet Spreads > Nut Butters"
1611,361,"Maranatha Creamy Raw Maple Almond Butter, 12 oz","Grocery & Gourmet Food > Canned, Dry & Packaged Foods > Jams, Jellies & Sweet Spreads > Nut Butters"
1612,361,"Don't Go Nuts Nut-Free Organic Roasted Soybean Spread Dips, Chocolate, (Pack of 8)","Grocery & Gourmet Food > Canned, Dry & Packaged Foods > Jams, Jellies & Sweet Spreads > Nut Butters"
1613,361,better n peanut butter original creamy -- 16 oz,"Grocery & Gourmet Food > Canned, Dry & Packaged Foods > Jams, Jellies & Sweet Spreads > Nut Butters"
1614,361,Peanut Butter Powder by,"Grocery & Gourmet Food > Canned, Dry & Packaged Foods > Jams, Jellies & Sweet Spreads > Nut Butters"
1615,361,"peter pan 100% natural honey roast creamy peanut and honey spread, 28 ounce","Grocery & Gourmet Food > Canned, Dry & Packaged Foods > Jams, Jellies & Sweet Spreads > Nut Butters"
1616,361,"jif extra crunchy peanut butter, 96 ounce","Grocery & Gourmet Food > Canned, Dry & Packaged Foods > Jams, Jellies & Sweet Spreads > Nut Butters"
1617,361,"Bell Plantation PB2 Powdered Peanut Butter with Chocolate, 6.5 Ounce","Grocery & Gourmet Food > Canned, Dry & Packaged Foods > Jams, Jellies & Sweet Spreads > Nut Butters"
1618,361,"justin's honey almond butter, squeeze packs, 1.15 ounce (pack of 10)","Grocery & Gourmet Food > Canned, Dry & Packaged Foods > Jams, Jellies & Sweet Spreads > Nut Butters"
1619,361,"bell plantation pb2 powdered peanut butter, 16-ounce - 2 pack misc.","Grocery & Gourmet Food > Canned, Dry & Packaged Foods > Jams, Jellies & Sweet Spreads > Nut Butters"
1620,361,"justin's nut butter, chocolate hazelnut, 16 oz jar (9247623)","Grocery & Gourmet Food > Canned, Dry & Packaged Foods > Jams, Jellies & Sweet Spreads > Nut Butters"
1621,361,"jif to go crunchy peanut butter, 12 ounce (pack of 6)","Grocery & Gourmet Food > Canned, Dry & Packaged Foods > Jams, Jellies & Sweet Spreads > Nut Butters"
1622,361,"Peanut Butter & Co. Peanut Butter, Mighty Maple, 16 Ounce Jars (Pack of 2)","Grocery & Gourmet Food > Canned, Dry & Packaged Foods > Jams, Jellies & Sweet Spreads > Nut Butters"
1623,361,"jif creamy reduced fat peanut butter spread, 16 ounce (pack of 12)","Grocery & Gourmet Food > Canned, Dry & Packaged Foods > Jams, Jellies & Sweet Spreads > Nut Butters"
1624,361,"Justin's Almond Butter, Honey, 16 Ounce (Pack of 6)","Grocery & Gourmet Food > Canned, Dry & Packaged Foods > Jams, Jellies & Sweet Spreads > Nut Butters"
1625,361,Teddie Smooth Old Fashioned All Natural Peanut Butter-16 Ounce Jar,"Grocery & Gourmet Food > Canned, Dry & Packaged Foods > Jams, Jellies & Sweet Spreads > Nut Butters"
1626,361,PB2 Powdered Peanut Butter 6.5 oz (6-Pack),"Grocery & Gourmet Food > Canned, Dry & Packaged Foods > Jams, Jellies & Sweet Spreads > Nut Butters"
1627,361,sunbutter natural no-stir creamy sunflower seed spread 16 oz,"Grocery & Gourmet Food > Canned, Dry & Packaged Foods > Jams, Jellies & Sweet Spreads > Nut Butters"
1628,361,raw organic cashew butter-16 ozs.,"Grocery & Gourmet Food > Canned, Dry & Packaged Foods > Jams, Jellies & Sweet Spreads > Nut Butters"
1629,361,bell plantation chocolate powdered peanut butter 16 oz - 3 pack,"Grocery & Gourmet Food > Canned, Dry & Packaged Foods > Jams, Jellies & Sweet Spreads > Nut Butters"
1630,361,Justins Nut Butter Natural,"Grocery & Gourmet Food > Canned, Dry & Packaged Foods > Jams, Jellies & Sweet Spreads > Nut Butters"
1631,361,"jif natural creamy peanut butter spread, 40-ounce (pack of 2)","Grocery & Gourmet Food > Canned, Dry & Packaged Foods > Jams, Jellies & Sweet Spreads > Nut Butters"
1632,361,"Justin's Chocolate Hazelnut Butter Blend, 16 Ounce","Grocery & Gourmet Food > Canned, Dry & Packaged Foods > Jams, Jellies & Sweet Spreads > Nut Butters"
1633,361,Powdered Peanut Butter Bundle: 1 HONEY (6.5 Oz) And 1 SALTED CARAMEL (6.5 Oz),"Grocery & Gourmet Food > Canned, Dry & Packaged Foods > Jams, Jellies & Sweet Spreads > Nut Butters"
1634,361,"Peanut Butter White Chocolate Wonderful, 16-Ounce (Pack of 3)","Grocery & Gourmet Food > Canned, Dry & Packaged Foods > Jams, Jellies & Sweet Spreads > Nut Butters"
1635,361,"nuttzo omega-3 multi-nut butter, 16-ounce","Grocery & Gourmet Food > Canned, Dry & Packaged Foods > Jams, Jellies & Sweet Spreads > Nut Butters"
1636,361,"Just Great Stuff Powdered Organic Peanut Butter, Chocolate, 6.35 Ounce","Grocery & Gourmet Food > Canned, Dry & Packaged Foods > Jams, Jellies & Sweet Spreads > Nut Butters"
1637,361,SunButter Organic Sunflower,"Grocery & Gourmet Food > Canned, Dry & Packaged Foods > Jams, Jellies & Sweet Spreads > Nut Butters"
1638,361,"Woodstock Organic RAW Almond Butter, Unsalted, 16 oz","Grocery & Gourmet Food > Canned, Dry & Packaged Foods > Jams, Jellies & Sweet Spreads > Nut Butters"
1639,361,"Skippy Peanut Butter In-a-Cup, 100 pack, large 3/4 ounce cups","Grocery & Gourmet Food > Canned, Dry & Packaged Foods > Jams, Jellies & Sweet Spreads > Nut Butters"
1640,361,"Justin's Classic Peanut Butter, 16 oz (Pack of 2)","Grocery & Gourmet Food > Canned, Dry & Packaged Foods > Jams, Jellies & Sweet Spreads > Nut Butters"
1641,361,bell plantation powdered peanut butter 16 oz - 6 pack,"Grocery & Gourmet Food > Canned, Dry & Packaged Foods > Jams, Jellies & Sweet Spreads > Nut Butters"
1642,361,pb2 powdered peanut butter and chocolate peanut butter 1 lb (pack of 2 (1 of each flavor)),"Grocery & Gourmet Food > Canned, Dry & Packaged Foods > Jams, Jellies & Sweet Spreads > Nut Butters"
1643,361,Oebel Marzipan Stollen 750g/26.5 Oz Baked in Germany,"Grocery & Gourmet Food > Canned, Dry & Packaged Foods > Jams, Jellies & Sweet Spreads > Nut Butters"
1644,361,"Good Spread Honey Peanut Butter - Natural Peanut Butter, Smooth, 16 oz. Jar (3 Pack)","Grocery & Gourmet Food > Canned, Dry & Packaged Foods > Jams, Jellies & Sweet Spreads > Nut Butters"
1645,361,SunButter Natural No-Stir,"Grocery & Gourmet Food > Canned, Dry & Packaged Foods > Jams, Jellies & Sweet Spreads > Nut Butters"
1646,361,"skippy super chunk peanut butter, 64-ounce containers (pack of 2)","Grocery & Gourmet Food > Canned, Dry & Packaged Foods > Jams, Jellies & Sweet Spreads > Nut Butters"
1647,361,"Bell Plantation PB2 Powdered Peanut Butter, 1 lb Jar (2-pack)","Grocery & Gourmet Food > Canned, Dry & Packaged Foods > Jams, Jellies & Sweet Spreads > Nut Butters"
1648,361,"bell plantation pb2 powdered peanut butter, 16-ounce - 4 pack","Grocery & Gourmet Food > Canned, Dry & Packaged Foods > Jams, Jellies & Sweet Spreads > Nut Butters"
1649,361,"justin's nut butter, honey peanut butter squeeze packs, 1.15 oz. (pack of 15)","Grocery & Gourmet Food > Canned, Dry & Packaged Foods > Jams, Jellies & Sweet Spreads > Nut Butters"
1650,361,wild friends all natural almond butter squeeze pack vanilla espresso -- 1.15 oz,"Grocery & Gourmet Food > Canned, Dry & Packaged Foods > Jams, Jellies & Sweet Spreads > Nut Butters"
1651,361,once again peanut butter organic crunchy -- 16 oz,"Grocery & Gourmet Food > Canned, Dry & Packaged Foods > Jams, Jellies & Sweet Spreads > Nut Butters"
1652,361,rigoni di asiago nocciolata organic hazelnut spread with cocoa and milk -- 9.52 oz,"Grocery & Gourmet Food > Canned, Dry & Packaged Foods > Jams, Jellies & Sweet Spreads > Nut Butters"
1653,361,artisana organics raw nut butter cashew -- 14 oz,"Grocery & Gourmet Food > Canned, Dry & Packaged Foods > Jams, Jellies & Sweet Spreads > Nut Butters"
1654,361,once again peanut butter creamy no salt -- 16 oz,"Grocery & Gourmet Food > Canned, Dry & Packaged Foods > Jams, Jellies & Sweet Spreads > Nut Butters"
1655,361,artisana organics raw nut butter almond -- 16 oz,"Grocery & Gourmet Food > Canned, Dry & Packaged Foods > Jams, Jellies & Sweet Spreads > Nut Butters"
1656,361,vitacost certified organic smooth & unsalted peanut butter smooth unsalted -- 18 oz (510 g),"Grocery & Gourmet Food > Canned, Dry & Packaged Foods > Jams, Jellies & Sweet Spreads > Nut Butters"
1657,361,barney butter almond butter smooth -- 16 oz,"Grocery & Gourmet Food > Canned, Dry & Packaged Foods > Jams, Jellies & Sweet Spreads > Nut Butters"
1658,361,wild friends organic sunflower butter honey -- 1.15 oz,"Grocery & Gourmet Food > Canned, Dry & Packaged Foods > Jams, Jellies & Sweet Spreads > Nut Butters"
1659,361,buff bake protein peanut butter cinnamon raisin -- 13 oz,"Grocery & Gourmet Food > Canned, Dry & Packaged Foods > Jams, Jellies & Sweet Spreads > Nut Butters"
1660,361,justin's peanut butter gluten free classic -- 16 oz,"Grocery & Gourmet Food > Canned, Dry & Packaged Foods > Jams, Jellies & Sweet Spreads > Nut Butters"
1661,361,"reese's pieces cane christmas,1.51 oz","Grocery & Gourmet Food > Canned, Dry & Packaged Foods > Jams, Jellies & Sweet Spreads > Nut Butters"
1662,361,justin's nut butter natural maple almond butterplastic jar - 16 oz,"Grocery & Gourmet Food > Canned, Dry & Packaged Foods > Jams, Jellies & Sweet Spreads > Nut Butters"
1663,361,wild harvest organic creamy peanut butter - (18oz),"Grocery & Gourmet Food > Canned, Dry & Packaged Foods > Jams, Jellies & Sweet Spreads > Nut Butters"
1664,361,peanut butter & co. old fashioned smooth - (16oz),"Grocery & Gourmet Food > Canned, Dry & Packaged Foods > Jams, Jellies & Sweet Spreads > Nut Butters"
1665,361,justin's all-natural classic almond butter - (16oz),"Grocery & Gourmet Food > Canned, Dry & Packaged Foods > Jams, Jellies & Sweet Spreads > Nut Butters"
1666,361,justin's all-natural classic peanut butter - (16oz),"Grocery & Gourmet Food > Canned, Dry & Packaged Foods > Jams, Jellies & Sweet Spreads > Nut Butters"
1667,361,yumbutter superfood almond butter - (7oz),"Grocery & Gourmet Food > Canned, Dry & Packaged Foods > Jams, Jellies & Sweet Spreads > Nut Butters"
1668,361,skippy® natural creamy peanut butter - 2/40oz,"Grocery & Gourmet Food > Canned, Dry & Packaged Foods > Jams, Jellies & Sweet Spreads > Nut Butters"
1669,361,simply jif peanut butter creamy low sodium & less sugar 15.5 oz jar,"Grocery & Gourmet Food > Canned, Dry & Packaged Foods > Jams, Jellies & Sweet Spreads > Nut Butters"
1670,361,stop & shop peanut butter creamy reduced fat 16.3 oz jar,"Grocery & Gourmet Food > Canned, Dry & Packaged Foods > Jams, Jellies & Sweet Spreads > Nut Butters"
1671,361,jif peanut butter extra crunchy 40 oz jar,"Grocery & Gourmet Food > Canned, Dry & Packaged Foods > Jams, Jellies & Sweet Spreads > Nut Butters"
1672,361,maranatha almond butter no stir creamy all natural 12 oz jar,"Grocery & Gourmet Food > Canned, Dry & Packaged Foods > Jams, Jellies & Sweet Spreads > Nut Butters"
1673,361,maranatha peanut butter creamy no-stir organic 16 oz jar,"Grocery & Gourmet Food > Canned, Dry & Packaged Foods > Jams, Jellies & Sweet Spreads > Nut Butters"
1674,361,giant peanut butter creamy 64 oz jar,"Grocery & Gourmet Food > Canned, Dry & Packaged Foods > Jams, Jellies & Sweet Spreads > Nut Butters"
1675,361,nutella spread hazelnut with skim milk & cocoa 26.5 oz jar,"Grocery & Gourmet Food > Canned, Dry & Packaged Foods > Jams, Jellies & Sweet Spreads > Nut Butters"
1676,361,santa cruz organic dark roasted peanut butter creamy 16 oz jar,"Grocery & Gourmet Food > Canned, Dry & Packaged Foods > Jams, Jellies & Sweet Spreads > Nut Butters"
1677,361,earth balance peanut butter and flaxseed creamy natural 16 oz jar,"Grocery & Gourmet Food > Canned, Dry & Packaged Foods > Jams, Jellies & Sweet Spreads > Nut Butters"
1678,361,teddie old fashioned peanut butter super chunky unsalted all natural 16 oz jar,"Grocery & Gourmet Food > Canned, Dry & Packaged Foods > Jams, Jellies & Sweet Spreads > Nut Butters"
1679,361,jif natural creamy peanut butter spread - 28 oz,"Grocery & Gourmet Food > Canned, Dry & Packaged Foods > Jams, Jellies & Sweet Spreads > Nut Butters"
1680,361,skippy chunky peanut butter - 64 oz,"Grocery & Gourmet Food > Canned, Dry & Packaged Foods > Jams, Jellies & Sweet Spreads > Nut Butters"
1681,361,safeway kitchens chunky peanut butter - 16 oz,"Grocery & Gourmet Food > Canned, Dry & Packaged Foods > Jams, Jellies & Sweet Spreads > Nut Butters"
1682,361,o organics organic peanut butter spread no stir creamy - 18 oz,"Grocery & Gourmet Food > Canned, Dry & Packaged Foods > Jams, Jellies & Sweet Spreads > Nut Butters"
1683,361,laura scudders peanut butter old fashioned smooth - 16 oz,"Grocery & Gourmet Food > Canned, Dry & Packaged Foods > Jams, Jellies & Sweet Spreads > Nut Butters"
1684,361,laura scudders peanut butter old fashioned smooth unsalted - 16 oz,"Grocery & Gourmet Food > Canned, Dry & Packaged Foods > Jams, Jellies & Sweet Spreads > Nut Butters"
1685,361,"walden farms whipped peanut spread chocolate peanut, 12 oz. calorie free","Grocery & Gourmet Food > Canned, Dry & Packaged Foods > Jams, Jellies & Sweet Spreads > Nut Butters"
1686,361,"pb2 powdered peanut butter natural, 6.5 oz.","Grocery & Gourmet Food > Canned, Dry & Packaged Foods > Jams, Jellies & Sweet Spreads > Nut Butters"
1687,361,"nutella hazelnut spread, 26.5 oz","Grocery & Gourmet Food > Canned, Dry & Packaged Foods > Jams, Jellies & Sweet Spreads > Nut Butters"
1688,361,"skippy natural creamy peanut butter spread, 40 oz","Grocery & Gourmet Food > Canned, Dry & Packaged Foods > Jams, Jellies & Sweet Spreads > Nut Butters"
1689,361,"jif jif whips whipped peanut butter, creamy, 15 oz","Grocery & Gourmet Food > Canned, Dry & Packaged Foods > Jams, Jellies & Sweet Spreads > Nut Butters"
1690,361,"skippy skippy super chunk peanut butter, extra crunchy, 28 oz","Grocery & Gourmet Food > Canned, Dry & Packaged Foods > Jams, Jellies & Sweet Spreads > Nut Butters"
1691,361,once again once again organic tahini 16 oz - vegan,"Grocery & Gourmet Food > Canned, Dry & Packaged Foods > Jams, Jellies & Sweet Spreads > Nut Butters"
1692,361,crazy richard's crazy richard's creamy peanut butter 16 oz,"Grocery & Gourmet Food > Canned, Dry & Packaged Foods > Jams, Jellies & Sweet Spreads > Nut Butters"
1693,361,"justin's justin's all natural almond butter, classic, 16 oz","Grocery & Gourmet Food > Canned, Dry & Packaged Foods > Jams, Jellies & Sweet Spreads > Nut Butters"
1694,361,biscoff biscoff spread -- 14 oz,"Grocery & Gourmet Food > Canned, Dry & Packaged Foods > Jams, Jellies & Sweet Spreads > Nut Butters"
1695,361,crazy richard's crazy richard's chunky peanut butter 16 oz,"Grocery & Gourmet Food > Canned, Dry & Packaged Foods > Jams, Jellies & Sweet Spreads > Nut Butters"
1696,361,"barney butter barney butter smooth almond butter, 10 ounce jars","Grocery & Gourmet Food > Canned, Dry & Packaged Foods > Jams, Jellies & Sweet Spreads > Nut Butters"
1697,361,jif jif peanut butter extra crunchy 28 ounce,"Grocery & Gourmet Food > Canned, Dry & Packaged Foods > Jams, Jellies & Sweet Spreads > Nut Butters"
1698,361,"peter pan peter pan peanut butter, creamy, honey roast, 16.3 oz","Grocery & Gourmet Food > Canned, Dry & Packaged Foods > Jams, Jellies & Sweet Spreads > Nut Butters"
1699,361,trader joe's organic peanut butter creamy unsalted 16 oz,"Grocery & Gourmet Food > Canned, Dry & Packaged Foods > Jams, Jellies & Sweet Spreads > Nut Butters"
1700,361,"Justin's Almond Butter, Classic, 16 Ounce","Grocery & Gourmet Food > Canned, Dry & Packaged Foods > Jams, Jellies & Sweet Spreads > Nut Butters"
1701,361,"nutilight - sugar free, low carb, hazelnut and cocoa spread 11 oz. jar","Grocery & Gourmet Food > Canned, Dry & Packaged Foods > Jams, Jellies & Sweet Spreads > Nut Butters"
1702,361,"Organic Nuttzo Seven Nut and Seed Butter, Smooth, 26 Ounce","Grocery & Gourmet Food > Canned, Dry & Packaged Foods > Jams, Jellies & Sweet Spreads > Nut Butters"
1703,361,Jiva Organics RAW SPROUTED Organic Almond Butter 8-Ounce Jar,"Grocery & Gourmet Food > Canned, Dry & Packaged Foods > Jams, Jellies & Sweet Spreads > Nut Butters"
1704,361,"Jif To Go Chocolate Silk Peanut Butter and Chocolate Flavored Spread, 12 Ounce","Grocery & Gourmet Food > Canned, Dry & Packaged Foods > Jams, Jellies & Sweet Spreads > Nut Butters"
1705,361,"better n peanut butter low salt spread, size: 16 oz (pack of 6)","Grocery & Gourmet Food > Canned, Dry & Packaged Foods > Jams, Jellies & Sweet Spreads > Nut Butters"
1706,361,justins classic almond butter squeeze pack 1.15oz,"Grocery & Gourmet Food > Canned, Dry & Packaged Foods > Jams, Jellies & Sweet Spreads > Nut Butters"
1707,361,justin's® maple almond butter - 10 oz,"Grocery & Gourmet Food > Canned, Dry & Packaged Foods > Jams, Jellies & Sweet Spreads > Nut Butters"
1708,361,"great value creamy peanut butter, 28 ounces","Grocery & Gourmet Food > Canned, Dry & Packaged Foods > Jams, Jellies & Sweet Spreads > Nut Butters"
1709,361,peter pan honey roast creamy peanut natural honey spread 40 oz,"Grocery & Gourmet Food > Canned, Dry & Packaged Foods > Jams, Jellies & Sweet Spreads > Nut Butters"
1710,361,"teddie smooth old fashioned all natural peanut butter, 16 oz","Grocery & Gourmet Food > Canned, Dry & Packaged Foods > Jams, Jellies & Sweet Spreads > Nut Butters"
1711,361,"jif chocolate silk peanut butter, 8 count","Grocery & Gourmet Food > Canned, Dry & Packaged Foods > Jams, Jellies & Sweet Spreads > Nut Butters"
1712,361,"nutella: hazelnut with skim milk cocoa spread, 13 oz","Grocery & Gourmet Food > Canned, Dry & Packaged Foods > Jams, Jellies & Sweet Spreads > Nut Butters"
1713,361,"skippy natural creamy peanut butter spread, 15.0 oz","Grocery & Gourmet Food > Canned, Dry & Packaged Foods > Jams, Jellies & Sweet Spreads > Nut Butters"
1714,361,justins classic almond butter 12 oz,"Grocery & Gourmet Food > Canned, Dry & Packaged Foods > Jams, Jellies & Sweet Spreads > Nut Butters"
1715,361,"peter pan creamy honey roast peanut spread, 16.3 oz","Grocery & Gourmet Food > Canned, Dry & Packaged Foods > Jams, Jellies & Sweet Spreads > Nut Butters"
1716,361,great value smooth peanut butter 18 ounces 12 count,"Grocery & Gourmet Food > Canned, Dry & Packaged Foods > Jams, Jellies & Sweet Spreads > Nut Butters"
1717,361,jif creamy peanut butter-40 oz,"Grocery & Gourmet Food > Canned, Dry & Packaged Foods > Jams, Jellies & Sweet Spreads > Nut Butters"
1718,361,woodstock smooth almond butter lightly toasted -- 16 oz,"Grocery & Gourmet Food > Canned, Dry & Packaged Foods > Jams, Jellies & Sweet Spreads > Nut Butters"
1719,361,windy city organics dastony™ cashew butter -- 8 oz,"Grocery & Gourmet Food > Canned, Dry & Packaged Foods > Jams, Jellies & Sweet Spreads > Nut Butters"
1720,361,peanut butter & co smooth operator® creamy peanut butter -- 16 oz,"Grocery & Gourmet Food > Canned, Dry & Packaged Foods > Jams, Jellies & Sweet Spreads > Nut Butters"
1721,361,windy city organics rawmio chocolate hazelnut spread -- 6 oz,"Grocery & Gourmet Food > Canned, Dry & Packaged Foods > Jams, Jellies & Sweet Spreads > Nut Butters"
1722,361,vitacost whole food all natural raw smooth & unsalted almond butter -- 16 oz (454 g),"Grocery & Gourmet Food > Canned, Dry & Packaged Foods > Jams, Jellies & Sweet Spreads > Nut Butters"
1723,361,windy city organics raw guru organic raw coconut flakes -- 16 oz,"Grocery & Gourmet Food > Canned, Dry & Packaged Foods > Jams, Jellies & Sweet Spreads > Nut Butters"
1724,361,justin's classic almond butter peanut free original -- 16 oz,"Grocery & Gourmet Food > Canned, Dry & Packaged Foods > Jams, Jellies & Sweet Spreads > Nut Butters"
1725,361,barney butter bare almond butter crunchy -- 10 oz,"Grocery & Gourmet Food > Canned, Dry & Packaged Foods > Jams, Jellies & Sweet Spreads > Nut Butters"
1726,361,artisana organic raw almond butter squeeze pack -- 1.19 oz,"Grocery & Gourmet Food > Canned, Dry & Packaged Foods > Jams, Jellies & Sweet Spreads > Nut Butters"
1727,361,wild friends all natural peanut butter chocolate coconut -- 16 oz,"Grocery & Gourmet Food > Canned, Dry & Packaged Foods > Jams, Jellies & Sweet Spreads > Nut Butters"
1728,361,windy city organics rawmio™ organic gourmet active superfood raw chocolate bark -- 1.76 oz,"Grocery & Gourmet Food > Canned, Dry & Packaged Foods > Jams, Jellies & Sweet Spreads > Nut Butters"
