,category_id,description,category_path
0,394,"Jell-O Cook and Serve Pudding and Pie Filling, Chocolate, 5-Ounce Boxes (Pack of 6)",Grocery & Gourmet Food > Cooking & Baking > Pie & Pastry Fillings
1,394,"Jell-O Instant Pudding & Pie Filling, Pistachio, 3.4-Ounce Boxes (Pack of 4)",Grocery & Gourmet Food > Cooking & Baking > Pie & Pastry Fillings
2,394,"Jell-O Sugar-Free Instant Pudding & Pie Filling, Chocolate Fudge, 1.4-Ounce Boxes (Pack of 6)",Grocery & Gourmet Food > Cooking & Baking > Pie & Pastry Fillings
3,394,"JELL-O Instant Pudding and Pie Filling, Butterscotch, 3.4-Ounce",Grocery & Gourmet Food > Cooking & Baking > Pie & Pastry Fillings
4,394,Jell-O Instant Banana Cream Pudding & Pie Filling 3.4 oz,Grocery & Gourmet Food > Cooking & Baking > Pie & Pastry Fillings
5,394,Jell-O Instant Lemon Pudding & Pie Filling 3.4 oz,Grocery & Gourmet Food > Cooking & Baking > Pie & Pastry Fillings
6,394,Lucky Leaf Premium Strawberry Rhubarb Fruit Filling Topping 21 oz Can,Grocery & Gourmet Food > Cooking & Baking > Pie & Pastry Fillings
7,394,"Comstock Original Country Apple Pie Filling Or Topping, 21 oz",Grocery & Gourmet Food > Cooking & Baking > Pie & Pastry Fillings
8,394,Peapod Pie Filling & Topping Blueberry 21 OZ CAN,Grocery & Gourmet Food > Cooking & Baking > Pie & Pastry Fillings
9,394,Jell-O Instant Pudding & Pie Filling Butterscotch Fat Free Sugar Free 1 OZ BOX,Grocery & Gourmet Food > Cooking & Baking > Pie & Pastry Fillings
10,394,Lucky Leaf Premium Pie Filling or Topping Apple 21 OZ CAN,Grocery & Gourmet Food > Cooking & Baking > Pie & Pastry Fillings
11,394,Peapod Instant Pudding & Pie Filling Vanilla 3.4 OZ BOX,Grocery & Gourmet Food > Cooking & Baking > Pie & Pastry Fillings
12,394,Jell-O Pudding & Pie Filling Instant Banana Cream - 3.4 Oz,Grocery & Gourmet Food > Cooking & Baking > Pie & Pastry Fillings
13,394,Jell-O Pudding & Pie Filling Instant French Vanilla - 3.4 Oz,Grocery & Gourmet Food > Cooking & Baking > Pie & Pastry Fillings
14,394,"Libby's Libby's, 100% Pure Pumpkin, 15 Oz",Grocery & Gourmet Food > Cooking & Baking > Pie & Pastry Fillings
15,394,"Jell-O Pistachio Instant Pudding & Pie Filling, 3.4 oz",Grocery & Gourmet Food > Cooking & Baking > Pie & Pastry Fillings
16,394,"Great Value Apple Pie Filling Or Topping, 21 oz",Grocery & Gourmet Food > Cooking & Baking > Pie & Pastry Fillings
17,394,"Comstock More Fruit Cherry Pie Filling Or Topping, 21 oz",Grocery & Gourmet Food > Cooking & Baking > Pie & Pastry Fillings
18,394,"Jell-O Instant Pudding & Pie Filling, Vanilla, Sugar Free/Fat Free - 1 oz box",Grocery & Gourmet Food > Cooking & Baking > Pie & Pastry Fillings
19,394,Libby's 100% Pure Pumpkin - 29 oz ...,Grocery & Gourmet Food > Cooking & Baking > Pie & Pastry Fillings
20,394,Libby's 100% Pure Pumpkin - 29 oz can,Grocery & Gourmet Food > Cooking & Baking > Pie & Pastry Fillings
21,394,"Jell-O Instant Pudding & Pie Filling, Oreo Cookies 'n Cream - 4.2 oz box",Grocery & Gourmet Food > Cooking & Baking > Pie & Pastry Fillings
22,394,Jell-o Chocolate Instant Pudding & Pie Filling,Grocery & Gourmet Food > Cooking & Baking > Pie & Pastry Fillings
23,394,"Pinnacle Foods Corp Comstock Cherry Pie Filling, 21 oz",Grocery & Gourmet Food > Cooking & Baking > Pie & Pastry Fillings
24,394,Comstock Original Country Peach - 21.00 oz,Grocery & Gourmet Food > Cooking & Baking > Pie & Pastry Fillings
25,394,Musselman's Cherry Pie Filling - 21.00 oz,Grocery & Gourmet Food > Cooking & Baking > Pie & Pastry Fillings
26,394,Jell-O Pudding & Pie Filling - 3.40 oz,Grocery & Gourmet Food > Cooking & Baking > Pie & Pastry Fillings
27,394,"Organic Pumpkin, 15 Ounce",Grocery & Gourmet Food > Cooking & Baking > Pie & Pastry Fillings
28,394,"Jell-O Cheesecake Flavored Instant Pudding & Pie Filling, 3.4 oz Boxes (3 Pack)",Grocery & Gourmet Food > Cooking & Baking > Pie & Pastry Fillings
29,394,"Borden None Such Condensed Mincemeat, Apples & Raisins, 9 OZ Box (Pack of 2)",Grocery & Gourmet Food > Cooking & Baking > Pie & Pastry Fillings
30,394,"Jell-O Instant Pudding and Pie Filling, Coconut Cream, 3.4-Ounce Boxes (Pack of 6))",Grocery & Gourmet Food > Cooking & Baking > Pie & Pastry Fillings
31,394,Libby's 100% Pure Pumpkin 3 PK 29oz. Cans,Grocery & Gourmet Food > Cooking & Baking > Pie & Pastry Fillings
32,394,"JELL-O Instant Pudding and Pie Filling, Chocolate, 3.9 Ounce (Pack of 4)",Grocery & Gourmet Food > Cooking & Baking > Pie & Pastry Fillings
33,394,"Kraft Jell-O Instant Pudding Dessert & Pie Filling, Pumpkin Spice, 3.4 Oz. Boxes (Pack of 6)",Grocery & Gourmet Food > Cooking & Baking > Pie & Pastry Fillings
34,394,Jell-O Instant Sugar Free-Fat Free Butterscotch Pudding and Pie Filling 1 oz,Grocery & Gourmet Food > Cooking & Baking > Pie & Pastry Fillings
35,394,"Great Value Cherry Pie Filling or Topping, 21 oz",Grocery & Gourmet Food > Cooking & Baking > Pie & Pastry Fillings
36,394,"Libby's 100% Pure Pumpkin, 29 oz",Grocery & Gourmet Food > Cooking & Baking > Pie & Pastry Fillings
37,394,Duncan Hines Comstock Original Lemon Creme Pie Filling Topping 21 oz Can,Grocery & Gourmet Food > Cooking & Baking > Pie & Pastry Fillings
38,394,Jell-O Instant Pudding & Pie Filling Chocolate Fat Free Sugar Free 2.1 OZ BOX,Grocery & Gourmet Food > Cooking & Baking > Pie & Pastry Fillings
39,394,Lucky Leaf Premium Pie Filling or Topping Peach 21 OZ CAN,Grocery & Gourmet Food > Cooking & Baking > Pie & Pastry Fillings
40,394,Jell-O Cook & Serve Pudding & Pie Filling Tapioca Fat Free 3 OZ BOX,Grocery & Gourmet Food > Cooking & Baking > Pie & Pastry Fillings
41,394,Jell-O Pudding & Pie Filling Instant Coconut Cream - 3.4 Oz,Grocery & Gourmet Food > Cooking & Baking > Pie & Pastry Fillings
42,394,Libbys 100% Pure Pumpkin - 29 Oz,Grocery & Gourmet Food > Cooking & Baking > Pie & Pastry Fillings
43,394,"Meijer Cherry Pie Filling with Sugar, 21 oz",Grocery & Gourmet Food > Cooking & Baking > Pie & Pastry Fillings
44,394,Jell-O Jell-O Sugar-Free Instant Pudding and Pie Filling - Chees...,Grocery & Gourmet Food > Cooking & Baking > Pie & Pastry Fillings
45,394,"Borden Borden None Such Condensed Mincemeat, Apples & Raisins, 9...",Grocery & Gourmet Food > Cooking & Baking > Pie & Pastry Fillings
46,394,"Solo Apricot Cake & Pastry Filling, 12 oz",Grocery & Gourmet Food > Cooking & Baking > Pie & Pastry Fillings
47,394,"Libby's 100% Pure Pumpkin, 15 oz",Grocery & Gourmet Food > Cooking & Baking > Pie & Pastry Fillings
48,394,"Jell-O Chocolate Instant Pudding & Pie Filling, 5.9 oz",Grocery & Gourmet Food > Cooking & Baking > Pie & Pastry Fillings
49,394,"Great Value Sugar Free Reduced Calorie French Vanilla Pudding & Pie Filling, 1.34 oz",Grocery & Gourmet Food > Cooking & Baking > Pie & Pastry Fillings
50,394,"Wilderness Berry Medley Pie Filling or Topping, 22 oz",Grocery & Gourmet Food > Cooking & Baking > Pie & Pastry Fillings
51,394,"Duncan Hines Wilderness Simply Cherry Pie Filling & Topping, 21 oz",Grocery & Gourmet Food > Cooking & Baking > Pie & Pastry Fillings
52,394,Libby's 100% Pure Pumpkin 30 oz,Grocery & Gourmet Food > Cooking & Baking > Pie & Pastry Fillings
53,394,"Jell-O Instant Pudding & Pie Filling, Vanilla - 5.1 oz box",Grocery & Gourmet Food > Cooking & Baking > Pie & Pastry Fillings
54,394,Jell-O Cook & Serve Chocolate Pudding & Pie Filling,Grocery & Gourmet Food > Cooking & Baking > Pie & Pastry Fillings
55,394,"Jell-O Instant Pudding & Pie Filling, Coconut, 3.4 oz",Grocery & Gourmet Food > Cooking & Baking > Pie & Pastry Fillings
56,394,ShopRite Pie Filling - Apple - 21.00 oz,Grocery & Gourmet Food > Cooking & Baking > Pie & Pastry Fillings
57,394,Lucky Leaf Pie Filling - Lite - C - 20.00 oz,Grocery & Gourmet Food > Cooking & Baking > Pie & Pastry Fillings
58,394,"Farmer's Market Organic Pumpkin Puree, 16 Ounce (Pack of 12)",Grocery & Gourmet Food > Cooking & Baking > Pie & Pastry Fillings
59,394,"Jell-O Instant Pudding and Pie Filling, French Vanilla, 3.4-Ounce Boxes (Pack of 6)",Grocery & Gourmet Food > Cooking & Baking > Pie & Pastry Fillings
60,394,"Jell-O Sugar Free-Fat Free Instant Pudding and Pie Filling, Vanilla, 1-Ounce Boxes (Pack of 6)",Grocery & Gourmet Food > Cooking & Baking > Pie & Pastry Fillings
61,394,"Jell-O Instant Pudding and Pie Filling, Chocolate Fudge, 3.9-Ounce Boxes (Pack of 6)",Grocery & Gourmet Food > Cooking & Baking > Pie & Pastry Fillings
62,394,Jell-O Instant Vanilla Pudding & Pie Filling 5.1 oz,Grocery & Gourmet Food > Cooking & Baking > Pie & Pastry Fillings
63,394,Jell-O Instant Sugar Free-Fat Free Chocolate Fudge Pudding & Pie Filling 1.4 oz,Grocery & Gourmet Food > Cooking & Baking > Pie & Pastry Fillings
64,394,Solo Apricot Cake Pastry Filling 12 oz,Grocery & Gourmet Food > Cooking & Baking > Pie & Pastry Fillings
65,394,Libby's 100% Pure Pumpkin 29 oz. Can,Grocery & Gourmet Food > Cooking & Baking > Pie & Pastry Fillings
66,394,"Great Value: Blueberry Pie Filling, 21 Oz",Grocery & Gourmet Food > Cooking & Baking > Pie & Pastry Fillings
67,394,"Jell-O Instant Pudding and Pie Filling, Vanilla - (3.4oz)",Grocery & Gourmet Food > Cooking & Baking > Pie & Pastry Fillings
68,394,Libby's 100% Pure Pumpkin - 29 oz. - 3 ct. - 934595,Grocery & Gourmet Food > Cooking & Baking > Pie & Pastry Fillings
69,394,Jell-O Instant Pudding & Pie Filling Chocolate Fat Free Sugar Free 1.4 OZ BOX,Grocery & Gourmet Food > Cooking & Baking > Pie & Pastry Fillings
70,394,Jell-O Instant Pudding & Pie Filling Oreo Cookies 'n Creme 4.2 OZ BOX,Grocery & Gourmet Food > Cooking & Baking > Pie & Pastry Fillings
71,394,Jell-O Instant Pudding & Pie Filling Butterscotch 3.4 OZ BOX,Grocery & Gourmet Food > Cooking & Baking > Pie & Pastry Fillings
72,394,Jell-O Pudding & Pie Filling Instant Lemon - 3.4 Oz,Grocery & Gourmet Food > Cooking & Baking > Pie & Pastry Fillings
73,394,"Meijer Instant Chocolate Pudding & Pie Filling, 3.9 oz",Grocery & Gourmet Food > Cooking & Baking > Pie & Pastry Fillings
74,394,"Libby's Libbys 100% Pure Pumpkin, 29 Ounce",Grocery & Gourmet Food > Cooking & Baking > Pie & Pastry Fillings
75,394,"Jell-O Jell-O: Instant Banana Cream Pudding & Pie Filling, 5.1 Oz",Grocery & Gourmet Food > Cooking & Baking > Pie & Pastry Fillings
76,394,"Jell-O Jell-O Instant Pudding & Pie Filling, Vanilla, 5.1 Ounce",Grocery & Gourmet Food > Cooking & Baking > Pie & Pastry Fillings
77,394,"Great Value Chocolate Instant Pudding & Pie Filling, 3.9 oz",Grocery & Gourmet Food > Cooking & Baking > Pie & Pastry Fillings
78,394,"Great Value French Vanilla Instant Pudding & Pie Filling, 3.4 oz",Grocery & Gourmet Food > Cooking & Baking > Pie & Pastry Fillings
79,394,"Jell-O Coconut Cream Instant Pudding & Pie Filling, 3.4 oz",Grocery & Gourmet Food > Cooking & Baking > Pie & Pastry Fillings
80,394,"Great Value Banana Cream Instant Pudding & Pie Filling, 3.4 oz",Grocery & Gourmet Food > Cooking & Baking > Pie & Pastry Fillings
81,394,"Jell-O Oreo Cookies 'N Cream With Cookie Pieces Instant Pudding & Pie Filling, 4.2 oz",Grocery & Gourmet Food > Cooking & Baking > Pie & Pastry Fillings
82,394,Market Pantry Cherry Pie Filling Or Topping 21-oz.,Grocery & Gourmet Food > Cooking & Baking > Pie & Pastry Fillings
83,394,"Libby's Easy Pumpkin, Pie Mix - 30 oz can",Grocery & Gourmet Food > Cooking & Baking > Pie & Pastry Fillings
84,394,"Duncan Hines Comstock Pie Filling & Topping, Original Country Cherry - 21 oz can",Grocery & Gourmet Food > Cooking & Baking > Pie & Pastry Fillings
85,394,"Jell-O Instant Pudding & Pie Filling, Chocolate - 3.9 oz box",Grocery & Gourmet Food > Cooking & Baking > Pie & Pastry Fillings
86,394,"Jell-O Instant Pudding & Pie Filling, Butterscotch, Sugar Free/Fat Free - 1 oz box",Grocery & Gourmet Food > Cooking & Baking > Pie & Pastry Fillings
87,394,"Jell-O Instant Pudding & Pie Filling, Chocolate - 2.1 oz box",Grocery & Gourmet Food > Cooking & Baking > Pie & Pastry Fillings
88,394,Jell-O Cook & Serve Vanilla Pudding & Pie Filling,Grocery & Gourmet Food > Cooking & Baking > Pie & Pastry Fillings
89,394,Jell-O Instant Vanilla Pudding & Pie Filling Mix,Grocery & Gourmet Food > Cooking & Baking > Pie & Pastry Fillings
90,394,Jell-O Oreo Cookies 'n Cream Instant Pudding & Pie Filling,Grocery & Gourmet Food > Cooking & Baking > Pie & Pastry Fillings
91,394,"Jell-O Cook & Serve Pudding & Pie Filling, Vanilla, 4.6 oz",Grocery & Gourmet Food > Cooking & Baking > Pie & Pastry Fillings
92,394,Lucky Leaf Pie Filling - Strawber - 21.00 oz,Grocery & Gourmet Food > Cooking & Baking > Pie & Pastry Fillings
93,394,"Jell-O Sugar-Free Instant Pudding and Pie Filling, Cheesecake, 1-Ounce Boxes",Grocery & Gourmet Food > Cooking & Baking > Pie & Pastry Fillings
94,394,Jell-O Instant Strawberry Creme Pudding and Pie Filling 3.4 Ounces (Pack of 4),Grocery & Gourmet Food > Cooking & Baking > Pie & Pastry Fillings
95,394,"Borden None Such Condensed Mincemeat, Apples & Raisins, 9-ounce Box (Pack of 4)",Grocery & Gourmet Food > Cooking & Baking > Pie & Pastry Fillings
96,394,"Jell-O Cook and Serve Pudding and Pie Filling, Sugar-Free, Fat Free, Vanilla, 0.8-Ounce Boxes (Pack of 6)",Grocery & Gourmet Food > Cooking & Baking > Pie & Pastry Fillings
97,394,"Kraft Jell-O Instant Pudding Dessert & Pie Filling, Pumpkin Spice, 3.4 Oz. Boxes (Pack of 8)",Grocery & Gourmet Food > Cooking & Baking > Pie & Pastry Fillings
98,394,Jell-O Instant Sugar Free-Fat Free Vanilla Pudding & Pie Filling .8 oz,Grocery & Gourmet Food > Cooking & Baking > Pie & Pastry Fillings
99,394,"Libby's Pumpkin: Easy Pumpkin Pie Mix , 30 Oz",Grocery & Gourmet Food > Cooking & Baking > Pie & Pastry Fillings
100,394,Lucky Leaf Premium Caramel Apple Pie Filling 21 oz. Can,Grocery & Gourmet Food > Cooking & Baking > Pie & Pastry Fillings
101,394,Giant Instant Pudding & Pie Filling Chocolate 3.9 OZ BOX,Grocery & Gourmet Food > Cooking & Baking > Pie & Pastry Fillings
102,394,Jell-O Cook & Serve Pudding & Pie Filling Vanilla 4.6 OZ BOX,Grocery & Gourmet Food > Cooking & Baking > Pie & Pastry Fillings
103,394,Jell-O Instant Pudding & Pie Filling Vanilla Fat Free Sugar Free 1 OZ BOX,Grocery & Gourmet Food > Cooking & Baking > Pie & Pastry Fillings
104,394,Jell-O Cook & Serve Pudding & Pie Filling Chocolate 5 OZ BOX,Grocery & Gourmet Food > Cooking & Baking > Pie & Pastry Fillings
105,394,Jell-O Instant Pudding & Pie Filling Chocolate 3.9 OZ BOX,Grocery & Gourmet Food > Cooking & Baking > Pie & Pastry Fillings
106,394,Stop & Shop Pie Filling & Topping Cherry 21 OZ CAN,Grocery & Gourmet Food > Cooking & Baking > Pie & Pastry Fillings
107,394,Stop & Shop Instant Pudding & Pie Filling Chocolate 3.9 OZ BOX,Grocery & Gourmet Food > Cooking & Baking > Pie & Pastry Fillings
108,394,Jell-O Pudding & Pie Filling Instant Chocolate Fudge - 5.9 Oz,Grocery & Gourmet Food > Cooking & Baking > Pie & Pastry Fillings
109,394,Jell-O Pudding & Pie Filling Instant Sugar Free Fat Free Chocolate Fudge - 1.4 Oz,Grocery & Gourmet Food > Cooking & Baking > Pie & Pastry Fillings
110,394,Jell-O Pudding & Pie Filling Instant Sugar Free Fat Free Vanillaa - 1 Oz,Grocery & Gourmet Food > Cooking & Baking > Pie & Pastry Fillings
111,394,"Meijer Apple Pie Filling with Sugar, 20 oz",Grocery & Gourmet Food > Cooking & Baking > Pie & Pastry Fillings
112,394,Jell-O Jell-O Vanilla Instant Pudding & Pie Filling 3.4 Ounce,Grocery & Gourmet Food > Cooking & Baking > Pie & Pastry Fillings
113,394,"Jell-O Jell-O Instant Pudding and Pie Filling, White Chocolate, ...",Grocery & Gourmet Food > Cooking & Baking > Pie & Pastry Fillings
114,394,"Libby's Libbys Pumpkin Pie Mix, 30 Ounce Can",Grocery & Gourmet Food > Cooking & Baking > Pie & Pastry Fillings
115,394,"Jell-O Banana Cream Instant Pudding & Pie Filling, 3.4 Oz",Grocery & Gourmet Food > Cooking & Baking > Pie & Pastry Fillings
116,394,"Jell-O Banana Cream Instant Pudding & Pie Filling, 5.1 oz",Grocery & Gourmet Food > Cooking & Baking > Pie & Pastry Fillings
117,394,"Comstock Premium Raspberry Pie Filling Or Topping, 21 oz",Grocery & Gourmet Food > Cooking & Baking > Pie & Pastry Fillings
118,394,"Jell-O Lemon Instant Pudding & Pie Filling, 3.4 Oz",Grocery & Gourmet Food > Cooking & Baking > Pie & Pastry Fillings
119,394,"Comstock Original Country Peach Pie Filling Or Topping, 21 oz",Grocery & Gourmet Food > Cooking & Baking > Pie & Pastry Fillings
120,394,"Jell-O Instant Pudding & Pie Filling, Pistachio - 3.4 oz box",Grocery & Gourmet Food > Cooking & Baking > Pie & Pastry Fillings
121,394,Apple Pie Filling & Topping,Grocery & Gourmet Food > Cooking & Baking > Pie & Pastry Fillings
122,394,Jell-O Instant Pistachio Pudding & Pie Filling,Grocery & Gourmet Food > Cooking & Baking > Pie & Pastry Fillings
123,394,Lucky Leaf Premium Apple Pie Filling or Topping,Grocery & Gourmet Food > Cooking & Baking > Pie & Pastry Fillings
124,394,Comstock Apple Pie Filling & Topping,Grocery & Gourmet Food > Cooking & Baking > Pie & Pastry Fillings
125,394,"Jell-O Sugar-Free Instant Pudding & Pie Filling, Cheesecake, 1 oz",Grocery & Gourmet Food > Cooking & Baking > Pie & Pastry Fillings
126,394,"Jell-O Instant Pudding & Pie Filling, Chocolate, 5.9 oz",Grocery & Gourmet Food > Cooking & Baking > Pie & Pastry Fillings
127,394,Jell-O Pudding & Pie Filling - 5.00 oz,Grocery & Gourmet Food > Cooking & Baking > Pie & Pastry Fillings
128,394,Lucky Leaf Apple Pie Filling - Li - 20.00 oz,Grocery & Gourmet Food > Cooking & Baking > Pie & Pastry Fillings
129,394,Instant Chocolate Pudding & Pie Filling 3.9 OZ BOX,Grocery & Gourmet Food > Cooking & Baking > Pie & Pastry Fillings
130,394,"Jell-O Sugar-Free Instant Pudding and Pie Filling, Butterscotch, 1-Ounce Boxes (Pack of 6)",Grocery & Gourmet Food > Cooking & Baking > Pie & Pastry Fillings
131,394,"JELL-O Instant Pudding and Pie Filling, Oreo Cookies 'n Cream, 4.2-Ounce",Grocery & Gourmet Food > Cooking & Baking > Pie & Pastry Fillings
132,394,Market Pantry Blueberry Fruit Pie Filling or Topping 21 oz,Grocery & Gourmet Food > Cooking & Baking > Pie & Pastry Fillings
133,394,Jell-O Cook & Serve Pudding & Pie Filling Chocolate Fat Free Sugar Free 1.3 OZ BOX,Grocery & Gourmet Food > Cooking & Baking > Pie & Pastry Fillings
134,394,One-Pie Pie Filling Pumpkin 15 OZ CAN,Grocery & Gourmet Food > Cooking & Baking > Pie & Pastry Fillings
135,394,"Jell-O Pistachio Sugar Free & Fat Free Pistachio Instant Pudding & Pie Filling, 1 Oz",Grocery & Gourmet Food > Cooking & Baking > Pie & Pastry Fillings
136,394,"Jell-O Sugar Free & Fat Free Banana Cream Instant Pudding & Pie Filling, .9 oz",Grocery & Gourmet Food > Cooking & Baking > Pie & Pastry Fillings
137,394,"Jell-O Chocolate Instant Pudding & Pie Filling, 2.1 oz",Grocery & Gourmet Food > Cooking & Baking > Pie & Pastry Fillings
138,394,"Jell-O Sugar Free & Fat Free Butterscotch Instant Pudding & Pie Filling, 1 oz",Grocery & Gourmet Food > Cooking & Baking > Pie & Pastry Fillings
139,394,"Jell-O Chocolate Cook & Serve Pudding & Pie Filling, 5 Oz",Grocery & Gourmet Food > Cooking & Baking > Pie & Pastry Fillings
140,394,"Comstock More Fruit Apple Pie Filling Or Topping, 21 Oz",Grocery & Gourmet Food > Cooking & Baking > Pie & Pastry Fillings
141,394,"JELL-O Red Velvet Instant Pudding & Pie Filling Mix, 3.4 oz",Grocery & Gourmet Food > Cooking & Baking > Pie & Pastry Fillings
142,394,"Marie Callender's Lattice Apple Pie, 42 oz",Grocery & Gourmet Food > Cooking & Baking > Pie & Pastry Fillings
143,394,"Jell-O Instant Pudding & Pie Filling, Banana Cream - 3.4 oz box",Grocery & Gourmet Food > Cooking & Baking > Pie & Pastry Fillings
144,394,Comstock More Fruit Blueberry Pie Filling & Topping,Grocery & Gourmet Food > Cooking & Baking > Pie & Pastry Fillings
145,394,Instant Chocolate Pudding & Pie Filling,Grocery & Gourmet Food > Cooking & Baking > Pie & Pastry Fillings
146,394,Lucky Leaf Cherry Pie Filling,Grocery & Gourmet Food > Cooking & Baking > Pie & Pastry Fillings
147,394,"Jell-O Vanilla, Instant Pudding & Pie Filling, 3.4 oz",Grocery & Gourmet Food > Cooking & Baking > Pie & Pastry Fillings
148,394,"Comstock Original Pie Filling & Topping, Country Cherry, 21 oz",Grocery & Gourmet Food > Cooking & Baking > Pie & Pastry Fillings
149,394,My-T-Fine Pudding & Pie Filling - 6.25 oz,Grocery & Gourmet Food > Cooking & Baking > Pie & Pastry Fillings
150,394,"Jell-O Sugar-Free Instant Pudding and Pie Filling, Pistachio, 1-Ounce Boxes (Pack of 6)",Grocery & Gourmet Food > Cooking & Baking > Pie & Pastry Fillings
151,394,"Jell-O Sugar-Free Instant Pudding and Pie Filling, Banana Cream, 0.9-Ounce Boxes (Pack of 6)",Grocery & Gourmet Food > Cooking & Baking > Pie & Pastry Fillings
152,394,"Solo Filling, Poppy Seed, 12.5-Ounce Unit (Pack of 12)",Grocery & Gourmet Food > Cooking & Baking > Pie & Pastry Fillings
153,394,Libbys Libbys 100% Pure,Grocery & Gourmet Food > Cooking & Baking > Pie & Pastry Fillings
154,394,Jell-O Cheesecake Sugar Free Instant Pudding & Pie Filling (4-Pack),Grocery & Gourmet Food > Cooking & Baking > Pie & Pastry Fillings
155,394,"Jell-O Sugar-Free Instant Pudding and Pie Filling, Chocolate, 2.1-Ounce Boxes (Pack of 6)",Grocery & Gourmet Food > Cooking & Baking > Pie & Pastry Fillings
156,394,Libby's 100% Pure Pumpkin Pie & Dessert Filling (Pack of 3) 15 oz Cans,Grocery & Gourmet Food > Cooking & Baking > Pie & Pastry Fillings
157,394,"Jell-O Sugar-Free Instant Pudding and Pie Filling, Chocolate, 1.4-Ounce Boxes (Pack of 6)",Grocery & Gourmet Food > Cooking & Baking > Pie & Pastry Fillings
158,394,"None Such: Classic Original Mincemeat, 27 Oz",Grocery & Gourmet Food > Cooking & Baking > Pie & Pastry Fillings
159,394,Caramel Apple Pie Filling,Grocery & Gourmet Food > Cooking & Baking > Pie & Pastry Fillings
160,394,"Jell-O Instant Pudding and Pie Filling, Chocolate - (3.9oz)",Grocery & Gourmet Food > Cooking & Baking > Pie & Pastry Fillings
161,394,Peapod Instant Pudding & Pie Filling Chocolate 3.9 OZ BOX,Grocery & Gourmet Food > Cooking & Baking > Pie & Pastry Fillings
162,394,Peapod Instant Pudding & Pie Filling Vanilla Sugar Free 1 OZ BOX,Grocery & Gourmet Food > Cooking & Baking > Pie & Pastry Fillings
163,394,Peapod Pie Filling & Topping Cherry 21 OZ CAN,Grocery & Gourmet Food > Cooking & Baking > Pie & Pastry Fillings
164,394,Jell-O Cook & Serve Pudding & Pie Filling Vanilla 3 OZ BOX,Grocery & Gourmet Food > Cooking & Baking > Pie & Pastry Fillings
165,394,Libby's Pumpkin 100% Pure 15 OZ CAN,Grocery & Gourmet Food > Cooking & Baking > Pie & Pastry Fillings
166,394,Giant Pie Filling & Topping Spiced Apple 21 OZ CAN,Grocery & Gourmet Food > Cooking & Baking > Pie & Pastry Fillings
167,394,Jell-O Pudding & Pie Filling Instant Butterscotch - 3.4 Oz,Grocery & Gourmet Food > Cooking & Baking > Pie & Pastry Fillings
168,394,Jell-O Pudding & Pie Filling Cook & Serve Butterscotch - 3.5 Oz,Grocery & Gourmet Food > Cooking & Baking > Pie & Pastry Fillings
169,394,Jell-O Pudding & Pie Filling Instant Vanilla - 5.1 Oz,Grocery & Gourmet Food > Cooking & Baking > Pie & Pastry Fillings
170,394,"Wilderness Original Country Cherry Pie Filling Or Topping, 21 oz",Grocery & Gourmet Food > Cooking & Baking > Pie & Pastry Fillings
171,394,"Jell-O Sugar Free & Fat Free White Chocolate Instant Pudding & Pie Filling, 1 oz",Grocery & Gourmet Food > Cooking & Baking > Pie & Pastry Fillings
172,394,"Jell-O Sugar Free & Fat Free Vanilla Instant Pudding & Pie Filling, 1 Oz",Grocery & Gourmet Food > Cooking & Baking > Pie & Pastry Fillings
173,394,"Wilderness Original Country Cherry Pie Filling/Topping, 30 oz",Grocery & Gourmet Food > Cooking & Baking > Pie & Pastry Fillings
174,394,"Jell-O Instant Pudding & Pie Filling, Pistachio, 3.4 oz",Grocery & Gourmet Food > Cooking & Baking > Pie & Pastry Fillings
175,394,Libby's 100% Pure Pumpkin - 15.00 oz,Grocery & Gourmet Food > Cooking & Baking > Pie & Pastry Fillings
176,394,Lucky Leaf Pie Filling - Peach - 21.00 oz,Grocery & Gourmet Food > Cooking & Baking > Pie & Pastry Fillings
177,394,Harris Teeter Pie Filling & Topping - 21.00 oz,Grocery & Gourmet Food > Cooking & Baking > Pie & Pastry Fillings
178,394,"Jell-O Sugar-Free Instant Pudding & Pie Filling, Banana Cream, 0.9-Ounce Boxes (Pack of 24)",Grocery & Gourmet Food > Cooking & Baking > Pie & Pastry Fillings
179,394,"JELL-O Instant Pudding and Pie Filling, Vanilla, 5.1 Ounce (Pack of 4)",Grocery & Gourmet Food > Cooking & Baking > Pie & Pastry Fillings
180,394,Libby's 100% Pure Pumpkin 15 oz,Grocery & Gourmet Food > Cooking & Baking > Pie & Pastry Fillings
181,394,"Henry & Henry Strawberry Pastry and Cake Filling, Redi Pak, 2 Pound",Grocery & Gourmet Food > Cooking & Baking > Pie & Pastry Fillings
182,394,"Borden None Such Condensed Mincemeat, Apples & Raisins, 9-Ounce Box (Pack of 6)",Grocery & Gourmet Food > Cooking & Baking > Pie & Pastry Fillings
183,394,Libbys 100% Pure Pumpkin - 29 Oz (2 - Pack),Grocery & Gourmet Food > Cooking & Baking > Pie & Pastry Fillings
184,394,"Libby's, 100% Pure Pumpkin, 15oz Can (Pack of 6)",Grocery & Gourmet Food > Cooking & Baking > Pie & Pastry Fillings
185,394,Solo Poppy Seed Cake & Pastry Filling (12.5 oz Cans) 2 Pack,Grocery & Gourmet Food > Cooking & Baking > Pie & Pastry Fillings
186,394,Lucky Leaf Premium Pie Filling or Topping Strawberry 21 OZ CAN,Grocery & Gourmet Food > Cooking & Baking > Pie & Pastry Fillings
187,394,Giant Instant Pudding & Pie Filling Chocolate 5.85 OZ BOX,Grocery & Gourmet Food > Cooking & Baking > Pie & Pastry Fillings
188,394,Stop & Shop Instant Pudding & Pie Filling Vanilla 5.1 OZ BOX,Grocery & Gourmet Food > Cooking & Baking > Pie & Pastry Fillings
189,394,Duncan Hines Comstock More Fruit Pie Filling & Topping Blueberry 21 OZ CAN,Grocery & Gourmet Food > Cooking & Baking > Pie & Pastry Fillings
190,394,Jell-O Instant Pudding & Pie Filling French Vanilla 3.4 OZ BOX,Grocery & Gourmet Food > Cooking & Baking > Pie & Pastry Fillings
191,394,Libby's Pumpkin 100% Pure 29 OZ CAN,Grocery & Gourmet Food > Cooking & Baking > Pie & Pastry Fillings
192,394,Jell-O Pudding & Pie Filling Instant Sugar Free Fat Free Vanilla a - 1.5 Oz,Grocery & Gourmet Food > Cooking & Baking > Pie & Pastry Fillings
