,category_id,description,category_path
0,395,"Hoosier Hill Farm LLC Hoosier Hill Farm Whole Powdered Eggs, 1 Pound",Grocery & Gourmet Food > Cooking & Baking > Powdered Eggs
1,395,"Hoosier Hill Farm Whole Powdered Eggs, 1 Pound",Grocery & Gourmet Food > Cooking & Baking > Powdered Eggs
2,395,"Hoosier Hill Farm Pickled Red Beet Egg powder mix, 1 lb",Grocery & Gourmet Food > Cooking & Baking > Powdered Eggs
3,395,"Just Whites Powdered Egg Whites, 3 oz",Grocery & Gourmet Food > Cooking & Baking > Powdered Eggs
4,395,"Wise Foods 144 Total Servings Powdered Eggs in a Bucket, White",Grocery & Gourmet Food > Cooking & Baking > Powdered Eggs
5,395,"Powdered Eggs Dried Egg Mix for Scrambled Eggs, Baking, Camping 6 oz by Sonstegard",Grocery & Gourmet Food > Cooking & Baking > Powdered Eggs
6,395,Powdered Egg Whites - 2.25 Pound Can,Grocery & Gourmet Food > Cooking & Baking > Powdered Eggs
7,395,MILLIARD Whole Egg Powder,Grocery & Gourmet Food > Cooking & Baking > Powdered Eggs
8,395,"Egg White Powder, 8 oz.",Grocery & Gourmet Food > Cooking & Baking > Powdered Eggs
9,395,"Magic Flavors Whole Egg Powder, 8 Oz Pouch",Grocery & Gourmet Food > Cooking & Baking > Powdered Eggs
10,395,OvaEasy Powdered Whole Eggs,Grocery & Gourmet Food > Cooking & Baking > Powdered Eggs
11,395,AAA Grade Egg White Powder (Molecular Gastronomy) u Non-GMO ! OU Kosher Certified - 400g/14oz,Grocery & Gourmet Food > Cooking & Baking > Powdered Eggs
12,395,"11.5 OZ Whole Egg Powder (Non-GMO, Pasteurized, Made in USA, 1 Ingredient no additives, Produced from the Freshest of Eggs)",Grocery & Gourmet Food > Cooking & Baking > Powdered Eggs
13,395,"OvaEasy, Whole Egg Crystals - 12 Eggs",Grocery & Gourmet Food > Cooking & Baking > Powdered Eggs
14,395,Wise Company 144-Serving Powdered Eggs Bucket,Grocery & Gourmet Food > Cooking & Baking > Powdered Eggs
15,395,OvaEasy Whole Egg Crystals - 12 Eggs,Grocery & Gourmet Food > Cooking & Baking > Powdered Eggs
16,395,Powdered Egg Whites - 2.25 Pound Can New,Grocery & Gourmet Food > Cooking & Baking > Powdered Eggs
17,395,"Pack of 3 Sonstegard Powdered Egg Mix, 6 Oz Each",Grocery & Gourmet Food > Cooking & Baking > Powdered Eggs
18,395,Powdered Whole Eggs - 2.25 Pound Can,Grocery & Gourmet Food > Cooking & Baking > Powdered Eggs
19,395,Legacy Essentials Long Term Powdered Whole Eggs - 25 Year Shelf Life Egg Powder for Emergency Food Storage Supply (Quantity 1),Grocery & Gourmet Food > Cooking & Baking > Powdered Eggs
20,395,OvaEasy Powdered Whole Eggs (6-pack of 4.5 oz. bags),Grocery & Gourmet Food > Cooking & Baking > Powdered Eggs
21,395,Wise Company 144 Serving Powdered Eggs,Grocery & Gourmet Food > Cooking & Baking > Powdered Eggs
22,395,Powdered Whole Eggs 2.25lb,Grocery & Gourmet Food > Cooking & Baking > Powdered Eggs
23,395,Whole Egg Powder 40 Oz.,Grocery & Gourmet Food > Cooking & Baking > Powdered Eggs
24,395,Hoosier Hill Farm Whole Powdered Eggs,Grocery & Gourmet Food > Cooking & Baking > Powdered Eggs
25,395,Hoosier Hill Farm Whole Powdered Eggs 1 lb.,Grocery & Gourmet Food > Cooking & Baking > Powdered Eggs
26,395,AAA Grade Egg White Powder (Molecular Gastronomy) ˜ Non-GMO ! OU Kosher Certified - 400g/14oz,Grocery & Gourmet Food > Cooking & Baking > Powdered Eggs
27,395,OvaEasy Powdered Whole Eggs (3-pack of 4.5 oz. bags),Grocery & Gourmet Food > Cooking & Baking > Powdered Eggs
28,395,"Whole Egg Powder, 8oz.",Grocery & Gourmet Food > Cooking & Baking > Powdered Eggs
29,395,Powdered Egg Whites - 2.25,Grocery & Gourmet Food > Cooking & Baking > Powdered Eggs
30,395,Ovaeasy Whole Egg Crystals-5,Grocery & Gourmet Food > Cooking & Baking > Powdered Eggs
31,395,11.5 OZ Whole Egg Powder (Non-GMO & Pasteurized),Grocery & Gourmet Food > Cooking & Baking > Powdered Eggs
32,395,"Emergency Essentials Dried Whole Egg Powder, 40 oz",Grocery & Gourmet Food > Cooking & Baking > Powdered Eggs
33,395,"Dehydrated Egg White Powder, 2Lbs Dried Powdered Egg Whites, Stay Fresh Zipper Bag-(32oz)",Grocery & Gourmet Food > Cooking & Baking > Powdered Eggs
34,395,Frontier Natural Products Organic Whole Egg Powdered -- 16 oz,Grocery & Gourmet Food > Cooking & Baking > Powdered Eggs
35,395,"Ova Easy Egg Crystals, 4.5",Grocery & Gourmet Food > Cooking & Baking > Powdered Eggs
36,395,"ova easy egg crystals, 4.5 oz/bag",Grocery & Gourmet Food > Cooking & Baking > Powdered Eggs
37,395,MILLIARD Whole Egg Powder - 16oz.,Grocery & Gourmet Food > Cooking & Baking > Powdered Eggs
38,395,AAA Grade Egg White Powder (Molecular Gastronomy) Non-GMO OU Kosher Certified,Grocery & Gourmet Food > Cooking & Baking > Powdered Eggs
39,395,"WillPowder Egg White Powder, 16-Ounce Jar",Grocery & Gourmet Food > Cooking & Baking > Powdered Eggs
40,395,Provident Pantry® MyChoiceTM Whole Egg Powder 10oz.,Grocery & Gourmet Food > Cooking & Baking > Powdered Eggs
41,395,Whole Powdered Eggs - 5# Mylar Zip Bag (180 eggs),Grocery & Gourmet Food > Cooking & Baking > Powdered Eggs
42,395,Emergency Essentials Whole Egg Powder - 40 Ounces,Grocery & Gourmet Food > Cooking & Baking > Powdered Eggs
43,395,Powdered Eggs Dried Egg Mix,Grocery & Gourmet Food > Cooking & Baking > Powdered Eggs
