,category_id,description,category_path
0,466,tampax radiant compak,Health & Beauty > Personal Care > Feminine Care > Tampons
1,466,"pearl plastic, regular absorbency unscented tampons, 36 count",Health & Beauty > Personal Care > Feminine Care > Tampons
2,466,"Tampax Cardboard Applicator Tampons, Regular Absorbency, 54 Count (Pack of 2) Tampax",Health & Beauty > Personal Care > Feminine Care > Tampons
3,466,"Playtex Gentle Glide Tampons Multipack with Super Absorbency, Fresh Scent, 18 Count",Health & Beauty > Personal Care > Feminine Care > Tampons
4,466,playtex gentle glide super plus 18 tampons,Health & Beauty > Personal Care > Feminine Care > Tampons
5,466,"kotex click tampons, super absorbency, 50 count",Health & Beauty > Personal Care > Feminine Care > Tampons
6,466,"seventh generation chlorine free organic cotton tampons, super, non-applicator, 20-count packages (pack of 12) (240 tampons)",Health & Beauty > Personal Care > Feminine Care > Tampons
7,466,natural sea tampons by poseidon sponge (full set),Health & Beauty > Personal Care > Feminine Care > Tampons
8,466,"u by kotex click regular compact tampons, unscented, 36 count health and beauty",Health & Beauty > Personal Care > Feminine Care > Tampons
9,466,tampax pearl plastic triple,Health & Beauty > Personal Care > Feminine Care > Tampons
10,466,"seventh generation organic cotton tampons, super plus, chlorine free, 20 count",Health & Beauty > Personal Care > Feminine Care > Tampons
11,466,"tampax radiant plastic unscented tampons, super plus absorbency, 32 count quantity: 2",Health & Beauty > Personal Care > Feminine Care > Tampons
12,466,"o.b. procomfort regular, 40 count",Health & Beauty > Personal Care > Feminine Care > Tampons
13,466,"Tampax Pearl Plastic Unscented Tampons, Ultra Absorbency, 18-Count (Pack of 12)",Health & Beauty > Personal Care > Feminine Care > Tampons
14,466,"u by kotex security tampons, multi-pak regular/super, plastic applicator, unscented, 36 count",Health & Beauty > Personal Care > Feminine Care > Tampons
15,466,jade and pearl sea pearl sponge tampon md 2pk sp-rm,Health & Beauty > Personal Care > Feminine Care > Tampons
16,466,"Tampax Pearl Plastic, Regular Absorbency Unscented Tampons, 18 Count Tampax",Health & Beauty > Personal Care > Feminine Care > Tampons
17,466,tampax plastic pearl lites,Health & Beauty > Personal Care > Feminine Care > Tampons
18,466,natracare organic all,Health & Beauty > Personal Care > Feminine Care > Tampons
19,466,"organyc hypoallergenic 100% organic cotton internal tampons with applicator, regular, 16-count box new",Health & Beauty > Personal Care > Feminine Care > Tampons
20,466,tampax compak pearl,Health & Beauty > Personal Care > Feminine Care > Tampons
21,466,"seventh generation super absorbency applicator tampon, 16 count",Health & Beauty > Personal Care > Feminine Care > Tampons
22,466,"playtex gentle glide unscented, super plus, 36 count",Health & Beauty > Personal Care > Feminine Care > Tampons
23,466,"o.b. regular, 40 count",Health & Beauty > Personal Care > Feminine Care > Tampons
24,466,"Pearl plastic, Regular Absorbency Unscented Tampons, 54 Count",Health & Beauty > Personal Care > Feminine Care > Tampons
25,466,"Tampax Pearl Compak plastic, Triplepack with Light/Regular/Super Absorbencies",Health & Beauty > Personal Care > Feminine Care > Tampons
26,466,"kotex security tampons, multi-pack, 50 counts",Health & Beauty > Personal Care > Feminine Care > Tampons
27,466,organic essentials tampons-16 regular-with applicator,Health & Beauty > Personal Care > Feminine Care > Tampons
28,466,"tampax radiant plastic unscented tampons, regular absorbency, 16 count health and beauty",Health & Beauty > Personal Care > Feminine Care > Tampons
29,466,"organyc hypoallergenic 100% organic cotton internal tampons with applicator, regular, 16-count boxes (pack of 2)",Health & Beauty > Personal Care > Feminine Care > Tampons
30,466,"Veeda Super Applicator Tampon, 16-Count",Health & Beauty > Personal Care > Feminine Care > Tampons
31,466,"Tampax Pearl Unscented Tampons Combo Pack, 96 count Regular Absorbency and 96 Super Absorbency",Health & Beauty > Personal Care > Feminine Care > Tampons
32,466,clean point herbal tampon fast effect on thrush bacterial vaginosis vaginitis,Health & Beauty > Personal Care > Feminine Care > Tampons
33,466,"playtex gentle glide unscented ultra tampons-36 ct, 2 pk",Health & Beauty > Personal Care > Feminine Care > Tampons
34,466,"Tampax Tampons, Super (100 ct.) Plus 5 ct. Tampax Pearl Trial Pack",Health & Beauty > Personal Care > Feminine Care > Tampons
35,466,"tampax radiant plastic tampons duo pack, unscented, 84 count new",Health & Beauty > Personal Care > Feminine Care > Tampons
36,466,Tampax Radiant Plastic Duo-Pack (Regular & Super) Unscented Tampons 32ct,Health & Beauty > Personal Care > Feminine Care > Tampons
37,466,"tampax pearl plastic fresh scent tampons, super absorbency, 18 count",Health & Beauty > Personal Care > Feminine Care > Tampons
38,466,"tampax pearl tampons with pearl plastic applicator, unscented, super, 18 ea - 1 box",Health & Beauty > Personal Care > Feminine Care > Tampons
39,466,"playtex gentle glide tampons, unscented multipack - 50 each",Health & Beauty > Personal Care > Feminine Care > Tampons
40,466,"playtex gentle glide tampons, unscented, ultra, 36 ea - 1 pack",Health & Beauty > Personal Care > Feminine Care > Tampons
41,466,"tampax radiant tampons, regular - 32 ea",Health & Beauty > Personal Care > Feminine Care > Tampons
42,466,"u by kotex click tampons, double pack, unscented, super - 36 ea",Health & Beauty > Personal Care > Feminine Care > Tampons
43,466,"natracare organic all-cotton non-applicator tampons, regular - 10 ea",Health & Beauty > Personal Care > Feminine Care > Tampons
44,466,"tampax pearl compak tampons with compak plastic applicator, unscented, regular, 40 ea - 1 pack",Health & Beauty > Personal Care > Feminine Care > Tampons
45,466,"kotex natural balance security tampons, unscented, super plus, 36 ea - 36 ea",Health & Beauty > Personal Care > Feminine Care > Tampons
46,466,"tampax pearl pocket pearl compact tampons, regular super - 34 ea",Health & Beauty > Personal Care > Feminine Care > Tampons
47,466,"veeda 100% natural cotton applicator tampons, super plus - 16 ea",Health & Beauty > Personal Care > Feminine Care > Tampons
48,466,"veeda 100% natural cotton applicator tampons, regular - 16 ea",Health & Beauty > Personal Care > Feminine Care > Tampons
49,466,"tampax tampons with radiant plastic applicators, unscented, duo pack, 32 ea - 1 ea",Health & Beauty > Personal Care > Feminine Care > Tampons
50,466,"o.b. pro comfort tampons, multi-pack, regular & super - 40 ea",Health & Beauty > Personal Care > Feminine Care > Tampons
51,466,"playtex sport tampons, unscented multipack, 8 light, 20 regular, 8 super - 1 pack",Health & Beauty > Personal Care > Feminine Care > Tampons
52,466,"tampax pearl plastic applicator tampons, fresh scent, super - 36 ea",Health & Beauty > Personal Care > Feminine Care > Tampons
53,466,"tampax pearl tampons with pearl plastic applicator, unscented, triple pack, super/reg/lite, 36 ea - 1 box",Health & Beauty > Personal Care > Feminine Care > Tampons
54,466,"walgreens compact plastic applicator tampons, regular - 18 ea",Health & Beauty > Personal Care > Feminine Care > Tampons
55,466,"o.b. multi pack, 18 regular 12 super 10 super plus - 40 ea",Health & Beauty > Personal Care > Feminine Care > Tampons
56,466,"playtex gentle glide tampons, unscented multipack, 25 regular & 25 super - 50 each",Health & Beauty > Personal Care > Feminine Care > Tampons
57,466,"u by kotex security tampons, plastic applicator, unscented, regular - 34 ea",Health & Beauty > Personal Care > Feminine Care > Tampons
58,466,"playtex gentle glide 360 degree plastic tampons...unscented, 24 super & 12 super plus - 36 ea",Health & Beauty > Personal Care > Feminine Care > Tampons
59,466,"u by kotex click unscented tampons, super plus, 18 ea - 1 pack",Health & Beauty > Personal Care > Feminine Care > Tampons
60,466,tampons regular absorbency plastic 40 ct - up & up™,Health & Beauty > Personal Care > Feminine Care > Tampons
61,466,tampax pearl multipax lite/regular/super-36 count,Health & Beauty > Personal Care > Feminine Care > Tampons
62,466,tampax pocket pearl regular/super tampons - 34 count,Health & Beauty > Personal Care > Feminine Care > Tampons
63,466,tampax regular tampoons - 51 count,Health & Beauty > Personal Care > Feminine Care > Tampons
64,466,tampax radiant multi pack regular/super/super plus tampons - 32 count,Health & Beauty > Personal Care > Feminine Care > Tampons
65,466,"kotex natural balance security tampons, super, 36 ct",Health & Beauty > Personal Care > Feminine Care > Tampons
66,466,"u by kotex sleek super tampons, 34 count",Health & Beauty > Personal Care > Feminine Care > Tampons
67,466,"u by kotex click regular & super tampons, 50 count",Health & Beauty > Personal Care > Feminine Care > Tampons
68,466,"u by kotex security tampons, multi-pak regular/super, unscented, 36ct",Health & Beauty > Personal Care > Feminine Care > Tampons
69,466,"u by kotex sleek unscented tampons, regular, 36ct",Health & Beauty > Personal Care > Feminine Care > Tampons
70,466,"walgreens tampons, super plus 40.0 ea",Health & Beauty > Personal Care > Feminine Care > Tampons
71,466,"playtex sport fresh balance tampons, multipack regular & super 32.0 ea",Health & Beauty > Personal Care > Feminine Care > Tampons
72,466,tampons with radiant plastic applicators unscented tampax,Health & Beauty > Personal Care > Feminine Care > Tampons
73,466,"tampax pearl tampons triplepack unscented,lite super super plus 36.0 ea",Health & Beauty > Personal Care > Feminine Care > Tampons
74,466,"non-applicator tampons, value pack ultra absorbency o.b.",Health & Beauty > Personal Care > Feminine Care > Tampons
75,466,"u by kotex click compact tampons unscented,regular/super 34.0 ea",Health & Beauty > Personal Care > Feminine Care > Tampons
76,466,"tampax pearl tampons, super plus unscented 36.0 ea",Health & Beauty > Personal Care > Feminine Care > Tampons
77,466,"tampons, fresh scent multipack playtex sport",Health & Beauty > Personal Care > Feminine Care > Tampons
78,466,"tampax pearl super tampons, 96 ct",Health & Beauty > Personal Care > Feminine Care > Tampons
79,466,"tampax pearl unscented super tampons with plastic applicator-18 ct, 2 pack",Health & Beauty > Personal Care > Feminine Care > Tampons
80,466,"tampax pearl super tampons with plastic applicator, unscented - 36 ct",Health & Beauty > Personal Care > Feminine Care > Tampons
81,466,"tampax pearl regular absorbency tampons with plastic applicator, unscented, 18 ct",Health & Beauty > Personal Care > Feminine Care > Tampons
82,466,"tampax pearl unscented super tampons with plastic applicator-36 ct, 2 pack",Health & Beauty > Personal Care > Feminine Care > Tampons
83,466,o.b. tampons - regular/super/super plus - 40 ct,Health & Beauty > Personal Care > Feminine Care > Tampons
84,466,tampax multipax tampons with flushable cardboard applicator-80 ct,Health & Beauty > Personal Care > Feminine Care > Tampons
85,466,"o.b. tampons multi-pack-40 ct, 2 pack",Health & Beauty > Personal Care > Feminine Care > Tampons
86,466,tampax pearl plastic regular absorbency tampons - unscented - 54 ct,Health & Beauty > Personal Care > Feminine Care > Tampons
87,466,o.b. tampons - super plus - 80 ct,Health & Beauty > Personal Care > Feminine Care > Tampons
88,466,"tampax radiant regular & super duopack tampons with plastic applicator, unscented, 32 ct",Health & Beauty > Personal Care > Feminine Care > Tampons
89,466,natracare organic cotton tampons super without applicator -- 10 tampons,Health & Beauty > Personal Care > Feminine Care > Tampons
90,466,natracare organic cotton tampons super without applicator -- 20 tampons,Health & Beauty > Personal Care > Feminine Care > Tampons
91,466,natracare organic cotton tampons super with applicator -- 16 tampons,Health & Beauty > Personal Care > Feminine Care > Tampons
92,466,tampax pearl tampons regular absorbency unscented 20.0 ea 0.61 lbs,Health & Beauty > Personal Care > Feminine Care > Tampons
93,466,cvs tampons super unscented 36.0 ea 0.65 lbs,Health & Beauty > Personal Care > Feminine Care > Tampons
94,466,"o.b. fluid-lock tampons, ultra 40.0 ct 0.37 lbs",Health & Beauty > Personal Care > Feminine Care > Tampons
95,466,"natracare organic cotton tampons super, 10ct 10.0 ct 0.08 lbs",Health & Beauty > Personal Care > Feminine Care > Tampons
96,466,tampax pearl tampons super absorbency unscented 36.0 ea 0.85 lbs,Health & Beauty > Personal Care > Feminine Care > Tampons
97,466,cvs tampons regular unscented 36.0 ea 0.53 lbs,Health & Beauty > Personal Care > Feminine Care > Tampons
98,466,"tampax pearl multipax tampons with plastic applicator, unscented - 36 ct",Health & Beauty > Personal Care > Feminine Care > Tampons
99,466,"tampax radiant compak super absorbency unscented tampons with plastic applicator, 36 ct",Health & Beauty > Personal Care > Feminine Care > Tampons
100,466,"tampax pearl tampons, fresh scent - light/regular/super - 72 ct",Health & Beauty > Personal Care > Feminine Care > Tampons
101,466,tampax tampons with cardboard applicator - regular - 80 ct,Health & Beauty > Personal Care > Feminine Care > Tampons
102,466,tampax pearl unscented multipax tampons with plastic applicator-36 ct,Health & Beauty > Personal Care > Feminine Care > Tampons
103,466,playtex gentle glide 360 tampons - ultra - 72 ct,Health & Beauty > Personal Care > Feminine Care > Tampons
104,466,playtex sport unscented multipack tampons-36 ct,Health & Beauty > Personal Care > Feminine Care > Tampons
105,466,"seventh generation organic tampons, no applicator - super plus - 20 ct",Health & Beauty > Personal Care > Feminine Care > Tampons
106,466,"tampax pearl plastic tampons, super, unscented (18ct)",Health & Beauty > Personal Care > Feminine Care > Tampons
107,466,"tampax tampons, regular - (40ct)",Health & Beauty > Personal Care > Feminine Care > Tampons
108,466,"tampax pocket pearl tampons, super plus, unscented - (18ct)",Health & Beauty > Personal Care > Feminine Care > Tampons
109,466,"tampax pearl, super plus, fresh scent regular tampons - (36ct)",Health & Beauty > Personal Care > Feminine Care > Tampons
110,466,tampaxbasepearl,Health & Beauty > Personal Care > Feminine Care > Tampons
111,466,tampax pearl tampons regular absorbency with plastic applicator unscented 54 ct box,Health & Beauty > Personal Care > Feminine Care > Tampons
112,466,playtex regular sport multi pack unscented tampons - 36 count,Health & Beauty > Personal Care > Feminine Care > Tampons
113,466,tampax original regular flushable tampons - 40 count,Health & Beauty > Personal Care > Feminine Care > Tampons
114,466,tampax unscented pearl plastic multi pack tampons - 50 count,Health & Beauty > Personal Care > Feminine Care > Tampons
115,466,safeway regular tampons multi pack - 40 count,Health & Beauty > Personal Care > Feminine Care > Tampons
116,466,playtex sport tampons super - 36 count,Health & Beauty > Personal Care > Feminine Care > Tampons
117,466,playtex sport regular unscented tampons - 18 count,Health & Beauty > Personal Care > Feminine Care > Tampons
118,466,kotex security tampons super plus absorbency - 34 count,Health & Beauty > Personal Care > Feminine Care > Tampons
119,466,tampax pearl plastic lite unscented tampons - 36 count,Health & Beauty > Personal Care > Feminine Care > Tampons
120,466,"tampax tampax pocket pearl compact tampons, super, 36 ct",Health & Beauty > Personal Care > Feminine Care > Tampons
121,466,"kotex u by kotex click compact tampons, super unscented, 50 ct",Health & Beauty > Personal Care > Feminine Care > Tampons
122,466,"natracare natracare cotton tampons, super plus, 20 ct 20",Health & Beauty > Personal Care > Feminine Care > Tampons
123,466,"kotex kotex security tampons super plus absorbency, 34 count",Health & Beauty > Personal Care > Feminine Care > Tampons
124,466,tampax radiant plastic super absorbency unscented tampons 16ct,Health & Beauty > Personal Care > Feminine Care > Tampons
125,466,"o.b. pro comfort digital tampons, regular, 40 count",Health & Beauty > Personal Care > Feminine Care > Tampons
126,466,"tampax tampax anti-slip grip cardboard applicator, lites/regular/super multipax absorbency tampons 40 count (pack of 3)",Health & Beauty > Personal Care > Feminine Care > Tampons
127,466,"cotton tampon w, out applicator regular 20 ct.",Health & Beauty > Personal Care > Feminine Care > Tampons
128,466,"o.b. applicator free digital tampons, ultra - 40 count",Health & Beauty > Personal Care > Feminine Care > Tampons
129,466,"Tampax Pearl plastic, Ultra Absorbency, Unscented Tampons, 36 Count (Pack of 2)",Health & Beauty > Personal Care > Feminine Care > Tampons
130,466,natracare tampons reg with applictr 16 ct ( multi-pack),Health & Beauty > Personal Care > Feminine Care > Tampons
131,466,do tampons take your virginity?: a catholic girl's memoir,Health & Beauty > Personal Care > Feminine Care > Tampons
132,466,"tampax radiant plastic triple pack absorbencies unscented tampons, 32 count (pack of 6)",Health & Beauty > Personal Care > Feminine Care > Tampons
133,466,"Tampax Tampax Anti-Slip Grip Cardboard Applicator, Lites/Regular/Super Multipax Absorbency Tampons 40 Count (Pack",Health & Beauty > Personal Care > Feminine Care > Tampons
134,466,"o.b. Pro Comfort Applicator Free Digital Tampons, Regular - 40 Count",Health & Beauty > Personal Care > Feminine Care > Tampons
135,466,"Playtex Gentle Glide Tampons Multipack, Fresh Scent Regular/Super Absorbency, 36 Count",Health & Beauty > Personal Care > Feminine Care > Tampons
136,466,"tampax pearl plastic unscented tampons, ultra absorbency, 36 count (pack of 2) new",Health & Beauty > Personal Care > Feminine Care > Tampons
137,466,playtex sport tampon bundle,Health & Beauty > Personal Care > Feminine Care > Tampons
138,466,Natural Sea Tampons |10pcs| by Poseidon Sponge (Full Set),Health & Beauty > Personal Care > Feminine Care > Tampons
139,466,Tampax Tampons with Flushable Cardboard Applicator - Light/Regular/Super - 80 ct,Health & Beauty > Personal Care > Feminine Care > Tampons
140,466,"u by kotex click regular/super compact tampons, unscented, 34 count (pack of 6)",Health & Beauty > Personal Care > Feminine Care > Tampons
141,466,tampax compak super plus x 20,Health & Beauty > Personal Care > Feminine Care > Tampons
142,466,"pearl plastic, regular absorbency unscented tampons, 54 count new",Health & Beauty > Personal Care > Feminine Care > Tampons
143,466,"tampax pearl plastic fresh scent tampons, regular absorbency, 18 count",Health & Beauty > Personal Care > Feminine Care > Tampons
144,466,"tampax pearl plastic triple pack, light/regular/super absorbency, unscented tampons, 50 count new",Health & Beauty > Personal Care > Feminine Care > Tampons
145,466,natracare tampons reg with applictr 16 ct ( 4 pack),Health & Beauty > Personal Care > Feminine Care > Tampons
146,466,Tampax Anti-Slip Grip Regular Absorbency Tampons - 54 Ct,Health & Beauty > Personal Care > Feminine Care > Tampons
147,466,Veeda - Natural Cotton Tampons - Applicator Free - Bundle of 3 Sizes,Health & Beauty > Personal Care > Feminine Care > Tampons
148,466,(3 PACK) - Cottons Applicator Tampons - Regular | 16s | 3 PACK - SUPER SAVER,Health & Beauty > Personal Care > Feminine Care > Tampons
149,466,"tampax pearl plastic, regular absorbency unscented tampons - 18 count",Health & Beauty > Personal Care > Feminine Care > Tampons
150,466,"tampax radiant plastic, regular absorbency, unscented tampons 32 count",Health & Beauty > Personal Care > Feminine Care > Tampons
151,466,"tampax pearl unscented tampons, regular absorbency (96 ct)",Health & Beauty > Personal Care > Feminine Care > Tampons
152,466,"tampax radiant plastic, duopack, unscented tampons, 32 count health and beauty",Health & Beauty > Personal Care > Feminine Care > Tampons
153,466,"u by kotex security tampons, regular, unscented, 34 count (pack of 6)",Health & Beauty > Personal Care > Feminine Care > Tampons
154,466,"natracare tampons regular with applicator, 2 pack",Health & Beauty > Personal Care > Feminine Care > Tampons
155,466,"o.b. pro comfort tampons, multi-pack, 40-count packages (pack of 3)",Health & Beauty > Personal Care > Feminine Care > Tampons
156,466,"o.b. pro comfort non-applicator tampons, value pack, multi pak - 40 ea",Health & Beauty > Personal Care > Feminine Care > Tampons
157,466,organyc feminine tampon,Health & Beauty > Personal Care > Feminine Care > Tampons
158,466,"Tampax Pearl Plastic Tampons, Duopack, Unscented, 36 Count",Health & Beauty > Personal Care > Feminine Care > Tampons
159,466,"Veeda, 100% Hypoallergenic, Natural Cotton, Chemical Free, Unscented,Regular Tampons with Plastic Applicator,(3 boxes of 16 )",Health & Beauty > Personal Care > Feminine Care > Tampons
160,466,organic essentials tampons-16 regular-with applicator new,Health & Beauty > Personal Care > Feminine Care > Tampons
161,466,"tampax regular absorbency tampons, anti-slip grip cardboard applicator, 40 count",Health & Beauty > Personal Care > Feminine Care > Tampons
162,466,u by kotex sleek,Health & Beauty > Personal Care > Feminine Care > Tampons
163,466,radiant plastic regular absorbency unscented tampons 16ct,Health & Beauty > Personal Care > Feminine Care > Tampons
164,466,u by kotex click super plus,Health & Beauty > Personal Care > Feminine Care > Tampons
165,466,natracare 8002 organic all,Health & Beauty > Personal Care > Feminine Care > Tampons
166,466,tampax regular absorbency,Health & Beauty > Personal Care > Feminine Care > Tampons
167,466,Certified Organic 100% Cotton Regular Tampons Natracare 16 Tampon,Health & Beauty > Personal Care > Feminine Care > Tampons
168,466,"tampax pearl plastic triple pack, light/regular/super absorbency, scented tampons, 36 count (pack of 2)",Health & Beauty > Personal Care > Feminine Care > Tampons
169,466,"Tampax Pearl Plastic Fresh Scent Tampons, Super Plus Absorbency, 18 Count",Health & Beauty > Personal Care > Feminine Care > Tampons
170,466,"Pearl Plastic Triplepack, Unscented Tampons 36 Count",Health & Beauty > Personal Care > Feminine Care > Tampons
171,466,playtex sport tampons unscented super absorbency - 36 count,Health & Beauty > Personal Care > Feminine Care > Tampons
172,466,"tampax pearl light tampons with plastic applicator, unscented - 36 ct",Health & Beauty > Personal Care > Feminine Care > Tampons
173,466,"tampax pearl plastic unscented tampons, regular absorbency, 36 count new",Health & Beauty > Personal Care > Feminine Care > Tampons
174,466,"Playtex Sport Tampons with Flex-Fit Technology, Super Plus, Unscented - 36",Health & Beauty > Personal Care > Feminine Care > Tampons
175,466,"pearl plastic ultra absorbency, unscented tampons 36 count",Health & Beauty > Personal Care > Feminine Care > Tampons
176,466,"pearl plastic, super plus absorbency, unscented tampons, 18 count",Health & Beauty > Personal Care > Feminine Care > Tampons
177,466,"walgreens tampons with cardboard applicators, unscented, regular - 20 ea",Health & Beauty > Personal Care > Feminine Care > Tampons
178,466,"tampax pearl tampons plastic applicators, unscented, triple pack, light/regular/super, 50 - 50 ea",Health & Beauty > Personal Care > Feminine Care > Tampons
179,466,"tampax radiant plastic, super plus absorbency, unscented tampons - 32 ea",Health & Beauty > Personal Care > Feminine Care > Tampons
180,466,"u by kotex click unscented tampons, double pack, super, 36 ea - 1 pack",Health & Beauty > Personal Care > Feminine Care > Tampons
181,466,"tampax tampons with cardboard applicators, regular - 54 ea",Health & Beauty > Personal Care > Feminine Care > Tampons
182,466,"playtex sport tampons, unscented, super plus, 36 ea - 1 pack",Health & Beauty > Personal Care > Feminine Care > Tampons
183,466,"tampax pearl tampons with pearl plastic applicator, unscented, super plus, 36 - 36 ea",Health & Beauty > Personal Care > Feminine Care > Tampons
184,466,"tampax pearl compak plastic, super absorbency, unscented tampons, 40 count (pack of 2) health and beauty",Health & Beauty > Personal Care > Feminine Care > Tampons
185,466,"Tampax Radiant plastic Regular absorbency unscented tampons, 75 loose Pieces",Health & Beauty > Personal Care > Feminine Care > Tampons
186,466,"tampax tampax pearl plastic super plus tampons unscented, unscented 18 each",Health & Beauty > Personal Care > Feminine Care > Tampons
187,466,"Tampax Pearl Plastic Tampons, Regular Absorbency, Unscented, 54 Count",Health & Beauty > Personal Care > Feminine Care > Tampons
188,466,"Tampax Pearl Plastic Tampons, Regular Absorbency, Unscented, 50 Count",Health & Beauty > Personal Care > Feminine Care > Tampons
189,466,"Playtex Gentle Glide Tampons Multipack, Unscented Regular/Super Absorbency, 50 Count Playtex",Health & Beauty > Personal Care > Feminine Care > Tampons
190,466,"u by kotex click regular compact tampons, unscented, 18 count (pack of 4)",Health & Beauty > Personal Care > Feminine Care > Tampons
191,466,"tampax pearl plastic unscented tampons, lites/light absorbency, 36 count (pack of 2) quantity: 3",Health & Beauty > Personal Care > Feminine Care > Tampons
192,466,natracare regular tampons ( 1 x 20 ct),Health & Beauty > Personal Care > Feminine Care > Tampons
193,466,"tampax pearl plastic unscented tampons, regular absorbency, 18 count health and beauty",Health & Beauty > Personal Care > Feminine Care > Tampons
194,466,Natracare 583351 Certified Organic 100% Cotton Regular Tampons 16 Tampon,Health & Beauty > Personal Care > Feminine Care > Tampons
195,466,u by kotex click regular,Health & Beauty > Personal Care > Feminine Care > Tampons
196,466,Organic Cotton Multipack Applicator Tampons Emerita 32 ct Box,Health & Beauty > Personal Care > Feminine Care > Tampons
