,category_id,description,category_path
2197,466,"Tampax Super Absorbency Plastic Applicator Tampons, Unscented, 36 Count",Health & Beauty > Personal Care > Feminine Care > Tampons
2198,466,natracare tampons organic all cotton tampons super 20 pack(s),Health & Beauty > Personal Care > Feminine Care > Tampons
2199,466,"Tampax Pearl Plastic Tampons, Triplepack, Unscented, 50 Count",Health & Beauty > Personal Care > Feminine Care > Tampons
2200,466,"tampax pearl compak plastic, triplepack with light/regular/super absorbencies, unscented tampons, 40 count (pack of 2)",Health & Beauty > Personal Care > Feminine Care > Tampons
2201,466,"tampax pearl compak plastic, super absorbency, unscented tampons, 20 count (pack of 4)",Health & Beauty > Personal Care > Feminine Care > Tampons
2202,466,"u by kotex click* regular tampons, 18 count (pack of 4)",Health & Beauty > Personal Care > Feminine Care > Tampons
2203,466,"Playtex Gentle Glide 360 Unscented Tampon, Super Absorbency (80 count)",Health & Beauty > Personal Care > Feminine Care > Tampons
2204,466,tampax cardboard applicator,Health & Beauty > Personal Care > Feminine Care > Tampons
2205,466,"radiant plastic tampons, super absorbency, unscented, 32 count, (pack of 6)",Health & Beauty > Personal Care > Feminine Care > Tampons
2206,466,"Tampax Pearl Plastic, Super Absorbency, Unscented Tampons, 75 loose Pieces",Health & Beauty > Personal Care > Feminine Care > Tampons
2207,466,"o.b. pro comfort tampons, multi-pack, 40-count packages (pack of 3) health and beauty",Health & Beauty > Personal Care > Feminine Care > Tampons
2208,466,"tampon,og,regular,applctr",Health & Beauty > Personal Care > Feminine Care > Tampons
2209,466,"tampax pearl plastic, super absorbency, scented tampons, 36 count",Health & Beauty > Personal Care > Feminine Care > Tampons
2210,466,Gynotex Dry Soft-Tampons (dry) - 30-pack,Health & Beauty > Personal Care > Feminine Care > Tampons
2211,466,u by kotex click compact,Health & Beauty > Personal Care > Feminine Care > Tampons
2212,466,tampax essentials plastic,Health & Beauty > Personal Care > Feminine Care > Tampons
2213,466,"u by kotex security tampons regular plastic applicator, unscented, 36 count",Health & Beauty > Personal Care > Feminine Care > Tampons
2214,466,"u by kotex click tampon, super absorbency, 18-count boxes (pack of 4)",Health & Beauty > Personal Care > Feminine Care > Tampons
2215,466,playtex sport tampons super absorbency unscented (80 ct.),Health & Beauty > Personal Care > Feminine Care > Tampons
2216,466,"kotex click tampons, regular absorbency, 50 count",Health & Beauty > Personal Care > Feminine Care > Tampons
2217,466,"tampax pearl unscented tampons, super absorbency (96 ct) health and beauty",Health & Beauty > Personal Care > Feminine Care > Tampons
2218,466,"tampax pearl plastic triple pack, light/regular/super absorbency, unscented tampons, 50 count health and beauty",Health & Beauty > Personal Care > Feminine Care > Tampons
2219,466,Natracare Tampons Super with Applicator 16 Ct (Pack of 3),Health & Beauty > Personal Care > Feminine Care > Tampons
2220,466,"Natracare Tampons Non-Applicator Regular 20 Ct, Set of 4",Health & Beauty > Personal Care > Feminine Care > Tampons
2221,466,"Tampax Cardboard Applicator Tampons, Super Absorbency Unscented (105 ct) + Bonus Trial Pack",Health & Beauty > Personal Care > Feminine Care > Tampons
2222,466,"tampax radiant compak plastic unscented tampons, super absorbency, 18 count health and beauty",Health & Beauty > Personal Care > Feminine Care > Tampons
2223,466,tampax compak tampons fresh super absorbancy x 20,Health & Beauty > Personal Care > Feminine Care > Tampons
2224,466,premium ultra soft sea pearls reusable sea sponges - multi size 3 pack new,Health & Beauty > Personal Care > Feminine Care > Tampons
2225,466,"tampax triple pack unscented plastic applicator tampons, 36 count, 36.000 count",Health & Beauty > Personal Care > Feminine Care > Tampons
2226,466,"u by kotex click regular compact tampons, unscented, 34 count",Health & Beauty > Personal Care > Feminine Care > Tampons
2227,466,tampax tampons for vending,Health & Beauty > Personal Care > Feminine Care > Tampons
2228,466,"tampax pearl plastic unscented tampons, ultra absorbency, 36 count (pack of 2)",Health & Beauty > Personal Care > Feminine Care > Tampons
2229,466,"organyc hypoallergenic 100% organic cotton internal tampons with applicator, regular, 16-count box",Health & Beauty > Personal Care > Feminine Care > Tampons
2230,466,"Tampax Pearl Plastic Tampons, Triplepack, Unscented, 36 Count",Health & Beauty > Personal Care > Feminine Care > Tampons
2231,466,"femtex tampons, cardboard applicator, super plus absorbency, 40 tampons (pack of 12)",Health & Beauty > Personal Care > Feminine Care > Tampons
2232,466,organic super tampon 20bx,Health & Beauty > Personal Care > Feminine Care > Tampons
2233,466,"maxim organic cardboard applicator tampon, regular, 16 count, box",Health & Beauty > Personal Care > Feminine Care > Tampons
2234,466,"tampax radiant plastic unscented tampons, super absorbency, 16 count quantity: 2",Health & Beauty > Personal Care > Feminine Care > Tampons
2235,466,"tampax radiant plastic unscented tampons, super absorbency, 32 count quantity: 2",Health & Beauty > Personal Care > Feminine Care > Tampons
2236,466,"tampax pearl tampons with pearl plastic applicators, unscented, duo pack, regular/super, 18 ea - 1 pack",Health & Beauty > Personal Care > Feminine Care > Tampons
2237,466,"tampax pearl plastic applicator tampons, unscented, lites - 36 ea",Health & Beauty > Personal Care > Feminine Care > Tampons
2238,466,"tampax pearl tampons pocket, super plus - 18 ea",Health & Beauty > Personal Care > Feminine Care > Tampons
2239,466,"playtex sport tampons, unscented, super plus - 36 ea",Health & Beauty > Personal Care > Feminine Care > Tampons
2240,466,"tampax radiant plastic, tampons, unscented super plus",Health & Beauty > Personal Care > Feminine Care > Tampons
2241,466,"u by kotex sleek tampons, unscented, regular - 18 ea",Health & Beauty > Personal Care > Feminine Care > Tampons
2242,466,"u by kotex sleek unscented tampons, super plus, 18 ea - 18 ea",Health & Beauty > Personal Care > Feminine Care > Tampons
2243,466,"o.b. non-applicator tampons, value pack, super - 40 ea",Health & Beauty > Personal Care > Feminine Care > Tampons
2244,466,"tampax pearl tampons plastic applicators, unscented, duo pack, regular/super, 36 ea - 1 ea",Health & Beauty > Personal Care > Feminine Care > Tampons
2245,466,"u by kotex click unscented tampons, regular - 50 ea",Health & Beauty > Personal Care > Feminine Care > Tampons
2246,466,"tampax pearl tampons, super, unscented - 36 ea",Health & Beauty > Personal Care > Feminine Care > Tampons
2247,466,"seventh generation chlorine-free organic applicator tampon, regular, 16 ea - 1 pack",Health & Beauty > Personal Care > Feminine Care > Tampons
2248,466,tampax radiant regular tampons - 32 count,Health & Beauty > Personal Care > Feminine Care > Tampons
2249,466,playtex gentle glide plastic unscented multi-pack tampons 50-ct.,Health & Beauty > Personal Care > Feminine Care > Tampons
2250,466,tampax pearl triple pack light/regular/super absorbency scented tampons - 36 count,Health & Beauty > Personal Care > Feminine Care > Tampons
2251,466,playtex sport plastic applicator unscented super plus absorbency tampons 36-ct.,Health & Beauty > Personal Care > Feminine Care > Tampons
2252,466,tampax pearl super absorbancy tampons - 36 count,Health & Beauty > Personal Care > Feminine Care > Tampons
2253,466,tampax pearl triple pack regular tampons - 2 pack (50 count each),Health & Beauty > Personal Care > Feminine Care > Tampons
2254,466,up & up regular unscented tampons 40-pk.,Health & Beauty > Personal Care > Feminine Care > Tampons
2255,466,tampax pearl regular tampons - 54 count (2 pack),Health & Beauty > Personal Care > Feminine Care > Tampons
2256,466,u by kotex super click tampons - 34 count,Health & Beauty > Personal Care > Feminine Care > Tampons
2257,466,tampax pearl regular tampons - 18 count,Health & Beauty > Personal Care > Feminine Care > Tampons
2258,466,tampax pearl regular absorbency scented tampons - 36 count,Health & Beauty > Personal Care > Feminine Care > Tampons
2259,466,u by kotex click* regular compact tampons 18 count,Health & Beauty > Personal Care > Feminine Care > Tampons
2260,466,"tampax pearl plastic active super absorbency unscented tampons, 36 count",Health & Beauty > Personal Care > Feminine Care > Tampons
2261,466,"playtex regular unscented sport tampons, 18ct",Health & Beauty > Personal Care > Feminine Care > Tampons
2262,466,"u by kotex click super tampons, 34 count",Health & Beauty > Personal Care > Feminine Care > Tampons
2263,466,"tampax pearl plastic unscented super plus absorbency tampons, 36 count",Health & Beauty > Personal Care > Feminine Care > Tampons
2264,466,"tampax lites/light absorbency unscented plastic applicator tampons, 18 count",Health & Beauty > Personal Care > Feminine Care > Tampons
2265,466,"equate tampons multipack, 54ct",Health & Beauty > Personal Care > Feminine Care > Tampons
2266,466,"playtex sport unscented tampons, light/regular, 18ct",Health & Beauty > Personal Care > Feminine Care > Tampons
2267,466,"equate premium regular multipack tampons, 36ct",Health & Beauty > Personal Care > Feminine Care > Tampons
2268,466,u by kotex security regular super tampons 34 count,Health & Beauty > Personal Care > Feminine Care > Tampons
2269,466,playtex gentle glide tampons scented super absorbency - 36 count,Health & Beauty > Personal Care > Feminine Care > Tampons
2270,466,"tampax tampons with radiant plastic applicators unscented, duo pack, 32 ea 1.0 ea",Health & Beauty > Personal Care > Feminine Care > Tampons
2271,466,"tampax pearl tamons duopack unscented,regular super 36.0 ea",Health & Beauty > Personal Care > Feminine Care > Tampons
2272,466,walgreens biodegradable applicator tampons 40.0 ea,Health & Beauty > Personal Care > Feminine Care > Tampons
2273,466,"tampons regular, unscented walgreens well beginnings 20.0 ea",Health & Beauty > Personal Care > Feminine Care > Tampons
2274,466,"kotex® travel size tampons, 2/pk",Health & Beauty > Personal Care > Feminine Care > Tampons
2275,466,tampax® pearl 36-count multipax fresh scented tampons,Health & Beauty > Personal Care > Feminine Care > Tampons
2276,466,tampax pearl compak 20-count super tampons 20 ct,Health & Beauty > Personal Care > Feminine Care > Tampons
2277,466,"seventh generation organic tampons, with applicator - super - 32 ct",Health & Beauty > Personal Care > Feminine Care > Tampons
2278,466,"playtex gentle glide 25 regular & 25 super tampons, unscented - 50 ct",Health & Beauty > Personal Care > Feminine Care > Tampons
2279,466,"seventh generation tampons, super plus, 20 ct, 2 pk",Health & Beauty > Personal Care > Feminine Care > Tampons
2280,466,"tampax radiant compak regular absorbency unscented tampons with plastic applicator, 18 ct",Health & Beauty > Personal Care > Feminine Care > Tampons
2281,466,tampax tampons with flushable cardboard applicator - super plus - 40 ct,Health & Beauty > Personal Care > Feminine Care > Tampons
2282,466,tampax super tampons with flushable cardboard applicator-40 ct,Health & Beauty > Personal Care > Feminine Care > Tampons
2283,466,tampax pearl tampons - light/regular - 36 ct,Health & Beauty > Personal Care > Feminine Care > Tampons
2284,466,"natracare, organic cotton tampons, super, 16 tampons",Health & Beauty > Personal Care > Feminine Care > Tampons
2285,466,playtex sport® multi pack tampons unscented -- 36 tampons,Health & Beauty > Personal Care > Feminine Care > Tampons
2286,466,emerita organic cotton tampons multipack -- 32 tampons,Health & Beauty > Personal Care > Feminine Care > Tampons
2287,466,"tampax pearl plastic tampons super plus absorbency scented, 18ct 18.0 ct 0.01 lbs",Health & Beauty > Personal Care > Feminine Care > Tampons
2288,466,"tampax pearl plastic tampons unscented ultra absorbency, 36ct 36.0 ct 0.15 lbs",Health & Beauty > Personal Care > Feminine Care > Tampons
2289,466,kotex u click tampons unscented regular 36.0 ea 0.45 lbs,Health & Beauty > Personal Care > Feminine Care > Tampons
2290,466,playtex sport tampons multi-pack fresh scent 36.0 ea 0.10 lbs,Health & Beauty > Personal Care > Feminine Care > Tampons
2291,466,tampax tampons multipax flushable applicator super/regular/lites 80.0 ea 1.42 lbs,Health & Beauty > Personal Care > Feminine Care > Tampons
2292,466,tampax pearl tampons regular absorbency unscented 36.0 ea 0.85 lbs,Health & Beauty > Personal Care > Feminine Care > Tampons
2293,466,cvs tampons super plus absorbency 40.0 ea 0.75 lbs,Health & Beauty > Personal Care > Feminine Care > Tampons
2294,466,cvs tampons regular 20.0 ea 0.23 lbs,Health & Beauty > Personal Care > Feminine Care > Tampons
2295,466,tampax pearl tampons regular absorbency fresh scent 40.0 ea 0.80 lbs,Health & Beauty > Personal Care > Feminine Care > Tampons
2296,466,"tampax pearl regular tampons with plastic applicator, unscented - 36 ct",Health & Beauty > Personal Care > Feminine Care > Tampons
2297,466,playtex sport tampons - super - 72 ct,Health & Beauty > Personal Care > Feminine Care > Tampons
2298,466,seventh generation tampons - regular - 40 ct,Health & Beauty > Personal Care > Feminine Care > Tampons
2299,466,tampax pearl active tampons - light/regular - 72 ct,Health & Beauty > Personal Care > Feminine Care > Tampons
2300,466,playtex gentle glide tampons regular plastic applicator fresh scent 40 ct box,Health & Beauty > Personal Care > Feminine Care > Tampons
2301,466,tampax pearl plastic tampons unscented duopack 9 lite 27 regular 36 ct box,Health & Beauty > Personal Care > Feminine Care > Tampons
2302,466,u by kotex tampons click plastic applicator super unscented - 18 count,Health & Beauty > Personal Care > Feminine Care > Tampons
2303,466,kotex tampon multi pack - 36 count,Health & Beauty > Personal Care > Feminine Care > Tampons
2304,466,o.b. super tampons - 40 count,Health & Beauty > Personal Care > Feminine Care > Tampons
2305,466,kotex security tampons economy pack - 34 count,Health & Beauty > Personal Care > Feminine Care > Tampons
2306,466,"playtex sport unscented super tampons, 36 ct",Health & Beauty > Personal Care > Feminine Care > Tampons
2307,466,"femtex super absorbency tampons, 8-ct. boxes",Health & Beauty > Personal Care > Feminine Care > Tampons
2308,466,playtex playtex sport tampons super unscented 18 each,Health & Beauty > Personal Care > Feminine Care > Tampons
2309,466,o.b. o.b. pro comfort tampons super 40 ea,Health & Beauty > Personal Care > Feminine Care > Tampons
2310,466,"o.b. ob pro comfort tampons, super, 40 ct",Health & Beauty > Personal Care > Feminine Care > Tampons
2311,466,"playtex gentle glide tampons, fresh scent, super plus, 36 ea - 1 ea",Health & Beauty > Personal Care > Feminine Care > Tampons
2312,466,"kotex natural balance security tampons, unscented, multi-pack, 50 ea - 1 pack",Health & Beauty > Personal Care > Feminine Care > Tampons
2313,466,"tampax pearl plastic triple pack includes light, regular, and super unscented tampons - 50 count",Health & Beauty > Personal Care > Feminine Care > Tampons
2314,466,tampax pocket pearl regular 18 ct.,Health & Beauty > Personal Care > Feminine Care > Tampons
2315,466,up & up™ multipack tampons plastic - 50 count,Health & Beauty > Personal Care > Feminine Care > Tampons
2316,466,kotex regular and super multi pack tampons - 36 count,Health & Beauty > Personal Care > Feminine Care > Tampons
2317,466,tampax radiant plastic duopack (regular & super) absorbencies unscented tampons - 32 count,Health & Beauty > Personal Care > Feminine Care > Tampons
2318,466,playtex tampons 48 ct,Health & Beauty > Personal Care > Feminine Care > Tampons
2319,466,tampax pearl multipax tampons - 50 count,Health & Beauty > Personal Care > Feminine Care > Tampons
2320,466,tampax pearl multipax tampons - 40 count,Health & Beauty > Personal Care > Feminine Care > Tampons
2321,466,athletic tampons regular absorbency plastic - 36 count - up & up™,Health & Beauty > Personal Care > Feminine Care > Tampons
2322,466,"tampax pearl plastic, light absorbency unscented tampons - 36 count",Health & Beauty > Personal Care > Feminine Care > Tampons
2323,466,u by kotex click* super plus compact tampons 18 count,Health & Beauty > Personal Care > Feminine Care > Tampons
2324,466,"u by kotex sleek, super plus tampons, 18 count",Health & Beauty > Personal Care > Feminine Care > Tampons
2325,466,"tampax pocket pearl regular absorbency unscented compact tampons, 18 count",Health & Beauty > Personal Care > Feminine Care > Tampons
2326,466,"equate regular absorbency unscented tampons, 40 count",Health & Beauty > Personal Care > Feminine Care > Tampons
2327,466,"equate plastic applicator regular absorbency unscented tampons, 36 count",Health & Beauty > Personal Care > Feminine Care > Tampons
2328,466,"kotex tampons regular, 36ct",Health & Beauty > Personal Care > Feminine Care > Tampons
2329,466,"u by kotex security regular tampons, 34 count",Health & Beauty > Personal Care > Feminine Care > Tampons
2330,466,"playtex femcare sport unscented super tampons, 36ct",Health & Beauty > Personal Care > Feminine Care > Tampons
2331,466,"u by kotex security super plus tampons, 34 count",Health & Beauty > Personal Care > Feminine Care > Tampons
2332,466,"tampax radiant compak plastic super absorbency, unscented tampons 18 count",Health & Beauty > Personal Care > Feminine Care > Tampons
2333,466,playtex sport tampons unscented regular absorbency 18 count,Health & Beauty > Personal Care > Feminine Care > Tampons
2334,466,"tampax pocket pearl regular/super unscented compact tampons duopack, 34 count",Health & Beauty > Personal Care > Feminine Care > Tampons
2335,466,"u by kotex security tampons, super plus, unscented, 50ct",Health & Beauty > Personal Care > Feminine Care > Tampons
2336,466,"u by kotex click unscented regular tampons, 50 count",Health & Beauty > Personal Care > Feminine Care > Tampons
2337,466,"tampax radiant plastic unscented super plus absorbent tampons, (choose your count)",Health & Beauty > Personal Care > Feminine Care > Tampons
2338,466,"playtex sport regular/super unscented tampons, 50 count",Health & Beauty > Personal Care > Feminine Care > Tampons
2339,466,tampax pearl ultra absorbency unscented tampons choose your count,Health & Beauty > Personal Care > Feminine Care > Tampons
2340,466,"tampax pearl tampons, super unscented 36.0 ea",Health & Beauty > Personal Care > Feminine Care > Tampons
2341,466,"tampax pearl tampons, regular unscented 36.0 ea",Health & Beauty > Personal Care > Feminine Care > Tampons
2342,466,"playtex gentle glide tampons, unscented multipack 25 regular & 25 super 50.0 ea.",Health & Beauty > Personal Care > Feminine Care > Tampons
2343,466,"playtex sport tampons, unscented regular, 36 ea 1.0 pack",Health & Beauty > Personal Care > Feminine Care > Tampons
2344,466,"non-applicator tampons, value pack regular, 40 ea o.b. pro comfort 1.0 pack",Health & Beauty > Personal Care > Feminine Care > Tampons
2345,466,tampons with pearl plastic applicators fresh scnet tampax pearl 1.0 pack,Health & Beauty > Personal Care > Feminine Care > Tampons
2346,466,"tampax pearl tampons triplepack unscented,lite regular super 50.0 ea",Health & Beauty > Personal Care > Feminine Care > Tampons
2347,466,u by kotex® sleek regular tampons 90ct,Health & Beauty > Personal Care > Feminine Care > Tampons
2348,466,the honest company regular tampon with applicator 64ct,Health & Beauty > Personal Care > Feminine Care > Tampons
2349,466,tampax pearl tampons - super plus - 18 ct,Health & Beauty > Personal Care > Feminine Care > Tampons
2350,466,tampax regular tampons with flushable cardboard applicator-20 ct,Health & Beauty > Personal Care > Feminine Care > Tampons
2351,466,"kotex multi-pack security tampons-50 ct, 2 pack",Health & Beauty > Personal Care > Feminine Care > Tampons
2352,466,o.b. tampons - super plus - 40 ct,Health & Beauty > Personal Care > Feminine Care > Tampons
2353,466,"tampax radiant regular & super tampons with plastic applicator, unscented - 32 ct",Health & Beauty > Personal Care > Feminine Care > Tampons
2354,466,"seventh generation tampons, super plus, 20 ct",Health & Beauty > Personal Care > Feminine Care > Tampons
2355,466,"playtex gentle glide regular tampons, unscented - 18 ct",Health & Beauty > Personal Care > Feminine Care > Tampons
2356,466,"playtex gentle glide multipack tampons, super/super+, unscented - 36 ct",Health & Beauty > Personal Care > Feminine Care > Tampons
2357,466,tampax pearl tampons - regular - 54 ct,Health & Beauty > Personal Care > Feminine Care > Tampons
2358,466,seventh generation organic tampons - regular - 40 ct,Health & Beauty > Personal Care > Feminine Care > Tampons
2359,466,playtex gentle glide 360 multi-pack tampons unscented -- 36 tampons,Health & Beauty > Personal Care > Feminine Care > Tampons
2360,466,maxim hygiene products organic cotton cardboard applicator tampons super -- 16 tampons,Health & Beauty > Personal Care > Feminine Care > Tampons
2361,466,cvs tampons super 54.0 ea 0.71 lbs,Health & Beauty > Personal Care > Feminine Care > Tampons
2362,466,tampax cardboard tampons super absorbency jumbo pack 54.0 ea 0.71 lbs,Health & Beauty > Personal Care > Feminine Care > Tampons
2363,466,cvs tampons multi-pack unscented 36.0 ea 0.07 lbs,Health & Beauty > Personal Care > Feminine Care > Tampons
2364,466,"cvs compact unscented tampons, regular 18.0 ea 0.20 lbs",Health & Beauty > Personal Care > Feminine Care > Tampons
2365,466,tampax pearl tampons regular absorbency fresh scent 36.0 ea,Health & Beauty > Personal Care > Feminine Care > Tampons
2366,466,"o.b. fluid-lock tampons, ultra 40.0 ea 0.37 lbs",Health & Beauty > Personal Care > Feminine Care > Tampons
2367,466,tampax pearl tampons super plus absorbency unscented 18.0 ea 0.61 lbs,Health & Beauty > Personal Care > Feminine Care > Tampons
2368,466,playtex gentle glide tampons deodorant regular absorbency 40.0 ea 0.57 lbs,Health & Beauty > Personal Care > Feminine Care > Tampons
2369,466,tampax radiant tampons - super - 32 ct,Health & Beauty > Personal Care > Feminine Care > Tampons
2370,466,"tampax radiant compak super absorbency tampons with plastic applicator, unscented - 36 ct",Health & Beauty > Personal Care > Feminine Care > Tampons
2371,466,"tampax pearl tampons, fresh scent - regular - 18 ct",Health & Beauty > Personal Care > Feminine Care > Tampons
2372,466,"tampax pearl ultra, plastic applicator, unscented tampons-36 ct",Health & Beauty > Personal Care > Feminine Care > Tampons
2373,466,tampax pearl tampons - light/regular - 72 ct,Health & Beauty > Personal Care > Feminine Care > Tampons
2374,466,"tampax pearl active slenderfit, plastic applicator tampons, triple pack, unscented, lite regular super - 36 ea",Health & Beauty > Personal Care > Feminine Care > Tampons
2375,466,"o.b. tampons, super - 40 ea",Health & Beauty > Personal Care > Feminine Care > Tampons
2376,466,"tampax pearl tampons with pearl plastic applicators, unscented, regular, 36 ea - 36 ea",Health & Beauty > Personal Care > Feminine Care > Tampons
2377,466,"tampax pearl plastic duo pack tampons, unscented, 20 regular, 16 super - 36 ea",Health & Beauty > Personal Care > Feminine Care > Tampons
2378,466,"tampax pocket pearl compact tampons, unscented, super plus - 36 ea",Health & Beauty > Personal Care > Feminine Care > Tampons
2379,466,"tampax pearl tampons, unscented, super - 18 ea",Health & Beauty > Personal Care > Feminine Care > Tampons
2380,466,"tampax pearl tampons with pearl plastic applicators, unscented, triple pack, light/regular/super, 50 - 50 ea",Health & Beauty > Personal Care > Feminine Care > Tampons
2381,466,"u by kotex sleek tampons, unscented, regular, 18 ea - 1 pack",Health & Beauty > Personal Care > Feminine Care > Tampons
2382,466,"tampax pearl tampons pocket, super - 36 ea",Health & Beauty > Personal Care > Feminine Care > Tampons
2383,466,up & up™ regular plastic applicator unscented tampons 20-pk.,Health & Beauty > Personal Care > Feminine Care > Tampons
2384,466,up&up regular plastic applicator unscented tampons - 40 count,Health & Beauty > Personal Care > Feminine Care > Tampons
2385,466,u by kotex sleek* regular tampons 34 count,Health & Beauty > Personal Care > Feminine Care > Tampons
2386,466,tampax pearl compak tampons - 40 count,Health & Beauty > Personal Care > Feminine Care > Tampons
2387,466,u by kotex click* super compact tampons 34 count,Health & Beauty > Personal Care > Feminine Care > Tampons
2388,466,up&up tampons regular absorbency plastic - 40 count,Health & Beauty > Personal Care > Feminine Care > Tampons
2389,466,"tampax radiant super, 32 count",Health & Beauty > Personal Care > Feminine Care > Tampons
2390,466,tampax pearl active super absorbency tampons - 36 count,Health & Beauty > Personal Care > Feminine Care > Tampons
2391,466,tampax pocket pearl regular absorbency unscented compact plastic tampons - 36 count,Health & Beauty > Personal Care > Feminine Care > Tampons
2392,466,playtex tampons 32 ct,Health & Beauty > Personal Care > Feminine Care > Tampons
2393,466,tampax pocket pear regular/super tampons - 34 count,Health & Beauty > Personal Care > Feminine Care > Tampons
2394,466,tampax pocket pearl regular - 18 count,Health & Beauty > Personal Care > Feminine Care > Tampons
2395,466,tampons super absorbency cardboard 40 ct - up & up™,Health & Beauty > Personal Care > Feminine Care > Tampons
2396,466,tampax pearl super tampons - 2 pack (50 count each),Health & Beauty > Personal Care > Feminine Care > Tampons
2397,466,tampax antislip grip cardboard applicator super absorbency tampons choose your count,Health & Beauty > Personal Care > Feminine Care > Tampons
2398,466,playtex gentle glide tampons unscented multipack 25 regular absorbency and 25 super absorbency 50 count,Health & Beauty > Personal Care > Feminine Care > Tampons
