,category_id,description,category_path
793,466,"tampax essentials tampons with plastic applicator, unscented, regular, 18 ea - 18 ea",Health & Beauty > Personal Care > Feminine Care > Tampons
794,466,"o.b. pro comfort tampons, regular - 40 ea",Health & Beauty > Personal Care > Feminine Care > Tampons
795,466,"tampons with pearl plastic applicator, unscented, ultra - 36 ea",Health & Beauty > Personal Care > Feminine Care > Tampons
796,466,"tampax pearl tampons, unscented, super - 36 ea",Health & Beauty > Personal Care > Feminine Care > Tampons
797,466,"u by kotex click unscented tampons, regular - 18 ea",Health & Beauty > Personal Care > Feminine Care > Tampons
798,466,"tampax pearl compak tampons with pearl plastic applicator, unscented, super - 40 ea",Health & Beauty > Personal Care > Feminine Care > Tampons
799,466,walgreens multipack tampons - 40 ea,Health & Beauty > Personal Care > Feminine Care > Tampons
800,466,"tampax cardboard, multipax tampons - 36 ea",Health & Beauty > Personal Care > Feminine Care > Tampons
801,466,"walgreens tampons, super - 40 ea",Health & Beauty > Personal Care > Feminine Care > Tampons
802,466,"tampax tampons with radiant plastic applicators, unscented, regular, 16 ea - 1 ea",Health & Beauty > Personal Care > Feminine Care > Tampons
803,466,"tampax pearl active tampons, unscented, regular - 36 ea",Health & Beauty > Personal Care > Feminine Care > Tampons
804,466,"tampax essentials tampons with plastic applicator, unscented, super, 18 ea - 18 ea",Health & Beauty > Personal Care > Feminine Care > Tampons
805,466,"walgreens perfection tampons multi-pack, unscented - 36 ea",Health & Beauty > Personal Care > Feminine Care > Tampons
806,466,tampax pearl super tampons - 2 pack (40 count each),Health & Beauty > Personal Care > Feminine Care > Tampons
807,466,tampax pearl super plus tampons - 36 count,Health & Beauty > Personal Care > Feminine Care > Tampons
808,466,tampax radiant super tampons - 16 count,Health & Beauty > Personal Care > Feminine Care > Tampons
809,466,kotex sleek super tampons - 36 count,Health & Beauty > Personal Care > Feminine Care > Tampons
810,466,"tampax pearl regular unscented, 54 count",Health & Beauty > Personal Care > Feminine Care > Tampons
811,466,tampax pocket pearl unscented super absorbency compact plastic tampons - 36 count,Health & Beauty > Personal Care > Feminine Care > Tampons
812,466,u by kotex® security tampon regular / super / super plus multi-pack - 50 count,Health & Beauty > Personal Care > Feminine Care > Tampons
813,466,playtex sport multipack unscented - 36 count,Health & Beauty > Personal Care > Feminine Care > Tampons
814,466,up & up™ tampons super absorbency plastic - 36 count,Health & Beauty > Personal Care > Feminine Care > Tampons
815,466,athletic tampons - regular absorbency - plastic - 36 ct - up & up™,Health & Beauty > Personal Care > Feminine Care > Tampons
816,466,"tampax cardboard applicator, super absorbency tampons 40 count",Health & Beauty > Personal Care > Feminine Care > Tampons
817,466,"tampax pocket pearl regular absorbency unscented compact tampons, 36 count",Health & Beauty > Personal Care > Feminine Care > Tampons
818,466,"playtex gentle glide tampons super deodorant, 36ct",Health & Beauty > Personal Care > Feminine Care > Tampons
819,466,"equate assorted absorbency unscented premium plastic tampons, 36 count",Health & Beauty > Personal Care > Feminine Care > Tampons
820,466,"pearl tampons with plastic applicators, fresh scent tampax pearl 36.0 ea",Health & Beauty > Personal Care > Feminine Care > Tampons
821,466,"u by kotex click unscented tampons super, 18 ea 1.0 ea",Health & Beauty > Personal Care > Feminine Care > Tampons
822,466,"radiant compak tampons with plastic applicator unscented,regular, 36 ea tampax 36.0 ea",Health & Beauty > Personal Care > Feminine Care > Tampons
823,466,"tampax pearl plastic duo pack tampons unscented, 20 regular, 16 super 36.0 ea",Health & Beauty > Personal Care > Feminine Care > Tampons
824,466,tampons with plastic applicator tampax pearl 36.0 ea,Health & Beauty > Personal Care > Feminine Care > Tampons
825,466,"tampons, unscented regular, 36 ea playtex sport 1.0 pack",Health & Beauty > Personal Care > Feminine Care > Tampons
826,466,"tampons, regular walgreens 40.0 ea",Health & Beauty > Personal Care > Feminine Care > Tampons
827,466,tampax pearl tampons pocket regular 36.0 ea,Health & Beauty > Personal Care > Feminine Care > Tampons
828,466,"playtex sport tampons, unscented super plus 36.0 ea",Health & Beauty > Personal Care > Feminine Care > Tampons
829,466,walgreens compact plastic applicator tampons super 18.0 ea,Health & Beauty > Personal Care > Feminine Care > Tampons
830,466,"tampax pearl tampons, lites/regular/super triplepack unscented 50.0 ea",Health & Beauty > Personal Care > Feminine Care > Tampons
831,466,"tampons super, plus o.b. 40.0 ea",Health & Beauty > Personal Care > Feminine Care > Tampons
832,466,organyc applicator tampon super 14ct 4pack,Health & Beauty > Personal Care > Feminine Care > Tampons
833,466,o.b. pro comfort tampons - super - 40 ct,Health & Beauty > Personal Care > Feminine Care > Tampons
834,466,seventh generation organic tampons - regular - 16 ct,Health & Beauty > Personal Care > Feminine Care > Tampons
835,466,"seventh generation organic chlorine-free organic applicator tampon, regular - regular - 16 ct",Health & Beauty > Personal Care > Feminine Care > Tampons
836,466,playtex sport tampons - regular - 72 ct,Health & Beauty > Personal Care > Feminine Care > Tampons
837,466,o.b. super plus tampons - 40 ct,Health & Beauty > Personal Care > Feminine Care > Tampons
838,466,seventh generation chlorine free organic cotton tampons - super -- 20 tampons,Health & Beauty > Personal Care > Feminine Care > Tampons
839,466,natracare organic cotton tampons super -- 10 tampons,Health & Beauty > Personal Care > Feminine Care > Tampons
840,466,natracare organic cotton tampons regular -- 20 tampons,Health & Beauty > Personal Care > Feminine Care > Tampons
841,466,tampax radiant super plus plastic unscented tampons 16.0 ea 0.32 lbs,Health & Beauty > Personal Care > Feminine Care > Tampons
842,466,u by kotex click regular tampons unscented 18.0 ea 0.22 lbs,Health & Beauty > Personal Care > Feminine Care > Tampons
843,466,"tampax anti-slip grip cardboard applicator tampons regular absorbency, 54ct 54.0 ct 0.57 lbs",Health & Beauty > Personal Care > Feminine Care > Tampons
844,466,kotex security tampons multi-pak unscented 36.0 ea 0.50 lbs,Health & Beauty > Personal Care > Feminine Care > Tampons
845,466,cvs tampons multi pack 54.0 ea 0.65 lbs,Health & Beauty > Personal Care > Feminine Care > Tampons
846,466,tampax cardboard tampons regular absorbency 54.0 ea 0.62 lbs,Health & Beauty > Personal Care > Feminine Care > Tampons
847,466,playtex sport tampons regular unscented 18.0 ea 0.27 lbs,Health & Beauty > Personal Care > Feminine Care > Tampons
848,466,"tampax radiant compak regular absorbency unscented tampons with plastic applicator, 36 ct",Health & Beauty > Personal Care > Feminine Care > Tampons
849,466,u by kotex security tampons - regular - 34 ct,Health & Beauty > Personal Care > Feminine Care > Tampons
850,466,"tampax radiant compak regular absorbency tampons with plastic applicator, unscented - 18 ct",Health & Beauty > Personal Care > Feminine Care > Tampons
851,466,"playtex gentle glide deodorant regular tampons, 18 ct",Health & Beauty > Personal Care > Feminine Care > Tampons
852,466,seventh generation applicator tampons-super--16ct,Health & Beauty > Personal Care > Feminine Care > Tampons
853,466,tampax tampons with flushable cardboard applicator - regular - 80 ct,Health & Beauty > Personal Care > Feminine Care > Tampons
854,466,"tampax essentials regular absorbency unscented tampons with plastic applicator, 36 ct",Health & Beauty > Personal Care > Feminine Care > Tampons
855,466,kotex regular security tampons-36 ct,Health & Beauty > Personal Care > Feminine Care > Tampons
856,466,"seventh generation organic tampons, no applicator - super plus - 40 ct",Health & Beauty > Personal Care > Feminine Care > Tampons
857,466,playtex sport tampons mlti-pk 8 light/20 regular/8 super plastic unscented 36 ct pkg,Health & Beauty > Personal Care > Feminine Care > Tampons
858,466,playtex sport tampons multi-pack 18 regular & 18 super plastic fresh scent 32 ct box,Health & Beauty > Personal Care > Feminine Care > Tampons
859,466,tampax pearl tampons triplepack 10 lites/30 regular/10 super unscented 50 ct box,Health & Beauty > Personal Care > Feminine Care > Tampons
860,466,"tampax pearl tampons, unscented, super plus - 18 ea",Health & Beauty > Personal Care > Feminine Care > Tampons
861,466,"tampax pearl tampons, scented, super plus - 36 ea",Health & Beauty > Personal Care > Feminine Care > Tampons
862,466,"tampax tampons with cardboard applicator, super, 20 ea - 1 pack",Health & Beauty > Personal Care > Feminine Care > Tampons
863,466,"360 plastic tampons, fresh scent, super plus - 36 ea",Health & Beauty > Personal Care > Feminine Care > Tampons
864,466,tampax super tampons - 40 count,Health & Beauty > Personal Care > Feminine Care > Tampons
865,466,cora organic cotton tampons mixed pack - 36 count,Health & Beauty > Personal Care > Feminine Care > Tampons
866,466,kotex sleek regular tampons - 34 count,Health & Beauty > Personal Care > Feminine Care > Tampons
867,466,tampax pearl plastic unscented regular absorbency tampons - 36 count,Health & Beauty > Personal Care > Feminine Care > Tampons
868,466,"o.b. tampons, super, 40ct",Health & Beauty > Personal Care > Feminine Care > Tampons
869,466,"tampax pearl plastic triple pack, light/regular/super absorbency, unscented tampons, 36 count 3.6"" x 5.9"" x 6.9""",Health & Beauty > Personal Care > Feminine Care > Tampons
870,466,"tampax pearl plastic light/regular/super absorbency unscented tampons, 50 count",Health & Beauty > Personal Care > Feminine Care > Tampons
871,466,tampax pearl lightregularsuper absorbency unscented tampons 36 count,Health & Beauty > Personal Care > Feminine Care > Tampons
872,466,"tampax pocket pearl super plus absorbency unscented compact tampons, (choose your count)",Health & Beauty > Personal Care > Feminine Care > Tampons
873,466,"playtex sport regular unscented tampons, 36ct",Health & Beauty > Personal Care > Feminine Care > Tampons
874,466,"tampax pocket pearl regular absorbency unscented compact tampons, (choose your count)",Health & Beauty > Personal Care > Feminine Care > Tampons
875,466,"tampax pearl plastic, super absorbency, unscented tampons, 36 count",Health & Beauty > Personal Care > Feminine Care > Tampons
876,466,"tampax radiant super plus absorbency unscented tampons, 32 count",Health & Beauty > Personal Care > Feminine Care > Tampons
877,466,u by kotex click regular super tampons 34 count,Health & Beauty > Personal Care > Feminine Care > Tampons
878,466,"u by kotex click compact tampons, super plus absorbency, unscented",Health & Beauty > Personal Care > Feminine Care > Tampons
879,466,"tampax super plus cardboard applicator tampons, 54 count",Health & Beauty > Personal Care > Feminine Care > Tampons
880,466,"tampax cardboard applicator regular absorbency tampons, (choose your count)",Health & Beauty > Personal Care > Feminine Care > Tampons
881,466,tampax pearl plastic tampons ultra unscented ultra absorbency 18 each pack of 2,Health & Beauty > Personal Care > Feminine Care > Tampons
882,466,"tampax pearl plastic regular/super/super plus absorbency unscented tampons, 36 count",Health & Beauty > Personal Care > Feminine Care > Tampons
883,466,tampax pearl plastic triplepack unscented tampons 36 count,Health & Beauty > Personal Care > Feminine Care > Tampons
884,466,playtex sport tampons unscented super absorbency 18 count,Health & Beauty > Personal Care > Feminine Care > Tampons
885,466,"tampons, unscented regular, 18 ea playtex sport 1.0 pack",Health & Beauty > Personal Care > Feminine Care > Tampons
886,466,tampons with pearl plastic applicator unscented tampax pearl 1.0 pack,Health & Beauty > Personal Care > Feminine Care > Tampons
887,466,"tampax tampons with radiant plastic applicators unscented,super, 32 ea 1.0 ea",Health & Beauty > Personal Care > Feminine Care > Tampons
888,466,"playtex sport tampons, unscented regular, 18 ea 1.0 pack",Health & Beauty > Personal Care > Feminine Care > Tampons
889,466,"tampax pearl active tampons unscented,lite 36.0 ea",Health & Beauty > Personal Care > Feminine Care > Tampons
890,466,"compak tampons with pearl plastic applicator unscented,triple pk, light/regular/super, 40 ea tampax pearl 40.0 ea.",Health & Beauty > Personal Care > Feminine Care > Tampons
891,466,tampons with pearl plastic applicators unscented tampax pearl,Health & Beauty > Personal Care > Feminine Care > Tampons
892,466,tampax radiant tampons regular/super duo 84ct,Health & Beauty > Personal Care > Feminine Care > Tampons
893,466,seventh generation 16-count feminine applicator regular tampons 16 ct,Health & Beauty > Personal Care > Feminine Care > Tampons
894,466,"seventh generation organic tampons, no applicator - regular - 20 ct",Health & Beauty > Personal Care > Feminine Care > Tampons
895,466,tampax pearl tampons - super - 50 ct,Health & Beauty > Personal Care > Feminine Care > Tampons
896,466,tampax pearl tampons - ultra - 72 ct,Health & Beauty > Personal Care > Feminine Care > Tampons
897,466,"seventh generation tampons, regular, 20 ct, no applicator",Health & Beauty > Personal Care > Feminine Care > Tampons
898,466,"playtex gentleglide 360, unscented 25 regular & 25 super tampons, 50 ct",Health & Beauty > Personal Care > Feminine Care > Tampons
899,466,playtex gentle glide 360 tampons - super plus - 36 ct,Health & Beauty > Personal Care > Feminine Care > Tampons
900,466,"seventh generation organic tampons, no applicator - regular - 40 ct",Health & Beauty > Personal Care > Feminine Care > Tampons
901,466,tampax multipax tampons with flushable cardboard applicator - 54 ct,Health & Beauty > Personal Care > Feminine Care > Tampons
902,466,tampax pearl unscented super tampons with plastic applicator-36 ct,Health & Beauty > Personal Care > Feminine Care > Tampons
903,466,seventh generation organic tampons - super plus - 20 ct,Health & Beauty > Personal Care > Feminine Care > Tampons
904,466,"tampax pearl plastic tampons unscented regular absorbency, 36ct 36.0 ct 0.01 lbs",Health & Beauty > Personal Care > Feminine Care > Tampons
905,466,"tampax pocket pearl duopack, regular and super, 34ct 34.0 ct 0.50 lbs",Health & Beauty > Personal Care > Feminine Care > Tampons
906,466,"natracare organic cotton tampons super, 20ct 20.0 ct 0.10 lbs",Health & Beauty > Personal Care > Feminine Care > Tampons
907,466,cvs super absorbency plastic tampons unscented 36.0 ea 0.73 lbs,Health & Beauty > Personal Care > Feminine Care > Tampons
908,466,"playtex gentle glide ultra tampons, unscented - 36 ct",Health & Beauty > Personal Care > Feminine Care > Tampons
909,466,tampax tampons with flushable cardboard applicator - light/regular/super - 160 ct,Health & Beauty > Personal Care > Feminine Care > Tampons
910,466,tampax tampons with cardboard applicator - regular - 40 ct,Health & Beauty > Personal Care > Feminine Care > Tampons
911,466,tampax radiant plastic triplepack (regular/super/super+) absorbency tampons 32 count,Health & Beauty > Personal Care > Feminine Care > Tampons
912,466,"playtex gentle glide unscented multipack tampons, super/super+, 36 ct",Health & Beauty > Personal Care > Feminine Care > Tampons
913,466,playtex sport tampons - regular - 36 ct,Health & Beauty > Personal Care > Feminine Care > Tampons
914,466,playtex gentle glide unscented ultra tampons-36 ct,Health & Beauty > Personal Care > Feminine Care > Tampons
915,466,o.b. pro comfort tampons - regular - 40 ct,Health & Beauty > Personal Care > Feminine Care > Tampons
916,466,tampax pocket pearl tampons - regular - 36 ct,Health & Beauty > Personal Care > Feminine Care > Tampons
917,466,"tampax pocket pearl tampons, regular, unscented - (18ct)",Health & Beauty > Personal Care > Feminine Care > Tampons
918,466,playtex sport tampons unscented regular - (18ct),Health & Beauty > Personal Care > Feminine Care > Tampons
919,466,tampax tampons super plus - (40ct),Health & Beauty > Personal Care > Feminine Care > Tampons
920,466,playtex gentle glide 360 tampons multi-pack regular & super unscented 36 ct box,Health & Beauty > Personal Care > Feminine Care > Tampons
921,466,tampax pearl tampons regular absorbency plastic applicator unscented 18 ct box,Health & Beauty > Personal Care > Feminine Care > Tampons
922,466,tampax anti-slip grip cardboard applicator super absorbency tampons - 40 count,Health & Beauty > Personal Care > Feminine Care > Tampons
923,466,tampax pearl plastic applicator super plus absorbency scented tampons - 36 count,Health & Beauty > Personal Care > Feminine Care > Tampons
924,466,up & up tampons 36 pk,Health & Beauty > Personal Care > Feminine Care > Tampons
925,466,"u by kotex® security® tampons, super 34 count",Health & Beauty > Personal Care > Feminine Care > Tampons
926,466,playtex sport unscented tampon multipack - 36 count,Health & Beauty > Personal Care > Feminine Care > Tampons
927,466,tampax pearl super absorbancy tampons - 50 count,Health & Beauty > Personal Care > Feminine Care > Tampons
928,466,"tampax pearl plastic regular absorbency tampons, (choose your count)",Health & Beauty > Personal Care > Feminine Care > Tampons
929,466,"u by kotex security tampons, regular, unscented",Health & Beauty > Personal Care > Feminine Care > Tampons
930,466,"u by kotex sleek regular tampons, 34 count",Health & Beauty > Personal Care > Feminine Care > Tampons
931,466,"u by kotex security super tampons, 34 count",Health & Beauty > Personal Care > Feminine Care > Tampons
932,466,"playtex sport fresh balance regular absorbency plastic tampons, 16 count",Health & Beauty > Personal Care > Feminine Care > Tampons
933,466,"u by kotex security tampons, super plus, unscented 36ct",Health & Beauty > Personal Care > Feminine Care > Tampons
934,466,"playtex tampons multipack fresh scent, 36ct",Health & Beauty > Personal Care > Feminine Care > Tampons
935,466,"tampax pearl plastic ultra absorbency unscented tampons, (choose your count)",Health & Beauty > Personal Care > Feminine Care > Tampons
936,466,"u by kotex click regular tampons, 34 count",Health & Beauty > Personal Care > Feminine Care > Tampons
937,466,"u by kotex click compact tampons, regular absorbency, unscented",Health & Beauty > Personal Care > Feminine Care > Tampons
938,466,"tampax pearl ultra absorbency unscented tampons, 36 count",Health & Beauty > Personal Care > Feminine Care > Tampons
939,466,ob regular tampons 40 count,Health & Beauty > Personal Care > Feminine Care > Tampons
940,466,"playtex gentle glide tampons super plus deodorant, 36ct",Health & Beauty > Personal Care > Feminine Care > Tampons
941,466,"tampons, fresh scent super, 36 ea playtex gentle glide",Health & Beauty > Personal Care > Feminine Care > Tampons
942,466,"tampax pearl tampons unscented,super 18.0 ea",Health & Beauty > Personal Care > Feminine Care > Tampons
943,466,"tampax tampons with anti-slip grip cardboard applicator, regular 54.0 ea",Health & Beauty > Personal Care > Feminine Care > Tampons
944,466,playtex sport fresh balance tampons regular 32.0 ea,Health & Beauty > Personal Care > Feminine Care > Tampons
945,466,compact plastic applicator tampons super walgreens 18.0 ea,Health & Beauty > Personal Care > Feminine Care > Tampons
946,466,"u by kotex click unscented tampons super, 50 ea 50.0 ea",Health & Beauty > Personal Care > Feminine Care > Tampons
947,466,"tampons with pearl plastic applicator unscented,super, 18 ea tampax pearl 1.0 box",Health & Beauty > Personal Care > Feminine Care > Tampons
948,466,"tampax radiant plastic tampons, triple pack absorbencies 32.0 ea",Health & Beauty > Personal Care > Feminine Care > Tampons
949,466,u by kotex click unscented tampons regular 18.0 ea,Health & Beauty > Personal Care > Feminine Care > Tampons
950,466,organic all-cotton tampons natracare 1.0 ea,Health & Beauty > Personal Care > Feminine Care > Tampons
951,466,"tampax pearl tampons, regular unscented 54.0 ea",Health & Beauty > Personal Care > Feminine Care > Tampons
952,466,tampax pearl regular 96ct,Health & Beauty > Personal Care > Feminine Care > Tampons
953,466,"playtex gentle glide ultra tampons, unscented - 36 ct - 2 pk",Health & Beauty > Personal Care > Feminine Care > Tampons
954,466,tampax pearl super plus tampons with plastic applicator - 18 ct,Health & Beauty > Personal Care > Feminine Care > Tampons
955,466,"playtex sport super tampons, unscented - 36 ct",Health & Beauty > Personal Care > Feminine Care > Tampons
956,466,"seventh generation organic tampons, with applicator - regular - 32 ct",Health & Beauty > Personal Care > Feminine Care > Tampons
957,466,u by kotex click tampons with compact applicator - super - 34 ct,Health & Beauty > Personal Care > Feminine Care > Tampons
958,466,"playtex sport regular tampons, unscented - 36 ct",Health & Beauty > Personal Care > Feminine Care > Tampons
959,466,"tampax pearl regular absorbency tampons with plastic applicator, fresh scent, 36 ct",Health & Beauty > Personal Care > Feminine Care > Tampons
960,466,"tampax compak pearl light tampons with plastic applicator, unscented - 20 ct",Health & Beauty > Personal Care > Feminine Care > Tampons
961,466,o.b. pro comfort super tampons - 40 ct,Health & Beauty > Personal Care > Feminine Care > Tampons
962,466,cvs tampons light absorbency plastic applicator unscented 18.0 ea 0.38 lbs,Health & Beauty > Personal Care > Feminine Care > Tampons
963,466,tampax pearl plastic tampons duopack 36.0 ea na,Health & Beauty > Personal Care > Feminine Care > Tampons
964,466,playtex gentle glide tampons deodorant super absorbency 36.0 ea 0.62 lbs,Health & Beauty > Personal Care > Feminine Care > Tampons
965,466,"tampax pearl active super tampons, unscented 36.0 ea na",Health & Beauty > Personal Care > Feminine Care > Tampons
966,466,u by kotex click tampons super plus unscented 18.0 ea 0.26 lbs,Health & Beauty > Personal Care > Feminine Care > Tampons
967,466,"tampax pocket pearl compact plastic tampons, regular absorbency - unscented - 36 ct",Health & Beauty > Personal Care > Feminine Care > Tampons
968,466,tampax pearl unscented super plus tampons with plastic applicator-18 ct,Health & Beauty > Personal Care > Feminine Care > Tampons
969,466,playtex gentle glide tampons - regular - 40 ct,Health & Beauty > Personal Care > Feminine Care > Tampons
970,466,playtex gentle glide tampons - regular - 20 ct,Health & Beauty > Personal Care > Feminine Care > Tampons
971,466,tampax pearl super plus tampons with plastic applicator-fresh scent-18 ct,Health & Beauty > Personal Care > Feminine Care > Tampons
972,466,playtex sport tampons - regular/super - 72 ct,Health & Beauty > Personal Care > Feminine Care > Tampons
973,466,"playtex gentle glide super plus tampons, unscented - 36 ct",Health & Beauty > Personal Care > Feminine Care > Tampons
974,466,"playtex gentle glide 360 tampons, fresh scent - regular - 54 ct",Health & Beauty > Personal Care > Feminine Care > Tampons
975,466,tampax tampons - regular - 100 ct. + 5 ct. tampax pearl trial pack,Health & Beauty > Personal Care > Feminine Care > Tampons
976,466,playtex sport tampons super plastic applicator unscented 36 ct box,Health & Beauty > Personal Care > Feminine Care > Tampons
977,466,u by kotex click tampons plastic super unscented 18 ct box,Health & Beauty > Personal Care > Feminine Care > Tampons
978,466,tampax pearl tampons super absorbency plastic applicator unscented 36 ct pkg,Health & Beauty > Personal Care > Feminine Care > Tampons
979,466,tampax pearl tampons super absorbency with plastic applicator unscented 18 ct box,Health & Beauty > Personal Care > Feminine Care > Tampons
980,466,"tampax compak pearl tampons multipack super, regular & lites 40 ct box",Health & Beauty > Personal Care > Feminine Care > Tampons
981,466,careone tampons multipack regular super & super plus cardboard applicator 40 ct box,Health & Beauty > Personal Care > Feminine Care > Tampons
982,466,tampax pearl tampons ultra absorbency w/plastic applicator unscented 36 ct box,Health & Beauty > Personal Care > Feminine Care > Tampons
983,466,tampax pearl tampons super absorbency with plastic applicator fresh scent 18 ct box,Health & Beauty > Personal Care > Feminine Care > Tampons
984,466,playtex sport tampons regular plastic applicator unscented 18 ct box,Health & Beauty > Personal Care > Feminine Care > Tampons
985,466,"U by Kotex Click Tampon, Regular Absorbency, Carmilla Limited Edition, Unscented, 34 Count (Pack of 6)",Health & Beauty > Personal Care > Feminine Care > Tampons
986,466,"o.b. digital tampon, super",Health & Beauty > Personal Care > Feminine Care > Tampons
987,466,"o.b. super plus, 40 count",Health & Beauty > Personal Care > Feminine Care > Tampons
988,466,tampax compak pearl super absorbancy plastic tampons - 20 ea,Health & Beauty > Personal Care > Feminine Care > Tampons
989,466,"playtex gentle glide tampons multipack, unscented regular/super absorbency, 36 count (pack of 2) health and beauty",Health & Beauty > Personal Care > Feminine Care > Tampons
990,466,"Poise Impressa Bladder Supports, Sizing Kit, 6 Tampons (Pack of 2)",Health & Beauty > Personal Care > Feminine Care > Tampons
991,466,"tampax pearl compak plastic, regular absorbency, unscented tampons, 20 count (pack of 4) health and beauty",Health & Beauty > Personal Care > Feminine Care > Tampons
992,466,u by kotex click,Health & Beauty > Personal Care > Feminine Care > Tampons
993,466,"u by kotex click tampon, regular absorbency, 18-count boxes (pack of 4)",Health & Beauty > Personal Care > Feminine Care > Tampons
994,466,Organic Essentials Certified Organic Cotton Tampons-16 regular w/ applicator,Health & Beauty > Personal Care > Feminine Care > Tampons
