,category_id,description,category_path
1592,466,kotex sleek regular tampons - 36 count,Health & Beauty > Personal Care > Feminine Care > Tampons
1593,466,tampax pocket pearl regular 36 ct.,Health & Beauty > Personal Care > Feminine Care > Tampons
1594,466,u by kotex click* regular/super compact tampons 34 count,Health & Beauty > Personal Care > Feminine Care > Tampons
1595,466,o.b.® super plus fluid lock tampons - 40 count,Health & Beauty > Personal Care > Feminine Care > Tampons
1596,466,tampax pearl compak regular absorbency tampons - 40 count,Health & Beauty > Personal Care > Feminine Care > Tampons
1597,466,seventh generation regular tampon with applicator - 16 count,Health & Beauty > Personal Care > Feminine Care > Tampons
1598,466,o.b. original tampons: super plus absorbency,Health & Beauty > Personal Care > Feminine Care > Tampons
1599,466,u by kotex® jumbo multi-pack security tampons - 50 count,Health & Beauty > Personal Care > Feminine Care > Tampons
1600,466,u by kotex® click regular compact tampon - 50 count,Health & Beauty > Personal Care > Feminine Care > Tampons
1601,466,tampax pocket pearl regular - 36 count,Health & Beauty > Personal Care > Feminine Care > Tampons
1602,466,kotex sleek tampons - super 36 count,Health & Beauty > Personal Care > Feminine Care > Tampons
1603,466,up&up regular unscented tampons - 40 count,Health & Beauty > Personal Care > Feminine Care > Tampons
1604,466,"u by kotex® security® tampons, regular 34 count",Health & Beauty > Personal Care > Feminine Care > Tampons
1605,466,up & up™ tampons regular absorbency cardboard - 40 count,Health & Beauty > Personal Care > Feminine Care > Tampons
1606,466,tampons - super absorbency - plastic - 36 ct - up & up™,Health & Beauty > Personal Care > Feminine Care > Tampons
1607,466,kotex regular and super multi pack tampons - 34 count,Health & Beauty > Personal Care > Feminine Care > Tampons
1608,466,o.b.® fluid lock multi-pack tampons - 40 count,Health & Beauty > Personal Care > Feminine Care > Tampons
1609,466,playtex sport plastic applicator unscented super absorbency tampons 36-ct.,Health & Beauty > Personal Care > Feminine Care > Tampons
1610,466,"u by kotex click, super tampons, 18 count",Health & Beauty > Personal Care > Feminine Care > Tampons
1611,466,"playtex gentle glide tampons regular multipack deodorant, 36ct",Health & Beauty > Personal Care > Feminine Care > Tampons
1612,466,"equate regular absorbency unscented premium plastic tampons, 40 count",Health & Beauty > Personal Care > Feminine Care > Tampons
1613,466,"tampax radiant plastic, duopack absorbency, unscented tampons, 32 count",Health & Beauty > Personal Care > Feminine Care > Tampons
1614,466,"playtex tampons multipack unscented, 36ct",Health & Beauty > Personal Care > Feminine Care > Tampons
1615,466,"playtex gentle glide tampons multipack unscented, 36ct",Health & Beauty > Personal Care > Feminine Care > Tampons
1616,466,"u by kotex security, multi-pak tampons, 50 count",Health & Beauty > Personal Care > Feminine Care > Tampons
1617,466,"u by kotex security, super tampons, 18 count",Health & Beauty > Personal Care > Feminine Care > Tampons
1618,466,"playtex sport tampons unscented, fresh balance multipack regular & super 50.0 ea",Health & Beauty > Personal Care > Feminine Care > Tampons
1619,466,u by kotex click unscented tampons super plus 18.0 ea,Health & Beauty > Personal Care > Feminine Care > Tampons
1620,466,u by kotex click unscented tampons regular 50.0 ea,Health & Beauty > Personal Care > Feminine Care > Tampons
1621,466,tampax tampons with radiant plastic applicators unscented 1.0 ea,Health & Beauty > Personal Care > Feminine Care > Tampons
1622,466,tampons with radiant plastic applicators unscented tampax 1.0 ea,Health & Beauty > Personal Care > Feminine Care > Tampons
1623,466,"tampax pearl active tampons, regular unscented 36.0 ea",Health & Beauty > Personal Care > Feminine Care > Tampons
1624,466,"walgreens tampons, regular 40.0 ea",Health & Beauty > Personal Care > Feminine Care > Tampons
1625,466,"tampax pearl tampons unscented,regular 54.0 ea",Health & Beauty > Personal Care > Feminine Care > Tampons
1626,466,organyc applicator tampons regular 16ct 4pack,Health & Beauty > Personal Care > Feminine Care > Tampons
1627,466,"playtex tampons, plastic applicator, 200/ct",Health & Beauty > Personal Care > Feminine Care > Tampons
1628,466,"tampax pearl regular absorbency tampons with plastic applicator, unscented, 36 ct",Health & Beauty > Personal Care > Feminine Care > Tampons
1629,466,tampax pearl tampons - super - 18 ct,Health & Beauty > Personal Care > Feminine Care > Tampons
1630,466,seventh generation organic tampons - super - 20 ct,Health & Beauty > Personal Care > Feminine Care > Tampons
1631,466,tampax super plus tampons with flushable cardboard applicator-10 ct,Health & Beauty > Personal Care > Feminine Care > Tampons
1632,466,tampax radiant tampons - super plus - 32 ct,Health & Beauty > Personal Care > Feminine Care > Tampons
1633,466,"natracare, organic cotton tampons, regular, 16 tampons",Health & Beauty > Personal Care > Feminine Care > Tampons
1634,466,natracare organic cotton tampons super -- 20 tampons,Health & Beauty > Personal Care > Feminine Care > Tampons
1635,466,"tampax pearl plastic tampons unscented triple pack light/regular/super absorbency, 36ct 36.0 ct 0.01 lbs",Health & Beauty > Personal Care > Feminine Care > Tampons
1636,466,cvs tampons light absorbency plastic applicator unscented 18.0 ea,Health & Beauty > Personal Care > Feminine Care > Tampons
1637,466,"tampax anti-slip grip cardboard applicator tampons lites/regular/super multipax absorbency, 54ct 54.0 ct 0.80 lbs",Health & Beauty > Personal Care > Feminine Care > Tampons
1638,466,playtex sport tampons super unscented 18.0 ea 0.31 lbs,Health & Beauty > Personal Care > Feminine Care > Tampons
1639,466,tampax pearl tampons light absorbency unscented 18.0 ea 0.25 lbs,Health & Beauty > Personal Care > Feminine Care > Tampons
1640,466,tampax tampons with flushable cardboard applicator - regular - 40 ct,Health & Beauty > Personal Care > Feminine Care > Tampons
1641,466,"playtex gentle glide 360 tampons, fresh scent - super plus - 72 ct",Health & Beauty > Personal Care > Feminine Care > Tampons
1642,466,"tampax essentials regular absorbency unscented tampons with plastic applicator, 18 ct",Health & Beauty > Personal Care > Feminine Care > Tampons
1643,466,organic non-applicator super tampons 20 ct,Health & Beauty > Personal Care > Feminine Care > Tampons
1644,466,"tampax radiant plastic tampons, unscented, duopack - (32ct)",Health & Beauty > Personal Care > Feminine Care > Tampons
1645,466,tampax pearl regular unscented tampons - (18ct),Health & Beauty > Personal Care > Feminine Care > Tampons
1646,466,ubykotexclicksupercompacttamponsunscented50ct,Health & Beauty > Personal Care > Feminine Care > Tampons
1647,466,playtex gentle glide tampons super plastic applicator deodorant 18 ct box,Health & Beauty > Personal Care > Feminine Care > Tampons
1648,466,u by kotex security tampons super absorbency medium-heavy flow 18 ct box,Health & Beauty > Personal Care > Feminine Care > Tampons
1649,466,tampax pearl tampons regular absorbency plastic applicator scented 36 ct box,Health & Beauty > Personal Care > Feminine Care > Tampons
1650,466,tampax tampons super plus absorbency with flushable applicator 40 ct box,Health & Beauty > Personal Care > Feminine Care > Tampons
1651,466,tampax pearl regular unscented - 18 count,Health & Beauty > Personal Care > Feminine Care > Tampons
1652,466,tampax super plus flushable tampons - 40 count,Health & Beauty > Personal Care > Feminine Care > Tampons
1653,466,playtex gentle glide unscented multi pack regular aborbency tampons - 36 count,Health & Beauty > Personal Care > Feminine Care > Tampons
1654,466,platex tampon deod super - 18 count,Health & Beauty > Personal Care > Feminine Care > Tampons
1655,466,"tampax tampax pearl plastic tampons, regular super & super plus,...",Health & Beauty > Personal Care > Feminine Care > Tampons
1656,466,tampax tampax pearl plastic regular absorbency unscented tampons...,Health & Beauty > Personal Care > Feminine Care > Tampons
1657,466,"o.b. ob tampons, super plus, 40 ct super plus",Health & Beauty > Personal Care > Feminine Care > Tampons
1658,466,"o.b. o.b. silk touch pro comfort tampons, regular, 18 ct",Health & Beauty > Personal Care > Feminine Care > Tampons
1659,466,"tampax pearl plastic triple pack, light/regular/super abs... 50",Health & Beauty > Personal Care > Feminine Care > Tampons
1660,466,"tampax tampax radiant plastic tampons, regular, 32 ct",Health & Beauty > Personal Care > Feminine Care > Tampons
1661,466,"o.b. o.b. tampons multipack, regular, super & super plus, 40 ct",Health & Beauty > Personal Care > Feminine Care > Tampons
1662,466,"kotex u by kotex security tampons multipak, multipack, 34 ct",Health & Beauty > Personal Care > Feminine Care > Tampons
1663,466,"seventh generation seventh generation applicator tampon - super, 16 count",Health & Beauty > Personal Care > Feminine Care > Tampons
1664,466,"o.b. ob tampons, regular, 40 ct",Health & Beauty > Personal Care > Feminine Care > Tampons
1665,466,"tampax tampax pearl compak plastic, regular absorbency, unscente...",Health & Beauty > Personal Care > Feminine Care > Tampons
1666,466,"playtex playtex gentle glide 360 scented tampons, super, 36 ct",Health & Beauty > Personal Care > Feminine Care > Tampons
1667,466,"tampax tampax tampons with anti-slip grip cardboard applicator, ...",Health & Beauty > Personal Care > Feminine Care > Tampons
1668,466,"playtex playtex sport fresh balance scented tampons, regular, 16 ct",Health & Beauty > Personal Care > Feminine Care > Tampons
1669,466,"tampax pearl unscented super plus absorbency tampons, 36ct",Health & Beauty > Personal Care > Feminine Care > Tampons
1670,466,"tampax radiant plastic unscented regular absorbent tampons, 16 count",Health & Beauty > Personal Care > Feminine Care > Tampons
1671,466,"tampax pocket pearl regular absorbency unscented compact tampons, 18 ct",Health & Beauty > Personal Care > Feminine Care > Tampons
1672,466,"tampax pearl plastic duo pack, 36 ct",Health & Beauty > Personal Care > Feminine Care > Tampons
1673,466,"tampax compak pearl plastic, r 40 ct",Health & Beauty > Personal Care > Feminine Care > Tampons
1674,466,"tampax pearl plastic tampons, mutlipax, unscented - 36 count",Health & Beauty > Personal Care > Feminine Care > Tampons
1675,466,"playtex gentle glide 360 tampons, plastic, super plus absorbency, fresh scent, 36 tampons",Health & Beauty > Personal Care > Feminine Care > Tampons
1676,466,u by kotex sleek tampons regular 90ct,Health & Beauty > Personal Care > Feminine Care > Tampons
1677,466,tampax tampons with cardboard applicators super,Health & Beauty > Personal Care > Feminine Care > Tampons
1678,466,"natracare organic all cotton tampons, super plus - 20 tampons",Health & Beauty > Personal Care > Feminine Care > Tampons
1679,466,kotex regular click tampons - 18 count,Health & Beauty > Personal Care > Feminine Care > Tampons
1680,466,"tampax radiant duopack tampons - 32 count (18 regular, 14 super)",Health & Beauty > Personal Care > Feminine Care > Tampons
1681,466,"tampax pearl tampons super, 96-count - sale price limit 2",Health & Beauty > Personal Care > Feminine Care > Tampons
1682,466,playtex gentle glide 360 fresh scent super plus tampons,Health & Beauty > Personal Care > Feminine Care > Tampons
1683,466,tampax regular tampons,Health & Beauty > Personal Care > Feminine Care > Tampons
1684,466,organic cotton tampons no applicator - super plus,Health & Beauty > Personal Care > Feminine Care > Tampons
1685,466,tampax anti-slip grip cardboa - 20.00 ct,Health & Beauty > Personal Care > Feminine Care > Tampons
1686,466,tampax regular cardboard appl - 20.00 ct,Health & Beauty > Personal Care > Feminine Care > Tampons
1687,466,tampax pearl active plastic a - 36.00 ct,Health & Beauty > Personal Care > Feminine Care > Tampons
1688,466,tampax cardboard applicator s - 20.00 ct,Health & Beauty > Personal Care > Feminine Care > Tampons
1689,466,playtex sport regular/super absorben - 36.00 ct,Health & Beauty > Personal Care > Feminine Care > Tampons
1690,466,tampax radiant plastic regula - 32.00 ct,Health & Beauty > Personal Care > Feminine Care > Tampons
1691,466,u by kotex sleek tampons super fu - 18.00 ct,Health & Beauty > Personal Care > Feminine Care > Tampons
1692,466,super tampons without applicator,Health & Beauty > Personal Care > Feminine Care > Tampons
1693,466,super plus tampons without applicator,Health & Beauty > Personal Care > Feminine Care > Tampons
1694,466,box of non-applicator tampons 0 super 0 super+ 18 regular,Health & Beauty > Personal Care > Feminine Care > Tampons
1695,466,boxes of applicator tampons 0 light 3 regular 3 super 12 super+,Health & Beauty > Personal Care > Feminine Care > Tampons
1696,466,box of applicator tampons 6 light 7 regular 5 super 0 super+,Health & Beauty > Personal Care > Feminine Care > Tampons
1697,466,box 7 light 9 regular 2 super,Health & Beauty > Personal Care > Feminine Care > Tampons
1698,466,box of applicator tampons 4 light 8 regular 6 super 0 super+,Health & Beauty > Personal Care > Feminine Care > Tampons
1699,466,boxes of applicator tampons 4 light 6 regular 8 super 0 super+,Health & Beauty > Personal Care > Feminine Care > Tampons
1700,466,boxes of applicator tampons 3 light 9 regular 6 super 0 super+,Health & Beauty > Personal Care > Feminine Care > Tampons
1701,466,"boxes 0 light, 16 regular, and 2 super",Health & Beauty > Personal Care > Feminine Care > Tampons
1702,466,box 5 light 5 regular 8 super,Health & Beauty > Personal Care > Feminine Care > Tampons
1703,466,box of applicator tampons 0 light 12 regular 6 super 0 super+,Health & Beauty > Personal Care > Feminine Care > Tampons
1704,466,"box 8 light, 4 regular, and 6 super",Health & Beauty > Personal Care > Feminine Care > Tampons
1705,466,natracare regular tampons with applicator ( 1x16 ct),Health & Beauty > Personal Care > Feminine Care > Tampons
1706,466,Certified Organic 100% Cotton Super Plus Tampoons Natracare 20 Tampon,Health & Beauty > Personal Care > Feminine Care > Tampons
1707,466,"Tampax Pearl Plastic Triple Pack, Light/Regular/Super Absorbency, Scented Tampons, 36 Count Tampax",Health & Beauty > Personal Care > Feminine Care > Tampons
1708,466,"tampax pearl regular absorbency unscented tampons, 96 count",Health & Beauty > Personal Care > Feminine Care > Tampons
1709,466,radiant plastic super absorbency unscented tampons 16ct quantity: 2,Health & Beauty > Personal Care > Feminine Care > Tampons
1710,466,"u by kotex sleek tampons super absorbency,18 count (pack of 8)",Health & Beauty > Personal Care > Feminine Care > Tampons
1711,466,tampax radiant plastic - super plus absorbency - unscented - 16 tampons - pack of 2,Health & Beauty > Personal Care > Feminine Care > Tampons
1712,466,"tampax cardboard applicator tampons, regular absorbency, 54 count (pack of 2)",Health & Beauty > Personal Care > Feminine Care > Tampons
1713,466,Natracare Organic All Cotton Tampons - Super With Applicator,Health & Beauty > Personal Care > Feminine Care > Tampons
1714,466,tampax pearl super tampons with plastic applicator-fresh scent-36 ct,Health & Beauty > Personal Care > Feminine Care > Tampons
1715,466,"tampax cardboard applicator tampons, super plus absorbency, 10 count (pack of 4)",Health & Beauty > Personal Care > Feminine Care > Tampons
1716,466,"tampax pearl plastic fresh scent tampons, super absorbency, 36 count (pack of 2)",Health & Beauty > Personal Care > Feminine Care > Tampons
1717,466,"u by kotex click compact tampons, regular absorbency, unscented, 34 count",Health & Beauty > Personal Care > Feminine Care > Tampons
1718,466,natracare organic super tampons with applicator 16 count,Health & Beauty > Personal Care > Feminine Care > Tampons
1719,466,tampax pearl unscented,Health & Beauty > Personal Care > Feminine Care > Tampons
1720,466,"Veeda Applicator Tampons, Super Plus, 48 Count",Health & Beauty > Personal Care > Feminine Care > Tampons
1721,466,"playtex gentle glide tampons with triple layer protection, super , fresh scent - 36 count (pack of 2)",Health & Beauty > Personal Care > Feminine Care > Tampons
1722,466,"organyc hypoallergenic 100% organic cotton internal tampons with applicator, super, 14-count box",Health & Beauty > Personal Care > Feminine Care > Tampons
1723,466,natracare tampons organic all cotton tampons super plus 20 pack(s),Health & Beauty > Personal Care > Feminine Care > Tampons
1724,466,"u by kotex sleek tampons, super plus absorbency, 18 count (pack of 4)",Health & Beauty > Personal Care > Feminine Care > Tampons
1725,466,"playtex sport unscented regular absorbency tampons, 80 count",Health & Beauty > Personal Care > Feminine Care > Tampons
1726,466,"Natracare, Organic Regular Tampons, 20 ct, 2-Pack (40 Tampons Total)",Health & Beauty > Personal Care > Feminine Care > Tampons
1727,466,"seventh generation tampons, super plus, chlorine free, 20 tampons (pack of 4)",Health & Beauty > Personal Care > Feminine Care > Tampons
1728,466,Playtex Gentle Glide 360 Unscented Ultra Tampons (18 Count) (4 Pack),Health & Beauty > Personal Care > Feminine Care > Tampons
1729,466,super tampons w/applicator organic natracare 16 tampon,Health & Beauty > Personal Care > Feminine Care > Tampons
1730,466,playtex gentle glide 360 unscented plastic tampons 80 ct multi-pack (40 regular + 40 super absorbency) health and beauty,Health & Beauty > Personal Care > Feminine Care > Tampons
1731,466,"Natracare Tampons Super 20 ct, 3 Pack",Health & Beauty > Personal Care > Feminine Care > Tampons
1732,466,"tampax pearl plastic fresh scent tampons, regular absorbency, 36 count health and beauty",Health & Beauty > Personal Care > Feminine Care > Tampons
1733,466,"playtex sport tampons, fresh scent super absorbency, 18 count (pack of 2)",Health & Beauty > Personal Care > Feminine Care > Tampons
1734,466,"playtex gentle glide tampons with triple layer protection, ultra , unscented - 36 count",Health & Beauty > Personal Care > Feminine Care > Tampons
1735,466,"Veeda Applicator Tampons, Lite, 48 Count",Health & Beauty > Personal Care > Feminine Care > Tampons
1736,466,o.b. pro comfort applicator,Health & Beauty > Personal Care > Feminine Care > Tampons
1737,466,"Tampax Pearl Plastic, Super Plus Absorbency, Unscented Tampons, 36 Count (Pack of 2)",Health & Beauty > Personal Care > Feminine Care > Tampons
1738,466,"tampax pearl plastic triple pack, regular/super/super plus absorbency, unscented tampons, 36 count (pack of 2)",Health & Beauty > Personal Care > Feminine Care > Tampons
1739,466,"seventh generation tampons, super plus non-applicator, free & clear organic cotton, 20ct",Health & Beauty > Personal Care > Feminine Care > Tampons
1740,466,"tampax radiant compak plastic unscented tampons, regular absorbency, 36 count",Health & Beauty > Personal Care > Feminine Care > Tampons
1741,466,"Natracare, Organic Regular Tampons, 3 boxes of 20, (60 Tampons Total)",Health & Beauty > Personal Care > Feminine Care > Tampons
1742,466,natural sea tampons by poseidon sponge (large set),Health & Beauty > Personal Care > Feminine Care > Tampons
1743,466,"jade & pearl: sea pearls sea sponge tampon, 2 pieces (reusable)",Health & Beauty > Personal Care > Feminine Care > Tampons
1744,466,"Tampax Pearl Compak Plastic, Triplepack With Light/Regular/Super Absorbencies, Unscented Tampons, 40 Count (Pack",Health & Beauty > Personal Care > Feminine Care > Tampons
1745,466,organic cotton super plus applicator tampons emerita 14 ct box,Health & Beauty > Personal Care > Feminine Care > Tampons
1746,466,Asha Beppy Soft Comfort Tampons with Lubricant Lamination - Pack of 8 by Beppy,Health & Beauty > Personal Care > Feminine Care > Tampons
1747,466,"u by kotex sleek unscented tampons, regular, 18s - 1 ea",Health & Beauty > Personal Care > Feminine Care > Tampons
1748,466,kotex security super absorbency tampons - 18 ea,Health & Beauty > Personal Care > Feminine Care > Tampons
1749,466,walgreens tampons - 20 ea,Health & Beauty > Personal Care > Feminine Care > Tampons
1750,466,"tampax pearl tampons, regular, unscented - 36 ea",Health & Beauty > Personal Care > Feminine Care > Tampons
1751,466,"tampax pearl tampons with pearl plastic applica... pack, super plus/super/reg, 36 ea - 1 box",Health & Beauty > Personal Care > Feminine Care > Tampons
1752,466,"tampax pearl active plastic tampons, unscented, duo pack reg/lite, 36 ea - 1 pack",Health & Beauty > Personal Care > Feminine Care > Tampons
1753,466,"tampax pearl tampons with pearl plastic applicator, fresh scent, super, 18 ea - 1 box",Health & Beauty > Personal Care > Feminine Care > Tampons
1754,466,"playtex sport tampons, unscented multipack, 6 light & 12 regular - 18 each",Health & Beauty > Personal Care > Feminine Care > Tampons
1755,466,"u by kotex click compact tampons, unscented, regular/super - 34 ea",Health & Beauty > Personal Care > Feminine Care > Tampons
1756,466,playtex sport tampons plastic applicator unscented - 36 each,Health & Beauty > Personal Care > Feminine Care > Tampons
1757,466,"tampons, unscented, ultra, 36 ea - 1 pack",Health & Beauty > Personal Care > Feminine Care > Tampons
1758,466,"o.b. pro comfort tampons, super - 40 ea",Health & Beauty > Personal Care > Feminine Care > Tampons
1759,466,"u by kotex click tampons, unscented, regular - 36 ea",Health & Beauty > Personal Care > Feminine Care > Tampons
1760,466,"tampax pearl tampons with pearl plastic applicator, unscented, ultra, 36 ea - 1 pack",Health & Beauty > Personal Care > Feminine Care > Tampons
1761,466,"tampax pearl tampons pocket duo, regular super - 34 ea",Health & Beauty > Personal Care > Feminine Care > Tampons
1762,466,"tampax radiant plastic tampons, triple pack absorbencies , regular super super plus - 32 ea",Health & Beauty > Personal Care > Feminine Care > Tampons
1763,466,"playtex gentle glide tampons, fresh scent, regular - 40 ea",Health & Beauty > Personal Care > Feminine Care > Tampons
1764,466,tampax unscented regular pearl plastic jumbo pack tampons - 54 count,Health & Beauty > Personal Care > Feminine Care > Tampons
1765,466,u by kotex click tampons plastic applicator regular unscented - 18 package,Health & Beauty > Personal Care > Feminine Care > Tampons
1766,466,signature care multipack plastic tampon - 36 count,Health & Beauty > Personal Care > Feminine Care > Tampons
1767,466,"tampax tampax pearl plastic tampons, regular, 54 ct",Health & Beauty > Personal Care > Feminine Care > Tampons
1768,466,"playtex playtex gentle glide tampons multipack, unscented regular...",Health & Beauty > Personal Care > Feminine Care > Tampons
1769,466,"kotex u by kotex security tampons, super plus, 34 ct",Health & Beauty > Personal Care > Feminine Care > Tampons
1770,466,"tampax tampax tampons, super, 54 ct 54",Health & Beauty > Personal Care > Feminine Care > Tampons
1771,466,"tampax tampax pearl plastic tampons, regular, 96 ct",Health & Beauty > Personal Care > Feminine Care > Tampons
1772,466,"tampax tampax pearl plastic triple pack, light/regular/super abs...",Health & Beauty > Personal Care > Feminine Care > Tampons
1773,466,"u by kotex u by kotex tampons click super absorbency, 34 count",Health & Beauty > Personal Care > Feminine Care > Tampons
1774,466,"tampax tampax tampons, super plus, 40 ct",Health & Beauty > Personal Care > Feminine Care > Tampons
1775,466,"tampax tampax pearl active plastic tampons, regular, 18 ct",Health & Beauty > Personal Care > Feminine Care > Tampons
1776,466,"tampax pearl tampons super unscented, 36 ct",Health & Beauty > Personal Care > Feminine Care > Tampons
1777,466,"playtex sport regular & super absorbency multi-pack unscented plastic tampons, 50 count",Health & Beauty > Personal Care > Feminine Care > Tampons
1778,466,"tampax compak radiant plastic, 18 ct",Health & Beauty > Personal Care > Feminine Care > Tampons
1779,466,"tampax pearl plastic super absorbency, unscented tampons, 36 ct",Health & Beauty > Personal Care > Feminine Care > Tampons
1780,466,"playtex gentle glide 360 tampons, plastic, regular absorbency, unscented, 40 tampons",Health & Beauty > Personal Care > Feminine Care > Tampons
1781,466,playtex sport multipack (reg/super) - 50 count,Health & Beauty > Personal Care > Feminine Care > Tampons
1782,466,"u by kotex security tampons, super plus - 34 count box",Health & Beauty > Personal Care > Feminine Care > Tampons
1783,466,kotex natural balance security tampons super -36 count,Health & Beauty > Personal Care > Feminine Care > Tampons
1784,466,tampax compak pearl on the go tampons with plastic applicators,Health & Beauty > Personal Care > Feminine Care > Tampons
1785,466,"playtex sport tampons, unscented multipack 18 regular, 18 super",Health & Beauty > Personal Care > Feminine Care > Tampons
1786,466,"tampax pearl compak triplepack tampons - 40 count (10 lites, 20",Health & Beauty > Personal Care > Feminine Care > Tampons
1787,466,"tampax pearl tampons plastic applicator unscented,super plus",Health & Beauty > Personal Care > Feminine Care > Tampons
1788,466,tampax pearl tampons with pearl plastic applicators unscented,Health & Beauty > Personal Care > Feminine Care > Tampons
1789,466,u by kotex click* regular/super co...,Health & Beauty > Personal Care > Feminine Care > Tampons
1790,466,natracare - organic 100 cotton tampons regular - 20 packs,Health & Beauty > Personal Care > Feminine Care > Tampons
1791,466,- o.b. super plus fluid lock tampons,Health & Beauty > Personal Care > Feminine Care > Tampons
1792,466,"tampax cardboard tampons, super absorbency - 20 count",Health & Beauty > Personal Care > Feminine Care > Tampons
1793,466,"tampax pearl plastic tampons, light absorbency, unscented - 18 count",Health & Beauty > Personal Care > Feminine Care > Tampons
1794,466,"tampax pearl plastic, light absorb...",Health & Beauty > Personal Care > Feminine Care > Tampons
