,category_id,description,category_path
0,470,sony lcsu11 soft compact,Health & Beauty > Personal Care > Oral Hygiene > Manual Toothbrushes
1,470,Smart Care Brush Buddies 4 pk.Toothbrushes,Health & Beauty > Personal Care > Oral Hygiene > Manual Toothbrushes
2,470,colgate toothbrush premier classic clean medium (card of 14) health and beauty,Health & Beauty > Personal Care > Oral Hygiene > Manual Toothbrushes
3,470,"Colgate Enamel Health Sensitive Toothbrush, Extra Soft , 2 ct",Health & Beauty > Personal Care > Oral Hygiene > Manual Toothbrushes
4,470,"readybrush prepasted toothbrushes, fresh mint flavor - bag of 10 toothbrushes new",Health & Beauty > Personal Care > Oral Hygiene > Manual Toothbrushes
5,470,"oral-b 3d white action replacement toothbrush heads, 2 count health and beauty",Health & Beauty > Personal Care > Oral Hygiene > Manual Toothbrushes
6,470,"colgate kids twin pack toothbrush, dora the explorer",Health & Beauty > Personal Care > Oral Hygiene > Manual Toothbrushes
7,470,"oral-b pro-health stages avengers assemble(soft) 5-7 years, twin pack",Health & Beauty > Personal Care > Oral Hygiene > Manual Toothbrushes
8,470,norcho toothbrush toiletry,Health & Beauty > Personal Care > Oral Hygiene > Manual Toothbrushes
9,470,"colgate wisp mini-brush with freshening bead, peppermint, 16-count health and beauty",Health & Beauty > Personal Care > Oral Hygiene > Manual Toothbrushes
10,470,"RADIUS Original Right Hand Toothbrush, Soft Bristles, Assorted Colors (Pack",Health & Beauty > Personal Care > Oral Hygiene > Manual Toothbrushes
11,470,curvex toothbrush,Health & Beauty > Personal Care > Oral Hygiene > Manual Toothbrushes
12,470,10 Toothbrush Standard Classic Medium Soft Individually wrapped,Health & Beauty > Personal Care > Oral Hygiene > Manual Toothbrushes
13,470,platypus ortho toothbrush,Health & Beauty > Personal Care > Oral Hygiene > Manual Toothbrushes
14,470,Aquafresh Kids with Cap Toothbrush (Pack of 6),Health & Beauty > Personal Care > Oral Hygiene > Manual Toothbrushes
15,470,justice league rotary toothbrush,Health & Beauty > Personal Care > Oral Hygiene > Manual Toothbrushes
16,470,Curaprox White Is Black 90ml + Toothbrush Ultra Soft,Health & Beauty > Personal Care > Oral Hygiene > Manual Toothbrushes
17,470,Weinisite Eco-Friendly Adult Soft Bristles Bamboo Toothbrush (Black *3),Health & Beauty > Personal Care > Oral Hygiene > Manual Toothbrushes
18,470,"RADIUS Kidz Right Hand Toothbrush for 6 years +, Very Soft Bristles, Assorted",Health & Beauty > Personal Care > Oral Hygiene > Manual Toothbrushes
19,470,firefly flashing toothbrush batman 1 minute timer,Health & Beauty > Personal Care > Oral Hygiene > Manual Toothbrushes
20,470,preserve soft bristle adult toothbrush -- 6 per case.,Health & Beauty > Personal Care > Oral Hygiene > Manual Toothbrushes
21,470,preserve ultra soft bristle toothbrush -- 6 per case.,Health & Beauty > Personal Care > Oral Hygiene > Manual Toothbrushes
22,470,gum go-betweens proxabrush handle with refills,Health & Beauty > Personal Care > Oral Hygiene > Manual Toothbrushes
23,470,"colgate kids minions toothbrush, 2 count",Health & Beauty > Personal Care > Oral Hygiene > Manual Toothbrushes
24,470,"reach toothbrush, medium, full head #11 - (6 pack)",Health & Beauty > Personal Care > Oral Hygiene > Manual Toothbrushes
25,470,"gum microtip toothbrush - 475 compact, ultra soft 6-count",Health & Beauty > Personal Care > Oral Hygiene > Manual Toothbrushes
26,470,"oral-b pro-health stages disney princess manual kid's toothbrush, pack of 6 (packaging may vary)",Health & Beauty > Personal Care > Oral Hygiene > Manual Toothbrushes
27,470,Firefly Toothbrush Batman Flashing 1 Min Timer (2 Pack),Health & Beauty > Personal Care > Oral Hygiene > Manual Toothbrushes
28,470,"colgate toothbrush, dora the explorer, extra soft, ages 2+, manual toothbrushes, (pack of 6)",Health & Beauty > Personal Care > Oral Hygiene > Manual Toothbrushes
29,470,bamboo toothbrush ?,Health & Beauty > Personal Care > Oral Hygiene > Manual Toothbrushes
30,470,Natural Bristle Toothbrush - Soft 1 toothbrush by C.O. Bigelow,Health & Beauty > Personal Care > Oral Hygiene > Manual Toothbrushes
31,470,mlb atlanta braves toothbrush,Health & Beauty > Personal Care > Oral Hygiene > Manual Toothbrushes
32,470,gum summit plus compact 505 soft toothbrush 3,Health & Beauty > Personal Care > Oral Hygiene > Manual Toothbrushes
33,470,"oral-b 3d white pulsar 35 medium manual toothbrush 1 count, (colors may vary)",Health & Beauty > Personal Care > Oral Hygiene > Manual Toothbrushes
34,470,DiamondWhiteTM Toothbrush Head - 4-Pack - Order Today and Get an Extra Brush,Health & Beauty > Personal Care > Oral Hygiene > Manual Toothbrushes
35,470,Orajel Nickelodeon Bubble Guppies Soft Children Toothbrush (6pack),Health & Beauty > Personal Care > Oral Hygiene > Manual Toothbrushes
36,470,preserve: adult ultra soft toothbrush individual mailer (6 pack),Health & Beauty > Personal Care > Oral Hygiene > Manual Toothbrushes
37,470,one sofresh flossing toothbrush soft full size assorted colors new,Health & Beauty > Personal Care > Oral Hygiene > Manual Toothbrushes
38,470,"Colgate Max Fresh Toothbrush Twin Pack, Full Head Medium",Health & Beauty > Personal Care > Oral Hygiene > Manual Toothbrushes
39,470,mlb los angeles angels toothbrush,Health & Beauty > Personal Care > Oral Hygiene > Manual Toothbrushes
40,470,colgate extra clean,Health & Beauty > Personal Care > Oral Hygiene > Manual Toothbrushes
41,470,preserve adult soft toothbrush with mailer assorted colors,Health & Beauty > Personal Care > Oral Hygiene > Manual Toothbrushes
42,470,fete from earth to earth natural bamboo toothbrush family pack with different coloured naturally biodegradable handles 4 ct our toothbrushes are made from natural bamboo which is beneficial for the environment and for you bamboo is the fastest naturally r,Health & Beauty > Personal Care > Oral Hygiene > Manual Toothbrushes
43,470,"Colgate 360 Degree Adult Full Head Toothbrush, Medium, 4 Count",Health & Beauty > Personal Care > Oral Hygiene > Manual Toothbrushes
44,470,Marvel Iron Man Toothbrush - Kids Musical Toothbrush in Blue,Health & Beauty > Personal Care > Oral Hygiene > Manual Toothbrushes
45,470,Dr. Fresh Kids Firefly Lightup Timer Toothbrush - 2 Ea,Health & Beauty > Personal Care > Oral Hygiene > Manual Toothbrushes
46,470,colgate kids minions toothbrush,Health & Beauty > Personal Care > Oral Hygiene > Manual Toothbrushes
47,470,propaganda toothbrush,Health & Beauty > Personal Care > Oral Hygiene > Manual Toothbrushes
48,470,radius source soft travel pack (toothbrush w/ case),Health & Beauty > Personal Care > Oral Hygiene > Manual Toothbrushes
49,470,"preserve toothbrushes, ultra soft bristles, 6-count",Health & Beauty > Personal Care > Oral Hygiene > Manual Toothbrushes
50,470,colgate my first toothbrush ages 02 extra soft 7 pack of 4 color pink,Health & Beauty > Personal Care > Oral Hygiene > Manual Toothbrushes
51,470,Travel Folding Soft Toothbrush (2 Pack),Health & Beauty > Personal Care > Oral Hygiene > Manual Toothbrushes
52,470,GUM Technique Deep Clean Toothbrush - 525 Soft Compact (Pack Of 12) colors vary,Health & Beauty > Personal Care > Oral Hygiene > Manual Toothbrushes
53,470,"preserve toothbrushes with travel case, soft bristles, (pack of 6)",Health & Beauty > Personal Care > Oral Hygiene > Manual Toothbrushes
54,470,"TONGUE SCRAPER 2 Effective Sweepers Made From Anti-Bacterial, BPA-Free â»Plastic. Quality Cleaner Gives Fresh Breath And Better Taste. 2 Different Functions, Compact Toothbrush For Traveling. Best Oral Care For Halitosis 100% Satisfaction Guaranteed!",Health & Beauty > Personal Care > Oral Hygiene > Manual Toothbrushes
55,470,home toothbrush travel oral,Health & Beauty > Personal Care > Oral Hygiene > Manual Toothbrushes
56,470,Oral-B 3D White Vivid 35 Medium Manual Toothbrush (Pack of 6),Health & Beauty > Personal Care > Oral Hygiene > Manual Toothbrushes
57,470,"oral-b pro-health jr. crossaction disney frozen manual kids toothbrush with free disney magic timer app by oral-b 1 count, colors may vary",Health & Beauty > Personal Care > Oral Hygiene > Manual Toothbrushes
58,470,firefly hello kitty readygo soft toothbrush with suction cup,Health & Beauty > Personal Care > Oral Hygiene > Manual Toothbrushes
59,470,Preserve Adult Ultra Soft Toothbrush with Mailer Assorted Colors,Health & Beauty > Personal Care > Oral Hygiene > Manual Toothbrushes
60,470,interdesign lora toothbrush,Health & Beauty > Personal Care > Oral Hygiene > Manual Toothbrushes
61,470,Bamboo Toothbrushes by ModestPlanet | 4-Pack | BPA-Free| Medium Bristles| Sustainable Material| Ergonomic & Easy Grip Design| Natural Alternative to Plastic| Supports Clean Teeth & Gums| Fights against Cavities,Health & Beauty > Personal Care > Oral Hygiene > Manual Toothbrushes
62,470,Woo Bamboo STANDARD Toothbrush With SUPER SOFT Bristles - Family FOUR PACK,Health & Beauty > Personal Care > Oral Hygiene > Manual Toothbrushes
63,470,"Earth's Daughter Biodegradable, Eco-Friendly, Natural Bamboo Kids' Toothbrushes With BPA-Free Ultrasoft Nylon Bristles - 4 Pack",Health & Beauty > Personal Care > Oral Hygiene > Manual Toothbrushes
64,470,"mam first toothbrush, girl",Health & Beauty > Personal Care > Oral Hygiene > Manual Toothbrushes
65,470,"oral-b pro-health stages monsters, inc. manual kid's toothbrush 1 count (pack of 6)",Health & Beauty > Personal Care > Oral Hygiene > Manual Toothbrushes
66,470,nfl detroit lions toothbrush,Health & Beauty > Personal Care > Oral Hygiene > Manual Toothbrushes
67,470,"Oral-B Pro-Health Clinical Pro-Flex Toothbrush with Flexing Sides, 40S - Soft, 2 Count",Health & Beauty > Personal Care > Oral Hygiene > Manual Toothbrushes
68,470,GUM 527 Technique Deep Clean Toothbrush -Ultra Soft Compact (6 Pack),Health & Beauty > Personal Care > Oral Hygiene > Manual Toothbrushes
69,470,"oral-b pro-health all-in-one 40 medium toothbrush twin pack, assorted colors, 2 count",Health & Beauty > Personal Care > Oral Hygiene > Manual Toothbrushes
70,470,"Oral-B Pro-Health Advanced Toothbrush, 2 Count Soft",Health & Beauty > Personal Care > Oral Hygiene > Manual Toothbrushes
71,470,"colgate max fresh full head toothbrush, medium",Health & Beauty > Personal Care > Oral Hygiene > Manual Toothbrushes
72,470,finding nemo zoothbrush manual toothbrush 1 count by zoothbrush new,Health & Beauty > Personal Care > Oral Hygiene > Manual Toothbrushes
73,470,"o'nano toothbrush, dual pack",Health & Beauty > Personal Care > Oral Hygiene > Manual Toothbrushes
74,470,"RADIUS Source Recycled Handle Toothbrush, Super Soft Bristles, Assorted Colors",Health & Beauty > Personal Care > Oral Hygiene > Manual Toothbrushes
75,470,"gum microtip toothbrush - 475 compact, ultra soft (3 pack)",Health & Beauty > Personal Care > Oral Hygiene > Manual Toothbrushes
76,470,Dr. Collins Perio Toothbrush with Supersoft Bristles Colors May Vary (Pack of 6),Health & Beauty > Personal Care > Oral Hygiene > Manual Toothbrushes
77,470,Refillable Soft Brush,Health & Beauty > Personal Care > Oral Hygiene > Manual Toothbrushes
78,470,bamboo toothbrush (3 pack,Health & Beauty > Personal Care > Oral Hygiene > Manual Toothbrushes
79,470,"colgate wisp coolmint, 32 brushes new",Health & Beauty > Personal Care > Oral Hygiene > Manual Toothbrushes
80,470,"Earth's Daughter Biodegradable, Eco-Friendly, Natural Bamboo Kids' Toothbrushes",Health & Beauty > Personal Care > Oral Hygiene > Manual Toothbrushes
81,470,american comb - toothbrush,Health & Beauty > Personal Care > Oral Hygiene > Manual Toothbrushes
82,470,gum t-bru technique dp/cln 2pk - full/sft,Health & Beauty > Personal Care > Oral Hygiene > Manual Toothbrushes
83,470,"Oral-B Pro-Health Advanced Toothbrush, 2 ct Medium",Health & Beauty > Personal Care > Oral Hygiene > Manual Toothbrushes
84,470,GUM 505 Summit+Toothbrush - Soft (6 Pack),Health & Beauty > Personal Care > Oral Hygiene > Manual Toothbrushes
85,470,brush with bamboo ecological bamboo toothbrush 12 pack new,Health & Beauty > Personal Care > Oral Hygiene > Manual Toothbrushes
86,470,NCAA Tennessee Volunteers Toothbrush,Health & Beauty > Personal Care > Oral Hygiene > Manual Toothbrushes
87,470,dazzlepro daz-7042 doodles edition kids rotary toothbrush,Health & Beauty > Personal Care > Oral Hygiene > Manual Toothbrushes
88,470,"preserve toothbrushes, soft bristles (pack of 6)",Health & Beauty > Personal Care > Oral Hygiene > Manual Toothbrushes
89,470,dr. fresh firefly marvel heroes toothbrush 4 count,Health & Beauty > Personal Care > Oral Hygiene > Manual Toothbrushes
90,470,flipper dino egg toothbrush,Health & Beauty > Personal Care > Oral Hygiene > Manual Toothbrushes
91,470,GUM Scene-Sations Toothbrush (6 Pack),Health & Beauty > Personal Care > Oral Hygiene > Manual Toothbrushes
92,470,"Colgate 360 Degree Surround Adult Full Head, Soft Manual Toothbrush, 2 Count(colors may vary)",Health & Beauty > Personal Care > Oral Hygiene > Manual Toothbrushes
93,470,"Morihata Toothbrushes, Set of 2, Black and White",Health & Beauty > Personal Care > Oral Hygiene > Manual Toothbrushes
94,470,miradent - happy morning xylitol disposable toothbrushes - 50 pack(s),Health & Beauty > Personal Care > Oral Hygiene > Manual Toothbrushes
95,470,dr. collins prepasted,Health & Beauty > Personal Care > Oral Hygiene > Manual Toothbrushes
96,470,accmart plastic toothbrush,Health & Beauty > Personal Care > Oral Hygiene > Manual Toothbrushes
97,470,"colgate wave comfort fit toothbrush, firm full head #99 (pack of 6)",Health & Beauty > Personal Care > Oral Hygiene > Manual Toothbrushes
98,470,travel toothbrush caps by,Health & Beauty > Personal Care > Oral Hygiene > Manual Toothbrushes
99,470,"colgate extra clean toothbrush, full head firm",Health & Beauty > Personal Care > Oral Hygiene > Manual Toothbrushes
100,470,"Colgate Toothbrush Double Action, Medium (Pack of 12)",Health & Beauty > Personal Care > Oral Hygiene > Manual Toothbrushes
101,470,Oral-B Pulsar Medium Toothbrush 1 Count,Health & Beauty > Personal Care > Oral Hygiene > Manual Toothbrushes
102,470,smileguard marvel heroes toothbrush 1 pack(4 brushes per pack),Health & Beauty > Personal Care > Oral Hygiene > Manual Toothbrushes
103,470,curaprox 5460 ultra soft toothbrush trio pack,Health & Beauty > Personal Care > Oral Hygiene > Manual Toothbrushes
104,470,STONG Family Size SG-103 Zero Germ UV Light 3-5 Minute Sanitizing timer Toothbrush,Health & Beauty > Personal Care > Oral Hygiene > Manual Toothbrushes
105,470,charm it! toothbrush set charm,Health & Beauty > Personal Care > Oral Hygiene > Manual Toothbrushes
106,470,special pack of 5 butler,Health & Beauty > Personal Care > Oral Hygiene > Manual Toothbrushes
107,470,"oral-b specialty toothbrush, interdental tapered compact 2 count",Health & Beauty > Personal Care > Oral Hygiene > Manual Toothbrushes
108,470,"oral-b specialty toothbrush, sulcus soft (pack of 6)",Health & Beauty > Personal Care > Oral Hygiene > Manual Toothbrushes
109,470,bamboo toothbrush 3 pack - made with bamboo charcoal infused bristles - sustainably grown in recycled biodegradable packaging,Health & Beauty > Personal Care > Oral Hygiene > Manual Toothbrushes
110,470,gum toothbrush #471 micro tip,Health & Beauty > Personal Care > Oral Hygiene > Manual Toothbrushes
111,470,PIAVE SILVER CARE (4336) PLUS Soft Toothbrush- Made in ITALY,Health & Beauty > Personal Care > Oral Hygiene > Manual Toothbrushes
112,470,2x oral-b pulsar 3d white advanced vivid soft toothbrush twin pack (colors may vary),Health & Beauty > Personal Care > Oral Hygiene > Manual Toothbrushes
113,470,special pack of 6 butler end tuft brush 308-r,Health & Beauty > Personal Care > Oral Hygiene > Manual Toothbrushes
114,470,"Dr. Fresh Marvel Heroes Standing Toothbrush, 4 Pack",Health & Beauty > Personal Care > Oral Hygiene > Manual Toothbrushes
115,470,"Colgate Slim Soft Charcoal Toothbrush Soft & Fine Bristles 0.01mm, Pack of 3",Health & Beauty > Personal Care > Oral Hygiene > Manual Toothbrushes
116,470,colgate wisp optic white coolmint minibrushes 8 pack 192 total brushes,Health & Beauty > Personal Care > Oral Hygiene > Manual Toothbrushes
117,470,"This Manual Toothbrush for Kids Sings ""Old MacDonald' Tune & Teaches Children Healthy Oral Hygene-Assorted",Health & Beauty > Personal Care > Oral Hygiene > Manual Toothbrushes
118,470,mouth watchers nano silver toothbrush - adult cramberry-red,Health & Beauty > Personal Care > Oral Hygiene > Manual Toothbrushes
119,470,curaprox ultrasoft toothbrush cs 5460  2 pack,Health & Beauty > Personal Care > Oral Hygiene > Manual Toothbrushes
120,470,"radius original right hand toothbrush, soft bristles, assorted colors 3-count health and beauty",Health & Beauty > Personal Care > Oral Hygiene > Manual Toothbrushes
121,470,"zoothbrush manual toothbrush, finding nemo, (pack of 3)",Health & Beauty > Personal Care > Oral Hygiene > Manual Toothbrushes
122,470,"colgate 360 compact head toothbrush, soft",Health & Beauty > Personal Care > Oral Hygiene > Manual Toothbrushes
123,470,colgate wisp mini brush 24,Health & Beauty > Personal Care > Oral Hygiene > Manual Toothbrushes
124,470,"oral-b 3d white pulsar 35 soft manual toothbrush twin pack, 2 count",Health & Beauty > Personal Care > Oral Hygiene > Manual Toothbrushes
125,470,toothbrushes lot 100 wholesale standard classic medium soft toothbrush,Health & Beauty > Personal Care > Oral Hygiene > Manual Toothbrushes
126,470,"nimbus® microfine® toothbrush regular size, pack of 5 ""colors vary""",Health & Beauty > Personal Care > Oral Hygiene > Manual Toothbrushes
127,470,oral-b pro-health pulsar toothbrushes medium - 4 ea,Health & Beauty > Personal Care > Oral Hygiene > Manual Toothbrushes
128,470,"colgate maxwhite toothbrush, full head medium 4 pack - 1 ea",Health & Beauty > Personal Care > Oral Hygiene > Manual Toothbrushes
129,470,oral-b pro-health soft bristles large head toothbrush - 1 ea,Health & Beauty > Personal Care > Oral Hygiene > Manual Toothbrushes
130,470,"oral-b advantage deep clean toothbrush twin pack, 40 soft/regular - 2 ea",Health & Beauty > Personal Care > Oral Hygiene > Manual Toothbrushes
131,470,"colgate extra clean toothbrush, soft full head ...",Health & Beauty > Personal Care > Oral Hygiene > Manual Toothbrushes
132,470,firefly kids! barbie light-up timer toothbrush - 1 each,Health & Beauty > Personal Care > Oral Hygiene > Manual Toothbrushes
133,470,"oral-b 3d white radiant whitening toothbrush 40, medium - 2 ea",Health & Beauty > Personal Care > Oral Hygiene > Manual Toothbrushes
134,470,"oral-b advantage deep clean toothbrush, 60 medium/large - 1 ea",Health & Beauty > Personal Care > Oral Hygiene > Manual Toothbrushes
135,470,"colgate kids spongebob squarepants toothbrush with suction cup, extra soft - 1 ea",Health & Beauty > Personal Care > Oral Hygiene > Manual Toothbrushes
136,470,"oral-b advantage 3d white toothbrush, small/medium - 1 ea",Health & Beauty > Personal Care > Oral Hygiene > Manual Toothbrushes
137,470,"oral-b stages kids manual toothbrush, disney - 1 ea",Health & Beauty > Personal Care > Oral Hygiene > Manual Toothbrushes
138,470,firefly kids! marvel heroes suction cup toothbrushes - 4 ea,Health & Beauty > Personal Care > Oral Hygiene > Manual Toothbrushes
139,470,"colgate wave zig zag toothbrush, medium - 2 ea",Health & Beauty > Personal Care > Oral Hygiene > Manual Toothbrushes
140,470,oral-b 3d white vivid 40 soft bristle manual toothbrush with tongue cleaner - 4 count,Health & Beauty > Personal Care > Oral Hygiene > Manual Toothbrushes
141,470,colgate 360 optic white toothbrush 1ct,Health & Beauty > Personal Care > Oral Hygiene > Manual Toothbrushes
142,470,reach ultra clean soft toothbrush - 1 ct,Health & Beauty > Personal Care > Oral Hygiene > Manual Toothbrushes
143,470,oral-b complete 5 way clean 40 soft manual toothbrush 1 count,Health & Beauty > Personal Care > Oral Hygiene > Manual Toothbrushes
144,470,oral-b pro-health clinical pro-flex medium toothbrush 1 count,Health & Beauty > Personal Care > Oral Hygiene > Manual Toothbrushes
145,470,oral-b glide tip with special deep clean bristles toothbrush 1 count,Health & Beauty > Personal Care > Oral Hygiene > Manual Toothbrushes
146,470,brush buddies singing lmfao manual toothbrush,Health & Beauty > Personal Care > Oral Hygiene > Manual Toothbrushes
147,470,oral-b 3d white vivid 40 soft manual toothbrush with tongue cleaner uspr 4 count - colors may vary,Health & Beauty > Personal Care > Oral Hygiene > Manual Toothbrushes
148,470,"colgate extra clean toothbrush medium, 4ct",Health & Beauty > Personal Care > Oral Hygiene > Manual Toothbrushes
149,470,reach® star wars kids toothbrush with suction cup - soft 2 ct,Health & Beauty > Personal Care > Oral Hygiene > Manual Toothbrushes
150,470,oral-b 3d white radiant whitening 40 soft bristle manual toothbrush - 1 count,Health & Beauty > Personal Care > Oral Hygiene > Manual Toothbrushes
151,470,arm & hammer truly radiant extra white soft toothbrush,Health & Beauty > Personal Care > Oral Hygiene > Manual Toothbrushes
152,470,oral-b pro-health glide tip soft toothbrush,Health & Beauty > Personal Care > Oral Hygiene > Manual Toothbrushes
153,470,"oral-b pro-health clinical pro-flex medium toothbrushes, 2-pack",Health & Beauty > Personal Care > Oral Hygiene > Manual Toothbrushes
154,470,oral-b pro-health clinical pro-flex soft too...,Health & Beauty > Personal Care > Oral Hygiene > Manual Toothbrushes
155,470,"colgate wave zigzag toothbrush, soft, 2 count",Health & Beauty > Personal Care > Oral Hygiene > Manual Toothbrushes
156,470,"oral-b pro-health soft toothbrush, 4 count",Health & Beauty > Personal Care > Oral Hygiene > Manual Toothbrushes
157,470,"gum travel toothbrush foldable, 2 ea (pack of 2)",Health & Beauty > Personal Care > Oral Hygiene > Manual Toothbrushes
158,470,sensodyne complete protection soft toothbrush,Health & Beauty > Personal Care > Oral Hygiene > Manual Toothbrushes
159,470,"colgate my first ages soft toothbrushes, 2 count",Health & Beauty > Personal Care > Oral Hygiene > Manual Toothbrushes
160,470,oral-b professional care precision clean toothbrush heads 3.0 ea,Health & Beauty > Personal Care > Oral Hygiene > Manual Toothbrushes
161,470,complete advantage deep clean toothbrush 35 soft/compact oral-b advantage,Health & Beauty > Personal Care > Oral Hygiene > Manual Toothbrushes
162,470,"clean+ toothbrush full, medium walgreens 1.0 ea",Health & Beauty > Personal Care > Oral Hygiene > Manual Toothbrushes
163,470,folding toothbrush soft colgate travel 1.0 ea,Health & Beauty > Personal Care > Oral Hygiene > Manual Toothbrushes
164,470,colgate kids minions toothbrush 2.0 ea,Health & Beauty > Personal Care > Oral Hygiene > Manual Toothbrushes
165,470,brushbuddies lady gaga singing toothbrush (bad romance & born this way) 1.0 ea,Health & Beauty > Personal Care > Oral Hygiene > Manual Toothbrushes
166,470,"oral-b glide tip with special deep clean bristles toothbrush, value pack",Health & Beauty > Personal Care > Oral Hygiene > Manual Toothbrushes
167,470,"3d white pro-flex toothbrush soft, full head oral-b",Health & Beauty > Personal Care > Oral Hygiene > Manual Toothbrushes
168,470,"3d white vivid toothbrush, twin pack oral-b advantage",Health & Beauty > Personal Care > Oral Hygiene > Manual Toothbrushes
169,470,tom's of maine children's dye-free toothbrush 1.0 ea,Health & Beauty > Personal Care > Oral Hygiene > Manual Toothbrushes
170,470,batman flashing sculpted toothbrush firefly kids! 1.0 ea,Health & Beauty > Personal Care > Oral Hygiene > Manual Toothbrushes
171,470,"colgate kids toothbrush, spongebob squarepants extra soft 2.0 ea",Health & Beauty > Personal Care > Oral Hygiene > Manual Toothbrushes
172,470,walgreens honeycomb toothbrushes full/soft 2.0 ea,Health & Beauty > Personal Care > Oral Hygiene > Manual Toothbrushes
173,470,dr. collins ecobrush toothbrushes 6.0 ea,Health & Beauty > Personal Care > Oral Hygiene > Manual Toothbrushes
174,470,colgate optic white toothbrush + whitening pen medium 1.0 ea,Health & Beauty > Personal Care > Oral Hygiene > Manual Toothbrushes
175,470,oral-b vitality flossaction toothbrush multi/none no size,Health & Beauty > Personal Care > Oral Hygiene > Manual Toothbrushes
176,470,toothbrush hld natural,Health & Beauty > Personal Care > Oral Hygiene > Manual Toothbrushes
177,470,"oral-b pro-health cross action advanced toothbrush 8-pack, soft",Health & Beauty > Personal Care > Oral Hygiene > Manual Toothbrushes
178,470,oral-b pro-health crisscross medium toothbrush 8-pk,Health & Beauty > Personal Care > Oral Hygiene > Manual Toothbrushes
179,470,oral-b pro-health cross action advanced toothbrush,Health & Beauty > Personal Care > Oral Hygiene > Manual Toothbrushes
180,470,crystal care toothbrush -,Health & Beauty > Personal Care > Oral Hygiene > Manual Toothbrushes
181,470,sensodyne pronamel extra-soft toothbrush,Health & Beauty > Personal Care > Oral Hygiene > Manual Toothbrushes
182,470,colgate optic white colgate optic white toothbrush + whitening gwp,Health & Beauty > Personal Care > Oral Hygiene > Manual Toothbrushes
183,470,"colgate wisp portable mini brush, peppermint - 4 ct - 3 pk",Health & Beauty > Personal Care > Oral Hygiene > Manual Toothbrushes
184,470,"colgate extra clean toothbrush, soft full head, 3 pack",Health & Beauty > Personal Care > Oral Hygiene > Manual Toothbrushes
185,470,oral b glide toothbrush with special deep clean bristles - 2 ct,Health & Beauty > Personal Care > Oral Hygiene > Manual Toothbrushes
186,470,brush buddies manual toothbrush - smurfs - 4 pk,Health & Beauty > Personal Care > Oral Hygiene > Manual Toothbrushes
187,470,crest zooth manual toothbrush - hello kitty - 2 pk,Health & Beauty > Personal Care > Oral Hygiene > Manual Toothbrushes
188,470,"oral b advantage toothbrush, medium - 2 ct",Health & Beauty > Personal Care > Oral Hygiene > Manual Toothbrushes
189,470,"oral b indicator contour clean toothbrush, soft - 4 ct",Health & Beauty > Personal Care > Oral Hygiene > Manual Toothbrushes
