,category_id,description,category_path
1158,470,"oral-b advantage plus complete deep clean toothbrush, small head, soft bristles - 1 ea",Health & Beauty > Personal Care > Oral Hygiene > Manual Toothbrushes
1159,470,"mentadent white & clean, toothbrush, medium full head - 1 ea",Health & Beauty > Personal Care > Oral Hygiene > Manual Toothbrushes
1160,470,colgate 360 total floss tip manual toothbrush 4 ct,Health & Beauty > Personal Care > Oral Hygiene > Manual Toothbrushes
1161,470,hello toothbrush green 1 count,Health & Beauty > Personal Care > Oral Hygiene > Manual Toothbrushes
1162,470,firefly marvel heroes kids toothbrushes - 3 pack,Health & Beauty > Personal Care > Oral Hygiene > Manual Toothbrushes
1163,470,justin bieber singing toothbrush (boyfriend) - colors may vary,Health & Beauty > Personal Care > Oral Hygiene > Manual Toothbrushes
1164,470,colgate kids my first colgate toothbrush 2ct - colors may vary,Health & Beauty > Personal Care > Oral Hygiene > Manual Toothbrushes
1165,470,colgate wisp max fresh peppermint 24ct,Health & Beauty > Personal Care > Oral Hygiene > Manual Toothbrushes
1166,470,youth soft toothbrushes 4 pk,Health & Beauty > Personal Care > Oral Hygiene > Manual Toothbrushes
1167,470,oral-b complete deep clean soft bristle manual toothbrush - 4 count,Health & Beauty > Personal Care > Oral Hygiene > Manual Toothbrushes
1168,470,kid's crest sesame street soft toothbrush,Health & Beauty > Personal Care > Oral Hygiene > Manual Toothbrushes
1169,470,"colgate extra clean toothbrush, soft, 6 count",Health & Beauty > Personal Care > Oral Hygiene > Manual Toothbrushes
1170,470,"oral-b complete fresh scope scented medium bristle toothbrush, 2 count",Health & Beauty > Personal Care > Oral Hygiene > Manual Toothbrushes
1171,470,equate angle edge deep clean soft regular toothbrushes 2 count,Health & Beauty > Personal Care > Oral Hygiene > Manual Toothbrushes
1172,470,"colgate 360° optic white platinum toothbrush, soft",Health & Beauty > Personal Care > Oral Hygiene > Manual Toothbrushes
1173,470,"dentek slim brush interdental cleaner, 32ct",Health & Beauty > Personal Care > Oral Hygiene > Manual Toothbrushes
1174,470,gum travel toothbrush 1 ea,Health & Beauty > Personal Care > Oral Hygiene > Manual Toothbrushes
1175,470,"colgate 360 optic white soft toothbrush, 1ct",Health & Beauty > Personal Care > Oral Hygiene > Manual Toothbrushes
1176,470,"gum super tip soft toothbrush, 4 count",Health & Beauty > Personal Care > Oral Hygiene > Manual Toothbrushes
1177,470,8 pack colgate premier classic clean deep dental cleanse manual toothbrush,Health & Beauty > Personal Care > Oral Hygiene > Manual Toothbrushes
1178,470,"colgate 360° optic white platinum toothbrush, medium",Health & Beauty > Personal Care > Oral Hygiene > Manual Toothbrushes
1179,470,gum crayola brand soft 227 wcolorful bristles toothbrushes 2 pk,Health & Beauty > Personal Care > Oral Hygiene > Manual Toothbrushes
1180,470,"arm & hammer spinbrush truly radiant deep clean manual toothbrush, medium 9"" x 1.68"" x 0.76""",Health & Beauty > Personal Care > Oral Hygiene > Manual Toothbrushes
1181,470,oralb prohealth clinical proflex soft toothbrushes 2ct,Health & Beauty > Personal Care > Oral Hygiene > Manual Toothbrushes
1182,470,colgate 360 optic white full head medium toothbrush,Health & Beauty > Personal Care > Oral Hygiene > Manual Toothbrushes
1183,470,colgate 360 optic white full head soft toothbrush,Health & Beauty > Personal Care > Oral Hygiene > Manual Toothbrushes
1184,470,12 pack reach crystal clean deep dental cleanse bilevel soft bristle toothbrush,Health & Beauty > Personal Care > Oral Hygiene > Manual Toothbrushes
1185,470,brushpoint scoobydoo manual toothbrush 2 count,Health & Beauty > Personal Care > Oral Hygiene > Manual Toothbrushes
1186,470,colgate travel voyage soft toothbrush,Health & Beauty > Personal Care > Oral Hygiene > Manual Toothbrushes
1187,470,nuk grins & giggles toddler toothbrush and cleanser set - purple one color,Health & Beauty > Personal Care > Oral Hygiene > Manual Toothbrushes
1188,470,dr. fresh firefly flashing toothbrush 2-pack one color,Health & Beauty > Personal Care > Oral Hygiene > Manual Toothbrushes
1189,470,walgreens folding travel toothbrush 1.0 ea,Health & Beauty > Personal Care > Oral Hygiene > Manual Toothbrushes
1190,470,g-u-m technique deep clean toothbrushes regular head 2.0 ea,Health & Beauty > Personal Care > Oral Hygiene > Manual Toothbrushes
1191,470,lightup timer toothbrush firefly kids! 1.0 ea,Health & Beauty > Personal Care > Oral Hygiene > Manual Toothbrushes
1192,470,oral-b pro-health clinical pro-flex soft toothbrush 1.0 ea,Health & Beauty > Personal Care > Oral Hygiene > Manual Toothbrushes
1193,470,deep clean toothbrush twin pack 40 medium/regular oral-b advantage,Health & Beauty > Personal Care > Oral Hygiene > Manual Toothbrushes
1194,470,oral-b stages kids manual toothbrush disney,Health & Beauty > Personal Care > Oral Hygiene > Manual Toothbrushes
1195,470,indicator contour clean toothbrushes oral-b 4.0 ea,Health & Beauty > Personal Care > Oral Hygiene > Manual Toothbrushes
1196,470,supersmile large whitening system with rinse & toothbrushes /original,Health & Beauty > Personal Care > Oral Hygiene > Manual Toothbrushes
1197,470,sunstar gum® crayola® pip-squeaks 2-pack toothbrushes,Health & Beauty > Personal Care > Oral Hygiene > Manual Toothbrushes
1198,470,"colgate wave toothbrush, compact head, soft - 3 pk",Health & Beauty > Personal Care > Oral Hygiene > Manual Toothbrushes
1199,470,"colgate extra clean toothbrush, full head, soft - 2 pk",Health & Beauty > Personal Care > Oral Hygiene > Manual Toothbrushes
1200,470,brush buddies kid's toothbrush - girl,Health & Beauty > Personal Care > Oral Hygiene > Manual Toothbrushes
1201,470,"colgate 360 colgate 360 full head toothbrush, medium",Health & Beauty > Personal Care > Oral Hygiene > Manual Toothbrushes
1202,470,"radius totz toothbrush 18 months and up, extra soft bristles, assorted colors, 3 count quantity: 2",Health & Beauty > Personal Care > Oral Hygiene > Manual Toothbrushes
1203,470,ikea new dragan toothbrush,Health & Beauty > Personal Care > Oral Hygiene > Manual Toothbrushes
1204,470,silver toothbrush with blue,Health & Beauty > Personal Care > Oral Hygiene > Manual Toothbrushes
1205,470,"colgate kids twin pack toothbrush, transformers",Health & Beauty > Personal Care > Oral Hygiene > Manual Toothbrushes
1206,470,gum summit # 509 tooth,Health & Beauty > Personal Care > Oral Hygiene > Manual Toothbrushes
1207,470,360-degree toothbrush 360do,Health & Beauty > Personal Care > Oral Hygiene > Manual Toothbrushes
1208,470,gum ortho travel,Health & Beauty > Personal Care > Oral Hygiene > Manual Toothbrushes
1209,470,toothbrush refill kid terradent 3 ea brush,Health & Beauty > Personal Care > Oral Hygiene > Manual Toothbrushes
1210,470,gum proxabrush go-betweens cleaners - 8 ct,Health & Beauty > Personal Care > Oral Hygiene > Manual Toothbrushes
1211,470,1000 toothbrushes wholesale,Health & Beauty > Personal Care > Oral Hygiene > Manual Toothbrushes
1212,470,set of 4 toothbrush,Health & Beauty > Personal Care > Oral Hygiene > Manual Toothbrushes
1213,470,brush buddies 0032924 lady gaga singing toothbrush,Health & Beauty > Personal Care > Oral Hygiene > Manual Toothbrushes
1214,470,soladey-3 ionic solar toothbrush! one of the most effective ways to remove plaque! red,Health & Beauty > Personal Care > Oral Hygiene > Manual Toothbrushes
1215,470,swissco tooth brush,Health & Beauty > Personal Care > Oral Hygiene > Manual Toothbrushes
1216,470,"radius original left hand toothbrush, soft bristles, assorted colors (3 pack)",Health & Beauty > Personal Care > Oral Hygiene > Manual Toothbrushes
1217,470,bamboo toothbrush (eco-friendly toothbrush with ultra soft bristles in biodegradable packaging) by bmbu /bam'boo/,Health & Beauty > Personal Care > Oral Hygiene > Manual Toothbrushes
1218,470,"aim germ evader toothbrush (soft) 2-2packs, 4 brushes",Health & Beauty > Personal Care > Oral Hygiene > Manual Toothbrushes
1219,470,oralb 3d white vivid 35 soft manual toothbrushpack of 6,Health & Beauty > Personal Care > Oral Hygiene > Manual Toothbrushes
1220,470,mlb boston red sox toothbrush,Health & Beauty > Personal Care > Oral Hygiene > Manual Toothbrushes
1221,470,ready brush prepasted disposable toothbrush 10 count,Health & Beauty > Personal Care > Oral Hygiene > Manual Toothbrushes
1222,470,itouchless uv toothbrush,Health & Beauty > Personal Care > Oral Hygiene > Manual Toothbrushes
1223,470,Snoopie Firefly Kid's Soft Toothbrushes (4 Count),Health & Beauty > Personal Care > Oral Hygiene > Manual Toothbrushes
1224,470,tortoise medium nylon bristle toothbrush toothbrush by bass brushes,Health & Beauty > Personal Care > Oral Hygiene > Manual Toothbrushes
1225,470,Curaprox Black Is White 90ml + Toothbrush Ultra Soft,Health & Beauty > Personal Care > Oral Hygiene > Manual Toothbrushes
1226,470,gum technique deep clean toothbrush - 525 soft compact (pack of 3),Health & Beauty > Personal Care > Oral Hygiene > Manual Toothbrushes
1227,470,toothbrush caps,Health & Beauty > Personal Care > Oral Hygiene > Manual Toothbrushes
1228,470,"tooth tunes taio cruz ""dynamite"" singing toothbrush",Health & Beauty > Personal Care > Oral Hygiene > Manual Toothbrushes
1229,470,VIOLIGHT Violife Rockee Toothbrush - Brrradley (VRT158WH),Health & Beauty > Personal Care > Oral Hygiene > Manual Toothbrushes
1230,470,"Mouth Watchers Antimicrobial Toothbrush with Flossing Bristles, Youth Pink",Health & Beauty > Personal Care > Oral Hygiene > Manual Toothbrushes
1231,470,GUM 509 Summit+Toothbrush Sensitive Bristles (3 Pack),Health & Beauty > Personal Care > Oral Hygiene > Manual Toothbrushes
1232,470,gum technique sensitive care full head 516 3,Health & Beauty > Personal Care > Oral Hygiene > Manual Toothbrushes
1233,470,"tooth tunes big time rush ""if i ruled the world"" singing toothbrush",Health & Beauty > Personal Care > Oral Hygiene > Manual Toothbrushes
1234,470,nhl boston bruins team toothbrush,Health & Beauty > Personal Care > Oral Hygiene > Manual Toothbrushes
1235,470,3 pack:: dentrust 3-sided toothbrush :: specialty toothbrush for autism & special needs :: autistic asd :: made in usa,Health & Beauty > Personal Care > Oral Hygiene > Manual Toothbrushes
1236,470,"Dr. Fresh Firefly, The Original Flashing Light Up Timer Toothbrush for Kids, Soft Bristle, 1 Minute Timer (Pack of 12) New",Health & Beauty > Personal Care > Oral Hygiene > Manual Toothbrushes
1237,470,adult pre-pasted disposable toothbrushes - 144 per pack new,Health & Beauty > Personal Care > Oral Hygiene > Manual Toothbrushes
1238,470,sankuwen 1pc toothbrush,Health & Beauty > Personal Care > Oral Hygiene > Manual Toothbrushes
1239,470,"Reach Complete Care Curve Plus Whitening Soft Adult Manual Toothbrush, 0.069 Pound (Pack of 6)",Health & Beauty > Personal Care > Oral Hygiene > Manual Toothbrushes
1240,470,pro-sys kids toothbrush,Health & Beauty > Personal Care > Oral Hygiene > Manual Toothbrushes
1241,470,Colgate Monster High Toothbrush Value Set - Soft (Colors may Vary),Health & Beauty > Personal Care > Oral Hygiene > Manual Toothbrushes
1242,470,"bmbu natural toothbrush ? firm bristle ? made with high quality, sustainably grown bamboo ? biodegradable packaging",Health & Beauty > Personal Care > Oral Hygiene > Manual Toothbrushes
1243,470,travel folding soft,Health & Beauty > Personal Care > Oral Hygiene > Manual Toothbrushes
1244,470,toothbrush deals,Health & Beauty > Personal Care > Oral Hygiene > Manual Toothbrushes
1245,470,prosys kids toothbrush  ages 25 pack of 4,Health & Beauty > Personal Care > Oral Hygiene > Manual Toothbrushes
1246,470,radius source recycled,Health & Beauty > Personal Care > Oral Hygiene > Manual Toothbrushes
1247,470,"Cand Kids Toothbrushes,Penguin-shaped,9 Pack",Health & Beauty > Personal Care > Oral Hygiene > Manual Toothbrushes
1248,470,oral-b pro-health clinical pro-flex medium toothbrush 2 count health and beauty,Health & Beauty > Personal Care > Oral Hygiene > Manual Toothbrushes
1249,470,"natural tooth & gum powder with activated charcoal, 2 x 2.75oz jars + 2 woobamboo toothbrushes",Health & Beauty > Personal Care > Oral Hygiene > Manual Toothbrushes
1250,470,biodegradable pearl toothbrush health and beauty,Health & Beauty > Personal Care > Oral Hygiene > Manual Toothbrushes
1251,470,8pcs toothbrush replacement,Health & Beauty > Personal Care > Oral Hygiene > Manual Toothbrushes
1252,470,colgate smiles childrens toothbrush with tongue cleaner (6 pack),Health & Beauty > Personal Care > Oral Hygiene > Manual Toothbrushes
1253,470,dentek slim brush 32's deep clean tight teeth (3 pack),Health & Beauty > Personal Care > Oral Hygiene > Manual Toothbrushes
1254,470,40 toothbrushes lot,Health & Beauty > Personal Care > Oral Hygiene > Manual Toothbrushes
1255,470,3 PACK :: DenTrust 3-Sided Toothbrush :: Soft :: Wrap-Around Design with Automatic 45 Degree Angle :: Made in USA,Health & Beauty > Personal Care > Oral Hygiene > Manual Toothbrushes
1256,470,"reach by design soft toothbrushes, #138, 2-count (pack of 6) assorted designs",Health & Beauty > Personal Care > Oral Hygiene > Manual Toothbrushes
1257,470,"reach toothbrush, firm, full head #12 - (12 pack)",Health & Beauty > Personal Care > Oral Hygiene > Manual Toothbrushes
1258,470,orajel paw patrol toddler toothbrush,Health & Beauty > Personal Care > Oral Hygiene > Manual Toothbrushes
1259,470,"radius totz plus toothbrush for 3 years +, silky soft bristles, assorted colors, colors may vary, 3 count",Health & Beauty > Personal Care > Oral Hygiene > Manual Toothbrushes
1260,470,"GUM 872PA Oral Toothbrush, Tight Gum, Proxabrush Go-Betweens Cleaner, Antibacterial Bristle (Pack of 36)",Health & Beauty > Personal Care > Oral Hygiene > Manual Toothbrushes
1261,470,gum 516 technique sensitive,Health & Beauty > Personal Care > Oral Hygiene > Manual Toothbrushes
1262,470,gun toothbrush,Health & Beauty > Personal Care > Oral Hygiene > Manual Toothbrushes
1263,470,oral-b complete advantage plus toothbrush head medium 1 ct pkg,Health & Beauty > Personal Care > Oral Hygiene > Manual Toothbrushes
1264,470,colgate slimsoft toothbrush adult pro tip soft 1 ct pkg,Health & Beauty > Personal Care > Oral Hygiene > Manual Toothbrushes
1265,470,12-pack: close-up right angle medium bristle toothbrushes,Health & Beauty > Personal Care > Oral Hygiene > Manual Toothbrushes
1266,470,oral b toothbrush pulsar medium twin pack manual - 2 count,Health & Beauty > Personal Care > Oral Hygiene > Manual Toothbrushes
1267,470,oral-b toothbrush advantage artica soft twin pack cleans and whitens - 2 count,Health & Beauty > Personal Care > Oral Hygiene > Manual Toothbrushes
1268,470,oral-b toothbrush crossaction regular soft 40 - 2 count,Health & Beauty > Personal Care > Oral Hygiene > Manual Toothbrushes
1269,470,signature care toothbrush angled edge soft twin pack - 2 count,Health & Beauty > Personal Care > Oral Hygiene > Manual Toothbrushes
1270,470,colgate toothbrush dora the explorer extra soft - each,Health & Beauty > Personal Care > Oral Hygiene > Manual Toothbrushes
1271,470,braun oral b advantage plus 40 medium 34 toothbrush - each,Health & Beauty > Personal Care > Oral Hygiene > Manual Toothbrushes
1272,470,"meijer kids! ice age extra soft toothbrush, 2 pk",Health & Beauty > Personal Care > Oral Hygiene > Manual Toothbrushes
1273,470,colgate kids my first toothbrush blue/light blue toothbrush,Health & Beauty > Personal Care > Oral Hygiene > Manual Toothbrushes
1274,470,whimzees toothbrush treat - l - 1 ct,Health & Beauty > Personal Care > Oral Hygiene > Manual Toothbrushes
1275,470,oral-b oral-b pro-health for me crossaction toothbrush,Health & Beauty > Personal Care > Oral Hygiene > Manual Toothbrushes
1276,470,tom's of maine tom's of maine medium manual toothbrush,Health & Beauty > Personal Care > Oral Hygiene > Manual Toothbrushes
1277,470,crest oral-b glide tip with special deep clean bristles toothbrush,Health & Beauty > Personal Care > Oral Hygiene > Manual Toothbrushes
1278,470,oral-b oral-b pulsar soft bristles toothbrush,Health & Beauty > Personal Care > Oral Hygiene > Manual Toothbrushes
1279,470,"radius radius toothbrush, scuba right hand soft, 1 ea",Health & Beauty > Personal Care > Oral Hygiene > Manual Toothbrushes
1280,470,colgate colgate 360 full head medium toothbrush (pack of 2),Health & Beauty > Personal Care > Oral Hygiene > Manual Toothbrushes
1281,470,"colgate colgate slim soft floss tip bristle toothbrush, 1 count",Health & Beauty > Personal Care > Oral Hygiene > Manual Toothbrushes
1282,470,"colgate colgate extra clean toothbrush, full head - soft",Health & Beauty > Personal Care > Oral Hygiene > Manual Toothbrushes
1283,470,oral-b oral-b glide tip with special deep clean bristles toothbrush,Health & Beauty > Personal Care > Oral Hygiene > Manual Toothbrushes
1284,470,oral-b oral-b advantage 3d white toothbrush small/soft small/soft,Health & Beauty > Personal Care > Oral Hygiene > Manual Toothbrushes
1285,470,"tom's of maine tom's of maine adult toothbrush, medium, 1 ea",Health & Beauty > Personal Care > Oral Hygiene > Manual Toothbrushes
1286,470,oral-b oral b indicator flat trim soft manual toothbrush,Health & Beauty > Personal Care > Oral Hygiene > Manual Toothbrushes
1287,470,"oral-b oral-b complete deep clean soft bristles toothbrush, 2 count",Health & Beauty > Personal Care > Oral Hygiene > Manual Toothbrushes
1288,470,oral-b oral b pro health stages disney princess soft manual toot...,Health & Beauty > Personal Care > Oral Hygiene > Manual Toothbrushes
1289,470,oral-b oral-b pulsar 3d white advanced vivid toothbrush -soft br...,Health & Beauty > Personal Care > Oral Hygiene > Manual Toothbrushes
1290,470,surround toddler toothbrush pack of 4 new,Health & Beauty > Personal Care > Oral Hygiene > Manual Toothbrushes
1291,470,"nimbus® microfine® toothbrush regular size, pack of 5 ""colors vary"" new",Health & Beauty > Personal Care > Oral Hygiene > Manual Toothbrushes
1292,470,"equate ultra white toothbrushes, soft full, 2 ct",Health & Beauty > Personal Care > Oral Hygiene > Manual Toothbrushes
1293,470,"colgate pink wave toothbrush, 1 ct",Health & Beauty > Personal Care > Oral Hygiene > Manual Toothbrushes
1294,470,"peanuts soft toothbrushes, 2 count",Health & Beauty > Personal Care > Oral Hygiene > Manual Toothbrushes
1295,470,"reach advanced design toothbrushes, firm, 7 ct",Health & Beauty > Personal Care > Oral Hygiene > Manual Toothbrushes
1296,470,"oral-b 3d white pro-flex soft toothbrush, 2 ct",Health & Beauty > Personal Care > Oral Hygiene > Manual Toothbrushes
1297,470,"colgate 360 optic white platinum toothbrush-8pk, medium bristle",Health & Beauty > Personal Care > Oral Hygiene > Manual Toothbrushes
1298,470,"oral b pulsar toothbrush, medium, compact 35, 1 toothbrush",Health & Beauty > Personal Care > Oral Hygiene > Manual Toothbrushes
1299,470,oral b 3d white vivid soft toothbrush - 2 count,Health & Beauty > Personal Care > Oral Hygiene > Manual Toothbrushes
1300,470,oral-b sensitive toothbrush extra soft - 1 ea,Health & Beauty > Personal Care > Oral Hygiene > Manual Toothbrushes
1301,470,colgate 360 degrees sensitive pro-relief toothbrushes compact head,Health & Beauty > Personal Care > Oral Hygiene > Manual Toothbrushes
1302,470,"colgate kids my first toothbrush, soft, ages 0-2",Health & Beauty > Personal Care > Oral Hygiene > Manual Toothbrushes
1303,470,"colgate extra clean toothbrush, fu...",Health & Beauty > Personal Care > Oral Hygiene > Manual Toothbrushes
1304,470,oral-b pro-health stages kids manual toothbrush featuring disney,Health & Beauty > Personal Care > Oral Hygiene > Manual Toothbrushes
1305,470,"g-u-m crayola pip-squeaks toothbrushes, ultrasoft 232 - 2 toothbrushes",Health & Beauty > Personal Care > Oral Hygiene > Manual Toothbrushes
1306,470,"colgate 360 optic white platinum toothbrush-8pk, soft bristle",Health & Beauty > Personal Care > Oral Hygiene > Manual Toothbrushes
1307,470,oral-b advantage complete deep clean soft bristles toothbrush 2 pack,Health & Beauty > Personal Care > Oral Hygiene > Manual Toothbrushes
1308,470,"oral-b pulsar toothbrushes, medium - 2 pack",Health & Beauty > Personal Care > Oral Hygiene > Manual Toothbrushes
1309,470,oral b value pack all in one pro-health medium toothbrushes,Health & Beauty > Personal Care > Oral Hygiene > Manual Toothbrushes
1310,470,publix value pack clean+ full head soft toothbrush,Health & Beauty > Personal Care > Oral Hygiene > Manual Toothbrushes
1311,470,colgate triple act toothbrush - 1.00 ct,Health & Beauty > Personal Care > Oral Hygiene > Manual Toothbrushes
1312,470,colgate 360 surround toothbrus - 1.00 ct,Health & Beauty > Personal Care > Oral Hygiene > Manual Toothbrushes
1313,470,colgate extra clean full head - 1.00 ct,Health & Beauty > Personal Care > Oral Hygiene > Manual Toothbrushes
1314,470,g-u-m timer light toothbrush - 1.00 ct,Health & Beauty > Personal Care > Oral Hygiene > Manual Toothbrushes
1315,470,colgate max white toothbrush soft - 2 count,Health & Beauty > Personal Care > Oral Hygiene > Manual Toothbrushes
1316,470,"radius, totz plus toothbrush, 3+ years, green/yellow, 1 toothbrush",Health & Beauty > Personal Care > Oral Hygiene > Manual Toothbrushes
1317,470,"radius, original toothbrush, purple, soft, right hand, 1 toothbrush",Health & Beauty > Personal Care > Oral Hygiene > Manual Toothbrushes
1318,470,worthy promotional products ole miss rebels toothbrush - set of three,Health & Beauty > Personal Care > Oral Hygiene > Manual Toothbrushes
1319,470,genetic solutions abc sing along musical toothbrush - set of two,Health & Beauty > Personal Care > Oral Hygiene > Manual Toothbrushes
1320,470,Oral-B Pro Health All In,Health & Beauty > Personal Care > Oral Hygiene > Manual Toothbrushes
1321,470,"TONGUE SCRAPER 2 Effective Sweepers Made From Anti-Bacterial, BPA-Free a»Plastic. Quality Cleaner Gives Fresh Breath And Better Taste. 2 Different Functions, Compact Toothbrush For Traveling. Best Oral Care For Halitosis 100% Satisfaction Guaranteed!",Health & Beauty > Personal Care > Oral Hygiene > Manual Toothbrushes
1322,470,"Colgate 360 Total Advanced Floss-Tip Bristle Toothbrush, Full Head Soft, 2 Count (Pack of 6)",Health & Beauty > Personal Care > Oral Hygiene > Manual Toothbrushes
1323,470,"RADIUS Travel Case for Original and Scuba Toothbrush, Assorted Colors (Pack of 3)",Health & Beauty > Personal Care > Oral Hygiene > Manual Toothbrushes
1324,470,"RADIUS Travel Case for Original and Scuba Toothbrush, Assorted Colors (3 Pack)",Health & Beauty > Personal Care > Oral Hygiene > Manual Toothbrushes
1325,470,SmileCare Youth Smiley Suction Toothbrush and Floss Kits - Dental Hygiene Products - 20 Kits per Pack,Health & Beauty > Personal Care > Oral Hygiene > Manual Toothbrushes
1326,470,eslite toothbrush,Health & Beauty > Personal Care > Oral Hygiene > Manual Toothbrushes
1327,470,NFL New York Giants Soft Toothbrush,Health & Beauty > Personal Care > Oral Hygiene > Manual Toothbrushes
1328,470,bathsense allure toothbrush,Health & Beauty > Personal Care > Oral Hygiene > Manual Toothbrushes
1329,470,"dr. fresh peanuts snoopy toothbrush for kids, 4 per pack (pack of 2)",Health & Beauty > Personal Care > Oral Hygiene > Manual Toothbrushes
1330,470,silver toothbrush with crystal handle toothbrush by nano-b,Health & Beauty > Personal Care > Oral Hygiene > Manual Toothbrushes
1331,470,"colgate 360 total advanced full head toothbrush, soft",Health & Beauty > Personal Care > Oral Hygiene > Manual Toothbrushes
1332,470,4pcs dental care premium bamboo charcoal nano toothbrush set + worldwide free shiping new,Health & Beauty > Personal Care > Oral Hygiene > Manual Toothbrushes
1333,470,dr.tungs snap on toothbrush,Health & Beauty > Personal Care > Oral Hygiene > Manual Toothbrushes
1334,470,"colgate wisp plus whitening, portable mini-brush toothbrush, coolmint 16 ea",Health & Beauty > Personal Care > Oral Hygiene > Manual Toothbrushes
1335,470,set 4 cute whale toothbrush,Health & Beauty > Personal Care > Oral Hygiene > Manual Toothbrushes
1336,470,Toob Toothbrush - - ASSORTED,Health & Beauty > Personal Care > Oral Hygiene > Manual Toothbrushes
1337,470,BeautyKate Set of 10 pcs Multifunction Oval Toothbrush Makup Brushes set (Rose-golden+Black Brush Handle),Health & Beauty > Personal Care > Oral Hygiene > Manual Toothbrushes
1338,470,"Colgate Kids Twin Pack Toothbrush, Spongebob, 2 Count",Health & Beauty > Personal Care > Oral Hygiene > Manual Toothbrushes
1339,470,Firefly Light-Up Toothbrush - Star Wars (Darth Vader) - 1,Health & Beauty > Personal Care > Oral Hygiene > Manual Toothbrushes
1340,470,oral-b 3d white luxe pro-flex toothbrush + crest 3d white whitestrips 1 hour express whitening kit,Health & Beauty > Personal Care > Oral Hygiene > Manual Toothbrushes
1341,470,oralb 3d white luxe proflex 38 medium manual toothbrush twin pack,Health & Beauty > Personal Care > Oral Hygiene > Manual Toothbrushes
1342,470,tek pro toothbrush: hard/firm (pack of 12),Health & Beauty > Personal Care > Oral Hygiene > Manual Toothbrushes
1343,470,dentrust 3-sided toothbrush :: specialty toothbrush for autism & special needs :: autistic asd :: made in usa,Health & Beauty > Personal Care > Oral Hygiene > Manual Toothbrushes
1344,470,toothbrush 5.5 in. b1318x,Health & Beauty > Personal Care > Oral Hygiene > Manual Toothbrushes
1345,470,hands free toothbrush,Health & Beauty > Personal Care > Oral Hygiene > Manual Toothbrushes
1346,470,colgate wave soft compact head toothbrush colors vary (pack of 8),Health & Beauty > Personal Care > Oral Hygiene > Manual Toothbrushes
1347,470,colgate extra clean toothbrush firm,Health & Beauty > Personal Care > Oral Hygiene > Manual Toothbrushes
1348,470,"colgate extra clean toothbrush full head firm #40, brushes hard (pack of 12) health and beauty",Health & Beauty > Personal Care > Oral Hygiene > Manual Toothbrushes
