,category_id,description,category_path
2304,470,surroundâ® toddler toothbrush (pack of 4),Health & Beauty > Personal Care > Oral Hygiene > Manual Toothbrushes
2305,470,"oral-b advantage 3d white vivid toothbrush, medium - 1 ea",Health & Beauty > Personal Care > Oral Hygiene > Manual Toothbrushes
2306,470,"g-u-m dinosaur training toothbrush, value pack - 2 ea",Health & Beauty > Personal Care > Oral Hygiene > Manual Toothbrushes
2307,470,"firefly kids! lightup timer toothbrush, soft - 2 ea",Health & Beauty > Personal Care > Oral Hygiene > Manual Toothbrushes
2308,470,firefly kids! hello kitty flashing sculpted toothbrush - 1 ea,Health & Beauty > Personal Care > Oral Hygiene > Manual Toothbrushes
2309,470,"brushpoint scoobydoo twin pack manual toothbrush, blue & red - 2 ea",Health & Beauty > Personal Care > Oral Hygiene > Manual Toothbrushes
2310,470,"firefly kids! lightup timer toothbrush, soft - ...",Health & Beauty > Personal Care > Oral Hygiene > Manual Toothbrushes
2311,470,"colgate wisp optic white portable mini-brush toothbrush, cool mint - 16 ea",Health & Beauty > Personal Care > Oral Hygiene > Manual Toothbrushes
2312,470,"violife bobee toothbrush, soccer - 1 ea",Health & Beauty > Personal Care > Oral Hygiene > Manual Toothbrushes
2313,470,"colgate 360 optic white full head toothbrush, soft - 1 ea",Health & Beauty > Personal Care > Oral Hygiene > Manual Toothbrushes
2314,470,"oral-b crossaction value pack! regular head toothbrush, medium - 2 ea",Health & Beauty > Personal Care > Oral Hygiene > Manual Toothbrushes
2315,470,"colgate kids teenage mutant ninja turtles toothbrush with suction cup, extra soft - 1 ea",Health & Beauty > Personal Care > Oral Hygiene > Manual Toothbrushes
2316,470,oral-b complete fresh scope soft bristles toothbrush - 2 ea,Health & Beauty > Personal Care > Oral Hygiene > Manual Toothbrushes
2317,470,reach ultra clean toothbrush medium - 1 ea,Health & Beauty > Personal Care > Oral Hygiene > Manual Toothbrushes
2318,470,"colgate 360 enamel health sensitive toothbrush,...",Health & Beauty > Personal Care > Oral Hygiene > Manual Toothbrushes
2319,470,colgate 360 enamel health whitening toothbrush soft - 1 ea,Health & Beauty > Personal Care > Oral Hygiene > Manual Toothbrushes
2320,470,"g-u-m technique deep clean toothbrush, value pack - 2 ea",Health & Beauty > Personal Care > Oral Hygiene > Manual Toothbrushes
2321,470,lg singing toothbrush (born & badromance),Health & Beauty > Personal Care > Oral Hygiene > Manual Toothbrushes
2322,470,oral-b pro-health stages kids manual toothbrush featuring marvel avengers with disney magictimer app by,Health & Beauty > Personal Care > Oral Hygiene > Manual Toothbrushes
2323,470,"my first colgate kids toothbrush extra soft, 6ct",Health & Beauty > Personal Care > Oral Hygiene > Manual Toothbrushes
2324,470,justin bieber singing toothbrush - sings 'somebody to love' & 'love me' (colors may vary),Health & Beauty > Personal Care > Oral Hygiene > Manual Toothbrushes
2325,470,brush buddies the smurfs poppin papa smurf manual toothbrush,Health & Beauty > Personal Care > Oral Hygiene > Manual Toothbrushes
2326,470,"colgate extra clean toothbrush soft, 1ct",Health & Beauty > Personal Care > Oral Hygiene > Manual Toothbrushes
2327,470,brush buddies the smurfs manual toothbrush - 4 count,Health & Beauty > Personal Care > Oral Hygiene > Manual Toothbrushes
2328,470,colgate ninja turtles toothbrush - extra soft ( 2 count),Health & Beauty > Personal Care > Oral Hygiene > Manual Toothbrushes
2329,470,colgate 360 optic white toothbrushes - 4 pack,Health & Beauty > Personal Care > Oral Hygiene > Manual Toothbrushes
2330,470,colgate kids minions manual toothbrush 2 count,Health & Beauty > Personal Care > Oral Hygiene > Manual Toothbrushes
2331,470,brush buddies the smurfs talkin smurfette manual toothbrush,Health & Beauty > Personal Care > Oral Hygiene > Manual Toothbrushes
2332,470,sunstar gum® technique® sensitive care ultra soft toothbrush - twin pack - assorted colors,Health & Beauty > Personal Care > Oral Hygiene > Manual Toothbrushes
2333,470,soft toothbrush set - 2 pack - up & up™,Health & Beauty > Personal Care > Oral Hygiene > Manual Toothbrushes
2334,470,colgate kid teenage mutant ninja turtles suction cup manual toothbrush 1ct,Health & Beauty > Personal Care > Oral Hygiene > Manual Toothbrushes
2335,470,oral-b pro-health all-in-one 40 soft toothbrush 4 count,Health & Beauty > Personal Care > Oral Hygiene > Manual Toothbrushes
2336,470,up & up soft toothbrush - 4 ct,Health & Beauty > Personal Care > Oral Hygiene > Manual Toothbrushes
2337,470,colgate kids toothbrush set - 3 pack,Health & Beauty > Personal Care > Oral Hygiene > Manual Toothbrushes
2338,470,dr. fresh marvel heroes suction cup toothbrushes 4 each,Health & Beauty > Personal Care > Oral Hygiene > Manual Toothbrushes
2339,470,"colgate spongebob squarepants extra soft toothbrush value pack, 2 count",Health & Beauty > Personal Care > Oral Hygiene > Manual Toothbrushes
2340,470,oralb prohealth clinical proflex soft toothbrush,Health & Beauty > Personal Care > Oral Hygiene > Manual Toothbrushes
2341,470,kid's oral-b pro-health stages marvel avengers soft toothbrush,Health & Beauty > Personal Care > Oral Hygiene > Manual Toothbrushes
2342,470,oralb prohealth stages kids manual toothbrush featuring marvel avengers with disney magictimer app,Health & Beauty > Personal Care > Oral Hygiene > Manual Toothbrushes
2343,470,arm hammer spinbrush truly radiant deep clean manual toothbrush soft,Health & Beauty > Personal Care > Oral Hygiene > Manual Toothbrushes
2344,470,"reach advanced design toothbrushes, firm, 7 count",Health & Beauty > Personal Care > Oral Hygiene > Manual Toothbrushes
2345,470,"oral-b stages, cars manual toothbrush, 5-7 years",Health & Beauty > Personal Care > Oral Hygiene > Manual Toothbrushes
2346,470,oral-b pulsar 3d white advanced vivid toothbrush soft,Health & Beauty > Personal Care > Oral Hygiene > Manual Toothbrushes
2347,470,"oral-b crossaction pro-health toothbrush, twin pack",Health & Beauty > Personal Care > Oral Hygiene > Manual Toothbrushes
2348,470,"reach advanced design firm toothbrush, 2 count",Health & Beauty > Personal Care > Oral Hygiene > Manual Toothbrushes
2349,470,shopkins brush buddies manual toothbrush 2-pack one color,Health & Beauty > Personal Care > Oral Hygiene > Manual Toothbrushes
2350,470,nuk grins & giggles toddler toothbrush and cleanser set - blue one color,Health & Beauty > Personal Care > Oral Hygiene > Manual Toothbrushes
2351,470,"plus toothbrush, dual cleaning tip, twin pack soft colgate",Health & Beauty > Personal Care > Oral Hygiene > Manual Toothbrushes
2352,470,oral-b complete deep clean soft bristles toothbrush 4.0 ea,Health & Beauty > Personal Care > Oral Hygiene > Manual Toothbrushes
2353,470,deep clean toothbrush twin pack 40 soft/regular oral-b advantage,Health & Beauty > Personal Care > Oral Hygiene > Manual Toothbrushes
2354,470,natural bamboo toothbrush by bambeauty 4 pack white bpafree soft nylon bristles biodegradable packaging  tooth brush handle premium wood toothbrushes keep unnecessary plastics  rubbers out of your mouth  away from your teeth,Health & Beauty > Personal Care > Oral Hygiene > Manual Toothbrushes
2355,470,gum toothbrush star wars flash lightcolor may vary,Health & Beauty > Personal Care > Oral Hygiene > Manual Toothbrushes
2356,470,gum tech 524 deep clean,Health & Beauty > Personal Care > Oral Hygiene > Manual Toothbrushes
2357,470,intizar uv toothbrush,Health & Beauty > Personal Care > Oral Hygiene > Manual Toothbrushes
2358,470,gum 409 toothbrush with stimulator - compact soft (3 pack),Health & Beauty > Personal Care > Oral Hygiene > Manual Toothbrushes
2359,470,Shopkins 2 Pack Manual Toothbrushes,Health & Beauty > Personal Care > Oral Hygiene > Manual Toothbrushes
2360,470,BrushBuddies Shopkins Manual Toothbrush 2 ea (Pack of 3),Health & Beauty > Personal Care > Oral Hygiene > Manual Toothbrushes
2361,470,colgate 360 compact head soft toothbrush (6 pack),Health & Beauty > Personal Care > Oral Hygiene > Manual Toothbrushes
2362,470,strawberry shortcake suction cup toothbrush - 4 count,Health & Beauty > Personal Care > Oral Hygiene > Manual Toothbrushes
2363,470,"Dr. Fresh Aim Premium Travel Toothbrush, Set of 2, 3-Pack",Health & Beauty > Personal Care > Oral Hygiene > Manual Toothbrushes
2364,470,"Violife Rockee The Toothbrush That Rocks, Chomper, 3 Count",Health & Beauty > Personal Care > Oral Hygiene > Manual Toothbrushes
2365,470,radius totz toothbrush for,Health & Beauty > Personal Care > Oral Hygiene > Manual Toothbrushes
2366,470,firefly toothbrush spiderman flashing 1 min timer,Health & Beauty > Personal Care > Oral Hygiene > Manual Toothbrushes
2367,470,oral-b complete fresh scope scented soft bristles toothbrush 2 count,Health & Beauty > Personal Care > Oral Hygiene > Manual Toothbrushes
2368,470,"Earth's Daughter Biodegradable, Eco-Friendly, Natural Bamboo Adult Toothbrushes",Health & Beauty > Personal Care > Oral Hygiene > Manual Toothbrushes
2369,470,Medline MDS136000 Latex Free Individually Wrapped Adult Toothbrushes (Pack of 144),Health & Beauty > Personal Care > Oral Hygiene > Manual Toothbrushes
2370,470,dentrust 3-sided toothbrush,Health & Beauty > Personal Care > Oral Hygiene > Manual Toothbrushes
2371,470,"oral-b pulsar medium bristle toothbrush , 2 count, (colors may vary)",Health & Beauty > Personal Care > Oral Hygiene > Manual Toothbrushes
2372,470,fuchs adult medium medoral natural duo plus toothbrush - 1 toothbrush - case of 10,Health & Beauty > Personal Care > Oral Hygiene > Manual Toothbrushes
2373,470,"Multi-Pack - Sofresh Flossing Toothbrush - Adult Size | Your Choice of Color | (4-Pack, Green)",Health & Beauty > Personal Care > Oral Hygiene > Manual Toothbrushes
2374,470,colgate kids toothbrush,Health & Beauty > Personal Care > Oral Hygiene > Manual Toothbrushes
2375,470,"Preserve Adult Medium Toothbrush with Mailer Assorted Colors, 6 Count",Health & Beauty > Personal Care > Oral Hygiene > Manual Toothbrushes
2376,470,violife vio100 toothbrush,Health & Beauty > Personal Care > Oral Hygiene > Manual Toothbrushes
2377,470,Preserve - Cinnamint Toothpicks - 35 Pick(s),Health & Beauty > Personal Care > Oral Hygiene > Manual Toothbrushes
2378,470,colgate wave gum comfort,Health & Beauty > Personal Care > Oral Hygiene > Manual Toothbrushes
2379,470,radius toothbrush bundle - 1 scuba right toothbrush + 1 travel case [colors may vary],Health & Beauty > Personal Care > Oral Hygiene > Manual Toothbrushes
2380,470,4 pack travel toothbrush folding (asst colors),Health & Beauty > Personal Care > Oral Hygiene > Manual Toothbrushes
2381,470,"colgate 360 degree sensitive toothbrush, extra soft, compact 34, 1 toothbrush, (case of 6)",Health & Beauty > Personal Care > Oral Hygiene > Manual Toothbrushes
2382,470,white soft bristle 3 sided toothbrush cleaner for child,Health & Beauty > Personal Care > Oral Hygiene > Manual Toothbrushes
2383,470,ncaa boise state broncos toothbrush,Health & Beauty > Personal Care > Oral Hygiene > Manual Toothbrushes
2384,470,whimzees toothbrush star,Health & Beauty > Personal Care > Oral Hygiene > Manual Toothbrushes
2385,470,"colgate 360 total advanced full head toothbrush, medium",Health & Beauty > Personal Care > Oral Hygiene > Manual Toothbrushes
2386,470,12x replacement toothbrush,Health & Beauty > Personal Care > Oral Hygiene > Manual Toothbrushes
2387,470,bamboo toothbrush best ecofriendly biodegradable bamboo handles and bpafree nonplastic nylon bristles for natural dental care perfect environmentally friendly way to help our planet go green,Health & Beauty > Personal Care > Oral Hygiene > Manual Toothbrushes
2388,470,dr. fresh toothbrush 4's marvel heroes 6 package (24 total toothbrushes),Health & Beauty > Personal Care > Oral Hygiene > Manual Toothbrushes
2389,470,"reach advanced design full head toothbrush, soft - 2 ea (pack of 5)",Health & Beauty > Personal Care > Oral Hygiene > Manual Toothbrushes
2390,470,preserve adult ultra soft toothbrush pack of 6,Health & Beauty > Personal Care > Oral Hygiene > Manual Toothbrushes
2391,470,4pcs dental care premium bamboo charcoal nano toothbrush set + worldwide free shiping,Health & Beauty > Personal Care > Oral Hygiene > Manual Toothbrushes
2392,470,tek professional full firm straight toothbrush - 1 ea new,Health & Beauty > Personal Care > Oral Hygiene > Manual Toothbrushes
2393,470,dr. fresh standing toothbrush - marvel heroes - 4 pk,Health & Beauty > Personal Care > Oral Hygiene > Manual Toothbrushes
2394,470,oral-b complete 5 way clean medium toothbrush 2 count (colors may vary),Health & Beauty > Personal Care > Oral Hygiene > Manual Toothbrushes
2395,470,dr. fresh marvel heroes 4 pk toothbrush new,Health & Beauty > Personal Care > Oral Hygiene > Manual Toothbrushes
2396,470,Finding Nemo Zoothbrush Manual Toothbrush 1 Count By Zoothbrush,Health & Beauty > Personal Care > Oral Hygiene > Manual Toothbrushes
2397,470,"oral-b pro-health stages monsters, inc. manual kid's toothbrush 1 count (pack of 6) quantity: 2",Health & Beauty > Personal Care > Oral Hygiene > Manual Toothbrushes
2398,470,"tom's of maine children's toothbrush bpa free, soft, pack of 6",Health & Beauty > Personal Care > Oral Hygiene > Manual Toothbrushes
2399,470,philips hx5100 toothbrush,Health & Beauty > Personal Care > Oral Hygiene > Manual Toothbrushes
2400,470,"violife bobee toothbrush, soccer ball",Health & Beauty > Personal Care > Oral Hygiene > Manual Toothbrushes
2401,470,mouth watchers nano silver toothbrush - adult orange,Health & Beauty > Personal Care > Oral Hygiene > Manual Toothbrushes
2402,470,barbie travel toothbrush with zippered case and cap,Health & Beauty > Personal Care > Oral Hygiene > Manual Toothbrushes
2403,470,nfl new england patriots toothbrush,Health & Beauty > Personal Care > Oral Hygiene > Manual Toothbrushes
2404,470,gum travel toothbrushes with antibacterial bristles-twin pack,Health & Beauty > Personal Care > Oral Hygiene > Manual Toothbrushes
2405,470,"Eco-Friendly Bamboo Toothbrush by Nyxe Naturals, 4 Pack",Health & Beauty > Personal Care > Oral Hygiene > Manual Toothbrushes
2406,470,12 count toothbrush,Health & Beauty > Personal Care > Oral Hygiene > Manual Toothbrushes
2407,470,"dr. fresh peanuts snoopy toothbrush for kids, 4 per pack (pack of 2) new",Health & Beauty > Personal Care > Oral Hygiene > Manual Toothbrushes
2408,470,"Tom's of Maine Naturally Clean Toothbrush, Medium, Pack of 6",Health & Beauty > Personal Care > Oral Hygiene > Manual Toothbrushes
2409,470,nfl tampa bay buccaneers toothbrush,Health & Beauty > Personal Care > Oral Hygiene > Manual Toothbrushes
2410,470,"bmbu natural toothbrush ? soft bristle ? made with high quality, sustainably grown bamboo ? biodegradable packaging",Health & Beauty > Personal Care > Oral Hygiene > Manual Toothbrushes
2411,470,pokemon toothbrush for 6-12,Health & Beauty > Personal Care > Oral Hygiene > Manual Toothbrushes
2412,470,"Radius Toothbrush, Source Super Soft, 6 Count",Health & Beauty > Personal Care > Oral Hygiene > Manual Toothbrushes
2413,470,careone elite toothbrush angle soft 1 ct pkg,Health & Beauty > Personal Care > Oral Hygiene > Manual Toothbrushes
2414,470,oral-b pulsar toothbrush soft 95 value pack 2 ct pkg,Health & Beauty > Personal Care > Oral Hygiene > Manual Toothbrushes
2415,470,colgate extra clean toothbrush full head medium #41 1 ct pkg,Health & Beauty > Personal Care > Oral Hygiene > Manual Toothbrushes
2416,470,6 pack: dr. fresh close up right angle toothbrushes,Health & Beauty > Personal Care > Oral Hygiene > Manual Toothbrushes
2417,470,colgate optic white toothbrush plus whitening pen,Health & Beauty > Personal Care > Oral Hygiene > Manual Toothbrushes
2418,470,colgate toothbrush medium 41 - 4 count,Health & Beauty > Personal Care > Oral Hygiene > Manual Toothbrushes
2419,470,signature care toothbrush orbit soft twin pack - 2 count,Health & Beauty > Personal Care > Oral Hygiene > Manual Toothbrushes
2420,470,reach disney phineas and ferb soft value pack youth toothbrushes - 2 count,Health & Beauty > Personal Care > Oral Hygiene > Manual Toothbrushes
2421,470,colgate toothbrush 360 optic white soft - 2 count,Health & Beauty > Personal Care > Oral Hygiene > Manual Toothbrushes
2422,470,oral-b toothbrush stages princess - 4.2 oz,Health & Beauty > Personal Care > Oral Hygiene > Manual Toothbrushes
2423,470,"meijer massaging bristles medium toothbrushes, 2 pk",Health & Beauty > Personal Care > Oral Hygiene > Manual Toothbrushes
2424,470,"reach medium-bristle designer toothbrushes, 5-ct. packs",Health & Beauty > Personal Care > Oral Hygiene > Manual Toothbrushes
2425,470,frontier preserve adult toothbrush soft 1 toothbrush,Health & Beauty > Personal Care > Oral Hygiene > Manual Toothbrushes
2426,470,"colgate colgate extra clean toothbrush, full head, medium",Health & Beauty > Personal Care > Oral Hygiene > Manual Toothbrushes
2427,470,colgate colgate 360 medium full manual toothbrush,Health & Beauty > Personal Care > Oral Hygiene > Manual Toothbrushes
2428,470,"gum gum crayola pip-squeak soft toothbrush, twin pack - 2 ea",Health & Beauty > Personal Care > Oral Hygiene > Manual Toothbrushes
2429,470,colgate colgate travel manual toothbrush adult,Health & Beauty > Personal Care > Oral Hygiene > Manual Toothbrushes
2430,470,paragon paragon whimzees toothbrush star dental treat for x-small...,Health & Beauty > Personal Care > Oral Hygiene > Manual Toothbrushes
2431,470,"oral-b oral-b 3d white radiant whitening toothbrush, medium, 2 ct",Health & Beauty > Personal Care > Oral Hygiene > Manual Toothbrushes
2432,470,radius radius original left hand soft manual toothbrush,Health & Beauty > Personal Care > Oral Hygiene > Manual Toothbrushes
2433,470,"colgate colgate extra clean toothbrush, full head - soft (pack of 4)",Health & Beauty > Personal Care > Oral Hygiene > Manual Toothbrushes
2434,470,colgate colgate optic white toothbrush plus whitening pen,Health & Beauty > Personal Care > Oral Hygiene > Manual Toothbrushes
2435,470,colgate colgate travel folding toothbrush soft,Health & Beauty > Personal Care > Oral Hygiene > Manual Toothbrushes
2436,470,"colgate colgate 360 total advanced soft full manual toothbrush, 2 ct",Health & Beauty > Personal Care > Oral Hygiene > Manual Toothbrushes
2437,470,fuchs fuchs record v medium manual toothbrush,Health & Beauty > Personal Care > Oral Hygiene > Manual Toothbrushes
2438,470,"colgate soft extra clean toothbrush, each",Health & Beauty > Personal Care > Oral Hygiene > Manual Toothbrushes
2439,470,"oral-b pro-health for me crossaction toothbrush, each",Health & Beauty > Personal Care > Oral Hygiene > Manual Toothbrushes
2440,470,oral b toothbrush 17 soft 2 pk,Health & Beauty > Personal Care > Oral Hygiene > Manual Toothbrushes
2441,470,"rite aid smart grip toothbrushes, replace-me bristles, soft, regular, 3 toothbrushes",Health & Beauty > Personal Care > Oral Hygiene > Manual Toothbrushes
2442,470,"oral b pro-health toothbrush, medium, 1 toothbrush",Health & Beauty > Personal Care > Oral Hygiene > Manual Toothbrushes
2443,470,firefly kids! ready go light-up timer toothbrush,Health & Beauty > Personal Care > Oral Hygiene > Manual Toothbrushes
2444,470,"oral-b 3d white advantage vivid toothbrush, full head, medium",Health & Beauty > Personal Care > Oral Hygiene > Manual Toothbrushes
2445,470,"colgate kids my first toothbrush, ...",Health & Beauty > Personal Care > Oral Hygiene > Manual Toothbrushes
2446,470,"firefly kids! light-up timer toothbrushes, soft - 2 pack",Health & Beauty > Personal Care > Oral Hygiene > Manual Toothbrushes
2447,470,oral-b sensitive toothbrush extra soft,Health & Beauty > Personal Care > Oral Hygiene > Manual Toothbrushes
2448,470,firey lightup timer toothbrush - soft (2 count ),Health & Beauty > Personal Care > Oral Hygiene > Manual Toothbrushes
2449,470,"colgate 360 optic white toothbrush, soft",Health & Beauty > Personal Care > Oral Hygiene > Manual Toothbrushes
2450,470,"colgate wave zigzag toothbrushes, ...",Health & Beauty > Personal Care > Oral Hygiene > Manual Toothbrushes
2451,470,saturday knight ltd. beach time toothbrush,Health & Beauty > Personal Care > Oral Hygiene > Manual Toothbrushes
2452,470,"colgate 360 optic white toothbrushes, full head, soft - 2 pack",Health & Beauty > Personal Care > Oral Hygiene > Manual Toothbrushes
2453,470,oral-b pro-health all-in-one 40 so...,Health & Beauty > Personal Care > Oral Hygiene > Manual Toothbrushes
2454,470,dr. fresh angry birds turbo toothbrush,Health & Beauty > Personal Care > Oral Hygiene > Manual Toothbrushes
2455,470,marvel firefly ready go brush spider-man light up timer toothbrush,Health & Beauty > Personal Care > Oral Hygiene > Manual Toothbrushes
2456,470,xlear - spry kid's bamboo toothbrush soft bristle - twin pack,Health & Beauty > Personal Care > Oral Hygiene > Manual Toothbrushes
2457,470,oral-b pulsar pulsar toothbrushes,Health & Beauty > Personal Care > Oral Hygiene > Manual Toothbrushes
2458,470,colgate wave toothbrush 4 pack,Health & Beauty > Personal Care > Oral Hygiene > Manual Toothbrushes
2459,470,"colgate extra clean toothbrush, full head, soft (color varies)",Health & Beauty > Personal Care > Oral Hygiene > Manual Toothbrushes
2460,470,reach crystal clean toothbrush,Health & Beauty > Personal Care > Oral Hygiene > Manual Toothbrushes
2461,470,firefly ready go brush star wars soft toothbrush,Health & Beauty > Personal Care > Oral Hygiene > Manual Toothbrushes
2462,470,kids oral-b toothbrushes,Health & Beauty > Personal Care > Oral Hygiene > Manual Toothbrushes
2463,470,value pack 3d white radiant soft toothbrushes,Health & Beauty > Personal Care > Oral Hygiene > Manual Toothbrushes
2464,470,tom's of maine naturally clean soft toothbrush (colors may vary),Health & Beauty > Personal Care > Oral Hygiene > Manual Toothbrushes
2465,470,"oral-b pro-health clinical pro-flex toothbrush with flexing sides, 40s - soft, 2 count",Health & Beauty > Personal Care > Oral Hygiene > Manual Toothbrushes
2466,470,oral-b indicator contour clea - 2.00 ct,Health & Beauty > Personal Care > Oral Hygiene > Manual Toothbrushes
2467,470,colgate extra clean toothbrush - 4.00 ct,Health & Beauty > Personal Care > Oral Hygiene > Manual Toothbrushes
2468,470,reach advanced design soft v - 1.00 ct,Health & Beauty > Personal Care > Oral Hygiene > Manual Toothbrushes
2469,470,oral-b 3d white vivid 40 soft - 1.00 ct,Health & Beauty > Personal Care > Oral Hygiene > Manual Toothbrushes
2470,470,colgate toothbrushes - 360 deg - 2.00 ct,Health & Beauty > Personal Care > Oral Hygiene > Manual Toothbrushes
2471,470,totz kids toothbrush,Health & Beauty > Personal Care > Oral Hygiene > Manual Toothbrushes
2472,470,colgate 360 total advanced toothbrush soft - 1 count,Health & Beauty > Personal Care > Oral Hygiene > Manual Toothbrushes
2473,470,zututh toothbrushes manual medium,Health & Beauty > Personal Care > Oral Hygiene > Manual Toothbrushes
2474,470,"bass brushes, the green brush toothbrush",Health & Beauty > Personal Care > Oral Hygiene > Manual Toothbrushes
2475,470,"radius, kidz toothbrush, very soft, 6yrs+. right hand, purple, 1 toothbrush",Health & Beauty > Personal Care > Oral Hygiene > Manual Toothbrushes
2476,470,"full head toothbrush, soft colgate maxwhite 1.0 ea",Health & Beauty > Personal Care > Oral Hygiene > Manual Toothbrushes
2477,470,3d white toothbrush small/soft oral-b advantage,Health & Beauty > Personal Care > Oral Hygiene > Manual Toothbrushes
2478,470,pronamel toothbrush sensodyne 1.0 ea,Health & Beauty > Personal Care > Oral Hygiene > Manual Toothbrushes
2479,470,perio toothbrush ultra soft & super slim dr. collins 1.0 ea,Health & Beauty > Personal Care > Oral Hygiene > Manual Toothbrushes
2480,470,"whole mouth clean toothbrush, value pack colgate 360 4.0 ea",Health & Beauty > Personal Care > Oral Hygiene > Manual Toothbrushes
2481,470,"colgate kids teenage mutant ninja turtle toothbrush, twin pack",Health & Beauty > Personal Care > Oral Hygiene > Manual Toothbrushes
2482,470,colgate wave zig zag toothbrush medium 2.0 ea,Health & Beauty > Personal Care > Oral Hygiene > Manual Toothbrushes
2483,470,web.bbb teething toothbrush for,Health & Beauty > Personal Care > Oral Hygiene > Manual Toothbrushes
2484,470,smartgrip toothbrush full walgreens 3.0 ea,Health & Beauty > Personal Care > Oral Hygiene > Manual Toothbrushes
2485,470,portable mini-brush max fresh peppermint colgate wisp,Health & Beauty > Personal Care > Oral Hygiene > Manual Toothbrushes
2486,470,"g-u-m sea friends, soft toothbrush for kids, 220rb 1.0 ea",Health & Beauty > Personal Care > Oral Hygiene > Manual Toothbrushes
2487,470,pulsar toothbrushes oral-b,Health & Beauty > Personal Care > Oral Hygiene > Manual Toothbrushes
2488,470,"toothbrush, dora the explorer extra soft colgate kids 1.0 ea",Health & Beauty > Personal Care > Oral Hygiene > Manual Toothbrushes
2489,470,oral-b pro-health pro-health clinical pro-flex medium toothbrush 2.0 ea,Health & Beauty > Personal Care > Oral Hygiene > Manual Toothbrushes
2490,470,firefly kids! hello kitty ready go brush 1.0 ea,Health & Beauty > Personal Care > Oral Hygiene > Manual Toothbrushes
2491,470,sanrio hello kitty flashing toothbrush w/cap dinner,Health & Beauty > Personal Care > Oral Hygiene > Manual Toothbrushes
2492,470,mam learn to brush toothbrush set in yellow yellow set of 2,Health & Beauty > Personal Care > Oral Hygiene > Manual Toothbrushes
2493,470,crest kids' sesame street toothbrush,Health & Beauty > Personal Care > Oral Hygiene > Manual Toothbrushes
2494,470,brush buddies toothbrush - smurfs - 4 pk,Health & Beauty > Personal Care > Oral Hygiene > Manual Toothbrushes
2495,470,"radius original toothbrush, right hand-assorted colors-2 pack",Health & Beauty > Personal Care > Oral Hygiene > Manual Toothbrushes
2496,470,firefly spiderman flashing sculpted toothbrush 42 mm,Health & Beauty > Personal Care > Oral Hygiene > Manual Toothbrushes
