,category_id,description,category_path
3061,473,"xtech xhst-100 oral hygiene ultra high powered 40,000vpm, 5 brushing modes, rechargeable electric ultrasonic toothbrush with charging dock & built-in",Health & Beauty > Personal Care > Oral Hygiene > Power Toothbrushes & Accessories
3062,473,"SoniShare - Philips Sonicare Replacement Heads Proresults 20-Pack, Replaces Most Sonicare Toothbrush Heads, Fits: Diamond Clean | Easy Clean | Healthy White | Plaque Control | Flex Care | Gum Control",Health & Beauty > Personal Care > Oral Hygiene > Power Toothbrushes & Accessories
3063,473,new set of 4 replacement toothbrush heads for philips sonicare kid's toothbrush,Health & Beauty > Personal Care > Oral Hygiene > Power Toothbrushes & Accessories
3064,473,generic oral-b dual clean,Health & Beauty > Personal Care > Oral Hygiene > Power Toothbrushes & Accessories
3065,473,"philips sonicare hx6066/70 diamondclean standard brush heads, 6-pack new",Health & Beauty > Personal Care > Oral Hygiene > Power Toothbrushes & Accessories
3066,473,"philips sonicare cleancare hx5910 power toothbrush with quadpacer ***twin pack*** (2 handles, 3 standard brush heads, 2 charger bases, & 2 travel case",Health & Beauty > Personal Care > Oral Hygiene > Power Toothbrushes & Accessories
3067,473,"Philips Sonicare for Kids Ice Age, Connected, HX6321/05",Health & Beauty > Personal Care > Oral Hygiene > Power Toothbrushes & Accessories
3068,473,"violight slim sonic toothbrush, bubbles",Health & Beauty > Personal Care > Oral Hygiene > Power Toothbrushes & Accessories
3069,473,"Philips Sonicare Flexcare Plus Sonic Electric Toothbrush, HX6921/30",Health & Beauty > Personal Care > Oral Hygiene > Power Toothbrushes & Accessories
3070,473,"colgate 360 optic white battery toothbrush, soft",Health & Beauty > Personal Care > Oral Hygiene > Power Toothbrushes & Accessories
3071,473,philips sonicare hx6772/74,Health & Beauty > Personal Care > Oral Hygiene > Power Toothbrushes & Accessories
3072,473,20 Replacement Brush Heads Compatible with Oral-B Electric Toothbrush Handles,Health & Beauty > Personal Care > Oral Hygiene > Power Toothbrushes & Accessories
3073,473,braun 4729-630 toothbrush power handle 1 speed,Health & Beauty > Personal Care > Oral Hygiene > Power Toothbrushes & Accessories
3074,473,"violife vs2t542-purple python slim sonic toothbrush, multi python",Health & Beauty > Personal Care > Oral Hygiene > Power Toothbrushes & Accessories
3075,473,"Philips Sonicare Diamond Clean Rechargeable Toothbrush w/Deep Clean Mode with Adaptive Clean Brush Head, Amethyst",Health & Beauty > Personal Care > Oral Hygiene > Power Toothbrushes & Accessories
3076,473,panasonic wew0927w replacement standard brush for ew-dl80-s and ew-dl91-w tooth brush,Health & Beauty > Personal Care > Oral Hygiene > Power Toothbrushes & Accessories
3077,473,"Standard Compatible Replacement Toothbrush Heads 4-pack. replaces Philips Sonicare HX6014 ProResults, fits DiamondClean, EasyClean, FlexCare series, HealthyWhite, Plaque Control & Gum Health Handles.",Health & Beauty > Personal Care > Oral Hygiene > Power Toothbrushes & Accessories
3078,473,"Sonishare Premium Replacement Toothbrush Heads, replaces HX6053/54 - 4 Pack (Other Quantities Also Available) - Fits Diamond Clean | Easy Clean | Healthy White | Plaque Control | Flex Care",Health & Beauty > Personal Care > Oral Hygiene > Power Toothbrushes & Accessories
3079,473,singing brush buddies ylvis what does the fox say musical electric toothbrush,Health & Beauty > Personal Care > Oral Hygiene > Power Toothbrushes & Accessories
3080,473,oral-b pro-health for me rechargeable power toothbrush including 2 sensitive clean refills 1 kit,Health & Beauty > Personal Care > Oral Hygiene > Power Toothbrushes & Accessories
3081,473,philips sonicare hx7022/66,Health & Beauty > Personal Care > Oral Hygiene > Power Toothbrushes & Accessories
3082,473,"spinbrush proclean medium bristle replacement heads, 2 heads (pack of 2)",Health & Beauty > Personal Care > Oral Hygiene > Power Toothbrushes & Accessories
3083,473,"oral b crossaction power toothbrush, soft b1010s (pack of 3) (colors may vary)",Health & Beauty > Personal Care > Oral Hygiene > Power Toothbrushes & Accessories
3084,473,"20 Pcs. (5x4) E-Cron® Toothbrush heads, Replacement for Philips Sonicare ProResults. Fully Compatible With The",Health & Beauty > Personal Care > Oral Hygiene > Power Toothbrushes & Accessories
3085,473,Colgate Teenage Mutant Ninja Turtles Talking Powered Toothbrush,Health & Beauty > Personal Care > Oral Hygiene > Power Toothbrushes & Accessories
3086,473,"Generic Floss Action Replacement Heads for Oral B Toothbrushes, 8 Pack [4, 12, 20 Packs Available]",Health & Beauty > Personal Care > Oral Hygiene > Power Toothbrushes & Accessories
3087,473,"Value Pack: Philips Sonicare HX7052 Eseries Toothbrush Head Sensitive 2 Pack, and Maxfloss Dental Floss",Health & Beauty > Personal Care > Oral Hygiene > Power Toothbrushes & Accessories
3088,473,oral-b vitality prowhite rechargeable electric toothbrush 1 count,Health & Beauty > Personal Care > Oral Hygiene > Power Toothbrushes & Accessories
3089,473,Philips Sonicare Ice Age Connected Tooth Brushes for Kids,Health & Beauty > Personal Care > Oral Hygiene > Power Toothbrushes & Accessories
3090,473,philips sonicare e-series replacement brush head standard hx7022/64 - 2 ct,Health & Beauty > Personal Care > Oral Hygiene > Power Toothbrushes & Accessories
3091,473,oral-b pro-health stages jake and the neverland pirates power kid's toothbrush 1 count health and beauty,Health & Beauty > Personal Care > Oral Hygiene > Power Toothbrushes & Accessories
3092,473,"sonimart compact replacement toothbrush heads 4-pack, compatible for philips sonicare hx6023 proresults compact, fits philips diamondclean, easyclean, new",Health & Beauty > Personal Care > Oral Hygiene > Power Toothbrushes & Accessories
3093,473,oral-b professional floss action replacement brush head 2 count,Health & Beauty > Personal Care > Oral Hygiene > Power Toothbrushes & Accessories
3094,473,"Philips Sonicare for Kids Ice Age, Bluetooth Connected Rechargeable Electric Toothbrush, HX6321/05",Health & Beauty > Personal Care > Oral Hygiene > Power Toothbrushes & Accessories
3095,473,"oral-b cross action replacement electric toothbrush heads for use on most oral-b rechargeable handles, 3 count",Health & Beauty > Personal Care > Oral Hygiene > Power Toothbrushes & Accessories
3096,473,oral b crossaction power,Health & Beauty > Personal Care > Oral Hygiene > Power Toothbrushes & Accessories
3097,473,Naturebelle New Replacement Charger Base AC Power for Philips HX5100 6732 E-series Electric Toothbrush,Health & Beauty > Personal Care > Oral Hygiene > Power Toothbrushes & Accessories
3098,473,electric toothbrush heads - set of 4 - compatible with braun oral b professional floss action replacement brush head - small pulse bristles provide a,Health & Beauty > Personal Care > Oral Hygiene > Power Toothbrushes & Accessories
3099,473,philips sonicare hx5610/01,Health & Beauty > Personal Care > Oral Hygiene > Power Toothbrushes & Accessories
3100,473,philips sonicare hx9023/64 pro results plaque control brush heads health and beauty,Health & Beauty > Personal Care > Oral Hygiene > Power Toothbrushes & Accessories
3101,473,philips sonicare hx5610/04,Health & Beauty > Personal Care > Oral Hygiene > Power Toothbrushes & Accessories
3102,473,"Philips Sonicare Essence 5600 Sonic Electric Rechargeable Toothbrush, White, HX5610/01",Health & Beauty > Personal Care > Oral Hygiene > Power Toothbrushes & Accessories
3103,473,"philips sonicare toothbrush e series generic replacement heads fits: essence, xtreme, elite and advance (4-pack)",Health & Beauty > Personal Care > Oral Hygiene > Power Toothbrushes & Accessories
3104,473,WILL CHARGE ALL FLEXCARE 900 SERIES TOOTHBRUSH HANDLES & HEALTHY WHITE 700 SERIES TOOTHBRUSH HANDLES - Philips Sonicare Flexcare & Healthy White Sanitizer/charger Model Hx6150 - Bulk Package,Health & Beauty > Personal Care > Oral Hygiene > Power Toothbrushes & Accessories
3105,473,Generic Oral-B Floss Action Replacement Toothbrush Heads 4 Pack,Health & Beauty > Personal Care > Oral Hygiene > Power Toothbrushes & Accessories
3106,473,"electric toothbrush heads - set of 4 - toothbrush heads - diamondclean - sonicare toothbrush heads, philips sonicare toothbrush heads, philips electri",Health & Beauty > Personal Care > Oral Hygiene > Power Toothbrushes & Accessories
3107,473,Littlebird4 Generic Replacement Brush Heads HX6013 HX6014 ProResults Compatible with Philips Sonicare Electric Toothbrush (4),Health & Beauty > Personal Care > Oral Hygiene > Power Toothbrushes & Accessories
3108,473,waterpik srsb-3w compact brush head,Health & Beauty > Personal Care > Oral Hygiene > Power Toothbrushes & Accessories
3109,473,"12x generic philips sonicare proresults hx6014 compatible with diamondclean, flexcare, flexcare+, healthywhite, sensitive, easyclean replacement brush",Health & Beauty > Personal Care > Oral Hygiene > Power Toothbrushes & Accessories
3110,473,16 oral-b dual clean,Health & Beauty > Personal Care > Oral Hygiene > Power Toothbrushes & Accessories
3111,473,"Spinbrush ARM & HAMMER Pro Series Daily Clean Battery Toothbrush Refills, Soft",Health & Beauty > Personal Care > Oral Hygiene > Power Toothbrushes & Accessories
3112,473,braun oral-b eb17-4 precision clean compatible replacement soft bristles electric toothbrush heads - 16 pack,Health & Beauty > Personal Care > Oral Hygiene > Power Toothbrushes & Accessories
3113,473,"violife slim sonic toothbrush, silver",Health & Beauty > Personal Care > Oral Hygiene > Power Toothbrushes & Accessories
3114,473,violight slim sonic toothbrush (florida),Health & Beauty > Personal Care > Oral Hygiene > Power Toothbrushes & Accessories
3115,473,Generic Cross Action toothbrush Replacement head-Oral-B (8),Health & Beauty > Personal Care > Oral Hygiene > Power Toothbrushes & Accessories
3116,473,"philips sonicare hx6013/66 pro results brush head (generic), standard, 8 units new",Health & Beauty > Personal Care > Oral Hygiene > Power Toothbrushes & Accessories
3117,473,Disney Descendants Battery Powered Kids Spinbrush Toothbrush ~ Mal,Health & Beauty > Personal Care > Oral Hygiene > Power Toothbrushes & Accessories
3118,473,replacement normal brush head - 4 pack new,Health & Beauty > Personal Care > Oral Hygiene > Power Toothbrushes & Accessories
3119,473,New Philips Premium Sonicare Hx6962 Flexcare Rechargeable Sonic Toothbrush,Health & Beauty > Personal Care > Oral Hygiene > Power Toothbrushes & Accessories
3120,473,philips sonicare hx9382/05 diamondclean rechargeable electric toothbrush dental professional,Health & Beauty > Personal Care > Oral Hygiene > Power Toothbrushes & Accessories
3121,473,"oral-b power dual clean replacement electric toothbrush head,3 count",Health & Beauty > Personal Care > Oral Hygiene > Power Toothbrushes & Accessories
3122,473,violife vs2t707 slim sonic,Health & Beauty > Personal Care > Oral Hygiene > Power Toothbrushes & Accessories
3123,473,"SoniShare Replacement Toothbrush Heads for Philips Sonicare Proresults, 20 Pack",Health & Beauty > Personal Care > Oral Hygiene > Power Toothbrushes & Accessories
3124,473,oral-b crossaction replacement electric toothbrush head refills 2 count,Health & Beauty > Personal Care > Oral Hygiene > Power Toothbrushes & Accessories
3125,473,cybersonic 2 replacement brush heads (8 pack),Health & Beauty > Personal Care > Oral Hygiene > Power Toothbrushes & Accessories
3126,473,generic toothbrush heads for braun oral-b eb17-4,Health & Beauty > Personal Care > Oral Hygiene > Power Toothbrushes & Accessories
3127,473,"SoniShare Premium E-Series Replacement Heads for Philips Sonicare Toothbrushes, 2 Pack [1, 4, 8 Packs Available]",Health & Beauty > Personal Care > Oral Hygiene > Power Toothbrushes & Accessories
3128,473,"philips sonicare flexcare rechargeable sonic toothbrush premium edition 2 pack bundle (2 flexcare handles, 2 diamond clean standard brush heads, 1 compact travel charger, 2 hygienic travel caps, 2 hard travel cases, 1 uv sanitizer)",Health & Beauty > Personal Care > Oral Hygiene > Power Toothbrushes & Accessories
3129,473,iBrush Elite SonicWave Electric Toothbrush with UV Sanitizer (White),Health & Beauty > Personal Care > Oral Hygiene > Power Toothbrushes & Accessories
3130,473,philips sonicare plaque control plus rechargeable toothbrush 2-pack hx6254/81,Health & Beauty > Personal Care > Oral Hygiene > Power Toothbrushes & Accessories
3131,473,"Sonimart Premium Compact Replacement Toothbrush Heads 4-pack, replaces Philips Sonicare HX6023 ProResults Compact",Health & Beauty > Personal Care > Oral Hygiene > Power Toothbrushes & Accessories
3132,473,oral-b professional deep sweep triaction 1000 rechargable electric toothbrush,Health & Beauty > Personal Care > Oral Hygiene > Power Toothbrushes & Accessories
3133,473,waterpik complete care 50 water flosser and triple sonic toothbrush white,Health & Beauty > Personal Care > Oral Hygiene > Power Toothbrushes & Accessories
3134,473,philips sonicare 3 series gum health rechargeable sonic toothbrush persian green,Health & Beauty > Personal Care > Oral Hygiene > Power Toothbrushes & Accessories
3135,473,arm & hammer spinbrush kids thomas & friends powered toothbrush - 1 ea,Health & Beauty > Personal Care > Oral Hygiene > Power Toothbrushes & Accessories
3136,473,"philips sonicare diamondclean sonic toothbrush, hx9332 - 1 ea",Health & Beauty > Personal Care > Oral Hygiene > Power Toothbrushes & Accessories
3137,473,philips sonicare hx6731/02 healthywhite rechargeable electric toothbrush - 1 ea,Health & Beauty > Personal Care > Oral Hygiene > Power Toothbrushes & Accessories
3138,473,"philips sonicare e-series sensitive standard brushheads, hx7053/64 - 3 ea",Health & Beauty > Personal Care > Oral Hygiene > Power Toothbrushes & Accessories
3139,473,"arm & hammer spinbrush pro-clean replacement brush heads, medium - 2 ea",Health & Beauty > Personal Care > Oral Hygiene > Power Toothbrushes & Accessories
3140,473,oral-b complete action anti-microbial power toothbrush replacement head - 2 ea,Health & Beauty > Personal Care > Oral Hygiene > Power Toothbrushes & Accessories
3141,473,philips sonicare hx9043/64 adaptive clean brush heads - 3 ea,Health & Beauty > Personal Care > Oral Hygiene > Power Toothbrushes & Accessories
3142,473,"colgate 360 optic white replacement brush heads, soft - 2 ea",Health & Beauty > Personal Care > Oral Hygiene > Power Toothbrushes & Accessories
3143,473,"philips sonicare for kids bluetooth connected rechargeable electric toothbrush, hx6321/02 - 1 ea",Health & Beauty > Personal Care > Oral Hygiene > Power Toothbrushes & Accessories
3144,473,philips sonicare hx6921/02 flexcare plus rechargeable electric toothbrush - 1 ea,Health & Beauty > Personal Care > Oral Hygiene > Power Toothbrushes & Accessories
3145,473,oral-b pro 500 electric rechargeable toothbrush with precision clean brush head - 1 ea,Health & Beauty > Personal Care > Oral Hygiene > Power Toothbrushes & Accessories
3146,473,"spinbrush by arm & hammer pro-clean toothbrush, soft - 1 ea",Health & Beauty > Personal Care > Oral Hygiene > Power Toothbrushes & Accessories
3147,473,sonicare replacement toothbrush heads (pack of 12),Health & Beauty > Personal Care > Oral Hygiene > Power Toothbrushes & Accessories
3148,473,"philips sonicare hx6062/64 diamondclean standard replacement brush heads, 2-pack",Health & Beauty > Personal Care > Oral Hygiene > Power Toothbrushes & Accessories
3149,473,pursonic s1 toothbrush uv sanitizer,Health & Beauty > Personal Care > Oral Hygiene > Power Toothbrushes & Accessories
3150,473,oral-b pro-health jr. featuring disney's frozen battery toothbrush,Health & Beauty > Personal Care > Oral Hygiene > Power Toothbrushes & Accessories
3151,473,philips sonicare series 2 steel powered toothbrush,Health & Beauty > Personal Care > Oral Hygiene > Power Toothbrushes & Accessories
3152,473,philips sonicare diamondclean hx9372/04 amethyst edition,Health & Beauty > Personal Care > Oral Hygiene > Power Toothbrushes & Accessories
3153,473,"sonicare essence electric toothbrush set, hx5612/09 bonus offer pack with free brush head (value $12) 3.4"" x 6.8"" x 8.5""",Health & Beauty > Personal Care > Oral Hygiene > Power Toothbrushes & Accessories
3154,473,oralb deep sweep 1000 electric rechargeable power toothbrush 3 pc mail in rebate available,Health & Beauty > Personal Care > Oral Hygiene > Power Toothbrushes & Accessories
3155,473,"philips sonicare plaque control electric toothbrush holiday pack, 3 pc",Health & Beauty > Personal Care > Oral Hygiene > Power Toothbrushes & Accessories
3156,473,arm hammer pro clean replacement brush heads 2ct,Health & Beauty > Personal Care > Oral Hygiene > Power Toothbrushes & Accessories
3157,473,"philips sonicare hx5620/20 essence 5600 rechargeable electric toothbrush, green (instant coupon applied)",Health & Beauty > Personal Care > Oral Hygiene > Power Toothbrushes & Accessories
3158,473,arm hammer spinbrush pro series ultra white soft replacement heads 2 count,Health & Beauty > Personal Care > Oral Hygiene > Power Toothbrushes & Accessories
3159,473,oralb pro 5000 dual electric rechargeable toothbrush w bluetooth connectivity,Health & Beauty > Personal Care > Oral Hygiene > Power Toothbrushes & Accessories
3160,473,brushpoint vital health sonic power oral care system,Health & Beauty > Personal Care > Oral Hygiene > Power Toothbrushes & Accessories
3161,473,"oral-b pc 1000 electric toothbrush, additional saving coupon applied $10 off, now only $26.00",Health & Beauty > Personal Care > Oral Hygiene > Power Toothbrushes & Accessories
3162,473,"oral-b healthy clean precision 1000 rechargeable toothbrush, 4 pc (limited time $10 instant coupon applied and $15-mail-in-rebate available)",Health & Beauty > Personal Care > Oral Hygiene > Power Toothbrushes & Accessories
3163,473,"oral-b complete action deep clean replacement power toothbrush head, 2 count 0.5"" x 1.3"" x 9.7""",Health & Beauty > Personal Care > Oral Hygiene > Power Toothbrushes & Accessories
3164,473,"oral-b healthy clean precision 1000 rechargeable toothbrush, 4 pc",Health & Beauty > Personal Care > Oral Hygiene > Power Toothbrushes & Accessories
3165,473,"philips sonicare hx7023/64 e-series standard brush heads, 3 count (instant coupon applied)",Health & Beauty > Personal Care > Oral Hygiene > Power Toothbrushes & Accessories
3166,473,oral-b deepsweep 4000 toothbrush twin pack,Health & Beauty > Personal Care > Oral Hygiene > Power Toothbrushes & Accessories
3167,473,oral-b pc 1000 electric toothbrush pack (limited time $10 instant coupon applied and $15-mail-in-rebate available),Health & Beauty > Personal Care > Oral Hygiene > Power Toothbrushes & Accessories
3168,473,oralb pulsar battery powered toothbrush soft,Health & Beauty > Personal Care > Oral Hygiene > Power Toothbrushes & Accessories
3169,473,"oral-b healthy clean precision 1000 rechargeable toothbrush, 4 pc 9.961"" x 2.165"" x 4.37""",Health & Beauty > Personal Care > Oral Hygiene > Power Toothbrushes & Accessories
3170,473,oral-b pro-health for me rechargeable toothbrush,Health & Beauty > Personal Care > Oral Hygiene > Power Toothbrushes & Accessories
3171,473,"philips sonicare hx5630/50 essence 5600 rechargeable electric toothbrush, pink (instant coupon applied)",Health & Beauty > Personal Care > Oral Hygiene > Power Toothbrushes & Accessories
3172,473,oralb professional precision clean replacement electric toothbrush heads 2 count,Health & Beauty > Personal Care > Oral Hygiene > Power Toothbrushes & Accessories
3173,473,"oral-b pro-health stages power finding dory toothbrush, soft",Health & Beauty > Personal Care > Oral Hygiene > Power Toothbrushes & Accessories
3174,473,oral-b sensitive clean power toothbrush refi...,Health & Beauty > Personal Care > Oral Hygiene > Power Toothbrushes & Accessories
3175,473,"SoniShare - Premium E-Series Replacement Toothbrush Heads 1, 2, 4, 8 Packs - Compatible with the Following Handles Advance | CleanCare| Elite | Essence | Xtreme (2)",Health & Beauty > Personal Care > Oral Hygiene > Power Toothbrushes & Accessories
3176,473,philips sonicare hx5612/08,Health & Beauty > Personal Care > Oral Hygiene > Power Toothbrushes & Accessories
3177,473,"gum go betweens proxabrush refills, wide, 8-count packages (pack of 12)",Health & Beauty > Personal Care > Oral Hygiene > Power Toothbrushes & Accessories
3178,473,"Jetpik Sonic toothbrush tip, General use, (2) Pack",Health & Beauty > Personal Care > Oral Hygiene > Power Toothbrushes & Accessories
3179,473,Philips Sonicare HX8332/11 Airfloss Ultra,Health & Beauty > Personal Care > Oral Hygiene > Power Toothbrushes & Accessories
3180,473,"Violight Violife VS2T713 Slim Sonic Series Electric Toothbrush, Leo Style, 2.4 Ounce",Health & Beauty > Personal Care > Oral Hygiene > Power Toothbrushes & Accessories
3181,473,oral-b pro 1000 electric,Health & Beauty > Personal Care > Oral Hygiene > Power Toothbrushes & Accessories
3182,473,Littlebird4 Generic Replacement Brush Heads HX6013 HX6014 ProResults Compatible with Philips Sonicare Electric Toothbrush (8),Health & Beauty > Personal Care > Oral Hygiene > Power Toothbrushes & Accessories
3183,473,"gum go betweens proxabrush refills, wide, 8-count packages (pack of 6) new",Health & Beauty > Personal Care > Oral Hygiene > Power Toothbrushes & Accessories
3184,473,replacement heads for rechargeable electric toothbrush by toilettree products. twin pack (black),Health & Beauty > Personal Care > Oral Hygiene > Power Toothbrushes & Accessories
3185,473,spinbrush pro sensitive ultra soft replacement brush heads,Health & Beauty > Personal Care > Oral Hygiene > Power Toothbrushes & Accessories
3186,473,philips sonicare flexcare platinum without sanitzer series 8 hx9181/04,Health & Beauty > Personal Care > Oral Hygiene > Power Toothbrushes & Accessories
3187,473,"Premium Replacement Toothbrush Heads For Phillips Sonicare (4-pack), fits DiamondClean, EasyClean, HydroClean, FlexCare series, HealthyWhite, Plaque Control and Gum Health Handles.",Health & Beauty > Personal Care > Oral Hygiene > Power Toothbrushes & Accessories
3188,473,philips sonicare for kids electric toothbrush purple,Health & Beauty > Personal Care > Oral Hygiene > Power Toothbrushes & Accessories
3189,473,oralb precision clean replacement toothbrush heads for select oralb electric toothbrushes 3pack blue,Health & Beauty > Personal Care > Oral Hygiene > Power Toothbrushes & Accessories
3190,473,oralb pro 5000 smart rechargeable bluetooth toothbrush white,Health & Beauty > Personal Care > Oral Hygiene > Power Toothbrushes & Accessories
3191,473,philips sonicare eseries standard screwon toothbrush heads 3pack white,Health & Beauty > Personal Care > Oral Hygiene > Power Toothbrushes & Accessories
3192,473,philips sonicare healthy white bonus power toothbrush kit white,Health & Beauty > Personal Care > Oral Hygiene > Power Toothbrushes & Accessories
3193,473,"philips sonicare e-series standard brushheads, hx7023/64 - 3 ea",Health & Beauty > Personal Care > Oral Hygiene > Power Toothbrushes & Accessories
3194,473,oral-b 3d white power toothbrush - 1 ea,Health & Beauty > Personal Care > Oral Hygiene > Power Toothbrushes & Accessories
3195,473,philips sonicare pro results sensitive brush heads hx6053/62 - 3 ea,Health & Beauty > Personal Care > Oral Hygiene > Power Toothbrushes & Accessories
3196,473,walgreens easyflex floss effects replacement brush heads - 5 each,Health & Beauty > Personal Care > Oral Hygiene > Power Toothbrushes & Accessories
3197,473,oral-b pro-health disney star wars battery toothbrush - 1 ea,Health & Beauty > Personal Care > Oral Hygiene > Power Toothbrushes & Accessories
3198,473,"philips sonicare sonicare for kids replacement brush heads hx6032/64, age 4-7 - 2 ea",Health & Beauty > Personal Care > Oral Hygiene > Power Toothbrushes & Accessories
3199,473,"oral-b precision black 7000 electric toothbrush with smartguide, frustration free packaging - 1 ea",Health & Beauty > Personal Care > Oral Hygiene > Power Toothbrushes & Accessories
3200,473,oral-b professional care deep sweep 5000 power toothbrush with smartguide - 1 ea,Health & Beauty > Personal Care > Oral Hygiene > Power Toothbrushes & Accessories
3201,473,"violife slim sonic fashion toothbrush, orchid shimmer - 1 ea",Health & Beauty > Personal Care > Oral Hygiene > Power Toothbrushes & Accessories
3202,473,philips sonicare hx9362/68 diamondclean rechargeable electric toothbrush,Health & Beauty > Personal Care > Oral Hygiene > Power Toothbrushes & Accessories
3203,473,"colgate 360 optic white power toothbrush soft, 1ct",Health & Beauty > Personal Care > Oral Hygiene > Power Toothbrushes & Accessories
3204,473,oral b sensitive refill -3 count replacement heads,Health & Beauty > Personal Care > Oral Hygiene > Power Toothbrushes & Accessories
3205,473,philips sonicare hx6921/02 flexcare plus rechargeable electric toothbrush - $25 off,Health & Beauty > Personal Care > Oral Hygiene > Power Toothbrushes & Accessories
3206,473,brushpoint sonic power oral care system,Health & Beauty > Personal Care > Oral Hygiene > Power Toothbrushes & Accessories
3207,473,oral-b pro-health stages kids battery toothbrush featuring disney jake and the never land pirates with,Health & Beauty > Personal Care > Oral Hygiene > Power Toothbrushes & Accessories
3208,473,"philips sonicare hx7022/64 e-series standard replacement brush heads, 2-pack",Health & Beauty > Personal Care > Oral Hygiene > Power Toothbrushes & Accessories
3209,473,"colgate 360 power toothbrush soft, 1ct",Health & Beauty > Personal Care > Oral Hygiene > Power Toothbrushes & Accessories
3210,473,pursonic officially licensed mlb baseball bat team toothbrushes - new york yankees,Health & Beauty > Personal Care > Oral Hygiene > Power Toothbrushes & Accessories
