,category_id,description,category_path
1980,473,oral-b smartseries pro 5000 rechargeable toothbrush,Health & Beauty > Personal Care > Oral Hygiene > Power Toothbrushes & Accessories
1981,473,8-pack: replacement toothbrush heads,Health & Beauty > Personal Care > Oral Hygiene > Power Toothbrushes & Accessories
1982,473,oral b by braun advanced power battery-operated toothbrush,Health & Beauty > Personal Care > Oral Hygiene > Power Toothbrushes & Accessories
1983,473,8-pack: philips sonicare-compatible replacement toothbrush heads - assorted styles,Health & Beauty > Personal Care > Oral Hygiene > Power Toothbrushes & Accessories
1984,473,12-pack: oral-b compatible replacement toothbrush heads?,Health & Beauty > Personal Care > Oral Hygiene > Power Toothbrushes & Accessories
1985,473,oral-b crossaction soft power toothbrush - count,Health & Beauty > Personal Care > Oral Hygiene > Power Toothbrushes & Accessories
1986,473,colgate optic white 360 whitens teeth powered toothbrush - each,Health & Beauty > Personal Care > Oral Hygiene > Power Toothbrushes & Accessories
1987,473,"philips sonicare philips sonicare e-series standard brush heads, hx7023/64",Health & Beauty > Personal Care > Oral Hygiene > Power Toothbrushes & Accessories
1988,473,oral-b oral-b power sensitive replacement electric toothbrush he...,Health & Beauty > Personal Care > Oral Hygiene > Power Toothbrushes & Accessories
1989,473,colgate colgate optic white soft powered toothbrush + built in wh...,Health & Beauty > Personal Care > Oral Hygiene > Power Toothbrushes & Accessories
1990,473,oral-b oral b vitality dual clean rechargeable powered toothbrus...,Health & Beauty > Personal Care > Oral Hygiene > Power Toothbrushes & Accessories
1991,473,"oral-b replacement electric toothbrush heads, 5 ct.",Health & Beauty > Personal Care > Oral Hygiene > Power Toothbrushes & Accessories
1992,473,"spin brush powered kid's marvel heroes toothbrush, each",Health & Beauty > Personal Care > Oral Hygiene > Power Toothbrushes & Accessories
1993,473,equate dual action power toothbrush,Health & Beauty > Personal Care > Oral Hygiene > Power Toothbrushes & Accessories
1994,473,"sonicare diamond clean brush heads, 6-pack - sale price limt 5 on all sonicare brush heads",Health & Beauty > Personal Care > Oral Hygiene > Power Toothbrushes & Accessories
1995,473,oral b pro-health stages disney princess power toothbrush,Health & Beauty > Personal Care > Oral Hygiene > Power Toothbrushes & Accessories
1996,473,up & up 5 ea powered toothbrush head,Health & Beauty > Personal Care > Oral Hygiene > Power Toothbrushes & Accessories
1997,473,oral-b pro care two pack rechargable toothbrush - sale price limit 2,Health & Beauty > Personal Care > Oral Hygiene > Power Toothbrushes & Accessories
1998,473,"oral-b pulsar battery operated toothbrush, soft/regular",Health & Beauty > Personal Care > Oral Hygiene > Power Toothbrushes & Accessories
1999,473,oral-b hello kitty kids powered soft toothbrush,Health & Beauty > Personal Care > Oral Hygiene > Power Toothbrushes & Accessories
2000,473,oral b complete action power deep clean soft toothbrush,Health & Beauty > Personal Care > Oral Hygiene > Power Toothbrushes & Accessories
2001,473,"philips sonicare essence sonic electric toothbrush, white, ffp",Health & Beauty > Personal Care > Oral Hygiene > Power Toothbrushes & Accessories
2002,473,braun oralb oralbrush pc 7000 black electric toothbrush,Health & Beauty > Personal Care > Oral Hygiene > Power Toothbrushes & Accessories
2003,473,"SoniShare Proresults Replacement Heads for Philips Sonicare Toothbrushes, 12 Pack [4, 8, 20 Packs Available]",Health & Beauty > Personal Care > Oral Hygiene > Power Toothbrushes & Accessories
2004,473,"oral b pro-health precision clean battery powered toothbrush, 2 pack",Health & Beauty > Personal Care > Oral Hygiene > Power Toothbrushes & Accessories
2005,473,oral-b deep sweep 1000 electric rechargeable power toothbrush powered by braun,Health & Beauty > Personal Care > Oral Hygiene > Power Toothbrushes & Accessories
2006,473,"philips sonicare hx7003/82 e-series replacement brush heads, 3-pack",Health & Beauty > Personal Care > Oral Hygiene > Power Toothbrushes & Accessories
2007,473,sonicety electric toothbrush hi-928 dream pink (portable/travel size),Health & Beauty > Personal Care > Oral Hygiene > Power Toothbrushes & Accessories
2008,473,CycleMore New Electric Toothbrush Replacment Charger Model 3757 For Braun Oral-b,Health & Beauty > Personal Care > Oral Hygiene > Power Toothbrushes & Accessories
2009,473,Pyle PHLTB41WT Ultrasonic Wave Rechargeable Electric Toothbrush Automatic Charging,Health & Beauty > Personal Care > Oral Hygiene > Power Toothbrushes & Accessories
2010,473,Yijan Waterproof Kids Music Electric Toothbrush Pink,Health & Beauty > Personal Care > Oral Hygiene > Power Toothbrushes & Accessories
2011,473,Kolibree Smart Toothbrush with Games. Sonic toothbrush Educates Kids with Live Feedback and Interactive App,Health & Beauty > Personal Care > Oral Hygiene > Power Toothbrushes & Accessories
2012,473,"Sonishare Premium Soft Replacement Toothbrush Heads, replaces HX6053/54 - 4 Pack (Other Quantities Also Available) - Fits Diamond Clean | Easy Clean | Healthy White | Plaque Control | Flex Care",Health & Beauty > Personal Care > Oral Hygiene > Power Toothbrushes & Accessories
2013,473,"SoniShare Standard Replacement Toothbrush Heads for Philips Sonicare Compact ProResults, 4 Pack [8, 12, 20 Packs Available]",Health & Beauty > Personal Care > Oral Hygiene > Power Toothbrushes & Accessories
2014,473,philips sonicare hx9352/04,Health & Beauty > Personal Care > Oral Hygiene > Power Toothbrushes & Accessories
2015,473,"Generic New Replacement Toothbrush Heads for Oral B Cross Action, 8 Pack [4, 8, 12, 20 Packs Available]",Health & Beauty > Personal Care > Oral Hygiene > Power Toothbrushes & Accessories
2016,473,"Philips Sonicare Flexcare Plus with Sanitizer, Frustration Free Packaging, HX6972/31",Health & Beauty > Personal Care > Oral Hygiene > Power Toothbrushes & Accessories
2017,473,"SoniShare Standard Replacement Toothbrush Heads for Philips Sonicare Diamond Clean, 20 Pack [4, 8, 12, 20 Packs Available]",Health & Beauty > Personal Care > Oral Hygiene > Power Toothbrushes & Accessories
2018,473,20 Soft Sensitive Replacement Toothbrush Heads replaces Philips Sonicare HX6054,Health & Beauty > Personal Care > Oral Hygiene > Power Toothbrushes & Accessories
2019,473,"Philips Sonicare HX6053/64 Standard Ultra Soft Sensitive Brush Heads, 3 Count",Health & Beauty > Personal Care > Oral Hygiene > Power Toothbrushes & Accessories
2020,473,Littlebird4 Gerenic Toothbrush Heads Compatible with Braun Oral B Sonic Complete,Health & Beauty > Personal Care > Oral Hygiene > Power Toothbrushes & Accessories
2021,473,"Sonimart Standard Replacement Toothbrush Heads 4-pack, replaces Philips Sonicare HX6014 ProResults, fits DiamondClean, EasyClean, FlexCare series, Hea",Health & Beauty > Personal Care > Oral Hygiene > Power Toothbrushes & Accessories
2022,473,"sprinbrush pro clean battery powered toothbrush, medium",Health & Beauty > Personal Care > Oral Hygiene > Power Toothbrushes & Accessories
2023,473,spinbrush kids my way electric toothbrush for boys 1 ea,Health & Beauty > Personal Care > Oral Hygiene > Power Toothbrushes & Accessories
2024,473,Oral-B Vitality Deep Sweep Rechargeable Electric Toothbrush Powered by Braun,Health & Beauty > Personal Care > Oral Hygiene > Power Toothbrushes & Accessories
2025,473,hothands disney hands & pocket warmers (40 count),Health & Beauty > Personal Care > Oral Hygiene > Power Toothbrushes & Accessories
2026,473,Value Pack: Philips Sonicare HX6013 Proresults Toothbrush Head Standard 3 Pack,Health & Beauty > Personal Care > Oral Hygiene > Power Toothbrushes & Accessories
2027,473,Philips Sonicare Tonguecare Plus Base Kit,Health & Beauty > Personal Care > Oral Hygiene > Power Toothbrushes & Accessories
2028,473,spinbrush proclean soft,Health & Beauty > Personal Care > Oral Hygiene > Power Toothbrushes & Accessories
2029,473,"Brightdeal E Series Replacement Heads For Philips Sonicare Essence, Xtreme, Elite, Advance (3-pack)",Health & Beauty > Personal Care > Oral Hygiene > Power Toothbrushes & Accessories
2030,473,oral b compatible brush head replacement 4/8/12/16 count for oral b/braun professional care/professional care smartseries/trizone/advance power/pro he health and beauty,Health & Beauty > Personal Care > Oral Hygiene > Power Toothbrushes & Accessories
2031,473,"Sonic-p Replacement Tooth Brush Heads, 4 Pack",Health & Beauty > Personal Care > Oral Hygiene > Power Toothbrushes & Accessories
2032,473,"Standard Replacement Brush Heads for Philips Sonicare HX6014/13 ProResults (4, 8, 12 or 20 Pack) | Fits: Easyclean, DiamondClean, HealthyWhite, Flexcare [12 Pack]",Health & Beauty > Personal Care > Oral Hygiene > Power Toothbrushes & Accessories
2033,473,"Philips Sonicare 2 Series Plaque Control Sonic Electric Rechargeable Toothbrush, Coral,HX6211/28",Health & Beauty > Personal Care > Oral Hygiene > Power Toothbrushes & Accessories
2034,473,waterpik complete care water flosser and sonic toothbrush (wp-900),Health & Beauty > Personal Care > Oral Hygiene > Power Toothbrushes & Accessories
2035,473,oral-b professional precision clean replacement brush head 2 count,Health & Beauty > Personal Care > Oral Hygiene > Power Toothbrushes & Accessories
2036,473,"philips sonicare hx7012/60 e-series compact replacement brush heads, 2-pack",Health & Beauty > Personal Care > Oral Hygiene > Power Toothbrushes & Accessories
2037,473,9 pcs replacement heads,Health & Beauty > Personal Care > Oral Hygiene > Power Toothbrushes & Accessories
2038,473,"Pyle PHLTBS51BK Ultrasonic Wave Rechargeable Electric Toothbrush Automatic Charging Base Dock, Black",Health & Beauty > Personal Care > Oral Hygiene > Power Toothbrushes & Accessories
2039,473,"philips sonicare hx3022/64 powerup brush head, sensitive, 2 count",Health & Beauty > Personal Care > Oral Hygiene > Power Toothbrushes & Accessories
2040,473,oral-b deep sweep 5000 smartseries with bluetooth electric rechargeable power toothbrush,Health & Beauty > Personal Care > Oral Hygiene > Power Toothbrushes & Accessories
2041,473,"pursonic s1 toothbrush sanitizer, 4 ounce health and beauty",Health & Beauty > Personal Care > Oral Hygiene > Power Toothbrushes & Accessories
2042,473,philips sonicare hx6211/04 2 series plaque control rechargeable toothbrush health and beauty,Health & Beauty > Personal Care > Oral Hygiene > Power Toothbrushes & Accessories
2043,473,philips sonicare diamondclean toothbrush 7 series rechargeable electric toothrush dental professional model,Health & Beauty > Personal Care > Oral Hygiene > Power Toothbrushes & Accessories
2044,473,SoniShare Generic New Replacement Toothbrush Heads for Oral B Precision Clean,Health & Beauty > Personal Care > Oral Hygiene > Power Toothbrushes & Accessories
2045,473,waterpik atb-2ab nano-sonic replacement brush,Health & Beauty > Personal Care > Oral Hygiene > Power Toothbrushes & Accessories
2046,473,20 pcs Replacement Brush Heads Compatible with Philips Sonicare Electric Toothbrush - Model HX-6054 - by FolksCare,Health & Beauty > Personal Care > Oral Hygiene > Power Toothbrushes & Accessories
2047,473,"Philips Sonicare Essence Sonic Electric Toothbrush, Solid Pink, HX5661/30",Health & Beauty > Personal Care > Oral Hygiene > Power Toothbrushes & Accessories
2048,473,oral-b pro 1000 electric rechargeable power toothbrush powered by,Health & Beauty > Personal Care > Oral Hygiene > Power Toothbrushes & Accessories
2049,473,"philips sonicare diamondclean sonic electric rechargeable toothbrush, white, hx9332/05",Health & Beauty > Personal Care > Oral Hygiene > Power Toothbrushes & Accessories
2050,473,philips sonicare 2 series plaque control sonic electric toothbrush,Health & Beauty > Personal Care > Oral Hygiene > Power Toothbrushes & Accessories
2051,473,crest spinbrush swirl - powe - 1.00 ct,Health & Beauty > Personal Care > Oral Hygiene > Power Toothbrushes & Accessories
2052,473,oral-b pro care electric toothbrush white/blue,Health & Beauty > Personal Care > Oral Hygiene > Power Toothbrushes & Accessories
2053,473,"vio life slim sonic silver toothbrush one size,silver",Health & Beauty > Personal Care > Oral Hygiene > Power Toothbrushes & Accessories
2054,473,"eco-dent, terradent med5, adult 31, medium, replacement head 3-pak",Health & Beauty > Personal Care > Oral Hygiene > Power Toothbrushes & Accessories
2055,473,"dr. tung's, ionic toothbrush, w/replacement head, 1 toothbrush, 1 replaceable head",Health & Beauty > Personal Care > Oral Hygiene > Power Toothbrushes & Accessories
2056,473,violife — blue polka dot duosonic on-the-go toothbrush set one-size,Health & Beauty > Personal Care > Oral Hygiene > Power Toothbrushes & Accessories
2057,473,dazzlepro — black rechargeable sonic toothbrush & sanitizer set,Health & Beauty > Personal Care > Oral Hygiene > Power Toothbrushes & Accessories
2058,473,"SoniShare - Premium Generic Proresults Replacement Heads for Philips Sonicare Toothbrushes - 4, 8, 12 or 20 Pack (4)",Health & Beauty > Personal Care > Oral Hygiene > Power Toothbrushes & Accessories
2059,473,Braun Oral-B Pro 7000 SmartSeries Electric Toothbrush with Bluetooth Connectivity and Rechargeable Battery - White,Health & Beauty > Personal Care > Oral Hygiene > Power Toothbrushes & Accessories
2060,473,Premium Sonicare E-Series Compatible Generic Replacement Toothbrush Heads,Health & Beauty > Personal Care > Oral Hygiene > Power Toothbrushes & Accessories
2061,473,"Great Value Tech® Sonicare Toothbrush E Series Replacement Heads Fits: Essence, Xtreme, Elite and Advance (2-pack)",Health & Beauty > Personal Care > Oral Hygiene > Power Toothbrushes & Accessories
2062,473,Rotadent Rota-Point Interdental Cleaners NEW Larger 30ct pack,Health & Beauty > Personal Care > Oral Hygiene > Power Toothbrushes & Accessories
2063,473,Braveness New Electric Toothbrush Replacement Charger Model 3757 For Braun Oral-b,Health & Beauty > Personal Care > Oral Hygiene > Power Toothbrushes & Accessories
2064,473,Premium Economical Replacement Toothbrush Heads 4-pack replaces Philips Sonicare,Health & Beauty > Personal Care > Oral Hygiene > Power Toothbrushes & Accessories
2065,473,"oral-b power dual clean replacement electric toothbrush head,3 count quantity: 2",Health & Beauty > Personal Care > Oral Hygiene > Power Toothbrushes & Accessories
2066,473,PURSONIC S520 Black Ultra High Powered Sonic Electric Toothbrush with Dock,Health & Beauty > Personal Care > Oral Hygiene > Power Toothbrushes & Accessories
2067,473,Philips Sonicare 2 Series Plaque Control Rechargeable Toothbrush,Health & Beauty > Personal Care > Oral Hygiene > Power Toothbrushes & Accessories
2068,473,"arm & hammer powered toothbrush replacement heads, medium - 2 ct - 2 pk",Health & Beauty > Personal Care > Oral Hygiene > Power Toothbrushes & Accessories
2069,473,"Philips Sonicare for Kids Connected Sonic Electric Toothbrush, HX6321/02",Health & Beauty > Personal Care > Oral Hygiene > Power Toothbrushes & Accessories
2070,473,emmi-dent annual supply,Health & Beauty > Personal Care > Oral Hygiene > Power Toothbrushes & Accessories
2071,473,philips sonicare hx6042/60 hx6044 sonicare for kids generic brush heads ages 7-10 (4pcs),Health & Beauty > Personal Care > Oral Hygiene > Power Toothbrushes & Accessories
2072,473,Littlebird4 Replacement Brush Heads Compatible with Oral-B Electric Toothbrush(4 Count),Health & Beauty > Personal Care > Oral Hygiene > Power Toothbrushes & Accessories
2073,473,brush buddies 00311-72 justin bieber singing toothbrush,Health & Beauty > Personal Care > Oral Hygiene > Power Toothbrushes & Accessories
2074,473,Oral-b Deep Sweep 1000 Electric Rechargeable Power Toothbrush,Health & Beauty > Personal Care > Oral Hygiene > Power Toothbrushes & Accessories
2075,473,"brushbrite philips sonicare hx6013/66 (generic) proresults toothbrush heads pack of 3 fits diamond clean, flexcare, healthywhite, and easy clean handl",Health & Beauty > Personal Care > Oral Hygiene > Power Toothbrushes & Accessories
2076,473,"philips sonicare hx7053/64 eseries standard sensitive replacement brush heads, 3 pack",Health & Beauty > Personal Care > Oral Hygiene > Power Toothbrushes & Accessories
2077,473,"philips sonicare airfloss rechargeable electric flosser, pink",Health & Beauty > Personal Care > Oral Hygiene > Power Toothbrushes & Accessories
2078,473,"philips sonicare hx6062/94 2 piece diamond clean standard brush heads, black health and beauty",Health & Beauty > Personal Care > Oral Hygiene > Power Toothbrushes & Accessories
2079,473,"oral-b professional deep sweep triaction 1000 rechargeable electric toothbrush, 1 count (packaging may vary) (packaging may vary)",Health & Beauty > Personal Care > Oral Hygiene > Power Toothbrushes & Accessories
2080,473,"SoniShare Replacement Toothbrush Heads for Philips Sonicare Diamond Clean, 8 Pack",Health & Beauty > Personal Care > Oral Hygiene > Power Toothbrushes & Accessories
2081,473,"sonimart standard replacement toothbrush heads 4-pack, compatible for philips sonicare hx6013 proresults standard, fits philips diamondclean, easyclea",Health & Beauty > Personal Care > Oral Hygiene > Power Toothbrushes & Accessories
2082,473,"philips sonicare hx6023/30 proresults compact brush heads, 3 pack",Health & Beauty > Personal Care > Oral Hygiene > Power Toothbrushes & Accessories
2083,473,generic oral-b sonic compatible replacement brush heads (4 ct.),Health & Beauty > Personal Care > Oral Hygiene > Power Toothbrushes & Accessories
2084,473,"Colgate 360 Optic White Sonic Power Toothbrush, Full Head Medium Twin,1 ct",Health & Beauty > Personal Care > Oral Hygiene > Power Toothbrushes & Accessories
2085,473,new set of 8 replacement toothbrush heads for philips sonicare kid's toothbrush new,Health & Beauty > Personal Care > Oral Hygiene > Power Toothbrushes & Accessories
2086,473,cuh ultrasonic toothbrush,Health & Beauty > Personal Care > Oral Hygiene > Power Toothbrushes & Accessories
2087,473,BLACK 7000 SmartSeries with Bluetooth Electric Rechargeable Power Toothbrush Powered by Braun,Health & Beauty > Personal Care > Oral Hygiene > Power Toothbrushes & Accessories
2088,473,oral-b pro 1000 electric rechargeable power toothbrush powered by braun,Health & Beauty > Personal Care > Oral Hygiene > Power Toothbrushes & Accessories
2089,473,waterpik complete care water flosser and sonic toothbrush (wp-900) health and beauty,Health & Beauty > Personal Care > Oral Hygiene > Power Toothbrushes & Accessories
2090,473,"oral-b power dual clean replacement electric toothbrush head,1 count",Health & Beauty > Personal Care > Oral Hygiene > Power Toothbrushes & Accessories
2091,473,"philips sonicare hx7012/64 eseries compact replacement brush heads, 2 count new",Health & Beauty > Personal Care > Oral Hygiene > Power Toothbrushes & Accessories
2092,473,Oral B Toothbrush Heads by Oral-Brite - Designed as a Premium Floss Action Replacement Head Compatible with Braun Electric Toothbrush Handles including Oral-B Toothbrushes with Bluetooth Connectivity,Health & Beauty > Personal Care > Oral Hygiene > Power Toothbrushes & Accessories
2093,473,philips sonicare hx6731/02 healthywhite rechargeable electric toothbrush,Health & Beauty > Personal Care > Oral Hygiene > Power Toothbrushes & Accessories
2094,473,Generic Oral-B Deep Sweep Replacement Electric Toothbrush Head - Pack of 12,Health & Beauty > Personal Care > Oral Hygiene > Power Toothbrushes & Accessories
2095,473,"replacement battery set for braun oral-b sonic complete toothbrush, 1600 mah ni-mh",Health & Beauty > Personal Care > Oral Hygiene > Power Toothbrushes & Accessories
2096,473,"oral-b sensitive gum care replacement electric toothbrush heads for use on most oral-b rechargeable handles, 3 count",Health & Beauty > Personal Care > Oral Hygiene > Power Toothbrushes & Accessories
2097,473,philips sonicare flexcare + handle hx6950 for hx6972 hx6992 hx6921 handle only bulk packaging,Health & Beauty > Personal Care > Oral Hygiene > Power Toothbrushes & Accessories
2098,473,Precision Clean Replacement Electric Toothbrush Head 2 Count,Health & Beauty > Personal Care > Oral Hygiene > Power Toothbrushes & Accessories
2099,473,"philips sonicare hx5610/30 essence 5600 rechargeable electric toothbrush, frustration free packaging",Health & Beauty > Personal Care > Oral Hygiene > Power Toothbrushes & Accessories
2100,473,"philips sonicare pro results gum health replacement toothbrush heads for sonicare electric rechargeable toothbrush, hx9033/64, 3-pack",Health & Beauty > Personal Care > Oral Hygiene > Power Toothbrushes & Accessories
2101,473,greatvaluetechtm generic sonicare standard e-series replacement brush heads (2),Health & Beauty > Personal Care > Oral Hygiene > Power Toothbrushes & Accessories
2102,473,new genuine oem philips hx6100 toothbrush sonicare travel charger base ac power new,Health & Beauty > Personal Care > Oral Hygiene > Power Toothbrushes & Accessories
2103,473,"Pyle PHLTB41WT Ultrasonic Wave Rechargeable Electric Toothbrush Automatic Charging Base Dock, White",Health & Beauty > Personal Care > Oral Hygiene > Power Toothbrushes & Accessories
2104,473,generic oral-b floss action compatible replacement brush heads (4 pk),Health & Beauty > Personal Care > Oral Hygiene > Power Toothbrushes & Accessories
2105,473,8 PCS Generic Philips Compatible Toothbrush Replacement Heads Sonicare P-HX,Health & Beauty > Personal Care > Oral Hygiene > Power Toothbrushes & Accessories
2106,473,oral-b professional healthy clean + gum care precision 3000 rechargeable electric toothbrush 1 count (packaging may vary),Health & Beauty > Personal Care > Oral Hygiene > Power Toothbrushes & Accessories
2107,473,new philip sonicare hx6054,Health & Beauty > Personal Care > Oral Hygiene > Power Toothbrushes & Accessories
2108,473,philips sonicare hx9023/30,Health & Beauty > Personal Care > Oral Hygiene > Power Toothbrushes & Accessories
2109,473,Philips Sonicare Pro Results Plaque Control Brush Head,Health & Beauty > Personal Care > Oral Hygiene > Power Toothbrushes & Accessories
2110,473,"violight vs2t556-girl power slim sonic toothbrush, girl power",Health & Beauty > Personal Care > Oral Hygiene > Power Toothbrushes & Accessories
2111,473,oral-b professional healthy clean + prowhite precision 4000 rechargeable electric toothbrush 1 count health and beauty,Health & Beauty > Personal Care > Oral Hygiene > Power Toothbrushes & Accessories
2112,473,oral-b complete action,Health & Beauty > Personal Care > Oral Hygiene > Power Toothbrushes & Accessories
2113,473,"generic replacement heads compatible with philips sonicare toothbrush e series : essence, xtreme, elite and advance - 4 packs (buy 3 get 1)",Health & Beauty > Personal Care > Oral Hygiene > Power Toothbrushes & Accessories
2114,473,"philips sonicare hx5610/30 essence 5600 rechargeable electric toothbrush, white health and beauty",Health & Beauty > Personal Care > Oral Hygiene > Power Toothbrushes & Accessories
2115,473,spinbrush my way! kid's powered toothbrush,Health & Beauty > Personal Care > Oral Hygiene > Power Toothbrushes & Accessories
2116,473,minnesota twins mlb toothbrush by pursonic,Health & Beauty > Personal Care > Oral Hygiene > Power Toothbrushes & Accessories
2117,473,Ivation Rechargeable Electric Toothbrush w/Sonic Wave Technology & UV Sanitizer - Includes Induction Charging,Health & Beauty > Personal Care > Oral Hygiene > Power Toothbrushes & Accessories
2118,473,"Xtech XHST-100 Oral Hygiene Ultra High Powered 40,000VPM, 5 Brushing Modes, Rechargeable Electric Ultrasonic Toothbrush with Charging Dock & Built-in UV Sanitizer, Includes 3 Brush Heads",Health & Beauty > Personal Care > Oral Hygiene > Power Toothbrushes & Accessories
2119,473,philips sonicare e-series essence replacement brush head 3 pack + free travel case,Health & Beauty > Personal Care > Oral Hygiene > Power Toothbrushes & Accessories
2120,473,philips sonicare airfloss 2,Health & Beauty > Personal Care > Oral Hygiene > Power Toothbrushes & Accessories
2121,473,8 pcs Replacement Brush Heads Compatible with Oral-B Electric Toothbrush - Model EB-18A - Works with all Oral B Brush Handles (except for Sonic models) - by FolksCare(TM),Health & Beauty > Personal Care > Oral Hygiene > Power Toothbrushes & Accessories
2122,473,"spinbrush refill truly radiant toothbrush, deep clean",Health & Beauty > Personal Care > Oral Hygiene > Power Toothbrushes & Accessories
2123,473,spinbrush pro recharge battery powered toothbrush,Health & Beauty > Personal Care > Oral Hygiene > Power Toothbrushes & Accessories
2124,473,oral b dual clean replacement electric toothbrush head-6 ct,Health & Beauty > Personal Care > Oral Hygiene > Power Toothbrushes & Accessories
2125,473,CISNO 4 Pack Electric Toothbrush Head Replacement For Philips Sonicare E-Series,Health & Beauty > Personal Care > Oral Hygiene > Power Toothbrushes & Accessories
2126,473,"oral-b pro-health stages monsters, inc. power kids toothbrush 1 count health and beauty",Health & Beauty > Personal Care > Oral Hygiene > Power Toothbrushes & Accessories
2127,473,"selena gomez arm & hammer spinbrush, tooth tunes, round & round, soft 1 toothbrush",Health & Beauty > Personal Care > Oral Hygiene > Power Toothbrushes & Accessories
2128,473,Oral-B Pro-Health For Me Rechargeable Power Toothbrush Including 2 Sensitive Clean Refills 1 Kit Oral-B,Health & Beauty > Personal Care > Oral Hygiene > Power Toothbrushes & Accessories
2129,473,generic oral b floss action compatible brush head replacement 4/8/12/16/20 count for oral b/braun professional care/professional care smartseries/triz,Health & Beauty > Personal Care > Oral Hygiene > Power Toothbrushes & Accessories
2130,473,"philips sonicare hx7012/60 e-series compact replacement brush heads, 2-pack new",Health & Beauty > Personal Care > Oral Hygiene > Power Toothbrushes & Accessories
