,category_id,description,category_path
907,473,"Sonishare Premium Replacement Toothbrush Heads, replaces HX6053/54 - 20 Pack (Other Quantities Available) - Fits Diamond Clean | Easy Clean | Healthy White | Plaque Control | Flex Care",Health & Beauty > Personal Care > Oral Hygiene > Power Toothbrushes & Accessories
908,473,generic oral b compatible brush head replacement for oral b (4 count),Health & Beauty > Personal Care > Oral Hygiene > Power Toothbrushes & Accessories
909,473,"Oral-B Floss Action Replacement Electric Toothbrush Heads for Use on Most Oral-B Rechargeable Handles by Baining , 12 Count (BH-BN-118-12)",Health & Beauty > Personal Care > Oral Hygiene > Power Toothbrushes & Accessories
910,473,"oral-b floss action replacement electric toothbrush heads for use on most oral-b rechargable handles, 3 count",Health & Beauty > Personal Care > Oral Hygiene > Power Toothbrushes & Accessories
911,473,"waterpik sensonic professional plus toothbrush, white/blue",Health & Beauty > Personal Care > Oral Hygiene > Power Toothbrushes & Accessories
912,473,Philips Sonicare HX8331/11 Airfloss Pro Rechargeable Electric Flosser,Health & Beauty > Personal Care > Oral Hygiene > Power Toothbrushes & Accessories
913,473,"philips sonicare hx6042/64 sonicare for kids replacement brush heads, ages 7-10, 2 pack health and beauty",Health & Beauty > Personal Care > Oral Hygiene > Power Toothbrushes & Accessories
914,473,"philips sonicare toothbrush e series heads fits: advance, clean care, elite, essence, xtreme - 6 pack health and beauty new",Health & Beauty > Personal Care > Oral Hygiene > Power Toothbrushes & Accessories
915,473,"philips sonicare toothbrush e series heads fits: advance, clean care, elite, essence, xtreme - 6 pack",Health & Beauty > Personal Care > Oral Hygiene > Power Toothbrushes & Accessories
916,473,"spinbrush sonic power truly radiant soft replacement brush heads, 2 heads",Health & Beauty > Personal Care > Oral Hygiene > Power Toothbrushes & Accessories
917,473,standard replacement toothbrush heads (4 pcs) hx6064 fits for philips sonicare diamondclean,Health & Beauty > Personal Care > Oral Hygiene > Power Toothbrushes & Accessories
918,473,universal travel charger for sonicare flexcare,Health & Beauty > Personal Care > Oral Hygiene > Power Toothbrushes & Accessories
919,473,"Oral-B Cross Action Brush Head Refills, 5 Count",Health & Beauty > Personal Care > Oral Hygiene > Power Toothbrushes & Accessories
920,473,"oral-b crossaction power battery toothbrush refill heads, soft - 2 ea",Health & Beauty > Personal Care > Oral Hygiene > Power Toothbrushes & Accessories
921,473,philips sonicare hx5620/20 essence rechargeable sonic toothbrush green,Health & Beauty > Personal Care > Oral Hygiene > Power Toothbrushes & Accessories
922,473,pro white oral b 12 top quality generic replacement heads (4 / 3packs),Health & Beauty > Personal Care > Oral Hygiene > Power Toothbrushes & Accessories
923,473,Philips Sonicare HX6921/30 Flexcare Plus Rechargeable Electric Toothbrush Used - Like New,Health & Beauty > Personal Care > Oral Hygiene > Power Toothbrushes & Accessories
924,473,universal charger for philips sonicare essence toothbrush,Health & Beauty > Personal Care > Oral Hygiene > Power Toothbrushes & Accessories
925,473,"philips sonicare hx6733/70 healthywhite 3 mode premium edition rechargeable toothbrush 2 sets (2 handles, 2 brush heads, 1 hydro clean uv sanitizer wi",Health & Beauty > Personal Care > Oral Hygiene > Power Toothbrushes & Accessories
926,473,Music battery powered Toothbrush for Child with Led Light and Soft brush bristle,Health & Beauty > Personal Care > Oral Hygiene > Power Toothbrushes & Accessories
927,473,"Philips Sonicare Flexcare Platinum Sonic Electric Toothbrush, HX9112/13",Health & Beauty > Personal Care > Oral Hygiene > Power Toothbrushes & Accessories
928,473,oral-b pulsar medium,Health & Beauty > Personal Care > Oral Hygiene > Power Toothbrushes & Accessories
929,473,Soniplus Premium Standard Replacement Toothbrush Heads 2-pack,Health & Beauty > Personal Care > Oral Hygiene > Power Toothbrushes & Accessories
930,473,"philips sonicare hx6053/62 sensitive brush heads, 3-pack",Health & Beauty > Personal Care > Oral Hygiene > Power Toothbrushes & Accessories
931,473,"Philips Sonicare Simply Clean Brush Head, 2 Count",Health & Beauty > Personal Care > Oral Hygiene > Power Toothbrushes & Accessories
932,473,conair replacement brushheads for rtg3csr-2 pack,Health & Beauty > Personal Care > Oral Hygiene > Power Toothbrushes & Accessories
933,473,health hp-stx ultra high,Health & Beauty > Personal Care > Oral Hygiene > Power Toothbrushes & Accessories
934,473,"Philips Sonicare HealthyWhite Plus Sonic Electric Toothbrush, Standard Packaging",Health & Beauty > Personal Care > Oral Hygiene > Power Toothbrushes & Accessories
935,473,"Genkent Replacement Brush Heads for Philips Sonicare Hx6034 Sonicare for Kids Brush Heads, Ages 4-7, 4-pack (12)",Health & Beauty > Personal Care > Oral Hygiene > Power Toothbrushes & Accessories
936,473,"philips sonicare hx5612/09 essence rechargeable electric toothbrush holiday pack, white health and beauty",Health & Beauty > Personal Care > Oral Hygiene > Power Toothbrushes & Accessories
937,473,"OralB Precision Clean Replacement Brush Heads, 5 Count w/ Free Loving Care Conditioner Packette",Health & Beauty > Personal Care > Oral Hygiene > Power Toothbrushes & Accessories
938,473,oral-b healthy clean and,Health & Beauty > Personal Care > Oral Hygiene > Power Toothbrushes & Accessories
939,473,oral-b professional dual clean replacement brush head 1 count,Health & Beauty > Personal Care > Oral Hygiene > Power Toothbrushes & Accessories
940,473,philips sonicare flexcare platinum standard intercare replacement heads hx9002,Health & Beauty > Personal Care > Oral Hygiene > Power Toothbrushes & Accessories
941,473,ARM & HAMMER Spinbrush Truly Radiant Extra White Battery Toothbrush,Health & Beauty > Personal Care > Oral Hygiene > Power Toothbrushes & Accessories
942,473,"sonimart premium ultra soft sensitive replacement toothbrush heads 2-pack, replaces philips sonicare hx7052 e-series sensitive, fits philips advance, new",Health & Beauty > Personal Care > Oral Hygiene > Power Toothbrushes & Accessories
943,473,8 pcs replacement toothbrush heads compatible with sonicare philips sonic p-hx-6014,Health & Beauty > Personal Care > Oral Hygiene > Power Toothbrushes & Accessories
944,473,"Philips Sonicare E-Series replacement toothbrush heads, HX7012/64, Compact",Health & Beauty > Personal Care > Oral Hygiene > Power Toothbrushes & Accessories
945,473,"Genkent Replacement Philips Sonicare Toothbrush e Series Heads Fits: Advance, Clean Care, Elite, Essence, Xtreme",Health & Beauty > Personal Care > Oral Hygiene > Power Toothbrushes & Accessories
946,473,Pengaz Dual Clean Replacement Toothbrush Heads GENERIC Compatible Electric,Health & Beauty > Personal Care > Oral Hygiene > Power Toothbrushes & Accessories
947,473,STONG Sg-618 Intelligent Sonic with LED Lights Child Electric Toothbrush for,Health & Beauty > Personal Care > Oral Hygiene > Power Toothbrushes & Accessories
948,473,Oral-B Ortho Replacement Electric Toothbrush Head 1 Count,Health & Beauty > Personal Care > Oral Hygiene > Power Toothbrushes & Accessories
949,473,Ronsit 4pcs Electric Toothbrush brush Heads for Philips Sonicare Proresult,Health & Beauty > Personal Care > Oral Hygiene > Power Toothbrushes & Accessories
950,473,"colgate 360 degree surround sonic power toothbrush, soft, 2 count",Health & Beauty > Personal Care > Oral Hygiene > Power Toothbrushes & Accessories
951,473,generic oral-b deep sweep replacement electric toothbrush head - for an innovative cleaning- 4 pack- by paz generix®,Health & Beauty > Personal Care > Oral Hygiene > Power Toothbrushes & Accessories
952,473,"philips sonicare hx6731/34 healthywhite rechargeable toothbrush, special pack",Health & Beauty > Personal Care > Oral Hygiene > Power Toothbrushes & Accessories
953,473,philips sonicare hx9033/64 pro results gum health brush heads,Health & Beauty > Personal Care > Oral Hygiene > Power Toothbrushes & Accessories
954,473,"replacement battery for braun oral-b triumph toothbrush, sanyo ni-mh 2150 mah, 42 mm long, 17 mm diameter",Health & Beauty > Personal Care > Oral Hygiene > Power Toothbrushes & Accessories
955,473,"4-pack philips sonicare compatible toothbrush heads diamond clean, flexcare. buy two orders and get one 4-pack free!",Health & Beauty > Personal Care > Oral Hygiene > Power Toothbrushes & Accessories
956,473,oral-b vitality deep sweep,Health & Beauty > Personal Care > Oral Hygiene > Power Toothbrushes & Accessories
957,473,philips sonicare hx3631/06,Health & Beauty > Personal Care > Oral Hygiene > Power Toothbrushes & Accessories
958,473,2 sonicare toothbrush heads + travel case - fits e series essence advance elite,Health & Beauty > Personal Care > Oral Hygiene > Power Toothbrushes & Accessories
959,473,"12 - Pack Philips Sonicare Compatible Toothbrush Heads Diamond Clean, Flexcare.",Health & Beauty > Personal Care > Oral Hygiene > Power Toothbrushes & Accessories
960,473,sonic toothbrush with uv sanitizer - rechargeable electric toothbrush,Health & Beauty > Personal Care > Oral Hygiene > Power Toothbrushes & Accessories
961,473,"spinbrush for kids battery powered toothbrush, my way, girls (pack of 2)",Health & Beauty > Personal Care > Oral Hygiene > Power Toothbrushes & Accessories
962,473,water pik pik pocket tips,Health & Beauty > Personal Care > Oral Hygiene > Power Toothbrushes & Accessories
963,473,"philips sonicare hx5610/30 essence 5600 rechargeable electric toothbrush, frustration free packaging health and beauty",Health & Beauty > Personal Care > Oral Hygiene > Power Toothbrushes & Accessories
964,473,Smilex AU-300E Ultrasonic Toothbrush Replacement Brush Heads - Medium Bristles,Health & Beauty > Personal Care > Oral Hygiene > Power Toothbrushes & Accessories
965,473,"20 Pcs. (5x4) E-CronToothbrush heads, Replacement for Philips Sonicare ProResults. Fully Compatible With The Following Philips Electric ToothBrush Models: DiamondClean, FlexCare, FlexCare Platinum, FlexCare(+), HealthyWhite, 2 Series, EasyClean and PowerUp",Health & Beauty > Personal Care > Oral Hygiene > Power Toothbrushes & Accessories
966,473,compatible replacement brush heads value 4 pack. includes 2 pack of cashmere cleanse facial brush heads and 2 pack of sensitive skin brush heads,Health & Beauty > Personal Care > Oral Hygiene > Power Toothbrushes & Accessories
967,473,"Sunartec Toothbrush Heads for Philips Sonicare HX6053/54, Diamond Clean, Easy Clean, Flex Care, Healthy White, Hydro Clean, 4-Pack",Health & Beauty > Personal Care > Oral Hygiene > Power Toothbrushes & Accessories
968,473,"Baining 228D-blue Essence Sonic Electric Rechargeable Toothbrush, Blue",Health & Beauty > Personal Care > Oral Hygiene > Power Toothbrushes & Accessories
969,473,oral-b 3d white replacement electric toothbrush head 3 count,Health & Beauty > Personal Care > Oral Hygiene > Power Toothbrushes & Accessories
970,473,oral-b pro 3000 power rechargeable electric toothbrush with bluetooth connectivity powered by braun,Health & Beauty > Personal Care > Oral Hygiene > Power Toothbrushes & Accessories
971,473,"supersmile series ii ls45â° sonic pulse replacement brush heads, 2 count",Health & Beauty > Personal Care > Oral Hygiene > Power Toothbrushes & Accessories
972,473,"Generic Diamond Clean Compatible Replacement Heads for Sonicare, 12 Pack",Health & Beauty > Personal Care > Oral Hygiene > Power Toothbrushes & Accessories
973,473,Philips Sonicare 2 Series Plaque Control Sonic Electric Toothbrush,Health & Beauty > Personal Care > Oral Hygiene > Power Toothbrushes & Accessories
974,473,2 rotadent legacy/classic brush heads - short point,Health & Beauty > Personal Care > Oral Hygiene > Power Toothbrushes & Accessories
975,473,"radius replacement heads, soft bristles, 2 count (pack of 3)",Health & Beauty > Personal Care > Oral Hygiene > Power Toothbrushes & Accessories
976,473,philips sonicare essence hx5810 hx5910 rechargeable toothbrush handle,Health & Beauty > Personal Care > Oral Hygiene > Power Toothbrushes & Accessories
977,473,"Generic Diamond Clean Replacement Heads for Philips Sonicare Toothbrushes, 20 Pack",Health & Beauty > Personal Care > Oral Hygiene > Power Toothbrushes & Accessories
978,473,"Philips Sonicare Travel Charger, HX6000/01",Health & Beauty > Personal Care > Oral Hygiene > Power Toothbrushes & Accessories
979,473,Disney Frozen 3pc Bright Smile Collection! (1) Battery Powered Turbo Toothbrush,Health & Beauty > Personal Care > Oral Hygiene > Power Toothbrushes & Accessories
980,473,philips sonicare hx9002/64,Health & Beauty > Personal Care > Oral Hygiene > Power Toothbrushes & Accessories
981,473,"Philips Sonicare HealthyWhite Plus Rechargeable Toothbrush, Standard Packaging",Health & Beauty > Personal Care > Oral Hygiene > Power Toothbrushes & Accessories
982,473,oral b deepsweep 1000 deep sweep toothbrush,Health & Beauty > Personal Care > Oral Hygiene > Power Toothbrushes & Accessories
983,473,oralb professional care 5000 toothbrush white,Health & Beauty > Personal Care > Oral Hygiene > Power Toothbrushes & Accessories
984,473,philips sonicare flexcare rechargeable sonic powered toothbrush white,Health & Beauty > Personal Care > Oral Hygiene > Power Toothbrushes & Accessories
985,473,philips sonicare essence rechargeable sonic toothbrush whiteblue,Health & Beauty > Personal Care > Oral Hygiene > Power Toothbrushes & Accessories
986,473,philips sonicare diamondclean electric toothbrush black,Health & Beauty > Personal Care > Oral Hygiene > Power Toothbrushes & Accessories
987,473,philips sonicare easyclean bonus pack white,Health & Beauty > Personal Care > Oral Hygiene > Power Toothbrushes & Accessories
988,473,"philips sonicare kids compact brush head, hx6032/94, compact, super fresh blue - 2 ea",Health & Beauty > Personal Care > Oral Hygiene > Power Toothbrushes & Accessories
989,473,philips sonicare hx9332 diamondclean rechargeable electric toothbrush - 1 ea,Health & Beauty > Personal Care > Oral Hygiene > Power Toothbrushes & Accessories
990,473,"violife slim sonic toothbrush replacement heads, deluxe size - 4 ea",Health & Beauty > Personal Care > Oral Hygiene > Power Toothbrushes & Accessories
991,473,"spinbrush by arm & hammer powered toothbrush, pro clean sonic brush, soft - 1 ea",Health & Beauty > Personal Care > Oral Hygiene > Power Toothbrushes & Accessories
992,473,oral-b professional care interproximal clean replacement brushheads - 1 ea,Health & Beauty > Personal Care > Oral Hygiene > Power Toothbrushes & Accessories
993,473,"philips sonicare powerup battery toothbrush, hx3631/02, blue - 1 ea",Health & Beauty > Personal Care > Oral Hygiene > Power Toothbrushes & Accessories
994,473,"philips sonicare kids compact brush head, hx6032/94, super fresh blue - 2 ea",Health & Beauty > Personal Care > Oral Hygiene > Power Toothbrushes & Accessories
995,473,waterpik srrb-3w replacement standard brush heads - 3 ea,Health & Beauty > Personal Care > Oral Hygiene > Power Toothbrushes & Accessories
996,473,philips sonicare hx9003/64 intercare standard replacement brush heads - 3 ea,Health & Beauty > Personal Care > Oral Hygiene > Power Toothbrushes & Accessories
997,473,philips sonicare hx6631/30 3 series gum health electric toothbrush - 1 ea,Health & Beauty > Personal Care > Oral Hygiene > Power Toothbrushes & Accessories
998,473,oral-b cross action brush head refills - 5 ea,Health & Beauty > Personal Care > Oral Hygiene > Power Toothbrushes & Accessories
999,473,"philips sonicare for kids replacement brush heads hx6042/64, age7-10 - 2 ea",Health & Beauty > Personal Care > Oral Hygiene > Power Toothbrushes & Accessories
1000,473,philips sonicare hx9110/02 flexcare platinum rechargeable electric toothbrush - 1 ea,Health & Beauty > Personal Care > Oral Hygiene > Power Toothbrushes & Accessories
1001,473,arm & hammer spinbrush kids my way powered toothbrush for boys - 1 ea,Health & Beauty > Personal Care > Oral Hygiene > Power Toothbrushes & Accessories
1002,473,"philips sonicare hx9033/64 gum health brush heads, white - 3 ea",Health & Beauty > Personal Care > Oral Hygiene > Power Toothbrushes & Accessories
1003,473,briteleafs uv ultraviolet family toothbrush sanitizer sterilizer cleaner - triple sanitizing cycles per day,Health & Beauty > Personal Care > Oral Hygiene > Power Toothbrushes & Accessories
1004,473,"philips sonicare hx7022/30 eseries standard replacement brush heads, 2 pack, frustration free packaging health and beauty",Health & Beauty > Personal Care > Oral Hygiene > Power Toothbrushes & Accessories
1005,473,"oral-b power sensitive replacement electric toothbrush head,3 count",Health & Beauty > Personal Care > Oral Hygiene > Power Toothbrushes & Accessories
1006,473,super sonic smile toothbrush replacement brushes 4 pack,Health & Beauty > Personal Care > Oral Hygiene > Power Toothbrushes & Accessories
1007,473,"philips sonicare hx6032/94 2 piece kids brush head, compact (colors may vary) new",Health & Beauty > Personal Care > Oral Hygiene > Power Toothbrushes & Accessories
1008,473,3 ~ braun professional deep sweep ~ eb30-3,Health & Beauty > Personal Care > Oral Hygiene > Power Toothbrushes & Accessories
1009,473,BrushSonic BH04-4 Quality Replacement Toothbrush Heads For Oral-B Dual Clean,Health & Beauty > Personal Care > Oral Hygiene > Power Toothbrushes & Accessories
1010,473,"Sonimart Sensitive Replacement Toothbrush Heads for Philips Sonicare e-Series HX7052, 2 pack",Health & Beauty > Personal Care > Oral Hygiene > Power Toothbrushes & Accessories
1011,473,Wellness WE4PRO Replacement Brush Heads for WE1100 Sonic Electric Toothbrush,Health & Beauty > Personal Care > Oral Hygiene > Power Toothbrushes & Accessories
1012,473,"Sonismart Premium Replacement Toothbrush Heads 4-pack, replaces Philips Sonicare",Health & Beauty > Personal Care > Oral Hygiene > Power Toothbrushes & Accessories
1013,473,"Generic Dual Action Compatible Replacement Heads for Oral-B, 4 Pack",Health & Beauty > Personal Care > Oral Hygiene > Power Toothbrushes & Accessories
1014,473,oral b vitality flossaction vitality floss action rechargeable power toothbrush,Health & Beauty > Personal Care > Oral Hygiene > Power Toothbrushes & Accessories
1015,473,"Philips Sonicare EasyClean Sonic Electric Toothbrush, Hx6511/34",Health & Beauty > Personal Care > Oral Hygiene > Power Toothbrushes & Accessories
1016,473,"SoniShare For Kids Replacement Heads for Philips Sonicare Toothbrushes, 4 Pack [4, 12, 20 Packs Available]",Health & Beauty > Personal Care > Oral Hygiene > Power Toothbrushes & Accessories
1017,473,"philips sonicare hx6013/64 proresults brush head, standard, 3 count",Health & Beauty > Personal Care > Oral Hygiene > Power Toothbrushes & Accessories
1018,473,philips sonicare hx6631/30,Health & Beauty > Personal Care > Oral Hygiene > Power Toothbrushes & Accessories
1019,473,"12 pcs. (3x4) Replacement Brush Heads Compatible with Philips Sonicare Electric Toothbrush Handles. Substitute for HX6013, HX6014 and other. Fully Compatible With DiamondClean, FlexCare Platinum, FlexCare+, HealthyWhite, HealthyWhite+, Sonicare 2 Series, Sonicare 3 Series, PowerUp. Replacements by ORAXPearlClean.",Health & Beauty > Personal Care > Oral Hygiene > Power Toothbrushes & Accessories
1020,473,Generic Cross Action toothbrush Replacement head-Oral-B (12),Health & Beauty > Personal Care > Oral Hygiene > Power Toothbrushes & Accessories
1021,473,2-PACK: Reviver Freshening Swipe (AS SEEN ON SHARK TANK!),Health & Beauty > Personal Care > Oral Hygiene > Power Toothbrushes & Accessories
1022,473,mlb los angeles dodgers pursonic baseball bat toothbrush,Health & Beauty > Personal Care > Oral Hygiene > Power Toothbrushes & Accessories
1023,473,Oral-B Floss Action Compatible Replacement Electric Tooth Brush Heads (4pcs),Health & Beauty > Personal Care > Oral Hygiene > Power Toothbrushes & Accessories
1024,473,"8x Generic Braun Oral-B Replacement Brush Heads Compatible With Oral B Vitality Precision Clean, Dual Clean, Professional Care, Professional Care Smar",Health & Beauty > Personal Care > Oral Hygiene > Power Toothbrushes & Accessories
1025,473,"Premium Oral-B Floss Action Generic Replacement Toothbrush Heads - 4, 8, 12 or 20 Pack (4)",Health & Beauty > Personal Care > Oral Hygiene > Power Toothbrushes & Accessories
1026,473,"philips sonicare hx6023/64 proresults compact brush heads, 3 pack new",Health & Beauty > Personal Care > Oral Hygiene > Power Toothbrushes & Accessories
1027,473,Sonicare 423502504291 UV Germicidal Sanitizer Replacement Bulb,Health & Beauty > Personal Care > Oral Hygiene > Power Toothbrushes & Accessories
1028,473,"hx6013/66 pro results brush head (generic), standard, 8 units",Health & Beauty > Personal Care > Oral Hygiene > Power Toothbrushes & Accessories
1029,473,Replacement Brush Heads Compatible with Oral-B Electric Toothbrush 4/8/12/16/20 Count For Oral B/Braun Professional Care/Professional Care SmartSeries/TriZone/Advance Power/Pro Health/Triumph/3D Excel/Vitality Precision Clean/Vitality Dual Clean (20),Health & Beauty > Personal Care > Oral Hygiene > Power Toothbrushes & Accessories
1030,473,"Sonishare Premium Replacement Toothbrush Heads, replaces HX6053/54 - 12 Pack (Other Quantities Available) - Fits Diamond Clean | Easy Clean | Healthy White | Plaque Control | Flex Care",Health & Beauty > Personal Care > Oral Hygiene > Power Toothbrushes & Accessories
1031,473,"oral-b pro-health precision clean battery toothbrush for superior plaque removal and healthy gums, pack of 1",Health & Beauty > Personal Care > Oral Hygiene > Power Toothbrushes & Accessories
1032,473,"Generic Dual Action Compatible Replacement Heads for Oral-B, 8 Pack",Health & Beauty > Personal Care > Oral Hygiene > Power Toothbrushes & Accessories
1033,473,philips sonicare hx6053/64,Health & Beauty > Personal Care > Oral Hygiene > Power Toothbrushes & Accessories
1034,473,philips sonicare plaque,Health & Beauty > Personal Care > Oral Hygiene > Power Toothbrushes & Accessories
1035,473,"Soniplus Standard Replacement Toothbrush Heads for Philips Sonicare ProResults HX6013/HX6014, 4 Pack",Health & Beauty > Personal Care > Oral Hygiene > Power Toothbrushes & Accessories
1036,473,oral-b pulsonic electric toothbrush,Health & Beauty > Personal Care > Oral Hygiene > Power Toothbrushes & Accessories
1037,473,"Philips Sonicare Sonic Electric Toothbrush for Kids, HX6311/07",Health & Beauty > Personal Care > Oral Hygiene > Power Toothbrushes & Accessories
1038,473,replacement heads (2 pack,Health & Beauty > Personal Care > Oral Hygiene > Power Toothbrushes & Accessories
1039,473,"Generic Floss Action Replacement Heads for Oral B Toothbrushes, 20 Pack [4, 8, 12 Packs Available]",Health & Beauty > Personal Care > Oral Hygiene > Power Toothbrushes & Accessories
1040,473,brushbrite philips sonicare,Health & Beauty > Personal Care > Oral Hygiene > Power Toothbrushes & Accessories
1041,473,"oral-b action power soft replacement brush head, 2-count",Health & Beauty > Personal Care > Oral Hygiene > Power Toothbrushes & Accessories
1042,473,"philips sonicare hx5610/01 essence 5600 rechargeable electric toothbrush, white health and beauty",Health & Beauty > Personal Care > Oral Hygiene > Power Toothbrushes & Accessories
1043,473,"Oral-b Electronic Toothbrush for Kids, Winnie the Pooh Oral B Power Stages",Health & Beauty > Personal Care > Oral Hygiene > Power Toothbrushes & Accessories
1044,473,philips sonicare hx6311/02 sonicare for kids rechargeable electric toothbrush health and beauty,Health & Beauty > Personal Care > Oral Hygiene > Power Toothbrushes & Accessories
1045,473,philips sonicare hx5630/50 essence rechargeable sonic toothbrush pink health and beauty,Health & Beauty > Personal Care > Oral Hygiene > Power Toothbrushes & Accessories
1046,473,oral-b deep sweep 1000,Health & Beauty > Personal Care > Oral Hygiene > Power Toothbrushes & Accessories
1047,473,oral-b dual clean,Health & Beauty > Personal Care > Oral Hygiene > Power Toothbrushes & Accessories
1048,473,panasonic sonic vibration rechargeable toothbrush,Health & Beauty > Personal Care > Oral Hygiene > Power Toothbrushes & Accessories
1049,473,philips sonicare hx9381/05 diamond clean rechargeable electric toothbrush,Health & Beauty > Personal Care > Oral Hygiene > Power Toothbrushes & Accessories
1050,473,"philips sonicare diamondclean black limited edition, remove up to 7x more plaque",Health & Beauty > Personal Care > Oral Hygiene > Power Toothbrushes & Accessories
1051,473,"panasonic ew-ds90-s compact battery-powered toothbrush, silver",Health & Beauty > Personal Care > Oral Hygiene > Power Toothbrushes & Accessories
1052,473,Premium Replacement Toothbrush Heads For Phillips Sonicare (4-pack),Health & Beauty > Personal Care > Oral Hygiene > Power Toothbrushes & Accessories
1053,473,"philips sonicare hx7052/64 eseries standard sensitive replacement brush heads, 2 count",Health & Beauty > Personal Care > Oral Hygiene > Power Toothbrushes & Accessories
1054,473,oral-b pro 500 power rechargeable electric toothbrush powered by braun,Health & Beauty > Personal Care > Oral Hygiene > Power Toothbrushes & Accessories
1055,473,philips sonicare hx6921/02 flexcare plus rechargeable electric toothbrush health and beauty,Health & Beauty > Personal Care > Oral Hygiene > Power Toothbrushes & Accessories
1056,473,the s&p 12-pack generic,Health & Beauty > Personal Care > Oral Hygiene > Power Toothbrushes & Accessories
1057,473,oral-b 3d white replacement electric toothbrush head 1 count,Health & Beauty > Personal Care > Oral Hygiene > Power Toothbrushes & Accessories
1058,473,braun sr18-3 sonic complete refill,Health & Beauty > Personal Care > Oral Hygiene > Power Toothbrushes & Accessories
1059,473,philips sonicare hx6731/02 healthywhite rechargeable electric toothbrush new,Health & Beauty > Personal Care > Oral Hygiene > Power Toothbrushes & Accessories
