,category_id,description,category_path
0,473,Oral-B WHITE 7000 SmartSeries with Bluetooth Electric Rechargeable Power Toothbrush Powered by Braun,Health & Beauty > Personal Care > Oral Hygiene > Power Toothbrushes & Accessories
1,473,precision clean replacement electric toothbrush head 1 count,Health & Beauty > Personal Care > Oral Hygiene > Power Toothbrushes & Accessories
2,473,Oral-B 3D White Luxe 4 Pack Pulsar Battery Powered Toothbrushes,Health & Beauty > Personal Care > Oral Hygiene > Power Toothbrushes & Accessories
3,473,"Oral-B Complete Action Deep Clean Power Toothbrush, 1 Count (Colors May Vary)",Health & Beauty > Personal Care > Oral Hygiene > Power Toothbrushes & Accessories
4,473,oral-b professional floss action replacement brush head 1 count health and beauty,Health & Beauty > Personal Care > Oral Hygiene > Power Toothbrushes & Accessories
5,473,"SoniShare Heads for Philips Toothbrushes, 20 Pack",Health & Beauty > Personal Care > Oral Hygiene > Power Toothbrushes & Accessories
6,473,"dazzlepro dp25098-0103 replacement head for daz-7080 sonic tooth brush, multi-color (pack of 3)",Health & Beauty > Personal Care > Oral Hygiene > Power Toothbrushes & Accessories
7,473,Unique New Replacement Soft Resilience Toothbrush Heads Fits for Lebond Sonic,Health & Beauty > Personal Care > Oral Hygiene > Power Toothbrushes & Accessories
8,473,"8x toothbrush heads compatible with philips sonicare, flexcare, diamond clean new",Health & Beauty > Personal Care > Oral Hygiene > Power Toothbrushes & Accessories
9,473,12 - Philips Sonicare Healthywhite Generic Toothbrush Replacement for Proresults Easyclean Hx6750 Hx6710 Hx6530 Heads,Health & Beauty > Personal Care > Oral Hygiene > Power Toothbrushes & Accessories
10,473,Philips Sonicare HX9026/84 ProResults plaque control Replacement Brush Heads - 6 pack,Health & Beauty > Personal Care > Oral Hygiene > Power Toothbrushes & Accessories
11,473,"ToothCo Premium Standard Size Replacement Toothbrush Heads for Philips Sonicare e-Series HX7022, 2 pack, fit Sonicare Advance, CleanCare, Elite, Essence and Xtreme Philips Brush Handles",Health & Beauty > Personal Care > Oral Hygiene > Power Toothbrushes & Accessories
12,473,"Generic Premium Replacement Toothbrush Heads for Oral B Floss Action, 4 Pack [8, 12, 20 Packs Available]",Health & Beauty > Personal Care > Oral Hygiene > Power Toothbrushes & Accessories
13,473,"WYAO® Standard Replacement Toothbrush Heads ?4-pack?, replaces Philips Sonicare HX6014 ProResults, fits DiamondClean",Health & Beauty > Personal Care > Oral Hygiene > Power Toothbrushes & Accessories
14,473,"Generic Premium Floss Action Replacement Heads for Oral B Toothbrushes, 4 Pack [8, 12, 20 Packs Available]",Health & Beauty > Personal Care > Oral Hygiene > Power Toothbrushes & Accessories
15,473,"Oral-B White 7000 SmartSeries Electric Rechargeable Power Toothbrush with Bluetooth, Powered by Braun",Health & Beauty > Personal Care > Oral Hygiene > Power Toothbrushes & Accessories
16,473,arm & hammer spinbrush pro clean toothbrush with 4 refills,Health & Beauty > Personal Care > Oral Hygiene > Power Toothbrushes & Accessories
17,473,philips sonicare hx6932/10 flexcare rs930 rechargeable electric toothbrush,Health & Beauty > Personal Care > Oral Hygiene > Power Toothbrushes & Accessories
18,473,Smilex AU-300E Original Ultrasonic Electric Toothbrush,Health & Beauty > Personal Care > Oral Hygiene > Power Toothbrushes & Accessories
19,473,pursonic s450 deluxe plus,Health & Beauty > Personal Care > Oral Hygiene > Power Toothbrushes & Accessories
20,473,colgate kids sponge bob,Health & Beauty > Personal Care > Oral Hygiene > Power Toothbrushes & Accessories
21,473,"philips sonicare hx6023/30 proresults compact brush heads, 3 count",Health & Beauty > Personal Care > Oral Hygiene > Power Toothbrushes & Accessories
22,473,philips sonicare hx9002/64 intercare standard replacement brush heads 2 ea,Health & Beauty > Personal Care > Oral Hygiene > Power Toothbrushes & Accessories
23,473,oral-b pulsar soft bristle,Health & Beauty > Personal Care > Oral Hygiene > Power Toothbrushes & Accessories
24,473,oral-b professional ortho brush kit replacement brush head 4 count,Health & Beauty > Personal Care > Oral Hygiene > Power Toothbrushes & Accessories
25,473,radius replacement heads,Health & Beauty > Personal Care > Oral Hygiene > Power Toothbrushes & Accessories
26,473,"colgate kids sponge bob powered toothbrush, extra soft bristles, colors and styles may vary",Health & Beauty > Personal Care > Oral Hygiene > Power Toothbrushes & Accessories
27,473,mlb new york yankees pursonic baseball bat toothbrush,Health & Beauty > Personal Care > Oral Hygiene > Power Toothbrushes & Accessories
28,473,"SoniShare - Compact Replacement Toothbrush Heads for Kids Compatible with Sonicare Toothbrushes - 4, 8, 12 or 20 Pack (12)",Health & Beauty > Personal Care > Oral Hygiene > Power Toothbrushes & Accessories
29,473,"violife slim sonic toothbrush, pink",Health & Beauty > Personal Care > Oral Hygiene > Power Toothbrushes & Accessories
30,473,"Spinbrush Pro Battery Powered Toothbrush, Soft (Colors May Vary)",Health & Beauty > Personal Care > Oral Hygiene > Power Toothbrushes & Accessories
31,473,SparkleFast Premium Generic Oral B Replacement Heads - Floss Action electric toothbrush heads (4 pack),Health & Beauty > Personal Care > Oral Hygiene > Power Toothbrushes & Accessories
32,473,"philips sonicare flexcare rechargeable sonic toothbrush premium edition 2 pack bundle (2 flexcare handles, 2 diamond clean standard brush heads, 1 com new",Health & Beauty > Personal Care > Oral Hygiene > Power Toothbrushes & Accessories
33,473,Pyle PHLTBS51BK Ultrasonic Wave Rechargeable Electric Toothbrush Automatic,Health & Beauty > Personal Care > Oral Hygiene > Power Toothbrushes & Accessories
34,473,"8pcs Toothbrush replacement Heads for Philips Sonicare, Flexcare, HX-6013, HX-6014",Health & Beauty > Personal Care > Oral Hygiene > Power Toothbrushes & Accessories
35,473,philips sonicare hx6042/60 hx6044 sonicare for kids generic brush heads ages 7-10 (8pcs),Health & Beauty > Personal Care > Oral Hygiene > Power Toothbrushes & Accessories
36,473,Philips Sonicare HX6211/96 2 Series Plaque Control Rechargeable Toothbrush,Health & Beauty > Personal Care > Oral Hygiene > Power Toothbrushes & Accessories
37,473,TravelSonic2 Electric Toothbrush Silver Senzacare 1 Brush,Health & Beauty > Personal Care > Oral Hygiene > Power Toothbrushes & Accessories
38,473,"brushpoint oscillating clean battery toothbrush, light blue",Health & Beauty > Personal Care > Oral Hygiene > Power Toothbrushes & Accessories
39,473,New Philips HX6100 Charger for Sonicare HeathyWhite Flexcare HX6500/HX6511/HX6530/HX6711/HX6730/HX6731/HX6732/HX6780/HX6781/HX6782/HX6902/HX6910/HX6930/HX6932/HX6942/HX6952/HX6972,Health & Beauty > Personal Care > Oral Hygiene > Power Toothbrushes & Accessories
40,473,"Philips Sonicare E-Series HX7022 Compatible Replacement Toothbrush Heads, 4-pack Standard Refills Fits: Essence, Xtreme, Elite, and Advance Handles (4",Health & Beauty > Personal Care > Oral Hygiene > Power Toothbrushes & Accessories
41,473,16 Oral-b Sonic Replacement Toothbrush Heads GENERIC NEUTRAL Braun Oral-b Replacement Electric Toothbrush Heads,Health & Beauty > Personal Care > Oral Hygiene > Power Toothbrushes & Accessories
42,473,"philips sonicare elite premium edition toothbrush with quadpacer ***twin pack*** (2 handles, 3 standard brush heads, 2 charger bases, & 2 travel cases health and beauty",Health & Beauty > Personal Care > Oral Hygiene > Power Toothbrushes & Accessories
43,473,8x toothbrush heads,Health & Beauty > Personal Care > Oral Hygiene > Power Toothbrushes & Accessories
44,473,replacement heads for the,Health & Beauty > Personal Care > Oral Hygiene > Power Toothbrushes & Accessories
45,473,"philips sonicare hx6733/90 healthywhite 3 mode platinum edition rechargeable toothbrush 2-pack bundle (2 power toothbrushes, 2 diamondclean brush head new",Health & Beauty > Personal Care > Oral Hygiene > Power Toothbrushes & Accessories
46,473,dr. tungs ionic toothbrush replacement heads,Health & Beauty > Personal Care > Oral Hygiene > Power Toothbrushes & Accessories
47,473,broxo,Health & Beauty > Personal Care > Oral Hygiene > Power Toothbrushes & Accessories
48,473,"arm & hammer powered toothbrush replacement heads, medium - 2 ct - (2 pack)",Health & Beauty > Personal Care > Oral Hygiene > Power Toothbrushes & Accessories
49,473,"SoniShare - Generic Diamond Clean Replacement Heads for Sonicare Toothbrushes - 4, 8, 12 or 20 Pack (12)",Health & Beauty > Personal Care > Oral Hygiene > Power Toothbrushes & Accessories
50,473,Philips Sonicare Essence Toothbrush HX5911/10,Health & Beauty > Personal Care > Oral Hygiene > Power Toothbrushes & Accessories
51,473,"colgate 360 degree optic white replacement brush heads, soft, 2 heads (pack of 2)",Health & Beauty > Personal Care > Oral Hygiene > Power Toothbrushes & Accessories
52,473,philips sonicare hx5351/46,Health & Beauty > Personal Care > Oral Hygiene > Power Toothbrushes & Accessories
53,473,"Philips Sonicare HX9023/64 Pro Results Plaque Control Brush Heads, 3 Count",Health & Beauty > Personal Care > Oral Hygiene > Power Toothbrushes & Accessories
54,473,travel sonic toothbrush by toilettree products (black),Health & Beauty > Personal Care > Oral Hygiene > Power Toothbrushes & Accessories
55,473,"Philips Sonicare Plaque Control Plus Rechargeable Toothbrush HX6254/81 Twin Pack (2 Rechargeable Toothbrushes, 4 Brush Heads, 2 travel cases, and 2 Ch",Health & Beauty > Personal Care > Oral Hygiene > Power Toothbrushes & Accessories
56,473,"philips sonicare hx6063/64 diamond clean replacement brush heads, standard, 3 count",Health & Beauty > Personal Care > Oral Hygiene > Power Toothbrushes & Accessories
57,473,"philips sonicare proresults replacement brush heads - 5 pack (fits diamondclean, flexcare+, flexcare, healthywhite, easyclean)",Health & Beauty > Personal Care > Oral Hygiene > Power Toothbrushes & Accessories
58,473,"violight slim sonic toothbrush, stripe",Health & Beauty > Personal Care > Oral Hygiene > Power Toothbrushes & Accessories
59,473,"Generic Premium Replacement Toothbrush Heads for Philips Sonicare Diamond Clean, 4 Pack [4, 8, 12, 20 Packs Available]",Health & Beauty > Personal Care > Oral Hygiene > Power Toothbrushes & Accessories
60,473,"E-Cron Replacement Toothbrush heads Compatible With Electric Toothbrush Oral B Precision Clean (EB17-4), 12 pcs (3x4)",Health & Beauty > Personal Care > Oral Hygiene > Power Toothbrushes & Accessories
61,473,"philips sonicare hx6062/64 diamondclean replacement brush heads, standard",Health & Beauty > Personal Care > Oral Hygiene > Power Toothbrushes & Accessories
62,473,brush heads replacement,Health & Beauty > Personal Care > Oral Hygiene > Power Toothbrushes & Accessories
63,473,waterpik sensonic professional toothbrush,Health & Beauty > Personal Care > Oral Hygiene > Power Toothbrushes & Accessories
64,473,"philips sonicare toothbrush e series generic replacement heads fits: essence, xtreme, elite and advance (4-pack) new",Health & Beauty > Personal Care > Oral Hygiene > Power Toothbrushes & Accessories
65,473,"Generic Floss Action Replacement Heads for Oral B Toothbrushes, 12 Pack [4, 8, 20 Packs Available]",Health & Beauty > Personal Care > Oral Hygiene > Power Toothbrushes & Accessories
66,473,Oralfit Replacement Brush Heads for Philips Sonicare (Pack of 4),Health & Beauty > Personal Care > Oral Hygiene > Power Toothbrushes & Accessories
67,473,"philips sonicare diamondclean replacement toothbrush heads, hx6062/64, white 2-pk",Health & Beauty > Personal Care > Oral Hygiene > Power Toothbrushes & Accessories
68,473,"Philips Sonicare InterCare replacement toothbrush heads, HX9003/64, 3-pk",Health & Beauty > Personal Care > Oral Hygiene > Power Toothbrushes & Accessories
69,473,philips sonicare diamondclean black limited edition dental professional model,Health & Beauty > Personal Care > Oral Hygiene > Power Toothbrushes & Accessories
70,473,new philip sonicare hx6053,Health & Beauty > Personal Care > Oral Hygiene > Power Toothbrushes & Accessories
71,473,hydrofloss regular jet tips,Health & Beauty > Personal Care > Oral Hygiene > Power Toothbrushes & Accessories
72,473,"SoniShare - Generic Diamond Clean Replacement Heads for Sonicare Toothbrushes - 4, 8, 12 or 20 Pack (4)",Health & Beauty > Personal Care > Oral Hygiene > Power Toothbrushes & Accessories
73,473,"Premium Oral-B Floss Action Generic Replacement Toothbrush Heads, 4 Count",Health & Beauty > Personal Care > Oral Hygiene > Power Toothbrushes & Accessories
74,473,"Philips Sonicare Essence+ HX3211/17 Electric Toothbrush, Mid Blue",Health & Beauty > Personal Care > Oral Hygiene > Power Toothbrushes & Accessories
75,473,PowerDriver 8 Pack Aa Ni-MH NiMH Rechargeable Batteries for Toothbrushes Solar,Health & Beauty > Personal Care > Oral Hygiene > Power Toothbrushes & Accessories
76,473,AZDENT® AZ-OC2 Electric Toothbrush with 4 Brush Heads(pack with batteries),Health & Beauty > Personal Care > Oral Hygiene > Power Toothbrushes & Accessories
77,473,"philips sonicare hx6063/60 diamondclean standard brush heads, 3-pack health and beauty",Health & Beauty > Personal Care > Oral Hygiene > Power Toothbrushes & Accessories
78,473,"Sonishare Premium Soft Replacement Toothbrush Heads, replaces HX6053/54 - 20 Pack (Other Quantities Available) - Fits Diamond Clean | Easy Clean | Healthy White | Plaque Control | Flex Care",Health & Beauty > Personal Care > Oral Hygiene > Power Toothbrushes & Accessories
79,473,violife slim sonic,Health & Beauty > Personal Care > Oral Hygiene > Power Toothbrushes & Accessories
80,473,"sonimart premium compact replacement toothbrush heads 4-pack, replaces philips sonicare hx6023 proresults compact, fits philips sonicare 2 series plaq new",Health & Beauty > Personal Care > Oral Hygiene > Power Toothbrushes & Accessories
81,473,"brushpoint twin pack battery power toothbrush, scooby doo, blue - orange",Health & Beauty > Personal Care > Oral Hygiene > Power Toothbrushes & Accessories
82,473,precision clean 8-pack replacement brush heads,Health & Beauty > Personal Care > Oral Hygiene > Power Toothbrushes & Accessories
83,473,oral-b professional healthy,Health & Beauty > Personal Care > Oral Hygiene > Power Toothbrushes & Accessories
84,473,pursonic s400 deluxe plus toothbrush,Health & Beauty > Personal Care > Oral Hygiene > Power Toothbrushes & Accessories
85,473,Yijan Waterproof Kids Music Electric Toothbrush Green,Health & Beauty > Personal Care > Oral Hygiene > Power Toothbrushes & Accessories
86,473,Premium Oral-B Floss Action Generic Replacement Toothbrush Heads (1 Pack/4pcs),Health & Beauty > Personal Care > Oral Hygiene > Power Toothbrushes & Accessories
87,473,arm & hammer spinbrush truly radiant sonic battery toothbrush refills,Health & Beauty > Personal Care > Oral Hygiene > Power Toothbrushes & Accessories
88,473,"philips sonicare proresults plaque control replacement toothbrush heads, hx9023/64, 3-pk",Health & Beauty > Personal Care > Oral Hygiene > Power Toothbrushes & Accessories
89,473,"20 Philips Sonicare Compatible Brush Heads Replacement HX6013, HX6014 ProResults including DiamondClean, FlexCare, FlexCare+, FlexCare Platinum, EasyC",Health & Beauty > Personal Care > Oral Hygiene > Power Toothbrushes & Accessories
90,473,the s&p replacement brush,Health & Beauty > Personal Care > Oral Hygiene > Power Toothbrushes & Accessories
91,473,"philips sonicare hx6063/64 diamond clean replacement brush heads, standard, 3 pack",Health & Beauty > Personal Care > Oral Hygiene > Power Toothbrushes & Accessories
92,473,colgate 360 degree surround,Health & Beauty > Personal Care > Oral Hygiene > Power Toothbrushes & Accessories
93,473,philips sonicare hx9042/94,Health & Beauty > Personal Care > Oral Hygiene > Power Toothbrushes & Accessories
94,473,"Ready Set Brush Star Wars ""YODA"" Star Wars Battery Powered Spin Toothbrush ! Plus Star Wars Crest ProHealh Jr. Toothpaste & Crest Pro-Health Jr. Star",Health & Beauty > Personal Care > Oral Hygiene > Power Toothbrushes & Accessories
95,473,"Standard Replacement Brush Heads for Philips Sonicare HX6014/13 ProResults (4, 8, 12 or 20 Pack) | Fits: Easyclean, DiamondClean, HealthyWhite, Flexca",Health & Beauty > Personal Care > Oral Hygiene > Power Toothbrushes & Accessories
96,473,will charge all flexcare 900 series toothbrush handles & healthy white 700 series toothbrush handles - philips sonicare flexcare & healthy white sanit,Health & Beauty > Personal Care > Oral Hygiene > Power Toothbrushes & Accessories
97,473,1 rotadent rota dent brush head flat hollow zila,Health & Beauty > Personal Care > Oral Hygiene > Power Toothbrushes & Accessories
98,473,"Premium Replacement Toothbrush Heads for Philips Sonicare E-Series, 2 Pack Standard, Philips Advance, CleanCare, Elite Essence, Xtreme Brush Handles",Health & Beauty > Personal Care > Oral Hygiene > Power Toothbrushes & Accessories
99,473,groovi silicone toothbrush bag (electric lime green),Health & Beauty > Personal Care > Oral Hygiene > Power Toothbrushes & Accessories
100,473,"colgate maxwhite adult full head soft, sonic powered toothbrush, colors vary health and beauty",Health & Beauty > Personal Care > Oral Hygiene > Power Toothbrushes & Accessories
101,473,"violife vs2t585 slim sonic toothbrush, prism",Health & Beauty > Personal Care > Oral Hygiene > Power Toothbrushes & Accessories
102,473,oral-b professional healthy clean + floss action precision 5000 rechargeable electric toothbrush 1 count,Health & Beauty > Personal Care > Oral Hygiene > Power Toothbrushes & Accessories
103,473,philips sonicare essence standard size brush heads (2)-bulk package,Health & Beauty > Personal Care > Oral Hygiene > Power Toothbrushes & Accessories
104,473,DazzleproTM Elite Sonic Toothbrush with UV Charger DP23096-1000 by Dastmalchi,Health & Beauty > Personal Care > Oral Hygiene > Power Toothbrushes & Accessories
105,473,Philips Sonicare Pro Results Plaque Control Toothbrush Heads for Sonicare Electric,Health & Beauty > Personal Care > Oral Hygiene > Power Toothbrushes & Accessories
106,473,SMILEE-Oral B Precision Clean Compatible Toothbrush Heads BEST VALUE Multipack (4),Health & Beauty > Personal Care > Oral Hygiene > Power Toothbrushes & Accessories
107,473,"SoniShare Premium Replacement Toothbrush Heads for Philips Sonicare Diamond Clean, 4 Pack",Health & Beauty > Personal Care > Oral Hygiene > Power Toothbrushes & Accessories
108,473,pack of 2 rotadent plus brush heads - hollow tip,Health & Beauty > Personal Care > Oral Hygiene > Power Toothbrushes & Accessories
109,473,Sterline Sonic ST-OR-T50 Rechargeable Toothbrush and Holder with 3 Replacement Heads,Health & Beauty > Personal Care > Oral Hygiene > Power Toothbrushes & Accessories
110,473,Maxx Elite Sonic Electric UV Toothbrush AND Sonic UV Travel Charger Case with,Health & Beauty > Personal Care > Oral Hygiene > Power Toothbrushes & Accessories
111,473,"SoniShare - Philips Sonicare Replacement Heads Proresults 4,8,12, or 20-pack (20)",Health & Beauty > Personal Care > Oral Hygiene > Power Toothbrushes & Accessories
112,473,8 oral-b sb - 17a flexisoft replacement toothbrush heads generic neutral braun oral-b electric replacement toothbrush heads (2 packs),Health & Beauty > Personal Care > Oral Hygiene > Power Toothbrushes & Accessories
113,473,BrushBrite Replacement Brush Heads (Set of 3),Health & Beauty > Personal Care > Oral Hygiene > Power Toothbrushes & Accessories
114,473,"philips sonicare hx5612/09 essence rechargeable electric toothbrush holiday pack, white",Health & Beauty > Personal Care > Oral Hygiene > Power Toothbrushes & Accessories
115,473,philips sonicare 2 series,Health & Beauty > Personal Care > Oral Hygiene > Power Toothbrushes & Accessories
116,473,"NEW Philip Sonicare Standard Soft Replacement Toothbrush Heads For Sensitive Teeth (4-pack) fits Sonicare 2, DiamondClean, EasyClean, HydroClean, FlexCare series, HealthyWhite, HX6014",Health & Beauty > Personal Care > Oral Hygiene > Power Toothbrushes & Accessories
117,473,"VeniCare New Replacement Toothbrush Heads for Philips Sonicare ProResults HX6013/HX6014, 8 Pack",Health & Beauty > Personal Care > Oral Hygiene > Power Toothbrushes & Accessories
118,473,"violife vs2t572-confetti slim sonic toothbrush, confetti",Health & Beauty > Personal Care > Oral Hygiene > Power Toothbrushes & Accessories
119,473,waterpik wp-440 ffp white satin handle cordless professional with nano sonic toothbrush with crystal clear reservoir,Health & Beauty > Personal Care > Oral Hygiene > Power Toothbrushes & Accessories
120,473,"oral-b pro-health for me cross action toothbrush 1 count, 1.000 count (pack of 3)",Health & Beauty > Personal Care > Oral Hygiene > Power Toothbrushes & Accessories
121,473,philips sonicare healthy white toothbrush handle - bulk package,Health & Beauty > Personal Care > Oral Hygiene > Power Toothbrushes & Accessories
122,473,oral-b professional floss action replacement brush head 3 count,Health & Beauty > Personal Care > Oral Hygiene > Power Toothbrushes & Accessories
123,473,"oral-b end-tufted denture toothbrush 1 count, 1.000 count (pack of 6)",Health & Beauty > Personal Care > Oral Hygiene > Power Toothbrushes & Accessories
124,473,"Philips Sonicare HealthyWhite+ electric rechargeable toothbrush, HX8911",Health & Beauty > Personal Care > Oral Hygiene > Power Toothbrushes & Accessories
125,473,"the sonic seal for e-series sonicare replacement heads, 3 count (blue, pink, frost)",Health & Beauty > Personal Care > Oral Hygiene > Power Toothbrushes & Accessories
126,473,Used for Philips HX5100 Toothbrush Sonicare Travel Charger Base AC Power Electric Toothbrush Replace Charger in,Health & Beauty > Personal Care > Oral Hygiene > Power Toothbrushes & Accessories
127,473,philips sonicare hx9382 / 54 diamondclean black dental professional model electric toothbrush,Health & Beauty > Personal Care > Oral Hygiene > Power Toothbrushes & Accessories
128,473,"sonimart premium ultra soft sensitive replacement toothbrush heads 4-pack, replaces philips sonicare hx6053 sensitive, fits philips sonicare 2 series",Health & Beauty > Personal Care > Oral Hygiene > Power Toothbrushes & Accessories
129,473,"Philips Sonicare DiamondClean replacement toothbrush heads, HX6063/64, White 3 count",Health & Beauty > Personal Care > Oral Hygiene > Power Toothbrushes & Accessories
130,473,philips sonicare hx8332/11,Health & Beauty > Personal Care > Oral Hygiene > Power Toothbrushes & Accessories
131,473,hx9170/10 flexcare platinum rechargeable electric toothbrush with uv sanitizer-philips sonicare,Health & Beauty > Personal Care > Oral Hygiene > Power Toothbrushes & Accessories
132,473,"Generic Replacement Philips Sonicare Toothbrush e Series Heads Fits: Advance, Clean Care, Elite, Essence, Xtreme (4)",Health & Beauty > Personal Care > Oral Hygiene > Power Toothbrushes & Accessories
133,473,"gum toothbrush star wars flash light,color may vary (pack of 3)",Health & Beauty > Personal Care > Oral Hygiene > Power Toothbrushes & Accessories
134,473,philips sonicare hx6921/30 flexcare plus rechargeable electric toothbrush health and beauty,Health & Beauty > Personal Care > Oral Hygiene > Power Toothbrushes & Accessories
135,473,"Philips Sonicare Toothbrush E Series Generic Rreplacement Heads Fits: Essence, Xtreme, Elite and Advance (4-pack) ...",Health & Beauty > Personal Care > Oral Hygiene > Power Toothbrushes & Accessories
136,473,philips sonicare for kids hx6032/05 small (4+) toothbrush heads - 2 pack,Health & Beauty > Personal Care > Oral Hygiene > Power Toothbrushes & Accessories
137,473,"Sonimart Standard Replacement Toothbrush Heads 4-pack, replaces Philips Sonicare",Health & Beauty > Personal Care > Oral Hygiene > Power Toothbrushes & Accessories
138,473,Charging Induction Cover/Stand for Sonicare DiamondClean Toothbrush Chargers,Health & Beauty > Personal Care > Oral Hygiene > Power Toothbrushes & Accessories
139,473,Premium Oral-B Floss Action Generic Replacement Toothbrush Heads (4),Health & Beauty > Personal Care > Oral Hygiene > Power Toothbrushes & Accessories
140,473,"Sonimart Premium Ultra Soft Sensitive Replacement Toothbrush Heads 4-pack, replaces Philips Sonicare HX6053 Sensitive",Health & Beauty > Personal Care > Oral Hygiene > Power Toothbrushes & Accessories
141,473,philips sonicare hx9033/64 pro results gum health brush heads health and beauty,Health & Beauty > Personal Care > Oral Hygiene > Power Toothbrushes & Accessories
142,473,oral-b 3d white power,Health & Beauty > Personal Care > Oral Hygiene > Power Toothbrushes & Accessories
143,473,"Genkent Replacement Philips Sonicare Toothbrush e Series Heads Fits: Advance, Clean Care, Elite, Essence, Xtreme (6)",Health & Beauty > Personal Care > Oral Hygiene > Power Toothbrushes & Accessories
144,473,"Pursonic High Power Rechargeable Sonic Toothbrush , Bonus 12 Toothbrush Heads",Health & Beauty > Personal Care > Oral Hygiene > Power Toothbrushes & Accessories
145,473,philips sonicare hx9033/64,Health & Beauty > Personal Care > Oral Hygiene > Power Toothbrushes & Accessories
146,473,"Philips Sonicare 2 Series Sonic Electric Rechargeable Toothbrush, Black, HX6211/07",Health & Beauty > Personal Care > Oral Hygiene > Power Toothbrushes & Accessories
147,473,philips sonicare hx3631/07,Health & Beauty > Personal Care > Oral Hygiene > Power Toothbrushes & Accessories
148,473,Darth Vader GUM Star Wars Power Battery Operated Toothbrush,Health & Beauty > Personal Care > Oral Hygiene > Power Toothbrushes & Accessories
149,473,Philips Sonicare HX8211/30 Airfloss Rechargeable Electric Flosser,Health & Beauty > Personal Care > Oral Hygiene > Power Toothbrushes & Accessories
150,473,"philips sonicare hx9002/64 intercare standard replacement brush heads, 2-pack",Health & Beauty > Personal Care > Oral Hygiene > Power Toothbrushes & Accessories
