,category_id,description,category_path
858,477,"PLATINUM Inglorious Fuzz Beard Care Kit For Men- Complete W/ Beard Comb- Pure Organic Golden Jojoba Oil, Chamomile & Argan Oil, Vit E, Aloe Vera - Beard Hair Skin Conditioner- Unscented",Health & Beauty > Personal Care > Shaving & Hair Removal > After Shaves & Grooming Aids
859,477,"beard balm natural leave in conditioner, 1.6 ounce new",Health & Beauty > Personal Care > Shaving & Hair Removal > After Shaves & Grooming Aids
860,477,eau sauvage by christian dior for men. aftershave 3.4 oz / 100 ml.,Health & Beauty > Personal Care > Shaving & Hair Removal > After Shaves & Grooming Aids
861,477,styptic pencil in crystal holster 12g block by laboratoires osma,Health & Beauty > Personal Care > Shaving & Hair Removal > After Shaves & Grooming Aids
862,477,"Tend Skin the Skin Care Solution for Men and Women 4oz ""pack of 2""",Health & Beauty > Personal Care > Shaving & Hair Removal > After Shaves & Grooming Aids
863,477,Badrick's Da Balm Beard Balm for Healthy Beard Growth,Health & Beauty > Personal Care > Shaving & Hair Removal > After Shaves & Grooming Aids
864,477,Basic Beard Care Kit,Health & Beauty > Personal Care > Shaving & Hair Removal > After Shaves & Grooming Aids
865,477,Beard Oil and Mustache Conditiner with Jojoba Oil to Naturally Condition and Style your Beard 30ml (1oz),Health & Beauty > Personal Care > Shaving & Hair Removal > After Shaves & Grooming Aids
866,477,"Beard Balm for The Modern Gentleman by Liberty Premium Grooming Co. â» Premier Cedar + Pine Whisker Softener & Conditioner w/ Natural Blend Of Essential Oils for Your Goatee, Mustache, & More",Health & Beauty > Personal Care > Shaving & Hair Removal > After Shaves & Grooming Aids
867,477,HAVANA - After Shave Lotion for Men - Post Shave Balm for All Skin Types - Tobacco Scented Moisturizer w/Shea,Health & Beauty > Personal Care > Shaving & Hair Removal > After Shaves & Grooming Aids
868,477,Beard Oil and Conditioner-100% Organic Pure Raw Unrefined Cold-Pressed Jojoba Oil and Argan Oil-Softens Beard,Health & Beauty > Personal Care > Shaving & Hair Removal > After Shaves & Grooming Aids
869,477,Clinique Post Shave Soother - 75ml/2.5oz,Health & Beauty > Personal Care > Shaving & Hair Removal > After Shaves & Grooming Aids
870,477,Beard Oil Conditioner,Health & Beauty > Personal Care > Shaving & Hair Removal > After Shaves & Grooming Aids
871,477,Imperial Barber Products Bergamot After-Shave Alcohol Free,Health & Beauty > Personal Care > Shaving & Hair Removal > After Shaves & Grooming Aids
872,477,Beard Oil - 100% Pure and Natural Beard Oil with Fresh Mint to Condition and,Health & Beauty > Personal Care > Shaving & Hair Removal > After Shaves & Grooming Aids
873,477,"Tend Skin Liquid, For Men and Women by Tend Skin",Health & Beauty > Personal Care > Shaving & Hair Removal > After Shaves & Grooming Aids
874,477,pi de givenchy by givenchy for men 3.3 oz after shave pour,Health & Beauty > Personal Care > Shaving & Hair Removal > After Shaves & Grooming Aids
875,477,"Best Beard Grooming Kit for Men. Kent Beard Comb, Mustache Comb with Firm Military Boar Bristle Hair Brush",Health & Beauty > Personal Care > Shaving & Hair Removal > After Shaves & Grooming Aids
876,477,"anthony logistics for men aftershave balm, 3 fl. oz.",Health & Beauty > Personal Care > Shaving & Hair Removal > After Shaves & Grooming Aids
877,477,"Badass Beard Care Butterfly Comb for Men - 100% Stainless Steel, Extremely",Health & Beauty > Personal Care > Shaving & Hair Removal > After Shaves & Grooming Aids
878,477,alum block by osma - 2 pack value health and beauty,Health & Beauty > Personal Care > Shaving & Hair Removal > After Shaves & Grooming Aids
879,477,Beard Balm 4 oz - 50% Less Per Ounce - Twice The Size - Expert Crafted With 100% Natural Ingredients - Softens and Conditions Your Beard - Best Leave-,Health & Beauty > Personal Care > Shaving & Hair Removal > After Shaves & Grooming Aids
880,477,"boucheron jaipur men after shave balm, 5.0 ounce",Health & Beauty > Personal Care > Shaving & Hair Removal > After Shaves & Grooming Aids
881,477,royall lyme by royall fragrances for men. aftershave lotion cologne 8 ounces royall fragrances; health and beauty,Health & Beauty > Personal Care > Shaving & Hair Removal > After Shaves & Grooming Aids
882,477,"taylor of old bond street alum block, 2.65 oz.",Health & Beauty > Personal Care > Shaving & Hair Removal > After Shaves & Grooming Aids
883,477,Escape Cedarwood Scent - #1 RATED Leven Rose Beard Oil and Leave-in Conditioner,Health & Beauty > Personal Care > Shaving & Hair Removal > After Shaves & Grooming Aids
884,477,the classic man beard oil - cedarwood and clove - essential oil scented beard conditioner by the 2bits man (1 oz.) new,Health & Beauty > Personal Care > Shaving & Hair Removal > After Shaves & Grooming Aids
885,477,"CanYouHandleBar Secondary Moustache Wax 1 OZ Can: Extra Strength, No Added Scent or Colors, All Natural",Health & Beauty > Personal Care > Shaving & Hair Removal > After Shaves & Grooming Aids
886,477,"tend skin care solution refillable roll on, 2.5 ounce new",Health & Beauty > Personal Care > Shaving & Hair Removal > After Shaves & Grooming Aids
887,477,"Temperance Beard Oil | Premium, Unscented Natural Oil | Best Softener and Conditioner",Health & Beauty > Personal Care > Shaving & Hair Removal > After Shaves & Grooming Aids
888,477,"Best After-shave Balm, Unscented, Premium Aftershave Lotion, Soothes and Moisturizes Face after shaving, Does Not Dry The Skin, Eliminates Razor Burn",Health & Beauty > Personal Care > Shaving & Hair Removal > After Shaves & Grooming Aids
889,477,Suavecito Premium Blends Sandalwood Aftershave Balm,Health & Beauty > Personal Care > Shaving & Hair Removal > After Shaves & Grooming Aids
890,477,Honest Abe's Beard Balm 2 oz Hand Made Leave In Conditioner with Organic &,Health & Beauty > Personal Care > Shaving & Hair Removal > After Shaves & Grooming Aids
891,477,SUPER SALE! Beard Oil and,Health & Beauty > Personal Care > Shaving & Hair Removal > After Shaves & Grooming Aids
892,477,Beard Brush And Beard Comb Set With Cloth Drawstring Bag Grooming Kit Made From Handmade Solid Wood And 100% Natural Boar Bristle By Heroic STAR Perfect For Use With Beard Oil Balm Wax And Pomade,Health & Beauty > Personal Care > Shaving & Hair Removal > After Shaves & Grooming Aids
893,477,Jason Shave Therapy Anti-Razor Burn Lotion - 8 oz - 2 pk,Health & Beauty > Personal Care > Shaving & Hair Removal > After Shaves & Grooming Aids
894,477,AleHorn 100% Handmade Horn Beard and Mustache Comb,Health & Beauty > Personal Care > Shaving & Hair Removal > After Shaves & Grooming Aids
895,477,Leven Rose Beard Oil and Leave-In Conditioner - 1 oz,Health & Beauty > Personal Care > Shaving & Hair Removal > After Shaves & Grooming Aids
896,477,mennen afta after shave skin conditioner original 3 fl oz pack of 2,Health & Beauty > Personal Care > Shaving & Hair Removal > After Shaves & Grooming Aids
897,477,"Aveeno Men's Fragrance Free After Shave Lotion, 3.4 Ounce, (Pack of 3)",Health & Beauty > Personal Care > Shaving & Hair Removal > After Shaves & Grooming Aids
898,477,"CLn BodyWash Physician-Developed Therapeutic Body Wash, For Skin Prone to Eczema (atopic dermatitis), Rash, Folliculitis (ingrown hairs, razor bumps), Acne, and Infection (8 Ounces)",Health & Beauty > Personal Care > Shaving & Hair Removal > After Shaves & Grooming Aids
899,477,Beard Brush And Beard Comb Set Soft Boar Bristle Perfect For Use With Beard,Health & Beauty > Personal Care > Shaving & Hair Removal > After Shaves & Grooming Aids
900,477,protein after shave lotion 4 oz,Health & Beauty > Personal Care > Shaving & Hair Removal > After Shaves & Grooming Aids
901,477,clinique for men post-shave healer / soother 75ml/2.5oz,Health & Beauty > Personal Care > Shaving & Hair Removal > After Shaves & Grooming Aids
902,477,2oz GET IT G RAZOR RELIEF,Health & Beauty > Personal Care > Shaving & Hair Removal > After Shaves & Grooming Aids
903,477,"Dare to Beard, Original, Beard Oil, Citrus Scent, 100% Natural, Grapeseed Oil, Jojoba Oil, Sweet Almond Oil, Bergamot",Health & Beauty > Personal Care > Shaving & Hair Removal > After Shaves & Grooming Aids
904,477,"The Regular Guy Beard Oil Conditioner & Softener. Pure & Natural, Handcrafted",Health & Beauty > Personal Care > Shaving & Hair Removal > After Shaves & Grooming Aids
905,477,"clubman pinaud moustache wax with free brush/comb applicator, chestnut, 0.5-ounce (pack of 3)",Health & Beauty > Personal Care > Shaving & Hair Removal > After Shaves & Grooming Aids
906,477,"BlackBeard's Pride Beard & Mustache Balm, Leave-in Hair and Skin Conditioner, All Natural Pure Botanicals, Butters, and Essential Oils, Suitable for a",Health & Beauty > Personal Care > Shaving & Hair Removal > After Shaves & Grooming Aids
907,477,"l'occitane l'occitan after shave balm, 2.5 fl. oz.",Health & Beauty > Personal Care > Shaving & Hair Removal > After Shaves & Grooming Aids
908,477,"Lab Series 3-in-1 Post-Shave Remedy, 1.7 Ounce by Aramis",Health & Beauty > Personal Care > Shaving & Hair Removal > After Shaves & Grooming Aids
909,477,"eShave After Shave Cream, White Tea, 4 oz.",Health & Beauty > Personal Care > Shaving & Hair Removal > After Shaves & Grooming Aids
910,477,Beard Oil by Liberty Premium Grooming Co. ; Small-Batch Limited Collection,Health & Beauty > Personal Care > Shaving & Hair Removal > After Shaves & Grooming Aids
911,477,Beard Balm Natural Leave In,Health & Beauty > Personal Care > Shaving & Hair Removal > After Shaves & Grooming Aids
912,477,"Myhsmooth GS-SM-NF Handmade Natural Green Sandalwood No Static Comb-pocket Comb (Beard) with Aromatic Scent for Long and Short Beards-perfect Mustache Comb(4.1"" Two Sides)",Health & Beauty > Personal Care > Shaving & Hair Removal > After Shaves & Grooming Aids
913,477,Best Beard & Mustache Scissors With Comb For Precise Facial Hair Trimming - Sharpness and Stainless Steel Give These Scissors Durability That Will Las,Health & Beauty > Personal Care > Shaving & Hair Removal > After Shaves & Grooming Aids
914,477,oxford & wells® soothing after shave balm - 2 ounce travel size,Health & Beauty > Personal Care > Shaving & Hair Removal > After Shaves & Grooming Aids
915,477,"Beard Brush for men with 100% Natural Anti-Static Boar Bristles from Anjou, Used with Oil or Balm for Healthy and Clean Facial Hair, Grooms Beards and Moustaches",Health & Beauty > Personal Care > Shaving & Hair Removal > After Shaves & Grooming Aids
916,477,Growing Dinosaurs12 Pack Windy City Novelties,Health & Beauty > Personal Care > Shaving & Hair Removal > After Shaves & Grooming Aids
917,477,"Beard Comb (Wooden) - Pocket Sized for Men On the Go - Wood Design Ensures No Static Even for Long Beards - Suitable for Use With Grooming Oil, Balm a",Health & Beauty > Personal Care > Shaving & Hair Removal > After Shaves & Grooming Aids
918,477,"Beard Balm - Fragrance Free - Premium Leave-in Beard and Skin Conditioner & Softener - Best All Natural Organic Oils, Butters & Waxes for Men By The G",Health & Beauty > Personal Care > Shaving & Hair Removal > After Shaves & Grooming Aids
919,477,Beard Oil for The Modern Gentleman by Liberty Premium Grooming Co. ; Premier Cedar + Pine Whisker Softener & Conditioner,Health & Beauty > Personal Care > Shaving & Hair Removal > After Shaves & Grooming Aids
920,477,Natural Beard Oil - 1 oz,Health & Beauty > Personal Care > Shaving & Hair Removal > After Shaves & Grooming Aids
921,477,"Beard Brush & beard Comb Kit - Handmade Organic Solid Wood, No Snag & Anti Static, 100% Natural Boar Bristle Soft Pocket hair Brush and Comb - for Head Hair, Men Beard & Mustache by Repsol Care",Health & Beauty > Personal Care > Shaving & Hair Removal > After Shaves & Grooming Aids
922,477,"professor fuzzworthy's beard care gloss and conditioner with organic oils from tasmania, australia 40ml",Health & Beauty > Personal Care > Shaving & Hair Removal > After Shaves & Grooming Aids
923,477,"Aloe Vera Gel for Face, Hair & Body :: Enriched with Essential Oils :: 100% Pure Concentrate, Certified Organic Aloe Vera :: Clinical Formulation - Best For Dry Skin, Acne, Insect Bites, Aging Skin and Razor Bumps :: 100ml (4oz)",Health & Beauty > Personal Care > Shaving & Hair Removal > After Shaves & Grooming Aids
924,477,blue stratos 100ml aftershave,Health & Beauty > Personal Care > Shaving & Hair Removal > After Shaves & Grooming Aids
925,477,"giorgio armani aftershave for men, armani diamonds, 2.5 fluid ounce",Health & Beauty > Personal Care > Shaving & Hair Removal > After Shaves & Grooming Aids
926,477,Northern Fir Quality Beard Oil Conditioner and Softener,Health & Beauty > Personal Care > Shaving & Hair Removal > After Shaves & Grooming Aids
927,477,herban cowboy dusk soothing carrot and cucumber after shave balm - 3.4 oz,Health & Beauty > Personal Care > Shaving & Hair Removal > After Shaves & Grooming Aids
928,477,paul sebastian men's aftershave balm - 4 oz,Health & Beauty > Personal Care > Shaving & Hair Removal > After Shaves & Grooming Aids
929,477,menscience post-shave repair - 4 oz,Health & Beauty > Personal Care > Shaving & Hair Removal > After Shaves & Grooming Aids
930,477,avene after-shave balm - 2.53 oz,Health & Beauty > Personal Care > Shaving & Hair Removal > After Shaves & Grooming Aids
931,477,"every man jack face lotion, post-shave, fragrance-free - 4.2 fl oz",Health & Beauty > Personal Care > Shaving & Hair Removal > After Shaves & Grooming Aids
932,477,aramis classic advanced moisture after shave - 4.1 fl oz,Health & Beauty > Personal Care > Shaving & Hair Removal > After Shaves & Grooming Aids
933,477,aramis men's 3.4-ounce after shave balm,Health & Beauty > Personal Care > Shaving & Hair Removal > After Shaves & Grooming Aids
934,477,obsession men by calvin klein men's 4-ounce after shave splash,Health & Beauty > Personal Care > Shaving & Hair Removal > After Shaves & Grooming Aids
935,477,lacoste challenge men's 2.5-ounce after shave balm,Health & Beauty > Personal Care > Shaving & Hair Removal > After Shaves & Grooming Aids
936,477,nautica 'competition' 2.4-ounce men's aftershave (tester),Health & Beauty > Personal Care > Shaving & Hair Removal > After Shaves & Grooming Aids
937,477,tend skin® liquid skin care solution - 4 oz,Health & Beauty > Personal Care > Shaving & Hair Removal > After Shaves & Grooming Aids
938,477,every man jack cedarwood beard oil - 1 oz,Health & Beauty > Personal Care > Shaving & Hair Removal > After Shaves & Grooming Aids
939,477,jason shave lotion anti-razor burn - 8 oz,Health & Beauty > Personal Care > Shaving & Hair Removal > After Shaves & Grooming Aids
940,477,burt's bees natural skin care aftershave lotion for men - 2.5 oz,Health & Beauty > Personal Care > Shaving & Hair Removal > After Shaves & Grooming Aids
941,477,pacific shaving co. caffeinated after shave cream - 3 oz,Health & Beauty > Personal Care > Shaving & Hair Removal > After Shaves & Grooming Aids
942,477,"old spice classic after shave, 6.37 fl oz",Health & Beauty > Personal Care > Shaving & Hair Removal > After Shaves & Grooming Aids
943,477,"nivea for men, for normal to dry skin after shave replenishing balm, 3.3 fl oz",Health & Beauty > Personal Care > Shaving & Hair Removal > After Shaves & Grooming Aids
944,477,"aqua velva after shave, musk scent, 3.5 fl oz",Health & Beauty > Personal Care > Shaving & Hair Removal > After Shaves & Grooming Aids
945,477,"special reserve, after shave cologne clubman 6.0 fl oz",Health & Beauty > Personal Care > Shaving & Hair Removal > After Shaves & Grooming Aids
946,477,men's after shave lotion fragrance free aveeno,Health & Beauty > Personal Care > Shaving & Hair Removal > After Shaves & Grooming Aids
947,477,"clubman special reserve, after shave cologne 6.0 fl oz",Health & Beauty > Personal Care > Shaving & Hair Removal > After Shaves & Grooming Aids
948,477,tea tree after shave & bump preventer sheamoisture 4.0 oz.,Health & Beauty > Personal Care > Shaving & Hair Removal > After Shaves & Grooming Aids
949,477,h2o plus oasis oil-free post shave balm - men's blue 3.4oz,Health & Beauty > Personal Care > Shaving & Hair Removal > After Shaves & Grooming Aids
950,477,"paul sebastian after shave, 4.0 oz. no color",Health & Beauty > Personal Care > Shaving & Hair Removal > After Shaves & Grooming Aids
951,477,Mr Rugged Pocket Beard Comb - Wide and Fine Teeth Sides - Pear Wood Comb - Wooden Handmade Brushes Beard Oils & Balms To Promote Softer & Thicker Growth - Better for Beards Than Metal or Plastic,Health & Beauty > Personal Care > Shaving & Hair Removal > After Shaves & Grooming Aids
952,477,"Stately Beard Co - Cedar Falls Beard Balm - All Natural and Organic, 2oz",Health & Beauty > Personal Care > Shaving & Hair Removal > After Shaves & Grooming Aids
953,477,Premium Beard Comb - Handmade Sandalwood Beard and Mustache Comb - Fine and Coarse Tooth [No.9] - Mouth Watering Scent - In a Rustic Gift Bag,Health & Beauty > Personal Care > Shaving & Hair Removal > After Shaves & Grooming Aids
954,477,6ml Protable Refillable Perfume Aftershave Atomizer Spray Bottle for Traveling Handbag (1 Set-7 Colors),Health & Beauty > Personal Care > Shaving & Hair Removal > After Shaves & Grooming Aids
955,477,NEW Age + Damage Defense FACIAL MOISTURIZER FOR MEN - 4 OZ - Soothing Aftershave Lotion & Powerful Anti-Aging Cream In One - All Natural With Certifie,Health & Beauty > Personal Care > Shaving & Hair Removal > After Shaves & Grooming Aids
956,477,ebarbershop deluxe mustache/beard grooming kit with wax in hard case,Health & Beauty > Personal Care > Shaving & Hair Removal > After Shaves & Grooming Aids
957,477,Jawbone Brother's Beard Balm with Leave in Conditioner - A Surprising Evolution,Health & Beauty > Personal Care > Shaving & Hair Removal > After Shaves & Grooming Aids
958,477,"Beardeur Beard Brush, Black Wild Boar Bristle, Best Firm Natural Wooden Round Comb, Men Skin Care, Distribute Oil In Your Facial Hair, Manage Any Must",Health & Beauty > Personal Care > Shaving & Hair Removal > After Shaves & Grooming Aids
959,477,Beard Brush 100% Boar Bristle - Best Small Bamboo Wooden Military Style Natural Grooming Mens Palm Brush - Can Be Used With Oil Or Balm To Shape - For,Health & Beauty > Personal Care > Shaving & Hair Removal > After Shaves & Grooming Aids
960,477,SHG is the Real Beard Oil and Leave-In Conditioner 100% Natural With Argan,Health & Beauty > Personal Care > Shaving & Hair Removal > After Shaves & Grooming Aids
961,477,"Beard Oil Softener & Conditioner Fragrance Free Complete Bundle with Wooden Comb, All Natural Vitamin E & Jojoba",Health & Beauty > Personal Care > Shaving & Hair Removal > After Shaves & Grooming Aids
962,477,Honest Amish Heavy Duty Beard Balm -New Large 4 Oz Twist Tin New,Health & Beauty > Personal Care > Shaving & Hair Removal > After Shaves & Grooming Aids
963,477,"Best Unscented Beard Oil by Sophisticated Beardsman, Handcrafted Blend of Premium",Health & Beauty > Personal Care > Shaving & Hair Removal > After Shaves & Grooming Aids
964,477,KOHANA - UNSCENTED Post Shave Moisturizer and Face Lotion for Men with Sensitive Skin. Luxury All-Natural Aftershave with Skin Nourishing Ingredients,Health & Beauty > Personal Care > Shaving & Hair Removal > After Shaves & Grooming Aids
965,477,"Aveeno Active Naturals Men's After Shave Lotion, 3.4oz (Pack of 3)",Health & Beauty > Personal Care > Shaving & Hair Removal > After Shaves & Grooming Aids
966,477,bump fighter mens disposable razors mens - 12-4packs (48 count),Health & Beauty > Personal Care > Shaving & Hair Removal > After Shaves & Grooming Aids
967,477,Magic Beard Balm Coal,Health & Beauty > Personal Care > Shaving & Hair Removal > After Shaves & Grooming Aids
968,477,Best Sandalwood Beard Oil & Conditioner for Men - 1 oz,Health & Beauty > Personal Care > Shaving & Hair Removal > After Shaves & Grooming Aids
969,477,"proraso liquid after shave cream, 3.4 ounce",Health & Beauty > Personal Care > Shaving & Hair Removal > After Shaves & Grooming Aids
970,477,"billy jealousy shaved ice after-shave balm, 3 ounces",Health & Beauty > Personal Care > Shaving & Hair Removal > After Shaves & Grooming Aids
971,477,"Top Aloe Vera Gel for Women & Men to help Moisturize Face and Regenerating Hands and Feet, Soothing Lotion for Sunburn. Works well for Treatment of Psoriasis, Eczema, Razor Bumps, Dry Skin, Itchy Scalp and Bug Bites. Used as a Repairing Beauty Mask.",Health & Beauty > Personal Care > Shaving & Hair Removal > After Shaves & Grooming Aids
972,477,"sabon aftershave cream, patchouli citrus, 5.28 fl. oz.",Health & Beauty > Personal Care > Shaving & Hair Removal > After Shaves & Grooming Aids
973,477,dream beard - the sampler 5 pack beard oil,Health & Beauty > Personal Care > Shaving & Hair Removal > After Shaves & Grooming Aids
974,477,"Best RETRO Beard Oil and Beard Comb bundle kit with FREE Beard Care eBook! - Fragrance Free Softener, Conditioner & Beard Growth for Men by Prophet and Tools!",Health & Beauty > Personal Care > Shaving & Hair Removal > After Shaves & Grooming Aids
975,477,"the body shop for men maca root razor relief, 3.3-fluid ounce",Health & Beauty > Personal Care > Shaving & Hair Removal > After Shaves & Grooming Aids
976,477,beard balm,Health & Beauty > Personal Care > Shaving & Hair Removal > After Shaves & Grooming Aids
977,477,"Old Spice After Shave Lotion Fresh Scent, 4.25 Ounces, 3 Pack",Health & Beauty > Personal Care > Shaving & Hair Removal > After Shaves & Grooming Aids
978,477,Natural Man Unscented Beard Oil 4 Ounce All Natural Beard Conditioner (No Added,Health & Beauty > Personal Care > Shaving & Hair Removal > After Shaves & Grooming Aids
979,477,"beard oil and conditioner, fragrance free, glass bottle with glass dropper, gives you a respectable beard that is healthy looking, and kissable",Health & Beauty > Personal Care > Shaving & Hair Removal > After Shaves & Grooming Aids
980,477,Princereigns Post-Shave Serum to Remove Ingrown Hairs and Razor Bumps,Health & Beauty > Personal Care > Shaving & Hair Removal > After Shaves & Grooming Aids
981,477,hugo by hugo boss for men. aftershave 5.0 oz.,Health & Beauty > Personal Care > Shaving & Hair Removal > After Shaves & Grooming Aids
982,477,The Fresh Man Beard Oil - Spearmint & Eucalyptus Beard Oil - Scented Beard,Health & Beauty > Personal Care > Shaving & Hair Removal > After Shaves & Grooming Aids
983,477,Beardilizer ® Beard Oil Collection - #23 Lumberjack Cedar Leaf 4 Oz - Made,Health & Beauty > Personal Care > Shaving & Hair Removal > After Shaves & Grooming Aids
984,477,"Smooth Viking Beard Balm with Shea Butter and Argan Oil, 2 Ounce",Health & Beauty > Personal Care > Shaving & Hair Removal > After Shaves & Grooming Aids
985,477,heal post-shave healer for head and face 1oz after shave by bee bald,Health & Beauty > Personal Care > Shaving & Hair Removal > After Shaves & Grooming Aids
986,477,"beard oil and conditioner, fragrance free, glass bottle with glass dropper, gives you a respectable beard that is healthy looking, and kissable new",Health & Beauty > Personal Care > Shaving & Hair Removal > After Shaves & Grooming Aids
987,477,The Woods Man Beard Oil,Health & Beauty > Personal Care > Shaving & Hair Removal > After Shaves & Grooming Aids
988,477,Woody's Quality Grooming for Men Beard Oil 1.0 Ounce,Health & Beauty > Personal Care > Shaving & Hair Removal > After Shaves & Grooming Aids
989,477,Morocco Beard Oil by The Bearded Bastard,Health & Beauty > Personal Care > Shaving & Hair Removal > After Shaves & Grooming Aids
990,477,thayers - witch hazel after shave with aloe vera extra strength - 4 oz.,Health & Beauty > Personal Care > Shaving & Hair Removal > After Shaves & Grooming Aids
991,477,clubman pinaud styptic pencil travel size .33 oz (pack of 3),Health & Beauty > Personal Care > Shaving & Hair Removal > After Shaves & Grooming Aids
992,477,"Beard Hunk Beard Oil - All Natural - MOISTURIZING, CONDITIONING, RELIEVES ITCHINESS",Health & Beauty > Personal Care > Shaving & Hair Removal > After Shaves & Grooming Aids
993,477,Honest Amish - Pure Beard Oil - 2 Ounce - Fragrance Free,Health & Beauty > Personal Care > Shaving & Hair Removal > After Shaves & Grooming Aids
994,477,"The Real Man Company Beard Oil and Conditioner for Men,Guaranteed Awesome,Manly and Kissable Beard or your Money Back!100% Organic Premium Beard Care",Health & Beauty > Personal Care > Shaving & Hair Removal > After Shaves & Grooming Aids
995,477,gabels sta-cool after shave with menthol 16oz/473ml,Health & Beauty > Personal Care > Shaving & Hair Removal > After Shaves & Grooming Aids
996,477,"Ingrown Hair Treatment for Women & Men - 8 OZ ORGANIC Citrus Herb Formula for Razor Bumps, Razor Burn & Ingrown Hairs - Purifies, Disinfects & Soothes the Skin",Health & Beauty > Personal Care > Shaving & Hair Removal > After Shaves & Grooming Aids
997,477,Beardilizer ® Beard Growth Topical Spray - Sandalwood - 4 oz,Health & Beauty > Personal Care > Shaving & Hair Removal > After Shaves & Grooming Aids
998,477,Wild Willie's Beard Butter - The Only Amazing Beard Balm with 13 Natural Locally Sourced Ingredients to Condition,Health & Beauty > Personal Care > Shaving & Hair Removal > After Shaves & Grooming Aids
999,477,Fine Tooth Sandalwood Beard Comb and Leather Made in the USA Carrying Pocket,Health & Beauty > Personal Care > Shaving & Hair Removal > After Shaves & Grooming Aids
1000,477,Bump Patrol After Shave 2,Health & Beauty > Personal Care > Shaving & Hair Removal > After Shaves & Grooming Aids
1001,477,"Earth Science 145 After Shave Skin Soother, 5.9 Fluid Ounce",Health & Beauty > Personal Care > Shaving & Hair Removal > After Shaves & Grooming Aids
1002,477,"#1 Best Beard & Mustache Scissors With Comb For Precise Facial Hair Trimming - Sharpness and Stainless Steel Give These Scissors Durability That Will Last, Order Your's Now!",Health & Beauty > Personal Care > Shaving & Hair Removal > After Shaves & Grooming Aids
