,category_id,description,category_path
2938,477,"Beard Oil by Mountaineer Brand, Barefoot/UNSCENTED: Beard Conditioning Oil, 2 Ounce bottle",Health & Beauty > Personal Care > Shaving & Hair Removal > After Shaves & Grooming Aids
2939,477,Organic Beard Oil by All American Gentlemen (2 fl oz) - 100% Natural Beard,Health & Beauty > Personal Care > Shaving & Hair Removal > After Shaves & Grooming Aids
2940,477,Best Beard Oil,Health & Beauty > Personal Care > Shaving & Hair Removal > After Shaves & Grooming Aids
2941,477,eshave after shave cream,Health & Beauty > Personal Care > Shaving & Hair Removal > After Shaves & Grooming Aids
2942,477,razorock 100% natural handmade aftershave wax 60ml,Health & Beauty > Personal Care > Shaving & Hair Removal > After Shaves & Grooming Aids
2943,477,"Beard Brush by Zilberhaar - Pure Boar Bristle l Perfect Skin Care l for all Beard Balms and Beard Oils l Exfoliates Skin, helps Softening and Conditio",Health & Beauty > Personal Care > Shaving & Hair Removal > After Shaves & Grooming Aids
2944,477,212 Sexy by Carolina Herrera For Men. Aftershave 3.3-Ounces by 212 Sexy,Health & Beauty > Personal Care > Shaving & Hair Removal > After Shaves & Grooming Aids
2945,477,8 oz genuine ogallala bay rum & sandalwood aftershave old-time looking bottle and label.,Health & Beauty > Personal Care > Shaving & Hair Removal > After Shaves & Grooming Aids
2946,477,Beard Oil and Mustache Oil for Bear Men Fragrance Free Organic Leave in Conditioner and Softener Unscented,Health & Beauty > Personal Care > Shaving & Hair Removal > After Shaves & Grooming Aids
2947,477,Detroit Grooming Co. Beard Oil - The Corktown 0.5 Oz.| Oil For All Beards | Helps Soften And Condition Dry And Itchy Beards,Health & Beauty > Personal Care > Shaving & Hair Removal > After Shaves & Grooming Aids
2948,477,dolce & gabbana the one after shave balm - 75ml/2.5oz,Health & Beauty > Personal Care > Shaving & Hair Removal > After Shaves & Grooming Aids
2949,477,"dove men + care post shave balm, sensitive, 3.4 oz (pack of 3)",Health & Beauty > Personal Care > Shaving & Hair Removal > After Shaves & Grooming Aids
2950,477,black opal mens razor bumps solution 1oz,Health & Beauty > Personal Care > Shaving & Hair Removal > After Shaves & Grooming Aids
2951,477,canyouhandlebar extra strength moustache wax: secondary <> made with local michigan beeswax,Health & Beauty > Personal Care > Shaving & Hair Removal > After Shaves & Grooming Aids
2952,477,Beard Salve by All American Gentlemen (2 oz) - Beard Balm and Mustache Wax,Health & Beauty > Personal Care > Shaving & Hair Removal > After Shaves & Grooming Aids
2953,477,"Ultimate Beard Kit Contains: Organic Beard Balm, Organic Beard Oil, Organic",Health & Beauty > Personal Care > Shaving & Hair Removal > After Shaves & Grooming Aids
2954,477,"Burt's Bees Natural Skin Care Aftershave for Men, 2.5 Fluid Ounce",Health & Beauty > Personal Care > Shaving & Hair Removal > After Shaves & Grooming Aids
2955,477,Art Naturals Organic Beard Oil & Leave-In Conditioner 2 oz- 100% Pure & Natural Unscented - Best for Groomed Beard,Health & Beauty > Personal Care > Shaving & Hair Removal > After Shaves & Grooming Aids
2956,477,Natural Man Bay Lime Beard Oil 4oz - All Natural Beard Conditioner by Botanical Skin Works,Health & Beauty > Personal Care > Shaving & Hair Removal > After Shaves & Grooming Aids
2957,477,Beard Balm for Men - Beard,Health & Beauty > Personal Care > Shaving & Hair Removal > After Shaves & Grooming Aids
2958,477,Vera Wang By Vera Wang For Men. Aftershave 3.4 oz by Vera Wang,Health & Beauty > Personal Care > Shaving & Hair Removal > After Shaves & Grooming Aids
2959,477,President Garfield's Cool Cat 100% Organic Beard Oil 2 oz Pump Bottle with Tea Tree,Health & Beauty > Personal Care > Shaving & Hair Removal > After Shaves & Grooming Aids
2960,477,Ultimate Grooming Kit for Men. Kent Comb and Brush Strokes Firm Military Boar Bristle Beard Brush Beard and Mustache,Health & Beauty > Personal Care > Shaving & Hair Removal > After Shaves & Grooming Aids
2961,477,"Beard Balm for Men- Heavy Duty Leave-In Wax Beard Conditioner- Combine With Beard Oil for Best Results- Styles, Strengthens & Thickens Bearded Men Wit",Health & Beauty > Personal Care > Shaving & Hair Removal > After Shaves & Grooming Aids
2962,477,"gillette series after shave lotion, sensitive skin - 2.54 fl oz",Health & Beauty > Personal Care > Shaving & Hair Removal > After Shaves & Grooming Aids
2963,477,sheamoisture shave tea tree after shave & bump preventer - 4 oz,Health & Beauty > Personal Care > Shaving & Hair Removal > After Shaves & Grooming Aids
2964,477,art of shaving 3.3-ounce lavender after-shave balm 1 pack,Health & Beauty > Personal Care > Shaving & Hair Removal > After Shaves & Grooming Aids
2965,477,every man jackmj 1.0oz beard oil cedarwood,Health & Beauty > Personal Care > Shaving & Hair Removal > After Shaves & Grooming Aids
2966,477,"mennen afta after shave fresh skin conditioner, 3 oz",Health & Beauty > Personal Care > Shaving & Hair Removal > After Shaves & Grooming Aids
2967,477,"neutrogena men razor defense post shave lotion, 2.5 fl oz",Health & Beauty > Personal Care > Shaving & Hair Removal > After Shaves & Grooming Aids
2968,477,afta after shave skin conditioner original 3 oz (pack of 2),Health & Beauty > Personal Care > Shaving & Hair Removal > After Shaves & Grooming Aids
2969,477,"british sterling men's after shave, 3.8 fl oz",Health & Beauty > Personal Care > Shaving & Hair Removal > After Shaves & Grooming Aids
2970,477,english leather mens after shave 34 fl oz,Health & Beauty > Personal Care > Shaving & Hair Removal > After Shaves & Grooming Aids
2971,477,every man jack face lotion and post shave signature mint 4.2 oz.,Health & Beauty > Personal Care > Shaving & Hair Removal > After Shaves & Grooming Aids
2972,477,burberry brit rhythm men's after shave balm none 5.0oz,Health & Beauty > Personal Care > Shaving & Hair Removal > After Shaves & Grooming Aids
2973,477,The Everywhere Crop All Over Palm Ombre (95G) XS,Health & Beauty > Personal Care > Shaving & Hair Removal > After Shaves & Grooming Aids
2974,477,"gucci made to measure after shave balm, 2.5 oz no color",Health & Beauty > Personal Care > Shaving & Hair Removal > After Shaves & Grooming Aids
2975,477,"dolce&gabbana the one sport after shave balm, 2.5 oz no color",Health & Beauty > Personal Care > Shaving & Hair Removal > After Shaves & Grooming Aids
2976,477,"calvin klein euphoria men aftershave balm, 6.7 oz no color",Health & Beauty > Personal Care > Shaving & Hair Removal > After Shaves & Grooming Aids
2977,477,"the art of shaving after-shave balm - unscented, 1 oz no color",Health & Beauty > Personal Care > Shaving & Hair Removal > After Shaves & Grooming Aids
2978,477,"ralph lauren polo blue after shave gel, 4.2 fl. oz. no color",Health & Beauty > Personal Care > Shaving & Hair Removal > After Shaves & Grooming Aids
2979,477,"clinique for men post-shave soother, 2.5 fl oz",Health & Beauty > Personal Care > Shaving & Hair Removal > After Shaves & Grooming Aids
2980,477,beardbrand beard oil tree ranger one size,Health & Beauty > Personal Care > Shaving & Hair Removal > After Shaves & Grooming Aids
2981,477,issey miyake 'l'eau d'issey pour homme' after shave lotion one size,Health & Beauty > Personal Care > Shaving & Hair Removal > After Shaves & Grooming Aids
2982,477,profile™ 'recharge' age combating post-shave serum (nordstrom exclusive) one size,Health & Beauty > Personal Care > Shaving & Hair Removal > After Shaves & Grooming Aids
2983,477,l'occitane cade after shave balm none 2.5 oz,Health & Beauty > Personal Care > Shaving & Hair Removal > After Shaves & Grooming Aids
2984,477,the art of shaving® sandalwood after-shave balm 3.3 oz,Health & Beauty > Personal Care > Shaving & Hair Removal > After Shaves & Grooming Aids
2985,477,walton wood farm beard balm blue one size,Health & Beauty > Personal Care > Shaving & Hair Removal > After Shaves & Grooming Aids
2986,477,chanel pour monsieur after shave moisturizer 2.5 oz,Health & Beauty > Personal Care > Shaving & Hair Removal > After Shaves & Grooming Aids
2987,477,kwik stop styptic powder,Health & Beauty > Personal Care > Shaving & Hair Removal > After Shaves & Grooming Aids
2988,477,mesmerize for men after shave conditioner,Health & Beauty > Personal Care > Shaving & Hair Removal > After Shaves & Grooming Aids
2989,477,tom ford cond beard oil neroli portof,Health & Beauty > Personal Care > Shaving & Hair Removal > After Shaves & Grooming Aids
2990,477,clinique men's post-shave healer,Health & Beauty > Personal Care > Shaving & Hair Removal > After Shaves & Grooming Aids
2991,477,Clinique For Men™ 2 in 1 Skin Hydrator + Beard Conditioner,Health & Beauty > Personal Care > Shaving & Hair Removal > After Shaves & Grooming Aids
2992,477,Clinique For Men™ Post-Shave Soother 2.5 fl. oz.,Health & Beauty > Personal Care > Shaving & Hair Removal > After Shaves & Grooming Aids
2993,477,shea moisture for women after shave regerative lotion -- 4 fl oz,Health & Beauty > Personal Care > Shaving & Hair Removal > After Shaves & Grooming Aids
2994,477,proraso beard balm / beard balm,Health & Beauty > Personal Care > Shaving & Hair Removal > After Shaves & Grooming Aids
2995,477,shaveworks the cool fix™ 5.3 oz/ 156 ml,Health & Beauty > Personal Care > Shaving & Hair Removal > After Shaves & Grooming Aids
2996,477,anthony after shave balm - 2.5 oz,Health & Beauty > Personal Care > Shaving & Hair Removal > After Shaves & Grooming Aids
2997,477,pinaud clubman styptic pencil 0.88 oz 0.09 lbs,Health & Beauty > Personal Care > Shaving & Hair Removal > After Shaves & Grooming Aids
2998,477,"dove men + care post shave balm, hydrate 3.4 oz na",Health & Beauty > Personal Care > Shaving & Hair Removal > After Shaves & Grooming Aids
2999,477,flawless post wax & shave serum swipes 30 ct,Health & Beauty > Personal Care > Shaving & Hair Removal > After Shaves & Grooming Aids
3000,477,azzaro chrome aftershave lotion,Health & Beauty > Personal Care > Shaving & Hair Removal > After Shaves & Grooming Aids
3001,477,billy jealousy beard control,Health & Beauty > Personal Care > Shaving & Hair Removal > After Shaves & Grooming Aids
3002,477,giorgio armani acqua di gio for men aftershave,Health & Beauty > Personal Care > Shaving & Hair Removal > After Shaves & Grooming Aids
3003,477,calvin klein eternity for men aftershave,Health & Beauty > Personal Care > Shaving & Hair Removal > After Shaves & Grooming Aids
3004,477,post-shave balm,Health & Beauty > Personal Care > Shaving & Hair Removal > After Shaves & Grooming Aids
3005,477,honeybee gardens herbal aftershave sandalwood liquid 4 fl oz liquid,Health & Beauty > Personal Care > Shaving & Hair Removal > After Shaves & Grooming Aids
3006,477,nivea for men after shave sensitive extra soothing balm - 3.3 fl. oz.,Health & Beauty > Personal Care > Shaving & Hair Removal > After Shaves & Grooming Aids
3007,477,aramis by aramis aftershave 4 oz for men,Health & Beauty > Personal Care > Shaving & Hair Removal > After Shaves & Grooming Aids
3008,477,michael jordan by michael jordan cologne spray 3.4 oz & aftershave balm 3.3 oz & hair and body wash 3.3 & cologne spray .5 oz for men,Health & Beauty > Personal Care > Shaving & Hair Removal > After Shaves & Grooming Aids
3009,477,paul sebastian by paul sebastian aftershave balm 4 oz for men,Health & Beauty > Personal Care > Shaving & Hair Removal > After Shaves & Grooming Aids
3010,477,bvlgari blv by bvlgari aftershave 3.4 oz for men,Health & Beauty > Personal Care > Shaving & Hair Removal > After Shaves & Grooming Aids
3011,477,bvlgari man by bvlgari aftershave balm 3.4 oz for men,Health & Beauty > Personal Care > Shaving & Hair Removal > After Shaves & Grooming Aids
3012,477,old spice by shulton aftershave 6.37 oz for men,Health & Beauty > Personal Care > Shaving & Hair Removal > After Shaves & Grooming Aids
3013,477,kouros by yves saint laurent aftershave 3.3 oz for men,Health & Beauty > Personal Care > Shaving & Hair Removal > After Shaves & Grooming Aids
3014,477,escape by calvin klein aftershave balm 6.7 oz for men,Health & Beauty > Personal Care > Shaving & Hair Removal > After Shaves & Grooming Aids
3015,477,acqua di selva by visconti di modrone aftershave 3.4 oz for men,Health & Beauty > Personal Care > Shaving & Hair Removal > After Shaves & Grooming Aids
3016,477,cvs after shave lotion spice scent 7.0 oz 0.05 lbs,Health & Beauty > Personal Care > Shaving & Hair Removal > After Shaves & Grooming Aids
3017,477,nivea for men after shave extra soothing balm sensitive skin 3.3 oz,Health & Beauty > Personal Care > Shaving & Hair Removal > After Shaves & Grooming Aids
3018,477,nivea for men double action after shave balm - 3.3 oz,Health & Beauty > Personal Care > Shaving & Hair Removal > After Shaves & Grooming Aids
3019,477,gillette series sensitive skin after shave lotion-2.5475 milliter,Health & Beauty > Personal Care > Shaving & Hair Removal > After Shaves & Grooming Aids
3020,477,neutrogena men razor defense post shave lotion-2.5 oz,Health & Beauty > Personal Care > Shaving & Hair Removal > After Shaves & Grooming Aids
3021,477,tend skin razor bump skin care solution (8.0 oz),Health & Beauty > Personal Care > Shaving & Hair Removal > After Shaves & Grooming Aids
3022,477,clinique clinique for men post-shave soother,Health & Beauty > Personal Care > Shaving & Hair Removal > After Shaves & Grooming Aids
3023,477,ralph lauren aftershave splash,Health & Beauty > Personal Care > Shaving & Hair Removal > After Shaves & Grooming Aids
3024,477,lavender after shave balm,Health & Beauty > Personal Care > Shaving & Hair Removal > After Shaves & Grooming Aids
3025,477,the art of shaving 1oz unscented after shave balm,Health & Beauty > Personal Care > Shaving & Hair Removal > After Shaves & Grooming Aids
3026,477,artistry® men art men post shave toner,Health & Beauty > Personal Care > Shaving & Hair Removal > After Shaves & Grooming Aids
3027,477,gillette series sensitive after shave gel - 2.54 fl. oz.,Health & Beauty > Personal Care > Shaving & Hair Removal > After Shaves & Grooming Aids
3028,477,hanae mori by hanae mori aftershave balm 5 oz for men,Health & Beauty > Personal Care > Shaving & Hair Removal > After Shaves & Grooming Aids
3029,477,hugo by hugo boss aftershave balm 2.5 oz for men,Health & Beauty > Personal Care > Shaving & Hair Removal > After Shaves & Grooming Aids
3030,477,eau de grey flannel by geoffrey beene aftershave lotion 2 oz (unboxed) for men,Health & Beauty > Personal Care > Shaving & Hair Removal > After Shaves & Grooming Aids
3031,477,english leather by dana aftershave 3.4 oz for men,Health & Beauty > Personal Care > Shaving & Hair Removal > After Shaves & Grooming Aids
3032,477,kenneth cole reaction aftershave balm 3.4 oz (unboxed) (tube). for men,Health & Beauty > Personal Care > Shaving & Hair Removal > After Shaves & Grooming Aids
3033,477,old spice by shulton aftershave 2.5 oz for men,Health & Beauty > Personal Care > Shaving & Hair Removal > After Shaves & Grooming Aids
3034,477,english leather by dana cologne .6 oz (3 pieces) & aftershave 1.7 oz & travel bag (2 pieces) for men,Health & Beauty > Personal Care > Shaving & Hair Removal > After Shaves & Grooming Aids
3035,477,guess suede by guess aftershave balm 3 oz for men,Health & Beauty > Personal Care > Shaving & Hair Removal > After Shaves & Grooming Aids
3036,477,the art of shaving after shave balm lemon 3.38oz,Health & Beauty > Personal Care > Shaving & Hair Removal > After Shaves & Grooming Aids
3037,477,the art of shaving after shave balm lavender,Health & Beauty > Personal Care > Shaving & Hair Removal > After Shaves & Grooming Aids
3038,477,post-shave healer one size/no color,Health & Beauty > Personal Care > Shaving & Hair Removal > After Shaves & Grooming Aids
3039,477,dove dove men+care hydrate+ post shave balm 3.4 fluid ounce,Health & Beauty > Personal Care > Shaving & Hair Removal > After Shaves & Grooming Aids
3040,477,badger badger man care organic beard oil -- 1 fl oz,Health & Beauty > Personal Care > Shaving & Hair Removal > After Shaves & Grooming Aids
3041,477,jack black jack black beard oil,Health & Beauty > Personal Care > Shaving & Hair Removal > After Shaves & Grooming Aids
3042,477,cw beggs and sons moisturizing lotion (after shave + face care),Health & Beauty > Personal Care > Shaving & Hair Removal > After Shaves & Grooming Aids
3043,477,zeus beard beard comb natural horn,Health & Beauty > Personal Care > Shaving & Hair Removal > After Shaves & Grooming Aids
3044,477,beardbrand mustache wax - tree ranger,Health & Beauty > Personal Care > Shaving & Hair Removal > After Shaves & Grooming Aids
3045,477,mcmc fragrance dude no. 1 beard oil,Health & Beauty > Personal Care > Shaving & Hair Removal > After Shaves & Grooming Aids
3046,477,stubble & 'stache face moisturizer and beard conditioner,Health & Beauty > Personal Care > Shaving & Hair Removal > After Shaves & Grooming Aids
3047,477,herbivore botanicals beard tonic,Health & Beauty > Personal Care > Shaving & Hair Removal > After Shaves & Grooming Aids
3048,477,after shave gel 3.4oz lavender,Health & Beauty > Personal Care > Shaving & Hair Removal > After Shaves & Grooming Aids
3049,477,after shave balm 1oz lavender pump,Health & Beauty > Personal Care > Shaving & Hair Removal > After Shaves & Grooming Aids
3050,477,unscented after-shave gel 3.3 oz,Health & Beauty > Personal Care > Shaving & Hair Removal > After Shaves & Grooming Aids
3051,477,giorgio armani acqua di gio after shave lotion no color,Health & Beauty > Personal Care > Shaving & Hair Removal > After Shaves & Grooming Aids
3052,477,"miracle care kwik-stop styptic powder for dogs & cats, .5-oz jar",Health & Beauty > Personal Care > Shaving & Hair Removal > After Shaves & Grooming Aids
3053,477,"gillette cool wave crisp after shave splash, 3.3oz",Health & Beauty > Personal Care > Shaving & Hair Removal > After Shaves & Grooming Aids
3054,477,"after shave moisturizer regular - 1.7oz, every 5 months",Health & Beauty > Personal Care > Shaving & Hair Removal > After Shaves & Grooming Aids
3055,477,"brut after shave, classic",Health & Beauty > Personal Care > Shaving & Hair Removal > After Shaves & Grooming Aids
3056,477,tend skin liquid skin care solution - 4 oz,Health & Beauty > Personal Care > Shaving & Hair Removal > After Shaves & Grooming Aids
3057,477,gillette series sensitive skin after shave gel - 2.5 fl oz.,Health & Beauty > Personal Care > Shaving & Hair Removal > After Shaves & Grooming Aids
3058,477,nivea for men sensitive post shave balm,Health & Beauty > Personal Care > Shaving & Hair Removal > After Shaves & Grooming Aids
3059,477,nivea men sensitive post shave bal...,Health & Beauty > Personal Care > Shaving & Hair Removal > After Shaves & Grooming Aids
3060,477,"nivea men original replenishing non-greasy post shave balm, 3.3 oz bottle (pack of 3)",Health & Beauty > Personal Care > Shaving & Hair Removal > After Shaves & Grooming Aids
3061,477,"dove men+care post shave balm, sensitive plus 3.4 oz",Health & Beauty > Personal Care > Shaving & Hair Removal > After Shaves & Grooming Aids
3062,477,nivea for men post shave balm - sens - 3.30 fl oz,Health & Beauty > Personal Care > Shaving & Hair Removal > After Shaves & Grooming Aids
3063,477,"aubrey organics, men's stock, north woods after shave, classic pine, 4 fl oz (118 ml)",Health & Beauty > Personal Care > Shaving & Hair Removal > After Shaves & Grooming Aids
3064,477,"aubrey organics, men's stock, after shave balm, north woods, 4 fl oz (118 ml)",Health & Beauty > Personal Care > Shaving & Hair Removal > After Shaves & Grooming Aids
3065,477,hawaiian sandalwood -after shave splash - no alcohol -with aha for ingrown hairs,Health & Beauty > Personal Care > Shaving & Hair Removal > After Shaves & Grooming Aids
3066,477,"lucky tiger lucky tiger organic aftershave & face tonic, 8 fl oz",Health & Beauty > Personal Care > Shaving & Hair Removal > After Shaves & Grooming Aids
3067,477,"old spice old spice aftershave, pure sport, 6.37 oz",Health & Beauty > Personal Care > Shaving & Hair Removal > After Shaves & Grooming Aids
3068,477,"lubriderm lubriderm men's 3-in-1 body, face & post-shave lotion, li...",Health & Beauty > Personal Care > Shaving & Hair Removal > After Shaves & Grooming Aids
3069,477,"proraso proraso refreshing & invigorating aftershave cream, eucal...",Health & Beauty > Personal Care > Shaving & Hair Removal > After Shaves & Grooming Aids
3070,477,c.o. bigelow bay rum after-shave balm,Health & Beauty > Personal Care > Shaving & Hair Removal > After Shaves & Grooming Aids
3071,477,imperial after shave balm & face moisturizer,Health & Beauty > Personal Care > Shaving & Hair Removal > After Shaves & Grooming Aids
3072,477,after shave balm 3.4oz lavender,Health & Beauty > Personal Care > Shaving & Hair Removal > After Shaves & Grooming Aids
3073,477,lavender after-shave balm,Health & Beauty > Personal Care > Shaving & Hair Removal > After Shaves & Grooming Aids
3074,477,davidoff cool water after shave no color one size,Health & Beauty > Personal Care > Shaving & Hair Removal > After Shaves & Grooming Aids
3075,477,versace eros after shave balm no color,Health & Beauty > Personal Care > Shaving & Hair Removal > After Shaves & Grooming Aids
3076,477,ralph lauren fragrances polo black after shave gel no color,Health & Beauty > Personal Care > Shaving & Hair Removal > After Shaves & Grooming Aids
3077,477,"jw pet pet styptic powder, 2-pack",Health & Beauty > Personal Care > Shaving & Hair Removal > After Shaves & Grooming Aids
3078,477,the humble twin cartridges 5 pk x1 dr. carver’s post shave sample x1,Health & Beauty > Personal Care > Shaving & Hair Removal > After Shaves & Grooming Aids
3079,477,dr. carver's magnanimous post shave (x1): just once,Health & Beauty > Personal Care > Shaving & Hair Removal > After Shaves & Grooming Aids
3080,477,dr. carver’s 3x magnanimous post shave cream,Health & Beauty > Personal Care > Shaving & Hair Removal > After Shaves & Grooming Aids
3081,477,"post shave balm travel - 1.7oz, every 2 months",Health & Beauty > Personal Care > Shaving & Hair Removal > After Shaves & Grooming Aids
3082,477,after shave moisturizer regular - 1.7oz,Health & Beauty > Personal Care > Shaving & Hair Removal > After Shaves & Grooming Aids
3083,477,ralph lauren polo black 4.2 oz. after shave splash,Health & Beauty > Personal Care > Shaving & Hair Removal > After Shaves & Grooming Aids
3084,477,l'occitane cade after shave balm,Health & Beauty > Personal Care > Shaving & Hair Removal > After Shaves & Grooming Aids
3085,477,"after shave, gel, sensitive skin, 2.5 fl oz (75 ml)",Health & Beauty > Personal Care > Shaving & Hair Removal > After Shaves & Grooming Aids
3086,477,kiehl's since 1851 ultimate men's after-shave balm & moisturizer no color,Health & Beauty > Personal Care > Shaving & Hair Removal > After Shaves & Grooming Aids
3087,477,the art of shaving after shave balm with sandalwood essential oil no color,Health & Beauty > Personal Care > Shaving & Hair Removal > After Shaves & Grooming Aids
3088,477,hb beard tonic sampler,Health & Beauty > Personal Care > Shaving & Hair Removal > After Shaves & Grooming Aids
3089,477,"province apothecary beard oil assorted, one size",Health & Beauty > Personal Care > Shaving & Hair Removal > After Shaves & Grooming Aids
3090,477,"caswell-massey 1752 after shave balm, sandalwood - 2 fl oz",Health & Beauty > Personal Care > Shaving & Hair Removal > After Shaves & Grooming Aids
3091,477,kwik stop styptic gel powder 1/2 oz,Health & Beauty > Personal Care > Shaving & Hair Removal > After Shaves & Grooming Aids
3092,477,sandalwood after-shave gel 3.3 oz,Health & Beauty > Personal Care > Shaving & Hair Removal > After Shaves & Grooming Aids
3093,477,after shave lotion 3.4oz ocean kelp,Health & Beauty > Personal Care > Shaving & Hair Removal > After Shaves & Grooming Aids
3094,477,after-shave balm,Health & Beauty > Personal Care > Shaving & Hair Removal > After Shaves & Grooming Aids
3095,477,dr. carver’s shave lather & post-shave bundle,Health & Beauty > Personal Care > Shaving & Hair Removal > After Shaves & Grooming Aids
3096,477,The Humble Twin CARTRIDGES 5 PK x1 Dr. Carver’s POST SHAVE x3,Health & Beauty > Personal Care > Shaving & Hair Removal > After Shaves & Grooming Aids
3097,477,"after shave moisturizer regular - 1.7oz, every 6 months",Health & Beauty > Personal Care > Shaving & Hair Removal > After Shaves & Grooming Aids
3098,477,"post shave balm travel - 1.7oz, every 3 months",Health & Beauty > Personal Care > Shaving & Hair Removal > After Shaves & Grooming Aids
3099,477,clubman moustache wax with brush/comb neutral,Health & Beauty > Personal Care > Shaving & Hair Removal > After Shaves & Grooming Aids
3100,477,old spice men's after shave classic,Health & Beauty > Personal Care > Shaving & Hair Removal > After Shaves & Grooming Aids
3101,477,gillette after shave,Health & Beauty > Personal Care > Shaving & Hair Removal > After Shaves & Grooming Aids
3102,477,"proraso after shave balm, sensitive skin, 3.4 oz (100 ml)",Health & Beauty > Personal Care > Shaving & Hair Removal > After Shaves & Grooming Aids
3103,477,jack earl i'm your huckleberry beard oil,Health & Beauty > Personal Care > Shaving & Hair Removal > After Shaves & Grooming Aids
3104,477,"caswell-massey 1752 after shave balm, almond - 2 fl oz",Health & Beauty > Personal Care > Shaving & Hair Removal > After Shaves & Grooming Aids
3105,477,"aubrey organics, men's stock, city rhythms after shave, 4 fl oz (118 ml)",Health & Beauty > Personal Care > Shaving & Hair Removal > After Shaves & Grooming Aids
3106,477,the adventurer aftershave tonic - sandalwood scent,Health & Beauty > Personal Care > Shaving & Hair Removal > After Shaves & Grooming Aids
3107,477,home brewed soaps hops & mint beard balm,Health & Beauty > Personal Care > Shaving & Hair Removal > After Shaves & Grooming Aids
