,category_id,description,category_path
1881,477,imperial barber products after-shave balm & face moisturizer 3oz,Health & Beauty > Personal Care > Shaving & Hair Removal > After Shaves & Grooming Aids
1882,477,Best Beard Oil and Leave-in,Health & Beauty > Personal Care > Shaving & Hair Removal > After Shaves & Grooming Aids
1883,477,Woodsman Beard Oil by The Bearded Bastard — All Natural (1 oz),Health & Beauty > Personal Care > Shaving & Hair Removal > After Shaves & Grooming Aids
1884,477,Beard First Aid Kit - by Honest Amish - Gift for the Bearded Man Who Has Everything,Health & Beauty > Personal Care > Shaving & Hair Removal > After Shaves & Grooming Aids
1885,477,GRAVE BEFORE SHAVE Gentlemen's Blend Beard Balm (Bourbon Scent) (2 oz.),Health & Beauty > Personal Care > Shaving & Hair Removal > After Shaves & Grooming Aids
1886,477,"l'occitane cade after-shave balm for men, 2.5 fl. oz.",Health & Beauty > Personal Care > Shaving & Hair Removal > After Shaves & Grooming Aids
1887,477,"clinique skin supplies for men travel kit 6 pcs set & travel bag face srub, scruffing lotion, m protect hydratation, post shave healer, age defencer,",Health & Beauty > Personal Care > Shaving & Hair Removal > After Shaves & Grooming Aids
1888,477,Beard Oil & Leave-in Conditioner - 100% Natural - Cold-Pressed 9 Oil Blend,Health & Beauty > Personal Care > Shaving & Hair Removal > After Shaves & Grooming Aids
1889,477,GABELS Bay Rum After Shave,Health & Beauty > Personal Care > Shaving & Hair Removal > After Shaves & Grooming Aids
1890,477,"Best RETRO Beard Oil and Beard Comb bundle kit with FREE Beard Care eBook! - Unscented Softener, Conditioner &",Health & Beauty > Personal Care > Shaving & Hair Removal > After Shaves & Grooming Aids
1891,477,"Omiera Labs Adroit Facial, Body, Bikini, And Legs Hair Growth Inhibitor Cream, Minimizes Growth Of Unwanted Hair While Preventing Breakouts, Ingrown Hair, Razor Burns & Redness After Waxing, Shaving, And Hair Removal & Electrolysis, 1. fl.oz.",Health & Beauty > Personal Care > Shaving & Hair Removal > After Shaves & Grooming Aids
1892,477,Aqua Velva Ice Sport After Shave -- 3.5 oz.,Health & Beauty > Personal Care > Shaving & Hair Removal > After Shaves & Grooming Aids
1893,477,"Sigma by Blaviar | Ultra-Luxury Eau de Cologne After-Shave Balm, 5 fl oz /",Health & Beauty > Personal Care > Shaving & Hair Removal > After Shaves & Grooming Aids
1894,477,"Beard Balm - With Shea Butter and Argan Oil - Leave in Wax Conditioner for Men - Styles, Strengthens & Thickens During Beard During Beard Growth - 2OZ",Health & Beauty > Personal Care > Shaving & Hair Removal > After Shaves & Grooming Aids
1895,477,"Murad Razor Burn Rescue, 1.5 oz.",Health & Beauty > Personal Care > Shaving & Hair Removal > After Shaves & Grooming Aids
1896,477,taconic shave unscented soothing after shave balm - alcohol free - 4 oz.,Health & Beauty > Personal Care > Shaving & Hair Removal > After Shaves & Grooming Aids
1897,477,The Real Man Company Beard Balm and Leave In Conditioner For Men That Want A Super Awesome And Kissable Beard100%,Health & Beauty > Personal Care > Shaving & Hair Removal > After Shaves & Grooming Aids
1898,477,neutrogena men razor defense post shave lotion 2.5 oz (2 pack) new,Health & Beauty > Personal Care > Shaving & Hair Removal > After Shaves & Grooming Aids
1899,477,"Tend Skin The Skin Care Solution For Unsightly Razor Bumps, Ingrown...",Health & Beauty > Personal Care > Shaving & Hair Removal > After Shaves & Grooming Aids
1900,477,"Bay Rum Aftershave Splash for Men - 4oz. of The Finest, All Natural, Premium",Health & Beauty > Personal Care > Shaving & Hair Removal > After Shaves & Grooming Aids
1901,477,black opal mens razor bumps recovery solution 1 oz.,Health & Beauty > Personal Care > Shaving & Hair Removal > After Shaves & Grooming Aids
1902,477,Premium 100% Natural Beard Oil for Men - Pure Jojoba and Argan Oil - Claim The Prize Your Beard Deserves,Health & Beauty > Personal Care > Shaving & Hair Removal > After Shaves & Grooming Aids
1903,477,"adidas sport fever aftershave for men, 0.5 ounce",Health & Beauty > Personal Care > Shaving & Hair Removal > After Shaves & Grooming Aids
1904,477,canoe by dana for men after shave 2 oz,Health & Beauty > Personal Care > Shaving & Hair Removal > After Shaves & Grooming Aids
1905,477,Spartans Den Beard Brush For Men | 100% Natural Boar Bristle & Eco-Friendly,Health & Beauty > Personal Care > Shaving & Hair Removal > After Shaves & Grooming Aids
1906,477,"Hand Crafted Caveman Drunken Caveman (Bay Rum) Beard Oil Leave in Conditioner, 1oz oil and FREE Handmade Comb",Health & Beauty > Personal Care > Shaving & Hair Removal > After Shaves & Grooming Aids
1907,477,"Cody Austin Beard Oil and Conditioner, Leather Scent, Made With Organic Oils",Health & Beauty > Personal Care > Shaving & Hair Removal > After Shaves & Grooming Aids
1908,477,"Beard Shaping Tool and Scissors Kit, Shaper and Styling Template Comb by BeardZ",Health & Beauty > Personal Care > Shaving & Hair Removal > After Shaves & Grooming Aids
1909,477,"Beard Growth Chart T-Shirt - Funny amish, professor, wizard, god beard shirt",Health & Beauty > Personal Care > Shaving & Hair Removal > After Shaves & Grooming Aids
1910,477,"the art of shaving after-shave balm, sandalwood essential oil, for all skin types, packaging may vary (100 ml)",Health & Beauty > Personal Care > Shaving & Hair Removal > After Shaves & Grooming Aids
1911,477,Zeus Deluxe Beard Grooming Kit for Men - Beard Care Gift Set to Soften Hairs and Prevent Itchiness and Dandruff (Scent: Sandalwood),Health & Beauty > Personal Care > Shaving & Hair Removal > After Shaves & Grooming Aids
1912,477,"Nivea for Men Sensitive After Shave Extra Soothing Balm, 3.3 oz",Health & Beauty > Personal Care > Shaving & Hair Removal > After Shaves & Grooming Aids
1913,477,Rowdy Beard Bros Beard Balm,Health & Beauty > Personal Care > Shaving & Hair Removal > After Shaves & Grooming Aids
1914,477,Skin Bracer by Mennen After Shave - Original - 7 oz,Health & Beauty > Personal Care > Shaving & Hair Removal > After Shaves & Grooming Aids
1915,477,"Proraso Beard Balm, 3.4 Ounces",Health & Beauty > Personal Care > Shaving & Hair Removal > After Shaves & Grooming Aids
1916,477,Nivea Men Sensitive Cooling Post Shave Balm (100ml),Health & Beauty > Personal Care > Shaving & Hair Removal > After Shaves & Grooming Aids
1917,477,"Old Spice After Shave Lotion, Pure Sport, 6.37 Ounce Bottle",Health & Beauty > Personal Care > Shaving & Hair Removal > After Shaves & Grooming Aids
1918,477,The Art of Shaving Sandalwood After Shave Balm Essential Oil 3.3 oz,Health & Beauty > Personal Care > Shaving & Hair Removal > After Shaves & Grooming Aids
1919,477,"edwin jagger 99.9% natural moisturizing aftershave lotion - sandalwood, 3.4 oz",Health & Beauty > Personal Care > Shaving & Hair Removal > After Shaves & Grooming Aids
1920,477,bump stopper razor bump treatment - 5 oz,Health & Beauty > Personal Care > Shaving & Hair Removal > After Shaves & Grooming Aids
1921,477,"nivea men artic freeze 2 in 1 after shave & gel moisturizer, cool kick - 3.3 fl oz",Health & Beauty > Personal Care > Shaving & Hair Removal > After Shaves & Grooming Aids
1922,477,"afta by mennen after shave skin conditioner, fresh - 3 fl oz",Health & Beauty > Personal Care > Shaving & Hair Removal > After Shaves & Grooming Aids
1923,477,"bump patrol aftershave razor bump treatment, original formula - 4 oz",Health & Beauty > Personal Care > Shaving & Hair Removal > After Shaves & Grooming Aids
1924,477,art of shaving 3.3-ounce lavender after-shave balm 2 pack,Health & Beauty > Personal Care > Shaving & Hair Removal > After Shaves & Grooming Aids
1925,477,sheamoisture shave aftershave regenerative for women - honey & black seed (4 oz),Health & Beauty > Personal Care > Shaving & Hair Removal > After Shaves & Grooming Aids
1926,477,maestro's classic beard butter modest blend - 6 oz,Health & Beauty > Personal Care > Shaving & Hair Removal > After Shaves & Grooming Aids
1927,477,"Beardoholic Premium Quality Beard Oil and Leave-in Conditioner, Softener - 100% Pure Organic Natural, Pine Scented - Beard Growth and Stops Itchiness - Jojoba and Argan Oil",Health & Beauty > Personal Care > Shaving & Hair Removal > After Shaves & Grooming Aids
1928,477,the grooming lounge best for last aftershave-5 oz,Health & Beauty > Personal Care > Shaving & Hair Removal > After Shaves & Grooming Aids
1929,477,"Badass Beard Care Beard Balm - The Ladies Man Scent, 1 oz - All Natural Ingredients, Soften Hair, Hydrate Skin to Get Rid of Itch and Dandruff, Promote Healthy Growth",Health & Beauty > Personal Care > Shaving & Hair Removal > After Shaves & Grooming Aids
1930,477,joop! by joop! for men. set-edt spray 4.2 ounces & aftershave 2.5 ounces,Health & Beauty > Personal Care > Shaving & Hair Removal > After Shaves & Grooming Aids
1931,477,"Hoot's Naturals Beard Balm, Extra Large 3.5oz, with Beard Comb - Organic Beard Oil Recipe - Beard Softener and Beard Conditioner",Health & Beauty > Personal Care > Shaving & Hair Removal > After Shaves & Grooming Aids
1932,477,Nivea Men Sensitive Post Shave Soothing Balm (100ml),Health & Beauty > Personal Care > Shaving & Hair Removal > After Shaves & Grooming Aids
1933,477,Aftershave Lotion for Men to Fight Razor Bumps & Ingrown Hairs with Best Natural,Health & Beauty > Personal Care > Shaving & Hair Removal > After Shaves & Grooming Aids
1934,477,Beard Oil Softener and Hair Comb Set-Beard Care Gift Kit for Professional Men,Health & Beauty > Personal Care > Shaving & Hair Removal > After Shaves & Grooming Aids
1935,477,Royall Lyme By Royall Fragrances For Men. Aftershave Lotion Cologne 8 Ounces by Royall Lyme,Health & Beauty > Personal Care > Shaving & Hair Removal > After Shaves & Grooming Aids
1936,477,The Zerian Boar Bristle Beard Brush for Men Bundle with Beard Care E-Booklet,Health & Beauty > Personal Care > Shaving & Hair Removal > After Shaves & Grooming Aids
1937,477,Alayna Naturals Beard Oil and Leave-In Conditioner - Best Beard Oil Fragrance Free - 100% Pure Organic Natural,Health & Beauty > Personal Care > Shaving & Hair Removal > After Shaves & Grooming Aids
1938,477,"L'Occitane Cade After Shave Balm For Men, 2.5 fl. oz. by Cade After Shave Balm",Health & Beauty > Personal Care > Shaving & Hair Removal > After Shaves & Grooming Aids
1939,477,"Beard Oil For Men and Leave-In Conditioner Unscented, Softens Beard, Relieves Itchiness and Moisturizes Skin, For Groomed Beard and Mustache Growth, Best Natural/Organic Oil, Made in USA, Jojoba and Argan Oil. Fast Growing, Healthy and Studly Beard.",Health & Beauty > Personal Care > Shaving & Hair Removal > After Shaves & Grooming Aids
1940,477,"B.I.G. Beard Balm - 100% Organic Premium Beard Balm for Beards, Mustache, & Goatee. Promotes Healthy Beard Hair",Health & Beauty > Personal Care > Shaving & Hair Removal > After Shaves & Grooming Aids
1941,477,"Finished Man Beard Oil - All Natural 100% Pure- Ylang-ylang Scented, Moisturizer and Conditioner for Your Beard",Health & Beauty > Personal Care > Shaving & Hair Removal > After Shaves & Grooming Aids
1942,477,Pre De Provence After-No. 63 After Shave Balm,Health & Beauty > Personal Care > Shaving & Hair Removal > After Shaves & Grooming Aids
1943,477,Prospector Co. Beard Oil 1oz Mini Flask,Health & Beauty > Personal Care > Shaving & Hair Removal > After Shaves & Grooming Aids
1944,477,Spiced Sandalwood Scent - #1 RATED Leven Rose Beard Oil and Leave-in Conditioner - Best Scented Beard Oil 100% Organic Natural for Groomed Beard Growt,Health & Beauty > Personal Care > Shaving & Hair Removal > After Shaves & Grooming Aids
1945,477,high time bump stopper-2 0.5oz double strength treatment (2 pack),Health & Beauty > Personal Care > Shaving & Hair Removal > After Shaves & Grooming Aids
1946,477,Beard Comb PLUS Beard Shaping Template All-In-One Tool | The Beard Care & Grooming Gift Kit For Any Beard Bro | Use With A Beard Trimmer Or Razor To Style Facial Hair For Perfect Line Up & Symmetry,Health & Beauty > Personal Care > Shaving & Hair Removal > After Shaves & Grooming Aids
1947,477,Hoot's Naturals Beard Balm with FREE Beard Comb - Mens Mustache and Beard Grooming Conditioner - All Natural Organic,Health & Beauty > Personal Care > Shaving & Hair Removal > After Shaves & Grooming Aids
1948,477,the art of shaving the art of shaving after-shave balm - unscented - 100 ml,Health & Beauty > Personal Care > Shaving & Hair Removal > After Shaves & Grooming Aids
1949,477,Luxxx Beauty Refresh After Shave Skin Soothing Mist for Women - Post Shave Skin Irritation Protection & Prevention,Health & Beauty > Personal Care > Shaving & Hair Removal > After Shaves & Grooming Aids
1950,477,"Beard Oil for Men - Use With Balm and Conditioner for the Best Facial Hair Grooming Kit - Relieves Itching for Easy Beard Growth - With Argan Oil, Jojoba Oil, Vitamin E and More - 2 OZ - Smooth Viking",Health & Beauty > Personal Care > Shaving & Hair Removal > After Shaves & Grooming Aids
1951,477,Beard Oil for Men- Combine With Balm & Conditioner for Ultimate Beard Care Grooming Kit- Put That Trimmer Down,Health & Beauty > Personal Care > Shaving & Hair Removal > After Shaves & Grooming Aids
1952,477,My Best Beard Brush For Men - Bamboo With Soft Boar Bristles To Comb Your Beard and Mustache - Perfect Hair Care Product To Use With Facial Hair Beard New,Health & Beauty > Personal Care > Shaving & Hair Removal > After Shaves & Grooming Aids
1953,477,"Beard Oil for Men by Kave - Promotes Growth, Softens Beard, Stops Itching - 100% Natural - Free Bonus Comb",Health & Beauty > Personal Care > Shaving & Hair Removal > After Shaves & Grooming Aids
1954,477,"the art of shaving after shave balm unscented for men, 1 ounce",Health & Beauty > Personal Care > Shaving & Hair Removal > After Shaves & Grooming Aids
1955,477,beardbrand tree ranger mustache wax,Health & Beauty > Personal Care > Shaving & Hair Removal > After Shaves & Grooming Aids
1956,477,"Majestic Pure Aftershave Splash with Organic Aloe, Witch Hazel, White Willow, and Tea Tree, 8 Fluid Ounce",Health & Beauty > Personal Care > Shaving & Hair Removal > After Shaves & Grooming Aids
1957,477,The Fresh Man Beard Oil,Health & Beauty > Personal Care > Shaving & Hair Removal > After Shaves & Grooming Aids
1958,477,honest amish - classic beard oil - 2oz,Health & Beauty > Personal Care > Shaving & Hair Removal > After Shaves & Grooming Aids
1959,477,alum block by osma - 2 pack value,Health & Beauty > Personal Care > Shaving & Hair Removal > After Shaves & Grooming Aids
1960,477,Simply Great Beard Oil - DATENITE Scented Beard Oil - Beard Conditioner 3 Oz,Health & Beauty > Personal Care > Shaving & Hair Removal > After Shaves & Grooming Aids
1961,477,Big Thicket Beard Oil - 1oz,Health & Beauty > Personal Care > Shaving & Hair Removal > After Shaves & Grooming Aids
1962,477,azulene oil aftercare after shave and waxing 2 ounces,Health & Beauty > Personal Care > Shaving & Hair Removal > After Shaves & Grooming Aids
1963,477,"Wild Willie's Beard Oil is Made Of 10 Natural Organic Nutrient Rich Essential Oils That Condition and Treat Each Follicle Down To Their Roots. Each Batch Is Handmade In Small Numbered Runs. Try It, You Will Be Hooked. We Guarantee It! (Original 2 oz.)",Health & Beauty > Personal Care > Shaving & Hair Removal > After Shaves & Grooming Aids
1964,477,gabels bay rum after shave lotion 16oz/1pt,Health & Beauty > Personal Care > Shaving & Hair Removal > After Shaves & Grooming Aids
1965,477,"anthony logistics for men aftershave balm, 2.5 fl. oz.",Health & Beauty > Personal Care > Shaving & Hair Removal > After Shaves & Grooming Aids
1966,477,Pocket Size Mens Sandalwood Beard Comb - Mustache Care - For Men,Health & Beauty > Personal Care > Shaving & Hair Removal > After Shaves & Grooming Aids
1967,477,l'oreal paris men's expert comfort max spf 15 anti-irritation after shave balm,Health & Beauty > Personal Care > Shaving & Hair Removal > After Shaves & Grooming Aids
1968,477,Beard Balm for Men - Beard 2 in 1 Conditioner and Beard Moisturizer - Great For Itch Relief and Beard Growth -,Health & Beauty > Personal Care > Shaving & Hair Removal > After Shaves & Grooming Aids
1969,477,issey miyake 'l'eau d'issey pour homme' soothing after-shave balm one size,Health & Beauty > Personal Care > Shaving & Hair Removal > After Shaves & Grooming Aids
1970,477,tend skin liquid-2.5 oz,Health & Beauty > Personal Care > Shaving & Hair Removal > After Shaves & Grooming Aids
1971,477,"dove men +care post shave balm, sensitive - 3.4 oz",Health & Beauty > Personal Care > Shaving & Hair Removal > After Shaves & Grooming Aids
1972,477,anthony logistics after shave balm os,Health & Beauty > Personal Care > Shaving & Hair Removal > After Shaves & Grooming Aids
1973,477,mesmerize black after shave conditioner,Health & Beauty > Personal Care > Shaving & Hair Removal > After Shaves & Grooming Aids
1974,477,wild country after shave,Health & Beauty > Personal Care > Shaving & Hair Removal > After Shaves & Grooming Aids
1975,477,jack black post-shave cooling gel,Health & Beauty > Personal Care > Shaving & Hair Removal > After Shaves & Grooming Aids
1976,477,kwik stop styptic powder 1/2oz,Health & Beauty > Personal Care > Shaving & Hair Removal > After Shaves & Grooming Aids
1977,477,honeybee gardens herbal aftershave key lime -- 4 fl oz,Health & Beauty > Personal Care > Shaving & Hair Removal > After Shaves & Grooming Aids
1978,477,korres vetiver root aftershave balm - 4.41 oz,Health & Beauty > Personal Care > Shaving & Hair Removal > After Shaves & Grooming Aids
1979,477,korres marigold & ginseng aftershave balm - 6.76 oz,Health & Beauty > Personal Care > Shaving & Hair Removal > After Shaves & Grooming Aids
1980,477,jack black bump fix™ razor bump & ingrown hair solution - 2 oz,Health & Beauty > Personal Care > Shaving & Hair Removal > After Shaves & Grooming Aids
1981,477,jack black bump fix razor bump & ingrown hair solution / bump fix razor bump & ingrown hair solution 6 oz,Health & Beauty > Personal Care > Shaving & Hair Removal > After Shaves & Grooming Aids
1982,477,l'occitane cade after shave balm / cade after shave balm,Health & Beauty > Personal Care > Shaving & Hair Removal > After Shaves & Grooming Aids
1983,477,jack black post shave cooling gel - 3.3 oz,Health & Beauty > Personal Care > Shaving & Hair Removal > After Shaves & Grooming Aids
1984,477,the art of shaving beard conditioner - peppermint essential oil 4 oz/ 120 ml,Health & Beauty > Personal Care > Shaving & Hair Removal > After Shaves & Grooming Aids
1985,477,l'occitane cade after shave balm - 2.5 oz,Health & Beauty > Personal Care > Shaving & Hair Removal > After Shaves & Grooming Aids
1986,477,"dove men +care post shave balm, hydrate, 3.4 oz",Health & Beauty > Personal Care > Shaving & Hair Removal > After Shaves & Grooming Aids
1987,477,the art of shaving alum block-1.76 oz.,Health & Beauty > Personal Care > Shaving & Hair Removal > After Shaves & Grooming Aids
1988,477,l'occitane cade after shave balm-2.5 oz.,Health & Beauty > Personal Care > Shaving & Hair Removal > After Shaves & Grooming Aids
1989,477,the art of shaving after-shave gel - sandalwood,Health & Beauty > Personal Care > Shaving & Hair Removal > After Shaves & Grooming Aids
1990,477,razor bump skin care solution by tend skin 8 oz.,Health & Beauty > Personal Care > Shaving & Hair Removal > After Shaves & Grooming Aids
1991,477,the art of shaving lavender after shave balm,Health & Beauty > Personal Care > Shaving & Hair Removal > After Shaves & Grooming Aids
1992,477,bikini zone medicated after shave gel for bikini area,Health & Beauty > Personal Care > Shaving & Hair Removal > After Shaves & Grooming Aids
1993,477,flawless post wax & shave serum by whish,Health & Beauty > Personal Care > Shaving & Hair Removal > After Shaves & Grooming Aids
1994,477,whish flawless post wax & shave serum,Health & Beauty > Personal Care > Shaving & Hair Removal > After Shaves & Grooming Aids
1995,477,honey & black seed after shave healing elixir,Health & Beauty > Personal Care > Shaving & Hair Removal > After Shaves & Grooming Aids
1996,477,the art of shaving 3.3oz lemon after shave balm,Health & Beauty > Personal Care > Shaving & Hair Removal > After Shaves & Grooming Aids
1997,477,ahava 1.7oz soothing after-shave moisturizer,Health & Beauty > Personal Care > Shaving & Hair Removal > After Shaves & Grooming Aids
1998,477,MKMenÂ® Cooling After-Shave Gel,Health & Beauty > Personal Care > Shaving & Hair Removal > After Shaves & Grooming Aids
1999,477,cool water by davidoff aftershave balm 1.7 oz (tube) (unboxed) for men,Health & Beauty > Personal Care > Shaving & Hair Removal > After Shaves & Grooming Aids
2000,477,grey flannel set-edt spray 4 oz & aftershave lotion 4 oz. for men,Health & Beauty > Personal Care > Shaving & Hair Removal > After Shaves & Grooming Aids
2001,477,eternity by calvin klein aftershave 3.4 oz for men,Health & Beauty > Personal Care > Shaving & Hair Removal > After Shaves & Grooming Aids
2002,477,stetson by coty cologne 2 oz & aftershave 2 oz (collector's edition) for men,Health & Beauty > Personal Care > Shaving & Hair Removal > After Shaves & Grooming Aids
2003,477,kanon norwegian wood by scannon aftershave 3.3 oz (unboxed) for men,Health & Beauty > Personal Care > Shaving & Hair Removal > After Shaves & Grooming Aids
2004,477,acqua di gio by giorgio armani aftershave 3.4 oz for men,Health & Beauty > Personal Care > Shaving & Hair Removal > After Shaves & Grooming Aids
2005,477,aramis by aramis aftershave advanced moisture balm 3.4 oz (tube) for men,Health & Beauty > Personal Care > Shaving & Hair Removal > After Shaves & Grooming Aids
2006,477,acqua di gio aftershave balm 2.5 oz. for men,Health & Beauty > Personal Care > Shaving & Hair Removal > After Shaves & Grooming Aids
2007,477,vera wang by vera wang aftershave 3.4 oz for men,Health & Beauty > Personal Care > Shaving & Hair Removal > After Shaves & Grooming Aids
2008,477,menscience post-shave repair,Health & Beauty > Personal Care > Shaving & Hair Removal > After Shaves & Grooming Aids
2009,477,"dove dove men+care sensitive+ post shave balm, 3.4 oz",Health & Beauty > Personal Care > Shaving & Hair Removal > After Shaves & Grooming Aids
2010,477,"bulldog bulldog natural skincare aftershave balm, 2.5 fl oz",Health & Beauty > Personal Care > Shaving & Hair Removal > After Shaves & Grooming Aids
2011,477,bijan bijan for men after shave balm 3.4 oz,Health & Beauty > Personal Care > Shaving & Hair Removal > After Shaves & Grooming Aids
2012,477,tend skin tend skin liquid skin care solution - 4 oz,Health & Beauty > Personal Care > Shaving & Hair Removal > After Shaves & Grooming Aids
2013,477,"neutrogena neutrogena razor defense post-shave lotion, 2.5 oz",Health & Beauty > Personal Care > Shaving & Hair Removal > After Shaves & Grooming Aids
2014,477,mr. natty famous beard elixir,Health & Beauty > Personal Care > Shaving & Hair Removal > After Shaves & Grooming Aids
2015,477,kyoku for men razor repair balm,Health & Beauty > Personal Care > Shaving & Hair Removal > After Shaves & Grooming Aids
2016,477,beardbrand large comb,Health & Beauty > Personal Care > Shaving & Hair Removal > After Shaves & Grooming Aids
2017,477,proraso beard oil,Health & Beauty > Personal Care > Shaving & Hair Removal > After Shaves & Grooming Aids
2018,477,mr. natty bring me sunshine beard elixir,Health & Beauty > Personal Care > Shaving & Hair Removal > After Shaves & Grooming Aids
2019,477,closed on monday beard balm,Health & Beauty > Personal Care > Shaving & Hair Removal > After Shaves & Grooming Aids
2020,477,unscented after-shave balm 3.3 oz,Health & Beauty > Personal Care > Shaving & Hair Removal > After Shaves & Grooming Aids
2021,477,alum block,Health & Beauty > Personal Care > Shaving & Hair Removal > After Shaves & Grooming Aids
2022,477,after shave lotion sandalwood,Health & Beauty > Personal Care > Shaving & Hair Removal > After Shaves & Grooming Aids
2023,477,after shave balm 3.4oz unscented,Health & Beauty > Personal Care > Shaving & Hair Removal > After Shaves & Grooming Aids
2024,477,after-shave lotion 3.3 oz,Health & Beauty > Personal Care > Shaving & Hair Removal > After Shaves & Grooming Aids
2025,477,"Beard Oil Moisturizer and Conditioner by Stellar Naturals Offers Best Blend of Botanic Oils with Vitamin E and Aloe, 100% Natural Unscented for Groomed Beard Growth, Mustache and Skin Care - 1 Oz",Health & Beauty > Personal Care > Shaving & Hair Removal > After Shaves & Grooming Aids
2026,477,Gentleman Jon 3.7 Ounce Alum Block in Plastic Case,Health & Beauty > Personal Care > Shaving & Hair Removal > After Shaves & Grooming Aids
2027,477,"Advanced Clinicals Luxury Men's Shave Kit: Glycolic Acid Cleanser, Sandalwood Pre-shave Oil, Self-foaming Shave Cream, and After-shave Moisturizing Balm Cream",Health & Beauty > Personal Care > Shaving & Hair Removal > After Shaves & Grooming Aids
2028,477,Navigator Class Man Care Beard Conditioning Oil Badger 1 oz Bottle,Health & Beauty > Personal Care > Shaving & Hair Removal > After Shaves & Grooming Aids
2029,477,"Beard Oil for Men - Use With Balm and Conditioner for Ultimate Beard Care Grooming Kit - No Trimmers Needed, Remain",Health & Beauty > Personal Care > Shaving & Hair Removal > After Shaves & Grooming Aids
2030,477,#1 Rated Beard Oil Set - Leven Rose Beard Kit - Spiced Sandalwood Beard Oil,Health & Beauty > Personal Care > Shaving & Hair Removal > After Shaves & Grooming Aids
2031,477,GREY FLANNEL by Geoffrey Beene AFTERSHAVE LOTION 4 OZ (UNBOXED),Health & Beauty > Personal Care > Shaving & Hair Removal > After Shaves & Grooming Aids
2032,477,Mr. Smith Daily Facial Moisturizer for Men 4oz. Anti-aging Face Care Cream and Soothing Aftershave Lotion All in One. All Natural. Suitable for All Skin Types,Health & Beauty > Personal Care > Shaving & Hair Removal > After Shaves & Grooming Aids
