,category_id,description,category_path
0,477,"Elegance After shave lotion, Aloe Vera, 250 ml",Health & Beauty > Personal Care > Shaving & Hair Removal > After Shaves & Grooming Aids
1,477,Barber Shop Beard Oil by The Bearded Bastard,Health & Beauty > Personal Care > Shaving & Hair Removal > After Shaves & Grooming Aids
2,477,"HAVANA - Aftershave Splash for Men - Scent: Tobacco Leaf, Cocoa Bean, Patchouli & Vanilla - 4oz of the Purest, All-Natural Ingredients - No Synthetic",Health & Beauty > Personal Care > Shaving & Hair Removal > After Shaves & Grooming Aids
3,477,natural man beard conditioning balm - all natural beard conditioner by botanical skin works health and beauty,Health & Beauty > Personal Care > Shaving & Hair Removal > After Shaves & Grooming Aids
4,477,Beard Comb | Fine & Coarse Tooth | Handmade Sandalwood Beard and Mustache Brush | Presented in Huntsman Travel,Health & Beauty > Personal Care > Shaving & Hair Removal > After Shaves & Grooming Aids
5,477,L'vanah Naturals Premium Beard Oil and Leave-In Conditioner for Great Beard,Health & Beauty > Personal Care > Shaving & Hair Removal > After Shaves & Grooming Aids
6,477,"bikini zone roll-on relief , after shave/medicated, 2 oz",Health & Beauty > Personal Care > Shaving & Hair Removal > After Shaves & Grooming Aids
7,477,"B.I.G. Beard Balm - 100% Organic Premium Beard Balm for Styling & Conditioning your Beard, Mustache, & Goatee.",Health & Beauty > Personal Care > Shaving & Hair Removal > After Shaves & Grooming Aids
8,477,The Woods Beard Balm - Pine and Cedarwood - Essential Oil Scented Beard Conditioner Beard Balm by The 2Bits Man,Health & Beauty > Personal Care > Shaving & Hair Removal > After Shaves & Grooming Aids
9,477,"Beard Oil and Unscented Conditioning Oil For Men That Moisturizes, Softens, and Eliminates Beard Itching - All Natural Beard Oil Made In The USA - 1 f",Health & Beauty > Personal Care > Shaving & Hair Removal > After Shaves & Grooming Aids
10,477,"All American Gentlemen Salve, Beard Balm and Mustache Wax Supports Growth, Softens Hair, Reduces Itch, Bold, Fresh Scent Non Greasy Leave-in Formula, Natural and Organic, 2 oz.",Health & Beauty > Personal Care > Shaving & Hair Removal > After Shaves & Grooming Aids
11,477,"clubman pinaud special reserve after shave cologne, 6 ounce new",Health & Beauty > Personal Care > Shaving & Hair Removal > After Shaves & Grooming Aids
12,477,Beard Oil For Men Made in USA With Wooden Comb-Anti-Static/No-Snag/Unscented,Health & Beauty > Personal Care > Shaving & Hair Removal > After Shaves & Grooming Aids
13,477,"muelhens 4711 after shave for men, 3.4 ounce",Health & Beauty > Personal Care > Shaving & Hair Removal > After Shaves & Grooming Aids
14,477,"gucci after shave lotion, guilty, 3 ounce kitchen",Health & Beauty > Personal Care > Shaving & Hair Removal > After Shaves & Grooming Aids
15,477,Beard Balm for Men- Heavy Duty Leave-In Wax Beard Conditioner- Combine With,Health & Beauty > Personal Care > Shaving & Hair Removal > After Shaves & Grooming Aids
16,477,"Aramis After Shave for Men, 8.1 Ounce",Health & Beauty > Personal Care > Shaving & Hair Removal > After Shaves & Grooming Aids
17,477,"Clarins The Art of Shaving After-Shave Lotion, Sandalwood, 0.68 Pound",Health & Beauty > Personal Care > Shaving & Hair Removal > After Shaves & Grooming Aids
18,477,Aramis By Aramis For Men Aftershave Advanced Moisture Balm 4.1 Oz by Aramis,Health & Beauty > Personal Care > Shaving & Hair Removal > After Shaves & Grooming Aids
19,477,WIZKER Brush - Eliminates Razor Bumps & Ingrown Hairs Fast - Chemical Free - Face & Body Cleansing - Unisex Exfoliating Scrub - Rid Shaving Bumps,Health & Beauty > Personal Care > Shaving & Hair Removal > After Shaves & Grooming Aids
20,477,Prospector Co. Beard Oil 1oz Mini Flask by Burroughs,Health & Beauty > Personal Care > Shaving & Hair Removal > After Shaves & Grooming Aids
21,477,Beard Balm - Rockriver Original Natural beard conditioning balm 2oz Best Scent!,Health & Beauty > Personal Care > Shaving & Hair Removal > After Shaves & Grooming Aids
22,477,Ultimate Beard Care Kit - Wisdom,Health & Beauty > Personal Care > Shaving & Hair Removal > After Shaves & Grooming Aids
23,477,Beard Oil for Men - Beard,Health & Beauty > Personal Care > Shaving & Hair Removal > After Shaves & Grooming Aids
24,477,vigoroso special edition after shave lotion 400ml after shave by floid,Health & Beauty > Personal Care > Shaving & Hair Removal > After Shaves & Grooming Aids
25,477,proraso pre and after shave cream 100ml,Health & Beauty > Personal Care > Shaving & Hair Removal > After Shaves & Grooming Aids
26,477,"baxter of california after shave balm, 4 fl. oz.",Health & Beauty > Personal Care > Shaving & Hair Removal > After Shaves & Grooming Aids
27,477,Beard Comb Pocket-size - Buffalo Horn and Sandalwood - No Static or Snagging,Health & Beauty > Personal Care > Shaving & Hair Removal > After Shaves & Grooming Aids
28,477,The Shaving Co. Beard Oil - 2 Oz - Best Natural Beard and Mustache Conditioner and Grooming Softener for Men,Health & Beauty > Personal Care > Shaving & Hair Removal > After Shaves & Grooming Aids
29,477,"Beard Comb - Natural Organic Sandal Wood Comb for Hair Anti-static Pocket Comb with Scented Fragrance Smell,perfect",Health & Beauty > Personal Care > Shaving & Hair Removal > After Shaves & Grooming Aids
30,477,Royall Lyme By Royall Fragrances For Men. Aftershave Lotion Cologne 8 Ounces by Royall Fragrances,Health & Beauty > Personal Care > Shaving & Hair Removal > After Shaves & Grooming Aids
31,477,mountaineer brand 100% natural moustache wax 2 oz. twice the size of most,Health & Beauty > Personal Care > Shaving & Hair Removal > After Shaves & Grooming Aids
32,477,Dream Beard - All Natural Hand Crafted Beard Oil - Bearded Barber - 30ml,Health & Beauty > Personal Care > Shaving & Hair Removal > After Shaves & Grooming Aids
33,477,"Beard Brush, Comb, Oil-Handmade Kit Made in USA Beard Care 100% Bamboo Natural Boar Bristle Anti-Static No Snag Unscented Leave-In Conditioner Helps I",Health & Beauty > Personal Care > Shaving & Hair Removal > After Shaves & Grooming Aids
34,477,"The Beardman Beard & Hair Brush for Men, Bamboo with Beachwood with 100% Soft Boar Bristles to Comb Beards and Mustache Complete with a Cotton Gift Bag - Great to Use with Facial Hair Beard Oil, Balm and Conditioners, Use with Dry or Wet Beards (Military - Hard)",Health & Beauty > Personal Care > Shaving & Hair Removal > After Shaves & Grooming Aids
35,477,PRADA AMBER POUR HOMME BY PRADA 3.4 oz / 100 ml AFTER SHAVE BALM FOR MEN,Health & Beauty > Personal Care > Shaving & Hair Removal > After Shaves & Grooming Aids
36,477,"Caveman Island Breeze Beard Oil, Leave in Conditioner, 2oz Coconut, Orange,",Health & Beauty > Personal Care > Shaving & Hair Removal > After Shaves & Grooming Aids
37,477,Smolder & Cinder 2 Pack Beard Oil - By The Blades Grim New,Health & Beauty > Personal Care > Shaving & Hair Removal > After Shaves & Grooming Aids
38,477,Pinaud Clubman After Shave,Health & Beauty > Personal Care > Shaving & Hair Removal > After Shaves & Grooming Aids
39,477,"BushKlawz 4 Sided Pocket Beard, Mustache, Hair, and Side Burns Comb",Health & Beauty > Personal Care > Shaving & Hair Removal > After Shaves & Grooming Aids
40,477,"Art Naturals Beard & Mustache Balm / Oil / Wax / Leave In Conditioner 2.0 oz - 100% Natural Conditioning that Soothes Itching - Thickens, Strengthens, Softens, Tames & Styles Facial Hair Growth.",Health & Beauty > Personal Care > Shaving & Hair Removal > After Shaves & Grooming Aids
41,477,Urban Prince Beard Balm Conditioner Premium Refreshing Scent 2 oz,Health & Beauty > Personal Care > Shaving & Hair Removal > After Shaves & Grooming Aids
42,477,"ArtNaturals Aloe Vera Gel for Face, Hair & Body - Certified Organic, 100% Pure Natural & Cold Pressed 12 Oz - For Sun Burn, Eczema, Bug or Insect Bites, Dry Damaged Aging skin, Razor Bumps and Acne",Health & Beauty > Personal Care > Shaving & Hair Removal > After Shaves & Grooming Aids
43,477,"firehouse moustache wax, dark (ffp)",Health & Beauty > Personal Care > Shaving & Hair Removal > After Shaves & Grooming Aids
44,477,tend skin liquid 16 oz.,Health & Beauty > Personal Care > Shaving & Hair Removal > After Shaves & Grooming Aids
45,477,"lustray blue spice after shave, 14 ounce",Health & Beauty > Personal Care > Shaving & Hair Removal > After Shaves & Grooming Aids
46,477,Beard Conditioner for Men- 100% Natural Wax Conditioning Softener- Use Beard Oil and Balm For Best Results & Growth,Health & Beauty > Personal Care > Shaving & Hair Removal > After Shaves & Grooming Aids
47,477,"Prophet and Tools RETRO Beard Oil and Beard Comb Kit with Free Beard Care Ebook - Unscented Organic Leave in Softener, Conditioner and Beard Growth - Natural for Men with 0% Alcohol, Vegan and Nut Free",Health & Beauty > Personal Care > Shaving & Hair Removal > After Shaves & Grooming Aids
48,477,Urth Post Shave Elixir Health and Beauty,Health & Beauty > Personal Care > Shaving & Hair Removal > After Shaves & Grooming Aids
49,477,Beardology Beard Oil (Sandalwood)- 1.0 Ounces,Health & Beauty > Personal Care > Shaving & Hair Removal > After Shaves & Grooming Aids
50,477,Tabac Original By Maurer & Wirtz For Men. Aftershave 10.1 Oz. by MAURER & WIRTZ,Health & Beauty > Personal Care > Shaving & Hair Removal > After Shaves & Grooming Aids
51,477,Honest Amish Extra Grit Beard Wax - Natural and Organic - Hair Paste and Hair,Health & Beauty > Personal Care > Shaving & Hair Removal > After Shaves & Grooming Aids
52,477,Sandalwood Beard Oil,Health & Beauty > Personal Care > Shaving & Hair Removal > After Shaves & Grooming Aids
53,477,Beard Balm By Wild Willie's - Leave In Conditioner Beard Butter - The Amazing Beard Balm with 13 Natural Locally Sourced Ingredients That Condition an,Health & Beauty > Personal Care > Shaving & Hair Removal > After Shaves & Grooming Aids
54,477,Heroic STAR Beard Brush Two Piece Set With Cloth Drawstring Bag Grooming Kit - Made From 100% Genuine Natural Boar Bristle And Solid Beech Wood - Perfect For Use With Beard Oil Balm Wax And Pomade,Health & Beauty > Personal Care > Shaving & Hair Removal > After Shaves & Grooming Aids
55,477,Beard Balm Conditioner For Men - Wild Willie's Beard Butter - Amazing Beard Balm with 13 Natural Locally Sourced,Health & Beauty > Personal Care > Shaving & Hair Removal > After Shaves & Grooming Aids
56,477,"Skin Bracer by Mennen Afta After Shave-7 oz, 2 pk",Health & Beauty > Personal Care > Shaving & Hair Removal > After Shaves & Grooming Aids
57,477,Professor Fuzzworthy's Beard Care Gloss and Conditioner with Organic Leatherwood Beeswax and Essential Plant Oils 40g,Health & Beauty > Personal Care > Shaving & Hair Removal > After Shaves & Grooming Aids
58,477,tend skin the skin care solution refillable roll on,Health & Beauty > Personal Care > Shaving & Hair Removal > After Shaves & Grooming Aids
59,477,Mennen Afta Original After Shave Skin Conditioner 3 oz. (Pack of 6),Health & Beauty > Personal Care > Shaving & Hair Removal > After Shaves & Grooming Aids
60,477,"clubman pinaud lilac vegetal after-shave lotion, 6-ounce",Health & Beauty > Personal Care > Shaving & Hair Removal > After Shaves & Grooming Aids
61,477,Beard Oil - Conditioner - 100% Natural–Certified Organic–Softens Coarse,Health & Beauty > Personal Care > Shaving & Hair Removal > After Shaves & Grooming Aids
62,477,Zelex for Men Aftershave Balm,Health & Beauty > Personal Care > Shaving & Hair Removal > After Shaves & Grooming Aids
63,477,"aqua velva cooling after shave, classic ice blue, 7 fluid ounce",Health & Beauty > Personal Care > Shaving & Hair Removal > After Shaves & Grooming Aids
64,477,clubman moustache wax with brush comb - neutral health and beauty,Health & Beauty > Personal Care > Shaving & Hair Removal > After Shaves & Grooming Aids
65,477,Beardology Beard Oil,Health & Beauty > Personal Care > Shaving & Hair Removal > After Shaves & Grooming Aids
66,477,Axe Hydrator Post Shave Gel,Health & Beauty > Personal Care > Shaving & Hair Removal > After Shaves & Grooming Aids
67,477,"Beard Conditioner - 100% Natural Beard Conditioner & Softener - Soothes Your Beard and Stops Itching - With Shea Butter, Mango Butter, Sweet Almond Oi",Health & Beauty > Personal Care > Shaving & Hair Removal > After Shaves & Grooming Aids
68,477,"Calvin Klein OBSESSION for Men After Shave, 4 fl. oz. by Calvin Klein",Health & Beauty > Personal Care > Shaving & Hair Removal > After Shaves & Grooming Aids
69,477,eshave after shave cream 4 oz.,Health & Beauty > Personal Care > Shaving & Hair Removal > After Shaves & Grooming Aids
70,477,"SALE | Spartans Den Premium Beard Balm | Beard Conditioner For Growth, Soften, Itch, Grooming & Frizz | Coconut Oil & Vitamin E Infused | ""Legend"" 2oz",Health & Beauty > Personal Care > Shaving & Hair Removal > After Shaves & Grooming Aids
71,477,miracle care by miraclecorp/gimborn 4-ounce kwik-stop styptic gel with benzocaine for dogs and cats,Health & Beauty > Personal Care > Shaving & Hair Removal > After Shaves & Grooming Aids
72,477,mr. natty natty's frank's beard oil elixir,Health & Beauty > Personal Care > Shaving & Hair Removal > After Shaves & Grooming Aids
73,477,"pre de provence shea butter enriched men's after shave balm, 2.5 ounce",Health & Beauty > Personal Care > Shaving & Hair Removal > After Shaves & Grooming Aids
74,477,ALL NATURAL Beard Balm - BEST Leven Rose Beard Balm - 100% Natural Leave In Conditioner with Natural Oils for Moustache Grooming and Beard Growing for Men - Fragrance Free Best Beard Oil Balm Unscented - 2 Oz,Health & Beauty > Personal Care > Shaving & Hair Removal > After Shaves & Grooming Aids
75,477,Issey Miyake L'Eau d'Issey Pour Homme Soothing After Shave Balm - 100ml/3.3oz New,Health & Beauty > Personal Care > Shaving & Hair Removal > After Shaves & Grooming Aids
76,477,beard growther (grow your beard fast) health and beauty,Health & Beauty > Personal Care > Shaving & Hair Removal > After Shaves & Grooming Aids
77,477,"Stetson Original Aftershave, 3.4 Fluid Ounce",Health & Beauty > Personal Care > Shaving & Hair Removal > After Shaves & Grooming Aids
78,477,NEW Age + Damage Defense Facial Moisturizer For Men - 4 OZ - Anti-Aging Cream Hydrator & Soothing Aftershave Lotion In One - All Natural With Certifie Misc.,Health & Beauty > Personal Care > Shaving & Hair Removal > After Shaves & Grooming Aids
79,477,"after shave spray, bump free, medicated, 0.47oz",Health & Beauty > Personal Care > Shaving & Hair Removal > After Shaves & Grooming Aids
80,477,"Hawkeye® Natural Green Sandalwood Handmade Portable Wood Hair Comb,beard Comb",Health & Beauty > Personal Care > Shaving & Hair Removal > After Shaves & Grooming Aids
81,477,mountaineer brand 100% natural beard oil - wv infused - large 2 oz. glass bottle with glass dropper,Health & Beauty > Personal Care > Shaving & Hair Removal > After Shaves & Grooming Aids
82,477,zirh international zirh erase by zirh international for men. aftershave relief tonic 200 ml / 6.7-ounces,Health & Beauty > Personal Care > Shaving & Hair Removal > After Shaves & Grooming Aids
83,477,dr. ganix - competition grade beard bomb - all natural beard conditioner,Health & Beauty > Personal Care > Shaving & Hair Removal > After Shaves & Grooming Aids
84,477,jean paul gaultier le male soothing after shave balm ( tube ) - 100ml/3.3oz,Health & Beauty > Personal Care > Shaving & Hair Removal > After Shaves & Grooming Aids
85,477,Nick Relief Styptic Powder * 6 - Vials,Health & Beauty > Personal Care > Shaving & Hair Removal > After Shaves & Grooming Aids
86,477,taylor of old bond street jermyn street aftershave,Health & Beauty > Personal Care > Shaving & Hair Removal > After Shaves & Grooming Aids
87,477,tend skin the skin care solution,Health & Beauty > Personal Care > Shaving & Hair Removal > After Shaves & Grooming Aids
88,477,kenneth cole reaction by kenneth cole after shave gel 3.4 oz for men,Health & Beauty > Personal Care > Shaving & Hair Removal > After Shaves & Grooming Aids
89,477,beard oil for men - beard potion - beard conditioning oil and softener - stimulate growth and keep your beard healthy - by beard mountain,Health & Beauty > Personal Care > Shaving & Hair Removal > After Shaves & Grooming Aids
90,477,The Classic Man Beard Balm- Cedarwood and Clove - Essential Oil Scented Beard Conditioner and Styling Balm by,Health & Beauty > Personal Care > Shaving & Hair Removal > After Shaves & Grooming Aids
91,477,Aqua Velva Classic Ice Blue Cooling After Shave 3.50 oz (Pack of 3),Health & Beauty > Personal Care > Shaving & Hair Removal > After Shaves & Grooming Aids
92,477,"Beard Conditioner - 100% Natural Beard Conditioner & Softener - Soothes Your Beard and Stops Itching - With Shea Butter, Mango Butter, Argan Oil, & Mo",Health & Beauty > Personal Care > Shaving & Hair Removal > After Shaves & Grooming Aids
93,477,"Mountaineer Brand All-Natural Beard Oil WV Timber, 2 Ounce",Health & Beauty > Personal Care > Shaving & Hair Removal > After Shaves & Grooming Aids
94,477,"Sunny Isle Jamaican Black Castor Oil Beard Oil 2 Oz ""Pack of 2""",Health & Beauty > Personal Care > Shaving & Hair Removal > After Shaves & Grooming Aids
95,477,Movember Best Beard Oil to Soften Hair and Soothe Annoying Itchy Growing Phase By Respect Your Beard | Keeps Hair,Health & Beauty > Personal Care > Shaving & Hair Removal > After Shaves & Grooming Aids
96,477,"grooming lounge best for last aftershave, 5 ounce",Health & Beauty > Personal Care > Shaving & Hair Removal > After Shaves & Grooming Aids
97,477,honest amish - heavy duty beard balm - 2 ounce - beard conditioner,Health & Beauty > Personal Care > Shaving & Hair Removal > After Shaves & Grooming Aids
98,477,BlackBeard's Pride Beard & Mustache Oil all Natural Conditioner for Men-Tame and Soften Facial hair -Highest Quality Pure Botanicals & Essential Oils,Health & Beauty > Personal Care > Shaving & Hair Removal > After Shaves & Grooming Aids
99,477,My Best Beard Comb Wide Tooth Bamboo Hair Comb For The Full Beard and Mustache With Handy Storage Pouch Perfect,Health & Beauty > Personal Care > Shaving & Hair Removal > After Shaves & Grooming Aids
100,477,Beard Catcher w/ Beard Shaper comb + BONUS Beard Grooming eBook! No Clogged Sinks. Easy Disposal. No Mess. Keep the Girlfriend Happy! No.1 Beard Grooming Gift for 2016,Health & Beauty > Personal Care > Shaving & Hair Removal > After Shaves & Grooming Aids
101,477,Barbero Alum Block In Plastic Case 3.52 oz / 100 g,Health & Beauty > Personal Care > Shaving & Hair Removal > After Shaves & Grooming Aids
102,477,Mr. Smith Daily Facial Moisturizer for Men 4oz. Anti-aging Face Care Cream and Soothing Aftershave Lotion All in One. All Natural. Suitable for All Sk,Health & Beauty > Personal Care > Shaving & Hair Removal > After Shaves & Grooming Aids
103,477,sandalwood the bearded man co beard oil conditioner mustache male grooming 10ml,Health & Beauty > Personal Care > Shaving & Hair Removal > After Shaves & Grooming Aids
104,477,Bioelements HIS Post Shave Serum for Men 3 oz,Health & Beauty > Personal Care > Shaving & Hair Removal > After Shaves & Grooming Aids
105,477,"proraso pre-shave cream, green tea & oatmeal, 3.6 oz (100 ml) & great goods alum block after shave & deodorant stone with case (125 g)",Health & Beauty > Personal Care > Shaving & Hair Removal > After Shaves & Grooming Aids
106,477,men's aftershave burt's bees 2.5 oz liquid,Health & Beauty > Personal Care > Shaving & Hair Removal > After Shaves & Grooming Aids
107,477,"Nivea for Men Sensitive Post Shave Balm, Active Comfort System, 3.3-Ounce Bottles (Pack of 2) Health and Beauty",Health & Beauty > Personal Care > Shaving & Hair Removal > After Shaves & Grooming Aids
108,477,Premium Beard Oil for Men - Natural Leave in Conditioner and Softener for Your,Health & Beauty > Personal Care > Shaving & Hair Removal > After Shaves & Grooming Aids
109,477,"Stately Beard Co. - Citrus Mint Beard Oil - All Natural and Organic, 1oz",Health & Beauty > Personal Care > Shaving & Hair Removal > After Shaves & Grooming Aids
110,477,"ArtOfShaving After-Shave Balm, Sandalwood 3.3 Oz (Unboxed)",Health & Beauty > Personal Care > Shaving & Hair Removal > After Shaves & Grooming Aids
111,477,Fat Savage Premium Masculine Scent Beard Oil & Leave-In Conditioner (2oz) All Natural Coconut Oil Based Moisturizer w/ Argan & Jojoba The Best Grooming Product for a Soft Beard & Masculine Scent,Health & Beauty > Personal Care > Shaving & Hair Removal > After Shaves & Grooming Aids
112,477,"Beard Brush, Best Natural Wooden Hair Brush For Men, 100% Firm Black Wild Boar Bristle, Use with Balm & Beard Oil to Style & Groom, Unique Vintage Pac",Health & Beauty > Personal Care > Shaving & Hair Removal > After Shaves & Grooming Aids
113,477,Best Sandalwood Beard Oil & Conditioner for Men - 2oz,Health & Beauty > Personal Care > Shaving & Hair Removal > After Shaves & Grooming Aids
114,477,sandalwood aftershave 100ml after shave by taylor of old bond street,Health & Beauty > Personal Care > Shaving & Hair Removal > After Shaves & Grooming Aids
115,477,"Paul Sebastian by Paul Sebastian for Men, Aftershave Lotion, 4-Ounce by PAUL SEBASTIAN",Health & Beauty > Personal Care > Shaving & Hair Removal > After Shaves & Grooming Aids
116,477,1 coochy after shave protection powder body boudoir .46 oz perfect product fast shipping,Health & Beauty > Personal Care > Shaving & Hair Removal > After Shaves & Grooming Aids
117,477,lucky tiger disappearing cream after shave cream 12oz,Health & Beauty > Personal Care > Shaving & Hair Removal > After Shaves & Grooming Aids
118,477,Natural Man Beard Oil 4oz,Health & Beauty > Personal Care > Shaving & Hair Removal > After Shaves & Grooming Aids
119,477,vintage black by kenneth cole for men: aftershave balm 3.4 oz (tube) (unboxed),Health & Beauty > Personal Care > Shaving & Hair Removal > After Shaves & Grooming Aids
120,477,Mr Rugged Beard Oil,Health & Beauty > Personal Care > Shaving & Hair Removal > After Shaves & Grooming Aids
121,477,"Badass Beard Care Beard Oil For Men - Mountain Man Scent, 1 oz - All Natural Ingredients, Keeps Beard and Mustache Full, Soft and Healthy, Reduce Itchy, Flaky Skin, Promote Healthy Growth",Health & Beauty > Personal Care > Shaving & Hair Removal > After Shaves & Grooming Aids
122,477,beard balm conditioner and hair styling all in one with beeswax lanolin wax and soy protein for condition control and repair,Health & Beauty > Personal Care > Shaving & Hair Removal > After Shaves & Grooming Aids
123,477,"Beardbrand - Mens All Star Beard Set - Tree Ranger - 1 Tree Ranger Beard Oil, 1 Tree Ranger Mustache Wax, 1 Tree",Health & Beauty > Personal Care > Shaving & Hair Removal > After Shaves & Grooming Aids
124,477,Leven Rose Beard Kit - #1 Rated Beard Oil Set - Spiced Sandalwood Beard Oil,Health & Beauty > Personal Care > Shaving & Hair Removal > After Shaves & Grooming Aids
125,477,royall lyme by royall fragrances for men. aftershave lotion cologne 8 ounces,Health & Beauty > Personal Care > Shaving & Hair Removal > After Shaves & Grooming Aids
126,477,"Beard Balm for Men - Leave-In Wax Beard Conditioner With Shea Butter and Argan Oil - Styles, Strengthens and Thickens",Health & Beauty > Personal Care > Shaving & Hair Removal > After Shaves & Grooming Aids
127,477,Premium Beard Comb - Handmade Sandalwood Beard and Mustache Comb - Fine Tooth,Health & Beauty > Personal Care > Shaving & Hair Removal > After Shaves & Grooming Aids
128,477,Beard Balm & Mustache Wax Leave-In Conditioner for Men - Best All Natural High Quality Oils that Give Your Beard an Awesome Look - Revolutionary Formu Health and Beauty,Health & Beauty > Personal Care > Shaving & Hair Removal > After Shaves & Grooming Aids
129,477,#1 TRUSTED Wooden Boar Hair Bristle Beard Brush by Leven Rose - Perfect For a Beard Grooming Kit for Men - Made,Health & Beauty > Personal Care > Shaving & Hair Removal > After Shaves & Grooming Aids
130,477,"My Best Beard Brush For Men - Bamboo With Soft Boar Bristles To Comb Beards and Mustache In A Cotton Gift Bag - Perfect With Facial Hair Beard Oil, Ba",Health & Beauty > Personal Care > Shaving & Hair Removal > After Shaves & Grooming Aids
131,477,Beard Oil for Men- Combine With Balm & Conditioner for Ultimate Beard Care,Health & Beauty > Personal Care > Shaving & Hair Removal > After Shaves & Grooming Aids
132,477,"all natural beard oil - tranquil sandalwood, 2 oz",Health & Beauty > Personal Care > Shaving & Hair Removal > After Shaves & Grooming Aids
133,477,Woody's Quality Grooming for Men 2 in 1 Beard Conditioner 4 oz,Health & Beauty > Personal Care > Shaving & Hair Removal > After Shaves & Grooming Aids
134,477,mr. natty natty's bring me sunshine frank's beard oil elixir,Health & Beauty > Personal Care > Shaving & Hair Removal > After Shaves & Grooming Aids
135,477,Mennen Afta after shave,Health & Beauty > Personal Care > Shaving & Hair Removal > After Shaves & Grooming Aids
136,477,apivita after shave balm with balsam & propolis 100ml / 3.35 oz,Health & Beauty > Personal Care > Shaving & Hair Removal > After Shaves & Grooming Aids
137,477,Beard Shaping Tool By GuideLine Pro Beard Care Product Use W/ Trimmer Or Razor Cut Symmetrical Beard and Mustache [ The Only Flexible Template ],Health & Beauty > Personal Care > Shaving & Hair Removal > After Shaves & Grooming Aids
138,477,"professor fuzzworthy's beard care gloss and conditioner with organic oils from tasmania, australia",Health & Beauty > Personal Care > Shaving & Hair Removal > After Shaves & Grooming Aids
139,477,Detroit Grooming Co. Beard Oil - The Corktown 0.5 Oz.| Oil For All Beards | Helps Soften And Condition Dry And,Health & Beauty > Personal Care > Shaving & Hair Removal > After Shaves & Grooming Aids
140,477,"Temperance Beard Oil | Premium, Unscented Natural Oil | Best Softener and Conditioner for Itchy Beards",Health & Beauty > Personal Care > Shaving & Hair Removal > After Shaves & Grooming Aids
