,category_id,description,category_path
1819,494,"Durex Invisible Ultra Thin Ultra Sensitive Lubricated Latex Condoms, 8 count",Health & Beauty > Sexual Wellness > Contraceptives & Lubricants > Condoms
1820,494,"Trojan Intensified Charged Orgasmic Pleasure Lubricant Condoms, 10 count",Health & Beauty > Sexual Wellness > Contraceptives & Lubricants > Condoms
1821,494,Lifestyles Skyn NonLatex Condoms 24 count,Health & Beauty > Sexual Wellness > Contraceptives & Lubricants > Condoms
1822,494,Durex Extra Sensitive Super Thin Condoms 24 Ct,Health & Beauty > Sexual Wellness > Contraceptives & Lubricants > Condoms
1823,494,"Trojan ENZ Premium Lubricant Condoms, 12ct",Health & Beauty > Sexual Wellness > Contraceptives & Lubricants > Condoms
1824,494,"Trojan Platinum Pack Premium Latex Condoms, 10 count",Health & Beauty > Sexual Wellness > Contraceptives & Lubricants > Condoms
1825,494,"Durex Performax Intense Ribbed Dotted Condoms with Delay Lubricant, 3 Count",Health & Beauty > Sexual Wellness > Contraceptives & Lubricants > Condoms
1826,494,Trojan Studded BareSkin Premium Lubricated Latex Condoms 10.0 ea,Health & Beauty > Sexual Wellness > Contraceptives & Lubricants > Condoms
1827,494,Durex Avanti Bare RealFeel Ultra Fine Lubricated Polyisoprene Non-Latex Condoms 24.0 ea,Health & Beauty > Sexual Wellness > Contraceptives & Lubricants > Condoms
1828,494,BareSkin Sensitivity Premium Lubricant Latex Condoms Trojan 24.0 ea,Health & Beauty > Sexual Wellness > Contraceptives & Lubricants > Condoms
1829,494,Trojan Her Pleasure Sensations Premium Lubricant Latex Condoms 12.0 ea,Health & Beauty > Sexual Wellness > Contraceptives & Lubricants > Condoms
1830,494,Trojan Magnum BareSkin Lubricated Latex Condoms 10.0 ea,Health & Beauty > Sexual Wellness > Contraceptives & Lubricants > Condoms
1831,494,Sensations Lubricated Premium Latex Condoms Trojan Her Pleasure 3.0 ea.,Health & Beauty > Sexual Wellness > Contraceptives & Lubricants > Condoms
1832,494,Durex Tropical Flavors Premium Lubricated Latex Condoms Assorted 12.0 ea,Health & Beauty > Sexual Wellness > Contraceptives & Lubricants > Condoms
1833,494,"Trojan Magnum Lubricated Latex Condoms, 36 ct",Health & Beauty > Sexual Wellness > Contraceptives & Lubricants > Condoms
1834,494,Mayer Laboratories Kimono Microthin Lubricated Latex Condoms -- 3 Condoms,Health & Beauty > Sexual Wellness > Contraceptives & Lubricants > Condoms
1835,494,Lifestyles Ultra Sensitive Condoms Lubricated Latex 3.0 EA 0.05 LBS,Health & Beauty > Sexual Wellness > Contraceptives & Lubricants > Condoms
1836,494,"Trojan Sensitivity Bare Skin Premium Lubricant Latex Condoms Value Pack, 24CT 24.0 CT 0.40 LBS",Health & Beauty > Sexual Wellness > Contraceptives & Lubricants > Condoms
1837,494,"Sustain Lubricated Condoms, Comfort Fit - (10pk)",Health & Beauty > Sexual Wellness > Contraceptives & Lubricants > Condoms
1838,494,Trojan Ultra Thin Sensitivity Spermicidal Condom - 12 Count,Health & Beauty > Sexual Wellness > Contraceptives & Lubricants > Condoms
1839,494,Trojan Enz Spermicidal Lubricated Condom - 12 Count,Health & Beauty > Sexual Wellness > Contraceptives & Lubricants > Condoms
1840,494,Trojan Trojan Ultra Thin Lubricated Condoms 36 Condoms,Health & Beauty > Sexual Wellness > Contraceptives & Lubricants > Condoms
1841,494,"Trojan Trojan Luxury Lubricated Natural Skin Condoms, 10 ea",Health & Beauty > Sexual Wellness > Contraceptives & Lubricants > Condoms
1842,494,"Trojan Trojan Stimulations Ultra Ribbed Latex Condoms, 12 Count",Health & Beauty > Sexual Wellness > Contraceptives & Lubricants > Condoms
1843,494,Trojan Trojan Condom Stimulations Intense Ribbed Ultrasmooth Lub...,Health & Beauty > Sexual Wellness > Contraceptives & Lubricants > Condoms
1844,494,Trojan Trojan Condoms Trojan Supra Lubricated Condoms - 6 pack,Health & Beauty > Sexual Wellness > Contraceptives & Lubricants > Condoms
1845,494,"Durex Durex Invisible Condom, 8 Ct",Health & Beauty > Sexual Wellness > Contraceptives & Lubricants > Condoms
1846,494,Trojan Pleasure Pack Premium Lubricated Latex Condoms,Health & Beauty > Sexual Wellness > Contraceptives & Lubricants > Condoms
1847,494,"Kimono MicroThin, Ultra Lubricated Latex Condoms Aqua Lube",Health & Beauty > Sexual Wellness > Contraceptives & Lubricants > Condoms
1848,494,TROJAN 24Ct Bareskin Condom,Health & Beauty > Sexual Wellness > Contraceptives & Lubricants > Condoms
1849,494,"Trojan Stimulations Ultra Ribbed Latex Condoms, Premium Lubricant - 3 pack",Health & Beauty > Sexual Wellness > Contraceptives & Lubricants > Condoms
1850,494,Trojan Pleasure Pack Condoms 40 Co...,Health & Beauty > Sexual Wellness > Contraceptives & Lubricants > Condoms
1851,494,Durex Condom 60 Count,Health & Beauty > Sexual Wellness > Contraceptives & Lubricants > Condoms
1852,494,Trojan Pleasure Pack,Health & Beauty > Sexual Wellness > Contraceptives & Lubricants > Condoms
1853,494,Trojan Ultra-Ribbed Ecstasy Condoms 10-pk.,Health & Beauty > Sexual Wellness > Contraceptives & Lubricants > Condoms
1854,494,"Condom, Classic",Health & Beauty > Sexual Wellness > Contraceptives & Lubricants > Condoms
1855,494,"Mayer Laboratories, Kimono, MicroThin Condoms, Lubricated, 12 Latex Condoms",Health & Beauty > Sexual Wellness > Contraceptives & Lubricants > Condoms
1856,494,Trojan Platinum Pack Lubricated Latex Condoms - 10 ea,Health & Beauty > Sexual Wellness > Contraceptives & Lubricants > Condoms
1857,494,"Trojan Ultra Thin Lubricated Latex Condoms, Spermicidal - 12 ea",Health & Beauty > Sexual Wellness > Contraceptives & Lubricants > Condoms
1858,494,Durex® Extra Sensitive™ Ultra Thin Condoms - 24 Count,Health & Beauty > Sexual Wellness > Contraceptives & Lubricants > Condoms
1859,494,Trojan Sensitivity Ultra Thin Premium Lubricant Condoms - 36 Count,Health & Beauty > Sexual Wellness > Contraceptives & Lubricants > Condoms
1860,494,Trojan Riviera Lubricant,Health & Beauty > Sexual Wellness > Contraceptives & Lubricants > Condoms
1861,494,LifeStyles Variety Premium Latex Condoms - 50 Count,Health & Beauty > Sexual Wellness > Contraceptives & Lubricants > Condoms
1862,494,SKYN® Elite Non-Latex Lubricated Condoms - 10 Count,Health & Beauty > Sexual Wellness > Contraceptives & Lubricants > Condoms
1863,494,ONE ZERO Condoms - 40 Count,Health & Beauty > Sexual Wellness > Contraceptives & Lubricants > Condoms
1864,494,LifeStyles® Skyn Original Condoms - 24 Count,Health & Beauty > Sexual Wellness > Contraceptives & Lubricants > Condoms
1865,494,Trojan Bareskin Premium Lubricant Condoms - 10 Count,Health & Beauty > Sexual Wellness > Contraceptives & Lubricants > Condoms
1866,494,Trojan Pleasure Pack Lubricated Condoms - 36 Count,Health & Beauty > Sexual Wellness > Contraceptives & Lubricants > Condoms
1867,494,"Trojan Sensitivity Condoms, 10ct",Health & Beauty > Sexual Wellness > Contraceptives & Lubricants > Condoms
1868,494,"Trojan Pleasure Pack Lubricated Latex Condoms, 36ct",Health & Beauty > Sexual Wellness > Contraceptives & Lubricants > Condoms
1869,494,Trojan Sensitivity Thintensity Ultrasmooth Lubricant Latex Condoms 12 count,Health & Beauty > Sexual Wellness > Contraceptives & Lubricants > Condoms
1870,494,Trojan Extended Pleasure Climax Control Lubricated Premium Latex Condoms 12.0 ea,Health & Beauty > Sexual Wellness > Contraceptives & Lubricants > Condoms
1871,494,Extra Sensitive Ultra Thin Condoms with Extra Lube Durex,Health & Beauty > Sexual Wellness > Contraceptives & Lubricants > Condoms
1872,494,"Okamoto 004, Male Latex Condoms 10.0 ea",Health & Beauty > Sexual Wellness > Contraceptives & Lubricants > Condoms
1873,494,Trojan Magnum Ecstasy UltraSmooth Lubricant Premium Latex Condoms 10.0 ea,Health & Beauty > Sexual Wellness > Contraceptives & Lubricants > Condoms
1874,494,One ZERO Condoms 12.0 ea,Health & Beauty > Sexual Wellness > Contraceptives & Lubricants > Condoms
1875,494,Extra Sensitive Ultra Thin Condoms with Extra Lube Durex 24.0 ea,Health & Beauty > Sexual Wellness > Contraceptives & Lubricants > Condoms
1876,494,Kimono MicroThin Sheer Variety Pack 24.0 ea,Health & Beauty > Sexual Wellness > Contraceptives & Lubricants > Condoms
1877,494,"Trojan Lubricated Latex Condoms, Pleasure Pack 36.0 ea",Health & Beauty > Sexual Wellness > Contraceptives & Lubricants > Condoms
1878,494,"Trojan Condom Sensitivity BareSkin Lubricated, 24 pk",Health & Beauty > Sexual Wellness > Contraceptives & Lubricants > Condoms
1879,494,"Mayer Laboratories Kimono Condoms Microthin Large, 12CT 12.0 CT 0.11 LBS",Health & Beauty > Sexual Wellness > Contraceptives & Lubricants > Condoms
1880,494,Trojan Ultra Thin Condoms Lubricated Latex 12.0 EA NA,Health & Beauty > Sexual Wellness > Contraceptives & Lubricants > Condoms
1881,494,Durex Extra Sensitive Condoms Lubricated Latex 3.0 EA 0.03 LBS,Health & Beauty > Sexual Wellness > Contraceptives & Lubricants > Condoms
1882,494,Trojan Pleasure Pack Lubricated Latex Condoms 36.0 EA NA,Health & Beauty > Sexual Wellness > Contraceptives & Lubricants > Condoms
1883,494,Trojan Stimulations Twisted Pleasure Lubricated Latex Condoms-12 ct,Health & Beauty > Sexual Wellness > Contraceptives & Lubricants > Condoms
1884,494,Trojan Sensitivity Ultra Thin Lubricated Latex Condoms-3 ct,Health & Beauty > Sexual Wellness > Contraceptives & Lubricants > Condoms
1885,494,Durex Extra Sensitive Latex Condoms Premium Lubricated Ultra Thin 12 CT PKG,Health & Beauty > Sexual Wellness > Contraceptives & Lubricants > Condoms
1886,494,Trojan Condoms Bare Skin Sensitivity Lubricated - 10 Count,Health & Beauty > Sexual Wellness > Contraceptives & Lubricants > Condoms
1887,494,Trojan Sensitivity Thintensity Condom - 12 Count,Health & Beauty > Sexual Wellness > Contraceptives & Lubricants > Condoms
1888,494,"Lifestyles Ultra Sensitive Latex Condoms, 40ct",Health & Beauty > Sexual Wellness > Contraceptives & Lubricants > Condoms
1889,494,"LifeStyles Ultra Sensitive Premium Lubricated Latex Condoms, 14 ct",Health & Beauty > Sexual Wellness > Contraceptives & Lubricants > Condoms
1890,494,"Trojan Her Pleasure Sensations Latex Condoms, Premium Lubricant - 12 pack",Health & Beauty > Sexual Wellness > Contraceptives & Lubricants > Condoms
1891,494,Durex Realfeel Latex Free Condoms - 10 ...,Health & Beauty > Sexual Wellness > Contraceptives & Lubricants > Condoms
1892,494,Durex Extra Sensitive Ultra Thin Condoms - 12 Count,Health & Beauty > Sexual Wellness > Contraceptives & Lubricants > Condoms
1893,494,"Trojan Magnum XL Premium Lubricated Latex Condoms, Extra Large Size - 12 pack",Health & Beauty > Sexual Wellness > Contraceptives & Lubricants > Condoms
1894,494,LifeStyles Skyn Non-Latex Lubricated Condoms Large,Health & Beauty > Sexual Wellness > Contraceptives & Lubricants > Condoms
1895,494,ONE Tantric Pleasures Condoms - 12 Count,Health & Beauty > Sexual Wellness > Contraceptives & Lubricants > Condoms
1896,494,Sir Richard's Extra Large Condoms - 12 Count,Health & Beauty > Sexual Wellness > Contraceptives & Lubricants > Condoms
1897,494,LifeStyles® Pleasure Collection Condoms - 30 count,Health & Beauty > Sexual Wellness > Contraceptives & Lubricants > Condoms
1898,494,Trojan Double Ecstasy Lubricated Condoms - 10 Count,Health & Beauty > Sexual Wellness > Contraceptives & Lubricants > Condoms
1899,494,Durex Play Vibrations Vibrating Ring - 1 Count,Health & Beauty > Sexual Wellness > Contraceptives & Lubricants > Condoms
1900,494,"Trojan Extended Condoms, 12ct",Health & Beauty > Sexual Wellness > Contraceptives & Lubricants > Condoms
1901,494,"Trojan Stimulations Ecstasy Ultrasmooth Lubricant Latex Condoms, 26 count",Health & Beauty > Sexual Wellness > Contraceptives & Lubricants > Condoms
1902,494,"Durex Performax Intense Premium Lubricated Latex Condoms, 12ct",Health & Beauty > Sexual Wellness > Contraceptives & Lubricants > Condoms
1903,494,"Trojan Lubricated Condoms Pleasure Pack, 3ct",Health & Beauty > Sexual Wellness > Contraceptives & Lubricants > Condoms
1904,494,"Trojan Thintensity Condoms For Ultra Sensitivity, 12ct",Health & Beauty > Sexual Wellness > Contraceptives & Lubricants > Condoms
1905,494,Trojan Pleasures Fire Ice Dual Action Lubricant Condoms 10ct,Health & Beauty > Sexual Wellness > Contraceptives & Lubricants > Condoms
1906,494,Trojan Sensitivity BareSkin Premium Lubricant Latex Condoms Value Pack - 24 CT,Health & Beauty > Sexual Wellness > Contraceptives & Lubricants > Condoms
1907,494,"Trojan Stimulations Twisted Premium Latex Condoms, 12 count",Health & Beauty > Sexual Wellness > Contraceptives & Lubricants > Condoms
1908,494,"Trojan Platinum Pack Premium Latex Condoms, 10ct",Health & Beauty > Sexual Wellness > Contraceptives & Lubricants > Condoms
1909,494,"Trojan-Enz Lubricated Latex Condoms, Spermicidal 36.0 ea",Health & Beauty > Sexual Wellness > Contraceptives & Lubricants > Condoms
1910,494,"Trojan Magnum Lubricated Latex Condoms, Thin Large 12.0 ea",Health & Beauty > Sexual Wellness > Contraceptives & Lubricants > Condoms
1911,494,Ecstasy UltraSmooth Lubricated Premium Latex Condoms Trojan 26.0 ea,Health & Beauty > Sexual Wellness > Contraceptives & Lubricants > Condoms
1912,494,Durex Variety Bowl 144.0 ea,Health & Beauty > Sexual Wellness > Contraceptives & Lubricants > Condoms
1913,494,"Lubricated Latex Condoms, Thin Large Trojan Magnum 12.0 ea",Health & Beauty > Sexual Wellness > Contraceptives & Lubricants > Condoms
1914,494,Trojan Magnum Lubricated Latex Condoms-3 ct,Health & Beauty > Sexual Wellness > Contraceptives & Lubricants > Condoms
1915,494,Mayer Laboratories Kimono Microthin Lubricated Latex Condoms Large -- 12 Condoms,Health & Beauty > Sexual Wellness > Contraceptives & Lubricants > Condoms
1916,494,Lifestyles Skyn Premium Non-Latex Condoms 3.0 EA 0.02 LBS,Health & Beauty > Sexual Wellness > Contraceptives & Lubricants > Condoms
1917,494,Trojan Her Pleasure Condoms Spermicidal Lubricant Latex 12.0 EA NA,Health & Beauty > Sexual Wellness > Contraceptives & Lubricants > Condoms
1918,494,Trojan Condoms Ultra Thin Lubricated 3.0 EA 0.03 LBS,Health & Beauty > Sexual Wellness > Contraceptives & Lubricants > Condoms
1919,494,Trojan Stimulations Intense Ribbed Ultrasmooth Lubricated Latex Condoms-12 ct,Health & Beauty > Sexual Wellness > Contraceptives & Lubricants > Condoms
1920,494,Trojan Sensitivity Ultra Thin Lubricated Condoms - (12ct),Health & Beauty > Sexual Wellness > Contraceptives & Lubricants > Condoms
1921,494,Durex Extra-Sensitive Lubricated Condoms - (12ct),Health & Beauty > Sexual Wellness > Contraceptives & Lubricants > Condoms
1922,494,Trojan Magnum Large Size Lubricated Condoms - (12ct),Health & Beauty > Sexual Wellness > Contraceptives & Lubricants > Condoms
1923,494,Trojan Sensitivity Premium Latex Condoms Lubricant Ultra Thin 12 CT BOX,Health & Beauty > Sexual Wellness > Contraceptives & Lubricants > Condoms
1924,494,Trojan Her Pleasure Ecstasy Ultrasmooth Lubricated Condom - 10 Count,Health & Beauty > Sexual Wellness > Contraceptives & Lubricants > Condoms
1925,494,Durex Durex Avanti Bare - Real Feel Non-Latex Condom 24 Count,Health & Beauty > Sexual Wellness > Contraceptives & Lubricants > Condoms
1926,494,Trojan Trojan-Enz Lubricated Condoms - Box of 12,Health & Beauty > Sexual Wellness > Contraceptives & Lubricants > Condoms
1927,494,Durex Durex Performax Intense Lubricated Ribbed Dotted Premium ...,Health & Beauty > Sexual Wellness > Contraceptives & Lubricants > Condoms
1928,494,"LifeStyles Lifestyles Skyn Selection Condoms, 24 Ct",Health & Beauty > Sexual Wellness > Contraceptives & Lubricants > Condoms
1929,494,Trojan Trojan Stimulations Ultra Ribbed Premium Lubricant Condom...,Health & Beauty > Sexual Wellness > Contraceptives & Lubricants > Condoms
1930,494,Durex Durex Performax - Intense Condom 12 Count,Health & Beauty > Sexual Wellness > Contraceptives & Lubricants > Condoms
1931,494,"Durex Pleasure Pack Condoms, 24 Ct",Health & Beauty > Sexual Wellness > Contraceptives & Lubricants > Condoms
1932,494,Trojan Sensitivity BareSkin Lubricated Premium Latex Condoms,Health & Beauty > Sexual Wellness > Contraceptives & Lubricants > Condoms
1933,494,Durex Pleasure Pack Assorted Premium Lubricated Latex Condoms,Health & Beauty > Sexual Wellness > Contraceptives & Lubricants > Condoms
1934,494,Trojan Pleasure Pack Premium Lubricated Latex Condoms - 3 pack,Health & Beauty > Sexual Wellness > Contraceptives & Lubricants > Condoms
1935,494,TROJAN 36Ct Pleasure Pack,Health & Beauty > Sexual Wellness > Contraceptives & Lubricants > Condoms
1936,494,"Sirrichard Collection Pack Condoms, 12 pack",Health & Beauty > Sexual Wellness > Contraceptives & Lubricants > Condoms
1937,494,l. condoms do each other good 12 pack health and beauty,Health & Beauty > Sexual Wellness > Contraceptives & Lubricants > Condoms
1938,494,Trojan Her Pleasure Condoms Lubricated Latex 3.0 EA 0.02 LBS,Health & Beauty > Sexual Wellness > Contraceptives & Lubricants > Condoms
1939,494,Trojan-Enz Condoms Spermicidal Lubricant Latex 12.0 EA 0.56 LBS,Health & Beauty > Sexual Wellness > Contraceptives & Lubricants > Condoms
1940,494,Trojan Condom Intensified Charged,Health & Beauty > Sexual Wellness > Contraceptives & Lubricants > Condoms
1941,494,Trojan Sensitivity Thintensity Lubricated Latex Condoms-12 ct,Health & Beauty > Sexual Wellness > Contraceptives & Lubricants > Condoms
1942,494,Trojan Magnum Latex Condoms Lubricated Large Size 12 CT BOX,Health & Beauty > Sexual Wellness > Contraceptives & Lubricants > Condoms
1943,494,Durex Pleasure Pack Latex Condoms Premium Lubricated 12 CT PKG,Health & Beauty > Sexual Wellness > Contraceptives & Lubricants > Condoms
1944,494,Durex Condoms Extra Sensitive Ultra Thin With Extra Lube - 12 Count,Health & Beauty > Sexual Wellness > Contraceptives & Lubricants > Condoms
1945,494,Trojan Trojan Condoms Trojan Platinum Pack -10 Pack,Health & Beauty > Sexual Wellness > Contraceptives & Lubricants > Condoms
1946,494,Trojan Trojan Condom Stimulations Ultra Ribbed Lubricated 36 Pc,Health & Beauty > Sexual Wellness > Contraceptives & Lubricants > Condoms
1947,494,"Trojan Trojan Sensitivity Bareskin Ultrathin Condoms, 10 Count",Health & Beauty > Sexual Wellness > Contraceptives & Lubricants > Condoms
1948,494,Sustain Sustain Condoms Ultra Thin - 10 Pack,Health & Beauty > Sexual Wellness > Contraceptives & Lubricants > Condoms
1949,494,Durex Durex Invisible - Condom 16 Count,Health & Beauty > Sexual Wellness > Contraceptives & Lubricants > Condoms
1950,494,Trojan Trojan Double Ecstasy Condoms - Box of 10,Health & Beauty > Sexual Wellness > Contraceptives & Lubricants > Condoms
1951,494,Trojan Trojan Stimulations Ecstasy Ribbed Condoms - Box of 10,Health & Beauty > Sexual Wellness > Contraceptives & Lubricants > Condoms
1952,494,Durex Durex Avanti Bare - Realfeel Non-Latex Condom 10 Count,Health & Beauty > Sexual Wellness > Contraceptives & Lubricants > Condoms
1953,494,LifeStyles Pleasure Collection Condoms & Lubricant Pack,Health & Beauty > Sexual Wellness > Contraceptives & Lubricants > Condoms
1954,494,Trojan Ultra Thin Lubricated Premium Latex Condoms - 12 pack,Health & Beauty > Sexual Wellness > Contraceptives & Lubricants > Condoms
1955,494,Trojan Supra Lube Condoms 6-pk.,Health & Beauty > Sexual Wellness > Contraceptives & Lubricants > Condoms
1956,494,TROJAN 10Ct Bare Skin Condoms,Health & Beauty > Sexual Wellness > Contraceptives & Lubricants > Condoms
1957,494,Durex Extra Sensitive Ultra Thin Premium Lubricated Latex Condoms,Health & Beauty > Sexual Wellness > Contraceptives & Lubricants > Condoms
1958,494,Durex Extra Sensitive Condom - 12.00 ct,Health & Beauty > Sexual Wellness > Contraceptives & Lubricants > Condoms
1959,494,Aoni Condoms - Extra Smooth Ultrathin 001 - World's Thinnest Latex Condom by Guinness World Records with Collagen-Infused Lubricant| 12pcs,Health & Beauty > Sexual Wellness > Contraceptives & Lubricants > Condoms
1960,494,"LifeStyles SNUGGER FIT Condoms - Also available in quantities of 12, 25, 90 (50 condoms)",Health & Beauty > Sexual Wellness > Contraceptives & Lubricants > Condoms
1961,494,Durex Extra Sensitive Lubricated 3pk,Health & Beauty > Sexual Wellness > Contraceptives & Lubricants > Condoms
1962,494,"Lifestyles THYN Condoms - Also available in quantities of 12, 50, 100 - (25 condoms)",Health & Beauty > Sexual Wellness > Contraceptives & Lubricants > Condoms
1963,494,Durex Extra Sensitive - 60 Piece - Low Shipping!,Health & Beauty > Sexual Wellness > Contraceptives & Lubricants > Condoms
1964,494,"Beyond Seven Pure Pleasure Sampler Pack Including Ultra Thin, Ultra Thin Aloe",Health & Beauty > Sexual Wellness > Contraceptives & Lubricants > Condoms
1965,494,"LifeStyles Skyn Elite Male Condoms, 10 Count",Health & Beauty > Sexual Wellness > Contraceptives & Lubricants > Condoms
1966,494,"Lifestyles Latex Condom, Extra Ribbed, Ultra Studded, Pleasure Shaped 2-packs of 12 Condoms",Health & Beauty > Sexual Wellness > Contraceptives & Lubricants > Condoms
1967,494,"Trojan Non-Lubricated Latex Condoms, Enz 12 ct (Quantity of 4)",Health & Beauty > Sexual Wellness > Contraceptives & Lubricants > Condoms
1968,494,"Kimono MicroThin AQUA LUBE - Also available in quantities of 12, 25, 100 (50",Health & Beauty > Sexual Wellness > Contraceptives & Lubricants > Condoms
1969,494,"LifeStyles SKYN LARGE Condoms - Also available in quantities of 12, 25, 90 (50 condoms)",Health & Beauty > Sexual Wellness > Contraceptives & Lubricants > Condoms
1970,494,"Kimono MicroThin RIBBED AND SENSI-DOTS Condoms - Also available in quantities of 12, 25, 100 (50 condoms)",Health & Beauty > Sexual Wellness > Contraceptives & Lubricants > Condoms
1971,494,Condom: Trojan Magnum Thin 3 Pack,Health & Beauty > Sexual Wellness > Contraceptives & Lubricants > Condoms
1972,494,Crown Condoms 100 Pack,Health & Beauty > Sexual Wellness > Contraceptives & Lubricants > Condoms
1973,494,"100 Beyond Seven Sheerlon Natural Rubber Latex Condoms, Extra Thin and Sensitive",Health & Beauty > Sexual Wellness > Contraceptives & Lubricants > Condoms
1974,494,"LifeStyles TUXEDO Condoms - Also available in quantities of 12, 25, 100 (50 condoms)",Health & Beauty > Sexual Wellness > Contraceptives & Lubricants > Condoms
1975,494,Tastees Flavored Condoms 24 Pack Assorted,Health & Beauty > Sexual Wellness > Contraceptives & Lubricants > Condoms
1976,494,Lixx by Trustex Latex Dams Dental Dams Banana Flavor 12 count,Health & Beauty > Sexual Wellness > Contraceptives & Lubricants > Condoms
1977,494,"LifeStyles SKYN EXTRA LUBRICATED Condoms - Various Quantities 12, 25, 50, 90 (12 condoms)",Health & Beauty > Sexual Wellness > Contraceptives & Lubricants > Condoms
1978,494,BILLY BOY Special Comfort,Health & Beauty > Sexual Wellness > Contraceptives & Lubricants > Condoms
1979,494,24 Durex Condoms Variety Pack! CondomMan's Collection of the the Best Durex Condom Styles,Health & Beauty > Sexual Wellness > Contraceptives & Lubricants > Condoms
1980,494,Trojan Pleasures Extended Pleasure Lubricated Latex Condoms-12 ct (Quantity,Health & Beauty > Sexual Wellness > Contraceptives & Lubricants > Condoms
1981,494,KIMONO MICRO THIN CONDOMS 3EA,Health & Beauty > Sexual Wellness > Contraceptives & Lubricants > Condoms
1982,494,Trojan Extended Pleasure Lubricated Condoms 12 Pack,Health & Beauty > Sexual Wellness > Contraceptives & Lubricants > Condoms
1983,494,Mayer Laboratories Kimono Condom MicroThin Aqua Lube - 12 Condoms - HSG-906826,Health & Beauty > Sexual Wellness > Contraceptives & Lubricants > Condoms
1984,494,"Lifestyles Skyn Selection Condoms, 10 Count",Health & Beauty > Sexual Wellness > Contraceptives & Lubricants > Condoms
1985,494,"Trojan Platinum Pack Premium Latex Condoms, Includes Bareskin, Ecstasy & Fire and Ice - 10 Condoms + Bonus Free Astroglide Gel 4 Ounce",Health & Beauty > Sexual Wellness > Contraceptives & Lubricants > Condoms
1986,494,Lixx by Trustex Latex Dams Dental Dams Vanilla Flavor 12 count,Health & Beauty > Sexual Wellness > Contraceptives & Lubricants > Condoms
1987,494,"Lifestyles SKYN and SKYN Intense Feel Combo Pack, Premium NON-LATEX Condoms, 20 Count",Health & Beauty > Sexual Wellness > Contraceptives & Lubricants > Condoms
1988,494,"Trojan Stimulations Ecstasy Ultrasmooth Lubricant,26-count (Packaging May Vary)",Health & Beauty > Sexual Wellness > Contraceptives & Lubricants > Condoms
1989,494,Okamoto BEYOND SEVEN Condoms - 25 condoms New,Health & Beauty > Sexual Wellness > Contraceptives & Lubricants > Condoms
1990,494,"Trojan Magnum Ultimate Collection (Regular, Ribbed, and Thin) Premium Large",Health & Beauty > Sexual Wellness > Contraceptives & Lubricants > Condoms
1991,494,"Trojan Sensitivity Bareskin Lubricated, Latex Condoms, 10 Pc (Pack of 4)",Health & Beauty > Sexual Wellness > Contraceptives & Lubricants > Condoms
1992,494,Beyond Seven By Okamoto,Health & Beauty > Sexual Wellness > Contraceptives & Lubricants > Condoms
1993,494,"Kimono MicroThin LARGE Condoms - Also available in quantities of 12, 50, 100 (25 condoms)",Health & Beauty > Sexual Wellness > Contraceptives & Lubricants > Condoms
1994,494,100 Small Condoms Variety Pack + Free Lubricant - Bulgeinbulk's Collection of 6 Different Types of Snugger Fit Condom,Health & Beauty > Sexual Wellness > Contraceptives & Lubricants > Condoms
1995,494,"Lifestyles Skyn Polyisoprene Condoms, 24-count Health and Beauty",Health & Beauty > Sexual Wellness > Contraceptives & Lubricants > Condoms
1996,494,Lifestyles Tuxedo Condoms,Health & Beauty > Sexual Wellness > Contraceptives & Lubricants > Condoms
1997,494,Lifestyles Skyn Extra,Health & Beauty > Sexual Wellness > Contraceptives & Lubricants > Condoms
1998,494,Okamoto Hydro pu 6 Condoms,Health & Beauty > Sexual Wellness > Contraceptives & Lubricants > Condoms
1999,494,"Studded Bareskin Lubricated Condoms, 10 Count",Health & Beauty > Sexual Wellness > Contraceptives & Lubricants > Condoms
2000,494,Icon Large Lubricated Latex Condoms 50 Pack,Health & Beauty > Sexual Wellness > Contraceptives & Lubricants > Condoms
2001,494,Crown Condoms - Pack Size,Health & Beauty > Sexual Wellness > Contraceptives & Lubricants > Condoms
