,category_id,description,category_path
0,494,"Trojan Studded Bareskin Premium Lubricated Condoms, 10ct",Health & Beauty > Sexual Wellness > Contraceptives & Lubricants > Condoms
1,494,LifeStyles EXTRA STRENGTH Condoms - 12 condoms,Health & Beauty > Sexual Wellness > Contraceptives & Lubricants > Condoms
2,494,LifeStyles SNUGGER FIT Condoms - 48 count,Health & Beauty > Sexual Wellness > Contraceptives & Lubricants > Condoms
3,494,Okamoto CROWN condoms - 25 condoms,Health & Beauty > Sexual Wellness > Contraceptives & Lubricants > Condoms
4,494,OKAMOTO 0.03 CONDOMES 12pieces MADE IN JAPAN,Health & Beauty > Sexual Wellness > Contraceptives & Lubricants > Condoms
5,494,Snugger Fit Condom Sampler,Health & Beauty > Sexual Wellness > Contraceptives & Lubricants > Condoms
6,494,"Durex Extra Sensitive Condom, Box of 12",Health & Beauty > Sexual Wellness > Contraceptives & Lubricants > Condoms
7,494,"LUCKY BLOKE Premium Thin Condoms - Ultimate International ULTRA THIN Condom Sampler - World's Best Thin Condoms (12 pack): Trojan, Okamoto, Kimono, Cr",Health & Beauty > Sexual Wellness > Contraceptives & Lubricants > Condoms
8,494,LIfeStyles ULTRA SENSITIVE NON LUBRICATED Condoms - 60 count,Health & Beauty > Sexual Wellness > Contraceptives & Lubricants > Condoms
9,494,"Lifestyles Skyn Polyisoprene Condoms, 24-count",Health & Beauty > Sexual Wellness > Contraceptives & Lubricants > Condoms
10,494,"Durex Lubricated Latex Condoms, Extra Sensitive 12 ct (Pack of 1)",Health & Beauty > Sexual Wellness > Contraceptives & Lubricants > Condoms
11,494,LifeStyles SNUGGER FIT Condoms - 50 condoms New,Health & Beauty > Sexual Wellness > Contraceptives & Lubricants > Condoms
12,494,Aoni Condoms - Extra Smooth Ultrathin 001 - World's Thinnest Latex Condom by,Health & Beauty > Sexual Wellness > Contraceptives & Lubricants > Condoms
13,494,Special pack of 6 TROJAN,Health & Beauty > Sexual Wellness > Contraceptives & Lubricants > Condoms
14,494,"Crown-Okamoto Super Thin Condoms, 24ct",Health & Beauty > Sexual Wellness > Contraceptives & Lubricants > Condoms
15,494,Okamoto 0.04 Zero Zero Four,Health & Beauty > Sexual Wellness > Contraceptives & Lubricants > Condoms
16,494,"Okamoto CROWN condoms - Also available in quantities of 12, 50, 100 - (25 condoms)",Health & Beauty > Sexual Wellness > Contraceptives & Lubricants > Condoms
17,494,Trojan Extended Condoms with Climax Control Lubricant 12 Ct (2 Pack) New,Health & Beauty > Sexual Wellness > Contraceptives & Lubricants > Condoms
18,494,"Kimono MicroThin LARGE Condoms - Also available in quantities of 25, 50, 100 (12 condoms)",Health & Beauty > Sexual Wellness > Contraceptives & Lubricants > Condoms
19,494,"Trojan, Durex, Crown, Global Protection, Lifestyle, Condoms Variety Pack, (Pack of 24)",Health & Beauty > Sexual Wellness > Contraceptives & Lubricants > Condoms
20,494,"Durex Pleasure Pack, Assorted Premium Lubricated Condoms, 12 Count New",Health & Beauty > Sexual Wellness > Contraceptives & Lubricants > Condoms
21,494,12 Okamoto Crown Condoms,Health & Beauty > Sexual Wellness > Contraceptives & Lubricants > Condoms
22,494,Durex Extra Sensitive Condoms - Pack Size - 50 Pack,Health & Beauty > Sexual Wellness > Contraceptives & Lubricants > Condoms
23,494,Premium Small Condom Assortment - Ultimate Smaller Condom Sampler - 12 Smaller / Snugger Fit Condoms 12 World's Best Condoms: Condom Variety from Euro New,Health & Beauty > Sexual Wellness > Contraceptives & Lubricants > Condoms
24,494,"Condoms Variety Trojan, Durex, Lifestyles, One, Atlas, Beyond Seven, Crown, Trustex, Impulse, Fantasy, Caution Wear, and More [The Random Fun That You Will Not Know Until You Have Used.] : Pack 36 Condoms",Health & Beauty > Sexual Wellness > Contraceptives & Lubricants > Condoms
25,494,One Condoms One Move,Health & Beauty > Sexual Wellness > Contraceptives & Lubricants > Condoms
26,494,"Ultra Ribbed Latex Condoms, Primium Lubricant, 36-Count Boxes (Pack of 2).",Health & Beauty > Sexual Wellness > Contraceptives & Lubricants > Condoms
27,494,Durex Pleasure Pack 60 Count; Exciting Mix of Sensation and Stimulation,Health & Beauty > Sexual Wellness > Contraceptives & Lubricants > Condoms
28,494,"Durex Pleasure Pack, Assorted Premium Lubricated Condoms, 24 Count",Health & Beauty > Sexual Wellness > Contraceptives & Lubricants > Condoms
29,494,Lifestyles Pleasure Shaped Condoms 24 Ct,Health & Beauty > Sexual Wellness > Contraceptives & Lubricants > Condoms
30,494,Snug Fit Small Condoms Assorted Sampler Pack Atlas Lifestyles Iron Grip Snugger,Health & Beauty > Sexual Wellness > Contraceptives & Lubricants > Condoms
31,494,Trojan Stimulations Ecstasy Lubricated Condoms 10 Ea New,Health & Beauty > Sexual Wellness > Contraceptives & Lubricants > Condoms
32,494,Lifestyles SKYN Condoms - 90 condoms,Health & Beauty > Sexual Wellness > Contraceptives & Lubricants > Condoms
33,494,Sir Richard's Condom Company Red Special Edition Condoms (Pack of 12),Health & Beauty > Sexual Wellness > Contraceptives & Lubricants > Condoms
34,494,Trojan Natural Lamb Condoms 3Pk.,Health & Beauty > Sexual Wellness > Contraceptives & Lubricants > Condoms
35,494,"One Glowing Pleasures, 3 Count",Health & Beauty > Sexual Wellness > Contraceptives & Lubricants > Condoms
36,494,"Trojan Magnum Bareskin Condoms, 10 Count",Health & Beauty > Sexual Wellness > Contraceptives & Lubricants > Condoms
37,494,Durex Intense Sensation Premium Durex Latex Condoms Lubricated 24 condoms,Health & Beauty > Sexual Wellness > Contraceptives & Lubricants > Condoms
38,494,Siam Circus 100 Pack Lifestyles Ultra Sensitive Thin Premium Non Lubricated Condoms Bulk,Health & Beauty > Sexual Wellness > Contraceptives & Lubricants > Condoms
39,494,Trojan Platinum Pack,Health & Beauty > Sexual Wellness > Contraceptives & Lubricants > Condoms
40,494,Lifestyles SKYN Premium NON-LATEX Polyisoprene Lubricated Condoms with Silver Pocket/Travel Case-24 Count,Health & Beauty > Sexual Wellness > Contraceptives & Lubricants > Condoms
41,494,Trojan Naturalamb Condom Lubricated Natural Skin 3 Pc,Health & Beauty > Sexual Wellness > Contraceptives & Lubricants > Condoms
42,494,"Sustain Variety Pack Condoms, 30 Count (10 Each of Ultra Thin, Tailored Fit and Comfort Fit)",Health & Beauty > Sexual Wellness > Contraceptives & Lubricants > Condoms
43,494,Sagami Original | Condoms | 002 0.02mm 20pc,Health & Beauty > Sexual Wellness > Contraceptives & Lubricants > Condoms
44,494,Trojan - Her Pleasure Condoms,Health & Beauty > Sexual Wellness > Contraceptives & Lubricants > Condoms
45,494,Condoms Variety Pack 60,Health & Beauty > Sexual Wellness > Contraceptives & Lubricants > Condoms
46,494,Okamoto 003 | Condoms | Aloe Jelly 10pc,Health & Beauty > Sexual Wellness > Contraceptives & Lubricants > Condoms
47,494,"Trojan ENZ Non-Lubricated Condoms, 12 Count",Health & Beauty > Sexual Wellness > Contraceptives & Lubricants > Condoms
48,494,OKAMOTO BEYOND SEVEN STUDDED 48-Count Pack,Health & Beauty > Sexual Wellness > Contraceptives & Lubricants > Condoms
49,494,"Condoms Variety 24 Pack Trojan, Durex, Lifestyles, Atlas, Crown, Trustex, Impulse, Fantasy, Caution Wear, and More [The Random Fun That You Will Not Know Until You Have Used]",Health & Beauty > Sexual Wellness > Contraceptives & Lubricants > Condoms
50,494,"Durex Lubricated Latex Condoms, Extra Sensitive 12 ct Box (Pack of 3)",Health & Beauty > Sexual Wellness > Contraceptives & Lubricants > Condoms
51,494,36 TROJAN MAGNUM LARGE GOLD LOOSE LUBRICATED CONDOMS,Health & Beauty > Sexual Wellness > Contraceptives & Lubricants > Condoms
52,494,"Trojan Sensitivity Thintensity,12-count",Health & Beauty > Sexual Wellness > Contraceptives & Lubricants > Condoms
53,494,Trojan Stimulations Ecstasy,Health & Beauty > Sexual Wellness > Contraceptives & Lubricants > Condoms
54,494,"Trojan Condom Sensitivity Bareskin Lubricated, 24 Count",Health & Beauty > Sexual Wellness > Contraceptives & Lubricants > Condoms
55,494,Sagami Original 002 Condom,Health & Beauty > Sexual Wellness > Contraceptives & Lubricants > Condoms
56,494,Lifestyles Ultra Thin Condoms 12 Pack,Health & Beauty > Sexual Wellness > Contraceptives & Lubricants > Condoms
57,494,Durex Her Sensation Premium Ribbed Durex Latex Condoms Lubricated 72 condoms,Health & Beauty > Sexual Wellness > Contraceptives & Lubricants > Condoms
58,494,Trojan Fire & Ice Condoms 3 Pack,Health & Beauty > Sexual Wellness > Contraceptives & Lubricants > Condoms
59,494,"Lifestyles Luscious Flavors Assorted Variety Lubricated Latex Condoms [Variety to your love life with Sensuous Vanilla, Tropical Banana and Wild Strawberry flavored condoms] - Pack of 24",Health & Beauty > Sexual Wellness > Contraceptives & Lubricants > Condoms
60,494,"Sir Richard's Condom Company Ultra Thin Condoms, 3-Count Pack",Health & Beauty > Sexual Wellness > Contraceptives & Lubricants > Condoms
61,494,"SKYN Elite Condoms, 10ct",Health & Beauty > Sexual Wellness > Contraceptives & Lubricants > Condoms
62,494,Durex Pleasure Pack 72,Health & Beauty > Sexual Wellness > Contraceptives & Lubricants > Condoms
63,494,Trojan Condom Magnum Ecstasy Ultrasmooth Lubricated 10pc - 2 Packs,Health & Beauty > Sexual Wellness > Contraceptives & Lubricants > Condoms
64,494,Trojan Pleasures Extended,Health & Beauty > Sexual Wellness > Contraceptives & Lubricants > Condoms
65,494,"Condom Extender, Oomph",Health & Beauty > Sexual Wellness > Contraceptives & Lubricants > Condoms
66,494,"Okamoto Beyond Seven ALOE Condoms - Also available in quantities of 25, 50, 100 - (12 condoms)",Health & Beauty > Sexual Wellness > Contraceptives & Lubricants > Condoms
67,494,L Condoms Ultra Thin Pack of 2 (24 Condoms),Health & Beauty > Sexual Wellness > Contraceptives & Lubricants > Condoms
68,494,12 Pack Caution Wear Iron Grip Snugger Fit Small Condoms New,Health & Beauty > Sexual Wellness > Contraceptives & Lubricants > Condoms
69,494,"Durex 30219 Pleasure Pack Condoms, Assorted",Health & Beauty > Sexual Wellness > Contraceptives & Lubricants > Condoms
70,494,TROJAN MAGNUM XL 60 PACK,Health & Beauty > Sexual Wellness > Contraceptives & Lubricants > Condoms
71,494,ONE Mixed Pleasure: 12-Pack of Condoms,Health & Beauty > Sexual Wellness > Contraceptives & Lubricants > Condoms
72,494,"Large Condoms - Mission: Great Sex! | Ultimate Large Condom Sampler - 12 Larger / Generous Fit World's Best Condoms: TROJAN, Kimono, LifeStyles, ONE C",Health & Beauty > Sexual Wellness > Contraceptives & Lubricants > Condoms
73,494,TROJAN FIRE & ICE CONDOMS DUAL ACTION LUBRICANT 18 PACK,Health & Beauty > Sexual Wellness > Contraceptives & Lubricants > Condoms
74,494,Lifestyles KYNG RIBBED Condoms - 50 condoms,Health & Beauty > Sexual Wellness > Contraceptives & Lubricants > Condoms
75,494,Trojan Condom Magnum Gold Collection Lubricated 10 Pc,Health & Beauty > Sexual Wellness > Contraceptives & Lubricants > Condoms
76,494,"Durex Real Feel Polyisoprene Non Latex Lubricated Condoms, 10 Count",Health & Beauty > Sexual Wellness > Contraceptives & Lubricants > Condoms
77,494,Aoni Condoms: Nanosilver Ultrathin 001 - World's Thinnest Latex Condom by Guinness,Health & Beauty > Sexual Wellness > Contraceptives & Lubricants > Condoms
78,494,100 Lifestyles Snugger Fit Condoms; Tighter Shape for Maximum Sensitivity New,Health & Beauty > Sexual Wellness > Contraceptives & Lubricants > Condoms
79,494,Durex PERFORMAX INTENSE Condoms in various quantities (25 condoms),Health & Beauty > Sexual Wellness > Contraceptives & Lubricants > Condoms
80,494,"Trojan Condom Magnum Armor Spermicidal, 12 Count",Health & Beauty > Sexual Wellness > Contraceptives & Lubricants > Condoms
81,494,Sagami Original 002 Condom 6pcs (Japan Import),Health & Beauty > Sexual Wellness > Contraceptives & Lubricants > Condoms
82,494,Lifestyles Snugger Fit Premium Lifestyles Latex Condoms Lubricated 72 condoms,Health & Beauty > Sexual Wellness > Contraceptives & Lubricants > Condoms
83,494,Lifestyles Snugger Fit Premium Lifestyles Latex Condoms Lubricated 12 condoms,Health & Beauty > Sexual Wellness > Contraceptives & Lubricants > Condoms
84,494,"Trojan Super Value Pleasure Pack Lubricated Condoms, 100 Count",Health & Beauty > Sexual Wellness > Contraceptives & Lubricants > Condoms
85,494,Sagami Original 001 Condom,Health & Beauty > Sexual Wellness > Contraceptives & Lubricants > Condoms
86,494,"Durex Avanti Bare Latex Condoms 24-count Box (Pack of 6), 144 Ct Total",Health & Beauty > Sexual Wellness > Contraceptives & Lubricants > Condoms
87,494,Lifestyles SKYN Condoms - 90 condoms New,Health & Beauty > Sexual Wellness > Contraceptives & Lubricants > Condoms
88,494,LIfeStyles SKYN Condoms -60,Health & Beauty > Sexual Wellness > Contraceptives & Lubricants > Condoms
89,494,"Trojan Sensitivity Bareskin Lubricated, Latex Condoms, 20 Pc Health and Beauty",Health & Beauty > Sexual Wellness > Contraceptives & Lubricants > Condoms
90,494,"Trojan Ecstasy Pack Lubricated Condoms, 26 Count",Health & Beauty > Sexual Wellness > Contraceptives & Lubricants > Condoms
91,494,"Trojan Ultra Thin, 36ct by Trojan",Health & Beauty > Sexual Wellness > Contraceptives & Lubricants > Condoms
92,494,"Durex Performax Intense Ribbed & Dotted with Delay Lubricant Premium Condom, 12 Count",Health & Beauty > Sexual Wellness > Contraceptives & Lubricants > Condoms
93,494,Okamoto Crown Condoms 25 pack,Health & Beauty > Sexual Wellness > Contraceptives & Lubricants > Condoms
94,494,"LifeStyles SKYN LARGE Condoms - Also available in quantities of 12, 25, 90 (50 condoms) New",Health & Beauty > Sexual Wellness > Contraceptives & Lubricants > Condoms
95,494,12 Trojan Extended Pleasure Condoms with Climax Control New,Health & Beauty > Sexual Wellness > Contraceptives & Lubricants > Condoms
96,494,12 Trojan Extended Pleasure,Health & Beauty > Sexual Wellness > Contraceptives & Lubricants > Condoms
97,494,"LifeStyles SKYN EXTRA LUBRICATED Condoms - Various Quantities 12, 25, 50, 90 (50 condoms)",Health & Beauty > Sexual Wellness > Contraceptives & Lubricants > Condoms
98,494,LIfeStyles SKYN Condoms - 50 count,Health & Beauty > Sexual Wellness > Contraceptives & Lubricants > Condoms
99,494,72 Durex Condoms Variety Pack + Free Lubricant - Bulgeinbulk's Collection of Durex Condoms,Health & Beauty > Sexual Wellness > Contraceptives & Lubricants > Condoms
100,494,"Kimono MicroThin AQUA LUBE - Also available in quantities of 12, 50, 100 (25",Health & Beauty > Sexual Wellness > Contraceptives & Lubricants > Condoms
101,494,"BILLY BOY Variety Condoms, Variety Pack, 10 Count",Health & Beauty > Sexual Wellness > Contraceptives & Lubricants > Condoms
102,494,"GLYDE Premium Organic Flavored Condom Sampler (Medium Fit) | 10 Count Pack, Australia's #1 Certified Vegan & Natural Condoms",Health & Beauty > Sexual Wellness > Contraceptives & Lubricants > Condoms
103,494,"Sir Richard's Condoms, Extra Large, 12 Count",Health & Beauty > Sexual Wellness > Contraceptives & Lubricants > Condoms
104,494,"Trojan Condom Pleasure Pack Lubricated, 44 Count New",Health & Beauty > Sexual Wellness > Contraceptives & Lubricants > Condoms
105,494,24 Okamoto Crown Condoms - AUTHENTIC - Made In Japan (Not Thailand),Health & Beauty > Sexual Wellness > Contraceptives & Lubricants > Condoms
106,494,Lifestyles KYNG Condoms - 50 condoms,Health & Beauty > Sexual Wellness > Contraceptives & Lubricants > Condoms
107,494,OKAMOTO Crown 60-Count Pack New,Health & Beauty > Sexual Wellness > Contraceptives & Lubricants > Condoms
108,494,Durex Extra Lubricated Latex Condoms (Pack of 60),Health & Beauty > Sexual Wellness > Contraceptives & Lubricants > Condoms
109,494,LifeStyles Skyn Intense Feel Non-Latex Lubricated Condoms - 22 ea,Health & Beauty > Sexual Wellness > Contraceptives & Lubricants > Condoms
110,494,Durex Pleasure Pack Premium Lubricated Latex Condoms - 12 ea,Health & Beauty > Sexual Wellness > Contraceptives & Lubricants > Condoms
111,494,"ONE Legend Condoms, Extra Large - 12 ea",Health & Beauty > Sexual Wellness > Contraceptives & Lubricants > Condoms
112,494,Premium Thin Condoms - Ultimate International ULTRA THIN Condom Sampler - World's Best Thin Condoms (12 pack):,Health & Beauty > Sexual Wellness > Contraceptives & Lubricants > Condoms
113,494,One Vanish Hyperthin Condoms - 12 Pack,Health & Beauty > Sexual Wellness > Contraceptives & Lubricants > Condoms
114,494,Atlas Non-lubricated Condoms 100 Pack New,Health & Beauty > Sexual Wellness > Contraceptives & Lubricants > Condoms
115,494,"Condoms Variety Pack 12 : Trojan, Durex, Lifestyles, One, Atlas, Beyond Seven, Crown, Trustex, Impulse, Fantasy, Caution Wear, and More [The Random Fu",Health & Beauty > Sexual Wellness > Contraceptives & Lubricants > Condoms
116,494,"Trojan-enz Condom ENZ Lubricated, 108 Count New",Health & Beauty > Sexual Wellness > Contraceptives & Lubricants > Condoms
117,494,"Condoms Variety Trojan, Durex, Lifestyles, One, Atlas, Beyond Seven, Crown,",Health & Beauty > Sexual Wellness > Contraceptives & Lubricants > Condoms
118,494,Okamoto 003 | Condoms | Large Size 10pc,Health & Beauty > Sexual Wellness > Contraceptives & Lubricants > Condoms
119,494,"SKYN Selection Condoms, 24ct",Health & Beauty > Sexual Wellness > Contraceptives & Lubricants > Condoms
120,494,"Condoms Variety Pack 100 : Trojan, Durex, Lifestyles, One, Atlas, Beyond Seven, Crown, Trustex, Impulse, Fantasy, Caution Wear, and More [The Random Fun That You Will Not Know Until You Have Used.]",Health & Beauty > Sexual Wellness > Contraceptives & Lubricants > Condoms
121,494,Okamoto CROWN Condoms - 60 count,Health & Beauty > Sexual Wellness > Contraceptives & Lubricants > Condoms
122,494,"Trojan MAGNUM Condoms - Also available in quantities of 12, 25, 50 - (75 condoms)",Health & Beauty > Sexual Wellness > Contraceptives & Lubricants > Condoms
123,494,Durex Extra Strength-strong Premium Latex Condoms EXTRA Lubricated (PACK OF,Health & Beauty > Sexual Wellness > Contraceptives & Lubricants > Condoms
124,494,Kimono Microthin Premium Lubricated Ultra Thin Latex Condoms and Silver Pocket,Health & Beauty > Sexual Wellness > Contraceptives & Lubricants > Condoms
125,494,Tastees Flavored Condoms 12 Pack Assorted,Health & Beauty > Sexual Wellness > Contraceptives & Lubricants > Condoms
126,494,"Lifestyles Luscious Flavors Assorted Variety Lubricated Latex Condoms [Variety to your love life with Sensuous Vanilla, Tropical Banana and Wild Strawberry flavored condoms] - Pack of 36",Health & Beauty > Sexual Wellness > Contraceptives & Lubricants > Condoms
127,494,"36 Durex Natural Feeling Dry Condoms, a Non-Lubricated Condom",Health & Beauty > Sexual Wellness > Contraceptives & Lubricants > Condoms
128,494,GLYDE MAXI Premium Ultra,Health & Beauty > Sexual Wellness > Contraceptives & Lubricants > Condoms
129,494,Lifestyles Skyn Intense,Health & Beauty > Sexual Wellness > Contraceptives & Lubricants > Condoms
130,494,Durex Extra Sensitive Lubricated Condoms - 50 counts,Health & Beauty > Sexual Wellness > Contraceptives & Lubricants > Condoms
131,494,Trojan Magnum Thin Lubricated Condoms 12 Ct (3 Pack),Health & Beauty > Sexual Wellness > Contraceptives & Lubricants > Condoms
132,494,Sagami Original 001 Condom 5pcs Set of 2,Health & Beauty > Sexual Wellness > Contraceptives & Lubricants > Condoms
133,494,12 Pack Caution Wear Iron,Health & Beauty > Sexual Wellness > Contraceptives & Lubricants > Condoms
134,494,"Condoms Variety Pack 12 : Trojan, Durex, Lifestyles, One, Crown, Caution Wear, and More [Randomly Selected Condoms]",Health & Beauty > Sexual Wellness > Contraceptives & Lubricants > Condoms
135,494,TRUSTEX MINT FLAVORED CONDOMS 60 PACK,Health & Beauty > Sexual Wellness > Contraceptives & Lubricants > Condoms
136,494,"Sir Richard's Condom Company Pleasure Dots Condoms, 3-Count Pack",Health & Beauty > Sexual Wellness > Contraceptives & Lubricants > Condoms
137,494,Trojan Ultra Ribbed Ecstasy 10/pk,Health & Beauty > Sexual Wellness > Contraceptives & Lubricants > Condoms
138,494,Trojan Pleasures Extended - Extend Your Pleasure With Just A Hint Of Numbing Agent 12pk,Health & Beauty > Sexual Wellness > Contraceptives & Lubricants > Condoms
139,494,Durex Variety Fish Bowl,Health & Beauty > Sexual Wellness > Contraceptives & Lubricants > Condoms
140,494,Lifestyles Skyn Non-Latex,Health & Beauty > Sexual Wellness > Contraceptives & Lubricants > Condoms
141,494,Lifestyles Pleasure,Health & Beauty > Sexual Wellness > Contraceptives & Lubricants > Condoms
142,494,"Sir Richard's Condom Company Ultra Thin Condoms, 12 Count",Health & Beauty > Sexual Wellness > Contraceptives & Lubricants > Condoms
143,494,Trojan Extended Pleasure Extended Pleasure Latex Condoms with Climax Control Lubricant 12 ea,Health & Beauty > Sexual Wellness > Contraceptives & Lubricants > Condoms
144,494,"Trojan Condom Sensitivity Ultra Thin Lubricated, 12 Count (Pack of 4)",Health & Beauty > Sexual Wellness > Contraceptives & Lubricants > Condoms
145,494,"LifeStyles SNUGGER FIT Condoms - Also available in quantities of 12, 25, 90 (50 condoms) New",Health & Beauty > Sexual Wellness > Contraceptives & Lubricants > Condoms
146,494,"Kimono Microthin Variety Pack, Blue, 24 Count",Health & Beauty > Sexual Wellness > Contraceptives & Lubricants > Condoms
147,494,"Durex LOVE Condoms - Also available in quantities of 25, 50, 100 - (12 condoms)",Health & Beauty > Sexual Wellness > Contraceptives & Lubricants > Condoms
148,494,"Trojan Condom Stimulations Twisted Pleasure Lubricated, 12 Count",Health & Beauty > Sexual Wellness > Contraceptives & Lubricants > Condoms
149,494,"Durex Extra Sensitive Ribbed Condom, 12 Count (Pack of 2)",Health & Beauty > Sexual Wellness > Contraceptives & Lubricants > Condoms
150,494,Trojan Non-Lubricated Latex,Health & Beauty > Sexual Wellness > Contraceptives & Lubricants > Condoms
151,494,"Trojan Double Ecstasy, 10 Count",Health & Beauty > Sexual Wellness > Contraceptives & Lubricants > Condoms
152,494,ONE Vanish Hyperthin Condoms Bulk (48),Health & Beauty > Sexual Wellness > Contraceptives & Lubricants > Condoms
153,494,Okamoto Zero Zero Three 0.03 Condom (Japan Edition) 12 Pcs Pack,Health & Beauty > Sexual Wellness > Contraceptives & Lubricants > Condoms
154,494,"Trojan Lubricated Condom, Magnum, Large, 12-Count",Health & Beauty > Sexual Wellness > Contraceptives & Lubricants > Condoms
155,494,LifeStyles SNUGGER FIT Condoms - 100 count,Health & Beauty > Sexual Wellness > Contraceptives & Lubricants > Condoms
156,494,ONE Flavor Waves: 12-Pack of Condoms,Health & Beauty > Sexual Wellness > Contraceptives & Lubricants > Condoms
157,494,Kimono MicroThin Plus Aqua Lube Condoms 12 Count,Health & Beauty > Sexual Wellness > Contraceptives & Lubricants > Condoms
158,494,"Trojan Condom Sensitivity Ultra Thin Lubricated, 36 Count",Health & Beauty > Sexual Wellness > Contraceptives & Lubricants > Condoms
159,494,"Durex Tropical Flavors Flavored Premium Condoms, 12 ct",Health & Beauty > Sexual Wellness > Contraceptives & Lubricants > Condoms
160,494,"LifeStyles SKYN EXTRA LUBRICATED Condoms - Various Quantities 12, 25, 50, 90 (90 condoms)",Health & Beauty > Sexual Wellness > Contraceptives & Lubricants > Condoms
161,494,Trojan Double Ecstasy Condom 10 pack,Health & Beauty > Sexual Wellness > Contraceptives & Lubricants > Condoms
162,494,Kimono MAXX Condoms 12 Pack,Health & Beauty > Sexual Wellness > Contraceptives & Lubricants > Condoms
163,494,Trojan Natural Lamb,Health & Beauty > Sexual Wellness > Contraceptives & Lubricants > Condoms
164,494,Okamoto CROWN condoms - 100,Health & Beauty > Sexual Wellness > Contraceptives & Lubricants > Condoms
165,494,"Trojan-enz Condom ENZ Lubricated, 108 Count",Health & Beauty > Sexual Wellness > Contraceptives & Lubricants > Condoms
166,494,"Lifestyles Pure Pleasure Variety Pack, including SKYN, THYN, and Ultra-Sensitive Premium Lubricated Condoms- 24 Count",Health & Beauty > Sexual Wellness > Contraceptives & Lubricants > Condoms
167,494,"Aoni Condoms: Four Play - Ultrathin 001 3pcs, Nanosilver Ultrathin 001 3pcs",Health & Beauty > Sexual Wellness > Contraceptives & Lubricants > Condoms
168,494,"25 Extra Large Condoms, Joe Lube XL Value Pack",Health & Beauty > Sexual Wellness > Contraceptives & Lubricants > Condoms
169,494,Durex Performax Intense Ribbed & Dotted with Delay Lubricant Premium Condom,Health & Beauty > Sexual Wellness > Contraceptives & Lubricants > Condoms
170,494,Trojan MAGNUM Gold Collection Condoms 20-Pack,Health & Beauty > Sexual Wellness > Contraceptives & Lubricants > Condoms
171,494,"Lifestyles Ultra Sensitive Condoms, 40-count",Health & Beauty > Sexual Wellness > Contraceptives & Lubricants > Condoms
172,494,Durex Performax Intense Premium 24 Pack Lubricated Latex Product Quality,Health & Beauty > Sexual Wellness > Contraceptives & Lubricants > Condoms
173,494,ONE Zero Condoms 12 Retail Box,Health & Beauty > Sexual Wellness > Contraceptives & Lubricants > Condoms
174,494,"Durex Play Tempations Lubricant, 10 Count (Pack of 2)",Health & Beauty > Sexual Wellness > Contraceptives & Lubricants > Condoms
175,494,"LifeStyles SKYN LARGE Condoms - Also available in quantities of 12, 50, 90 (25 condoms) New",Health & Beauty > Sexual Wellness > Contraceptives & Lubricants > Condoms
176,494,"Lifestyles Skyn Selection Condoms, 24 Count Health and Beauty",Health & Beauty > Sexual Wellness > Contraceptives & Lubricants > Condoms
177,494,Formerly known as the Crown Skinless Skin. - OKAMOTO Crown 100-Count Pack,Health & Beauty > Sexual Wellness > Contraceptives & Lubricants > Condoms
178,494,"LifeStyles SNUGGER FIT Condoms - Also available in quantities of 25, 50, 90 (12 condoms) New",Health & Beauty > Sexual Wellness > Contraceptives & Lubricants > Condoms
179,494,Aoni Condoms - Ultrathin,Health & Beauty > Sexual Wellness > Contraceptives & Lubricants > Condoms
180,494,Special pack of 6 TROJAN NATURALAMB 98050 3 per pack,Health & Beauty > Sexual Wellness > Contraceptives & Lubricants > Condoms
181,494,"Trojan Ultra ENZ Comfort, 12 Count",Health & Beauty > Sexual Wellness > Contraceptives & Lubricants > Condoms
