,category_id,description,category_path
1091,494,Durex Performax Intense 12 count,Health & Beauty > Sexual Wellness > Contraceptives & Lubricants > Condoms
1092,494,Okamoto Beyond Seven: 12-Pack of Condoms,Health & Beauty > Sexual Wellness > Contraceptives & Lubricants > Condoms
1093,494,Okamoto 003 | Condoms | Hyaluronic Acid + 10pc New,Health & Beauty > Sexual Wellness > Contraceptives & Lubricants > Condoms
1094,494,LifeStyles SNUGGER FIT Condoms - 60 count,Health & Beauty > Sexual Wellness > Contraceptives & Lubricants > Condoms
1095,494,Long Love Condoms (Plain) by UNIDUS - 3 Condoms,Health & Beauty > Sexual Wellness > Contraceptives & Lubricants > Condoms
1096,494,"Kimono MicroThin AQUA LUBE - Also available in quantities of 12, 25, 100 (50 condoms)",Health & Beauty > Sexual Wellness > Contraceptives & Lubricants > Condoms
1097,494,Durex Pleasure Pack 54 Latex Condoms New,Health & Beauty > Sexual Wellness > Contraceptives & Lubricants > Condoms
1098,494,Okamoto CROWN Condoms - 25 count,Health & Beauty > Sexual Wellness > Contraceptives & Lubricants > Condoms
1099,494,Lifestyles 3sum Condoms 24 Pack,Health & Beauty > Sexual Wellness > Contraceptives & Lubricants > Condoms
1100,494,"One Condoms One Move Lubricant, 100 Ml",Health & Beauty > Sexual Wellness > Contraceptives & Lubricants > Condoms
1101,494,Okamoto BEYOND SEVEN Condoms - 25 condoms,Health & Beauty > Sexual Wellness > Contraceptives & Lubricants > Condoms
1102,494,Sagami Original | Condoms,Health & Beauty > Sexual Wellness > Contraceptives & Lubricants > Condoms
1103,494,"LifeStyles EXTRA STRENGTH Condoms - Also available in quantities of 12, 50, 90 (25 condoms)",Health & Beauty > Sexual Wellness > Contraceptives & Lubricants > Condoms
1104,494,"Trojan-enz Condom ENZ Lubricated, 36 Count",Health & Beauty > Sexual Wellness > Contraceptives & Lubricants > Condoms
1105,494,"Small Condoms - Mission: Great Sex! | Ultimate Smaller Condom Sampler - Smaller / Snugger Fit Condoms | 12 World's Best Condoms: Lifestyles, GLYDE, RF",Health & Beauty > Sexual Wellness > Contraceptives & Lubricants > Condoms
1106,494,"Trojan Magnum, 36ct",Health & Beauty > Sexual Wellness > Contraceptives & Lubricants > Condoms
1107,494,Durex Performax Condoms 12 Pack,Health & Beauty > Sexual Wellness > Contraceptives & Lubricants > Condoms
1108,494,Trojan Sensitivity Ultra,Health & Beauty > Sexual Wellness > Contraceptives & Lubricants > Condoms
1109,494,My.Size Condoms Trial Pack (Wide),Health & Beauty > Sexual Wellness > Contraceptives & Lubricants > Condoms
1110,494,12 Lifestyles Snugger Fit,Health & Beauty > Sexual Wellness > Contraceptives & Lubricants > Condoms
1111,494,Global Protection Condom,Health & Beauty > Sexual Wellness > Contraceptives & Lubricants > Condoms
1112,494,Sagami Original 0.02mm,Health & Beauty > Sexual Wellness > Contraceptives & Lubricants > Condoms
1113,494,"LifeStyles SNUGGER FIT Condoms - Also available in quantities of 12, 50, 90 (25 condoms) New",Health & Beauty > Sexual Wellness > Contraceptives & Lubricants > Condoms
1114,494,"Trojan Magnum Gold Collection Condom, Large, 10 Count",Health & Beauty > Sexual Wellness > Contraceptives & Lubricants > Condoms
1115,494,Trojan Condom Sensitivity Ultra Thin Lubricated 36 Pc - 2 Packs,Health & Beauty > Sexual Wellness > Contraceptives & Lubricants > Condoms
1116,494,LIfeStyles SKYN LARGE Condoms - 48 count,Health & Beauty > Sexual Wellness > Contraceptives & Lubricants > Condoms
1117,494,Kameleon Red White and Blue Condoms 12 Pack,Health & Beauty > Sexual Wellness > Contraceptives & Lubricants > Condoms
1118,494,"Durex Pleasure Pack, Assorted Premium Lubricated Condoms, 3 Count",Health & Beauty > Sexual Wellness > Contraceptives & Lubricants > Condoms
1119,494,Lifestyles ULTRA SENSITIVE Lubricated Condoms - 50 condoms Health and Beauty,Health & Beauty > Sexual Wellness > Contraceptives & Lubricants > Condoms
1120,494,"Lifestyles ULTRA THIN Condoms - Also available in quantities of 12, 25, 100 - (50 condoms)",Health & Beauty > Sexual Wellness > Contraceptives & Lubricants > Condoms
1121,494,"Trojan Condom Pleasure Pack Lubricated, 40 Count",Health & Beauty > Sexual Wellness > Contraceptives & Lubricants > Condoms
1122,494,Okamoto 003 Platinum Condoms - 30 Pieces *** GUINNESS WORLD RECORD HOLDER AS THE THINNEST LATEX CONDOM***,Health & Beauty > Sexual Wellness > Contraceptives & Lubricants > Condoms
1123,494,"Sir Richard's Condoms, Classic Ribbed, 12 Count",Health & Beauty > Sexual Wellness > Contraceptives & Lubricants > Condoms
1124,494,ONE Zero Impossibly Thin 40 Ultra-thin Latex Condoms w/ Pocket Container New,Health & Beauty > Sexual Wellness > Contraceptives & Lubricants > Condoms
1125,494,"Trojan Sensitivity Bareskin Lubricated, Latex Condoms, 10-count New",Health & Beauty > Sexual Wellness > Contraceptives & Lubricants > Condoms
1126,494,576 Sensations Studded ONE Condoms 12 Pack,Health & Beauty > Sexual Wellness > Contraceptives & Lubricants > Condoms
1127,494,LifeStyles Skyn Intense Feel Non-Latex Lubricated Condoms Intensely Studded,Health & Beauty > Sexual Wellness > Contraceptives & Lubricants > Condoms
1128,494,OKAMOTO Beyond Seven Condoms - 36 count,Health & Beauty > Sexual Wellness > Contraceptives & Lubricants > Condoms
1129,494,Lifestyles KYNG Ribbed Condoms 12 Pack,Health & Beauty > Sexual Wellness > Contraceptives & Lubricants > Condoms
1130,494,Aoni Ultrathin 001 - World's Thinnest Latex Condom by Guinness World Record| 12Pcs,Health & Beauty > Sexual Wellness > Contraceptives & Lubricants > Condoms
1131,494,Durex 30219 Pleasure Pack,Health & Beauty > Sexual Wellness > Contraceptives & Lubricants > Condoms
1132,494,"Trojan Condom Her Pleasure Sensations Lubricated, 12 Count Health and Beauty",Health & Beauty > Sexual Wellness > Contraceptives & Lubricants > Condoms
1133,494,Trojan Large Size Condom Magnum Lubricated 12Pc -4 Packs,Health & Beauty > Sexual Wellness > Contraceptives & Lubricants > Condoms
1134,494,Condom: Trojan Magnum XL 12 Pack,Health & Beauty > Sexual Wellness > Contraceptives & Lubricants > Condoms
1135,494,"Lifestyles Flavors and Colors Premium Lubricated Latex Condoms (24 Pack) Chocolate, Vanilla, Strawberry, Banana, and Blueberry Flavored",Health & Beauty > Sexual Wellness > Contraceptives & Lubricants > Condoms
1136,494,Trojan Ecstasy Ultra Smooth Lubricated Premium Latex Condoms-20 Count,Health & Beauty > Sexual Wellness > Contraceptives & Lubricants > Condoms
1137,494,"Lifestyles Skyn Intense Feel Condoms, 22 Count",Health & Beauty > Sexual Wellness > Contraceptives & Lubricants > Condoms
1138,494,Lifestyles SKYN Large Non-Latex - Box of 3,Health & Beauty > Sexual Wellness > Contraceptives & Lubricants > Condoms
1139,494,"Durex Lubricated Latex Condoms, Extra Sensitive 12 ct (Quantity of 4)",Health & Beauty > Sexual Wellness > Contraceptives & Lubricants > Condoms
1140,494,LifeStyles SKYN LARGE Condoms - 90 condoms,Health & Beauty > Sexual Wellness > Contraceptives & Lubricants > Condoms
1141,494,"Trojan Condom ENZ Spermicidal, 12 Count",Health & Beauty > Sexual Wellness > Contraceptives & Lubricants > Condoms
1142,494,"Durex Extra Sensitive Ultra Thin Lubricated Condoms, 24 Count",Health & Beauty > Sexual Wellness > Contraceptives & Lubricants > Condoms
1143,494,Sagami original 002 condom 36pcs [japan import],Health & Beauty > Sexual Wellness > Contraceptives & Lubricants > Condoms
1144,494,Sagami Original | Condoms | 002 0.02mm 12pc x3,Health & Beauty > Sexual Wellness > Contraceptives & Lubricants > Condoms
1145,494,"Lifestyles THYN Condoms - Also available in quantities of 12, 25, 100 - (50 condoms)",Health & Beauty > Sexual Wellness > Contraceptives & Lubricants > Condoms
1146,494,Lifestyles Assorted Colors Premium Lifestyles Latex Condoms Lubricated 48 condoms,Health & Beauty > Sexual Wellness > Contraceptives & Lubricants > Condoms
1147,494,"LifeStyles ULTRA LUBRICATED Condoms - Also available in quantities of 12, 50, 100 (25 condoms)",Health & Beauty > Sexual Wellness > Contraceptives & Lubricants > Condoms
1148,494,"Trojan Condom Pure Ecstasy Ultrasmooth Lubricated, 10 Count Health and Beauty",Health & Beauty > Sexual Wellness > Contraceptives & Lubricants > Condoms
1149,494,Beyond Seven STUDDED Condoms - 50 condoms,Health & Beauty > Sexual Wellness > Contraceptives & Lubricants > Condoms
1150,494,Okamoto Condom Variety Pack + Free Lubricant - 12 Pack,Health & Beauty > Sexual Wellness > Contraceptives & Lubricants > Condoms
1151,494,Lifestyles Luscious Flavors Assorted Variety Lubricated Latex Condoms [Variety to your love life with Sensuous,Health & Beauty > Sexual Wellness > Contraceptives & Lubricants > Condoms
1152,494,"Sir Richard's Condom Company Ultra Thin Condoms, 12-Count Pack",Health & Beauty > Sexual Wellness > Contraceptives & Lubricants > Condoms
1153,494,"Trojan Condom Pleasure Pack Lubricated, 36 Count Health and Beauty",Health & Beauty > Sexual Wellness > Contraceptives & Lubricants > Condoms
1154,494,Lifestyles Luscious Flavors Assorted Variety Lubricated Latex Condoms [Variety,Health & Beauty > Sexual Wellness > Contraceptives & Lubricants > Condoms
1155,494,MaxxFantasy Maxx Pleasure,Health & Beauty > Sexual Wellness > Contraceptives & Lubricants > Condoms
1156,494,"12 Okamoto Crown Condoms, World Famous Super Thin and Sensitive Condom, for Extra Sensation",Health & Beauty > Sexual Wellness > Contraceptives & Lubricants > Condoms
1157,494,Trustex Flavored 12 Pack -- Chocolate,Health & Beauty > Sexual Wellness > Contraceptives & Lubricants > Condoms
1158,494,"NON-LATEX Sampler Pack (Trojan Supra Bare Skin, Durex Avanti Bare Real Feel, and Lifestyles SKYN) Premium Lubricated Condoms with Silver Pocket/Travel Case-12 Count",Health & Beauty > Sexual Wellness > Contraceptives & Lubricants > Condoms
1159,494,Trojan Sensitivity Bareskin Ultrathin Condoms,Health & Beauty > Sexual Wellness > Contraceptives & Lubricants > Condoms
1160,494,Durex Pleasure Pack 72 Count; Exciting Mix of Sensation and Stimulation New,Health & Beauty > Sexual Wellness > Contraceptives & Lubricants > Condoms
1161,494,Okamoto 003 | Condoms | Smooth Powder 10pc,Health & Beauty > Sexual Wellness > Contraceptives & Lubricants > Condoms
1162,494,Lifestyles SKYN Large Non-Latex Condoms 144 Pack,Health & Beauty > Sexual Wellness > Contraceptives & Lubricants > Condoms
1163,494,OKAMOTO Crown 100-Count Pack New,Health & Beauty > Sexual Wellness > Contraceptives & Lubricants > Condoms
1164,494,"Kimono Latex Micro Thin Condoms, Ultra Lubricated, 24-Count Boxes (Pack of 2)",Health & Beauty > Sexual Wellness > Contraceptives & Lubricants > Condoms
1165,494,"Condoms Variety Trojan, Durex, Lifestyles, One, Atlas, Beyond Seven, Crown, Trustex, Impulse, Fantasy, Caution Wear, and More [The Random Fun That You Will Not Know Until You Have Used.] : Pack 24 Condoms",Health & Beauty > Sexual Wellness > Contraceptives & Lubricants > Condoms
1166,494,"Trojan Condom Stimulations Twisted Pleasure Lubricated, 12 Count (Pack of 4)",Health & Beauty > Sexual Wellness > Contraceptives & Lubricants > Condoms
1167,494,"Durex Performax Intense Ribbed and Dotted with Delay Lubricant Premium Condom, 12 Count",Health & Beauty > Sexual Wellness > Contraceptives & Lubricants > Condoms
1168,494,Trojan Condom Sensitivity Ultra Thin Spermicidal 2 Packs of 12 pc,Health & Beauty > Sexual Wellness > Contraceptives & Lubricants > Condoms
1169,494,"Trojan Her Pleasure Sensations, Spermicidal Lubricated Latex Condoms - 12 ea",Health & Beauty > Sexual Wellness > Contraceptives & Lubricants > Condoms
1170,494,"Kimono MicroThin, Ultra Thin Lubricated Latex Condoms - 12 ea",Health & Beauty > Sexual Wellness > Contraceptives & Lubricants > Condoms
1171,494,"Durex Love-Box Copenhagen Premium Lubricated Condoms, Pleasure - 3 ea",Health & Beauty > Sexual Wellness > Contraceptives & Lubricants > Condoms
1172,494,LifeStyles Ultra Sensitive Premium Lubricated Latex Condoms - 12 ea,Health & Beauty > Sexual Wellness > Contraceptives & Lubricants > Condoms
1173,494,"Durex Extra Sensitive Ribbed, Premium Lubricated Latex Condoms - 12 ea",Health & Beauty > Sexual Wellness > Contraceptives & Lubricants > Condoms
1174,494,LifeStyles Fun Bumps Condoms Added Pleasure - 12 ea,Health & Beauty > Sexual Wellness > Contraceptives & Lubricants > Condoms
1175,494,LifeStyles Thyn Premium Lubricated Latex Condoms - 12 ea,Health & Beauty > Sexual Wellness > Contraceptives & Lubricants > Condoms
1176,494,Trojan Naturalamb Laytex Free Lubricated Condoms - 3 Count,Health & Beauty > Sexual Wellness > Contraceptives & Lubricants > Condoms
1177,494,Trojan Bareskin Premium Lubricant Condoms - 24 Count,Health & Beauty > Sexual Wellness > Contraceptives & Lubricants > Condoms
1178,494,Durex Pleasure Pack Sensation and Stimulation - 24 Count,Health & Beauty > Sexual Wellness > Contraceptives & Lubricants > Condoms
1179,494,Trojan Magnum Ribbed Lubricated Latex Condoms - 12 Count,Health & Beauty > Sexual Wellness > Contraceptives & Lubricants > Condoms
1180,494,Durex Extra Sensitive Condoms - 24ct,Health & Beauty > Sexual Wellness > Contraceptives & Lubricants > Condoms
1181,494,"Trojan Double Ecstasy Lubricated Latex Condoms, 10 count",Health & Beauty > Sexual Wellness > Contraceptives & Lubricants > Condoms
1182,494,Trojan Enz Lubricated Condoms 3 Ct. Trojan-Enz Lubricated Condoms 3,Health & Beauty > Sexual Wellness > Contraceptives & Lubricants > Condoms
1183,494,"Lubricated Latex Condoms, Pleasure Pack Trojan",Health & Beauty > Sexual Wellness > Contraceptives & Lubricants > Condoms
1184,494,Premium Lubricant Latex Condoms Trojan Ultra Thin 36.0 ea,Health & Beauty > Sexual Wellness > Contraceptives & Lubricants > Condoms
1185,494,Trojan Luxury Lubricated Natural Skin Condoms 10.0 ea,Health & Beauty > Sexual Wellness > Contraceptives & Lubricants > Condoms
1186,494,One Super Bargain,Health & Beauty > Sexual Wellness > Contraceptives & Lubricants > Condoms
1187,494,Atlas True Fit Condoms 12 Pack,Health & Beauty > Sexual Wellness > Contraceptives & Lubricants > Condoms
1188,494,Trojan Magnum Premium Large Lubricated Latex Condoms Bulk Packaging - Pack of 48,Health & Beauty > Sexual Wellness > Contraceptives & Lubricants > Condoms
1189,494,"L. Condoms Ultra Thin 12 Pack of Natural, Premium Condoms",Health & Beauty > Sexual Wellness > Contraceptives & Lubricants > Condoms
1190,494,Shibari Premium Lubricated,Health & Beauty > Sexual Wellness > Contraceptives & Lubricants > Condoms
1191,494,Lifestyles Skyn Large Non-latex - Box Of 12,Health & Beauty > Sexual Wellness > Contraceptives & Lubricants > Condoms
1192,494,Durex Performax Intense Lubricated Latex Condoms-12 ct,Health & Beauty > Sexual Wellness > Contraceptives & Lubricants > Condoms
1193,494,Lifestyles ULTRA SENSITIVE Lubricated Condoms - Also available in quantities,Health & Beauty > Sexual Wellness > Contraceptives & Lubricants > Condoms
1194,494,LifeStyles 7312 Skyn,Health & Beauty > Sexual Wellness > Contraceptives & Lubricants > Condoms
1195,494,Okamoto 003 | Condoms,Health & Beauty > Sexual Wellness > Contraceptives & Lubricants > Condoms
1196,494,Long Love Climax Control Condoms 12pcs (4pack),Health & Beauty > Sexual Wellness > Contraceptives & Lubricants > Condoms
1197,494,OKAMOTO Beyond Seven Condoms - 25 count,Health & Beauty > Sexual Wellness > Contraceptives & Lubricants > Condoms
1198,494,Lifestyles KYNG Condoms 48 Pack,Health & Beauty > Sexual Wellness > Contraceptives & Lubricants > Condoms
1199,494,"Kimono Condom, Micro Thin",Health & Beauty > Sexual Wellness > Contraceptives & Lubricants > Condoms
1200,494,"40 Durex Condoms, Assorted Variety Pack!! Collection of Different Types of Durex Condoms, (Pack of 40)",Health & Beauty > Sexual Wellness > Contraceptives & Lubricants > Condoms
1201,494,Sagami Original 002 Condom 12pcs (Japan Import),Health & Beauty > Sexual Wellness > Contraceptives & Lubricants > Condoms
1202,494,Trojan Magnum Thin 12ct,Health & Beauty > Sexual Wellness > Contraceptives & Lubricants > Condoms
1203,494,"Durex Sensitive Collection (Avanti Bare, Enhanced Pleasure, and Extra Sensitive) Premium Lubricated Latex Condoms with Silver Pocket/Travel Case- 24 C",Health & Beauty > Sexual Wellness > Contraceptives & Lubricants > Condoms
1204,494,CROWN condoms mfd by Okamoto - 36 count,Health & Beauty > Sexual Wellness > Contraceptives & Lubricants > Condoms
1205,494,"Condoms : Trojan, Durex, Lifestyles, Crown, One, Atlas, and More Variety Pack (12)",Health & Beauty > Sexual Wellness > Contraceptives & Lubricants > Condoms
1206,494,ONE FLAVOR WAVES ASSORTED,Health & Beauty > Sexual Wellness > Contraceptives & Lubricants > Condoms
1207,494,"Trojan Pleasure Pack NEW MIX Premium Lubricated Latex Condoms - 40 Count Variety Pack - Double Ecstasy, Charged, Ultra Thin, Ultra Ribbed, ENZ - Brand",Health & Beauty > Sexual Wellness > Contraceptives & Lubricants > Condoms
1208,494,Okamoto BEYOND SEVEN Condoms - 100 condoms,Health & Beauty > Sexual Wellness > Contraceptives & Lubricants > Condoms
1209,494,"Trojan Condom Sensitivity Ultra Thin Lubricated, 12 Count Health and Beauty",Health & Beauty > Sexual Wellness > Contraceptives & Lubricants > Condoms
1210,494,"Trojan Stimulations Ecstasy Ultrasmooth Lubricant,10-count",Health & Beauty > Sexual Wellness > Contraceptives & Lubricants > Condoms
1211,494,"Durex Pleasure Pack Natural Rubber Premium Latex Condoms, 54 Count",Health & Beauty > Sexual Wellness > Contraceptives & Lubricants > Condoms
1212,494,"Kimono MicroThin Plus Aqua Lube Condoms, 24 count",Health & Beauty > Sexual Wellness > Contraceptives & Lubricants > Condoms
1213,494,"Trojan BARESKIN Condoms - Also available in quantites of 12, 50, 100 - (25",Health & Beauty > Sexual Wellness > Contraceptives & Lubricants > Condoms
1214,494,Durex Maximum Love: 12-Pack of Condoms,Health & Beauty > Sexual Wellness > Contraceptives & Lubricants > Condoms
1215,494,Durex Intense Sensation Premium Durex Latex Condoms Lubricated 72 condoms,Health & Beauty > Sexual Wellness > Contraceptives & Lubricants > Condoms
1216,494,Trojan Condom Magnum Ecstasy Ultrasmooth Lubricated 10pc - 3 Packs,Health & Beauty > Sexual Wellness > Contraceptives & Lubricants > Condoms
1217,494,ONE Condoms Mixed Pleasures - 40 ea,Health & Beauty > Sexual Wellness > Contraceptives & Lubricants > Condoms
1218,494,"Okamoto Latex Condoms, Bulk Pack - 100 ea",Health & Beauty > Sexual Wellness > Contraceptives & Lubricants > Condoms
1219,494,"Sir Richard's Condom Company Condoms, Classic Ribbed - 12 ea",Health & Beauty > Sexual Wellness > Contraceptives & Lubricants > Condoms
1220,494,"Trojan Latex Condoms, Intense Ribbed - 12 ea",Health & Beauty > Sexual Wellness > Contraceptives & Lubricants > Condoms
1221,494,"Crown Natural Rubber Latex Condoms, Lightly Lubricated - 36 ea",Health & Beauty > Sexual Wellness > Contraceptives & Lubricants > Condoms
1222,494,ONE ZERO Condoms - 40 ea,Health & Beauty > Sexual Wellness > Contraceptives & Lubricants > Condoms
1223,494,"Trojan Magnum Lubricated Latex Condoms, Large - 12 ea",Health & Beauty > Sexual Wellness > Contraceptives & Lubricants > Condoms
1224,494,"Beyond Seven Sheerlon Natural Rubber Latex Condoms, Lightly Lubricated - 12 ea",Health & Beauty > Sexual Wellness > Contraceptives & Lubricants > Condoms
1225,494,Lifestyles Ultra Sensitive Condoms - 40 count,Health & Beauty > Sexual Wellness > Contraceptives & Lubricants > Condoms
1226,494,Sustain Comfort Fit Condoms - 10 Count,Health & Beauty > Sexual Wellness > Contraceptives & Lubricants > Condoms
1227,494,Trojan Enz Armor Spermicidal Lubricant Condoms - 12 Condoms,Health & Beauty > Sexual Wellness > Contraceptives & Lubricants > Condoms
1228,494,Durex® Pleasure Pack™ Sensation and Stimulation 2 Pack Condoms - 48 Count,Health & Beauty > Sexual Wellness > Contraceptives & Lubricants > Condoms
1229,494,Sustain Ultra Thin Condoms - 10 Count,Health & Beauty > Sexual Wellness > Contraceptives & Lubricants > Condoms
1230,494,Trojan Pleasure Pack Premium Latex Condoms - 36 CT,Health & Beauty > Sexual Wellness > Contraceptives & Lubricants > Condoms
1231,494,"Trojan Sensitivity BareSkin Lubricant Latex Condoms, 10 count",Health & Beauty > Sexual Wellness > Contraceptives & Lubricants > Condoms
1232,494,"TROJAN ENZ Premium Lubricant Latex Condoms, 3 count",Health & Beauty > Sexual Wellness > Contraceptives & Lubricants > Condoms
1233,494,"Trojan Magnum Thin Ultrasmooth Large Size Lubricant Condoms, 12ct",Health & Beauty > Sexual Wellness > Contraceptives & Lubricants > Condoms
1234,494,"Lubricated Latex Condoms, Twisted Pleasure Trojan",Health & Beauty > Sexual Wellness > Contraceptives & Lubricants > Condoms
1235,494,Mixed Pleasures Condoms One,Health & Beauty > Sexual Wellness > Contraceptives & Lubricants > Condoms
1236,494,ONE Mixed Pleasures Condoms 12.0 ea,Health & Beauty > Sexual Wellness > Contraceptives & Lubricants > Condoms
1237,494,For Ultra Sensitivity Lubricated Premium Latex Condoms Trojan Ultra Thin 12.0 ea,Health & Beauty > Sexual Wellness > Contraceptives & Lubricants > Condoms
1238,494,"Trojan Lubricated Premium Latex Condoms, Pleasure Pack 12.0 ea",Health & Beauty > Sexual Wellness > Contraceptives & Lubricants > Condoms
1239,494,Pleasure Plus Condoms One,Health & Beauty > Sexual Wellness > Contraceptives & Lubricants > Condoms
1240,494,ONE® Condoms ZERO Thin,Health & Beauty > Sexual Wellness > Contraceptives & Lubricants > Condoms
1241,494,"ONE® Mixed Pleasures, 100 Condoms",Health & Beauty > Sexual Wellness > Contraceptives & Lubricants > Condoms
1242,494,ONE® Condoms Mixed Pleasures™,Health & Beauty > Sexual Wellness > Contraceptives & Lubricants > Condoms
1243,494,"Durex Extra Sensitive Lubricated Ultra Thin Premium Condoms, 12 ct",Health & Beauty > Sexual Wellness > Contraceptives & Lubricants > Condoms
1244,494,Trojan Magnum Lubricated Latex Condoms Large -- 12 Condoms,Health & Beauty > Sexual Wellness > Contraceptives & Lubricants > Condoms
1245,494,"Kimono MicroThin LARGE Condoms - Also available in quantities of 12, 25, 50 (100 condoms) New",Health & Beauty > Sexual Wellness > Contraceptives & Lubricants > Condoms
1246,494,Crown Condoms,Health & Beauty > Sexual Wellness > Contraceptives & Lubricants > Condoms
1247,494,Kimono Microthin Condoms 48 Pack,Health & Beauty > Sexual Wellness > Contraceptives & Lubricants > Condoms
1248,494,Okamoto 004 Condoms - Also,Health & Beauty > Sexual Wellness > Contraceptives & Lubricants > Condoms
1249,494,LIfeStyles ULTRA SENSITIVE Condoms - 25 count,Health & Beauty > Sexual Wellness > Contraceptives & Lubricants > Condoms
1250,494,ONE The Legend: 36-Pack of Condoms,Health & Beauty > Sexual Wellness > Contraceptives & Lubricants > Condoms
1251,494,"Trojan Her Pleasure Ecstasy Ultrasmooth Lubricant,10-count",Health & Beauty > Sexual Wellness > Contraceptives & Lubricants > Condoms
1252,494,Durex Extra Lubricated Latex Condoms (Pack of 60) Health and Beauty,Health & Beauty > Sexual Wellness > Contraceptives & Lubricants > Condoms
1253,494,"100 Joe Lube Condoms, Ultra Thin for Extra Pleasure",Health & Beauty > Sexual Wellness > Contraceptives & Lubricants > Condoms
1254,494,"Trojan Magnum Armor, 3 Count",Health & Beauty > Sexual Wellness > Contraceptives & Lubricants > Condoms
1255,494,Trojan Bareskin Lubricated 24pk New,Health & Beauty > Sexual Wellness > Contraceptives & Lubricants > Condoms
1256,494,Okamoto Condom Variety Pack + Free Lubricant - 72 Pack,Health & Beauty > Sexual Wellness > Contraceptives & Lubricants > Condoms
1257,494,ONE Glowing Pleasures Glow In The Dark Lubricated Latex Condoms Bulk [A New Experience with Your Partner] - 12,Health & Beauty > Sexual Wellness > Contraceptives & Lubricants > Condoms
1258,494,Trojan Magnum Xl Lubricated Condoms 12 Pack Health and Beauty,Health & Beauty > Sexual Wellness > Contraceptives & Lubricants > Condoms
1259,494,Okamoto Crown Condoms 100ea pack,Health & Beauty > Sexual Wellness > Contraceptives & Lubricants > Condoms
1260,494,Trojan Magnum Bareskin Condoms 10 Count Box,Health & Beauty > Sexual Wellness > Contraceptives & Lubricants > Condoms
1261,494,Trojan Magnum Premium Large Lubricated Latex Condoms Bulk Packaging - Pack,Health & Beauty > Sexual Wellness > Contraceptives & Lubricants > Condoms
1262,494,"LifeStyles ULTRA LUBRICATED Condoms - Also available in quantities of 12, 25, 50 (100 condoms)",Health & Beauty > Sexual Wellness > Contraceptives & Lubricants > Condoms
1263,494,"60 Okamoto Crown Condoms, Super Thin Condom",Health & Beauty > Sexual Wellness > Contraceptives & Lubricants > Condoms
1264,494,Condom: Trojan Pleasures Ecstasy Fire & Ice 10 Pack,Health & Beauty > Sexual Wellness > Contraceptives & Lubricants > Condoms
1265,494,Okamoto Crown - 50 Pack,Health & Beauty > Sexual Wellness > Contraceptives & Lubricants > Condoms
1266,494,KIMONO MICROTHIN 60 PACK,Health & Beauty > Sexual Wellness > Contraceptives & Lubricants > Condoms
1267,494,"Condoms Variety Pack 72 : Trojan, Durex, Lifestyles, One, Atlas, Beyond Seven",Health & Beauty > Sexual Wellness > Contraceptives & Lubricants > Condoms
1268,494,"Trojan BARESKIN Condoms - Also available in quantities of 12, 25, 50 - (100 condoms)",Health & Beauty > Sexual Wellness > Contraceptives & Lubricants > Condoms
1269,494,"Trojan Condom Sensitivity Bareskin Lubricated, 24 Count Health and Beauty",Health & Beauty > Sexual Wellness > Contraceptives & Lubricants > Condoms
1270,494,Long Love Condoms (Plain) by UNIDUS - 5 Pack (15 Condoms),Health & Beauty > Sexual Wellness > Contraceptives & Lubricants > Condoms
1271,494,Durex Extra Sensitive ultra thin condoms 24 pack (Pack of 2),Health & Beauty > Sexual Wellness > Contraceptives & Lubricants > Condoms
1272,494,"Crown, Super Thin and Sensitive condom. The Closest Thing To Nothing At All - Brought To You By Oakland Gardens (10 (10 Condoms))",Health & Beauty > Sexual Wellness > Contraceptives & Lubricants > Condoms
