,category_id,description,category_path
544,494,"Durex Avanti Bare Real Feel Polyisoprene Non Latex Lubricated Condoms, 24 Count Health and Beauty",Health & Beauty > Sexual Wellness > Contraceptives & Lubricants > Condoms
545,494,"50 Extra Large Condoms, Joe Lube XL Value Pack",Health & Beauty > Sexual Wellness > Contraceptives & Lubricants > Condoms
546,494,"Trojan Condom Sensitivity Ultra Thin Lubricated, 36 Count Health and Beauty",Health & Beauty > Sexual Wellness > Contraceptives & Lubricants > Condoms
547,494,Kimono MicroThin LARGE Condoms - 12 Condoms,Health & Beauty > Sexual Wellness > Contraceptives & Lubricants > Condoms
548,494,"Trojan Studded Bareskin Premium Lubricated Condoms, 10count (Pack of 2)",Health & Beauty > Sexual Wellness > Contraceptives & Lubricants > Condoms
549,494,"Kimono MicroThin AQUA LUBE - Also available in quantities of 12, 50, 100 (25 condoms) New",Health & Beauty > Sexual Wellness > Contraceptives & Lubricants > Condoms
550,494,"Trojan Her Pleasure Sensations Spermicidal Condoms, 12 Count",Health & Beauty > Sexual Wellness > Contraceptives & Lubricants > Condoms
551,494,"Playboy Lubricated Dotted Condoms, 12 Count",Health & Beauty > Sexual Wellness > Contraceptives & Lubricants > Condoms
552,494,"Trojan Magnum Ribbed Lubricated Condoms, 12 Count",Health & Beauty > Sexual Wellness > Contraceptives & Lubricants > Condoms
553,494,Trojan Condom Pleasure Pack,Health & Beauty > Sexual Wellness > Contraceptives & Lubricants > Condoms
554,494,"Lifestyles SKYN Large, Premium LARGE NON-LATEX Lubricated Condoms with Silver Pocket/Travel Case-24 Count",Health & Beauty > Sexual Wellness > Contraceptives & Lubricants > Condoms
555,494,60 Okamoto Crown Condoms,Health & Beauty > Sexual Wellness > Contraceptives & Lubricants > Condoms
556,494,Trojan Supra Ultra Thin,Health & Beauty > Sexual Wellness > Contraceptives & Lubricants > Condoms
557,494,"100 Extra Large Condoms, Joe Lube XL Value Pack",Health & Beauty > Sexual Wellness > Contraceptives & Lubricants > Condoms
558,494,"Lifestyles KYNG, Premium LARGE Lubricated Latex Condoms with Silver Pocket/",Health & Beauty > Sexual Wellness > Contraceptives & Lubricants > Condoms
559,494,Okamoto BEYOND SEVEN Condoms - 50 condoms,Health & Beauty > Sexual Wellness > Contraceptives & Lubricants > Condoms
560,494,Trojan Magnum Thin Lubricated Premium Latex Condoms 12 ct,Health & Beauty > Sexual Wellness > Contraceptives & Lubricants > Condoms
561,494,Trojan Condom ENZ,Health & Beauty > Sexual Wellness > Contraceptives & Lubricants > Condoms
562,494,Trojan Condom Magnum Ecstasy Ultrasmooth Lubricated - 10 per pack,Health & Beauty > Sexual Wellness > Contraceptives & Lubricants > Condoms
563,494,Trojan Pleasures Extended (12 Latex Condoms),Health & Beauty > Sexual Wellness > Contraceptives & Lubricants > Condoms
564,494,Trojan Pleasure Pack Lubricated Latex Condoms - 36 Pc,Health & Beauty > Sexual Wellness > Contraceptives & Lubricants > Condoms
565,494,"Trojan Enz Non-lubricated Condoms, 12 Count Package",Health & Beauty > Sexual Wellness > Contraceptives & Lubricants > Condoms
566,494,Aoni Condoms - Ultrathin 001 - World's Thinnest Latex Condom by Guinness World Record| 12Pcs,Health & Beauty > Sexual Wellness > Contraceptives & Lubricants > Condoms
567,494,"One Condoms One Mixed Pleasures, 40 Count Health and Beauty",Health & Beauty > Sexual Wellness > Contraceptives & Lubricants > Condoms
568,494,"OKAMOTO BEYOND SEVEN MALE CONDOM, 36-Count Pack",Health & Beauty > Sexual Wellness > Contraceptives & Lubricants > Condoms
569,494,One® Mixed Pleasures 40,Health & Beauty > Sexual Wellness > Contraceptives & Lubricants > Condoms
570,494,"Durex Invisible Ultra Thin and Ultra Sensitive Premium Condoms, 16 Count",Health & Beauty > Sexual Wellness > Contraceptives & Lubricants > Condoms
571,494,ONE Condoms Pleasure Plus: 12-Pack of Condoms,Health & Beauty > Sexual Wellness > Contraceptives & Lubricants > Condoms
572,494,"Trojan Naturalamb Condom Lubricated, 20 Count",Health & Beauty > Sexual Wellness > Contraceptives & Lubricants > Condoms
573,494,Trojan Natural Lamb Lubricated Condoms (30 Condoms),Health & Beauty > Sexual Wellness > Contraceptives & Lubricants > Condoms
574,494,Snug Fit Condoms Sampler Pack 13 pack - Smaller Condoms Including: Lifestyles Snugger Fit & Small Size Condoms,Health & Beauty > Sexual Wellness > Contraceptives & Lubricants > Condoms
575,494,Durex Extra Sensitive 100 Pack New,Health & Beauty > Sexual Wellness > Contraceptives & Lubricants > Condoms
576,494,"Condoms Variety 24 Pack Trojan, Durex, Lifestyles, Atlas, Crown, Trustex, Impulse",Health & Beauty > Sexual Wellness > Contraceptives & Lubricants > Condoms
577,494,"Durex Lubricated Latex Condoms, Extra Sensitive, 24 Loose Pieces",Health & Beauty > Sexual Wellness > Contraceptives & Lubricants > Condoms
578,494,"Okamoto BEYOND SEVEN Condoms - Also available in quantities of 12, 50, 100 - (25 condoms)",Health & Beauty > Sexual Wellness > Contraceptives & Lubricants > Condoms
579,494,"LifeStyles RIBBED PLEASURE Condoms - Also available in quantities of 12, 25, 100 (50 condoms)",Health & Beauty > Sexual Wellness > Contraceptives & Lubricants > Condoms
580,494,"Durex Extra Sensitive Lubricated Condoms, 24-Count Boxes (Pack of 2)",Health & Beauty > Sexual Wellness > Contraceptives & Lubricants > Condoms
581,494,Icon Large Lubricated Latex Condoms 100 Pack,Health & Beauty > Sexual Wellness > Contraceptives & Lubricants > Condoms
582,494,"Durex Intense Sensation Dotted Lubricated Condoms, 3 Count",Health & Beauty > Sexual Wellness > Contraceptives & Lubricants > Condoms
583,494,Lifestyles Luscious Flavors Condoms 12-Pack,Health & Beauty > Sexual Wellness > Contraceptives & Lubricants > Condoms
584,494,"Lifestyles SKYN Large, Premium LARGE NON-LATEX Lubricated Condoms and Silver Pocket/Travel Case-24 Count New",Health & Beauty > Sexual Wellness > Contraceptives & Lubricants > Condoms
585,494,"Naturalamb Natural Skin Condoms, Lubricated, 10 condoms",Health & Beauty > Sexual Wellness > Contraceptives & Lubricants > Condoms
586,494,"Trojan Condom Platinum Pack Lubricated, 26 Count (Pack of 2)",Health & Beauty > Sexual Wellness > Contraceptives & Lubricants > Condoms
587,494,LIfeStyles SKYN LARGE Condoms - 50 count,Health & Beauty > Sexual Wellness > Contraceptives & Lubricants > Condoms
588,494,Durex Her Sensation Premium Ribbed Durex Latex Condoms Lubricated 48 condoms,Health & Beauty > Sexual Wellness > Contraceptives & Lubricants > Condoms
589,494,"Durex XXL Extra Large Lubricated Condoms, 12 Count",Health & Beauty > Sexual Wellness > Contraceptives & Lubricants > Condoms
590,494,Kimono Microthin Large,Health & Beauty > Sexual Wellness > Contraceptives & Lubricants > Condoms
591,494,Trojan Magnum Xl Lubricated Condoms 12 Ct,Health & Beauty > Sexual Wellness > Contraceptives & Lubricants > Condoms
592,494,Trojan Enz Premium Lubricated Latex Condoms Bulk Super Save: Pack of 100 Condoms,Health & Beauty > Sexual Wellness > Contraceptives & Lubricants > Condoms
593,494,Kimono MicroThin LARGE Condoms - 25 Condoms,Health & Beauty > Sexual Wellness > Contraceptives & Lubricants > Condoms
594,494,My Size Condoms My Size 64Mm Condoms 36 Pack,Health & Beauty > Sexual Wellness > Contraceptives & Lubricants > Condoms
595,494,"Trojan Condom Pleasure Pack Lubricated, 120 Count New",Health & Beauty > Sexual Wellness > Contraceptives & Lubricants > Condoms
596,494,Onea® Mixed Pleasures 40 Exotic Condoms 8 Amazing Styles with Pocket Travel Container,Health & Beauty > Sexual Wellness > Contraceptives & Lubricants > Condoms
597,494,LIFESTYLES SKYN Intense Feel Condoms 50 Count (5/10 Packs),Health & Beauty > Sexual Wellness > Contraceptives & Lubricants > Condoms
598,494,Trojan Her Pleasure Sensations Spermicidal Lubricated Latex Condoms-12 ct (Quantity of 4),Health & Beauty > Sexual Wellness > Contraceptives & Lubricants > Condoms
599,494,LIfeStyles SKYN Condoms - 25 count,Health & Beauty > Sexual Wellness > Contraceptives & Lubricants > Condoms
600,494,Global Protection Night Light Glow in the Dark: 3-Pack of Condoms,Health & Beauty > Sexual Wellness > Contraceptives & Lubricants > Condoms
601,494,LifeStyles SKYN LARGE Condoms - 25 condoms Health and Beauty,Health & Beauty > Sexual Wellness > Contraceptives & Lubricants > Condoms
602,494,"Sir Richard's Condoms, Pleasure Dots, 12 Count",Health & Beauty > Sexual Wellness > Contraceptives & Lubricants > Condoms
603,494,Okamoto Beyond Seven STUDDED Condoms - 50 condoms,Health & Beauty > Sexual Wellness > Contraceptives & Lubricants > Condoms
604,494,"Sustain Ultra Thin Condoms, 10 Count",Health & Beauty > Sexual Wellness > Contraceptives & Lubricants > Condoms
605,494,50 Joe Non-Lubricated Ultra-thin Condoms,Health & Beauty > Sexual Wellness > Contraceptives & Lubricants > Condoms
606,494,Okamoto Crown Skin Less Skin: 36-Pack of Condoms,Health & Beauty > Sexual Wellness > Contraceptives & Lubricants > Condoms
607,494,Condoms Variety Pack 12,Health & Beauty > Sexual Wellness > Contraceptives & Lubricants > Condoms
608,494,"Durex Real Feel Polyisoprene Non Latex Lubricated Condoms, 10 Count (Pack of 2)",Health & Beauty > Sexual Wellness > Contraceptives & Lubricants > Condoms
609,494,Durex Pleasuremax: 36-Pack of Condoms,Health & Beauty > Sexual Wellness > Contraceptives & Lubricants > Condoms
610,494,Okamoto CROWN Male Condoms - 50 bulk,Health & Beauty > Sexual Wellness > Contraceptives & Lubricants > Condoms
611,494,Trojan Vibrations Vibrating Touch Fingertip Massager and 1 Premium Latex Condom,Health & Beauty > Sexual Wellness > Contraceptives & Lubricants > Condoms
612,494,"Sir Richard's Condom Company Collection of Condoms, 12 Count Health and Beauty",Health & Beauty > Sexual Wellness > Contraceptives & Lubricants > Condoms
613,494,Sir Richard's Classic Ribbed Condoms Pack of 3 (36 Condoms),Health & Beauty > Sexual Wellness > Contraceptives & Lubricants > Condoms
614,494,"SKYN Original Condoms, 12ct",Health & Beauty > Sexual Wellness > Contraceptives & Lubricants > Condoms
615,494,"Lifestyles Ultra Sensitive Condoms, 12-count",Health & Beauty > Sexual Wellness > Contraceptives & Lubricants > Condoms
616,494,Rough Rider Studded Condoms 24 Pack,Health & Beauty > Sexual Wellness > Contraceptives & Lubricants > Condoms
617,494,Okamoto 0.02 EX Polyurethane Condom 6pc | Regular Size (Japan Import),Health & Beauty > Sexual Wellness > Contraceptives & Lubricants > Condoms
618,494,Premium Ultra Thin Condoms - GLYDE ULTRA (36 Count) Standard Fit Extra Sheer,Health & Beauty > Sexual Wellness > Contraceptives & Lubricants > Condoms
619,494,Trojan Magnum Thin Lubricated Latex Condoms-12 ct (Quantity of 3),Health & Beauty > Sexual Wellness > Contraceptives & Lubricants > Condoms
620,494,LifeStyles SNUGGER FIT Condoms - 72 count,Health & Beauty > Sexual Wellness > Contraceptives & Lubricants > Condoms
621,494,Caution Wear Iron Grip Condoms 12 Pack,Health & Beauty > Sexual Wellness > Contraceptives & Lubricants > Condoms
622,494,"Trojan, Durex, and Crown Condoms 36 Condom Variety Pack",Health & Beauty > Sexual Wellness > Contraceptives & Lubricants > Condoms
623,494,Trojan Magnum Ecstasy Lubricated Condoms 10pc 20 Pack,Health & Beauty > Sexual Wellness > Contraceptives & Lubricants > Condoms
624,494,LifeStyles SNUGGER FIT Condoms - 12 condoms,Health & Beauty > Sexual Wellness > Contraceptives & Lubricants > Condoms
625,494,Okamoto Condom 0.03 Platinum Condoms 10p,Health & Beauty > Sexual Wellness > Contraceptives & Lubricants > Condoms
626,494,Durex Extra Sensitive 24 Pack,Health & Beauty > Sexual Wellness > Contraceptives & Lubricants > Condoms
627,494,Skyn Extra Lubricated 12 Condoms (2 Pack),Health & Beauty > Sexual Wellness > Contraceptives & Lubricants > Condoms
628,494,"Trojan Sensitivity, BareSkin Premium Latex Condoms 10 ct (Quantity of 4)",Health & Beauty > Sexual Wellness > Contraceptives & Lubricants > Condoms
629,494,Trojan Her Pleasure Sensations Lubricated Latex Condoms-12 ct (Quantity of 3),Health & Beauty > Sexual Wellness > Contraceptives & Lubricants > Condoms
630,494,ONE FLAVOR WAVES ASSORTED FLAVORED CONDOMS 12 PACK,Health & Beauty > Sexual Wellness > Contraceptives & Lubricants > Condoms
631,494,Sir Richard's Pleasure Dots Condoms Pack of 3 (36 Condoms),Health & Beauty > Sexual Wellness > Contraceptives & Lubricants > Condoms
632,494,ONE Glowing Pleasures Glow in the Dark Lubricated Latex Condoms Bulk [A New Experience with Your Partner] - 24,Health & Beauty > Sexual Wellness > Contraceptives & Lubricants > Condoms
633,494,ONE The Legend: 12-Pack of,Health & Beauty > Sexual Wellness > Contraceptives & Lubricants > Condoms
634,494,"Trojan Naturalamb Condom Lubricated, 10 Count",Health & Beauty > Sexual Wellness > Contraceptives & Lubricants > Condoms
635,494,GLYDE MAXI Premium Ultra Thin Large Condoms - 36 Count : The #1 Large Natural,Health & Beauty > Sexual Wellness > Contraceptives & Lubricants > Condoms
636,494,Kimono MAXX Condoms 24 Pack,Health & Beauty > Sexual Wellness > Contraceptives & Lubricants > Condoms
637,494,"Durex Real Feel Polyisoprene Non Latex Lubricated Condoms, 10 Count New",Health & Beauty > Sexual Wellness > Contraceptives & Lubricants > Condoms
638,494,Condom: Trojan Magnum Thin 12 Pack,Health & Beauty > Sexual Wellness > Contraceptives & Lubricants > Condoms
639,494,Lifestyles Ultra Sensitive Non-Lubricated: 100-Pack of Condoms,Health & Beauty > Sexual Wellness > Contraceptives & Lubricants > Condoms
640,494,Durex Pleasuremax Premium,Health & Beauty > Sexual Wellness > Contraceptives & Lubricants > Condoms
641,494,Siam Circus Caution Wear Iron Grip Snugger Fit Silicone-Based Lubricated Condoms 50-Pack,Health & Beauty > Sexual Wellness > Contraceptives & Lubricants > Condoms
642,494,OKAMOTO CONDOMES ZERO ONE 0.01mm 3Pieces MADE IN JAPAN,Health & Beauty > Sexual Wellness > Contraceptives & Lubricants > Condoms
643,494,LifeStyles EXTRA STRENGTH,Health & Beauty > Sexual Wellness > Contraceptives & Lubricants > Condoms
644,494,Kimono Latex Micro Thin,Health & Beauty > Sexual Wellness > Contraceptives & Lubricants > Condoms
645,494,Trojan Ecstasy Pack,Health & Beauty > Sexual Wellness > Contraceptives & Lubricants > Condoms
646,494,"Sir Richard's Condoms, Ultra Thin, 12 Count New",Health & Beauty > Sexual Wellness > Contraceptives & Lubricants > Condoms
647,494,Trojan Stimulations Ecstasy Lubricated Condoms 10 Ea,Health & Beauty > Sexual Wellness > Contraceptives & Lubricants > Condoms
648,494,"Durex Tropical Fruit Flavored (Strawberry, Orange, Banana, and Apple) Lubricated",Health & Beauty > Sexual Wellness > Contraceptives & Lubricants > Condoms
649,494,Durex PERFORMAX INTENSE Condoms in various quantities (50 condoms),Health & Beauty > Sexual Wellness > Contraceptives & Lubricants > Condoms
650,494,Okamoto Beyond Seven ALOE Condoms - 25 condoms New,Health & Beauty > Sexual Wellness > Contraceptives & Lubricants > Condoms
651,494,"Durex Extra Sensitive Condom, Natural 24 count New",Health & Beauty > Sexual Wellness > Contraceptives & Lubricants > Condoms
652,494,Sagami Original 001 Condom 5pcs,Health & Beauty > Sexual Wellness > Contraceptives & Lubricants > Condoms
653,494,12 Pack Caution Wear Iron Grip Snugger Fit Small Condoms,Health & Beauty > Sexual Wellness > Contraceptives & Lubricants > Condoms
654,494,One® Tantric Pleasures 40 Exotic Condoms with Pocket Travel Container,Health & Beauty > Sexual Wellness > Contraceptives & Lubricants > Condoms
655,494,Durex Pleasure Pack 72 Count; Exciting Mix of Sensation and Stimulation,Health & Beauty > Sexual Wellness > Contraceptives & Lubricants > Condoms
656,494,OKAMOTO BEYOND SEVEN 100-Count Pack,Health & Beauty > Sexual Wellness > Contraceptives & Lubricants > Condoms
657,494,"Trojan Condom Sensitivity Ultra Thin Spermicidal, 12 Count Pack of 3",Health & Beauty > Sexual Wellness > Contraceptives & Lubricants > Condoms
658,494,Trojan Magnum Fire & Ice Dual Action Lubricated Latex Condoms-10 ct (Quantity of 3),Health & Beauty > Sexual Wellness > Contraceptives & Lubricants > Condoms
659,494,"Trojan Pleasure Pack NEW MIX Premium Lubricated Latex Condoms - 40 Count Variety Pack - Double Ecstasy, Charged, Ultra Thin, Ultra Ribbed, ENZ - Brand NEW",Health & Beauty > Sexual Wellness > Contraceptives & Lubricants > Condoms
660,494,Durex Play Vibrations Vibrating Ring 1 ct (Quantity of 3),Health & Beauty > Sexual Wellness > Contraceptives & Lubricants > Condoms
661,494,"Trojan Extended Pleasure Premium Latex Condoms, Climax Control Lubricant , 36 condoms",Health & Beauty > Sexual Wellness > Contraceptives & Lubricants > Condoms
662,494,Crown Condom - 50 Piece,Health & Beauty > Sexual Wellness > Contraceptives & Lubricants > Condoms
663,494,"SAGAMI ORIGINAL 001 5pcs Regular-size, Ultra Thin Condom 0.01 (3) Health and Beauty",Health & Beauty > Sexual Wellness > Contraceptives & Lubricants > Condoms
664,494,Aoni Condoms: Ultrathin 001 & Nanosilver Ultrathin 001 - World's Thinnest Latex,Health & Beauty > Sexual Wellness > Contraceptives & Lubricants > Condoms
665,494,Kimono MicroThin: 100-Pack,Health & Beauty > Sexual Wellness > Contraceptives & Lubricants > Condoms
666,494,OKAMOTO Beyond Seven Latex Condoms - 25 condoms,Health & Beauty > Sexual Wellness > Contraceptives & Lubricants > Condoms
667,494,100 Lifestyles Ultra,Health & Beauty > Sexual Wellness > Contraceptives & Lubricants > Condoms
668,494,12 Lifestyles Condoms Variety Pack + Free Lubricant - Bulgeinbulk's Collection of 12 Different Types of Lifestyles Condoms,Health & Beauty > Sexual Wellness > Contraceptives & Lubricants > Condoms
669,494,LifeStyles SNUGGER FIT Condoms - 90 condoms,Health & Beauty > Sexual Wellness > Contraceptives & Lubricants > Condoms
670,494,ONE Vanish Hyperthin Condoms Bulk (100),Health & Beauty > Sexual Wellness > Contraceptives & Lubricants > Condoms
671,494,LifeStyles SKYN Selection - 24 pack (pack of 3),Health & Beauty > Sexual Wellness > Contraceptives & Lubricants > Condoms
672,494,Long Love Climax Control Condoms 12pcs (1pack),Health & Beauty > Sexual Wellness > Contraceptives & Lubricants > Condoms
673,494,Okamoto Beyond Seven STUDDED Condoms - 25 condoms,Health & Beauty > Sexual Wellness > Contraceptives & Lubricants > Condoms
674,494,"LifeStyles PLEASURE SHAPED CONDOMS, Box of 12, Relaxed Condom Tip for Extra Stimulation",Health & Beauty > Sexual Wellness > Contraceptives & Lubricants > Condoms
675,494,Iron Grip Condoms - Pack,Health & Beauty > Sexual Wellness > Contraceptives & Lubricants > Condoms
676,494,Kimono Microthin Large Premium Lubricated Latex Condoms and Silver Pocket/Travel Case-20 Count,Health & Beauty > Sexual Wellness > Contraceptives & Lubricants > Condoms
677,494,"Trojan-Enz Lubricated Condom, 36 Count",Health & Beauty > Sexual Wellness > Contraceptives & Lubricants > Condoms
678,494,"Trojan Magnum Gold Collection, Large Size,10-count",Health & Beauty > Sexual Wellness > Contraceptives & Lubricants > Condoms
679,494,Lifestyles Turbo Condoms with Excitegel 10 Condoms (Pack of 6) 60 TOTAL CONDOMS,Health & Beauty > Sexual Wellness > Contraceptives & Lubricants > Condoms
680,494,BILLY BOY Special Comfort Condoms 10 Pack,Health & Beauty > Sexual Wellness > Contraceptives & Lubricants > Condoms
681,494,Kimono MicroThin: 100-Pack of Condoms,Health & Beauty > Sexual Wellness > Contraceptives & Lubricants > Condoms
682,494,LIfeStyles ULTRA SENSITIVE Condoms - 108 count,Health & Beauty > Sexual Wellness > Contraceptives & Lubricants > Condoms
683,494,Durex Avanti Bare Real Feel NON-LATEX Polyisoprene Lubricated Condoms with Silver Pocket/Travel Case-24 Count,Health & Beauty > Sexual Wellness > Contraceptives & Lubricants > Condoms
684,494,"100 Lifestyles Ultra Sensitive Condoms, a Condom that's Extra Thin and Lubricated for a Better Fit",Health & Beauty > Sexual Wellness > Contraceptives & Lubricants > Condoms
685,494,Trojan Magnum Thin,Health & Beauty > Sexual Wellness > Contraceptives & Lubricants > Condoms
686,494,Crown-Okamoto Super Thin,Health & Beauty > Sexual Wellness > Contraceptives & Lubricants > Condoms
687,494,"Durex Lubricated Latex Condoms, Extra Sensitive 3 Count (Pack of 12)",Health & Beauty > Sexual Wellness > Contraceptives & Lubricants > Condoms
688,494,OKAMOTO Beyond Seven Latex Condoms - 36 condoms,Health & Beauty > Sexual Wellness > Contraceptives & Lubricants > Condoms
689,494,"Condoms Variety Bulk Pack 200 Condoms : Trojan, Durex, Lifestyles, One, Atlas",Health & Beauty > Sexual Wellness > Contraceptives & Lubricants > Condoms
690,494,ONE Vanish Hyperthin Premium Lubricated Latex Condoms with Silver Pocket/Travel Case (12),Health & Beauty > Sexual Wellness > Contraceptives & Lubricants > Condoms
691,494,"Sir Richards Condom Company Ultra Thin Condoms - 12 Count, 2 Pack",Health & Beauty > Sexual Wellness > Contraceptives & Lubricants > Condoms
692,494,Lifestyles Ultra Sensitive non-lubricated Condom Quantitiy 36 LOW SHIPPING!,Health & Beauty > Sexual Wellness > Contraceptives & Lubricants > Condoms
693,494,Trojan Charged Orgasmic Pleasure Condoms 100-Pack,Health & Beauty > Sexual Wellness > Contraceptives & Lubricants > Condoms
694,494,"Large Condoms Sampler Pack - Larger Condoms Including: XXL Condoms, Lifestyles",Health & Beauty > Sexual Wellness > Contraceptives & Lubricants > Condoms
695,494,ONE Pleasure Plus The New Shap of Pleasure for Maximum Pleasure Lubricated,Health & Beauty > Sexual Wellness > Contraceptives & Lubricants > Condoms
696,494,Durex Extra Lubricated Latex Condoms (Pack of 100),Health & Beauty > Sexual Wellness > Contraceptives & Lubricants > Condoms
697,494,Crown Condoms 24 Pack,Health & Beauty > Sexual Wellness > Contraceptives & Lubricants > Condoms
698,494,L. Large Condoms 12 Pack,Health & Beauty > Sexual Wellness > Contraceptives & Lubricants > Condoms
699,494,Lifestyles SKYN Extra Lubricated NON-LATEX Polyisoprene Condoms with Silver Pocket/Travel Case-12 Count,Health & Beauty > Sexual Wellness > Contraceptives & Lubricants > Condoms
700,494,Durex Extra Sensitive 100 Pack,Health & Beauty > Sexual Wellness > Contraceptives & Lubricants > Condoms
701,494,Sagami | Condoms | 0.09mm + Super Dot for Long Play! 10pc,Health & Beauty > Sexual Wellness > Contraceptives & Lubricants > Condoms
702,494,Trojan BARESKIN Condoms,Health & Beauty > Sexual Wellness > Contraceptives & Lubricants > Condoms
703,494,Okamoto 0.02 EX Polyurethane Condom 3 color Mix 6pc | Regular Size (Japan Import),Health & Beauty > Sexual Wellness > Contraceptives & Lubricants > Condoms
704,494,Lifestyles Luscious Flavors Condoms 24-Pack,Health & Beauty > Sexual Wellness > Contraceptives & Lubricants > Condoms
705,494,Durex Invisible Premium Lubricated Latex Condoms with Silver Pocket/Travel Case-16 Count,Health & Beauty > Sexual Wellness > Contraceptives & Lubricants > Condoms
706,494,"Trojan Condom Magnum Thin Lubricated, 12 Count Health and Beauty",Health & Beauty > Sexual Wellness > Contraceptives & Lubricants > Condoms
707,494,"LifeStyles SNUGGER FIT Condoms - Also available in quantities of 25, 50, 90 (12 condoms)",Health & Beauty > Sexual Wellness > Contraceptives & Lubricants > Condoms
708,494,"LifeStyles Pleasure Collection, 30ct",Health & Beauty > Sexual Wellness > Contraceptives & Lubricants > Condoms
709,494,"Trojan Condom Magnum Lubricated, 36 Count New",Health & Beauty > Sexual Wellness > Contraceptives & Lubricants > Condoms
710,494,Okamoto Beyond Seven STUDDED Condoms - 100 condoms,Health & Beauty > Sexual Wellness > Contraceptives & Lubricants > Condoms
711,494,Trojan Condom Magnum Thin,Health & Beauty > Sexual Wellness > Contraceptives & Lubricants > Condoms
712,494,Snug Fit Condoms Sampler,Health & Beauty > Sexual Wellness > Contraceptives & Lubricants > Condoms
713,494,Trojan Sensitivity Ultra Thin Premium Lubricant Condom 36 Ct Value Pack New,Health & Beauty > Sexual Wellness > Contraceptives & Lubricants > Condoms
714,494,Trojan Lubricated Latex,Health & Beauty > Sexual Wellness > Contraceptives & Lubricants > Condoms
715,494,Okamoto Condom Variety Pack + Free Lubricant - 36 Pack New,Health & Beauty > Sexual Wellness > Contraceptives & Lubricants > Condoms
716,494,"Magnum Ribbed Lubricated Condoms, 12 Count",Health & Beauty > Sexual Wellness > Contraceptives & Lubricants > Condoms
717,494,Trojan Bareskin Lubricated 24pk,Health & Beauty > Sexual Wellness > Contraceptives & Lubricants > Condoms
718,494,Lifestyles SKYN Condoms,Health & Beauty > Sexual Wellness > Contraceptives & Lubricants > Condoms
719,494,Trojan Extended Pleasure,Health & Beauty > Sexual Wellness > Contraceptives & Lubricants > Condoms
720,494,Trojan Naturalamb Condom Lubricated Natural Skin 3 Pc - 2 pack,Health & Beauty > Sexual Wellness > Contraceptives & Lubricants > Condoms
721,494,"Durex Rainbow Flavors and Colors Variety Pack, Premium Lubricated Latex Condoms-24 Count",Health & Beauty > Sexual Wellness > Contraceptives & Lubricants > Condoms
722,494,"Okamoto BIG BOY | Condoms | Super Big Boy 12pc (dia:37mm, Extra Gel)",Health & Beauty > Sexual Wellness > Contraceptives & Lubricants > Condoms
723,494,"Latex Free Condoms Sampler Pack - Trojan Naturalamb Lambskin Condoms, Trojan Supra, Durex Real Feel, LifeStyles Skyn, LifeStyles Skyn Large, LifeStyle New",Health & Beauty > Sexual Wellness > Contraceptives & Lubricants > Condoms
724,494,Lifestyle Condoms Lifestyles Skyn Extra Lubricated - 12 Pack,Health & Beauty > Sexual Wellness > Contraceptives & Lubricants > Condoms
725,494,Lifestyles SKYN Elite Premium NON-LATEX Polyisoprene Lubricated Condoms with Silver Pocket/Travel Case-10 Count,Health & Beauty > Sexual Wellness > Contraceptives & Lubricants > Condoms
726,494,Okamoto Condom Variety Pack + Free Lubricant - 48 Pack,Health & Beauty > Sexual Wellness > Contraceptives & Lubricants > Condoms
727,494,Trojan Condom Pleasures,Health & Beauty > Sexual Wellness > Contraceptives & Lubricants > Condoms
728,494,ONE Vanish Hyperthin Premium Lubricated Latex Condoms with Silver Pocket/Travel,Health & Beauty > Sexual Wellness > Contraceptives & Lubricants > Condoms
