,category_id,description,category_path
491,537,Wide Platform Digital Glass Bathroom Scale Black - Holds up to 400 lbs. 14 inches wide platform - By Utopia Scales,Home & Kitchen > Bath > Bathroom Accessories > Scales
492,537,"VonHaus Body Fat Scale - BMI Weight Scale with Body Composition Analyser, Hydration Monitor, 400lb Weight Capacity, Silver/Glass Bathroom Weight Scales",Home & Kitchen > Bath > Bathroom Accessories > Scales
493,537,Etekcity Etekfit 11lb-400lb Digital Bluetooth Body Fat BMI Weight Bathroom,Home & Kitchen > Bath > Bathroom Accessories > Scales
494,537,"Etekcity Ultra Wide Digital Body Weight Bathroom Scale, 440lb /200kg, 15.4"" x 11.8""",Home & Kitchen > Bath > Bathroom Accessories > Scales
495,537,"Kinzi Precision Digital Bathroom Scale w/ Extra Large Lighted Display, 400 lb. Capacity and ""Step-On"" Technology [2015 VERSION]",Home & Kitchen > Bath > Bathroom Accessories > Scales
496,537,Utopia Scales USJK-B01-1,Home & Kitchen > Bath > Bathroom Accessories > Scales
497,537,"SmartWay Precision XL Digital Bathroom Scale YES I CAN! Motivation Series w/ Extra Wide 440lb Step-On Platform ""2015 Limited Edition"" (Black)",Home & Kitchen > Bath > Bathroom Accessories > Scales
498,537,"NewlineNY Auto Step On Digital Bathroom Scale, Red-Orange SBB0818-RO",Home & Kitchen > Bath > Bathroom Accessories > Scales
499,537,"60beat BLUE Bathroom scale for iPhone 6, 6 plus, 5, 5S, 5C, 4S most iPads and other Bluetooth Smart devices",Home & Kitchen > Bath > Bathroom Accessories > Scales
500,537,"Xtech Highly Accurate 440lbs / 200kg Capacity Precision Digital Bathroom Scale with Automatic-on Display Technology and Large 3.6"" Easy-to-read Backlit LCD",Home & Kitchen > Bath > Bathroom Accessories > Scales
501,537,"DecoBros 400lb 15'' Ultra Wide Platform Precision Plus Digital Bathroom Scale with and Extra Large LCD Display, Step-On Startup",Home & Kitchen > Bath > Bathroom Accessories > Scales
502,537,"Etekcity Digital Stainless Steel Body Weight Bathroom Scale, 400 Pounds",Home & Kitchen > Bath > Bathroom Accessories > Scales
503,537,"Mosiso® - Ultra Thin High Accuracy Digital Bathroom Scale with ""Smart Step-On"" Technology, (BLUE)",Home & Kitchen > Bath > Bathroom Accessories > Scales
504,537,"Etekcity® High Precision (0.2lb) 400lb /180kg Digital Bathroom Scale, ""Smart Step-on"" function, Strain Gauge Sensors, Large Backlit Display, Tempered",Home & Kitchen > Bath > Bathroom Accessories > Scales
505,537,"Smart Weigh SMS500 Digital Bathroom Scale, High Accuracy, Dual Color Weight Change Detection and Smart Step-On",Home & Kitchen > Bath > Bathroom Accessories > Scales
506,537,"Vive Precision Digital Bathroom Scale - Weight Scale Measuring Device - Electronic Body Scale, Easy to Read, Backlit Display - Accurate to .2 LBs (Silver)",Home & Kitchen > Bath > Bathroom Accessories > Scales
507,537,"EatSmart Precision MaxView Digital Bathroom Scale w/ 4.5"" Backlit LCD Display",Home & Kitchen > Bath > Bathroom Accessories > Scales
508,537,"Escali BFBW200 Glass Body Fat/ Body Water Digital Bathroom Scale, 440lb/200 Kg",Home & Kitchen > Bath > Bathroom Accessories > Scales
509,537,"Surpahs Shiny Small Lightweight Digital Bathroom Scale w/ BMI Calculation, Auto Identify 4 Users [White] New",Home & Kitchen > Bath > Bathroom Accessories > Scales
510,537,Eatsmart Precision Plus,Home & Kitchen > Bath > Bathroom Accessories > Scales
511,537,Utopia Scales USJKB-901,Home & Kitchen > Bath > Bathroom Accessories > Scales
512,537,"Digital Glass Bathroom Scale - Tempered Glass with LCD Display (Clear), 330 lb. Capacity, Perfect for Weight Regulation at Home or In the Gym, Fits Easily Beneath Bathroom Counter, Easy to Clean - By Utopia Scales",Home & Kitchen > Bath > Bathroom Accessories > Scales
513,537,"Ozeri Precision Digital Bath Scale (400 Lbs Edition), In Tempered Glass With Step-on Activation, White New",Home & Kitchen > Bath > Bathroom Accessories > Scales
514,537,American Weigh Scales Talking Bathroom Scale - 330CVS,Home & Kitchen > Bath > Bathroom Accessories > Scales
515,537,Fitbit Aria Wi-Fi Smart Bathroom Scale Black NO SIZE,Home & Kitchen > Bath > Bathroom Accessories > Scales
516,537,Beurer New York City Glass Bathroom Scale MULTI ONE-SIZE,Home & Kitchen > Bath > Bathroom Accessories > Scales
517,537,HoMedics® Glass Digital Bathroom Scale 405 GLASS SCALE,Home & Kitchen > Bath > Bathroom Accessories > Scales
518,537,Fitbit Aria Wi-Fi Weight/Body Fat/BMI Digital Smart Scale - White White,Home & Kitchen > Bath > Bathroom Accessories > Scales
519,537,"Tikteck Bluetooth Smart Scale, FREE App for iPhone and Android Devices, Bathroom Weight Scale",Home & Kitchen > Bath > Bathroom Accessories > Scales
520,537,"BalanceFrom High Accuracy Ultra Slim Digital Bathroom Scale with ""Smart Step-On"" Technology and Large Display [NEWEST VERSION] (Black)",Home & Kitchen > Bath > Bathroom Accessories > Scales
521,537,"GoWISE USA Digital Body Fat Scale - FDA Approved - Measures Weight, Body Fat, Water & Bone Mass, 400 lbs Capacity, Tempered Glass (Black)",Home & Kitchen > Bath > Bathroom Accessories > Scales
522,537,"Smart Weigh Body Fat Digital Precision Scale with Tempered Glass Platform, Eight User Recognition, and 440 lb Weight Capacity, Measures Weight, Body Fat, Water, Muscle and Bone Mass",Home & Kitchen > Bath > Bathroom Accessories > Scales
523,537,"GoWISE USA Slim Digital Bathroom Scale - Measures Weight, Body Fat, Water, & Bone Mass 400 Lbs Capacity Tempered Glass GW22029",Home & Kitchen > Bath > Bathroom Accessories > Scales
524,537,"EatSmart Precision Digital Bathroom Scale w/ Extra Large Lighted Display, 400 lb. Capacity and ""Step-On"" Technology [2016 VERSION] - 22,000+ Reviews EatSmart Guaranteed Accurate",Home & Kitchen > Bath > Bathroom Accessories > Scales
525,537,Most Accurate Bathroom Scales - AccuPoint! Easy Step-on Technology; Extra Large,Home & Kitchen > Bath > Bathroom Accessories > Scales
526,537,EatSmart Products Precision Tracker Digital Bathroom Scale with Eatsmart Accutrack Software,Home & Kitchen > Bath > Bathroom Accessories > Scales
527,537,Balance High Accuracy Body Fat Scale with Easy-to-Read Backlit LCD and 5-Year Warranty,Home & Kitchen > Bath > Bathroom Accessories > Scales
528,537,"EatSmart Precision Digital Bathroom Scale w/ Extra Large Lighted Display, 400 lb. Capacity and ""Step-On"" Technology [2014 VERSION] - 10,000+ Reviews EatSmart Guaranteed Accurate",Home & Kitchen > Bath > Bathroom Accessories > Scales
529,537,"Ozeri Precision Digital Bath Scale (400 lbs Edition), in Tempered Glass with Step-on Activation, in Black",Home & Kitchen > Bath > Bathroom Accessories > Scales
530,537,"EatSmart Precision Digital Bathroom Scale w/ Extra Large Lighted Display, 400 lb. Capacity and ""Step-On"" Technology [2016 VERSION] - 22,000+ Reviews E",Home & Kitchen > Bath > Bathroom Accessories > Scales
531,537,"Smart Weigh Contemporary Series Digital Vanity / Bathroom Scale with an Extra Large 4.3"" Backlighted LCD Screen (White)",Home & Kitchen > Bath > Bathroom Accessories > Scales
532,537,"Etekcity Digital Body Weight Scale with Body Tape Measure, Tempered glass, 400 Pounds",Home & Kitchen > Bath > Bathroom Accessories > Scales
533,537,"GoWISE USA Slim Digital Bathroom Scale - Measures Weight, Body Fat, Water, & Bone Mass 400 Lbs Capacity Tempered Glass (Silver)",Home & Kitchen > Bath > Bathroom Accessories > Scales
534,537,"Accuweight Digital Bathroom Body Weight Scale Accurate Bathroom Scale 400lb, Gray",Home & Kitchen > Bath > Bathroom Accessories > Scales
535,537,"Etekcity Digital Body Weight Bathroom Scale, 400lb/180kg, White/Gray",Home & Kitchen > Bath > Bathroom Accessories > Scales
536,537,"Utopia Scales USJK-B01-7 Tempered Glass Digital Bathroom Scale with LCD Display, 396 lb. Capacity",Home & Kitchen > Bath > Bathroom Accessories > Scales
537,537,"Famili Non Slip Accurate Digital Body Weight Bathroom Scale, 400lb/180kg, Blue",Home & Kitchen > Bath > Bathroom Accessories > Scales
538,537,"Accuweight Digital Body Weight Bathroom Scale, 400lb/180kg AW-BS001BS, Gray",Home & Kitchen > Bath > Bathroom Accessories > Scales
539,537,"Surpahs Shiny Small Lightweight Digital Bathroom Scale w/ BMI Calculation, Auto Identify 4 Users [Sachet Pink]",Home & Kitchen > Bath > Bathroom Accessories > Scales
540,537,"Etekcity Digital Body Fat Scale with Easy-to-Read Backlit Display, 400 Pounds",Home & Kitchen > Bath > Bathroom Accessories > Scales
541,537,My Weigh Elite Series Bathroom Body Weight Scale - 400 lb,Home & Kitchen > Bath > Bathroom Accessories > Scales
542,537,"Withings Body - Body Composition Wi-Fi Scale, Black",Home & Kitchen > Bath > Bathroom Accessories > Scales
543,537,"Etekcity Stylish Digital Body Weight Bathroom Scale, 400lb, Unique Circular Design",Home & Kitchen > Bath > Bathroom Accessories > Scales
544,537,"NewlineNY SBB-0719M-NYLG Step-On Mini Travel Bathroom Scale, Modern Green",Home & Kitchen > Bath > Bathroom Accessories > Scales
545,537,Fitbit Aria Wi-fi Smart Scale,Home & Kitchen > Bath > Bathroom Accessories > Scales
546,537,EatSmart Precision Tracker,Home & Kitchen > Bath > Bathroom Accessories > Scales
547,537,"NewlineNY SBB-0720N-NYRO Step-On Mini Travel Bathroom Scale, Red Orange",Home & Kitchen > Bath > Bathroom Accessories > Scales
548,537,"Ozeri Touch 440 lbs Total Body Bath Scale - Measures Weight, Fat, Muscle, Bone & Hydration with Auto Recognition",Home & Kitchen > Bath > Bathroom Accessories > Scales
549,537,"GoWISE USA Slim Digital Bathroom Scale - Measures Weight, Body Fat, Water, & Bone Mass 400 Lbs Capacity Tempered Glass GW22025",Home & Kitchen > Bath > Bathroom Accessories > Scales
550,537,"Ozeri Precision Digital Bath Scale (400 Lbs Edition), In Tempered Glass With Step-on Activation, White Health and Beauty",Home & Kitchen > Bath > Bathroom Accessories > Scales
551,537,"EatSmart Products Precision Calpal Digital Bathroom Scale with 440 Pound Capacity, BMI and Calorie Intake Analysis",Home & Kitchen > Bath > Bathroom Accessories > Scales
552,537,EatSmart Precision Plus Digital Bathroom Scale Silver,Home & Kitchen > Bath > Bathroom Accessories > Scales
553,537,Modern Digital with Glass Top Bathroom Scale,Home & Kitchen > Bath > Bathroom Accessories > Scales
554,537,Weight Watchers® Glass Scale - White,Home & Kitchen > Bath > Bathroom Accessories > Scales
555,537,Fitbit Aria Wi-Fi Smart Scale - Black (FB201B),Home & Kitchen > Bath > Bathroom Accessories > Scales
556,537,EatSmart Digital Bathroom Scale with Extra Large Backlight in Silver,Home & Kitchen > Bath > Bathroom Accessories > Scales
557,537,Weight Watchers Body Analysis Scale Multi/None NO SIZE,Home & Kitchen > Bath > Bathroom Accessories > Scales
558,537,Fitbit 'Aria' Wireless Smart Scale Black One Size,Home & Kitchen > Bath > Bathroom Accessories > Scales
559,537,Weight Gurus® Bluetooth® Smart Scale BLACK SCALE,Home & Kitchen > Bath > Bathroom Accessories > Scales
560,537,Withings Digital Body Cardio™ Scale in Black with Wi-Fi Connectivity BLACK SCALE,Home & Kitchen > Bath > Bathroom Accessories > Scales
561,537,Fitbit™ Aria Wi-Fi Smart Bathroom Scale in White WHITE SCALE,Home & Kitchen > Bath > Bathroom Accessories > Scales
562,537,HoMedicsi¿½ Carbon Fiber Glass Bathroom Scale Black,Home & Kitchen > Bath > Bathroom Accessories > Scales
563,537,Refurbished: Fitbit Aria Wi-Fi Weight/Body Fat/BMI Digital Smart Scale - Black Black,Home & Kitchen > Bath > Bathroom Accessories > Scales
564,537,Body Composition Bathroom Scale,Home & Kitchen > Bath > Bathroom Accessories > Scales
565,537,Perfect Fitness Body Fat Scale New,Home & Kitchen > Bath > Bathroom Accessories > Scales
566,537,Weight Gurus Wifi Smart Connected Body Fat Scale w/ Backlit LCD & ITO Conductive Surface Technology,Home & Kitchen > Bath > Bathroom Accessories > Scales
567,537,"Utopia Scales USJK-B01-7 Tempered Glass Digital Bathroom Scale with LCD Display (Black), 400 lb. Capacity, Perfect for Weight Regulation at Home or In",Home & Kitchen > Bath > Bathroom Accessories > Scales
568,537,"Ozeri ZB20 WeightMaster II 440 lbs Digital Bath Scale with BMI and Weight Change Detection, White",Home & Kitchen > Bath > Bathroom Accessories > Scales
569,537,"EatSmart Precision Body Fat Scale Bathroom Scale w/ 400 lb. Capacity, BMI and Step Off Technology",Home & Kitchen > Bath > Bathroom Accessories > Scales
570,537,"Smart Weigh Precision Digital Vanity / Bathroom Scale, ""Smart Step-On"" Technology, Tempered Glass Platform and Large Backlight Display",Home & Kitchen > Bath > Bathroom Accessories > Scales
571,537,Weight Gurus Digital Bathroom Scale with Large Backlit LCD and Smartphone Tracking (White),Home & Kitchen > Bath > Bathroom Accessories > Scales
572,537,VonHaus Digital Bathroom Scale - Glass/Silver Body Weight Scale - 400 lbs / 180 kg Capacity,Home & Kitchen > Bath > Bathroom Accessories > Scales
573,537,Digital Glass Bathroom Scale 6mm Thick Tempered Glass - Transparent By Utopia,Home & Kitchen > Bath > Bathroom Accessories > Scales
574,537,Weight Gurus Digital Bathroom Scale with Large Backlit LCD and Smartphone Tracking (Silver),Home & Kitchen > Bath > Bathroom Accessories > Scales
575,537,"Etekcity Digital Body Weight Scale with Step-on Technology, 400 Pounds",Home & Kitchen > Bath > Bathroom Accessories > Scales
576,537,"Ozeri ZB19 Rev Digital Bathroom Scale with Electro-Mechanical Weight Dial, Black New",Home & Kitchen > Bath > Bathroom Accessories > Scales
577,537,Smart Weigh SMS500 Digital Memory Bathroom Scale with Dual Color Weight Change Detection and Smart Step-On Auto,Home & Kitchen > Bath > Bathroom Accessories > Scales
578,537,"Smart Weigh SMS500 Digital Memory Bathroom Scale with Dual Color Weight Change Detection and Smart Step-On Auto Recognition of Up To 8 Users Profile, Silver",Home & Kitchen > Bath > Bathroom Accessories > Scales
579,537,"DecoBros Precision Digital Bathroom Body Weight Scale w/ Extra Large Lighted Display, Step-On Startup",Home & Kitchen > Bath > Bathroom Accessories > Scales
580,537,Taylor Precision 1130T White Digital Bath Scale,Home & Kitchen > Bath > Bathroom Accessories > Scales
581,537,SmartWay Precision XL Digital Bathroom Scale - Extra Wide 440lb Step-On Platform w/ MyoTape Body Tape Measure Kit Included (Pink),Home & Kitchen > Bath > Bathroom Accessories > Scales
582,537,"BalanceFrom High Accuracy Digital Bathroom Scale with 4.3"" Extra Large Cool Blue Backlight Display and ""Smart Step-On"" Technology [NEWEST VERSION] (Bl",Home & Kitchen > Bath > Bathroom Accessories > Scales
583,537,"Fitbit Aria Wi-Fi Smart Scale, White New",Home & Kitchen > Bath > Bathroom Accessories > Scales
584,537,"Etekcity Digital Body Weight Bathroom Scale, 400lb/180kg, Circle Design",Home & Kitchen > Bath > Bathroom Accessories > Scales
585,537,"Ozeri ZB19-W Rev Digital Bathroom Scale with Electro-Mechanical Weight Dial, White",Home & Kitchen > Bath > Bathroom Accessories > Scales
586,537,"Etekcity Digital Body Weight Bathroom Scale with Step-On Technology, 400 Pounds, Black",Home & Kitchen > Bath > Bathroom Accessories > Scales
587,537,"NewlineNY Auto Step-on Super-Mini Travel Bathroom Scale, SBB0638SM-BK Black",Home & Kitchen > Bath > Bathroom Accessories > Scales
588,537,"Smart Weigh 400lb / 180kg Electronic Bathroom Scale with Sleek Tempered Glass Platform, Advanced Step-On Technology and Large Backlit LCD Display (Silver)",Home & Kitchen > Bath > Bathroom Accessories > Scales
589,537,"TaoTronics Smart Body Fat Scales Bathroom Scale, Measures Weight, BMI, Body Fat, Water, Muscle, Bone Mass, BMR, AMR, 12 User Memory Mode, Bluetooth 4.0 Digital Scale With Smart App, FDA Certified",Home & Kitchen > Bath > Bathroom Accessories > Scales
590,537,Digital Glass Bathroom Scale Black - Holds up to 400 lbs. 14 inches wide platform - By Utopia Scales,Home & Kitchen > Bath > Bathroom Accessories > Scales
591,537,"AMERICAN WEIGH SCALES Talking Bathroom Scale, Black",Home & Kitchen > Bath > Bathroom Accessories > Scales
592,537,"Smart Weigh 400lb / 180kg Electronic Bathroom Scale with Tempered Glass Balance Platform and Advanced Step-On Technology, Digital Weight Scale has Large Easy Read Backlit LCD Display",Home & Kitchen > Bath > Bathroom Accessories > Scales
593,537,EatSmart Precision 550 Extra Wide Digital Bath Scale w/ 550 LB Capacity Stainless Steel,Home & Kitchen > Bath > Bathroom Accessories > Scales
594,537,EatSmart Precision Digital Bathroom Scale Silver,Home & Kitchen > Bath > Bathroom Accessories > Scales
595,537,Withings Body Composition WiFi Smart Scale Black,Home & Kitchen > Bath > Bathroom Accessories > Scales
596,537,American Weigh Scales LowProfile Digital Bathroom Scale Black,Home & Kitchen > Bath > Bathroom Accessories > Scales
597,537,EatSmart Products Precision Digital Bathroom Scale with Extra Large Backlit 3.5 Inch Display - 1 ea,Home & Kitchen > Bath > Bathroom Accessories > Scales
598,537,American Weigh Scales Digital Bathroom Scale - 330ECO,Home & Kitchen > Bath > Bathroom Accessories > Scales
599,537,"Weight Gurus Smartphone Connected Digital Bathroom Scale, Large Backlit LCD and Weightless Technology",Home & Kitchen > Bath > Bathroom Accessories > Scales
600,537,Withings Wireless Bluetooth Scale White NO SIZE,Home & Kitchen > Bath > Bathroom Accessories > Scales
601,537,Fitbit Aria Wi-Fi Smart Bathroom Scale - White White,Home & Kitchen > Bath > Bathroom Accessories > Scales
602,537,Fitbit Aria Wi-Fi Smart Scale in Black Black,Home & Kitchen > Bath > Bathroom Accessories > Scales
603,537,Withings Smart Body Analyzer Bathroom Scale in White WHITE SCALE,Home & Kitchen > Bath > Bathroom Accessories > Scales
604,537,Accuweight Digital Glass Bathroom Scale CLEAR SCALE,Home & Kitchen > Bath > Bathroom Accessories > Scales
605,537,Beurer Body Analysis Bathroom Scale Stainless Steel,Home & Kitchen > Bath > Bathroom Accessories > Scales
606,537,Withings Digital Body™ Scale in Black with Wi-Fi Connectivity BLACK SCALE,Home & Kitchen > Bath > Bathroom Accessories > Scales
607,537,Taylor Glass Digital Bath Scale,Home & Kitchen > Bath > Bathroom Accessories > Scales
608,537,Stainless Digital Bath Scale,Home & Kitchen > Bath > Bathroom Accessories > Scales
