,category_id,description,category_path
0,537,"Balancefrom High Accuracy Plus Digital Bathroom Scale with Backlight LCD and Step-On Technology, Black",Home & Kitchen > Bath > Bathroom Accessories > Scales
1,537,"GoWISE USA Slim Digital Bathroom Scale - Measures Weight, Body Fat, Water, & Bone Mass 400 Lbs Capacity Tempered",Home & Kitchen > Bath > Bathroom Accessories > Scales
2,537,Newline Step-on Auto Display Digital Bathroom Scale,Home & Kitchen > Bath > Bathroom Accessories > Scales
3,537,"MIRA Digital Bathroom Scale with Handle , Large Display, 400 lb capacity",Home & Kitchen > Bath > Bathroom Accessories > Scales
4,537,"Famili FM272BT Digital Bathroom Body Weight Scale 400lbs/180kg, Golden",Home & Kitchen > Bath > Bathroom Accessories > Scales
5,537,Smart Weigh 400lb / 180kg Electronic Bathroom Scale with Sleek Tempered Glass,Home & Kitchen > Bath > Bathroom Accessories > Scales
6,537,Utopia Scales USJK-B01-3,Home & Kitchen > Bath > Bathroom Accessories > Scales
7,537,"Ozeri ZB19 Rev Digital Bathroom Scale with Electro-Mechanical Weight Dial, Black",Home & Kitchen > Bath > Bathroom Accessories > Scales
8,537,"Mosiso® High Accuracy Digital Bathroom Scale with 4.3"" Blue Backlight Display and ""Smart Step-On"" Technology [NEWEST VERSION] (Black)",Home & Kitchen > Bath > Bathroom Accessories > Scales
9,537,"Smart Weigh Body Fat Digital Precision Scale with Tempered Glass Platform, Eight User Recognition, and 440 lb",Home & Kitchen > Bath > Bathroom Accessories > Scales
10,537,"VonHaus Body Fat Scales 400lb Weight Capacity, Hydration Monitor, Composition Analyser, Bathroom Scales, Silver",Home & Kitchen > Bath > Bathroom Accessories > Scales
11,537,"EatSmart Precision Premium Digital Bathroom Scale with 3.5"" LCD and ""Step-On"" Technology",Home & Kitchen > Bath > Bathroom Accessories > Scales
12,537,"Digital Bathroom Scale by Trim w/ Extra Large Easy to Read Cool Blue Backlight LCD Display, ""Smart Auto-On"" Technology, and Elegant Round Tempered Gla",Home & Kitchen > Bath > Bathroom Accessories > Scales
13,537,"BalanceFrom High Accuracy Premium Digital Bathroom Scale with 3.6"" Extra Large Dual Color Backlight Display and ""Smart Step-On"" Technology [NEWEST VER",Home & Kitchen > Bath > Bathroom Accessories > Scales
14,537,"WiTscale S200 Bluetooth Smart Digital Bathroom Scale with Large Backlit Display and Step-On Technology for Galaxy S5, iPhone6(support Apple HealthKit)",Home & Kitchen > Bath > Bathroom Accessories > Scales
15,537,MIRA Instant On Digital Bathroom Scale with lighted display,Home & Kitchen > Bath > Bathroom Accessories > Scales
16,537,"EatSmart Precision Digital Bathroom Scale w/ Extra Large Lighted Display, 400 lb. Capacity and ""Step-On"" Technology",Home & Kitchen > Bath > Bathroom Accessories > Scales
17,537,Sleek and Modern Digital Bathroom scale w/ Glass top,Home & Kitchen > Bath > Bathroom Accessories > Scales
18,537,"Weight Gurus Digital Bathroom Weight Scale (Black) Glass, Clean Design, Large Display, & Battery Included",Home & Kitchen > Bath > Bathroom Accessories > Scales
19,537,"Etekcity Modern Digital Body Weight Bathroom Scale, 400lb, Unique Circular Design",Home & Kitchen > Bath > Bathroom Accessories > Scales
20,537,"NewlineNY Auto Step On Digital Bathroom Scale, Black",Home & Kitchen > Bath > Bathroom Accessories > Scales
21,537,"Surpahs Sense-ON Multifunction Digital Bathroom Scale - Body Fat Monitor - Measures Body Weight, BMI, Body Water",Home & Kitchen > Bath > Bathroom Accessories > Scales
22,537,American Weigh Scales Digital Bathroom Scale - GS-150,Home & Kitchen > Bath > Bathroom Accessories > Scales
23,537,Ozeri Touch 440 lbs Total Body Bath Scale,Home & Kitchen > Bath > Bathroom Accessories > Scales
24,537,Digital Bathroom Scale 330 x 0.2LB,Home & Kitchen > Bath > Bathroom Accessories > Scales
25,537,"ARIA SCALE, BLACK",Home & Kitchen > Bath > Bathroom Accessories > Scales
26,537,"Etekcity Digital Body Weight Scale with Step-On Technology, 400 Pounds, Elegant Black",Home & Kitchen > Bath > Bathroom Accessories > Scales
27,537,White Digital Bath Scale,Home & Kitchen > Bath > Bathroom Accessories > Scales
28,537,"Xtech Highly Accurate 440lbs / 200kg / 31.4st Capacity Precision Digital Bathroom Scale with Automatic-on Display Technology and Large 4.2"" Easy-to-re",Home & Kitchen > Bath > Bathroom Accessories > Scales
29,537,"Smart Weigh Precision Digital Vanity / Bathroom Scale, ""Smart Step-On"" Technology, Tempered Glass Platform and",Home & Kitchen > Bath > Bathroom Accessories > Scales
30,537,"FRK Digital Body Weight Bathroom Scale, High accuracy with Extre Large LCD Display, Memory Track and Multi-user Suitable for Family, Smart Step-on Technology",Home & Kitchen > Bath > Bathroom Accessories > Scales
31,537,"1byone Body Fat Scale with Tempered Glass, 180kg/400lb Weight Capacity, 10 Users Auto Recognition, Measures Weight, Body Fat, Water, Muscle, Calorie and BMI, Black",Home & Kitchen > Bath > Bathroom Accessories > Scales
32,537,Ozeri ZB19-W Rev Digital Bathroom Scale with Electro-Mechanical Weight Dial,Home & Kitchen > Bath > Bathroom Accessories > Scales
33,537,"EatSmart Precision Premium Digital Bathroom Scale with 3.5"" LCD and ""Step-On"" Technology New",Home & Kitchen > Bath > Bathroom Accessories > Scales
34,537,"BalanceFrom High Accuracy MemoryTrack Premium Digital Bathroom Scale with ""Smart Step-On"" and MemoryTrack Technology, Extra Large Dual Color Backlight New",Home & Kitchen > Bath > Bathroom Accessories > Scales
35,537,Garmin index Smart Scale - White,Home & Kitchen > Bath > Bathroom Accessories > Scales
36,537,"GoWISE USA Slim Digital Bathroom Scale - Measures Weight, Body Fat, Water, & Bone Mass 400 Lbs Capacity Tempered Glass GW22027",Home & Kitchen > Bath > Bathroom Accessories > Scales
37,537,"BalanceFrom High Accuracy MemoryTrack Premium Digital Bathroom Scale with ""Smart Step-On"" and MemoryTrack Technology, Extra Large Dual Color Backlight",Home & Kitchen > Bath > Bathroom Accessories > Scales
38,537,"EatSmart Precision Digital Bathroom Scale w/ Extra Large Lighted Display, 400 lb. Capacity and ""Step-On"" Technology [2013 VERSION] - 10,000+ Reviews E New",Home & Kitchen > Bath > Bathroom Accessories > Scales
39,537,Modern Bamboo Weighing Body Scale 2014 Product 400lb capacity Digital Blue Backlight LCD screen decor for Bath,Home & Kitchen > Bath > Bathroom Accessories > Scales
40,537,Sunbeam SAB602DQ1-05 Full View Dial Scale,Home & Kitchen > Bath > Bathroom Accessories > Scales
41,537,EatSmart Products Extra Wide Digital Bath Scale with 550 Pound Capacity,Home & Kitchen > Bath > Bathroom Accessories > Scales
42,537,Balance High Accuracy Bathroom Scale with Easy-to-Read Backlit LCD & 5-Year Warranty,Home & Kitchen > Bath > Bathroom Accessories > Scales
43,537,Surpahs Outlook 400 lb/180 kg Precision Digital Bathroom Scale (Black),Home & Kitchen > Bath > Bathroom Accessories > Scales
44,537,"Smart Weigh Smart Memory Bathroom Scale with 8 User Step-On Auto Recognition, Multi-Color Weight Change Detection, Memory Clear Function and Extra Large Backlit LCD Display",Home & Kitchen > Bath > Bathroom Accessories > Scales
45,537,"GDEALER Digital Bathroom Scale 400lb/180kg Body Weight Bathroom Scale, Elegant Black 6mm Tempered Glass, Step-On Technology, High Precision, Extra Large Lighted Display",Home & Kitchen > Bath > Bathroom Accessories > Scales
46,537,"Eatsmart Precision Plus Digital Bathroom Scale with Ultra Wide Platform and Step-on Technology, 440-Pounds New",Home & Kitchen > Bath > Bathroom Accessories > Scales
47,537,NewlineNY Step-on Super Mini Smallest Travel Bathroom Scale with Protection Sleeve: SBB0638SM-BK (Black) + NY-SMS-S001-BG,Home & Kitchen > Bath > Bathroom Accessories > Scales
48,537,"Fitbit Aria Wi-Fi Smart Scale, White",Home & Kitchen > Bath > Bathroom Accessories > Scales
49,537,"BalanceFrom High Accuracy Digital Bathroom Scale with Large Backlight Display and Step-on Technology, 4.3 Inch, Black",Home & Kitchen > Bath > Bathroom Accessories > Scales
50,537,Ozeri Rev Digital Bathroom Scale with Electro-Mechanical Weight Dial,Home & Kitchen > Bath > Bathroom Accessories > Scales
51,537,Smart Weigh Smart Memory Bathroom Scale with 8 User Step-On Auto Recognition,Home & Kitchen > Bath > Bathroom Accessories > Scales
52,537,"Mosiso® High Accuracy Digital Bathroom Scale with 4.3"" Blue Backlight Display",Home & Kitchen > Bath > Bathroom Accessories > Scales
53,537,Pyle Smart Bathroom Body Scale with Bluetooth Wireless Smartphone Tracking,Home & Kitchen > Bath > Bathroom Accessories > Scales
54,537,"Digital Mother and Baby Bathroom Scale with Ultra Wide Platform, Step-on Technology and LCD Display, 400 lb Capacity",Home & Kitchen > Bath > Bathroom Accessories > Scales
55,537,ARIA WIFI SMART SCALE - BLACK,Home & Kitchen > Bath > Bathroom Accessories > Scales
56,537,American Weigh Scales Digital Bathroom Scale - 330LPG,Home & Kitchen > Bath > Bathroom Accessories > Scales
57,537,American Weigh Scales Digital Bathroom Scale - ZT-150-BK,Home & Kitchen > Bath > Bathroom Accessories > Scales
58,537,Kalorik Stainless Steel Digital Bathroom Scale Black NO SIZE,Home & Kitchen > Bath > Bathroom Accessories > Scales
59,537,Fitbit Aria Wi-Fi Smart Bathroom Scale - Black Black NO SIZE,Home & Kitchen > Bath > Bathroom Accessories > Scales
60,537,Ws Touchless Tare Glass Scale,Home & Kitchen > Bath > Bathroom Accessories > Scales
61,537,Escali® Glass Platform Bathroom Scale in Black BLACK SCALE,Home & Kitchen > Bath > Bathroom Accessories > Scales
62,537,Digital Body Analyzer1,Home & Kitchen > Bath > Bathroom Accessories > Scales
63,537,"BalanceFrom High Accuracy Digital Bathroom Scale with 4.3"" Large Backlight Display and Step-on Technology, Silver",Home & Kitchen > Bath > Bathroom Accessories > Scales
64,537,"Smart Weigh SMS500 Digital Bathroom Scale, High Accuracy, Dual Color Weight Change Detection and Smart Step-On Auto Recognition for 8 Users, Silver",Home & Kitchen > Bath > Bathroom Accessories > Scales
65,537,"Utopia Scales USJK-B01-7 Tempered Glass Digital Bathroom Scale with LCD Display (Black), 180kg. Capacity, Perfect for Weight Regulation at Home or In",Home & Kitchen > Bath > Bathroom Accessories > Scales
66,537,"Utopia Scales USJK-B01-1 Tempered Glass Digital Bathroom Scale with LCD Display, 330 lb. Capacity",Home & Kitchen > Bath > Bathroom Accessories > Scales
67,537,"EatSmart Precision Digital Bathroom Scale w/ Extra Large Lighted Display, 400 lb. Capacity and ""Step-On"" Technology [2016 VERSION] - 20,000+ Reviews E",Home & Kitchen > Bath > Bathroom Accessories > Scales
68,537,"Etekcity Digital Stainless Steel Body Weight Bathroom Scale, 400 Pounds, Step-On Technology",Home & Kitchen > Bath > Bathroom Accessories > Scales
69,537,My Weigh XL-440 Talking High Capacity 440 Pound Bathroom Digital Scale,Home & Kitchen > Bath > Bathroom Accessories > Scales
70,537,"Ozeri Precision Digital Bath Scale (400 Lbs Edition), In Tempered Glass With Step-on Activation, White",Home & Kitchen > Bath > Bathroom Accessories > Scales
71,537,"Smart Weigh 400lb / 180kg Electronic Bathroom Scale with Tempered Glass Balance Platform and Advanced Step-On Technology, Digital Weight Scale has Lar",Home & Kitchen > Bath > Bathroom Accessories > Scales
72,537,Pyle Smart Bathroom Body Scale with Bluetooth Wireless Smartphone Tracking for iPhone iPad & Android Devices (Black),Home & Kitchen > Bath > Bathroom Accessories > Scales
73,537,"Ozeri Precision II 440 lbs Digital Bathroom Scale, in Ultra Sturdy Tempered Glass with Blue Xbright LCD and StepOn Activation",Home & Kitchen > Bath > Bathroom Accessories > Scales
74,537,SlimSmart Digital Bathroom Scale - Extra Large Lighted Digital Display Scale - 400lb/225kg Capacity - Track Diet & Weight -Activates Automatically With Smart Step-On Technology,Home & Kitchen > Bath > Bathroom Accessories > Scales
75,537,"eHealthSource GBF-835 Digital Bathroom Scale, 440 Pound, Black",Home & Kitchen > Bath > Bathroom Accessories > Scales
76,537,"60beat Blue Bathroom Scale for iPhone 6, 6 Plus, 5, 5s, 5c, 4s and most iPads",Home & Kitchen > Bath > Bathroom Accessories > Scales
77,537,"Surpahs Shiny Small Lightweight Digital Bathroom Scale w/ BMI Calculation, Auto Identify 4 Users [White]",Home & Kitchen > Bath > Bathroom Accessories > Scales
78,537,NewlineNY Black Mini Bathroom Scale + Travel Slip Case SBB-0718MBK+101BG,Home & Kitchen > Bath > Bathroom Accessories > Scales
79,537,Digital Glass Bathroom Scale 6mm Thick Tempered Glass - Transparent By Utopia Care,Home & Kitchen > Bath > Bathroom Accessories > Scales
80,537,"GoWISE USA Slim Digital Bathroom Scale - Measures Weight, Body Fat, Water, & Bone Mass 400 Lbs Capacity Tempered Glass (Silver 1) New",Home & Kitchen > Bath > Bathroom Accessories > Scales
81,537,"Eatsmart Precision Plus Digital Bathroom Scale with Ultra Wide Platform and Step-on Technology, 440-Pounds Health and Beauty",Home & Kitchen > Bath > Bathroom Accessories > Scales
82,537,My Weigh XL-550 Talking Bathroom Scale,Home & Kitchen > Bath > Bathroom Accessories > Scales
83,537,"Ozeri Precision Digital Bath Scale (400 Lbs Edition), In Tempered Glass With Step-on Activation, Black",Home & Kitchen > Bath > Bathroom Accessories > Scales
84,537,"EatSmart Precision Digital Bathroom Scale w/ Extra Large Lighted Display, 400 Pound Capacity and ""Step-On"" Technology",Home & Kitchen > Bath > Bathroom Accessories > Scales
85,537,"Hippih 400lb / 180kg Electronic Bathroom Scale with Tempered Glass Balance Platform and Advanced Step-On Technology, Digital Weight Scale has Large Easy Read Backlit LCD Display B-001",Home & Kitchen > Bath > Bathroom Accessories > Scales
86,537,"Etekcity? High Precision (0.2lb) 5kg-200kg/11lb-440lb Digital Bathroom Body Fat Scale, Fat, WaterBones, Muscles, Calorie, and BMI Value, ""Smart Step-o",Home & Kitchen > Bath > Bathroom Accessories > Scales
87,537,"Etekcity Digital Body Weight Bathroom Scale, Smart Step-on Function, Reading Lock, Tempered Glass Surface, Batteries Included,11lb/5kg-400lb/180kg",Home & Kitchen > Bath > Bathroom Accessories > Scales
88,537,"EatSmart Precision Digital Bathroom Scale w/ Extra Large Lighted Display, 400",Home & Kitchen > Bath > Bathroom Accessories > Scales
89,537,"Accuweight High Accuracy Premium Digital Body Weight Bathroom Scale, Activates Automatically With Smart Step-On Technology, 400 lbs , Gray",Home & Kitchen > Bath > Bathroom Accessories > Scales
90,537,"Smart Weigh Precision Ultra Slim Digital Bathroom Scale with Instant Step-on technology, Tempered Glass with Black Accents",Home & Kitchen > Bath > Bathroom Accessories > Scales
91,537,"BalanceFrom High Accuracy Digital Bathroom Scale with 4.3"" Large Backlight Display and Step-on Technology, Black",Home & Kitchen > Bath > Bathroom Accessories > Scales
92,537,Fitbit Aria WiFi Smart Scale White,Home & Kitchen > Bath > Bathroom Accessories > Scales
93,537,EatSmart Precision Premium Digital Bathroom Scale in Black,Home & Kitchen > Bath > Bathroom Accessories > Scales
94,537,Peachtree Digital Personal Bathroom Scale Glass,Home & Kitchen > Bath > Bathroom Accessories > Scales
95,537,Kalorik Precision Digital Glass Bathroom Scale,Home & Kitchen > Bath > Bathroom Accessories > Scales
96,537,Weight Gurus® Smartphone Connected Bathroom Scale CLEAR SCALE,Home & Kitchen > Bath > Bathroom Accessories > Scales
97,537,"Weight Watchers® Glass Digital Body Analysis Red LED Bathroom Scale by Conair™ CLEAR 2.5"" X 15""",Home & Kitchen > Bath > Bathroom Accessories > Scales
98,537,Metro Ez Read Dial Bathroom Scale in White WHITE SCALE,Home & Kitchen > Bath > Bathroom Accessories > Scales
99,537,Withings Wireless Body Bathroom Scale in Black BLACK SCALE,Home & Kitchen > Bath > Bathroom Accessories > Scales
100,537,Taylor Digital Glass Scale,Home & Kitchen > Bath > Bathroom Accessories > Scales
101,537,Smart Weigh Tempered Glass Digital Bathroom Scale,Home & Kitchen > Bath > Bathroom Accessories > Scales
102,537,Bathroom Personal Digital Body Weight Scale Safety Glass with LCD 396lb,Home & Kitchen > Bath > Bathroom Accessories > Scales
103,537,"Digital Bathroom Scale by Vive Precision - Best Selling, Accurate Weight Scale - 2 Year Warranty (Silver)",Home & Kitchen > Bath > Bathroom Accessories > Scales
104,537,"Etekcity Digital Body Weight Bathroom Scale: Modern Design, 400 Pounds, Black",Home & Kitchen > Bath > Bathroom Accessories > Scales
105,537,SlimSmart® Digital Bathroom Scale - Extra Large Lighted Digital Display Scale,Home & Kitchen > Bath > Bathroom Accessories > Scales
106,537,"Lumsing Digital Scale Smart Body Analyzer, 10 Users Auto Recognition, Measures Weight, Body Fat, BMI, Water, Muscle and Bone Mass, 180kg/400lb Weight Capacity (Black)",Home & Kitchen > Bath > Bathroom Accessories > Scales
107,537,Digital Glass Bathroom Scale Black - Ultra Slim Tempered Glass - by Utopia Home,Home & Kitchen > Bath > Bathroom Accessories > Scales
108,537,"SmartWay Precision XL Digital Bathroom Scale YES I CAN! Motivation Series w/ Extra Wide 440lb Step-On Platform ""2015 Limited Edition"" (Pink)",Home & Kitchen > Bath > Bathroom Accessories > Scales
109,537,Smart Weigh 400lb/180kg Electronic Bathroom Scale in Tempered Glass with Advanced Step-On Technology (Gold),Home & Kitchen > Bath > Bathroom Accessories > Scales
110,537,Digital Bathroom Scale by Royal - Premium High Precision Accuracy from 150/330lbs - LCD Display,Home & Kitchen > Bath > Bathroom Accessories > Scales
111,537,"Woodsam Ultra Wide Digital Body Weight Bathroom Scale , Tempered Glass, 400lb Capacity Clear",Home & Kitchen > Bath > Bathroom Accessories > Scales
112,537,EatSmart Precision Digital,Home & Kitchen > Bath > Bathroom Accessories > Scales
113,537,"WiTscale S200 Bluetooth Smart Digital Bathroom Scale with Large Backlit Display and Step-On Technology for Galaxy S6, Note5, iPhone6s(support Apple He",Home & Kitchen > Bath > Bathroom Accessories > Scales
114,537,"NewlineNY Auto Step-On Mini Travel Bathroom Scale, SBB0722M-NYWH Off White",Home & Kitchen > Bath > Bathroom Accessories > Scales
115,537,"EatSmart Precision Digital Bathroom Scale w/ Extra Large Lighted Display, 400 lb. Capacity and ""Step-On"" Technology [2014 VERSION] - 10,000+ Reviews E New",Home & Kitchen > Bath > Bathroom Accessories > Scales
116,537,Utopia Scales USJK-B01-1 Tempered Glass Digital Bathroom Scale with LCD Display,Home & Kitchen > Bath > Bathroom Accessories > Scales
117,537,GoWISE USA Electronic Personal Digital Scale w/ Step-On Techonology & Wide Tempered Glass Platform & LCD Display w/ Backlight 400LB Capacity (Brown),Home & Kitchen > Bath > Bathroom Accessories > Scales
118,537,"Surpahs ""Step-ON"" Mini Digital Bathroom Scale, Perfect For Kids and Vacation (White, 400 lb/180 kg)",Home & Kitchen > Bath > Bathroom Accessories > Scales
119,537,"Smart Weigh Contemporary Series Digital Vanity / Bathroom Scale with an Extra Large 4.3"" Backlighted LCD Screen and Tempered Glass Platform",Home & Kitchen > Bath > Bathroom Accessories > Scales
120,537,Digital Glass Bathroom Scale Black - Ultra Slim Tempered Glass - by Utopia Home (Black) (Black),Home & Kitchen > Bath > Bathroom Accessories > Scales
121,537,Smart Weigh Contemporary Series Digital Vanity / Bathroom Scale with an Extra Large Backlighted LCD Screen (White),Home & Kitchen > Bath > Bathroom Accessories > Scales
122,537,"NewlineNY Auto Step On Digital Bathroom Scale, SBB0818 Modern Green",Home & Kitchen > Bath > Bathroom Accessories > Scales
123,537,"Vive Precision Digital Bathroom Scale - Digital Weight Scale for Body Weight & Measuring Weight Loss - Electronic Body Scale, Accurate to .2 LBs - Large, Easy Read Display - (Silver)",Home & Kitchen > Bath > Bathroom Accessories > Scales
124,537,"BalanceFrom High Accuracy Plus Digital Bathroom Scale with 3.6 Inch Large Dual Color Backlight Display and Smart Step-On Technology, Silver Health and Beauty",Home & Kitchen > Bath > Bathroom Accessories > Scales
125,537,Digital Glass Bathroom Scale Ultra Slim Tempered Glass - Clear - by Utopia Home,Home & Kitchen > Bath > Bathroom Accessories > Scales
126,537,"GoWISE USA Slim Digital Bathroom Scale - Measures Weight, Body Fat, Water, & Bone Mass 400 Lbs Capacity Tempered Glass (Black) New",Home & Kitchen > Bath > Bathroom Accessories > Scales
127,537,Peachtree GS-150 Tempered Glass Digital Bathroom Scale with LCD Display and 330-Pound Capacity,Home & Kitchen > Bath > Bathroom Accessories > Scales
128,537,Smart Weigh 400lb/180kg Electronic Bathroom Scale in Tempered Glass with Advanced Step-On Technology (Silver),Home & Kitchen > Bath > Bathroom Accessories > Scales
129,537,"NewlineNY SBB0721M-NYTW Digital Mini Travel Bathroom Scale, Trendy Wave",Home & Kitchen > Bath > Bathroom Accessories > Scales
130,537,"Gurin High Accuracy Digital Bathroom Scale with 4.3"" Display and Step-On Technology",Home & Kitchen > Bath > Bathroom Accessories > Scales
131,537,Weight Gurus Digital Bathroom Scale with Large Backlit LCD and Smartphone Tracking (Black) New,Home & Kitchen > Bath > Bathroom Accessories > Scales
132,537,Bnf Elscale3 Healthsmart Glass Electronic Bathroom Scale,Home & Kitchen > Bath > Bathroom Accessories > Scales
133,537,Ivation Ultra Thin LCD Tempered Glass Digital Bathroom & Gym Scale - Super Accurate HighPrecision Strain Gauge Sensor System - 330-Pound Load Capacity,Home & Kitchen > Bath > Bathroom Accessories > Scales
134,537,"Etekcity® High Precision 400 lb /180 kg Digital Bathroom Scale with ""Smart Step-on"" Technology, Strain Gauge Sensors System, Large Backlight Display,",Home & Kitchen > Bath > Bathroom Accessories > Scales
135,537,"WiTscale S1 Stainless Steel Body Fat Bluetooth Smart Digital Bathroom Scale with Large Backlit Display and Step-On Technology for Galaxy S6, samsung Note5 , iPhone6S(support Apple HealthKit) and iPad Air2",Home & Kitchen > Bath > Bathroom Accessories > Scales
136,537,Fitbit Aria Wi-Fi Smart Scale - White (FB201W),Home & Kitchen > Bath > Bathroom Accessories > Scales
137,537,Ozeri Rev Digital Bathroom Scale with ElectroMechanical Weight Dial,Home & Kitchen > Bath > Bathroom Accessories > Scales
138,537,Taylor Bowflex Body Fat Glass Digital Bathroom Scale Black NO SIZE,Home & Kitchen > Bath > Bathroom Accessories > Scales
139,537,Fitbit Aria WIFI Smart Scale Black,Home & Kitchen > Bath > Bathroom Accessories > Scales
140,537,Fitbit™ Aria Wi-Fi Smart Bathroom Scale in Black BLACK SCALE,Home & Kitchen > Bath > Bathroom Accessories > Scales
141,537,Withings Smart Body Analyzer Bathroom Scale in White White,Home & Kitchen > Bath > Bathroom Accessories > Scales
142,537,Fitbit Aria Wi-Fi Smart Bathroom Scale in Black Black,Home & Kitchen > Bath > Bathroom Accessories > Scales
143,537,Detecto™ Stainless Steel Bathroom Digital Scale STAINLESS STEEL LARGE,Home & Kitchen > Bath > Bathroom Accessories > Scales
144,537,"American Weigh Low Profile White Glass Top Digital Bathroom Scale, 330 X 0.2 lb",Home & Kitchen > Bath > Bathroom Accessories > Scales
145,537,"BalanceFrom High Accuracy Premium Digital Bathroom Scale with 3.6"" Extra Large Dual Color Backlight Display and ""Smart Step-On"" Technology [NEWEST VER Health and Beauty",Home & Kitchen > Bath > Bathroom Accessories > Scales
146,537,"Ozeri Precision II 440 lbs Digital Bathroom Scale, in Ultra Sturdy Tempered Glass with Blue Xbright LCD and StepOn Activation Health and Beauty",Home & Kitchen > Bath > Bathroom Accessories > Scales
147,537,"Smart Weigh DVS150 Digital Vanity/Bathroom Scale with Tempered Glass Platform, Weigh Upto 330-Pound, Black",Home & Kitchen > Bath > Bathroom Accessories > Scales
148,537,"Etekcity® High Precision (0.2lb) 400lb /180kg Digital Bathroom Scale, ""Smart Step-on"" function, Strain Gauge Sensors, Large Backlit Display, Tempered New",Home & Kitchen > Bath > Bathroom Accessories > Scales
149,537,BalanceFrom High Accuracy Touch Multifunction Digital Kitchen Scale with Extra Large Backlight Display [NEWEST VERSION] (Silver),Home & Kitchen > Bath > Bathroom Accessories > Scales
150,537,"NewlineNY Trendy Wave Mini Bathroom Scale + Travel Slip Case, SBB0721M-NYTW + NY-MSS101-BBL",Home & Kitchen > Bath > Bathroom Accessories > Scales
151,537,EatSmart Precision Choice Digital Bathroom Scale,Home & Kitchen > Bath > Bathroom Accessories > Scales
152,537,"Digital Mother and Baby Bathroom Scale with Ultra Wide Platform, Step-on Technology and LCD Display, 330 lb Capacity",Home & Kitchen > Bath > Bathroom Accessories > Scales
153,537,Ozeri Precision II 440 lbs,Home & Kitchen > Bath > Bathroom Accessories > Scales
154,537,"EatSmart Precision Digital Bathroom Scale w/ Extra Large Lighted Display, 400 lb. Capacity and ""Step-On"" Technology [2016 VERSION] - 20,000+ Reviews EatSmart Guaranteed Accurate",Home & Kitchen > Bath > Bathroom Accessories > Scales
155,537,"GoWISE USA Digital Body Fat Scale - FDA Approved - Measures Weight, Body Fat, Water & Bone Mass, 400 lbs Capacity, Tempered Glass (Silver)",Home & Kitchen > Bath > Bathroom Accessories > Scales
156,537,"Omega Ultra Slim Digital Bathroom Scale, 400 lb. Capacity, Sense-On Technology",Home & Kitchen > Bath > Bathroom Accessories > Scales
157,537,"Utopia Scales USJK-B01-1 Tempered Glass Digital Bathroom Scale with LCD Display (Clear), 330 lb. Capacity, Perfect for Weight Regulation at Home or In",Home & Kitchen > Bath > Bathroom Accessories > Scales
158,537,"ZERLA Digital Bathroom Scale - Highly Accurate Digital Scale with Large 4.5"" LCD Display - 400lb Capacity & ""Step-On""Technology & High Quality Tempered Glass",Home & Kitchen > Bath > Bathroom Accessories > Scales
159,537,"Etekcity Digital Body Weight Scale with Step-On Technology, 400 Pounds, Black",Home & Kitchen > Bath > Bathroom Accessories > Scales
160,537,"Ozeri Precision Digital Bath Scale (400 Lbs Edition), In Tempered Glass With Step-on Activation, Black New",Home & Kitchen > Bath > Bathroom Accessories > Scales
161,537,"INSEN Digital Body Weight Scale with Large LED display, White",Home & Kitchen > Bath > Bathroom Accessories > Scales
