,category_id,description,category_path
162,537,Sunbeam SAB602-05 Full View Dial Scale,Home & Kitchen > Bath > Bathroom Accessories > Scales
163,537,"Beets BLU Bluetooth Weight Bathroom Scale with Body Composition. Digital Scale works with Apple iPhone (4S and later), iPad (mini, 3, 4, Air) and Android (4.4 and later)",Home & Kitchen > Bath > Bathroom Accessories > Scales
164,537,My Weigh XL-550 Talking Bathroom Scale New,Home & Kitchen > Bath > Bathroom Accessories > Scales
165,537,"Ozeri Touch 440 lbs Total Body Bath Scale - Measures Weight, Fat, Muscle, Bone",Home & Kitchen > Bath > Bathroom Accessories > Scales
166,537,"60beat BLUE Bathroom scale for iPhone 5, 5S, 5C, 4S most iPads and other Bluetooth Smart devices",Home & Kitchen > Bath > Bathroom Accessories > Scales
167,537,"GoWISE USA Slim Digital Bathroom Scale - Measures Weight, Body Fat, Water, & Bone Mass 400 Lbs Capacity Tempered Glass (Silver) New",Home & Kitchen > Bath > Bathroom Accessories > Scales
168,537,American Weigh Amw-330lpg Low Profile Glass Top Digital Bathroom Scale 330 X 0.2 Pound,Home & Kitchen > Bath > Bathroom Accessories > Scales
169,537,"Ozeri WeightMaster Digital Bathroom Scale, with MICROBANa® Antimicrobial Product Protection",Home & Kitchen > Bath > Bathroom Accessories > Scales
170,537,"Wide Platform Digital Body Weight Bathroom Scale (400 lbs, 4.3 inch LCD) -",Home & Kitchen > Bath > Bathroom Accessories > Scales
171,537,"EatSmart Precision Digital Bathroom Scale w/ Extra Large Lighted Display, 400 lb. Capacity and ""Step-On"" Technology [2015 VERSION] - 20,000+ Reviews EatSmart Guaranteed Accurate",Home & Kitchen > Bath > Bathroom Accessories > Scales
172,537,Fitbit Aria WiFi Smart Scale,Home & Kitchen > Bath > Bathroom Accessories > Scales
173,537,EatSmart Precision Plus Bathroom Scale,Home & Kitchen > Bath > Bathroom Accessories > Scales
174,537,Taylor Soft Step Digital Bathroom Scale Black NO SIZE,Home & Kitchen > Bath > Bathroom Accessories > Scales
175,537,Fitbit Aria Wi-Fi Smart Bathroom Scale White NO SIZE,Home & Kitchen > Bath > Bathroom Accessories > Scales
176,537,Taylor Glass Digital Bathroom Scale MULTI/NONE NO SIZE,Home & Kitchen > Bath > Bathroom Accessories > Scales
177,537,Taylor Clear Glass Digital Bathroom Scale Multi/None NO SIZE,Home & Kitchen > Bath > Bathroom Accessories > Scales
178,537,"Weight Watchers Scale, WW44 Glass Digital Glass/Chrome",Home & Kitchen > Bath > Bathroom Accessories > Scales
179,537,Escali® Body Fat/Water Bathroom Scale GLASS SCALE,Home & Kitchen > Bath > Bathroom Accessories > Scales
180,537,Beurer London Glass Bathroom Scale MULTI ONE-SIZE,Home & Kitchen > Bath > Bathroom Accessories > Scales
181,537,"Famili FM271WCU High Precision Digital Body Weight Bathroom Scale with 400lbs/ 180kg Capacity and Antiskid Wide Platform, Blue",Home & Kitchen > Bath > Bathroom Accessories > Scales
182,537,"Digital Mother and Baby Bathroom Scale with Ultra Wide Platform, Step-on Technology",Home & Kitchen > Bath > Bathroom Accessories > Scales
183,537,Home Inovations Tempered Glass Digital Bathroom Scale with LCD Display-396 Pound Capacity,Home & Kitchen > Bath > Bathroom Accessories > Scales
184,537,"Digital Glass Bathroom Scale - Tempered Glass with LCD Display (Clear), 330 lb. Capacity, Perfect for Weight Regulation at Home or In the Gym, Fits Ea",Home & Kitchen > Bath > Bathroom Accessories > Scales
185,537,Weight Gurus Digital Bathroom Scale with Large Backlit LCD and Smartphone Tracking (Clear) New,Home & Kitchen > Bath > Bathroom Accessories > Scales
186,537,Taylor Bluetooth Body Fat Smart Scale w/ 400 lb Capacity and SmarTrack App,Home & Kitchen > Bath > Bathroom Accessories > Scales
187,537,"Ivation Premium Glass Ultra Thin Bathroom Scale LARGE LCD Display Easy To Read 150kg/330lbs Capacity, Extra Wide",Home & Kitchen > Bath > Bathroom Accessories > Scales
188,537,"Surpahs Dual-S 330 Lb Body Fat Scale, 4 User Recognition, Measures Body Weight",Home & Kitchen > Bath > Bathroom Accessories > Scales
189,537,"Surpahs Sense-ON Multifunction Digital Bathroom Scale, 400 lb - Body Fat Monitor - Measures Body Weight, BMI, Body Water, Muscle & Bone Mass - 8 Users Auto Recognition (Black)",Home & Kitchen > Bath > Bathroom Accessories > Scales
190,537,"BalanceFrom High Accuracy MemoryTrack Plus Digital Bathroom Scale with ""Smart Step-On"" and MemoryTrack Technology, Extra Large Dual Color Backlight Di",Home & Kitchen > Bath > Bathroom Accessories > Scales
191,537,"Etekcity® High Precision (0.2lb) 5kg-500kg/11lb-440lb Digital Bathroom Body Fat Scale, Fat, WaterBones, Muscles, Calorie, and BMI Value, ""Smart Step-",Home & Kitchen > Bath > Bathroom Accessories > Scales
192,537,"BalanceFrom High Accuracy Digital Bathroom Scale with Large Backlight Display and ""Step-On"" Technology [NEWEST VERSION] (Silver)",Home & Kitchen > Bath > Bathroom Accessories > Scales
193,537,Utopia Scales USJK-B01-7 Tempered Glass Digital Bathroom Scale with LCD Display,Home & Kitchen > Bath > Bathroom Accessories > Scales
194,537,"SmartWay Precision XL Digital Bathroom Scale YES I CAN! Motivation Series w/ Extra Wide 440lb Step-On Platform ""2014 Limited Edition"" (Pink)",Home & Kitchen > Bath > Bathroom Accessories > Scales
195,537,Weighmax 440LB Digital Tempered Glass Fitness Bathroom Scale with Step-On Tech,Home & Kitchen > Bath > Bathroom Accessories > Scales
196,537,Weight Gurus Smartphone Connected Digital Bathroom Scale with Large Backlit LCD and Weightless Technology(c) (Silver),Home & Kitchen > Bath > Bathroom Accessories > Scales
197,537,Etekcity Etekfit 11lb-400lb Digital Bathroom Bluetooth Body Fat Weight Scale,Home & Kitchen > Bath > Bathroom Accessories > Scales
198,537,"GoWISE USA Slim Digital Bathroom Scale, Black",Home & Kitchen > Bath > Bathroom Accessories > Scales
199,537,"GoWISE USA Slim Digital Bathroom Scale - Measures Weight, Body Fat, Water, & Bone Mass 400 Lbs Capacity Tempered Glass (Black)",Home & Kitchen > Bath > Bathroom Accessories > Scales
200,537,"Accuweight Digital Body Weight Bathroom Scale, 400lb/180kg, Gray",Home & Kitchen > Bath > Bathroom Accessories > Scales
201,537,"Wide Platform Digital Body Weight Bathroom Scale (400 lbs, 4.3 inch LCD) - Black",Home & Kitchen > Bath > Bathroom Accessories > Scales
202,537,Smart Weigh Precision,Home & Kitchen > Bath > Bathroom Accessories > Scales
203,537,"VonHaus Body Fat Scale - Body Composition Analyser, Hydration Monitor, 400lb Weight Capacity, Silver/Glass Bathroom Weight Scales",Home & Kitchen > Bath > Bathroom Accessories > Scales
204,537,"Etekcity Digital Body Weight Bathroom Scale w/ Step-On Technology, 400 Pounds, Black",Home & Kitchen > Bath > Bathroom Accessories > Scales
205,537,Fitbit Aria Wi-Fi Smart Scale; Color: White,Home & Kitchen > Bath > Bathroom Accessories > Scales
206,537,Etekcity Digital Bath Bathroom Body Weight Scale Tempered Glass up to 400 PoundsWhite,Home & Kitchen > Bath > Bathroom Accessories > Scales
207,537,Digital Glass Bathroom Scale with SuperBrite? Red,Home & Kitchen > Bath > Bathroom Accessories > Scales
208,537,Weight Watchers® Glass & Satin Nickel Body Analysis Bathroom Scale by Conair™ BRUSHED NICKEL SCALE,Home & Kitchen > Bath > Bathroom Accessories > Scales
209,537,HoMedics® 531 HealthStation® Body Fat Bathroom Scale SILVER SCALE,Home & Kitchen > Bath > Bathroom Accessories > Scales
210,537,Escali® Glass Platform Bathroom Scale in Silver SILVER SCALE,Home & Kitchen > Bath > Bathroom Accessories > Scales
211,537,FitbitT Aria Wi-Fi Smart Bathroom Scale in Black Black,Home & Kitchen > Bath > Bathroom Accessories > Scales
212,537,"Smart Weigh Precision Ultra Slim Digital Bathroom Scale with Instant Step-on technology, Tempered Glass with Black",Home & Kitchen > Bath > Bathroom Accessories > Scales
213,537,Digital Glass Bathroom Scale Black - Ultra Slim Tempered Glass - by Utopia Home (Black),Home & Kitchen > Bath > Bathroom Accessories > Scales
214,537,Weight Gurus Digital Bathroom Scale with Large Backlit LCD and Smartphone Tracking (Black) Health and Beauty,Home & Kitchen > Bath > Bathroom Accessories > Scales
215,537,Camry High Accuracy Digital Kitchen Food Scale Mixing Bowl 2.15l Liquid Volume Room Temperature and Timer Backlight,Home & Kitchen > Bath > Bathroom Accessories > Scales
216,537,"GoWISE USA Slim Digital Bathroom Scale - Measures Weight, Body Fat, Water, & Bone Mass 400 Lbs Capacity Tempered Glass GW22026",Home & Kitchen > Bath > Bathroom Accessories > Scales
217,537,"SmartWay Precision XL Digital Bathroom Scale YES I CAN! Motivation Series w/ Extra Wide 440lb Step-On Platform ""2014 Limited Edition"" (Black)",Home & Kitchen > Bath > Bathroom Accessories > Scales
218,537,"EatSmart Precision Digital Bathroom Scale w/ Extra Large Lighted Display, 400 lb. Capacity and ""Step-On"" Technology [2013 VERSION] - 10,000+ Reviews E",Home & Kitchen > Bath > Bathroom Accessories > Scales
219,537,"Utopia Scales USJK-B01-7 Tempered Glass Digital Bathroom Scale with LCD Display (Black), 396 lb. Capacity, Perfect for Weight Regulation at Home or In",Home & Kitchen > Bath > Bathroom Accessories > Scales
220,537,WiTscale S220 Body Fat Bluetooth Smart High Precision Digital Bathroom Scale with Large Backlit Display and Step-On Technology for iPhone6 with seamless data exporting to Apple HealthKit,Home & Kitchen > Bath > Bathroom Accessories > Scales
221,537,"Etekcitya® High Precision (0.2lb) 400lb /180kg Digital Bathroom Scale, ""Smart Step-on"" function, Strain Gauge Sensors, Large Backlit Display, Tempered",Home & Kitchen > Bath > Bathroom Accessories > Scales
222,537,"BalanceFrom High Accuracy Stainless Digital Luggage Postal Scale, 110 lb Capacity",Home & Kitchen > Bath > Bathroom Accessories > Scales
223,537,Digital Bathroom Scale by Royal - Premium High Precision Accuracy from 11-400lbs - LCD Display,Home & Kitchen > Bath > Bathroom Accessories > Scales
224,537,Scaleit Digital Bathroom Scale - LCD Display with Backlight - Black Tempered Glass - 400 LB Capacity,Home & Kitchen > Bath > Bathroom Accessories > Scales
225,537,"1byone Digital Smart Scale Body Scale Bathroom Scale Wireless Body Fat Scale with IOS and Android App to Manage Body weight, Body Fat, Water, Muscle Mass, BMI, BMR, Bone Mass and Visceral Fat, White",Home & Kitchen > Bath > Bathroom Accessories > Scales
226,537,"Utopia Scales USJK-W01 Ultra Wide Platform Digital Bathroom Scale with 4.3 inch LCD Display, 400 lbs. Capacity, Tempered Glass, Perfect for Weight Reg",Home & Kitchen > Bath > Bathroom Accessories > Scales
227,537,Accuweight Digital Bathroom Weight Scale with 400lb/180kg Body Weighing Scale,Home & Kitchen > Bath > Bathroom Accessories > Scales
228,537,"MIRA Bluetooth Bathroom Scale with SmartPhone and Tablet tracking (works with iPhone, iPad and Android)",Home & Kitchen > Bath > Bathroom Accessories > Scales
229,537,"EatSmart Precision Digital Bathroom Scale with Extra Large Lighted Display, 400 Pound",Home & Kitchen > Bath > Bathroom Accessories > Scales
230,537,Smart Weigh 400lb / 180kg Electronic Bathroom Scale with Tempered Glass Balance,Home & Kitchen > Bath > Bathroom Accessories > Scales
231,537,"Etekcity Digital Body Weight Scale, Tempered glass, 400 Pounds",Home & Kitchen > Bath > Bathroom Accessories > Scales
232,537,"Utopia Scales USJK-B01-3 Digital Bathroom Scale with LCD Display (Clear), 330 lb. Capacity, Perfect for Weight Regulation at Home or In the Gym, Fits",Home & Kitchen > Bath > Bathroom Accessories > Scales
233,537,Weight Gurus Smartphone Connected Digital Bathroom Scale with Large Backlit LCD and Weightless Technology(c) (Black) New,Home & Kitchen > Bath > Bathroom Accessories > Scales
234,537,"Etekcity High Precision 11lb-400lb Digital Body Weight Bathroom Scale, Black",Home & Kitchen > Bath > Bathroom Accessories > Scales
235,537,Utopai Home Digital Glass Bathroom Scale with Thick Tempered Glass (White),Home & Kitchen > Bath > Bathroom Accessories > Scales
236,537,"Digital Bathroom Scale by VIVE - Best Selling, Accurate Weight Scale - 2 Year Warranty (Silver)",Home & Kitchen > Bath > Bathroom Accessories > Scales
237,537,"Etekcity Modern Digital Body Weight Bathroom Scale, Curvy Sleek Design,400 Pounds",Home & Kitchen > Bath > Bathroom Accessories > Scales
238,537,Hippih Digital Body Weight Bathroom Scale with 400 lb Weight Capacity Measures Weight Easy-to-Read Back light LCD Glass AAA 009 (Silver),Home & Kitchen > Bath > Bathroom Accessories > Scales
239,537,"Fitbit Aria Wi-Fi Smart Scale, White Sports",Home & Kitchen > Bath > Bathroom Accessories > Scales
240,537,Weight Gurus Digital Bathroom Scale with Large Backlit LCD and Smartphone Tracking,Home & Kitchen > Bath > Bathroom Accessories > Scales
241,537,"Personal Digital Bathroom Scale with Extra Large Backlit 4.0"" Display and ""Step-On"" Technology (SILVER)",Home & Kitchen > Bath > Bathroom Accessories > Scales
242,537,"Etekcity Stainless Steel Digital Body Weight Bathroom Scale, 400 Pounds, Step-On Technology",Home & Kitchen > Bath > Bathroom Accessories > Scales
243,537,"Smart Weigh Precision Digital Vanity Bathroom Scale, Silver",Home & Kitchen > Bath > Bathroom Accessories > Scales
244,537,"Etekcity Digital Body Weight Bathroom Scale, 400lb/180kg, White",Home & Kitchen > Bath > Bathroom Accessories > Scales
245,537,"VonHaus Digital Bathroom Scale: Glass/Silver Body Weight Scale w/ LCD Display, 400lbs/180kg Capacity",Home & Kitchen > Bath > Bathroom Accessories > Scales
246,537,"Weight Gurus Bluetooth Smart Connected Body Fat Scale with Large Backlit LCD, by Greater Goods (Black)",Home & Kitchen > Bath > Bathroom Accessories > Scales
247,537,Garmin Index Smart Scale Black,Home & Kitchen > Bath > Bathroom Accessories > Scales
248,537,EatSmart Precision MaxView Digital Bathroom Scale ClearGray,Home & Kitchen > Bath > Bathroom Accessories > Scales
249,537,American Weigh Scales LowProfile Digital Bathroom Scale ClearSilver,Home & Kitchen > Bath > Bathroom Accessories > Scales
250,537,EatSmart Precision GetFit Digital BodyFat Scale Black,Home & Kitchen > Bath > Bathroom Accessories > Scales
251,537,Smart Weigh Precision Digital Vanity/ Bathroom Scale,Home & Kitchen > Bath > Bathroom Accessories > Scales
252,537,Fitbit Aria WiFi Smart Scale /Black,Home & Kitchen > Bath > Bathroom Accessories > Scales
253,537,Peachtree Digital Personal Bathroom Scale 7447025 Glass,Home & Kitchen > Bath > Bathroom Accessories > Scales
254,537,Fitbit Aria Wi-Fi Smart Scale White,Home & Kitchen > Bath > Bathroom Accessories > Scales
255,537,Conair® Thinner™ Portable Digital Bathroom Scale BLACK/SILVER SCALE,Home & Kitchen > Bath > Bathroom Accessories > Scales
256,537,Fitbit Aria Wi-Fi Weight/Body Fat/BMI Digital Smart Scale - Black Black,Home & Kitchen > Bath > Bathroom Accessories > Scales
257,537,"Digital Bathroom Scale, GDEALER 400lb/180kg Body Weight Bathroom Scale, Elegant",Home & Kitchen > Bath > Bathroom Accessories > Scales
258,537,RENPHO Digital Bathroom Scale 400lb/180kg High Accuracy with Elegant Marble Pattern [2016 New Release],Home & Kitchen > Bath > Bathroom Accessories > Scales
259,537,"BalanceFrom BHFA-B400BT High Accuracy Digital Bathroom Scale with 4.3"" Display and Step-On Technology Newest Version, Black",Home & Kitchen > Bath > Bathroom Accessories > Scales
260,537,"EatSmart Precision Digital Bathroom Scale w/ Extra Large Lighted Display, 400 lb. Capacity and ""Step-On"" Technology [2013 VERSION] - 10,000+ Reviews E Health and Beauty",Home & Kitchen > Bath > Bathroom Accessories > Scales
261,537,Digital Glass Bathroom Scale Black - 6mm Thick Tempered Glass By Utopia Scales,Home & Kitchen > Bath > Bathroom Accessories > Scales
262,537,"EatSmart Precision Digital Bathroom Scale with Extra Large Lighted Display & 400 Pound Capacity, 4.66 Pound",Home & Kitchen > Bath > Bathroom Accessories > Scales
263,537,"Etekcity Digital Body Weight Scale, Tempered glass, 400 Pounds (Certified Refurbished)",Home & Kitchen > Bath > Bathroom Accessories > Scales
264,537,"Etekcity Digital Body Weight Bathroom Scale, 506 Pounds, Large 4.3 Inch Backlit LCD Display",Home & Kitchen > Bath > Bathroom Accessories > Scales
265,537,"BalanceFrom High Accuracy Digital Bathroom Scale with 4.3"" Extra Large Cool Blue Backlight Display and ""Smart Step-On"" Technology [NEWEST VERSION]",Home & Kitchen > Bath > Bathroom Accessories > Scales
266,537,"GoWISE USA Slim Digital Bathroom Scale - Measures Weight, Body Fat, Water, & Bone Mass 400 Lbs Capacity Tempered Glass (Black) Health and Beauty",Home & Kitchen > Bath > Bathroom Accessories > Scales
267,537,"INSEN Precision Digital Body Fat Bathroom Scale, with Large LCD displayer, Smart Step-on Technology, Measures",Home & Kitchen > Bath > Bathroom Accessories > Scales
268,537,"EatSmart Precision Digital Bathroom Scale w/ Extra Large Lighted Display, 400 lb. Capacity and ""Step-On"" Technology [2014 VERSION] - 10,000+ Reviews E Health and Beauty",Home & Kitchen > Bath > Bathroom Accessories > Scales
269,537,"FRK Digital Body Weight Bathroom Scale, High accuracy with Tempered Glass Platform, Smart Step-on Technology, Batteries Included",Home & Kitchen > Bath > Bathroom Accessories > Scales
270,537,EatSmart Precision GetFit,Home & Kitchen > Bath > Bathroom Accessories > Scales
271,537,"Fitbit Aria Wi-Fi Smart Scale, Black Sports",Home & Kitchen > Bath > Bathroom Accessories > Scales
272,537,Digital Glass Bathroom Scale - By Utopia Scales,Home & Kitchen > Bath > Bathroom Accessories > Scales
273,537,"EatSmart Precision Digital Bathroom Scale w/ Extra Large Lighted Display, 400 lb. Capacity and ""Step-On"" Technology [2014 VERSION] - 10,000+ Reviews E",Home & Kitchen > Bath > Bathroom Accessories > Scales
274,537,"Famili Accurate Digital Bathroom Boday Weight Scale 400lbs/180kg FM272BT, Golden",Home & Kitchen > Bath > Bathroom Accessories > Scales
275,537,Balance High Accuracy Bathroom Scale with Easy-to-Read Backlit LCD and 5-Year Warranty,Home & Kitchen > Bath > Bathroom Accessories > Scales
276,537,"Surpahs Sense-ON Multifunction Digital Bathroom Scale, 400 lb - Body Fat Monitor",Home & Kitchen > Bath > Bathroom Accessories > Scales
277,537,Ozeri Precision Digital,Home & Kitchen > Bath > Bathroom Accessories > Scales
278,537,Garmin index Smart Scale - Black,Home & Kitchen > Bath > Bathroom Accessories > Scales
279,537,MIRA Digital Bathroom Scale,Home & Kitchen > Bath > Bathroom Accessories > Scales
280,537,"Etekcity High Precision (0.2lb) 400lb /180kg Digital Bathroom Scale, CE/FCC/ROHS Approved, Smart Step-on Function, Strain Gauge Sensors, Large Backlit",Home & Kitchen > Bath > Bathroom Accessories > Scales
281,537,"Ozeri WeightMaster Digital Bathroom Scale, with MICROBAN® Antimicrobial Product Protection",Home & Kitchen > Bath > Bathroom Accessories > Scales
282,537,"VonHaus Body Fat Scale - BMI Weight Scale with Body Composition Analyser, Hydration Monitor, 400lb Weight Capacity, Silver/Glass Bathroom Weight Scale",Home & Kitchen > Bath > Bathroom Accessories > Scales
283,537,Escali High-Capacity Bathroom Scale with Body Fat/Body Water Monitoring (440lb / 200kg),Home & Kitchen > Bath > Bathroom Accessories > Scales
284,537,"Etekcity Stainless Steel Digital Body Weight Bathroom Scale, Step-On Technology, 400 Pounds",Home & Kitchen > Bath > Bathroom Accessories > Scales
285,537,Bluetooth Bathroom Scales eHealthSource,Home & Kitchen > Bath > Bathroom Accessories > Scales
286,537,Fitbit Aria Wi-Fi Smart Scale; Color: Black,Home & Kitchen > Bath > Bathroom Accessories > Scales
287,537,"Taylor Tempered Glass Bath Scale, Silver",Home & Kitchen > Bath > Bathroom Accessories > Scales
288,537,Escali Glass Body Fat and Body Water Digital Bathroom Scale Multi/None SCALE,Home & Kitchen > Bath > Bathroom Accessories > Scales
289,537,Taylor Glass Digital Bathroom Scale Black NO SIZE,Home & Kitchen > Bath > Bathroom Accessories > Scales
290,537,Fitbit Aria Wi-Fi Smart Scale Black,Home & Kitchen > Bath > Bathroom Accessories > Scales
291,537,Escali® Glass Platform Bathroom Scale in Peacock Blue BLUE SCALE,Home & Kitchen > Bath > Bathroom Accessories > Scales
292,537,Digital Glass Bathroom Scale,Home & Kitchen > Bath > Bathroom Accessories > Scales
293,537,"Surpahs Sense-ON Multifunction Digital Bathroom Scale, 400 lb - Body Fat Monitor - Measures Body Weight, BMI, Body Water, Muscle & Bone Mass - 8 Users Auto Recognition (White)",Home & Kitchen > Bath > Bathroom Accessories > Scales
294,537,"Etekcity Digital Body Fat Weight BMI Bathroom Scale, BIA Technology, 400lb/180kg",Home & Kitchen > Bath > Bathroom Accessories > Scales
295,537,"Surpahs Sense-ON Multifunction Digital Bathroom Scale - Body Fat Monitor - Measures Body Weight, BMI, Body Water, Muscle & Bone Mass - 8 Users Auto Re New",Home & Kitchen > Bath > Bathroom Accessories > Scales
296,537,"EatSmart Precision Digital Bathroom Scale w/ Extra Large Lighted Display, 400 lb. Capacity and ""Step-On"" Technology [2016 VERSION] - 12,000+ Reviews E",Home & Kitchen > Bath > Bathroom Accessories > Scales
297,537,"Home Basics Glass Bathroom Scale, 2.5-Inch LCD",Home & Kitchen > Bath > Bathroom Accessories > Scales
298,537,EatSmart Precision Tracker Digital Bathroom Scale w/ 400 lb. Capacity and EatSmart AccuTrack Software New,Home & Kitchen > Bath > Bathroom Accessories > Scales
299,537,Fitbit Aria Wi-Fi Smart,Home & Kitchen > Bath > Bathroom Accessories > Scales
300,537,"Etekcity® High Precision (0.2lb) 5kg-200kg/11lb-440lb Digital Bathroom Body Fat Scale, Fat, WaterBones, Muscles, Calorie, and BMI Value, ""Smart Step-",Home & Kitchen > Bath > Bathroom Accessories > Scales
301,537,BalanceFrom High Accuracy Plus Digital Bathroom Scale with Backlight LCD and Step-On Technology (Silver),Home & Kitchen > Bath > Bathroom Accessories > Scales
302,537,"Smart Weigh Smart Tare Digital Body Weight Bathroom Scale with Baby or Pet Tare Weighing Technology, Large LCD Display and Tempered Glass Platform, 440lbs/200kg Capacity (Black)",Home & Kitchen > Bath > Bathroom Accessories > Scales
303,537,Smart Weigh Smart Tare Digital Body Weight Bathroom Scale with Baby or Pet,Home & Kitchen > Bath > Bathroom Accessories > Scales
304,537,"DecoBros Precision Plus Digital Bathroom Scale with Ultra Wide Platform and Extra Large LCD Display, Step-On Startup, 400 Pounds",Home & Kitchen > Bath > Bathroom Accessories > Scales
305,537,"VonHaus Body Fat Scale - Body Composition Analyser, Hydration Monitor, 400lb Weight Capacity, Silver/Glass Bathroom BMI Weight Scales",Home & Kitchen > Bath > Bathroom Accessories > Scales
306,537,"GoWISE USA Slim Digital Bathroom Scale - Measures Weight, Body Fat, Water, & Bone Mass 400 Lbs Capacity Tempered Glass (Silver 1)",Home & Kitchen > Bath > Bathroom Accessories > Scales
307,537,BalanceFrom High Accuracy Plus Digital Bathroom Scale with Backlight LCD and Step-On Technology (Silver) New,Home & Kitchen > Bath > Bathroom Accessories > Scales
308,537,"Smart Weigh Precision Body Composition Analyzer and Digital Bathroom Scale, 440 lb / 200kg Capacity, Measures Weight, BMI, Body Fat, Water, Muscle and Bone Mass, in Silver",Home & Kitchen > Bath > Bathroom Accessories > Scales
309,537,Digital Glass Bathroom Scale Black - Holds up to 396 lbs by Utopia Scales,Home & Kitchen > Bath > Bathroom Accessories > Scales
310,537,"BalanceFrom BFHA-B400ST High Accuracy Digital Bathroom Scale with 4.3"" Display and Step-On Technology Newest Version, Silver",Home & Kitchen > Bath > Bathroom Accessories > Scales
311,537,"Etekcity Etekfit Digital Bathroom Bluetooth Body Fat Weight Scale, 1-Year Warranty, FCC/CE/ROHS Approved, Measures Weight, Body Fat, Water Percentage,",Home & Kitchen > Bath > Bathroom Accessories > Scales
312,537,"Ozeri Precision II 440 lbs Digital Bathroom Scale, in Ultra Sturdy Tempered Glass with Blue Xbright LCD and StepOn Activation New",Home & Kitchen > Bath > Bathroom Accessories > Scales
313,537,"BalanceFrom High Accuracy Digital Bathroom Scale with 4.3"" Extra Large Cool Blue Backlight Display and ""Smart Step-On"" Technology [NEWEST VERSION] (Si Health and Beauty",Home & Kitchen > Bath > Bathroom Accessories > Scales
314,537,"Etekcity Digital Body Weight Bathroom Scale, High Precision, 400lb /180kg, Black/Silver",Home & Kitchen > Bath > Bathroom Accessories > Scales
315,537,iDoo Precision Digital Bathroom Scale 440lb/200kg with Jumbo Steady Platform,Home & Kitchen > Bath > Bathroom Accessories > Scales
316,537,"GoWISE USA Body Fat Scale with FDA approved- Measures Weight, Body Fat, Water, & Bone Mass 400 Lbs Capacity Tempered Glass (Black)",Home & Kitchen > Bath > Bathroom Accessories > Scales
317,537,"Etekcity Digital Body Weight Scale with Body Measuring Tape, 400 Pounds",Home & Kitchen > Bath > Bathroom Accessories > Scales
318,537,Fitbit Aria WiFi Smart Scale Black,Home & Kitchen > Bath > Bathroom Accessories > Scales
319,537,American Weigh Scales Digital Bathroom Scale - OM-200,Home & Kitchen > Bath > Bathroom Accessories > Scales
320,537,Fitbit Aria WiFi Smart Scale /White,Home & Kitchen > Bath > Bathroom Accessories > Scales
321,537,Digital Glass Bathroom Scale with SuperBrite™ Red LED Readout,Home & Kitchen > Bath > Bathroom Accessories > Scales
322,537,Soehnle Solar Digital Bathroom Scale BLACK SCALE,Home & Kitchen > Bath > Bathroom Accessories > Scales
323,537,HoMedicsi¿½ Glass Digital Bathroom Scale 405 Glass,Home & Kitchen > Bath > Bathroom Accessories > Scales
324,537,Detecto™ Wide Body Platform Glass Digital Bathroom Scale SILVER SCALE,Home & Kitchen > Bath > Bathroom Accessories > Scales
325,537,"HoMedics® Carbon Fiber Glass Bathroom Scale BLACK 13"" X 13""",Home & Kitchen > Bath > Bathroom Accessories > Scales
326,537,"Etekcity Digital Body Weight Bathroom Scale, 400lb/180kg, Black (Certified Refurbished)",Home & Kitchen > Bath > Bathroom Accessories > Scales
327,537,"BalanceFrom High Accuracy Plus Digital Bathroom Scale with 3.6"" Extra Large Dual Color Backlight Display and ""Smart Step-On"" Technology [NEWEST VERSIO",Home & Kitchen > Bath > Bathroom Accessories > Scales
