,category_id,description,category_path
328,537,"EPAuto Precision Digital Bathroom Body Weight Scale, Black",Home & Kitchen > Bath > Bathroom Accessories > Scales
329,537,"Smart Weigh 400lb / 180kg Electronic Bathroom Scale with Sleek Tempered Glass Platform, Advanced Step-On Technology and Large Easy Read Backlit LCD Display (Silver)",Home & Kitchen > Bath > Bathroom Accessories > Scales
330,537,"BalanceFrom C400SV High Accuracy Premium Digital Bathroom Scale with 3.6""/X-Large Backlight Display",Home & Kitchen > Bath > Bathroom Accessories > Scales
331,537,"VonHaus Body Fat Scales 400lb Weight Capacity, Hydration Monitor, Composition Analyser, Bathroom Scales",Home & Kitchen > Bath > Bathroom Accessories > Scales
332,537,"EatSmart Precision Digital Bathroom Scale w/ Extra Large Lighted Display, 400 lb. Capacity and ""Step-On"" Technology [2013 VERSION] - 10,000+ Reviews E Kitchen",Home & Kitchen > Bath > Bathroom Accessories > Scales
333,537,"TaoTronics Smart Digital Scale Bathroom Scale, Measures Weight, BMI, Body Fat",Home & Kitchen > Bath > Bathroom Accessories > Scales
334,537,"eHealthSourceDigital Bathroom Scale, 400 Pound, (Step on Activation)",Home & Kitchen > Bath > Bathroom Accessories > Scales
335,537,Sleek and Modern Glass Digital Bathroom Scale,Home & Kitchen > Bath > Bathroom Accessories > Scales
336,537,"Digital Bathroom Scale by Vive Precision - Best Selling, Accurate Weight Scale - 2 Year Warranty (Black)",Home & Kitchen > Bath > Bathroom Accessories > Scales
337,537,"HealthPro EBW-400 Electronic Bathroom Scale with 4.3"" Blue Backlit LCD & ""Step-On"" Technology",Home & Kitchen > Bath > Bathroom Accessories > Scales
338,537,"BalanceFrom High Accuracy Premium Digital Bathroom Scale with 3.6"" Extra Large Dual Color Backlight Display and ""Smart Step-On"" Technology [NEWEST VER New",Home & Kitchen > Bath > Bathroom Accessories > Scales
339,537,"BalanceFrom High Accuracy Digital Bathroom Scale with 4.3"" Extra Large Cool Blue Backlight Display and ""Smart Step-On"" Technology [NEWEST VERSION] (Si",Home & Kitchen > Bath > Bathroom Accessories > Scales
340,537,"Etekcity® High Precision (0.2lb) 400lb /180kg Digital Bathroom Scale, ""Smart Step-on"" function, Strain Gauge Sensors, Large Backlit Display, Tempered Health and Beauty",Home & Kitchen > Bath > Bathroom Accessories > Scales
341,537,"Etekcity Digital Body Weight Bathroom Scale with Skid Free Padding, 400 Pounds",Home & Kitchen > Bath > Bathroom Accessories > Scales
342,537,Pyle Smart Bathroom Body Scale with Bluetooth Wireless Smartphone Tracking for iPhone iPad & Android Devices (White),Home & Kitchen > Bath > Bathroom Accessories > Scales
343,537,"Vita Nova V1 Smart Precision Digital Bathroom Body Scale with Large Backlight Display, Smart Step-on Technology and Smartphone Tracking for Iphone/ipad & Android Devices (Blue)",Home & Kitchen > Bath > Bathroom Accessories > Scales
344,537,"NewlineNY Auto Step On Digital Bathroom Scale, SBB0818 White",Home & Kitchen > Bath > Bathroom Accessories > Scales
345,537,Smart Weigh DVS150 Digital Vanity / Bathroom Scale 330lbs x 0.2lbs with Tempered Glass Platform - Black,Home & Kitchen > Bath > Bathroom Accessories > Scales
346,537,Etekcity Etekfit 11lb-400lb Digital Bluetooth Body Fat BMI Weight Bathroom Scale,Home & Kitchen > Bath > Bathroom Accessories > Scales
347,537,"Ozeri Precision Pro II 440 lbs Digital Bathroom Scale, xLarge Tempered Glass Platform with Blue LCD and StepOn Activation",Home & Kitchen > Bath > Bathroom Accessories > Scales
348,537,"Weight Gurus Digital Bathroom Weight Scale (Clear) Glass, Clean Design, Large Display & Battery Included",Home & Kitchen > Bath > Bathroom Accessories > Scales
349,537,Utopai Home Digital Glass Bathroom Scale with Thick Tempered Glass (Transparent),Home & Kitchen > Bath > Bathroom Accessories > Scales
350,537,"BalanceFrom High Accuracy Premium Digital Bathroom Scale with 3.6"" Extra Large Dual Color Backlight Display and ""Smart Step-On"" Technology [NEWEST VERSION] (Blue)",Home & Kitchen > Bath > Bathroom Accessories > Scales
351,537,Ozeri 400 lbs Precision Digital Bath Scale,Home & Kitchen > Bath > Bathroom Accessories > Scales
352,537,Taylor Digital Bathroom Scale gray NO SIZE,Home & Kitchen > Bath > Bathroom Accessories > Scales
353,537,Aria Black - Wi-fi Smart Scale,Home & Kitchen > Bath > Bathroom Accessories > Scales
354,537,Fitbit 'Aria' Wireless Smart Scale White One Size,Home & Kitchen > Bath > Bathroom Accessories > Scales
355,537,Withings Smart Body Analyzer Bathroom Scale in Black BLACK SCALE,Home & Kitchen > Bath > Bathroom Accessories > Scales
356,537,Beurer Glass Body Analysis Bathroom Scale WHITE SCALE,Home & Kitchen > Bath > Bathroom Accessories > Scales
357,537,Withings Wireless Bathroom Scale in White WHITE SCALE,Home & Kitchen > Bath > Bathroom Accessories > Scales
358,537,Fitbit Aria Wi-Fi Smart Scale in White,Home & Kitchen > Bath > Bathroom Accessories > Scales
359,537,Withings Smart Body Analyzer Bathroom Scale in Black Black,Home & Kitchen > Bath > Bathroom Accessories > Scales
360,537,Digital Body Analyzer,Home & Kitchen > Bath > Bathroom Accessories > Scales
361,537,"Etekcity Digital Body Weight Bathroom Scale, 400lb/180kg, Black",Home & Kitchen > Bath > Bathroom Accessories > Scales
362,537,EatSmart Precision Premium,Home & Kitchen > Bath > Bathroom Accessories > Scales
363,537,Weight Watchers WW400GD Digital Glass Scale by Conair,Home & Kitchen > Bath > Bathroom Accessories > Scales
364,537,"EatSmart Precision Body Check Bathroom Scale w/ 400 lb. Capacity, BMI and Step Off Technology (White)",Home & Kitchen > Bath > Bathroom Accessories > Scales
365,537,"VonHaus Digital Bathroom Weight Scale, 180 kg (400 Pound) Capacity, Silver",Home & Kitchen > Bath > Bathroom Accessories > Scales
366,537,"FRK Precision Digital Body Weight Bathroom Scale, High Accuracy with Tempered Glass Platform, Slim Design, Smart Step-on Technology, 2 Year Warranty",Home & Kitchen > Bath > Bathroom Accessories > Scales
367,537,"EatSmart Precision CalPal Digital Bathroom Scale w/ 440 lb. Capacity, BMI and Calorie Intake Analysis",Home & Kitchen > Bath > Bathroom Accessories > Scales
368,537,Weight Gurus Digital Bathroom Scale with Large Backlit LCD and Smartphone Tracking (Black),Home & Kitchen > Bath > Bathroom Accessories > Scales
369,537,Digital Glass Bathroom Scale Black - 6mm Thick Tempered Glass By Utopia Care,Home & Kitchen > Bath > Bathroom Accessories > Scales
370,537,EatSmart Products Precision Choice Digital Bathroom Scale,Home & Kitchen > Bath > Bathroom Accessories > Scales
371,537,Utopia Scales USJK-B01-7,Home & Kitchen > Bath > Bathroom Accessories > Scales
372,537,"WiTscale S200 Bluetooth Digital Bathroom Scale w/ Large Backlit Display and Step-On Technology for iPhone5S, iPhone5C, iPad mini",Home & Kitchen > Bath > Bathroom Accessories > Scales
373,537,"Surpahs Outlook Precision Digital Bathroom Scale (400 lb/180 kg, Black)",Home & Kitchen > Bath > Bathroom Accessories > Scales
374,537,"Fitbit Aria Wi-Fi Smart Scale, Black New",Home & Kitchen > Bath > Bathroom Accessories > Scales
375,537,BalanceFrom High Accuracy Touch Multifunction Digital Kitchen Scale with Extra Large Backlight Display (Silver),Home & Kitchen > Bath > Bathroom Accessories > Scales
376,537,"NewlineNY Smallest Step On Super Mini Travel Bathroom Scale, SBB0638SM-WH Off White",Home & Kitchen > Bath > Bathroom Accessories > Scales
377,537,"FeatherWeigh Precision Digital Bathroom Scale with Extra Large Backlight Display and ""Step-on"" Technology 400lbs (Silver)",Home & Kitchen > Bath > Bathroom Accessories > Scales
378,537,"NewlineNY Step On Comfort Edge Extra Large 4.3"" Cool Blue Backlight Display Bathroom Scale; SBB0868-BK Black",Home & Kitchen > Bath > Bathroom Accessories > Scales
379,537,"Digital Bathroom Scale, GDEALER 400lb/180kg Body Weight Bathroom Scale, Elegant Black 6mm Tempered Glass, Step-On Technology, High Precision, Extra Large Lighted Display",Home & Kitchen > Bath > Bathroom Accessories > Scales
380,537,"INSEN High Accuracy Digital Body Weight Bathroom Scale with Tempered Glass Surface, Sky Blue",Home & Kitchen > Bath > Bathroom Accessories > Scales
381,537,"Etekcity Digital Body Weight Bathroom Scale, 440lb /200kg, 15.4"" x 11.8"" Ultra Wide Platform",Home & Kitchen > Bath > Bathroom Accessories > Scales
382,537,"Hippih 400lb / 180kg Electronic Bathroom Scale with Tempered Glass Balance Platform and Advanced Step-On Technology, Digital Weight Scale has Large Easy Read Backlit LCD Display A-002",Home & Kitchen > Bath > Bathroom Accessories > Scales
383,537,"EatSmart Precision Digital Bathroom Scale w/ Extra Large Lighted Display, 400 lb. Capacity and ""Step-On"" Technology [2013 VERSION] - 10,000+ Reviews EatSmart Guaranteed Accurate",Home & Kitchen > Bath > Bathroom Accessories > Scales
384,537,"Kinzi Precision Digital Bathroom Scale w/ Extra Large Lighted Display, 400 lb. Capacity and ""Step-On"" Technology [2016 VERSION]",Home & Kitchen > Bath > Bathroom Accessories > Scales
385,537,"Smart Weigh Digital Body Fat Weight Scale with Tempered Glass, 440 pounds, Black",Home & Kitchen > Bath > Bathroom Accessories > Scales
386,537,Most Accurate Bathroom Scales - AccuPoint! Easy Step-on Technology; Extra Large 8mm Tempered Glass Platform; Large Lighted Display; 400 lb/180 kg Capacity; Units kg lb st; AAAs Included; FREE BONUS!,Home & Kitchen > Bath > Bathroom Accessories > Scales
387,537,Weight Gurus Smartphone Connected Digital Bathroom Scale with Large Backlit LCD and Weightless Technology(c) (White),Home & Kitchen > Bath > Bathroom Accessories > Scales
388,537,"Woodsam Digital Body Weight Bathroom Fitness Scale, 400LB/180KG , Black Clear",Home & Kitchen > Bath > Bathroom Accessories > Scales
389,537,"Etekcity 4.3 Inch Ultra Wide Platfrom Digital Body Weight Scale, 440 Pounds, Black",Home & Kitchen > Bath > Bathroom Accessories > Scales
390,537,"GoWISE USA Slim Digital Bathroom Scale - Measures Weight, Body Fat, Water, & Bone Mass 400 Lbs Capacity Tempered Glass (Black 1) New",Home & Kitchen > Bath > Bathroom Accessories > Scales
391,537,FITBIT ALTRA WI-FI SMART SCALE - WHITE,Home & Kitchen > Bath > Bathroom Accessories > Scales
392,537,Kalorik EBS37070 Digital Bathroom Scale Multi/None,Home & Kitchen > Bath > Bathroom Accessories > Scales
393,537,Taylor Wireless Bluetooth Digital Bathroom Scale black NO SIZE,Home & Kitchen > Bath > Bathroom Accessories > Scales
394,537,Taylor Digital Glass Bathroom Scale,Home & Kitchen > Bath > Bathroom Accessories > Scales
395,537,Fitbit Aria Wi-Fi Smart Scale in Black BLACK SCALE,Home & Kitchen > Bath > Bathroom Accessories > Scales
396,537,Weight Gurus® Bluetooth® Smart Bathroom Scale BLACK SCALE,Home & Kitchen > Bath > Bathroom Accessories > Scales
397,537,Whynter Intelligent Digital Body Analysis Scale w/Memory,Home & Kitchen > Bath > Bathroom Accessories > Scales
398,537,Escali Body Fat & Water Scale High Quality Bathroom Scale!,Home & Kitchen > Bath > Bathroom Accessories > Scales
399,537,"Personal Digital Bathroom Scale with Extra Large Backlit 4.0"" Display and ""Step-On"" Technology (BLACK)",Home & Kitchen > Bath > Bathroom Accessories > Scales
400,537,"Eatsmart Precision Plus Digital Bathroom Scale with Ultra Wide Platform and Step-on Technology, 440-Pounds",Home & Kitchen > Bath > Bathroom Accessories > Scales
401,537,"Kinzi Precision Digital Bathroom Scale w/ Extra Large Lighted Display, 400 lb. Capacity and Step-On Technology",Home & Kitchen > Bath > Bathroom Accessories > Scales
402,537,"1byone Digital Body Weight Bathroom Scale, 180kg/400lb, Tempered Glass and Step-on Technology, Precision 0.1kg/0.2lb, Black",Home & Kitchen > Bath > Bathroom Accessories > Scales
403,537,"BalanceFrom BFHA-PM400SV High Accuracy Ultra Slim Digital Bathroom Scale, Silver",Home & Kitchen > Bath > Bathroom Accessories > Scales
404,537,Weight Gurus Wifi Smart Connected Body Fat Scale with Large Backlit LCD (White + Stainless),Home & Kitchen > Bath > Bathroom Accessories > Scales
405,537,"Utopia Scales USJK-B01-7 Tempered Glass Digital Bathroom Scale with LCD Display (Black), 180kg. Capacity, Perfect for Weight Regulation at Home or In the Gym, Fits Easily Beneath Bathroom Counter, Easy to Clean",Home & Kitchen > Bath > Bathroom Accessories > Scales
406,537,"1byone Digital Body Scale Weight Scale Bathroom Scale, 180kg/400lb, Tempered Glass and Step-on Technology, Precision 0.1kg/0.2lb, Black",Home & Kitchen > Bath > Bathroom Accessories > Scales
407,537,Gurin Precision Digital Bathroom Scale w/ Extra Large Backlit Display and Auto-On Technology,Home & Kitchen > Bath > Bathroom Accessories > Scales
408,537,"Smart Weigh 400lb/180kg Electronic Bathroom Scale with Sleek Tempered Glass Platform, Advanced Step-On Technology and Large Backlit LCD Display (Gold)",Home & Kitchen > Bath > Bathroom Accessories > Scales
409,537,"Balancefrom High Accuracy Plus Digital Bathroom Scale with Backlight LCD and Step-On Technology, Gold",Home & Kitchen > Bath > Bathroom Accessories > Scales
410,537,"Aickar Bathroom Scale 400 Lbs Capacity Bathroom Scale Measures Weight, Body Fat, Water, & Bone Mass Body Weight Scale Digital Body Weight Scale",Home & Kitchen > Bath > Bathroom Accessories > Scales
411,537,"Mosiso® High Accuracy Digital Bathroom Scale with 4.3"" Blue Backlight Display and ""Smart Step-On"" Technology [NEWEST VERSION] (Silver)",Home & Kitchen > Bath > Bathroom Accessories > Scales
412,537,"NewlineNY Step On Comfort-Edge Extra Large 4.3"" Display Cool Blue Backlight Bathroom Scale, SBB0868-GN Green",Home & Kitchen > Bath > Bathroom Accessories > Scales
413,537,"Surpahs Sense-ON Multifunction Digital Bathroom Scale - Body Fat Monitor - Measures Body Weight, BMI, Body Water, Muscle & Bone Mass - 8 Users Auto Re",Home & Kitchen > Bath > Bathroom Accessories > Scales
414,537,"eHealthSource GBF-1012 Digital Bathroom Scale, 440 Pound, Black",Home & Kitchen > Bath > Bathroom Accessories > Scales
415,537,"BalanceFrom High Accuracy Premium Digital Bathroom Scale with 3.6"" Extra Large Dual Color Backlight Display and ""Smart Step-On"" Technology [NEWEST VERSION] (Black)",Home & Kitchen > Bath > Bathroom Accessories > Scales
416,537,"BalanceFrom High Accuracy Digital Bathroom Scale with Large Backlight Display and ""Step-On"" Technology [NEWEST VERSION] (Silver) Health and Beauty",Home & Kitchen > Bath > Bathroom Accessories > Scales
417,537,"BalanceFrom High Accuracy Plus Digital Bathroom Scale with 3.6 Inch Large Dual Color Backlight Display and Smart Step-On Technology, Silver",Home & Kitchen > Bath > Bathroom Accessories > Scales
418,537,"BalanceFrom High Accuracy Digital Bathroom Scale with 4.3"" Extra Large Cool Blue Backlight Display and ""Smart Step-On"" Technology [NEWEST VERSION] Health and Beauty",Home & Kitchen > Bath > Bathroom Accessories > Scales
419,537,"BalanceFrom High Accuracy Digital Bathroom Scale with Large Backlight Display and Step-on Technology, 4.3 Inch, Silver",Home & Kitchen > Bath > Bathroom Accessories > Scales
420,537,Weight Gurus Digital Bathroom Scale with Large Backlit LCD and Smartphone Tracking (Silver) New,Home & Kitchen > Bath > Bathroom Accessories > Scales
421,537,"Etekcity Digital Body Weight Bathroom Scale, 400lb/180kg, Elegant Black",Home & Kitchen > Bath > Bathroom Accessories > Scales
422,537,Etekcity® High Precision 180kg/400lb Digital Bathroom Scale with Step-on Technology high-precision strain gauge sensors system backlit display temper,Home & Kitchen > Bath > Bathroom Accessories > Scales
423,537,Weight Gurus Digital Bathroom Weight Scale (Clear) Clean Design & Large Display,Home & Kitchen > Bath > Bathroom Accessories > Scales
424,537,"Coosh CBS002A Precision Digital Bathroom Scale with Enlarged LCD and Comfort Plus Platform, 330lb Capacity",Home & Kitchen > Bath > Bathroom Accessories > Scales
425,537,My Weigh Xl-700 Talking Bathroom Scale 700 Lb 320kg,Home & Kitchen > Bath > Bathroom Accessories > Scales
426,537,"BalanceFrom High Accuracy Premium Digital Bathroom Scale with 3.6"" Extra Large Dual Color Backlight Display and ""Smart Step-On"" Technology [NEWEST VERSION] (Silver)",Home & Kitchen > Bath > Bathroom Accessories > Scales
427,537,"BalanceFrom High Accuracy Digital Bathroom Scale with 4.3"" Large Backlight Display and Step-on Technology, Silver New",Home & Kitchen > Bath > Bathroom Accessories > Scales
428,537,"iDOO Precision [Marble Pattern] Digital Bathroom Scale, 440lb/200kg",Home & Kitchen > Bath > Bathroom Accessories > Scales
429,537,"BalanceFrom High Accuracy Premium Digital Bathroom Scale with 3.6"" Extra Large Dual Color Backlight Display and ""Smart Step-On"" Technology [NEWEST VERSION] (Gold)",Home & Kitchen > Bath > Bathroom Accessories > Scales
430,537,Escali Bath Smart Connect Digital Bathroom Scale,Home & Kitchen > Bath > Bathroom Accessories > Scales
431,537,BalanceFrom High Accuracy Digital Bathroom Scale with Backlit Display and Step-On Technology [NEWEST VERSION] (Silver),Home & Kitchen > Bath > Bathroom Accessories > Scales
432,537,"GoWISE USA Slim Digital Bathroom Scale - Measures Weight, Body Fat, Water, & Bone Mass 400 Lbs Capacity Tempered Glass (Black 1)",Home & Kitchen > Bath > Bathroom Accessories > Scales
433,537,"Ollieroo® White 400lb Precision Digital Body Weight Bathroom Scale with Tempered Glass, Blue LCD Display, Smart Step-on",Home & Kitchen > Bath > Bathroom Accessories > Scales
434,537,"NewlineNY SBB0718M-NYBK Step-On Mini Travel Bathroom Scale, Cool Black New",Home & Kitchen > Bath > Bathroom Accessories > Scales
435,537,EatSmart Precision CalPal Digital Bathroom Scale Black,Home & Kitchen > Bath > Bathroom Accessories > Scales
436,537,Fitbit Aria Wi-Fi Smart Scale,Home & Kitchen > Bath > Bathroom Accessories > Scales
437,537,Withings Wireless Scale - White,Home & Kitchen > Bath > Bathroom Accessories > Scales
438,537,Taylor Digital Glass Bath Scale,Home & Kitchen > Bath > Bathroom Accessories > Scales
439,537,American Weigh Scales Digital Bathroom Scale - ZT-150-WT,Home & Kitchen > Bath > Bathroom Accessories > Scales
440,537,Etekcity Digital Bath Bathroom Body Weight Watcher Scale up to 400 PoundsBlack,Home & Kitchen > Bath > Bathroom Accessories > Scales
441,537,Remedy Digital Bathroom Scale Multi/None SCALE,Home & Kitchen > Bath > Bathroom Accessories > Scales
442,537,Beurer Body Analysis Bathroom Scale STAINLESS STEEL SCALE,Home & Kitchen > Bath > Bathroom Accessories > Scales
443,537,Weight Watchers® Glass Body Analysis Bathroom Scale by Conair™ with Muscle Mass CLEAR/SILVER SCALE,Home & Kitchen > Bath > Bathroom Accessories > Scales
444,537,"Fitbit Aria Wi-Fi Smart Scale - Black, FB201B",Home & Kitchen > Bath > Bathroom Accessories > Scales
445,537,Digital Bathroom Scale with Extra Large Backlight in Silver by EatSmart,Home & Kitchen > Bath > Bathroom Accessories > Scales
446,537,Fitbit Fitbit - Aria Wi-fi Smart Scale - White,Home & Kitchen > Bath > Bathroom Accessories > Scales
447,537,Taylor Glass Electronic Scale,Home & Kitchen > Bath > Bathroom Accessories > Scales
448,537,"INSEN Precision Digital Body Fat Bathroom Scale, with Large LCD displayer, Smart Step-on Technology, Measures up to 7 Parameters Body Weight, BMI, Fat, Water, Calories, Muscle and Bone Mass, White",Home & Kitchen > Bath > Bathroom Accessories > Scales
449,537,EatSmart Precision Tracker Digital Bathroom Scale w/ 400 lb. Capacity and EatSmart AccuTrack Software,Home & Kitchen > Bath > Bathroom Accessories > Scales
450,537,Weight Gurus Smartphone Connected Digital Bathroom Scale with Large Backlit LCD and Weightless Technology(c) (Chevron),Home & Kitchen > Bath > Bathroom Accessories > Scales
451,537,"Smart Weigh Smart Tare Digital Body Weight Bathroom Scale with Baby or Pet Tare Weighing Technology, Large LCD Display and Tempered Glass Platform, 440lbs/200kg Capacity (Silver)",Home & Kitchen > Bath > Bathroom Accessories > Scales
452,537,"BalanceFrom High Accuracy Premium Digital Bathroom Scale with 3.6"" Extra Large Dual Color Backlight Display and",Home & Kitchen > Bath > Bathroom Accessories > Scales
453,537,"Fitbit Aria Wi-Fi Smart Scale, Black",Home & Kitchen > Bath > Bathroom Accessories > Scales
454,537,"NewlineNY SBB0718M-NYBK Step-On Mini Travel Bathroom Scale, Cool Black",Home & Kitchen > Bath > Bathroom Accessories > Scales
455,537,"Ozeri Precision II 440 lbs Digital Bathroom Scale, in Ultra Sturdy Tempered Glass with Blue Xbright LCD and StepOn",Home & Kitchen > Bath > Bathroom Accessories > Scales
456,537,Smart Weigh Contemporary Series Digital Vanity / Bathroom Scale with an Extra Large Backlighted LCD Screen and Tempered Glass Platform,Home & Kitchen > Bath > Bathroom Accessories > Scales
457,537,"Ozeri Precision II Digital Bathroom Scale (440 lbs Capacity), with Weight Change Detection Technology & StepOn Activation",Home & Kitchen > Bath > Bathroom Accessories > Scales
458,537,"Surpahs ""Step-ON"" Portable Small Foot Digital Body Scale, Bathroom Scale (Pink, 400 lb/180 kg)",Home & Kitchen > Bath > Bathroom Accessories > Scales
459,537,"NewlineNY Lightest Step On Super Mini Travel Bathroom Scale, SBB0638SM-GN Green",Home & Kitchen > Bath > Bathroom Accessories > Scales
460,537,Weight Gurus Smartphone Connected Digital Bathroom Scale with Large Backlit LCD and Weightless Technology(c) (Black),Home & Kitchen > Bath > Bathroom Accessories > Scales
461,537,"Easy@Home High Precision Digital Bathroom Scale w/ 4.3"" Extra Large Backlit Display and ""Smart Step-On"" Technology, BMI reference Card, CW222",Home & Kitchen > Bath > Bathroom Accessories > Scales
462,537,EatSmart Precision Tracker Digital Bathroom Scale w/ 400 lb. Capacity and EatSmart AccuTrack Software (Silver),Home & Kitchen > Bath > Bathroom Accessories > Scales
463,537,"NewlineNY Travel Protection Sleeve for Mini Bathroom Scales (Case only, no scale) NY-MSS101-BG",Home & Kitchen > Bath > Bathroom Accessories > Scales
464,537,Weight Gurus Digital Bathroom Scale with Large Backlit LCD and Smartphone Tracking (Clear),Home & Kitchen > Bath > Bathroom Accessories > Scales
465,537,GoWISE USA Electronic Personal Digital Scale w/ Step-On Techonology & Wide Tempered Glass Platform & LCD Display w/ Backlight 400LB Capacity (White/Silver),Home & Kitchen > Bath > Bathroom Accessories > Scales
466,537,Digital Bathroom Scale by,Home & Kitchen > Bath > Bathroom Accessories > Scales
467,537,"EatSmart Precision Digital Bathroom Scale w/ Extra Large Lighted Display, 400 lb. Capacity and ""Step-On"" Technology [2015 VERSION] - 20,000+ Reviews E",Home & Kitchen > Bath > Bathroom Accessories > Scales
468,537,"Smart Weigh SMS500 Digital Bathroom Scale, High Accuracy, Dual Color Weight Change Detection and Smart Step-On Auto Recognition for 8 Users, Black",Home & Kitchen > Bath > Bathroom Accessories > Scales
469,537,"Utopia Scales USJK-B01-1 Tempered Glass Digital Bathroom Scale with LCD Display (Clear), 330 lb. Capacity, Perfect for Weight Regulation at Home or In the Gym, Fits Easily Beneath Bathroom Counter, Easy to Clean",Home & Kitchen > Bath > Bathroom Accessories > Scales
470,537,Digital Glass Bathroom,Home & Kitchen > Bath > Bathroom Accessories > Scales
471,537,"Ivation Premium Glass Ultra Thin Bathroom Scale LARGE LCD Display Easy To Read 150kg/330lbs Capacity, Extra Wide 14 inch platform!",Home & Kitchen > Bath > Bathroom Accessories > Scales
472,537,"Ozeri ZB19 Rev Digital Bathroom Scale with Electro-Mechanical Weight Dial,",Home & Kitchen > Bath > Bathroom Accessories > Scales
473,537,"Ozeri ZB19-W Rev Digital Bathroom Scale, White",Home & Kitchen > Bath > Bathroom Accessories > Scales
474,537,EatSmart EatSmart Precision Premium Digital Bathroom Scale BlackSilver,Home & Kitchen > Bath > Bathroom Accessories > Scales
475,537,"Sunbeam Rotating Dial Bathroom Scale, White",Home & Kitchen > Bath > Bathroom Accessories > Scales
476,537,"Weight Gurus Smartphone Connected Digital Bathroom Scale, Large Backlit LCD and Weightless Technology; Color: black",Home & Kitchen > Bath > Bathroom Accessories > Scales
477,537,Fitbit Aria Wi-Fi Smart Bathroom Scale - White White NO SIZE,Home & Kitchen > Bath > Bathroom Accessories > Scales
478,537,HoMedics® 900 Dual Display Digital Bathroom Scale BLACK/GREY SCALE,Home & Kitchen > Bath > Bathroom Accessories > Scales
479,537,Fitbit Aria Wi-Fi Smart Scale in White WHITE SCALE,Home & Kitchen > Bath > Bathroom Accessories > Scales
480,537,Conair® Thinner® Digital Precision Chrome and Glass Bathroom Scale CHROME/GLASS SCALE,Home & Kitchen > Bath > Bathroom Accessories > Scales
481,537,"Weight Watchers® by Conair™ Glass Digital Body Analysis Red LED Bathroom Scale CLEAR 2.5"" X 15""",Home & Kitchen > Bath > Bathroom Accessories > Scales
482,537,"Ozeri Precision II Digital Bathroom Scale, in Ultra Sturdy Tempered Glass",Home & Kitchen > Bath > Bathroom Accessories > Scales
483,537,fitbit Aria™ Wi-Fi Smart Scale,Home & Kitchen > Bath > Bathroom Accessories > Scales
484,537,Dixon Bamboo Digital Bath Scale,Home & Kitchen > Bath > Bathroom Accessories > Scales
485,537,"Soehnle 63747 Pino Digital Bath Scale, White",Home & Kitchen > Bath > Bathroom Accessories > Scales
486,537,Taylor Glass Digital Bath Scale With LCD Display,Home & Kitchen > Bath > Bathroom Accessories > Scales
487,537,"EatSmart Precision Digital Bathroom Scale w/ Extra Large Lighted Display, 400 lb. Capacity and ""Step-On"" Technology [2016 VERSION] - 12,000+ Reviews EatSmart Guaranteed Accurate",Home & Kitchen > Bath > Bathroom Accessories > Scales
488,537,Weight Gurus Digital Bathroom Weight Scale (Black) Clean Design & Large Display,Home & Kitchen > Bath > Bathroom Accessories > Scales
489,537,EatSmart Products,Home & Kitchen > Bath > Bathroom Accessories > Scales
490,537,SmartWay Precision XL Digital Bathroom Scale Kit w/ Extra Wide 440lb Step-On Platform and MyoTape Body Tape Measure (White),Home & Kitchen > Bath > Bathroom Accessories > Scales
