,category_id,description,category_path
0,539,Clorox ToiletWand Disposable Toilet Cleaning System ( Refills 6 - 1.04 oz ),Home & Kitchen > Bath > Bathroom Accessories > Toilet Accessories
1,539,clorox toiletwand,Home & Kitchen > Bath > Bathroom Accessories > Toilet Accessories
2,539,clorox toilet wand disinfecting refills rainforest rush 30 count,Home & Kitchen > Bath > Bathroom Accessories > Toilet Accessories
3,539,"Clorox ToiletWand Disinfecting Refills, 20 Count",Home & Kitchen > Bath > Bathroom Accessories > Toilet Accessories
4,539,Clorox ToiletWand Disposable Toilet Cleaning System with 6 Refills,Home & Kitchen > Bath > Bathroom Accessories > Toilet Accessories
