,category_id,description,category_path
0,552,"dawn ultra hand renewal dishwashing liquid with olay beauty pomegranate splash scent, 9 ounce (pack of 12)",Home & Kitchen > Dishwashing > Dish Detergent
1,552,"puracy natural dish soap, green tea & lime, 16 ounces",Home & Kitchen > Dishwashing > Dish Detergent
2,552,"2x method gel dish pump refill, sea minerals, 36 fluid ounce",Home & Kitchen > Dishwashing > Dish Detergent
3,552,"Palmolive Ultra Oxy-plus Power Degreaser Dish Liquid, 25 Ounce (Pack of 4)",Home & Kitchen > Dishwashing > Dish Detergent
4,552,"dawn platinum dishwashing foam refill, fresh rapids, 30.9 ounce",Home & Kitchen > Dishwashing > Dish Detergent
5,552,"Method Gel Dish Pump, Pink Grapefruit, 6 Count",Home & Kitchen > Dishwashing > Dish Detergent
6,552,"dawn ultra pure essentials dishwashing liquid, citrus infusion scent, clear/straw color - no dyes, 24 ounce (pack of 2)",Home & Kitchen > Dishwashing > Dish Detergent
7,552,dawn direct foam,Home & Kitchen > Dishwashing > Dish Detergent
8,552,"joy dishwashing liquid, lemon scent, 30 ounce",Home & Kitchen > Dishwashing > Dish Detergent
9,552,"palmolive ultra baby bottles, toy and dish wash liquid, 20-ounce(pack of 3)",Home & Kitchen > Dishwashing > Dish Detergent
10,552,Dawn Dishwashing Liquid Original Scent 21.6 Oz (3 Pack),Home & Kitchen > Dishwashing > Dish Detergent
11,552,"method gel dish pump, lemon mint, 18 ounce",Home & Kitchen > Dishwashing > Dish Detergent
12,552,joy dishwashing liquid,Home & Kitchen > Dishwashing > Dish Detergent
13,552,"eco-me dish soap, fragrance-free 16 oz",Home & Kitchen > Dishwashing > Dish Detergent
14,552,palmolive ultra original,Home & Kitchen > Dishwashing > Dish Detergent
15,552,"dawn ultra antibacterial dishwashing liquid, apple blossom scent, 24 fl oz",Home & Kitchen > Dishwashing > Dish Detergent
16,552,350buy acrylic 12 powder liquid kits nails art tips kit clipper brush dish buffer block,Home & Kitchen > Dishwashing > Dish Detergent
17,552,mrs meyer's clean day 11103 liquid dish soap 16 oz. - lavender scent,Home & Kitchen > Dishwashing > Dish Detergent
18,552,"biokleen free & clear dishwash liquid, 32-ounce bottles (pack of 12)",Home & Kitchen > Dishwashing > Dish Detergent
19,552,"Dawn Ultra Dish Liquid with Olay, Pomegranate Splash Scent , 20 Ounce",Home & Kitchen > Dishwashing > Dish Detergent
20,552,caldrea dish soap sea salt neroli -- 16 fl oz,Home & Kitchen > Dishwashing > Dish Detergent
21,552,ecover dish powder zero - 48 oz,Home & Kitchen > Dishwashing > Dish Detergent
22,552,"mrs. meyer's clean day liquid dish soap, lemon verbena, 16oz",Home & Kitchen > Dishwashing > Dish Detergent
23,552,"ajax super degreaser dish liquid, lemon, 30 fluid ounce",Home & Kitchen > Dishwashing > Dish Detergent
24,552,natural homelogic dish soap - jasmine mist - 24 fl oz,Home & Kitchen > Dishwashing > Dish Detergent
25,552,"babyganics foaming dish soap refill, 32 fl. oz. (pack of 2), packaging may vary",Home & Kitchen > Dishwashing > Dish Detergent
26,552,"Ikea Dishwashing Brush Set of Five (5), Assorted Colors",Home & Kitchen > Dishwashing > Dish Detergent
27,552,greenworks natural dishwashing liquid original scent value pack 22fluid ounce bottles 2 pack with 2 sos all surface sponges,Home & Kitchen > Dishwashing > Dish Detergent
28,552,mrs meyers - soap dish liquid geranium 16 oz,Home & Kitchen > Dishwashing > Dish Detergent
29,552,palmolive ultra oxyplus power degreaser dish washing liquid-10oz (2 pack),Home & Kitchen > Dishwashing > Dish Detergent
30,552,"stonewall kitchen cranberry harvest dish soap, 17.6 ounce",Home & Kitchen > Dishwashing > Dish Detergent
31,552,Dawn Ultra Antibacterial Antibacterial Dishwashing Liquid - 21.6 oz - Orange - 3 pk,Home & Kitchen > Dishwashing > Dish Detergent
32,552,"lysol no-touch kitchen system dish soap, sparkling tangerine, 2 refills, 8.5 ounce new",Home & Kitchen > Dishwashing > Dish Detergent
33,552,"seventh generation dish liquid, lavender floral & mint, 25-ounce bottles (pack of 6) packaging may vary",Home & Kitchen > Dishwashing > Dish Detergent
34,552,"2 Pack, Dawn Ultra Hand Renewal Olay Beauty Dishwashing Liquid, Tropical Shea",Home & Kitchen > Dishwashing > Dish Detergent
35,552,"Earth Friendly Lavender Dishmate, 25 Ounce -- 6 per case.",Home & Kitchen > Dishwashing > Dish Detergent
36,552,palmolive ultra baby,Home & Kitchen > Dishwashing > Dish Detergent
37,552,ecover dishwashing liquid lemon aloe -- 16 fl oz,Home & Kitchen > Dishwashing > Dish Detergent
38,552,"method power foam dish 16oz, lavender",Home & Kitchen > Dishwashing > Dish Detergent
39,552,"2x palmolive ultra original dish washing liquid, 10oz",Home & Kitchen > Dishwashing > Dish Detergent
40,552,"ecos dishmate dish liquid, almond 25 oz. (pack of 2)",Home & Kitchen > Dishwashing > Dish Detergent
41,552,"caldrea dish soap liquid, ginger pomelo, 16-ounce bottles (pack of 2)",Home & Kitchen > Dishwashing > Dish Detergent
42,552,method dish soap pump - 18,Home & Kitchen > Dishwashing > Dish Detergent
43,552,"method pump dish soap cucumber, 18-ounce (pack of 6)",Home & Kitchen > Dishwashing > Dish Detergent
44,552,"method dish soap pump, clementine, 18 ounce",Home & Kitchen > Dishwashing > Dish Detergent
45,552,Mrs. Meyer's - Clean Day Liquid Dish Soap Lavender - 16 oz.3 Pack,Home & Kitchen > Dishwashing > Dish Detergent
46,552,"Mrs Meyers Clean Day Basil Automatic Dish Pack, 12.7 Ounce -- 6 per case.",Home & Kitchen > Dishwashing > Dish Detergent
47,552,"Frosch Natural Pomegranate Liquid Hand Dish Washing Soap, 500 ml (Pack of 2)",Home & Kitchen > Dishwashing > Dish Detergent
48,552,Palmolive Ultra Orange Antibacterial Concentrated Dish Liquid 10 Ounce,Home & Kitchen > Dishwashing > Dish Detergent
49,552,"Baby Bottle & Dish Safe Liquid Dapple, Lavender, 16.9 oz Liquid",Home & Kitchen > Dishwashing > Dish Detergent
50,552,mrs meyers clean day dish soap lemon verbena 16 ounce bottle mrs meyers,Home & Kitchen > Dishwashing > Dish Detergent
51,552,"mrs. meyer's clean day dish soap, lemon verbena, 16 ounce",Home & Kitchen > Dishwashing > Dish Detergent
52,552,dawn platinum power clean dishwashing liquid-refreshing rain-20 oz,Home & Kitchen > Dishwashing > Dish Detergent
53,552,"babyganics foaming dish and bottle soap pump, 16 fluid ounce (pack of 3), packaging may vary health and beauty",Home & Kitchen > Dishwashing > Dish Detergent
54,552,Method Dish Soap Pump - 18 oz - Cucumber - 2 pk,Home & Kitchen > Dishwashing > Dish Detergent
55,552,"Dawn Dishwashing Liquid, Summertime Showers, 25 Oz",Home & Kitchen > Dishwashing > Dish Detergent
56,552,"ajax bleach alternative dish liquid, lime, 14 fluid ounce",Home & Kitchen > Dishwashing > Dish Detergent
57,552,honest dish soap lavender 16 fl oz,Home & Kitchen > Dishwashing > Dish Detergent
58,552,"Palmolive Ultra Antibacterial Dish Liquid, Orange, 50 Ounce",Home & Kitchen > Dishwashing > Dish Detergent
59,552,"lysol no-touch kitchen system dish soap, sparkling tangerine, 2 refills, 8.5 ounce health and beauty",Home & Kitchen > Dishwashing > Dish Detergent
60,552,dawn ultra original scent,Home & Kitchen > Dishwashing > Dish Detergent
61,552,green works dishwashing liquid - 22 oz - original,Home & Kitchen > Dishwashing > Dish Detergent
62,552,"Method Dish Soap, Lime and Sea Salt, 3 Count",Home & Kitchen > Dishwashing > Dish Detergent
63,552,"Dabble Refill Pack Baby Bottle and Dish Liquid, Fragrance Free, 34 Fluid Ounce",Home & Kitchen > Dishwashing > Dish Detergent
64,552,mrs. meyers clean day liquid dish soap radish scent 16 oz. 3 pack,Home & Kitchen > Dishwashing > Dish Detergent
65,552,dawn non ultra original scent dishwashing liquid 12.6 fl oz (2-pack),Home & Kitchen > Dishwashing > Dish Detergent
66,552,"dawn ultra concentrated antibacterial hand soap dishwashing liquid, orange scent, 24 ...",Home & Kitchen > Dishwashing > Dish Detergent
67,552,"gaiam size 2 bottles seventh generation dish soap liquid - lemongrass & clementine (set of 2, 25oz)",Home & Kitchen > Dishwashing > Dish Detergent
68,552,"green works natural dishwashing liquid-water lilly, water lilly, 22 oz-3 pack",Home & Kitchen > Dishwashing > Dish Detergent
69,552,"Dawn Platinum Erasing Dish Foam, Dishwashing Soap Pump Lime Surge Scent (3 Pa...",Home & Kitchen > Dishwashing > Dish Detergent
70,552,"3x procter & gamble 02613 original dawn dishwashing liquid, 1 gal.",Home & Kitchen > Dishwashing > Dish Detergent
71,552,dawn ultra hand renewal,Home & Kitchen > Dishwashing > Dish Detergent
72,552,dawn ultra pure essentials dishwashing liquid clearstraw color  no dyes sparkling mist 24 ounce pack of 2,Home & Kitchen > Dishwashing > Dish Detergent
73,552,dawn platinum power clean dish soap (20oz),Home & Kitchen > Dishwashing > Dish Detergent
74,552,"caldrea dish soap, lavender pine, 16 fluid ounce",Home & Kitchen > Dishwashing > Dish Detergent
75,552,Puracy Natural Liquid Dish Soap - Sulfate-Free - THE BEST Dishwashing Detergent,Home & Kitchen > Dishwashing > Dish Detergent
76,552,Dish Soap by Caldrea Essential Collection Earth Friendly Concentrated Plant-based,Home & Kitchen > Dishwashing > Dish Detergent
77,552,"gain ultra hawaiian aloha dishwashing liquid, 44 oz",Home & Kitchen > Dishwashing > Dish Detergent
78,552,"dawn direct dishwashing foam refill, fresh rapids scent - 30.9 fl oz",Home & Kitchen > Dishwashing > Dish Detergent
79,552,"babyganics foaming dish & bottle soap refill, fragrance free - 33.8 fl oz",Home & Kitchen > Dishwashing > Dish Detergent
80,552,"method dish soap pump, pink grapefruit - 18 fl oz",Home & Kitchen > Dishwashing > Dish Detergent
81,552,"method dish soap pump, lime & sea salt - 18 oz",Home & Kitchen > Dishwashing > Dish Detergent
82,552,"earth friendly products ultra dishmate, liquid dishwashing cleaner, natural almond - 25 fl oz",Home & Kitchen > Dishwashing > Dish Detergent
83,552,"dawn platinum power oxi dishwashing liquid, invigorating berry - 18 fl oz",Home & Kitchen > Dishwashing > Dish Detergent
84,552,"seventh generation natural dish liquid, free an...",Home & Kitchen > Dishwashing > Dish Detergent
85,552,honest company lavender plant-based dish soap 26.5 fl oz,Home & Kitchen > Dishwashing > Dish Detergent
86,552,dawn ultra platinum power clean refreshing rain scent liquid dish soap 30 oz,Home & Kitchen > Dishwashing > Dish Detergent
87,552,dawn® hand renewal with olay® peach & almonds dishwashing liquid 18 oz,Home & Kitchen > Dishwashing > Dish Detergent
88,552,method natural concentrated clementine dish soap 18 oz,Home & Kitchen > Dishwashing > Dish Detergent
89,552,"babyganics dish & bottle soap refill, fragrance free - 32oz",Home & Kitchen > Dishwashing > Dish Detergent
90,552,dawn ultra original scent liquid dish soap 24 oz,Home & Kitchen > Dishwashing > Dish Detergent
91,552,caldrea essentials collection dish soap herbs of provence - 16 oz,Home & Kitchen > Dishwashing > Dish Detergent
92,552,mrs. meyer's dish soap basil 16oz,Home & Kitchen > Dishwashing > Dish Detergent
93,552,better life unscented dish soap - 22 oz,Home & Kitchen > Dishwashing > Dish Detergent
94,552,"green apple liquid hand wash dish soap, 24oz - up & up™",Home & Kitchen > Dishwashing > Dish Detergent
95,552,dawn ultra apple blossom scent antibacterial dishwashing liquid 75 fl oz,Home & Kitchen > Dishwashing > Dish Detergent
96,552,"dawn pretreater for dishes power dissolver dish detergent, 12.8 fl oz",Home & Kitchen > Dishwashing > Dish Detergent
97,552,"dawn ultra hand renewal pomegranate splash scent dishwashing liquid, 18 fl oz",Home & Kitchen > Dishwashing > Dish Detergent
98,552,palmolive classic gentle caring dishwashing liquid 28 fl oz,Home & Kitchen > Dishwashing > Dish Detergent
99,552,"palmolive beachy breeze & tropical citrus dish liquid, 25 oz",Home & Kitchen > Dishwashing > Dish Detergent
100,552,"dawn ultra malibu sunrise dishwashing liquid, 24 fl oz",Home & Kitchen > Dishwashing > Dish Detergent
101,552,"ajax triple action orange dish & hand soap, 90 oz 10.2"" x 4.7"" x 5.8""",Home & Kitchen > Dishwashing > Dish Detergent
102,552,"gain ultra original dishwashing liquid, 40 oz",Home & Kitchen > Dishwashing > Dish Detergent
103,552,"green works natural dishwashing liquid, water lily, 22 fl oz",Home & Kitchen > Dishwashing > Dish Detergent
104,552,babyganics dish soap refill citrus one color,Home & Kitchen > Dishwashing > Dish Detergent
105,552,dapple natural based dish liquid,Home & Kitchen > Dishwashing > Dish Detergent
106,552,dapple natural baby lavender bottle dish liquid refill pack 34 ounce,Home & Kitchen > Dishwashing > Dish Detergent
107,552,liquid dish soap basil mrs. meyer's clean day 16.0 fl oz,Home & Kitchen > Dishwashing > Dish Detergent
108,552,ultra dish liquid original palmolive 25.0 fl oz,Home & Kitchen > Dishwashing > Dish Detergent
109,552,ultra pure + clear dish liquid palmolive 25.0 fl oz,Home & Kitchen > Dishwashing > Dish Detergent
110,552,naturally clean lemon verbena dish soap lemon verbena no size,Home & Kitchen > Dishwashing > Dish Detergent
111,552,"dawn® dishwashing liquid, original scent, 1 gallon",Home & Kitchen > Dishwashing > Dish Detergent
112,552,"seventh generation® natural dish liquid, 25 oz.",Home & Kitchen > Dishwashing > Dish Detergent
113,552,"dawn professional dish detergent with pump, 1 gallon",Home & Kitchen > Dishwashing > Dish Detergent
114,552,palmolive ultra liquid dish soap original 25oz,Home & Kitchen > Dishwashing > Dish Detergent
115,552,"green works™ dish detergent natural dishwashing liquid, original scent, 22 oz.",Home & Kitchen > Dishwashing > Dish Detergent
116,552,palmolivereg dishwashing liquid original scent 1 gallon,Home & Kitchen > Dishwashing > Dish Detergent
117,552,ultra escapes dishwashing liquid fuji cherry blossom 14.6 oz,Home & Kitchen > Dishwashing > Dish Detergent
118,552,ultra 56 oz. original scent dishwashing liquid,Home & Kitchen > Dishwashing > Dish Detergent
119,552,12.6-oz orange dish soap,Home & Kitchen > Dishwashing > Dish Detergent
120,552,"williams-sonoma essential oils dish soap refill, fleur de sel",Home & Kitchen > Dishwashing > Dish Detergent
121,552,"williams-sonoma essential oils dish soap, hand soap & lotion set with wire caddy, black fig",Home & Kitchen > Dishwashing > Dish Detergent
122,552,the honest company dish soap,Home & Kitchen > Dishwashing > Dish Detergent
123,552,babyganicsï¿½ 32 oz. fragrance-free foaming dish & bottle soap refill,Home & Kitchen > Dishwashing > Dish Detergent
124,552,babyganicsï¿½ dish dazzler™ foaming soap refill in citrus scent clear,Home & Kitchen > Dishwashing > Dish Detergent
125,552,mrs. meyer's® clean day aromatherapeutic geranium 16-ounce liquid dish soap clear 16 oz,Home & Kitchen > Dishwashing > Dish Detergent
126,552,mrs. meyer's® clean day aromatherapeutic lavender 16 oz. liquid dish soap gold 16 oz,Home & Kitchen > Dishwashing > Dish Detergent
127,552,babyganics foaming dish & bottle soap - citrus - 32 oz - 2 pk,Home & Kitchen > Dishwashing > Dish Detergent
128,552,green works dishwashing liquid - 22 oz - free and clear,Home & Kitchen > Dishwashing > Dish Detergent
129,552,palmolive ultra dish liquid - 25 oz - original,Home & Kitchen > Dishwashing > Dish Detergent
130,552,method pump dish starter & refill bundle-clementine,Home & Kitchen > Dishwashing > Dish Detergent
131,552,babyganics foaming dish & bottle soap - fragrance-free - 16 oz - 2 pk,Home & Kitchen > Dishwashing > Dish Detergent
132,552,palmolive ultra dishwashing liquid - 25 oz - pure + clear,Home & Kitchen > Dishwashing > Dish Detergent
133,552,dawn ultra platinum diswashing foam - 10.15 oz - fresh rapids,Home & Kitchen > Dishwashing > Dish Detergent
134,552,"palmolive ultra baby bottle, toy, & dish washing liquid-25 oz",Home & Kitchen > Dishwashing > Dish Detergent
135,552,babyganics dish dazzler foaming dish & bottle soap - citrus,Home & Kitchen > Dishwashing > Dish Detergent
136,552,"td> method pump dish soap, sea minerals, 18 oz, 2 pk",Home & Kitchen > Dishwashing > Dish Detergent
137,552,"seventh generation hand care dish liquid, free & clear, 18 oz",Home & Kitchen > Dishwashing > Dish Detergent
138,552,dawn platinum erasing dishwashing foam refill - 30.9 oz - fresh rapids,Home & Kitchen > Dishwashing > Dish Detergent
139,552,lifetree dish soap citrus fresh -- 32 fl oz,Home & Kitchen > Dishwashing > Dish Detergent
140,552,caldrea dish soap mandarin vetiver -- 16 fl oz,Home & Kitchen > Dishwashing > Dish Detergent
141,552,biokleen natural dish liquid -- 32 fl oz,Home & Kitchen > Dishwashing > Dish Detergent
142,552,the honest company honest dish soap white grapefruit -- 16 fl oz,Home & Kitchen > Dishwashing > Dish Detergent
143,552,babyganics dish dazzler foaming dish & bottle soap citrus -- 16 fl oz,Home & Kitchen > Dishwashing > Dish Detergent
144,552,method dish soap clementine -- 18 fl oz,Home & Kitchen > Dishwashing > Dish Detergent
145,552,earth friendly ultra liquid dishmate natural lavender -- 25 fl oz,Home & Kitchen > Dishwashing > Dish Detergent
146,552,earth friendly ultra liquid dishmate natural grapefruit -- 25 fl oz,Home & Kitchen > Dishwashing > Dish Detergent
147,552,ajax dish liquid-tropical lime twist - 28 oz,Home & Kitchen > Dishwashing > Dish Detergent
148,552,ajax dish liquid - 30 oz - lavender,Home & Kitchen > Dishwashing > Dish Detergent
149,552,dawn ultra dishwashing liquid - 34.2 oz - mediterranean lavender,Home & Kitchen > Dishwashing > Dish Detergent
150,552,"better life liquid dish soap, clary sage & citrus - 22 oz",Home & Kitchen > Dishwashing > Dish Detergent
151,552,"caldrea liquid dish soap, mandarin vetiver - 16 oz",Home & Kitchen > Dishwashing > Dish Detergent
152,552,dawn ultra antibacterial antibacterial dishwashing liquid - 38 oz - apple blossom,Home & Kitchen > Dishwashing > Dish Detergent
153,552,"method dish refill, lemon mint, 36oz",Home & Kitchen > Dishwashing > Dish Detergent
154,552,seventh generation dish liquid - fresh lime & lavender - 25 oz,Home & Kitchen > Dishwashing > Dish Detergent
155,552,dawn ultra dishwashing liquid - 24 oz - original,Home & Kitchen > Dishwashing > Dish Detergent
156,552,swanson healthy home eco-friendly dishwashing liquid liquid 25 fl oz (739 ml) liquid,Home & Kitchen > Dishwashing > Dish Detergent
157,552,palmolive original dishwashing liquid - (20oz),Home & Kitchen > Dishwashing > Dish Detergent
158,552,"earth friendly products ultra dishmate liquid dishwashing cleaner, natural almond - (25oz)",Home & Kitchen > Dishwashing > Dish Detergent
159,552,"mrs. meyer's clean day liquid dish soap, lavender scent - (16oz)",Home & Kitchen > Dishwashing > Dish Detergent
160,552,original dawn dishwashing liquid - 1 gal.,Home & Kitchen > Dishwashing > Dish Detergent
161,552,peapod ultra concentrated dish soap liquid citrus scent 10 oz btl,Home & Kitchen > Dishwashing > Dish Detergent
162,552,palmolive ultra dish liquid antibacterial orange 25 oz btl,Home & Kitchen > Dishwashing > Dish Detergent
163,552,nature's promise free from liquid dish detergent pumpkin spice 25 oz btl,Home & Kitchen > Dishwashing > Dish Detergent
164,552,giant dish soap liquid orange 25 oz btl,Home & Kitchen > Dishwashing > Dish Detergent
165,552,dawn ultra dishwashing liquid hand renewal with olay pomegranate splash 20 oz btl,Home & Kitchen > Dishwashing > Dish Detergent
166,552,nature's promise free from dish liquid free & clear 25 oz btl,Home & Kitchen > Dishwashing > Dish Detergent
167,552,dawn classic dishwashing liquid original scent 12.6 oz btl,Home & Kitchen > Dishwashing > Dish Detergent
168,552,method liquid dish pump lemon mint - 18 fl. oz.,Home & Kitchen > Dishwashing > Dish Detergent
169,552,dawn dishwashing liquid ultra concentrated original - 9 fl. oz.,Home & Kitchen > Dishwashing > Dish Detergent
170,552,ajax dish liquid triple action orange - 28 fl. oz.,Home & Kitchen > Dishwashing > Dish Detergent
171,552,safeway dish detergent liquid soap anti bacteria lemon - 24 fl. oz.,Home & Kitchen > Dishwashing > Dish Detergent
172,552,Seventh Generation Natural Dish Detergent 25 oz. Lavender,Home & Kitchen > Dishwashing > Dish Detergent
173,552,meijer liquid dishwashing detergent original scent 24 oz.,Home & Kitchen > Dishwashing > Dish Detergent
174,552,Seventh Generation Natural Dish Detergent 25oz Free and Clear,Home & Kitchen > Dishwashing > Dish Detergent
175,552,babyganics® 3.38 oz. fragrance-free foaming dish & bottle soap white 175 ct,Home & Kitchen > Dishwashing > Dish Detergent
176,552,"seventh generation seventh generation dish liquid, lavender floral & mint, 5...",Home & Kitchen > Dishwashing > Dish Detergent
177,552,"earth friendly products earth friendly products wave dishwashing detergent gel, f...",Home & Kitchen > Dishwashing > Dish Detergent
178,552,"seventh generation seventh generation dish soap, lavender floral & mint, 50 ...",Home & Kitchen > Dishwashing > Dish Detergent
179,552,method method dish and hand odor eliminating 2-in-1 soap sweet w...,Home & Kitchen > Dishwashing > Dish Detergent
180,552,"dawn dawn professional dish soap, 38 fl oz",Home & Kitchen > Dishwashing > Dish Detergent
181,552,"dawn dawn ultra dishwashing detergent liquid, original scent, ...",Home & Kitchen > Dishwashing > Dish Detergent
182,552,"method method dish & hand gel hand soap, sweet water, 11.6 fl oz sweet water",Home & Kitchen > Dishwashing > Dish Detergent
183,552,"jr watkins jr watkins dish soap, lavender, 24 fl oz lavender",Home & Kitchen > Dishwashing > Dish Detergent
184,552,"method method dish soap, sea minerals, 18 ounce",Home & Kitchen > Dishwashing > Dish Detergent
185,552,"mrs. meyer's clean day mrs. meyer's clean day liquid dish soap, basil, 16 fl oz",Home & Kitchen > Dishwashing > Dish Detergent
186,552,"attitude attitude dishwashing liquid wildflower, 23.7 ounce (pack ...",Home & Kitchen > Dishwashing > Dish Detergent
187,552,mrs. meyer's liquid dish soap - lemon verbena - 16 oz,Home & Kitchen > Dishwashing > Dish Detergent
188,552,"palmolive palmolive soft touch dishwashing liquid vitamin e, 10 fl oz",Home & Kitchen > Dishwashing > Dish Detergent
189,552,"seventh generation seventh generation dish soap, free & clear, 50 fl oz",Home & Kitchen > Dishwashing > Dish Detergent
190,552,"gain gain dish liquid soap, lavender, 24 fl oz",Home & Kitchen > Dishwashing > Dish Detergent
191,552,"palmolive palmolive pure & clear dishwashing liquid, light scent, 2... fresh scent 4.5 fl oz",Home & Kitchen > Dishwashing > Dish Detergent
192,552,"seventh generation seventh generation dishwashing detergent gel, lemon, 42 f...",Home & Kitchen > Dishwashing > Dish Detergent
193,552,"mrs. meyer's clean day mrs. meyer's clean day dish soap, apple cider, 16 fl oz",Home & Kitchen > Dishwashing > Dish Detergent
194,552,"ajax super degreaser lemon dishwashing liquid, 30 fl oz",Home & Kitchen > Dishwashing > Dish Detergent
195,552,"dawn ultra concentrated dishwashing liquid, original scent, 38oz",Home & Kitchen > Dishwashing > Dish Detergent
196,552,mrs. meyers mrs. meyer's basil liquid dish soap,Home & Kitchen > Dishwashing > Dish Detergent
197,552,"earth friendly dishmate ultra liquid dishwashing cleaner, natural lavender - 25 fl oz bottle",Home & Kitchen > Dishwashing > Dish Detergent
198,552,dawn apple blossom antibacterial liquid dishwashing soap 24 oz,Home & Kitchen > Dishwashing > Dish Detergent
199,552,"palmolive pure & clear dish liquid, light scent - 25 oz bottle",Home & Kitchen > Dishwashing > Dish Detergent
200,552,dawn ultra original scent dishwash...,Home & Kitchen > Dishwashing > Dish Detergent
201,552,kirkland signature eco friendly liquid dish soap - 135 fl oz jug,Home & Kitchen > Dishwashing > Dish Detergent
202,552,"dawn ultra dishwashing liquid, lemon scent, yellow, 24 ounce (pack of 2)",Home & Kitchen > Dishwashing > Dish Detergent
203,552,"method dish soap, sea minerals, 3 count",Home & Kitchen > Dishwashing > Dish Detergent
204,552,dawn ultra power clean dishwashing liquid refreshing rain  30 oz,Home & Kitchen > Dishwashing > Dish Detergent
205,552,"method gel dish pump, clementine, 18 ounce",Home & Kitchen > Dishwashing > Dish Detergent
206,552,"green works 30168 natural dishwashing liquid, 22 fl oz bottle, original",Home & Kitchen > Dishwashing > Dish Detergent
207,552,Murchison-Hume Heirloom Dishwashing Liquid - 32 Oz - Australian White Grapefruit,Home & Kitchen > Dishwashing > Dish Detergent
208,552,8 oz wave jet rinse aid dish liquid,Home & Kitchen > Dishwashing > Dish Detergent
209,552,"Finish Rinse Agent for Dishwashing, 32 FL. oz - Dishwasher Detergent",Home & Kitchen > Dishwashing > Dish Detergent
210,552,The Honest Company Lavender Dish Soap 26.5 ounces,Home & Kitchen > Dishwashing > Dish Detergent
211,552,"seventh generation dish liquid, free & clear, 25 fl oz",Home & Kitchen > Dishwashing > Dish Detergent
212,552,earth friendly products dishmate dish soap grapefruit 25 oz squeeze bottle earth friendly,Home & Kitchen > Dishwashing > Dish Detergent
213,552,caldrea dish soap ginger pomelo -- 16 fl oz,Home & Kitchen > Dishwashing > Dish Detergent
214,552,"Boulder Clean Natural Liquid Dish Soap Refill, Apple Orchard, 100 Fluid Ounce",Home & Kitchen > Dishwashing > Dish Detergent
215,552,"2x palmolive original dish liquid, 30 fluid ounce",Home & Kitchen > Dishwashing > Dish Detergent
216,552,Palmolive Dish Liquid 90 Oz,Home & Kitchen > Dishwashing > Dish Detergent
217,552,"palmolive dish liquid, crisp orchard burst, 28 ounce",Home & Kitchen > Dishwashing > Dish Detergent
218,552,"j.r. watkins dish soap, moisturizing, pomegranate and acai, 24 fluid ounce",Home & Kitchen > Dishwashing > Dish Detergent
219,552,Dawn Ultra Dishwashing Liquid - 21.6 oz - Original - 3 pk,Home & Kitchen > Dishwashing > Dish Detergent
220,552,mrs meyers liquid dish soap lavender 16 oz,Home & Kitchen > Dishwashing > Dish Detergent
221,552,dapple baby bottle & dish liquid - fragrance free - 16.9 oz - 2 pk,Home & Kitchen > Dishwashing > Dish Detergent
222,552,100% natural liquid dish,Home & Kitchen > Dishwashing > Dish Detergent
