,category_id,description,category_path
3097,552,j.r. watkins lemon scented dish soap 24 oz,Home & Kitchen > Dishwashing > Dish Detergent
3098,552,green works free & clear dish soap 22 oz,Home & Kitchen > Dishwashing > Dish Detergent
3099,552,mrs. meyer's rosemary scented dish soap 16 oz,Home & Kitchen > Dishwashing > Dish Detergent
3100,552,dawn ultra concentrated antibacterial hand soap apple blossom scent dishwashing liquid 34.2 fl oz,Home & Kitchen > Dishwashing > Dish Detergent
3101,552,"dawn original dishwashing liquid, 56 oz",Home & Kitchen > Dishwashing > Dish Detergent
3102,552,dawn ultra antibacterial dishwashing liquid apple blossom (choose your size),Home & Kitchen > Dishwashing > Dish Detergent
3103,552,"dawn ultra hand renewal with olay beauty pomegranate splash scent dishwashing liquid, 44 fl oz",Home & Kitchen > Dishwashing > Dish Detergent
3104,552,"dawn hand renewal with olay pomegranate splash, 28 oz",Home & Kitchen > Dishwashing > Dish Detergent
3105,552,dawn ultra concentrated antibacterial hand soap apple blossom scent dishwashing liquid 38 fl oz,Home & Kitchen > Dishwashing > Dish Detergent
3106,552,dawn ultra malibu sunrise dishwashing liquid 216 fl oz,Home & Kitchen > Dishwashing > Dish Detergent
3107,552,"gain ultra bleach alternative honeyberry hula scent dishwashing liquid, 40 oz",Home & Kitchen > Dishwashing > Dish Detergent
3108,552,babyganics citrus dish soap refill,Home & Kitchen > Dishwashing > Dish Detergent
3109,552,dapple fragrance free dish liquid - 17 ounce,Home & Kitchen > Dishwashing > Dish Detergent
3110,552,dapple fragrance free 17 oz. dish liquid one color,Home & Kitchen > Dishwashing > Dish Detergent
3111,552,babyganics citrus foaming dish soap,Home & Kitchen > Dishwashing > Dish Detergent
3112,552,babyganics dish dazzler foaming dish & bottle soap refill - 33.8 ounce one color,Home & Kitchen > Dishwashing > Dish Detergent
3113,552,dapple fragrance free dish liquid - 17 ounce one color,Home & Kitchen > Dishwashing > Dish Detergent
3114,552,ultra antibacterial dish liquid orange palmolive,Home & Kitchen > Dishwashing > Dish Detergent
3115,552,liquid dish soap lemon verbena mrs. meyer's clean day,Home & Kitchen > Dishwashing > Dish Detergent
3116,552,ultra hand renewal with olay beauty dishwashing liquid pomegranate splash dawn 20.0 fl oz,Home & Kitchen > Dishwashing > Dish Detergent
3117,552,palmolive liquid dish soap oxy power degreaser 10.0 oz.,Home & Kitchen > Dishwashing > Dish Detergent
3118,552,natural dish liquid lavender floral and mint seventh generation 25.0 oz.,Home & Kitchen > Dishwashing > Dish Detergent
3119,552,ajaxreg pink rose dish detergent 1 gal bottle,Home & Kitchen > Dishwashing > Dish Detergent
3120,552,dawn dishwashing liquid 38 oz 2pack,Home & Kitchen > Dishwashing > Dish Detergent
3121,552,dawn antibacterial dish soap orange 38 oz,Home & Kitchen > Dishwashing > Dish Detergent
3122,552,"williams-sonoma dish soap, lemongrass ginger",Home & Kitchen > Dishwashing > Dish Detergent
3123,552,"williams-sonoma essential oils dish soap, hand soap & lotion with wire caddy, fresh linen",Home & Kitchen > Dishwashing > Dish Detergent
3124,552,"williams-sonoma essential oils dish soap refill, vert frais",Home & Kitchen > Dishwashing > Dish Detergent
3125,552,"williams-sonoma essential oils dish soap refill, rosemary mint",Home & Kitchen > Dishwashing > Dish Detergent
3126,552,the honest company extra suds dish soap white grapefruit one size,Home & Kitchen > Dishwashing > Dish Detergent
3127,552,molton brown london london fine liquid hand wash rok radish and basil 10 oz,Home & Kitchen > Dishwashing > Dish Detergent
3128,552,molton brown london 'rok radish & basil' fine liquid hand wash rockrose and pine 10 oz,Home & Kitchen > Dishwashing > Dish Detergent
3129,552,babyganicsï¿½ 16 oz. fragrance-free foaming dish & bottle soap clear,Home & Kitchen > Dishwashing > Dish Detergent
3130,552,dapple® fragrance-free baby bottle & dish liquid 34 oz. refill pack clear 34 oz,Home & Kitchen > Dishwashing > Dish Detergent
3131,552,"mrs. meyer's clean day liquid dish soap, geranium - 16 oz - 3 pk",Home & Kitchen > Dishwashing > Dish Detergent
3132,552,babyganics foaming dish & bottle soap citrus- 16oz,Home & Kitchen > Dishwashing > Dish Detergent
3133,552,babyganics foaming dish & bottle soap - fragrance free - 3.38 oz,Home & Kitchen > Dishwashing > Dish Detergent
3134,552,dapple baby bottle & dish liquid - fragrance free - 34 oz,Home & Kitchen > Dishwashing > Dish Detergent
3135,552,dawn ultra platinum dishwashing liquid - 18 oz - refreshing rain,Home & Kitchen > Dishwashing > Dish Detergent
3136,552,common good dish soap - 16 oz - lavender,Home & Kitchen > Dishwashing > Dish Detergent
3137,552,planet ultra dishwashing liquid - 25 oz - free & clear,Home & Kitchen > Dishwashing > Dish Detergent
3138,552,dapple baby bottle & dish liquid refill pack - lavender - 34 oz,Home & Kitchen > Dishwashing > Dish Detergent
3139,552,"planet ultra dishwashing liquid, 2pk",Home & Kitchen > Dishwashing > Dish Detergent
3140,552,"method dish soap, cucumber - (18fl oz)",Home & Kitchen > Dishwashing > Dish Detergent
3141,552,earth friendly ultra liquid dishmate natural almond -- 25 fl oz,Home & Kitchen > Dishwashing > Dish Detergent
3142,552,method dish soap pump - 18 oz - sea minerals,Home & Kitchen > Dishwashing > Dish Detergent
3143,552,dawn ultra dishwashing liquid - original - 21.6 oz,Home & Kitchen > Dishwashing > Dish Detergent
3144,552,"method dish soap pump, basil - 18 oz",Home & Kitchen > Dishwashing > Dish Detergent
3145,552,"method limited edition pump dish soap, lemon mint, 18 oz",Home & Kitchen > Dishwashing > Dish Detergent
3146,552,babyganics foaming dish & bottle soap - fragrance free - 32 fl oz - 2 pk,Home & Kitchen > Dishwashing > Dish Detergent
3147,552,dawn dishwashing liquid - 25 oz - original,Home & Kitchen > Dishwashing > Dish Detergent
3148,552,palmolive ultra dish liquid - 25 oz - original - 2 pk,Home & Kitchen > Dishwashing > Dish Detergent
3149,552,dawn ultra hand renewal with olay beauty dishwashing liquid-pomegranate splash-44 oz,Home & Kitchen > Dishwashing > Dish Detergent
3150,552,palmolive ultra dishwashing liquid - 25 oz,Home & Kitchen > Dishwashing > Dish Detergent
3151,552,babyganics dish & bottle soap bundle - fragrance-free - 33.8 oz,Home & Kitchen > Dishwashing > Dish Detergent
3152,552,"method dish soap pump, ginger yuzu - 18 oz",Home & Kitchen > Dishwashing > Dish Detergent
3153,552,"method dish detergent, pink grapefruit - 20 ct - 2 pk",Home & Kitchen > Dishwashing > Dish Detergent
3154,552,babyganics dish dazzler foaming dish & bottle soap - fragrance free-16oz - 2 pack,Home & Kitchen > Dishwashing > Dish Detergent
3155,552,method dish soap pump - 18 oz - lemon mint,Home & Kitchen > Dishwashing > Dish Detergent
3156,552,palmolive ultra pure + clear spring fresh dish washing liquid-10oz,Home & Kitchen > Dishwashing > Dish Detergent
3157,552,dawn ultra dishwashing liquid - 38 oz - original - 2 pk,Home & Kitchen > Dishwashing > Dish Detergent
3158,552,"mrs. meyer's clean day liquid dish soap, lemon verbena, 16 oz-2 pack",Home & Kitchen > Dishwashing > Dish Detergent
3159,552,"method pump dish soap, sea minerals, 18 oz",Home & Kitchen > Dishwashing > Dish Detergent
3160,552,seventh generation ultra power plus™ natural dish liquid -- 22 fl oz,Home & Kitchen > Dishwashing > Dish Detergent
3161,552,ecover zero dish soap fragrance free -- 25 fl oz,Home & Kitchen > Dishwashing > Dish Detergent
3162,552,citrasolv citradish® natural dish soap lemon verbena -- 25 fl oz,Home & Kitchen > Dishwashing > Dish Detergent
3163,552,ajax dish liquid and hand soap orange 30.0 oz 2.38 lbs,Home & Kitchen > Dishwashing > Dish Detergent
3164,552,ajax antibacterial hand soap/dish liquid orange 16.0 oz 0.33 lbs,Home & Kitchen > Dishwashing > Dish Detergent
3165,552,j.r. watkins white tea & bamboo liquid dish soap,Home & Kitchen > Dishwashing > Dish Detergent
3166,552,stonewall kitchen caddy with 1 dish soap & 1 hand soap - grapefruit thyme - 16.9 oz,Home & Kitchen > Dishwashing > Dish Detergent
3167,552,palmolive ultra antibacterial dish liquid - 25 oz - orange,Home & Kitchen > Dishwashing > Dish Detergent
3168,552,method pump dish soap - 18 oz - clementine,Home & Kitchen > Dishwashing > Dish Detergent
3169,552,seventh generation dish liquid - 25 oz - lavender floral & mint,Home & Kitchen > Dishwashing > Dish Detergent
3170,552,mrs. meyer's clean day dish soap - 16 oz - iowa pine,Home & Kitchen > Dishwashing > Dish Detergent
3171,552,dawn ultra antibacterial antibacterial dishwashing liquid - apple blossom - 34.2 oz,Home & Kitchen > Dishwashing > Dish Detergent
3172,552,method pump dish soap - lemon mint - 18 oz - 2,Home & Kitchen > Dishwashing > Dish Detergent
3173,552,dawn ultra hand renewal with olay beauty dishwashing liquid - 18 oz - lavender silk,Home & Kitchen > Dishwashing > Dish Detergent
3174,552,method dish pump-ginger yuzu-18 oz,Home & Kitchen > Dishwashing > Dish Detergent
3175,552,palmolive ultra antibacterial dish liquid - orange - 25 oz,Home & Kitchen > Dishwashing > Dish Detergent
3176,552,"earth friendly products dishmate, dishwashing liquid-free & clear-25 oz",Home & Kitchen > Dishwashing > Dish Detergent
3177,552,better life liquid dish soap - lemon mint - 22 oz,Home & Kitchen > Dishwashing > Dish Detergent
3178,552,dawn ultra hand renewal with olay beauty dishwashing liquid - 44 oz - pomegranate splash,Home & Kitchen > Dishwashing > Dish Detergent
3179,552,common good lavendar dish soap in glass bottle,Home & Kitchen > Dishwashing > Dish Detergent
3180,552,clean day liquid dish soap - lavender 16 fl oz (473 ml) liquid,Home & Kitchen > Dishwashing > Dish Detergent
3181,552,natural dish liquid hand moisturizing 32 fl oz liquid,Home & Kitchen > Dishwashing > Dish Detergent
3182,552,"seventh generation natural dish liquid, free & clear - (50oz)",Home & Kitchen > Dishwashing > Dish Detergent
3183,552,"ajax dish liquid, lemon - (14oz)",Home & Kitchen > Dishwashing > Dish Detergent
3184,552,mrs. meyer's clean day liquid dish soap geranium 16 oz btl,Home & Kitchen > Dishwashing > Dish Detergent
3185,552,peapod ultra concentrated dish soap liquid original 10 oz btl,Home & Kitchen > Dishwashing > Dish Detergent
3186,552,stop & shop ultra dishwashing liquid & antibacterial hand soap citrus 24 oz btl,Home & Kitchen > Dishwashing > Dish Detergent
3187,552,peapod ultra concentrated dish liquid waterfall mist scent 24 oz btl,Home & Kitchen > Dishwashing > Dish Detergent
3188,552,seventh generation dish liquid fresh citrus & ginger natural 25 oz btl,Home & Kitchen > Dishwashing > Dish Detergent
3189,552,dawn classic dishwashing liquid original scent 75 oz btl,Home & Kitchen > Dishwashing > Dish Detergent
3190,552,dawn ultra dishwashing liquid new zealand springs scent 21.6 oz btl,Home & Kitchen > Dishwashing > Dish Detergent
3191,552,ivory ultra dishwashing liquid concentrated classic scent 24 oz btl,Home & Kitchen > Dishwashing > Dish Detergent
3192,552,earth friendly ultra dishmate dish liquid free & clear 100% natural 25 oz btl,Home & Kitchen > Dishwashing > Dish Detergent
3193,552,sun & earth xtra concentrated dish liquid citrus hypo-allergenic natural 22 oz btl,Home & Kitchen > Dishwashing > Dish Detergent
3194,552,stop & shop ultra dish washing liquid hand rejuvenating lavender 20 oz btl,Home & Kitchen > Dishwashing > Dish Detergent
3195,552,nature's promise free from liquid dish detergent eucalyptus aloe scent 25 oz btl,Home & Kitchen > Dishwashing > Dish Detergent
3196,552,"legacy of clean® dish drops® dish liquid, citrus scent, 16.9 fl. oz./500 ml",Home & Kitchen > Dishwashing > Dish Detergent
3197,552,seventh generation dishwashing liquid lavender - 25 oz,Home & Kitchen > Dishwashing > Dish Detergent
3198,552,bright green dish soap liquid free and clear - 25 fl. oz.,Home & Kitchen > Dishwashing > Dish Detergent
3199,552,ivory dishwashing liquid ultra concentrated classic scent - 90 fl. oz.,Home & Kitchen > Dishwashing > Dish Detergent
3200,552,dawn ultra concentrated antibacterial hand soap dishwashing liquid,Home & Kitchen > Dishwashing > Dish Detergent
3201,552,"palmolive palmolive original dish soap, original scent, 25 fl oz",Home & Kitchen > Dishwashing > Dish Detergent
3202,552,"seventh generation seventh generation dish soap, lemongrass & clementine zes...",Home & Kitchen > Dishwashing > Dish Detergent
3203,552,"mrs. meyer's clean day dish soap, lemon verbena, 16 ounce multipack (9 bottles (16 fl oz ea) total)",Home & Kitchen > Dishwashing > Dish Detergent
3204,552,"dapple dapple dish liquid travel size, 3 fl oz",Home & Kitchen > Dishwashing > Dish Detergent
3205,552,"palmolive palmolive original dish soap, 3 fl oz",Home & Kitchen > Dishwashing > Dish Detergent
3206,552,mrs. meyer's clean day mrs. meyers dish soap - iowa pine - 16 oz,Home & Kitchen > Dishwashing > Dish Detergent
3207,552,"dawn dawn hand renewal with olay dish soap lavender, 18 fl oz",Home & Kitchen > Dishwashing > Dish Detergent
3208,552,"dawn dawn pure essentials dishwashing liquid, sparkling mist, ...",Home & Kitchen > Dishwashing > Dish Detergent
3209,552,dapple dapple dish liquid - travel size - 3 ounce,Home & Kitchen > Dishwashing > Dish Detergent
3210,552,palmolive ultra dish washing liquid - pure & clear - 10 oz,Home & Kitchen > Dishwashing > Dish Detergent
3211,552,earth friendly ultra liquid dishmate natural pear -- 25 fl oz,Home & Kitchen > Dishwashing > Dish Detergent
3212,552,earth friendly ultra liquid dishmate lavender -- 25 fl oz,Home & Kitchen > Dishwashing > Dish Detergent
3213,552,caldrea liquid dish soap - 16 oz - mandarin vetiver,Home & Kitchen > Dishwashing > Dish Detergent
3214,552,dawn ultra hand renewal with olay beauty dishwashing liquid - 20 oz - cool springs,Home & Kitchen > Dishwashing > Dish Detergent
3215,552,ecover dishwashing liquid - 16 oz - lemon & aloe,Home & Kitchen > Dishwashing > Dish Detergent
3216,552,"dawn power clean dishwashing liquid, refreshing rain scent, 30 oz",Home & Kitchen > Dishwashing > Dish Detergent
3217,552,"dawn ultra antibacterial antibacterial dishwashing liquid, apple blossom - 38 oz",Home & Kitchen > Dishwashing > Dish Detergent
3218,552,dawn ultra dishwashing liquid - 34.2 oz - new zealand springs,Home & Kitchen > Dishwashing > Dish Detergent
3219,552,mrs. meyer's clean day liquid dish soap - peony - 16 oz,Home & Kitchen > Dishwashing > Dish Detergent
3220,552,dawn ultra power clean dishwashing liquid - 30 oz - refreshing rain,Home & Kitchen > Dishwashing > Dish Detergent
3221,552,ultra liquid dishmate natural pear 25 fl oz liquid,Home & Kitchen > Dishwashing > Dish Detergent
3222,552,mrs. meyer's clean day liquid dish soap - lemon liquid 16 fl oz (473 ml) liquid,Home & Kitchen > Dishwashing > Dish Detergent
3223,552,clean day liquid dish soap - lemon 16 fl oz liquid,Home & Kitchen > Dishwashing > Dish Detergent
3224,552,clean day liquid dish soap - bluebell 16 fl oz liquid,Home & Kitchen > Dishwashing > Dish Detergent
3225,552,"seventh generation hand care natural dish liquid, free & clear - (18oz)",Home & Kitchen > Dishwashing > Dish Detergent
3226,552,"dawn ultra blue dishwashing liquid, original scent - (21.6fl oz)",Home & Kitchen > Dishwashing > Dish Detergent
3227,552,"dawn ultra blue dishwashing liquid, original scent - (24oz)",Home & Kitchen > Dishwashing > Dish Detergent
3228,552,"earth friendly products ultra dishmate liquid dishwashing cleaner, natural grapefruit - (25oz)",Home & Kitchen > Dishwashing > Dish Detergent
3229,552,palmolive original dishwashing liquid - (25oz),Home & Kitchen > Dishwashing > Dish Detergent
3230,552,palmolive ultra mild dishwashing liquid,Home & Kitchen > Dishwashing > Dish Detergent
3231,552,dawn professional dish detergent (1 gal.),Home & Kitchen > Dishwashing > Dish Detergent
3232,552,dawntotalclean,Home & Kitchen > Dishwashing > Dish Detergent
3233,552,palmolive® ultra antibacterial dish liquid (90 fl.oz.),Home & Kitchen > Dishwashing > Dish Detergent
3234,552,ajax dish liquid with bleach alternative grapefruit 30 oz btl,Home & Kitchen > Dishwashing > Dish Detergent
3235,552,ajax dish liquid with bleach alternative lime 28 oz btl,Home & Kitchen > Dishwashing > Dish Detergent
3236,552,ajax dish liquid antibacterial orange 12.6 oz btl,Home & Kitchen > Dishwashing > Dish Detergent
3237,552,dawn ultra dishwashing liquid hand renewal with olay beauty lavender silk 18 oz btl,Home & Kitchen > Dishwashing > Dish Detergent
3238,552,mrs. meyer's clean day liquid dish soap lemon verbena scent 16 oz btl,Home & Kitchen > Dishwashing > Dish Detergent
3239,552,legacy of clean™ dish drops® concentrated dish liquid,Home & Kitchen > Dishwashing > Dish Detergent
3240,552,dawn plus hand renewal cucumber & melon - 20 fl. oz.,Home & Kitchen > Dishwashing > Dish Detergent
3241,552,palmolive ultra concentrated dish liquid soft touch with aloe - 25 fl. oz.,Home & Kitchen > Dishwashing > Dish Detergent
3242,552,dawn original - 75 fl. oz.,Home & Kitchen > Dishwashing > Dish Detergent
3243,552,dawn ultra anti bacterial orange - 75 fl. oz.,Home & Kitchen > Dishwashing > Dish Detergent
3244,552,dawn original - 14.6 fl. oz.,Home & Kitchen > Dishwashing > Dish Detergent
3245,552,"meijer ecowise dish liquid, eucalyptus lemon, 25 oz",Home & Kitchen > Dishwashing > Dish Detergent
3246,552,"dawn ultra hand renewal dish soap w/ olay beauty, lavender, 20oz",Home & Kitchen > Dishwashing > Dish Detergent
3247,552,"the home store ultra dish citrus liquid dish detergent, 30-oz.",Home & Kitchen > Dishwashing > Dish Detergent
3248,552,method dish soap biodegradable 18 oz pump,Home & Kitchen > Dishwashing > Dish Detergent
3249,552,"method method dish soap, pink grapefruit, 18 ounce",Home & Kitchen > Dishwashing > Dish Detergent
3250,552,"dawn dawn(r) dishwashing liquid, original scent, 9 oz, bottles",Home & Kitchen > Dishwashing > Dish Detergent
3251,552,"dawn dawn escapes dish soap, caribbean breeze, 21.6 fl oz",Home & Kitchen > Dishwashing > Dish Detergent
3252,552,"palmolive palmolive ultra antibacterial dish soap, orange, 50 fl oz",Home & Kitchen > Dishwashing > Dish Detergent
3253,552,"boulder clean boulder clean dish soap, valencia orange, 28 fl oz",Home & Kitchen > Dishwashing > Dish Detergent
3254,552,"method method power foam dish soap, waterfall, 16 fl oz",Home & Kitchen > Dishwashing > Dish Detergent
3255,552,"mrs. meyer's clean day mrs. meyer's clean day dish soap - lemon verbena, 16 oz.",Home & Kitchen > Dishwashing > Dish Detergent
3256,552,"palmolive palmolive dishwashing liquid original, 90 fl oz",Home & Kitchen > Dishwashing > Dish Detergent
3257,552,"palmolive palmolive dishwashing liquid original, 52 fl oz",Home & Kitchen > Dishwashing > Dish Detergent
3258,552,"method method liquid dish soap sea minerals, 18 fl oz sea minerals",Home & Kitchen > Dishwashing > Dish Detergent
3259,552,palmolive palmolive ultra oxy plus power degreaser concentrated dis...,Home & Kitchen > Dishwashing > Dish Detergent
3260,552,"dapple dapple baby bottle & dish liquid, 34 fl oz",Home & Kitchen > Dishwashing > Dish Detergent
3261,552,"gain gain dish liquid soap, honeyberry hula, 24 fl oz",Home & Kitchen > Dishwashing > Dish Detergent
3262,552,"sun & earth sun & earth dish soap, light citrus, 22 fl oz",Home & Kitchen > Dishwashing > Dish Detergent
3263,552,"palmolive palmolive dish soap, 102 fl oz",Home & Kitchen > Dishwashing > Dish Detergent
3264,552,"ultra gain lavender scent dishwashing liquid, 24 fl oz",Home & Kitchen > Dishwashing > Dish Detergent
3265,552,"dawn ultra concentrated dishwashing liquid apple blossom antibacterial hand soap, 21.6 oz",Home & Kitchen > Dishwashing > Dish Detergent
3266,552,"dawn dishwashing foam refill, 30.9 oz",Home & Kitchen > Dishwashing > Dish Detergent
3267,552,dawn direct foam fresh rapids 915 ml,Home & Kitchen > Dishwashing > Dish Detergent
3268,552,green works natural manual pot & pan dish liquid,Home & Kitchen > Dishwashing > Dish Detergent
3269,552,mrs. meyer's basil liquid dish soap,Home & Kitchen > Dishwashing > Dish Detergent
3270,552,"dawn hand soap/dishwashing liquid, ultra concentrated, antibacterial, apple blossom scent 9 fl oz (266 ml)",Home & Kitchen > Dishwashing > Dish Detergent
3271,552,mrs. meyer's basil liquid dish soap 16 oz,Home & Kitchen > Dishwashing > Dish Detergent
3272,552,"dawn ultra antibacterial dishwashing liquid, apple blossom - 24 oz bottle",Home & Kitchen > Dishwashing > Dish Detergent
3273,552,earth friendly grapefruit dishmate - 25 oz bottle,Home & Kitchen > Dishwashing > Dish Detergent
3274,552,dawn ultra original scent liquid d...,Home & Kitchen > Dishwashing > Dish Detergent
3275,552,mrs. meyer's dish soap basil - 16 ...,Home & Kitchen > Dishwashing > Dish Detergent
3276,552,palmolive ultra oxy plus power degreaser concentrated dish liquid - 10,Home & Kitchen > Dishwashing > Dish Detergent
3277,552,dawn original 2x concentrated liquid dishwashing soap 24 oz,Home & Kitchen > Dishwashing > Dish Detergent
3278,552,organic fit organic 90 oz liquid dish detergent,Home & Kitchen > Dishwashing > Dish Detergent
3279,552,palmolive ultra concentrated dish ...,Home & Kitchen > Dishwashing > Dish Detergent
3280,552,"earth friendly, free & clear wave auto dish gel, 40 fl oz",Home & Kitchen > Dishwashing > Dish Detergent
3281,552,"mrs. meyer's liquid dish soap, sunflower, 16 fluid ounce",Home & Kitchen > Dishwashing > Dish Detergent
3282,552,"seventh generation&reg; natural dishwashing liquid, 25 oz",Home & Kitchen > Dishwashing > Dish Detergent
3283,552,dawn platinum power dishwas - 9.00 fl oz,Home & Kitchen > Dishwashing > Dish Detergent
3284,552,oxi dish detergent - 10.20 oz,Home & Kitchen > Dishwashing > Dish Detergent
3285,552,dawn dishwashing liquid - 24.00 fl oz,Home & Kitchen > Dishwashing > Dish Detergent
3286,552,mrs. meyer's clean liquid dish soap - bas - 16.00 fl oz,Home & Kitchen > Dishwashing > Dish Detergent
3287,552,gain dish liquid soap origi - 24.00 fl oz,Home & Kitchen > Dishwashing > Dish Detergent
3288,552,"planet, inc. ultra dishwashing liquid",Home & Kitchen > Dishwashing > Dish Detergent
3289,552,"ultra gain dish liquid soap, hawaiian aloha, 24 fl oz dish care 24 fl oz plastic jug",Home & Kitchen > Dishwashing > Dish Detergent
3290,552,"j r watkins, natural home care, dish soap, lavender, 24 fl oz (710 ml)",Home & Kitchen > Dishwashing > Dish Detergent
3291,552,"attitude, baby bottle & dishwashing liquid, fragrance-free, 23.7 fl oz (700 ml)",Home & Kitchen > Dishwashing > Dish Detergent
3292,552,"mrs. meyers clean day, liquid dish soap, lavender scent, 16 fl oz (473 ml)",Home & Kitchen > Dishwashing > Dish Detergent
3293,552,boxed dawn ultra 75-oz. dish detergent,Home & Kitchen > Dishwashing > Dish Detergent
3294,552,babyganics — fragrance-free foam dish/bottle soap - set of three size one-size,Home & Kitchen > Dishwashing > Dish Detergent
3295,552,"Puracy Natural Liquid Dish Soap, Green Tea and Lime - 1 Pack",Home & Kitchen > Dishwashing > Dish Detergent
3296,552,"MRS MEYERS Liquid Dish Soap, Lemon Verbena, 48 Fluid Ounce",Home & Kitchen > Dishwashing > Dish Detergent
3297,552,Mrs. Meyer's Clean Day Dish Soap - Lemon Verbena - 16 oz,Home & Kitchen > Dishwashing > Dish Detergent
3298,552,"Ajax Bleach Alternative Citrus Berry Splash Dish Liquid, 28 fl oz",Home & Kitchen > Dishwashing > Dish Detergent
3299,552,Dawn Ultra Concentrated Antibacterial H...,Home & Kitchen > Dishwashing > Dish Detergent
3300,552,"Dawn Dishwashing Liquid, Original Scent...",Home & Kitchen > Dishwashing > Dish Detergent
3301,552,Method Dish Soap Honeycrisp Apple ...,Home & Kitchen > Dishwashing > Dish Detergent
3302,552,Dawn Ultra Antibacterial Dishwashi...,Home & Kitchen > Dishwashing > Dish Detergent
3303,552,Method Clementine Dish Soap Refill 36 o...,Home & Kitchen > Dishwashing > Dish Detergent
3304,552,Seventh Generation Natural Dish Liquid - 25.00 fl oz,Home & Kitchen > Dishwashing > Dish Detergent
3305,552,Dawn Ultra Original Scent D - 24.00 fl oz,Home & Kitchen > Dishwashing > Dish Detergent
3306,552,"seventh generation seventh generation dish liquid - fresh citrus & ginger, 2...",Home & Kitchen > Dishwashing > Dish Detergent
3307,552,"palmolive dish detergent, original - 1 gal jug",Home & Kitchen > Dishwashing > Dish Detergent
3308,552,dawn non concentrated bleach alternative dishwashing liquid - 12.6 oz - fresh rapids,Home & Kitchen > Dishwashing > Dish Detergent
3309,552,caldrea liquid dish soap - 16 oz - ginger pomelo,Home & Kitchen > Dishwashing > Dish Detergent
3310,552,caldrea liquid dish soap-sea salt neroli-16oz,Home & Kitchen > Dishwashing > Dish Detergent
3311,552,j. r. watkins liquid dish soap - 24 oz - lemon,Home & Kitchen > Dishwashing > Dish Detergent
3312,552,ultra dishmate dishwashing cleaner 25 fl oz liquid,Home & Kitchen > Dishwashing > Dish Detergent
3313,552,clean day liquid dish soap - lemon 16 fl oz (473 ml) liquid,Home & Kitchen > Dishwashing > Dish Detergent
3314,552,"the honest company dish soap, white grapefruit - (26.5fl oz)",Home & Kitchen > Dishwashing > Dish Detergent
3315,552,"common good dish soap, lavender - (16fl oz)",Home & Kitchen > Dishwashing > Dish Detergent
3316,552,"seventh generation natural dish liquid, lavender floral & mint - (25fl oz)",Home & Kitchen > Dishwashing > Dish Detergent
3317,552,dawnoriginal,Home & Kitchen > Dishwashing > Dish Detergent
3318,552,guaranteed value ultra liquid dishwashing & hand soap antibacterial 25 oz btl,Home & Kitchen > Dishwashing > Dish Detergent
3319,552,dawn ultra dishwashing liquid original scent 21.6 oz btl,Home & Kitchen > Dishwashing > Dish Detergent
3320,552,dawn ultra dishwashing liquid apple blossom 21.6 oz btl,Home & Kitchen > Dishwashing > Dish Detergent
3321,552,giant ultra concentrated dish washing liquid lemon 25 oz btl,Home & Kitchen > Dishwashing > Dish Detergent
3322,552,dawn ultra concentrated dishwashing liquid original scent 34.2 oz btl,Home & Kitchen > Dishwashing > Dish Detergent
