,category_id,description,category_path
882,552,dawn ultra platinum power clean refreshing rain scent liquid dish soap 20 oz,Home & Kitchen > Dishwashing > Dish Detergent
883,552,mrs meyers dish cranberry 16.0fl0z,Home & Kitchen > Dishwashing > Dish Detergent
884,552,up&up hand wash dish soap - unscented - 24 oz,Home & Kitchen > Dishwashing > Dish Detergent
885,552,mrs. meyer's dish soap cranberry 16oz,Home & Kitchen > Dishwashing > Dish Detergent
886,552,method orla kiely dish soap - pear ginger 18 oz,Home & Kitchen > Dishwashing > Dish Detergent
887,552,method ®pink persimmon dish soap 18 oz,Home & Kitchen > Dishwashing > Dish Detergent
888,552,original refill liquid hand wash dish soap - blue - 60oz - up & up™,Home & Kitchen > Dishwashing > Dish Detergent
889,552,palmolive ultra fusion clean baking soda & grapefruit dish soap - 22 oz,Home & Kitchen > Dishwashing > Dish Detergent
890,552,"great value pomegranate scent dishwashing liquid, 60 oz",Home & Kitchen > Dishwashing > Dish Detergent
891,552,babyganics foam dish and bottle soap refill fragrance free - 32 ounce,Home & Kitchen > Dishwashing > Dish Detergent
892,552,"palmolive ultra original dish liquid, 38 oz",Home & Kitchen > Dishwashing > Dish Detergent
893,552,"great value antibacterial green apple scent refill size dishwashing liquid/hand soap, 60 oz",Home & Kitchen > Dishwashing > Dish Detergent
894,552,"gain ultra apple berry twist dishwashing liquid, 40 fl oz",Home & Kitchen > Dishwashing > Dish Detergent
895,552,dawn ultra original scent dishwashing liquid 56 fl oz,Home & Kitchen > Dishwashing > Dish Detergent
896,552,"dawn ultra antibacterial hand soap orange scent dishwashing liquid, 24 fl oz",Home & Kitchen > Dishwashing > Dish Detergent
897,552,"palmolive original dish liquid, 52 fl oz",Home & Kitchen > Dishwashing > Dish Detergent
898,552,dapple fragrance-free baby bottle and dish liquid 16.9 ounce - apple-pear one color,Home & Kitchen > Dishwashing > Dish Detergent
899,552,babyganics dish dazzler foaming dish & bottle soap refill - 33.8 ounce,Home & Kitchen > Dishwashing > Dish Detergent
900,552,babyganics foaming dish and baby bottle soap refill- citrus- 32 ounce bottle one color,Home & Kitchen > Dishwashing > Dish Detergent
901,552,babies r us bottle dish soap,Home & Kitchen > Dishwashing > Dish Detergent
902,552,dish liquid with bleach alternative grapefruit ajax 14.0 fl oz,Home & Kitchen > Dishwashing > Dish Detergent
903,552,super degreaser dish liquid lemon ajax 14.0 fl oz,Home & Kitchen > Dishwashing > Dish Detergent
904,552,dish soap refill sea minerals method,Home & Kitchen > Dishwashing > Dish Detergent
905,552,ultra dish liquid original palmolive,Home & Kitchen > Dishwashing > Dish Detergent
906,552,mrs. meyer's clean day liquid dish soap lavender 16.0 fl oz,Home & Kitchen > Dishwashing > Dish Detergent
907,552,palmolive soft touch liquid dish soap with vitamin e 25.0 fl oz,Home & Kitchen > Dishwashing > Dish Detergent
908,552,liquid dish soap honeysuckle mrs. meyer's clean day,Home & Kitchen > Dishwashing > Dish Detergent
909,552,"ajax(reg) triple action orange dish liquid, 30 oz.",Home & Kitchen > Dishwashing > Dish Detergent
910,552,palmolive antibacterial liquid dish soap orange 25oz,Home & Kitchen > Dishwashing > Dish Detergent
911,552,clorox green worksreg dishwashing liquid original 22 oz,Home & Kitchen > Dishwashing > Dish Detergent
912,552,"dawn® antibacterial dishwashing liquid, orange scent, 34.2 oz.",Home & Kitchen > Dishwashing > Dish Detergent
913,552,"dcx gw dish liquid,orig 6",Home & Kitchen > Dishwashing > Dish Detergent
914,552,18-oz orange dish soap,Home & Kitchen > Dishwashing > Dish Detergent
915,552,14-oz orange dish soap,Home & Kitchen > Dishwashing > Dish Detergent
916,552,ws dish soap spiced chstnut,Home & Kitchen > Dishwashing > Dish Detergent
917,552,"williams-sonoma essential oils dish soap, black fig",Home & Kitchen > Dishwashing > Dish Detergent
918,552,"tuscan cedarwood dish soap, hand soap and lotion with caddy, set of 3, tuscan cedarwood",Home & Kitchen > Dishwashing > Dish Detergent
919,552,babyganics(r) 16 oz. citrus foaming dish & bottle soap,Home & Kitchen > Dishwashing > Dish Detergent
920,552,"berkley green baby™ 24 oz. bottle, dish & toy liquid clear 24 oz",Home & Kitchen > Dishwashing > Dish Detergent
921,552,honest 16-ounce dish soap in grapefruit scent clear/multi 16 oz,Home & Kitchen > Dishwashing > Dish Detergent
922,552,babyganicsï¿½ 16 oz. citrus foaming dish & bottle soap,Home & Kitchen > Dishwashing > Dish Detergent
923,552,dapple® fragrance free dish liquid clear 16.9 oz,Home & Kitchen > Dishwashing > Dish Detergent
924,552,"palmolive ultra pure & clear dishwashing liquid, 25 oz-2 pack",Home & Kitchen > Dishwashing > Dish Detergent
925,552,"method pump dish soap, clementine, 18 oz",Home & Kitchen > Dishwashing > Dish Detergent
926,552,method dish soap pump - sea minerals - 18 oz - 3 pk,Home & Kitchen > Dishwashing > Dish Detergent
927,552,dapple refill pack: baby bottle and dish liquid,Home & Kitchen > Dishwashing > Dish Detergent
928,552,mrs. meyer's clean day liquid dish soap - 16 oz - basil - 3 pk,Home & Kitchen > Dishwashing > Dish Detergent
929,552,"palmolive phosphate free dishwashing detergent, lemon splash - 45 oz",Home & Kitchen > Dishwashing > Dish Detergent
930,552,"palmolive dish liquid, dish & sink - 25 oz - cucumber citrus",Home & Kitchen > Dishwashing > Dish Detergent
931,552,"seventh generation dish liquid, floral mint, 25 oz, 3 pack",Home & Kitchen > Dishwashing > Dish Detergent
932,552,ecover dish soap pink geranium -- 25 oz,Home & Kitchen > Dishwashing > Dish Detergent
933,552,attitude eco baby dishwashing liquid -- 23.7 fl oz,Home & Kitchen > Dishwashing > Dish Detergent
934,552,better life dish it out natural dish soap clary sage + citrus -- 22 fl oz,Home & Kitchen > Dishwashing > Dish Detergent
935,552,better life dish it out™ natural dish soap unscented -- 22 fl oz,Home & Kitchen > Dishwashing > Dish Detergent
936,552,dawn dish liquid antibacterial apple blossom 9.0 oz 0.92 lbs,Home & Kitchen > Dishwashing > Dish Detergent
937,552,"mrs. meyer's clean day liquid dish soap, rosemary",Home & Kitchen > Dishwashing > Dish Detergent
938,552,dawn ultra hand renewal with olay beauty dishwashing liquid - cool springs - 18 oz,Home & Kitchen > Dishwashing > Dish Detergent
939,552,"ivory ultra dishwashing liquid, 24oz",Home & Kitchen > Dishwashing > Dish Detergent
940,552,method power dish foam - 16 oz - lemon mint,Home & Kitchen > Dishwashing > Dish Detergent
941,552,"method power dish foam, pink grapefruit, 16 oz, 2 ct",Home & Kitchen > Dishwashing > Dish Detergent
942,552,"bayes dish soap, unscented - 16 oz",Home & Kitchen > Dishwashing > Dish Detergent
943,552,"method limited edition dish soap pump, beach sage - 18 oz",Home & Kitchen > Dishwashing > Dish Detergent
944,552,ivory dishwashing liquid - 24 oz,Home & Kitchen > Dishwashing > Dish Detergent
945,552,"dawn ultra antibacterial dishwashing liquid, apple blossom, 38 oz",Home & Kitchen > Dishwashing > Dish Detergent
946,552,"Method Gel Dish Pump, Pear Ginger, 6 Count",Home & Kitchen > Dishwashing > Dish Detergent
947,552,"palmolive original dish liquid, 30 fluid ounce",Home & Kitchen > Dishwashing > Dish Detergent
948,552,"dapple: refill pack: baby bottle and dish liquid, 34 oz",Home & Kitchen > Dishwashing > Dish Detergent
949,552,Legacy of Clean Dish Drops Dishwashing Liquid Detergent REFILL - Original Scent - 1 L/33.8 fl. oz.,Home & Kitchen > Dishwashing > Dish Detergent
950,552,"palmolive ultra soft touch with aloe dish liquid, 25-ounce (pack of 2)",Home & Kitchen > Dishwashing > Dish Detergent
951,552,Better Life Dishwashing Soap - Sage and Citrus - 22 fl oz,Home & Kitchen > Dishwashing > Dish Detergent
952,552,365 Everyday Value Dish Soap - Citrus (Pack of 2),Home & Kitchen > Dishwashing > Dish Detergent
953,552,"Dawn Ultra Dishwashing Liquid, Original Scent, 21.6 Ounce, (Pack of 4)",Home & Kitchen > Dishwashing > Dish Detergent
954,552,"Dawn Ultra Hand Renewal Dishwashing Liquid with Olay Beauty Pomegranate Splash Scent, 9 Oz",Home & Kitchen > Dishwashing > Dish Detergent
955,552,"4 Pk, Dawn Platinum Power Clean Refreshing Rain Scent Dishwashing Liquid 20 ounce",Home & Kitchen > Dishwashing > Dish Detergent
956,552,Method Dish Soap Pump - 18 Oz - Lime Sea Salt - 3 Pk,Home & Kitchen > Dishwashing > Dish Detergent
957,552,"babyganics foaming dish soap refill, citrus, 32 fluid ounce, packaging may vary",Home & Kitchen > Dishwashing > Dish Detergent
958,552,the honest company liquid dish soap  16 oz  lavender new,Home & Kitchen > Dishwashing > Dish Detergent
959,552,"j.r. watkins natural liquid dish soap, lavender, 24 ounce (pack of 6)",Home & Kitchen > Dishwashing > Dish Detergent
960,552,method dish soap pump - 18 oz - basil,Home & Kitchen > Dishwashing > Dish Detergent
961,552,cucina lime zest and cypress 16.9 oz concentrated dish detergent,Home & Kitchen > Dishwashing > Dish Detergent
962,552,method dish soap sea minerals pack of 3,Home & Kitchen > Dishwashing > Dish Detergent
963,552,"PGC56037 Dish Power Dissolver, 32oz Spray Bottle, 6 per Case",Home & Kitchen > Dishwashing > Dish Detergent
964,552,baby bottle+dish liquid,Home & Kitchen > Dishwashing > Dish Detergent
965,552,"100% natural liquid dish soap (3 pack), green tea & lime, 16 ounce bottle",Home & Kitchen > Dishwashing > Dish Detergent
966,552,method dish soap biodegradable lemon 18 oz pump,Home & Kitchen > Dishwashing > Dish Detergent
967,552,Dapple Baby Bottle and Dish Liquid - Lavender - 34 oz - 2 pk,Home & Kitchen > Dishwashing > Dish Detergent
968,552,"palmolive ultra baby bottles, toy and dish wash liquid, 25 ounce (3 pack)",Home & Kitchen > Dishwashing > Dish Detergent
969,552,Seventh Generation Natural Liquid Dish Soap,Home & Kitchen > Dishwashing > Dish Detergent
970,552,"method smarty dish detergent, pink grapefruit, 20 ct",Home & Kitchen > Dishwashing > Dish Detergent
971,552,"dawn ultra concentrated dishwashing liquid dish detergent refill size, original scent, 56 fl oz (2x concentrated strength)",Home & Kitchen > Dishwashing > Dish Detergent
972,552,"mrs. meyer's clean day liquid dishsoap, geranium - 16 oz",Home & Kitchen > Dishwashing > Dish Detergent
973,552,"method gel dish pump, lime and sea salt, 18 ounce",Home & Kitchen > Dishwashing > Dish Detergent
974,552,Method Dish Soap Pump - 18 oz - Pink Grapefruit - 2 pk,Home & Kitchen > Dishwashing > Dish Detergent
975,552,eco-friendly dishwashing liquid 25 fl oz (739 ml) liquid,Home & Kitchen > Dishwashing > Dish Detergent
976,552,"Citrasolv/Homesolv Dish Free and Clear Dishwashing Liquid, 25 Fluid Ounce",Home & Kitchen > Dishwashing > Dish Detergent
977,552,babyganics dish dazzler foaming dish & bottle soap - fragrance free - 2 pack,Home & Kitchen > Dishwashing > Dish Detergent
978,552,"method gel dish pump refill, sea minerals, 36 fluid ounce health and beauty",Home & Kitchen > Dishwashing > Dish Detergent
979,552,"J.R. Watkins Liquid Dish Soap, Aloe and Green Tea, 24 Fluid Ounce",Home & Kitchen > Dishwashing > Dish Detergent
980,552,"simple human liquid dish soap with refill pouch, lemon, 34 fluid ounce",Home & Kitchen > Dishwashing > Dish Detergent
981,552,"palmolive tropical tango dish liquid, 12.6 ounce quantity: 3",Home & Kitchen > Dishwashing > Dish Detergent
982,552,"Dawn Ultra Dishwashing Liquid Original Scent, 56 Fluid Ounce, 2 Count",Home & Kitchen > Dishwashing > Dish Detergent
983,552,Pure & Basic Dish Soap - 33.8 fl. oz. - 1000 ml (Apple Spice),Home & Kitchen > Dishwashing > Dish Detergent
984,552,"palmolive classic fresh citrus blast, 14 fluid ounce",Home & Kitchen > Dishwashing > Dish Detergent
985,552,CUCINA Dish Detergent Refills - 34 fl. oz.- Lime Zest & Cypress,Home & Kitchen > Dishwashing > Dish Detergent
986,552,planet ultra dishwashing liquid -- 25 fl oz,Home & Kitchen > Dishwashing > Dish Detergent
987,552,2 of caldrea basil blue set countertop spray + liquid dish soap 16oz,Home & Kitchen > Dishwashing > Dish Detergent
988,552,Dawn Direct Foam Diswashing Foam Surge - 10.15 oz - Lime Surge - 2 pk,Home & Kitchen > Dishwashing > Dish Detergent
989,552,"mrs. meyer's clean day liquid dish soap, honeysuckle, 16 fluid ounce",Home & Kitchen > Dishwashing > Dish Detergent
990,552,"dawn ultra hand renewal with olay beauty dishwashing liquid, tropical shea butter scent, white, 30-ounce",Home & Kitchen > Dishwashing > Dish Detergent
991,552,"Seventh Generation Natural Hand Dish Refill, Free and Clear, 36 Ounce",Home & Kitchen > Dishwashing > Dish Detergent
992,552,"dawn ultra antibacterial hand soap dishwashing liquid, orange scent, 9 ounce (pack of 18)",Home & Kitchen > Dishwashing > Dish Detergent
993,552,"the honest company dish soap (16 oz, lemon verbena)",Home & Kitchen > Dishwashing > Dish Detergent
994,552,"Dawn Platinum Power Clean Dishwashing Liquid, Refreshing Rain, 18 Fluid Ounce",Home & Kitchen > Dishwashing > Dish Detergent
995,552,"dawn ultra platinum, bleach alt. 3x more grease cleaning power, (2) 20 fl oz bottles, total: 40 fl oz",Home & Kitchen > Dishwashing > Dish Detergent
996,552,"dawn ultra concentrated antibacterial hand soap dishwashing liquid, orange scent, 21.6 ounce (pack of 2)",Home & Kitchen > Dishwashing > Dish Detergent
997,552,"Sun & Earth Natural Dish Soap, Light Citrus 128 fl. Oz.",Home & Kitchen > Dishwashing > Dish Detergent
998,552,dawn ultra concentrated original scent dishwashing liquid 38 oz,Home & Kitchen > Dishwashing > Dish Detergent
999,552,"Better Life Dish Soap, Unscented, 22 Ounces",Home & Kitchen > Dishwashing > Dish Detergent
1000,552,dapple fragrance-free baby bottle & dish liquid,Home & Kitchen > Dishwashing > Dish Detergent
1001,552,ecover dishwashing liquid,Home & Kitchen > Dishwashing > Dish Detergent
1002,552,liquid dish soap 16oz rosemary,Home & Kitchen > Dishwashing > Dish Detergent
1003,552,"Dawn Ultra Dishwasing Liquid, Original Scent, Blue, 21.6 Ounce (Pack of 2)",Home & Kitchen > Dishwashing > Dish Detergent
1004,552,"Method Dish Soap, Lemon Mint, 3 Count",Home & Kitchen > Dishwashing > Dish Detergent
1005,552,"method dish soap pump, clementine, 18-ounce (pack of 6)",Home & Kitchen > Dishwashing > Dish Detergent
1006,552,dawn ultra dishwashing liquid - 24 oz - original - 3 pk,Home & Kitchen > Dishwashing > Dish Detergent
1007,552,"ajax 14616 pink rose lotion dish detergent for hand dishwashing, 1 gallon",Home & Kitchen > Dishwashing > Dish Detergent
1008,552,dawn ultra concentrated - 90 oz. bottle,Home & Kitchen > Dishwashing > Dish Detergent
1009,552,"Dawn, Ultra Dishwashing Liquid 56 Fl Oz and Antibacterial Hand Soap Apple Blossom Scent",Home & Kitchen > Dishwashing > Dish Detergent
1010,552,palmolive ultra original dish liquid 25 ounce palmolive,Home & Kitchen > Dishwashing > Dish Detergent
1011,552,"dawn ultra antibacterial hand soap dishwashing liquid, apple blossom scent, green, 14 ounce (pack of 5) quantity: 2",Home & Kitchen > Dishwashing > Dish Detergent
1012,552,"mrs. meyer's clean day liquid dish soap, rosemary, 3pk",Home & Kitchen > Dishwashing > Dish Detergent
1013,552,"williams-sonoma essential oils collection dish soap, peppermint",Home & Kitchen > Dishwashing > Dish Detergent
1014,552,"williams-sonoma essential oils dish soap, hand soap & lotion gift set, french lavender",Home & Kitchen > Dishwashing > Dish Detergent
1015,552,babyganicsï¿½ 32 oz. fragrance-free foaming dish & bottle soap refill clear,Home & Kitchen > Dishwashing > Dish Detergent
1016,552,babyganics dish dazzler foaming dish & bottle soap refill - citrus - 33.8 oz,Home & Kitchen > Dishwashing > Dish Detergent
1017,552,"method dish soap pump, sea minerals - 18 oz",Home & Kitchen > Dishwashing > Dish Detergent
1018,552,dawn ultra antibacterial antibacterial dishwashing liquid - 21.6 oz - apple blossom,Home & Kitchen > Dishwashing > Dish Detergent
1019,552,td> mrs. meyer's clean day liquid dish soap - 16 oz - lavender,Home & Kitchen > Dishwashing > Dish Detergent
1020,552,"dawn dishwashing liquid, original - 25 oz",Home & Kitchen > Dishwashing > Dish Detergent
1021,552,dawn ultra hand renewal with olay beauty dishwashing liquid-pomegranate splash-20 oz,Home & Kitchen > Dishwashing > Dish Detergent
1022,552,"method orla holiday dish soap, peppermint vanilla - 18 oz - 2 pk",Home & Kitchen > Dishwashing > Dish Detergent
1023,552,mrs. meyer's clean day liquid dish soap - 16 oz - lemon verbena - 2 pk,Home & Kitchen > Dishwashing > Dish Detergent
1024,552,dawn ultra antibacterial antibacterial dishwashing liquid - 21.6 oz - orange,Home & Kitchen > Dishwashing > Dish Detergent
1025,552,ajax triple action dish liquid-orange - 12.6 oz,Home & Kitchen > Dishwashing > Dish Detergent
1026,552,babyganics foaming dish & bottle soap - fragrance free - 32 oz,Home & Kitchen > Dishwashing > Dish Detergent
1027,552,dapple refill pack: baby bottle & dish liquid - lavender - 34 oz,Home & Kitchen > Dishwashing > Dish Detergent
1028,552,"method dish soap pump, lemon mint - 18 oz",Home & Kitchen > Dishwashing > Dish Detergent
1029,552,palmolive ultra dishwashing liquid - pure + clear - 25 oz - 2 pk,Home & Kitchen > Dishwashing > Dish Detergent
1030,552,seventh generation natural dish liquid lavender floral & mint -- 50 fl oz,Home & Kitchen > Dishwashing > Dish Detergent
1031,552,method dish soap sea minerals -- 18 fl oz,Home & Kitchen > Dishwashing > Dish Detergent
1032,552,method dish soap ginger yuzu -- 18 fl oz,Home & Kitchen > Dishwashing > Dish Detergent
1033,552,"Seventh Generation Natural Hand Dish Refill, Free & Clear, 36 oz",Home & Kitchen > Dishwashing > Dish Detergent
1034,552,caldrea dish soap liquid-mandarin vetiver-16 oz.,Home & Kitchen > Dishwashing > Dish Detergent
1035,552,method dish soap pump - 18 oz - honey crisp apple,Home & Kitchen > Dishwashing > Dish Detergent
1036,552,palmolive ultra dish liquid-original - 38 oz - original - 2 ct,Home & Kitchen > Dishwashing > Dish Detergent
1037,552,"mrs. meyer's clean day holiday liquid dish soap, orange clove, 16 oz",Home & Kitchen > Dishwashing > Dish Detergent
1038,552,"method limited edition pump dish soap, beach sage, 18oz",Home & Kitchen > Dishwashing > Dish Detergent
1039,552,dawn ultra dishwashing liquid - 38 oz - mediterranean lavender,Home & Kitchen > Dishwashing > Dish Detergent
1040,552,clean day liquid dish soap - basil 16 fl oz liquid,Home & Kitchen > Dishwashing > Dish Detergent
1041,552,zero dish soap fragrance free 739 ml (25 fl oz) liquid,Home & Kitchen > Dishwashing > Dish Detergent
1042,552,natural plant extracts dish soap - 16 fl oz (473 ml) liquid,Home & Kitchen > Dishwashing > Dish Detergent
1043,552,dish soap - citrus berry 16 fl oz liquid,Home & Kitchen > Dishwashing > Dish Detergent
1044,552,"seventh generation ultra power plus automatic dishwasher detergent gel, fresh citrus scent - (65fl oz)",Home & Kitchen > Dishwashing > Dish Detergent
1045,552,"Seventh Generation Natural Dish Liquid, Lemongrass & Clementine Zest, 25-Oz",Home & Kitchen > Dishwashing > Dish Detergent
1046,552,dawn ultra power clean refreshing rain scent dishwashing liquid - (20oz),Home & Kitchen > Dishwashing > Dish Detergent
1047,552,"method dish soap natural concentrated dish wash liquid, clementine - (18fl oz)",Home & Kitchen > Dishwashing > Dish Detergent
1048,552,ivory ultra dishwashing liquid - (25fl oz),Home & Kitchen > Dishwashing > Dish Detergent
1049,552,"dawn ultra total clean, pomegranate awakening (24 fl. oz, 3 pk.) t",Home & Kitchen > Dishwashing > Dish Detergent
1050,552,member's mark ultimate clean dishwashing liquid (100oz.),Home & Kitchen > Dishwashing > Dish Detergent
1051,552,stop & shop ultra dish liquid & antibacterial hand soap green apple 24 oz btl,Home & Kitchen > Dishwashing > Dish Detergent
1052,552,ajax dish liquid lemon 14 oz btl,Home & Kitchen > Dishwashing > Dish Detergent
1053,552,stop & shop ultra concentrated dish liquid lavendar scent 24 oz btl,Home & Kitchen > Dishwashing > Dish Detergent
1054,552,palmolive ultra dish liquid soft touch with aloe for dry skin 25 oz btl,Home & Kitchen > Dishwashing > Dish Detergent
1055,552,seventh generation dish liquid lavender floral & mint natural 25 oz btl,Home & Kitchen > Dishwashing > Dish Detergent
1056,552,dawn ultra dishwashing liquid hand renewal with olay cucumber & melon 18 oz btl,Home & Kitchen > Dishwashing > Dish Detergent
1057,552,palmolive ultra oxy plus dish liquid power degreaser 25 oz btl,Home & Kitchen > Dishwashing > Dish Detergent
1058,552,legacy of clean® dish liquid - citrus scent,Home & Kitchen > Dishwashing > Dish Detergent
1059,552,ajax triple action orange liquid dish - 30 fl. oz.,Home & Kitchen > Dishwashing > Dish Detergent
1060,552,palmolive ultra concentrated dish liquid antibacterial orange - 25 fl. oz.,Home & Kitchen > Dishwashing > Dish Detergent
1061,552,"meijer extra strength liquid dishwashing detergent, original scent, 19oz",Home & Kitchen > Dishwashing > Dish Detergent
1062,552,dapple(r) 3 oz. travel-size fragrance-free dish liquid,Home & Kitchen > Dishwashing > Dish Detergent
1063,552,"dawn dawn ultra platinum stainfighter dish soap, lemon burst, ...",Home & Kitchen > Dishwashing > Dish Detergent
1064,552,"betterlife better life dish it out natural dish soap unscented, 22 f...",Home & Kitchen > Dishwashing > Dish Detergent
1065,552,"mrs. meyer's clean day mrs. meyer's clean day dish soap, lavender, 16 ounce bottle lavender",Home & Kitchen > Dishwashing > Dish Detergent
1066,552,"method method dish soap, clementine, 18 ounce (pack of 3)",Home & Kitchen > Dishwashing > Dish Detergent
1067,552,"method method dish soap, sea minerals, 18 ounce (pack of 2)",Home & Kitchen > Dishwashing > Dish Detergent
1068,552,"mrs. meyer's clean day mrs. meyer's clean day dish soap, geranium, 16 fl oz",Home & Kitchen > Dishwashing > Dish Detergent
1069,552,"seventh generation seventh generation dish soap, free & clear, 25 fl oz",Home & Kitchen > Dishwashing > Dish Detergent
1070,552,"dawn dawn ultra dish soap, original scent, 9 fl oz",Home & Kitchen > Dishwashing > Dish Detergent
1071,552,dawn dawn platinum power clean dishwashing liquid - refreshing...,Home & Kitchen > Dishwashing > Dish Detergent
1072,552,"method method dish soap foaming, french lavender, 16 ounce",Home & Kitchen > Dishwashing > Dish Detergent
1073,552,"mrs. meyer's clean day mrs. meyer's clean day liquid dish soap, geranium, 16 flu...",Home & Kitchen > Dishwashing > Dish Detergent
1074,552,baby btl&dish liq refl ff 34 fz by dapple,Home & Kitchen > Dishwashing > Dish Detergent
1075,552,"earth friendly products ecos wave dishwashing detergent liquid, organic lavender,...",Home & Kitchen > Dishwashing > Dish Detergent
1076,552,palmolive palmolive ultra pure + clear dish liquid,Home & Kitchen > Dishwashing > Dish Detergent
1077,552,"palmolive palmolive soft touch dishwashing liquid vitamin e, 25 fl oz",Home & Kitchen > Dishwashing > Dish Detergent
1078,552,"seventh generation seventh generation dishwashing detergent powder, free & c... 45 oz",Home & Kitchen > Dishwashing > Dish Detergent
1079,552,"dawn original scent ultra concentrated dishwashing liquid, 14oz",Home & Kitchen > Dishwashing > Dish Detergent
1080,552,"gaiam size 2 bottles seventh generation dish soap liquid - free & clear (set of 2, 25oz)",Home & Kitchen > Dishwashing > Dish Detergent
1081,552,"babyganics foaming dish soap refill, fragrance free, 32 fl. oz. (pack of 2), packaging may vary",Home & Kitchen > Dishwashing > Dish Detergent
1082,552,mrs. meyers liquid dish soap in lavender,Home & Kitchen > Dishwashing > Dish Detergent
1083,552,"Dawn Ultra Dishwashing Liquid, Original Scent, 56 Ounce - 2 Pack",Home & Kitchen > Dishwashing > Dish Detergent
1084,552,dawn ultra original scent dishwashing liquid 24 fl oz (pack of 2) grocery,Home & Kitchen > Dishwashing > Dish Detergent
1085,552,mrs meyers  clean day liquid dish soap lavender  16 oz3 pack misc,Home & Kitchen > Dishwashing > Dish Detergent
1086,552,"Palmolive Ultra Pure and Clear Dish Liquid, 25 Ounce (Pack of 12)",Home & Kitchen > Dishwashing > Dish Detergent
1087,552,"better life dish it out dish soap unscented, 22 oz - 651 ml",Home & Kitchen > Dishwashing > Dish Detergent
1088,552,"Palmolive Ultra Dish Liquid, Multi Surface, 25 Ounce",Home & Kitchen > Dishwashing > Dish Detergent
1089,552,dawn non-ultra original scent dishwashing liquid 56 fl oz (pack of 8),Home & Kitchen > Dishwashing > Dish Detergent
1090,552,"j.r. watkins natural liquid dish soap, grapefruit, 24 ounce (pack of 6)",Home & Kitchen > Dishwashing > Dish Detergent
1091,552,caldrea 32 floz floral hand wash dish soaps,Home & Kitchen > Dishwashing > Dish Detergent
1092,552,"baby bottle & dish safe liquid dapple, lavender, 16.9 oz liquid new",Home & Kitchen > Dishwashing > Dish Detergent
1093,552,"attitude baby bottle and dishwashing liquid fragrance free, fragrance free, 23.7 fluid ounce",Home & Kitchen > Dishwashing > Dish Detergent
1094,552,"palmolive original dish liquid, 25 ounce",Home & Kitchen > Dishwashing > Dish Detergent
1095,552,"dawn direct foam dishwashing foam, refill, fresh rapids scent, 30.9 fluid ounce bottles (pack of 6)",Home & Kitchen > Dishwashing > Dish Detergent
1096,552,method lime & sea salt dish soap 18 oz - 3 pack,Home & Kitchen > Dishwashing > Dish Detergent
1097,552,dawn ultra original scent dishwashing liquid 24 fl oz pack of 2 packaging may vary new,Home & Kitchen > Dishwashing > Dish Detergent
1098,552,"Dapple Refill Pack Baby Bottle and Dish Liquid, Fragrance Free, 34 Fluid Ounce (2 Pack)",Home & Kitchen > Dishwashing > Dish Detergent
1099,552,Method Dish Soap Cucumber -- 18 fl oz (Pack of 2),Home & Kitchen > Dishwashing > Dish Detergent
1100,552,"method Dish Soap Pump, Cucumber, 18 oz method",Home & Kitchen > Dishwashing > Dish Detergent
1101,552,"biokleen dishwash liquid, fragrance free - 32 oz",Home & Kitchen > Dishwashing > Dish Detergent
1102,552,mrs meyers clean day liquid dishwashing soap honeysuckle 16 oz 1 pack new,Home & Kitchen > Dishwashing > Dish Detergent
