,category_id,description,category_path
1986,552,dawn ultra new zealand spring scent dishwashing liquid 38 fl oz,Home & Kitchen > Dishwashing > Dish Detergent
1987,552,"Dishwashing Liquid, 14 oz Bottle, Lemon Scent, 25/Carton, Sold as 1 Carton,",Home & Kitchen > Dishwashing > Dish Detergent
1988,552,"palmolive ultra soft touch with vitamin e dish liquid, 25-ounce (pack of 2)",Home & Kitchen > Dishwashing > Dish Detergent
1989,552,"Dawn Simply Clean Non-Concentrate Dish Soap, Fresh Rapids Scent,12.6 Oz, 2 Pack",Home & Kitchen > Dishwashing > Dish Detergent
1990,552,"ecover dishwashing liquid herbal, 32 fluid ounce",Home & Kitchen > Dishwashing > Dish Detergent
1991,552,"babyganics foaming dish & bottle soap eco pack, refill & foaming pump bottle, fragrance free, 33.8 ounces, packaging may vary",Home & Kitchen > Dishwashing > Dish Detergent
1992,552,"mrs. meyer's clean day liquid dish soap, lavender, 16 oz-2 pack",Home & Kitchen > Dishwashing > Dish Detergent
1993,552,Method Dish Soap Pump - 18 oz - Pink Grapefruit,Home & Kitchen > Dishwashing > Dish Detergent
1994,552,natural homelogic liquid dish soap - jasmine mist,Home & Kitchen > Dishwashing > Dish Detergent
1995,552,dawn non-ultra antibacterial hand soap lemon scent dishwashing liquid 25 fluid ounce (pack of 5),Home & Kitchen > Dishwashing > Dish Detergent
1996,552,mrs. meyer's clean day liquid dish soap basil - 16 fl oz - 2 pack,Home & Kitchen > Dishwashing > Dish Detergent
1997,552,"Dawn Ultra Concentrated Antibacterial Hand Soap Dishwashing Liquid, Orange",Home & Kitchen > Dishwashing > Dish Detergent
1998,552,"planet dishwashing liquid, free & clear, certified biodegradable, 25oz",Home & Kitchen > Dishwashing > Dish Detergent
1999,552,dawn ultra concentrated original scent dishwashing liquid - 38 fl oz,Home & Kitchen > Dishwashing > Dish Detergent
2000,552,"mrs. meyer's clean day liquid dish soap, geranium, 16 fluid ounce (pack of 3)",Home & Kitchen > Dishwashing > Dish Detergent
2001,552,dish soap 16oz unscented,Home & Kitchen > Dishwashing > Dish Detergent
2002,552,"earth friendly products dishmate, dishwashing liquid, natural pear, 25-ounce (pack of 2)",Home & Kitchen > Dishwashing > Dish Detergent
2003,552,CUCINA Dish Detergent Refills - 34 fl. oz.- Coriander and Olive Tree,Home & Kitchen > Dishwashing > Dish Detergent
2004,552,"Palmolive Ultra Original Dish Liquid, Twin Pack, 38 Fl Oz",Home & Kitchen > Dishwashing > Dish Detergent
2005,552,"mrs. meyer's clean day dish soap, lavender, 16-ounce bottles (case of 6)",Home & Kitchen > Dishwashing > Dish Detergent
2006,552,the honest company 11160 dish soap - 16 ounces,Home & Kitchen > Dishwashing > Dish Detergent
2007,552,"better life dish soap, unscented 22.0 oz (pack of 3) health and beauty",Home & Kitchen > Dishwashing > Dish Detergent
2008,552,Natural HomeLogic Dish Soap - Citrus Grove - 24 fl oz,Home & Kitchen > Dishwashing > Dish Detergent
2009,552,"Sun and Earth Natural Concentrated Dishwashing Liquid, Light Citrus, 128 Ounce",Home & Kitchen > Dishwashing > Dish Detergent
2010,552,"method dish soap pump refill, clementine, 36 fl oz",Home & Kitchen > Dishwashing > Dish Detergent
2011,552,Planet Ultra Dishwashing Liquid - 25 oz - 2 pk,Home & Kitchen > Dishwashing > Dish Detergent
2012,552,"babyganics foaming dish soap refill, citrus, 33.8 fluid ounce, packaging may vary",Home & Kitchen > Dishwashing > Dish Detergent
2013,552,palmolive lotus blossom & lavender concentrated dish washing liquid 10 fl oz... iwgl,Home & Kitchen > Dishwashing > Dish Detergent
2014,552,"caldrea palmarosa dish soap liquid, wild mint, 16 fluid ounce",Home & Kitchen > Dishwashing > Dish Detergent
2015,552,"Dawn Ultra Dishwashing Liquid, Original Scent, 75 Ounce",Home & Kitchen > Dishwashing > Dish Detergent
2016,552,Dapple Baby Bottle & Dish Liquid Fragrance-Free Travel Size 3 oz,Home & Kitchen > Dishwashing > Dish Detergent
2017,552,method dish soap pump - 18 oz - cucumber new,Home & Kitchen > Dishwashing > Dish Detergent
2018,552,dawn ultra hand renewal with olay beauty pomegranate splash scent dishwashing liquid 44 fl oz,Home & Kitchen > Dishwashing > Dish Detergent
2019,552,"ecover dishwashing liquid, lemon and aloe vera, 32 fluid ounce health and beauty",Home & Kitchen > Dishwashing > Dish Detergent
2020,552,"Mrs. Meyer's Clean Day Dish Soap, Lavender, 16 Fl Oz Bottles",Home & Kitchen > Dishwashing > Dish Detergent
2021,552,sonett lemon dishwashing liquid (10 fl oz/300 ml),Home & Kitchen > Dishwashing > Dish Detergent
2022,552,"Free & Clear Natural Dishwashing Liquid, Non-Toxic, 25 Oz.",Home & Kitchen > Dishwashing > Dish Detergent
2023,552,palmolive ultra soft touch,Home & Kitchen > Dishwashing > Dish Detergent
2024,552,"mrs. meyer's clean day liquid dish soap, honeysuckle, 16 fluid ounce (pack of 3) health and beauty",Home & Kitchen > Dishwashing > Dish Detergent
2025,552,"palmolive dish liquid, original, 28 ounce",Home & Kitchen > Dishwashing > Dish Detergent
2026,552,"Seventh Generation Organic Foaming Natural Dish Soap, Pure Lemon 16 oz.",Home & Kitchen > Dishwashing > Dish Detergent
2027,552,pure care 100 natural liquid dish soap hypoallergenic  slsfree septic safe  made with organic soap berry  soap nut extract and aloe vera  16oz,Home & Kitchen > Dishwashing > Dish Detergent
2028,552,"Dawn Platinum Power Clean Dishwashing Liquid, Refreshing Rain, 18 Fluid Ounce (Pack of 2)",Home & Kitchen > Dishwashing > Dish Detergent
2029,552,earth friendly products dishmate detergent free and clear 25 oz earth friendly products,Home & Kitchen > Dishwashing > Dish Detergent
2030,552,dawn power dissolver dish pretreater liquid trigger spray bottle 32 fl oz,Home & Kitchen > Dishwashing > Dish Detergent
2031,552,"Dawn Platinum Dishwashing Foam Refill, Fresh Rapids, 30.9 Ounce by sadadssad",Home & Kitchen > Dishwashing > Dish Detergent
2032,552,"palmolive ultra dish liquid, soft touch almond milk and blueberry, 25 ounce",Home & Kitchen > Dishwashing > Dish Detergent
2033,552,caldrea dish soap basil blue sage -- 16 fl oz,Home & Kitchen > Dishwashing > Dish Detergent
2034,552,"dawn ultra antibacterial hand soap dishwashing liquid, green, apple blossom scent, 24 ounce (pack of 2) health and beauty",Home & Kitchen > Dishwashing > Dish Detergent
2035,552,ivory liquid dish soap,Home & Kitchen > Dishwashing > Dish Detergent
2036,552,"babyganics dish dazzler foaming dish soap refill, 33.8 fl. oz. (pack of 2)",Home & Kitchen > Dishwashing > Dish Detergent
2037,552,"Grab Green Natural Dish Soap, Tangerine with Lemongrass, 16 Ounce (3 Count)",Home & Kitchen > Dishwashing > Dish Detergent
2038,552,"green works 30388 natural manual pot and pan liquid detergent, original, 128 fl oz can",Home & Kitchen > Dishwashing > Dish Detergent
2039,552,chefs planet dish soap cruet 12ounce,Home & Kitchen > Dishwashing > Dish Detergent
2040,552,"dawn ultra dishwashing liquid, original scent, blue, 24 ounce",Home & Kitchen > Dishwashing > Dish Detergent
2041,552,green works dishwashing liquid - 22 oz - original - 3 pk,Home & Kitchen > Dishwashing > Dish Detergent
2042,552,Mrs. Meyers 765222 Mrs. Meyers Liquid Dish Soap - Lemon Verbena - Case of 6,Home & Kitchen > Dishwashing > Dish Detergent
2043,552,"babyganics foaming dish soap refill, fragrance free, 32 fl. oz. (pack of 2), packaging may vary used - like new",Home & Kitchen > Dishwashing > Dish Detergent
2044,552,grab green liquid dish soap,Home & Kitchen > Dishwashing > Dish Detergent
2045,552,"Green Works Natural Dishwashing Liquid Value Pack, Free and Clear, Pack of Two, 44 fl oz Total (Packaging May Vary)",Home & Kitchen > Dishwashing > Dish Detergent
2046,552,The Honest Company Dish Soap - 26.5 Oz - Lemon Verbena,Home & Kitchen > Dishwashing > Dish Detergent
2047,552,caldrea dish soap rosewater driftwood -- 16 fl oz,Home & Kitchen > Dishwashing > Dish Detergent
2048,552,"dapple natural based baby bottle & dish liquid, lavender, 16.9-fluid ounces (pack of 3)",Home & Kitchen > Dishwashing > Dish Detergent
2049,552,"babyganics foaming dish soap refill, fragrance free, 32 fl. oz. (pack of 2), packaging may vary health and beauty",Home & Kitchen > Dishwashing > Dish Detergent
2050,552,"palmolive tropical tango dish liquid, 12.6 ounce quantity: 2",Home & Kitchen > Dishwashing > Dish Detergent
2051,552,Dish Power Dissolver Liquid Trigger Spray Bottle 32 oz,Home & Kitchen > Dishwashing > Dish Detergent
2052,552,"mrs. meyers clean day liquid dishwashing soap, honeysuckle, 16 oz 1 pack",Home & Kitchen > Dishwashing > Dish Detergent
2053,552,palmolive dish liquid 90,Home & Kitchen > Dishwashing > Dish Detergent
2054,552,dawn ultra antibacterial,Home & Kitchen > Dishwashing > Dish Detergent
2055,552,Palmolive Dish Liquid 90 Oz- Original,Home & Kitchen > Dishwashing > Dish Detergent
2056,552,"Dapple Baby Bottle and Dish Liquid, Lavender, Travel Size, 3 Fluid Ounce, 2 Pack",Home & Kitchen > Dishwashing > Dish Detergent
2057,552,palmolive ultra original dish washing liquid-10oz,Home & Kitchen > Dishwashing > Dish Detergent
2058,552,dawn non-ultra original scent dishwashing liquid 29 fluid ounce,Home & Kitchen > Dishwashing > Dish Detergent
2059,552,"Dawn 02611 Original Scent Manual Pot and Pan Detergent, 5 Gallons",Home & Kitchen > Dishwashing > Dish Detergent
2060,552,Caldrea Liquid Dish Soap - 16 oz - Lavender Pine - 2 pk,Home & Kitchen > Dishwashing > Dish Detergent
2061,552,mrs. meyer's clean day® liquid dish soap basil -- 16 fl oz,Home & Kitchen > Dishwashing > Dish Detergent
2062,552,"seventh generation natural dish liquid, fresh lime & lavender, 25 ounce (pack of 6)",Home & Kitchen > Dishwashing > Dish Detergent
2063,552,dawn ultra antibacterial hand soap orange scent dishwashing liquid 216 fl oz dawn,Home & Kitchen > Dishwashing > Dish Detergent
2064,552,clean day liquid dish soap - lavender 16 fl oz liquid,Home & Kitchen > Dishwashing > Dish Detergent
2065,552,dawn at emberwilde,Home & Kitchen > Dishwashing > Dish Detergent
2066,552,"caldrea dish soap liquid, black coriander lime - 16 oz",Home & Kitchen > Dishwashing > Dish Detergent
2067,552,palmolive ultra dish liquid - 25 fl oz,Home & Kitchen > Dishwashing > Dish Detergent
2068,552,"method power foam dish soap, lemon mint - 16 oz",Home & Kitchen > Dishwashing > Dish Detergent
2069,552,"attitude dishwashing liquid, wildflower - 23.7 fl oz",Home & Kitchen > Dishwashing > Dish Detergent
2070,552,"seventh generation dishwashing liquid, lavender floral & mint, 25 oz",Home & Kitchen > Dishwashing > Dish Detergent
2071,552,"babyganics dish dazzler foaming dish and bottle soap, citrus, 16 fluid ounce",Home & Kitchen > Dishwashing > Dish Detergent
2072,552,"palmolive ultra dish orange antibacterial dish soap, 10 oz",Home & Kitchen > Dishwashing > Dish Detergent
2073,552,"earth friendly products dishmate, dishwashing liquid, free and clear, 25-ounce (pack of 2)",Home & Kitchen > Dishwashing > Dish Detergent
2074,552,mrs. meyers clean day dish,Home & Kitchen > Dishwashing > Dish Detergent
2075,552,"mrs. meyer's clean day liquid dish soap, basil, 16-ounce bottles (case of 6) new",Home & Kitchen > Dishwashing > Dish Detergent
2076,552,"ajax bleach alternative dish liquid, grapefruit, 14 fluid ounce (pack of 4)",Home & Kitchen > Dishwashing > Dish Detergent
2077,552,mrs. meyer's clean day liquid dish soap - 16 oz - lavender - 2 pk,Home & Kitchen > Dishwashing > Dish Detergent
2078,552,procter & gamble 00632 dawn power dissolver,Home & Kitchen > Dishwashing > Dish Detergent
2079,552,"Ajax Dishwashing Liquid, Super Degreaser, Lemon, 28 Ounce",Home & Kitchen > Dishwashing > Dish Detergent
2080,552,"method gel dish pump, cucumber, 18 ounce",Home & Kitchen > Dishwashing > Dish Detergent
2081,552,palmolive ultra dish liquid soft touch coconut butter 25 ounce,Home & Kitchen > Dishwashing > Dish Detergent
2082,552,"dawn ultra dishwashing liquid, original scent , blue , 14oz (4 pack)",Home & Kitchen > Dishwashing > Dish Detergent
2083,552,"ajax bleach alternative dish liquid, grapefruit, 14 fluid ounce",Home & Kitchen > Dishwashing > Dish Detergent
2084,552,"method power foam dish 16oz, lemon mint",Home & Kitchen > Dishwashing > Dish Detergent
2085,552,"2 Pk, Dawn Platinum Power Clean Refreshing Rain Scent Dishwashing Liquid 9 Fl. Oz",Home & Kitchen > Dishwashing > Dish Detergent
2086,552,mrs. meyer's clean day® liquid dish soap sunflower -- 16 fl oz,Home & Kitchen > Dishwashing > Dish Detergent
2087,552,Dapple Fragrance-Free Baby Bottle & Dish Liquid 16.9 oz - Pack of 2,Home & Kitchen > Dishwashing > Dish Detergent
2088,552,"method gel dish pump refill 36oz, lemon mint (pack of 2)",Home & Kitchen > Dishwashing > Dish Detergent
2089,552,"babyganics dish dazzler foaming dish soap refill, 33.8 fl. oz. (pack of 2), packaging may vary health and beauty",Home & Kitchen > Dishwashing > Dish Detergent
2090,552,ecos dishmate dish liquid,Home & Kitchen > Dishwashing > Dish Detergent
2091,552,dawn dishwashing liquid,Home & Kitchen > Dishwashing > Dish Detergent
2092,552,palmolive ultra antibacterial orange dish washing liquid-10oz,Home & Kitchen > Dishwashing > Dish Detergent
2093,552,method natural concentrated dish liquid beach sage 18 fluid ounce,Home & Kitchen > Dishwashing > Dish Detergent
2094,552,"dawn ultra hand renewal with olay beauty scent dishwashing liquid, pomegranate splash, 38 ounce (pack of 2)",Home & Kitchen > Dishwashing > Dish Detergent
2095,552,"method gel dish pump, sea minerals, 18oz, (pack of 6)",Home & Kitchen > Dishwashing > Dish Detergent
2096,552,"mrs. meyer's clean day liquid dish soap, basil, 16 fluid ounce bottles",Home & Kitchen > Dishwashing > Dish Detergent
2097,552,ultra gain original scent dishwashing liquid - 24 fl. oz. (2 pack),Home & Kitchen > Dishwashing > Dish Detergent
2098,552,"ecover natural dishwashing liquid, chamomile and marigold, 32 fluid ounce",Home & Kitchen > Dishwashing > Dish Detergent
2099,552,Mrs. Meyers Liquid Dish Soap Case Of 6 Geranium,Home & Kitchen > Dishwashing > Dish Detergent
2100,552,"seventh generation dish liquid, free & clear, 25-ounce bottles (pack of 6) packaging may vary",Home & Kitchen > Dishwashing > Dish Detergent
2101,552,"babyganics foaming dish and bottle soap, fragrance free, 16oz pump bottle (pack of 3) health and beauty",Home & Kitchen > Dishwashing > Dish Detergent
2102,552,baby bottle+dish liquid 16.9 ounces (pack of 2),Home & Kitchen > Dishwashing > Dish Detergent
2103,552,"mrs. meyer's clean day dish soap, lemon verbena, 16-ounce bottles (case of 6)",Home & Kitchen > Dishwashing > Dish Detergent
2104,552,babyganics foaming dish and bottle soap fragrance free 16oz pump bottle pack of 3 babyganics,Home & Kitchen > Dishwashing > Dish Detergent
2105,552,"Dawn Platinum Dishwashing Foam, Fresh Rapids, 10.1 Ounce",Home & Kitchen > Dishwashing > Dish Detergent
2106,552,palmolive ultra original dish washing liquid-20oz,Home & Kitchen > Dishwashing > Dish Detergent
2107,552,14 oz. ajax liquid dish soap,Home & Kitchen > Dishwashing > Dish Detergent
2108,552,Palmolive Ultra Dish,Home & Kitchen > Dishwashing > Dish Detergent
2109,552,chef's planet dish soap,Home & Kitchen > Dishwashing > Dish Detergent
2110,552,planet ultra dishwashing liquid 25 fluid ounce planet,Home & Kitchen > Dishwashing > Dish Detergent
2111,552,"earth friendly products dishmate, dishwashing liquid, natural lavender, 25-ounce (pack of 2)",Home & Kitchen > Dishwashing > Dish Detergent
2112,552,joy ultra dishwashing,Home & Kitchen > Dishwashing > Dish Detergent
2113,552,"Ecover Natural Plant-based Liquid Dish Soap, Fragrance Free, 25 Fl Oz (Pack of 6)",Home & Kitchen > Dishwashing > Dish Detergent
2114,552,dawn non-ultra summertime showers dishwashing liquid 25 fluid ounce (pack of 5),Home & Kitchen > Dishwashing > Dish Detergent
2115,552,"Stonewall Kitchen White Pine Dish Soap, 1.2250-Ounce Bottles (Pack of 3)",Home & Kitchen > Dishwashing > Dish Detergent
2116,552,Caldrea Orange Freesia Dish Soap Refill 32 oz.,Home & Kitchen > Dishwashing > Dish Detergent
2117,552,"pure care natural non-toxic concentrated dish soap 32oz, eucalyptus, spearmint essential oils",Home & Kitchen > Dishwashing > Dish Detergent
2118,552,Shopkins Season 2 #2-096 Purple Dishy Liquid,Home & Kitchen > Dishwashing > Dish Detergent
2119,552,"dawn ultra antibacterial hand soap dishwashing liquid, green, apple blossom scent, 24...",Home & Kitchen > Dishwashing > Dish Detergent
2120,552,natural dishwashing liquid in free and clear (set of 13),Home & Kitchen > Dishwashing > Dish Detergent
2121,552,grabgreen liquid dish soap thyme with fig leaf -- 16 oz,Home & Kitchen > Dishwashing > Dish Detergent
2122,552,method natural concentrated,Home & Kitchen > Dishwashing > Dish Detergent
2123,552,dawn non-ultra antibacterial hand soap lemon scent dishwashing liquid 25 fluid ounce (pack of 5) health and beauty,Home & Kitchen > Dishwashing > Dish Detergent
2124,552,"dawn ultra dishwashing liquid, original (2 count, 24 fl oz each)",Home & Kitchen > Dishwashing > Dish Detergent
2125,552,"dawn ultra antibacterial hand soap orange scent dishwashing liquid, 21.6 fl oz",Home & Kitchen > Dishwashing > Dish Detergent
2126,552,dapple baby bottle and dish liquid lavender travel size 3 fluid ounce dapple,Home & Kitchen > Dishwashing > Dish Detergent
2127,552,"mrs. meyer's clean day dish soap, geranium, 16-ounce bottles (case of 6)",Home & Kitchen > Dishwashing > Dish Detergent
2128,552,"palmolive original dish liquid, 52 fluid ounce (pack of 6)",Home & Kitchen > Dishwashing > Dish Detergent
2129,552,dish liquid lemongrass and clementine zest 25 ounces,Home & Kitchen > Dishwashing > Dish Detergent
2130,552,dawn ultra original scent dishwashing liquid 90 fl. oz,Home & Kitchen > Dishwashing > Dish Detergent
2131,552,"100% natural liquid dish soap (3 pack), green tea & lime, 16 fluid ounce bottle",Home & Kitchen > Dishwashing > Dish Detergent
2132,552,"Grab Green Natural Power Degreaser Cleaner, Red Pear with Magnolia, 16 Ounce (Pack of 3)",Home & Kitchen > Dishwashing > Dish Detergent
2133,552,baby bottle+dish liquid 16.90 ounces,Home & Kitchen > Dishwashing > Dish Detergent
2134,552,"dawn direct foam dishwashing foam-lime surge-10.1 oz., 300 milliter",Home & Kitchen > Dishwashing > Dish Detergent
2135,552,simplehuman liquid dish,Home & Kitchen > Dishwashing > Dish Detergent
2136,552,"earth friendly products dishmate, dishwashing liquid, natural apricot, 25 ounces",Home & Kitchen > Dishwashing > Dish Detergent
2137,552,"dawn escapes dishwashing liquid, mediterranean lavender - 21.6 fl oz",Home & Kitchen > Dishwashing > Dish Detergent
2138,552,dapple 16.9 floz unscented hand wash dish soaps,Home & Kitchen > Dishwashing > Dish Detergent
2139,552,dawn® platinum power clean™ refreshing rain™ dishwashing liquid 28 oz,Home & Kitchen > Dishwashing > Dish Detergent
2140,552,mrs meyers dish iowa pine 16.0fl0z,Home & Kitchen > Dishwashing > Dish Detergent
2141,552,dawn® hand renewal with olay® cucumber & melon dishwashing liquid 28 oz,Home & Kitchen > Dishwashing > Dish Detergent
2142,552,green works original scent dish soap 22 oz,Home & Kitchen > Dishwashing > Dish Detergent
2143,552,"up & up™ pomegranate renewal liquid hand wash dish soap, 20oz",Home & Kitchen > Dishwashing > Dish Detergent
2144,552,method smarty dish plus free and clear 24 ct,Home & Kitchen > Dishwashing > Dish Detergent
2145,552,mrs. meyer's basil dish soap 16 oz,Home & Kitchen > Dishwashing > Dish Detergent
2146,552,dawn ultra dishwashing liquid with olay hand renewal peach & almond 20 oz,Home & Kitchen > Dishwashing > Dish Detergent
2147,552,"dawn ultra original scent dishwashing liquid, 9 fl oz",Home & Kitchen > Dishwashing > Dish Detergent
2148,552,up & up blue original scent liquid dishwashing soap 24 oz,Home & Kitchen > Dishwashing > Dish Detergent
2149,552,dawn ultra platinum erasing lime surge scent dish foam 10.1 oz,Home & Kitchen > Dishwashing > Dish Detergent
2150,552,palmolive soft touch almond milk blueberry ultra concentrated dish liquid 38 fl oz,Home & Kitchen > Dishwashing > Dish Detergent
2151,552,"ultra gain original scent dishwashing liquid, 9 fl oz",Home & Kitchen > Dishwashing > Dish Detergent
2152,552,dawn platinum erasing dishwashing foam refill fresh rapids scent 309 fl oz,Home & Kitchen > Dishwashing > Dish Detergent
2153,552,"gain ultra moonlight breeze scent dishwashing liquid, 24 fl oz",Home & Kitchen > Dishwashing > Dish Detergent
2154,552,dawn ultra original scent dishwashing liquid 38 fl oz,Home & Kitchen > Dishwashing > Dish Detergent
2155,552,"dawn ultra antibacterial apple blossom dishwashing liquid, 21.6 fl oz",Home & Kitchen > Dishwashing > Dish Detergent
2156,552,babies r us bottle & dish soap one color,Home & Kitchen > Dishwashing > Dish Detergent
2157,552,method dish soap refill clementine 36.0 fl oz,Home & Kitchen > Dishwashing > Dish Detergent
2158,552,"dish soap pump, limited edition fresh currant method 18.0 fl oz",Home & Kitchen > Dishwashing > Dish Detergent
2159,552,super degreaser dish liquid soap lemon ajax 30.0 fl oz,Home & Kitchen > Dishwashing > Dish Detergent
2160,552,dish soap refill clementine method,Home & Kitchen > Dishwashing > Dish Detergent
2161,552,spongeables all-in-one dish soap and sponge 7-pack,Home & Kitchen > Dishwashing > Dish Detergent
2162,552,dawn antibacterial dish soap orange 342 oz,Home & Kitchen > Dishwashing > Dish Detergent
2163,552,dawn ultra antibacterial dishwashing liquid apple blossom 30 oz,Home & Kitchen > Dishwashing > Dish Detergent
2164,552,25 oz. dishwashing detergent non-concentrated original,Home & Kitchen > Dishwashing > Dish Detergent
2165,552,25 oz. natural dish free and clear liquid soap,Home & Kitchen > Dishwashing > Dish Detergent
2166,552,ultra 28 oz. original scent dishwashing liquid,Home & Kitchen > Dishwashing > Dish Detergent
2167,552,"williams-sonoma dish soap refill, lemongrass ginger",Home & Kitchen > Dishwashing > Dish Detergent
2168,552,"williams-sonoma dish soap refill, meyer lemon",Home & Kitchen > Dishwashing > Dish Detergent
2169,552,"williams-sonoma essential oils dish soap, winter forest",Home & Kitchen > Dishwashing > Dish Detergent
2170,552,ws dish soap meyer lemon,Home & Kitchen > Dishwashing > Dish Detergent
2171,552,"berkley green babyt 24 oz. bottle, dish & toy liquid clear",Home & Kitchen > Dishwashing > Dish Detergent
2172,552,interdesign® forma dish soap pump caddy in satin satin hand soap caddy,Home & Kitchen > Dishwashing > Dish Detergent
2173,552,dappleï¿½ 16.9 oz. dish liquid in lavender clear,Home & Kitchen > Dishwashing > Dish Detergent
2174,552,palmolive ultra pure & clear dishwashing liquid-25 oz,Home & Kitchen > Dishwashing > Dish Detergent
2175,552,better life dish soap - 22 oz - unscented,Home & Kitchen > Dishwashing > Dish Detergent
2176,552,method dish soap pump refill - 36 oz - clementine,Home & Kitchen > Dishwashing > Dish Detergent
2177,552,"method power dish foam, pink grapefruit, 16 oz",Home & Kitchen > Dishwashing > Dish Detergent
2178,552,"method limited edition pump dish soap mint, lemon mint, 18 oz, 2 pk",Home & Kitchen > Dishwashing > Dish Detergent
2179,552,"method dish soap pump, lime + sea salt-18 oz",Home & Kitchen > Dishwashing > Dish Detergent
2180,552,mrs. meyer's clean day liquid dish soap - lavender - 16 oz - 2 pk,Home & Kitchen > Dishwashing > Dish Detergent
2181,552,"mrs. meyer's clean day liquid dish soap, basil, 16oz, 3pk",Home & Kitchen > Dishwashing > Dish Detergent
2182,552,"method dish soap pump refill, clementine - 36 oz - 2 pk",Home & Kitchen > Dishwashing > Dish Detergent
2183,552,"method liquid dish refill pouch, ginger yuzu, 36 oz, 2 pk",Home & Kitchen > Dishwashing > Dish Detergent
2184,552,"method pump dish soap, sea minerals, 18 oz, 2 pk",Home & Kitchen > Dishwashing > Dish Detergent
2185,552,dapple baby bottle & dish liquid - lavender - 34 oz,Home & Kitchen > Dishwashing > Dish Detergent
2186,552,seventh generation dish liquid - 25 oz - free & clear,Home & Kitchen > Dishwashing > Dish Detergent
2187,552,common good bergamot dish soap,Home & Kitchen > Dishwashing > Dish Detergent
2188,552,method power foam dish soap waterfall -- 16 fl oz,Home & Kitchen > Dishwashing > Dish Detergent
2189,552,earth friendly dishmate dish liquid free and clear -- 25 fl oz,Home & Kitchen > Dishwashing > Dish Detergent
2190,552,grabgreen liquid dish soap tangerine with lemongrass -- 16 fl oz,Home & Kitchen > Dishwashing > Dish Detergent
2191,552,"j.r. watkins moisturizing dish soap sweetgrass and citron, 24 oz 24.0 oz 1.87 lbs",Home & Kitchen > Dishwashing > Dish Detergent
2192,552,green works dishwashing liquid - 22 oz - simply tangerine,Home & Kitchen > Dishwashing > Dish Detergent
2193,552,dawn ultra plus bleach alternative dishwashing liquid - 28 oz - fresh rapids,Home & Kitchen > Dishwashing > Dish Detergent
2194,552,"green works dishwashing liquid, water lilly - 22 oz",Home & Kitchen > Dishwashing > Dish Detergent
2195,552,palmolive ultra oxy plus power degreaser dish liquid - 25 oz,Home & Kitchen > Dishwashing > Dish Detergent
2196,552,mrs. meyer's clean day liquid dish soap - lemon vebena - 16 oz - 3,Home & Kitchen > Dishwashing > Dish Detergent
2197,552,dawn ultra hand renewal with olay beauty dishwashing liquid-lavender silk-20 oz,Home & Kitchen > Dishwashing > Dish Detergent
2198,552,palmolive oxy plus power degreaser dish liquid - 25 oz -,Home & Kitchen > Dishwashing > Dish Detergent
2199,552,dawn ultra pure essentials dishwashing liquid-sparkling mist-24 oz.,Home & Kitchen > Dishwashing > Dish Detergent
2200,552,palmolive ultra multi surface dish liquid - 25 oz,Home & Kitchen > Dishwashing > Dish Detergent
2201,552,eco-me natural plant extracts dish soap - lemon liquid 16 fl oz liquid,Home & Kitchen > Dishwashing > Dish Detergent
2202,552,"mrs. meyer's clean day liquid dish soap, iowa pine - (16oz)",Home & Kitchen > Dishwashing > Dish Detergent
2203,552,"seventh generation dish liquid, natural lavender floral & mint - (25oz)",Home & Kitchen > Dishwashing > Dish Detergent
