,category_id,description,category_path
0,595,greenpig solutions 52,Home & Kitchen > Household Cleaning > Drain Openers
1,595,instant power hair & grease drain opener 1 l,Home & Kitchen > Household Cleaning > Drain Openers
2,595,"clorox liquid plumr heavy-duty clog remover, gel, 80oz bottle",Home & Kitchen > Household Cleaning > Drain Openers
3,595,johnson s c inc 00117 drano max clog remover new,Home & Kitchen > Household Cleaning > Drain Openers
4,595,green gobbler pro with crystalex technology - professional strength powdered drain opener - treats 6 clogs!!,Home & Kitchen > Household Cleaning > Drain Openers
5,595,johnson s c inc 20113 crystal drano drain opener,Home & Kitchen > Household Cleaning > Drain Openers
6,595,"Roebic RV-Q-12 32-Ounce RV and Marine Water Treatment, Black",Home & Kitchen > Household Cleaning > Drain Openers
7,595,drano max build-up remover - 10115 64oz drano build-up rmvr,Home & Kitchen > Household Cleaning > Drain Openers
8,595,"Enzytabs Septic Tank System Treatment, Billions of Enzyme Producing Bacteria Reduce Bad Odors and Help Prevent Backups, 4 Month Supply (4 tablets)",Home & Kitchen > Household Cleaning > Drain Openers
9,595,Shefko UNBELIEVABLE Industrial Strength Drain Opener and Cleaner and Septic Cleaner 100% All Natural - The Most,Home & Kitchen > Household Cleaning > Drain Openers
10,595,"roebic k-87-q-4 sgp soap, grease and paper digester, 32-ounce",Home & Kitchen > Household Cleaning > Drain Openers
11,595,drano professional strength,Home & Kitchen > Household Cleaning > Drain Openers
12,595,sani sticks the superior odor killer and drain cleaner solution lemon scent  48 pack,Home & Kitchen > Household Cleaning > Drain Openers
13,595,Drain Cleaner & Septic Tank Treatment - Drain Opener - 1 Year Supply - Safe Natural Enzymes Clean Pipes - Stop Sewer Smell & Toilet Overflow - For Bathtub Shower & Kitchen PlumbClear,Home & Kitchen > Household Cleaning > Drain Openers
14,595,"rid-x septic tank system treatment, 3-dose liquid, 24 ounce",Home & Kitchen > Household Cleaning > Drain Openers
15,595,"rid-x septic tank system treatment powder, 2-dose, 19.6 ounce",Home & Kitchen > Household Cleaning > Drain Openers
16,595,"rid-x septic tank system treatment, 1-dose liquid, 8 ounce",Home & Kitchen > Household Cleaning > Drain Openers
17,595,Drano Gel Clog Remover - 80 oz - 2 pk,Home & Kitchen > Household Cleaning > Drain Openers
18,595,Bio-Zone Septic Tank Treatment 100% Natural Solution No Chemicals 5 Year Supply Environmentally Friendly,Home & Kitchen > Household Cleaning > Drain Openers
19,595,"sani sticks, the superior odor killer and drain cleaner solution, lavender scent - 48 pack",Home & Kitchen > Household Cleaning > Drain Openers
20,595,liquid plumr pro-strength clog remover-80 oz,Home & Kitchen > Household Cleaning > Drain Openers
21,595,green gobbler heavy duty oven grill bbq  range hood cleaner  64 oz jug,Home & Kitchen > Household Cleaning > Drain Openers
22,595,drain care (18 oz / 510 g),Home & Kitchen > Household Cleaning > Drain Openers
23,595,roebic hdcrydo6 2pound heavy duty crystal drain opener,Home & Kitchen > Household Cleaning > Drain Openers
24,595,"drano foaming liquid, 17 oz",Home & Kitchen > Household Cleaning > Drain Openers
25,595,12 lb potassium hydroxide,Home & Kitchen > Household Cleaning > Drain Openers
26,595,thrift t-100 alkaline based 1-pound granular drain cleaner personal healthcare / health care,Home & Kitchen > Household Cleaning > Drain Openers
27,595,"Green Gobbler ULTIMATE Degreaser, Stain Remover & Hand Wipes - 50 Wipes",Home & Kitchen > Household Cleaning > Drain Openers
28,595,Professor Amos' Super Fast Drain Cleaner 2 pk,Home & Kitchen > Household Cleaning > Drain Openers
29,595,"enforcer edc16 build-up remover, 18 oz.",Home & Kitchen > Household Cleaning > Drain Openers
30,595,drainout dob06n bathroom drain opener-16 fluid ounces-specially formulated to clear hair and soap clogs in sinks and tubs-septic safe,Home & Kitchen > Household Cleaning > Drain Openers
31,595,"rid-x septic tank system treatment, 1-dose powder, 9.8 ounce",Home & Kitchen > Household Cleaning > Drain Openers
32,595,"pure lye drain opener, 1 lb new",Home & Kitchen > Household Cleaning > Drain Openers
33,595,Clorox Company 30717 Dispenser Drain Foam Cleaner,Home & Kitchen > Household Cleaning > Drain Openers
34,595,"Drano Max Clog Remover Twin Pack, 160 Ounce",Home & Kitchen > Household Cleaning > Drain Openers
35,595,perfect shopping 1pc home,Home & Kitchen > Household Cleaning > Drain Openers
36,595,"rid-x septic tank system treatment, 4 month supply powder, 39.2 ounce",Home & Kitchen > Household Cleaning > Drain Openers
37,595,minwax 30016 formby's build-up remover,Home & Kitchen > Household Cleaning > Drain Openers
38,595,"liquid-plumr pro-strength clog remover, slow flow fighter - 17 fl oz",Home & Kitchen > Household Cleaning > Drain Openers
39,595,drano professional strength foamer clog remover - 17 oz,Home & Kitchen > Household Cleaning > Drain Openers
40,595,liquid-plumr pro-strength clog remover slow flow fighter 17 oz,Home & Kitchen > Household Cleaning > Drain Openers
41,595,liquidplumr professional strength gel clog remover 80 oz,Home & Kitchen > Household Cleaning > Drain Openers
42,595,drano max gel clog remover 42 ounces. commercial line,Home & Kitchen > Household Cleaning > Drain Openers
43,595,clog remover power gel liquid-plumr,Home & Kitchen > Household Cleaning > Drain Openers
44,595,"liquid-plumr pro-strength clog remover, slow flow fighter 17.0 fl oz",Home & Kitchen > Household Cleaning > Drain Openers
45,595,green gobbler supersized set of 12 drain opener packets w/stic,Home & Kitchen > Household Cleaning > Drain Openers
46,595,professor amos fast microbial maintenance powder,Home & Kitchen > Household Cleaning > Drain Openers
47,595,sludge buster powerhouse drain cleaner 6-pack,Home & Kitchen > Household Cleaning > Drain Openers
48,595,33.8 oz. hair and grease drain opener,Home & Kitchen > Household Cleaning > Drain Openers
49,595,16 oz. septic system treatment,Home & Kitchen > Household Cleaning > Drain Openers
50,595,128-fl oz drain cleaner,Home & Kitchen > Household Cleaning > Drain Openers
51,595,32-oz heavy duty drain opener,Home & Kitchen > Household Cleaning > Drain Openers
52,595,citra drain drain maintainer - 22 oz - valencia orange,Home & Kitchen > Household Cleaning > Drain Openers
53,595,liquid-plumr full clog destroyer gel clog remover 80 oz btl,Home & Kitchen > Household Cleaning > Drain Openers
54,595,liquid plummer professional strength drain cleaner - 32 fl. oz.,Home & Kitchen > Household Cleaning > Drain Openers
55,595,liquid-plumr professional strength drain cleaner - 32 fl. oz.,Home & Kitchen > Household Cleaning > Drain Openers
56,595,"liquid-plumr® pro-strength clog remover, hair clog eliminator®, 16 fluid oz.",Home & Kitchen > Household Cleaning > Drain Openers
57,595,"earthworm family safe drain cleaner, fresh citrus & sage - 32 oz",Home & Kitchen > Household Cleaning > Drain Openers
58,595,"earth friendly products earth friendly natural earth enzymes drain opener, 2 lb",Home & Kitchen > Household Cleaning > Drain Openers
59,595,"drano drano snake plus commercial line, 16 oz",Home & Kitchen > Household Cleaning > Drain Openers
60,595,"drano drano max gel clog remover, 32 fl oz (pack of 2)",Home & Kitchen > Household Cleaning > Drain Openers
61,595,clorox liquid plumr heavy-duty gel clog remover - 80 oz jug,Home & Kitchen > Household Cleaning > Drain Openers
62,595,"liquid plumr gel clog remover, professional strength, 2.5 qts",Home & Kitchen > Household Cleaning > Drain Openers
63,595,"liquid plume pro strength penetrex gel drain cleaner, 17 oz",Home & Kitchen > Household Cleaning > Drain Openers
64,595,johnson s c inc 117 drano max clog remover - 32 fl oz jug,Home & Kitchen > Household Cleaning > Drain Openers
65,595,drano max gel clog remover 1 gal. pack,Home & Kitchen > Household Cleaning > Drain Openers
66,595,Purdy Stera-Sheen 4 lb Sanitizer Jar w/ Green Label,Home & Kitchen > Household Cleaning > Drain Openers
67,595,green gobbler refresh garbage disposal  drain cleaner  deodorizer  32 oz concentrate,Home & Kitchen > Household Cleaning > Drain Openers
68,595,"clorox, 2-in-1 foam, liquid-plumr, slow flow fighter, 17fl oz",Home & Kitchen > Household Cleaning > Drain Openers
69,595,tresalto hair clog remover tool for drain cleaning  set of 2,Home & Kitchen > Household Cleaning > Drain Openers
70,595,"GET SERIOUS Grease Trap Treatment Commercial Enzyme Drain Opener, Cleaner, Odor Control, Trap Cleaning And Maintenance",Home & Kitchen > Household Cleaning > Drain Openers
71,595,Drano Snake Plus Drain Cleaner Pro 16 Oz,Home & Kitchen > Household Cleaning > Drain Openers
72,595,"Sani Sticks, As Seen on TV Drain Cleaner and Deodorizer, Lavender Scent - 48 Pack",Home & Kitchen > Household Cleaning > Drain Openers
73,595,"Sani Sticks, As Seen on TV Drain Cleaner and Deodorizer, Lavender Scent - 24 Pack",Home & Kitchen > Household Cleaning > Drain Openers
74,595,drainout dob0632n bathroom drain opener-32 ounces-specially formulated to clear hair and soap clogs in sinks and tubs-septic safe,Home & Kitchen > Household Cleaning > Drain Openers
75,595,drano liquid clog remover,Home & Kitchen > Household Cleaning > Drain Openers
76,595,happy campers organic rv,Home & Kitchen > Household Cleaning > Drain Openers
77,595,happy campers organic rv holding tank treatment - medium 40oz jar (40-treatments),Home & Kitchen > Household Cleaning > Drain Openers
78,595,Drain Daddy Industrial Strength Drain Opener,Home & Kitchen > Household Cleaning > Drain Openers
79,595,2PCS Hair Drain Clog Remover Drain Relief Tool for Drain Cleaning 17'' - Fengbao,Home & Kitchen > Household Cleaning > Drain Openers
80,595,snagerz bathroom drain hair,Home & Kitchen > Household Cleaning > Drain Openers
81,595,Shefko UNBELIEVABLE Industrial Strength Drain Opener and Cleaner and Septic Cleaner 100% All Natural - The Most Powerful Natural Drain Cleaner - Conti,Home & Kitchen > Household Cleaning > Drain Openers
82,595,Drain Snake by Northfall Direct - Sink and Drain cleaning unclog remover (4 Pack),Home & Kitchen > Household Cleaning > Drain Openers
83,595,"Green Gobbler ""REFRESH"" Garbage Disposal & Drain Cleaner & Deodorizer - 32",Home & Kitchen > Household Cleaning > Drain Openers
84,595,green gobbler ultimate main,Home & Kitchen > Household Cleaning > Drain Openers
85,595,"ComStar 024924305003 Pure Lye Bead Drain Opener, 1 lb, White",Home & Kitchen > Household Cleaning > Drain Openers
86,595,"Drano 00117-2PK Max Clog Remover (Pack of 2), 32 oz",Home & Kitchen > Household Cleaning > Drain Openers
87,595,"Food Grade Sodium Hydroxide 99% Pure Lye Micro Beads, 8 Ounces(makes 2 Batches of Soap)",Home & Kitchen > Household Cleaning > Drain Openers
88,595,"unique natural products super digest-it safe drain opener, 32-ounce",Home & Kitchen > Household Cleaning > Drain Openers
89,595,"rid-x septic tank system treatment, 3-dose dual action septi-pacs, 3.2 ounce",Home & Kitchen > Household Cleaning > Drain Openers
90,595,sierra tools ez zip drain cleaner,Home & Kitchen > Household Cleaning > Drain Openers
91,595,"greenpig solutions 53 concentrated formula live septic tank treatment, 2 year supply",Home & Kitchen > Household Cleaning > Drain Openers
92,595,"liquid-plumr pro-strength clog remover, full clog destroyer, 32 fluid ounces",Home & Kitchen > Household Cleaning > Drain Openers
93,595,Drano Max Gel Clog Remover 32 Oz - Pack of 3,Home & Kitchen > Household Cleaning > Drain Openers
94,595,"drano max gel, clog remover, 80-ounce new",Home & Kitchen > Household Cleaning > Drain Openers
95,595,Drain Cleaner Snake. Brush. No More Pouring Down Chemicals. No Need for Electric Tools This Has Plumber Quality,Home & Kitchen > Household Cleaning > Drain Openers
96,595,earthworm family-safe drain,Home & Kitchen > Household Cleaning > Drain Openers
97,595,liquid plumber 2in1 foam prostrength 17 ounces,Home & Kitchen > Household Cleaning > Drain Openers
98,595,bio-clean drain septic,Home & Kitchen > Household Cleaning > Drain Openers
99,595,baam! drain blaster cleaner,Home & Kitchen > Household Cleaning > Drain Openers
100,595,"rid-x septic tank system treatment, 3 month supply dual action septi-pacs, 3.2 ounce",Home & Kitchen > Household Cleaning > Drain Openers
101,595,drano professional strength foamer clog remover - 17 fl oz,Home & Kitchen > Household Cleaning > Drain Openers
102,595,liquid-plumr foaming pipe snake - 17 fl. oz.,Home & Kitchen > Household Cleaning > Drain Openers
103,595,"liquid-plumr professional strength gel, clog re...",Home & Kitchen > Household Cleaning > Drain Openers
104,595,drano advanced septic treatment - 3 ea,Home & Kitchen > Household Cleaning > Drain Openers
105,595,liquid-plumr slow flow fighter - 17 fl oz,Home & Kitchen > Household Cleaning > Drain Openers
106,595,drano professional strength foamer clog remover...,Home & Kitchen > Household Cleaning > Drain Openers
107,595,liquid-plumr disposal & drain foaming cleaner 5 ct,Home & Kitchen > Household Cleaning > Drain Openers
108,595,liquid-plumr pro-strength clog remover hair clog eliminator 16 oz,Home & Kitchen > Household Cleaning > Drain Openers
109,595,clorox liquid-plumr pro strength hair clog eliminator 16 oz,Home & Kitchen > Household Cleaning > Drain Openers
110,595,liquid-plumber fresh citrus disposal plus drain foaming cleaner 5 foaming power packs - 5.3 oz,Home & Kitchen > Household Cleaning > Drain Openers
111,595,liquid-plumr pro-strength penetrex gel drain cleaner 17 oz,Home & Kitchen > Household Cleaning > Drain Openers
112,595,"liquid-plumr pro-strength clog remover, urgent clear, 17 fluid ounces",Home & Kitchen > Household Cleaning > Drain Openers
113,595,"liquid-plumr hair clog eliminator, 16 fl oz",Home & Kitchen > Household Cleaning > Drain Openers
114,595,"drano max gel clog remover, 2 qt",Home & Kitchen > Household Cleaning > Drain Openers
115,595,"drano® liquid clog remover, 32 oz.",Home & Kitchen > Household Cleaning > Drain Openers
116,595,green gobbler set/6 drain cleaner packets & 16o z refresh drain,Home & Kitchen > Household Cleaning > Drain Openers
117,595,professor amos fast pm drain maintenance powder,Home & Kitchen > Household Cleaning > Drain Openers
118,595,1 gal. professional strength drain cleaner,Home & Kitchen > Household Cleaning > Drain Openers
119,595,1 gal. max gel clog remover,Home & Kitchen > Household Cleaning > Drain Openers
120,595,k-400 drain cleaner,Home & Kitchen > Household Cleaning > Drain Openers
121,595,18 oz. kitchen crystals clog remover,Home & Kitchen > Household Cleaning > Drain Openers
122,595,19.6-oz septic cleaner,Home & Kitchen > Household Cleaning > Drain Openers
123,595,liquid-plumr pro-strength penetrex gel - (17fl oz),Home & Kitchen > Household Cleaning > Drain Openers
124,595,drano max gel clog remover professional strength 32 oz btl,Home & Kitchen > Household Cleaning > Drain Openers
125,595,drano clog remover max gel - 80 fl. oz.,Home & Kitchen > Household Cleaning > Drain Openers
126,595,safeway drain clog remover max gel - 80 fl. oz.,Home & Kitchen > Household Cleaning > Drain Openers
127,595,"liquid-plumr liquid plumr gel clog remover, 80 fl oz",Home & Kitchen > Household Cleaning > Drain Openers
128,595,"liquid-plumr disposal + drain foaming cleaner, foaming po...",Home & Kitchen > Household Cleaning > Drain Openers
129,595,drano liquid clog remover 32 fl. oz. jug,Home & Kitchen > Household Cleaning > Drain Openers
130,595,"clorox pro-strength liquid-plumr foaming pipe snake clog remover, 17oz",Home & Kitchen > Household Cleaning > Drain Openers
131,595,"liquid plumr clog remover, gel, professional strength 32 fl oz (1 qt) 946 ml",Home & Kitchen > Household Cleaning > Drain Openers
132,595,thrift t100 alkaline based 1pound granular drain cleaner by zurn,Home & Kitchen > Household Cleaning > Drain Openers
133,595,"Sodium Hydroxide (Caustic Soda, Lye) Beads FCC/ Food Grade 5 Lb",Home & Kitchen > Household Cleaning > Drain Openers
134,595,thrift t-100 alkaline based,Home & Kitchen > Household Cleaning > Drain Openers
135,595,"Citrasolv/Homesolv Drain Natural Build-up Remover, Valencia Orange, 22-Ounce Bottles (Pack of 6)",Home & Kitchen > Household Cleaning > Drain Openers
136,595,"rid-x septic tank system treatment, 1 month supply powder, 9.8 ounce",Home & Kitchen > Household Cleaning > Drain Openers
137,595,"GET SERIOUS Grease Trap Treatment Commercial Enzyme Drain Opener, Cleaner, Odor Control, Trap Cleaning And Maintenance. 1 Gallon",Home & Kitchen > Household Cleaning > Drain Openers
138,595,johnson s c inc 00117 drano,Home & Kitchen > Household Cleaning > Drain Openers
139,595,"green gobbler ""refresh"" garbage disposal & drain cleaner & deodorizer - lemon (32 oz)",Home & Kitchen > Household Cleaning > Drain Openers
140,595,"RID-X Commercial Septic System Liquid Treatment, Dual Action, 6 Monthly Doses, 48 Oz",Home & Kitchen > Household Cleaning > Drain Openers
141,595,"liquid-plumr pro-strength clog remover, urgent clear, 6 count",Home & Kitchen > Household Cleaning > Drain Openers
142,595,"greenpig solutions 56 concentrated formula live septic tank treatment, 5 year supply",Home & Kitchen > Household Cleaning > Drain Openers
143,595,"sani sticks, the superior odor killer and drain cleaner solution, unscented - 24 pack",Home & Kitchen > Household Cleaning > Drain Openers
144,595,"Rid-X Septic Tank System Treatment Powder, 19.6 Ounce",Home & Kitchen > Household Cleaning > Drain Openers
145,595,Bio-Zone Septic Tank Treatment 100% Natural Solution No Chemicals 1 Year Supply Environmentally Friendly,Home & Kitchen > Household Cleaning > Drain Openers
146,595,4 lb potassium hydroxide food grade red hot devil caustic potash flakes,Home & Kitchen > Household Cleaning > Drain Openers
147,595,drano 42 oz. max gel,Home & Kitchen > Household Cleaning > Drain Openers
148,595,liquid plumber 2-in-1 foam,Home & Kitchen > Household Cleaning > Drain Openers
149,595,"biokleen bac-out drain care gel, 6-count",Home & Kitchen > Household Cleaning > Drain Openers
150,595,"Shefko UNBELIEVABLE Industrial Strength Drain Maintenance Treatment Drain Cleaner and Septic Cleaner 100% All Natural - Continuous, Protective BioActive Solution - 32 oz fl",Home & Kitchen > Household Cleaning > Drain Openers
151,595,drano dual force foamer clog remover - 17 oz - 2 pk,Home & Kitchen > Household Cleaning > Drain Openers
152,595,drano commercial line 128 oz,Home & Kitchen > Household Cleaning > Drain Openers
153,595,liquid plumber foam pipe snake,Home & Kitchen > Household Cleaning > Drain Openers
154,595,Rid-X Septic Treatment Dash Button,Home & Kitchen > Household Cleaning > Drain Openers
155,595,Green Gobbler SEPTIC SAVER Bacteria Enzyme Pacs - 6 Month Septic Tank Supply - 6 Pre-Measured Packets(2.13 oz,Home & Kitchen > Household Cleaning > Drain Openers
156,595,earthworm® drain cleaner,Home & Kitchen > Household Cleaning > Drain Openers
157,595,ecological laboratories microbe-lift septic and cesspool treatment 32 fl. oz,Home & Kitchen > Household Cleaning > Drain Openers
158,595,"citra drain natural build-up remover, valencia orange, 22-ounce bottles (pack of 6)",Home & Kitchen > Household Cleaning > Drain Openers
159,595,"sani sticks, the superior odor killer and drain cleaner solution, lavender scent - 24 pack",Home & Kitchen > Household Cleaning > Drain Openers
160,595,4 lb sodium hydroxide food grade red hot devil lye 99+% pure caustic soda,Home & Kitchen > Household Cleaning > Drain Openers
161,595,"flo-kem 5195 flo-zyme bio-enzyme drain opener/deoderizer with pleasant scent, 1 gallon bottle, milky white",Home & Kitchen > Household Cleaning > Drain Openers
162,595,"zep zucyr2 crystal heat drain opener, 2 lbs.",Home & Kitchen > Household Cleaning > Drain Openers
163,595,thrift marketing inc t-200 thrift drain cleaner 2 lb,Home & Kitchen > Household Cleaning > Drain Openers
164,595,"drainbo household drain treatment and cleaner, 32-ounce",Home & Kitchen > Household Cleaning > Drain Openers
165,595,superior tools drainstick-drain clog remover,Home & Kitchen > Household Cleaning > Drain Openers
166,595,"liquid plumr 30717 disposal plus drain foaming cleaner, pk/5",Home & Kitchen > Household Cleaning > Drain Openers
167,595,green gobbler septic saver bacteria enzyme pacs - 6 month septic tank supply - 6 pre-measured packets(2.13 oz each),Home & Kitchen > Household Cleaning > Drain Openers
168,595,"rid-x septic tank system treatment, 1 month supply liquid, 8 ounce",Home & Kitchen > Household Cleaning > Drain Openers
169,595,professor amos super fast drain cleaner,Home & Kitchen > Household Cleaning > Drain Openers
170,595,liquid-plumr hair clog,Home & Kitchen > Household Cleaning > Drain Openers
171,595,drano snake plus health and beauty,Home & Kitchen > Household Cleaning > Drain Openers
172,595,drano max clog remover liquid drain cleaner,Home & Kitchen > Household Cleaning > Drain Openers
173,595,"MY&LY 20"" Drain Clog Remover-- Drain Cleaning Tool for Remove Hair--Drain Relief",Home & Kitchen > Household Cleaning > Drain Openers
174,595,liquid-plumr disposal plus drain foaming cleaner fresh citrus 5 foaming power packs 5.3 oz,Home & Kitchen > Household Cleaning > Drain Openers
175,595,drano,Home & Kitchen > Household Cleaning > Drain Openers
176,595,ridx septic tank system treatment 2dose powder 196 ounce,Home & Kitchen > Household Cleaning > Drain Openers
177,595,"liquid-plumr double impact pro-strength clog remover, 18 fl oz",Home & Kitchen > Household Cleaning > Drain Openers
178,595,liquid-plumr clog remover power gel 1.0 qt,Home & Kitchen > Household Cleaning > Drain Openers
179,595,"liquid-plumr® heavy-duty clog remover drain cleaner, 80 oz.",Home & Kitchen > Household Cleaning > Drain Openers
180,595,green gobbler supersized set of 12 drain opener packets w/stick,Home & Kitchen > Household Cleaning > Drain Openers
181,595,dranoreg liquid drain cleaner 32 oz safety cap bottle 12carton,Home & Kitchen > Household Cleaning > Drain Openers
182,595,19 oz. liquid heat drain opener,Home & Kitchen > Household Cleaning > Drain Openers
183,595,42 oz. drain max gel clog remover,Home & Kitchen > Household Cleaning > Drain Openers
184,595,64 oz. drain build up remover,Home & Kitchen > Household Cleaning > Drain Openers
185,595,32-oz drain cleaner crystals,Home & Kitchen > Household Cleaning > Drain Openers
186,595,liquid plumr pro-strength penetrex clog remover-17 oz,Home & Kitchen > Household Cleaning > Drain Openers
187,595,"drano liquid clog remover, regular formula, 32 oz-2 pack",Home & Kitchen > Household Cleaning > Drain Openers
188,595,liquid plumr 2pk,Home & Kitchen > Household Cleaning > Drain Openers
189,595,drano clog remover liquid 32 oz btl,Home & Kitchen > Household Cleaning > Drain Openers
190,595,drano clog remover professional strength foamer 17 oz btl,Home & Kitchen > Household Cleaning > Drain Openers
191,595,liquid-plumr pro-strenght penetrex gel clears toughest clogs in - 17 fl. oz.,Home & Kitchen > Household Cleaning > Drain Openers
192,595,"liquid-plumr® pro-strength clog remover, urgent clear®, 17 fluid oz.",Home & Kitchen > Household Cleaning > Drain Openers
193,595,liquid-plumr liquid-plumr 17 fl oz penetrex gel liquid drain cleaner 1...,Home & Kitchen > Household Cleaning > Drain Openers
194,595,"drano drano max gel, clog remover, 80 ounce",Home & Kitchen > Household Cleaning > Drain Openers
195,595,"drano max gel clog remover, pro strength, value size - 80 fl oz",Home & Kitchen > Household Cleaning > Drain Openers
196,595,ace pro drain cleaner - 64 oz bottle,Home & Kitchen > Household Cleaning > Drain Openers
197,595,"Professional Slow Drain Cleaner and Clog Remover - 10 Foot Long - Metal Hair Catcher, Sink Dredge Pipeline Cleaner",Home & Kitchen > Household Cleaning > Drain Openers
198,595,Clorox/Home Cleaning 00243 Liquid-Plumr Professional Strength Drain Opener,Home & Kitchen > Household Cleaning > Drain Openers
199,595,"Roebic Laboratories, Inc. K-47-4 32-Ounce Cesspool Treatment",Home & Kitchen > Household Cleaning > Drain Openers
200,595,drain cleaner 25ft,Home & Kitchen > Household Cleaning > Drain Openers
201,595,johnson s c inc 00117 drano max clog remover  32 ozpack of 2 new,Home & Kitchen > Household Cleaning > Drain Openers
202,595,"Evelots Green Unclog Ease Odor Killer & Drain Cleaner Solution, 12 Pack",Home & Kitchen > Household Cleaning > Drain Openers
203,595,earthworm® drain cleaner - clog remover - drain opener / deodorizer - 32 fl oz,Home & Kitchen > Household Cleaning > Drain Openers
204,595,Johnson S C Inc 00117 Drano Max Clog Remover by Johnson S C Inc,Home & Kitchen > Household Cleaning > Drain Openers
205,595,drano drain cleaner,Home & Kitchen > Household Cleaning > Drain Openers
206,595,johnson s c inc 14768 drano foaming liquid,Home & Kitchen > Household Cleaning > Drain Openers
207,595,"liquid-plumr 00243 professional strength drain opener, 32 fl oz bottle",Home & Kitchen > Household Cleaning > Drain Openers
208,595,"drano max gel, clog",Home & Kitchen > Household Cleaning > Drain Openers
209,595,drano max gel clog remover 80ounce drano,Home & Kitchen > Household Cleaning > Drain Openers
210,595,happy campers organic rv holding tank treatment - large 64oz tub (64-treatments),Home & Kitchen > Household Cleaning > Drain Openers
211,595,"sani sticks, as seen on tv drain cleaner and deodorizer, unscented - 48 pack",Home & Kitchen > Household Cleaning > Drain Openers
212,595,2 lb Red Hot Devil Lye Sodium Hydroxide Meets Food Chemical Codex High Grade Caustic Soda Beads,Home & Kitchen > Household Cleaning > Drain Openers
213,595,"roebic laboratories, inc. k-97-4 main line cleaner, 32-ounce",Home & Kitchen > Household Cleaning > Drain Openers
214,595,"drano professional strength kitchen crystals clog remover, case pack, six - 18 ounce cans (108 ounces)",Home & Kitchen > Household Cleaning > Drain Openers
