,category_id,description,category_path
666,595,liquid-plumber pro-strength clear clog remover urgent - 17 oz,Home & Kitchen > Household Cleaning > Drain Openers
667,595,liquidplumr gel clog remover 32 oz,Home & Kitchen > Household Cleaning > Drain Openers
668,595,power plumber airpressure drain opener plunger kitpower plumber kit,Home & Kitchen > Household Cleaning > Drain Openers
669,595,liquidplumr prostrength full clog destroyer clog remover 128 fl oz,Home & Kitchen > Household Cleaning > Drain Openers
670,595,"rid-x liquid 3-month septic tank system treatment, 24 oz.",Home & Kitchen > Household Cleaning > Drain Openers
671,595,drano dual force foamer 17oz,Home & Kitchen > Household Cleaning > Drain Openers
672,595,drano kitchen crystals clog remover 18 ounces,Home & Kitchen > Household Cleaning > Drain Openers
673,595,drain daddy set of 2 fast acting 32 oz. drain cleaners,Home & Kitchen > Household Cleaning > Drain Openers
674,595,professor amos superfast drain cleaner 2-pack with 8 oz. fast mm microbial maintenance powder,Home & Kitchen > Household Cleaning > Drain Openers
675,595,professor amos superfast max drain-opening powder,Home & Kitchen > Household Cleaning > Drain Openers
676,595,professor amos superfast drain cleaner 2-pack with 8 oz. fast mm microbial maintenance powder auto-ship,Home & Kitchen > Household Cleaning > Drain Openers
677,595,33.8 oz. disposal and drain cleaner orange,Home & Kitchen > Household Cleaning > Drain Openers
678,595,2 lb. crystal heat drain opener,Home & Kitchen > Household Cleaning > Drain Openers
679,595,kleer drain opener,Home & Kitchen > Household Cleaning > Drain Openers
680,595,24 oz. septic system treatment,Home & Kitchen > Household Cleaning > Drain Openers
681,595,10-minute hair clog remover 128-oz drain cleaner,Home & Kitchen > Household Cleaning > Drain Openers
682,595,48-oz septic cleaner,Home & Kitchen > Household Cleaning > Drain Openers
683,595,18-oz drain cleaner crystals,Home & Kitchen > Household Cleaning > Drain Openers
684,595,128-oz max clog remover gel,Home & Kitchen > Household Cleaning > Drain Openers
685,595,"drano dual force foamer clog remover, 17 oz-2 pack",Home & Kitchen > Household Cleaning > Drain Openers
686,595,rid-x septic system treatment 3-dose dual action septi-pacs-3.2 oz,Home & Kitchen > Household Cleaning > Drain Openers
687,595,liquid plumr original clog remover-80 oz,Home & Kitchen > Household Cleaning > Drain Openers
688,595,"citra drain citra drain drain maintainer, valencia orange, 22 oz",Home & Kitchen > Household Cleaning > Drain Openers
689,595,earth friendly products earth friendly drain opener - 2 pound,Home & Kitchen > Household Cleaning > Drain Openers
690,595,"drano drano ultra max gel clog remover, 80 fluid ounce bottles,...",Home & Kitchen > Household Cleaning > Drain Openers
691,595,drano max twin pack 80oz,Home & Kitchen > Household Cleaning > Drain Openers
692,595,liquidplumr professional strength foaming pipe snake clog remover 17,Home & Kitchen > Household Cleaning > Drain Openers
693,595,"liquid plumr professional strength, 2-pack, 80-ounce - limit 5",Home & Kitchen > Household Cleaning > Drain Openers
694,595,ram rod drain opener - 1 qt bottle,Home & Kitchen > Household Cleaning > Drain Openers
695,595,earthworm natural drain cleaner,Home & Kitchen > Household Cleaning > Drain Openers
696,595,drano max gel professional strength -32 ounces,Home & Kitchen > Household Cleaning > Drain Openers
697,595,pure lye drain opener 1 lb. pack of 2,Home & Kitchen > Household Cleaning > Drain Openers
698,595,liquid plumber foam pipe,Home & Kitchen > Household Cleaning > Drain Openers
699,595,whink 06217 hair clog blaster liquid drain clog remover 32 oz,Home & Kitchen > Household Cleaning > Drain Openers
700,595,20 oz. powder toilet care tune up crystal drain cleaner,Home & Kitchen > Household Cleaning > Drain Openers
701,595,"Green Gobbler GGDC3PACBOX Drain Opener, Hair Grabber Tool, 3 Piece, 8.25 Oz ( 233 g ) Each",Home & Kitchen > Household Cleaning > Drain Openers
702,595,advanced septic treatment,Home & Kitchen > Household Cleaning > Drain Openers
703,595,12 lb sodium hydroxide food grade red hot devil lye caustic soda beads,Home & Kitchen > Household Cleaning > Drain Openers
704,595,biokleen bac-out drain care,Home & Kitchen > Household Cleaning > Drain Openers
705,595,unique marketing of colorado 244 rv digest it 32 oz,Home & Kitchen > Household Cleaning > Drain Openers
706,595,"green gobbler pro w/ free ""hair grabber"" tool",Home & Kitchen > Household Cleaning > Drain Openers
707,595,rooto corp. 1030 1 lb. drain cleaner with lye,Home & Kitchen > Household Cleaning > Drain Openers
708,595,"pure lye drain opener, 1 lb (3) with a pair of safety gloves",Home & Kitchen > Household Cleaning > Drain Openers
709,595,"20"" drain clog remover- quick and painless slow-drain relief",Home & Kitchen > Household Cleaning > Drain Openers
710,595,"advanced septic treatment, 3 count",Home & Kitchen > Household Cleaning > Drain Openers
711,595,"Pure Lye Drain Opener, 1 Lb 2-Pack",Home & Kitchen > Household Cleaning > Drain Openers
712,595,"liquid-plumr professional strength gel, clog remover - 32 oz",Home & Kitchen > Household Cleaning > Drain Openers
713,595,"Superior Tool 03819 Manual DrainStick-Sink, Bath, and Shower Drain Clog Remover and Cleaner-Drain Stick Easy Drain",Home & Kitchen > Household Cleaning > Drain Openers
714,595,"pure lye drain opener, 1 lb",Home & Kitchen > Household Cleaning > Drain Openers
715,595,"liquid-plumr hair clog eliminator, 16 fluid ounce",Home & Kitchen > Household Cleaning > Drain Openers
716,595,6 lb sodium hydroxide food grade red hot devil lye caustic soda beads,Home & Kitchen > Household Cleaning > Drain Openers
717,595,"liquid-plumr pro-strength clog remover double impact, snake + gel system - 18 fl oz",Home & Kitchen > Household Cleaning > Drain Openers
718,595,"liquid-plumr pro-strength clog remover, full clog destroyer - 1 qt",Home & Kitchen > Household Cleaning > Drain Openers
719,595,liquid-plumber pro-strength clog remover slow flow fighter - 17 oz,Home & Kitchen > Household Cleaning > Drain Openers
720,595,drano max gel value pack - 80 fl oz,Home & Kitchen > Household Cleaning > Drain Openers
721,595,"liquid-plumr pro-strength clog remover, hair clog eliminator, 16 fluid ounces",Home & Kitchen > Household Cleaning > Drain Openers
722,595,"liquid-plumr heavy duty clog remover gel, 80 fl oz",Home & Kitchen > Household Cleaning > Drain Openers
723,595,liquidplumr prostrength clog remover full clog destroyer 80 fluid ounces,Home & Kitchen > Household Cleaning > Drain Openers
724,595,17 oz. foaming liquid drain cleaner,Home & Kitchen > Household Cleaning > Drain Openers
725,595,18 oz. drain care build up remover,Home & Kitchen > Household Cleaning > Drain Openers
726,595,commercial line 128-oz drain cleaner,Home & Kitchen > Household Cleaning > Drain Openers
727,595,10-oz septic cleaner,Home & Kitchen > Household Cleaning > Drain Openers
728,595,liquid-plumr pro-strength penetrex gel - (17oz),Home & Kitchen > Household Cleaning > Drain Openers
729,595,hair clog remover - 33.8 fl. oz.,Home & Kitchen > Household Cleaning > Drain Openers
730,595,drano clog remover max gel - 32 fl. oz.,Home & Kitchen > Household Cleaning > Drain Openers
731,595,"drano drano regular liquid clog remover, 32 oz",Home & Kitchen > Household Cleaning > Drain Openers
732,595,earth friendly drain opener - 2 pound,Home & Kitchen > Household Cleaning > Drain Openers
733,595,"rid-x easy-flush formula 1 dose septic system treatment, 9.8oz",Home & Kitchen > Household Cleaning > Drain Openers
734,595,"drano ultra, *sale price limit 5",Home & Kitchen > Household Cleaning > Drain Openers
735,595,liquid-plumr pro-strength penetrex drain opening gel 17 oz,Home & Kitchen > Household Cleaning > Drain Openers
736,595,liquid plumber prof strength - 32 oz,Home & Kitchen > Household Cleaning > Drain Openers
737,595,"liquid plumr professional strength, 2-pack, 80-ounce - sale price limit 5",Home & Kitchen > Household Cleaning > Drain Openers
738,595,liquid plumr clog destroyer 2/128 ounce,Home & Kitchen > Household Cleaning > Drain Openers
739,595,max clog remover,Home & Kitchen > Household Cleaning > Drain Openers
740,595,Pure Lye Drain Opener 1 lb (3),Home & Kitchen > Household Cleaning > Drain Openers
741,595,"Sani Sticks, As Seen on TV Drain Cleaner and Deodorizer, Lemon Scent - 24 Pack",Home & Kitchen > Household Cleaning > Drain Openers
742,595,"airx rx 33 bio-enzymatic grease trap and drain maintainer, 1 gallon bottle, orange",Home & Kitchen > Household Cleaning > Drain Openers
743,595,"rid-x septic tank system treatment, 3 month supply powder, 29.4 ounce",Home & Kitchen > Household Cleaning > Drain Openers
744,595,green gobbler pro with crystalex technology - professional strength powdered drain opener,Home & Kitchen > Household Cleaning > Drain Openers
745,595,"roebic laboratories k-67 granular concentrate drain and trap cleaner, 16-ounce bag",Home & Kitchen > Household Cleaning > Drain Openers
746,595,"greenpig solutions 52 concentrated formula live septic tank treatment, 1 year supply",Home & Kitchen > Household Cleaning > Drain Openers
747,595,"SC Johnson Wax Pro Strength Drano Max Gel, 128 Oz",Home & Kitchen > Household Cleaning > Drain Openers
748,595,Best Drain Cleaner & Septic Tank Treatment - 2-in-1 Professional Cleaning Supplies Formula - 1 Year Supply - Natural Enzyme Cleaner Prevents Backups Guaranteed,Home & Kitchen > Household Cleaning > Drain Openers
749,595,high pressure drain opener,Home & Kitchen > Household Cleaning > Drain Openers
750,595,drano gel clog remover - 80 oz - 2 pk new,Home & Kitchen > Household Cleaning > Drain Openers
751,595,green gobbler drain opener,Home & Kitchen > Household Cleaning > Drain Openers
752,595,liquid-plumr full clog destroyer 2x128oz,Home & Kitchen > Household Cleaning > Drain Openers
753,595,"SimpleAir Clean Flow HVAC Drain Line Treatment Tabs, 6 pk",Home & Kitchen > Household Cleaning > Drain Openers
754,595,"rid-x septic tank system treatment liquid, 6-dose, 48 ounce",Home & Kitchen > Household Cleaning > Drain Openers
755,595,Earthworm Drain Cleaner - Drain Deodorizer - Natural and Family-Safe - 64 fl oz,Home & Kitchen > Household Cleaning > Drain Openers
756,595,Thrift T-100 Alkaline Based 1-Pound Granular Drain Cleaner Personal Healthcare,Home & Kitchen > Household Cleaning > Drain Openers
757,595,"Sani Sticks, the Superior Odor Killer and Drain Cleaner Solution, Orange Scent, 48 Pack",Home & Kitchen > Household Cleaning > Drain Openers
758,595,invade bio drain gel drain cleaner - 1 case (4 gallons),Home & Kitchen > Household Cleaning > Drain Openers
759,595,s c johnson wax drano clog,Home & Kitchen > Household Cleaning > Drain Openers
760,595,drano max clog remover,Home & Kitchen > Household Cleaning > Drain Openers
761,595,"green gobbler w/ free ""hair grabber"" - money back gaurantee",Home & Kitchen > Household Cleaning > Drain Openers
762,595,"Biokleen Bac-Out Drain Care Gel, 32 Ounces",Home & Kitchen > Household Cleaning > Drain Openers
763,595,"Clorox Company 30708 Liquid Plumr Gel, 18-Ounce",Home & Kitchen > Household Cleaning > Drain Openers
764,595,roebic k-570-q-4 32-ounce,Home & Kitchen > Household Cleaning > Drain Openers
765,595,green gobbler ultimate main drain opener  hair 76 0z by green gobbler,Home & Kitchen > Household Cleaning > Drain Openers
766,595,washing machine lint trap 5pack to go over washer hose best mesh snare lint catcher for machines get it now  reduce clogged pipes  protect your septic drainage field  pramoda inc,Home & Kitchen > Household Cleaning > Drain Openers
767,595,"roebic laboratories, inc",Home & Kitchen > Household Cleaning > Drain Openers
768,595,thrift t100 alkaline based 1pound granular drain cleaner,Home & Kitchen > Household Cleaning > Drain Openers
769,595,bio-clean drain septic bacteria,Home & Kitchen > Household Cleaning > Drain Openers
770,595,thrift marketing giddsty0400879 drain cleaner 2 lb,Home & Kitchen > Household Cleaning > Drain Openers
771,595,Green Gobbler Apple Melon ULTRA PACS - 8 Refills - All Purpose Degreaser &,Home & Kitchen > Household Cleaning > Drain Openers
772,595,rooto corp. 1030 1 lb,Home & Kitchen > Household Cleaning > Drain Openers
773,595,earthworm natural enzyme-based family-safe drain cleaner - 32 fl oz,Home & Kitchen > Household Cleaning > Drain Openers
774,595,"liquid-plumr disposal + drain foaming cleaner, foaming power packs - 1.06 oz",Home & Kitchen > Household Cleaning > Drain Openers
775,595,liquid-plumr fresh citrus disposal plus drain foaming cleaner 5 foaming power packs - 5.3 oz,Home & Kitchen > Household Cleaning > Drain Openers
776,595,coleman liquid septic tank deodorizor,Home & Kitchen > Household Cleaning > Drain Openers
777,595,"drano(reg) liquid clog remover, 32 oz.",Home & Kitchen > Household Cleaning > Drain Openers
778,595,professor amos superfast max drain powder and fast pm drain maintenance powder,Home & Kitchen > Household Cleaning > Drain Openers
779,595,plumber's hero drain cleaner with attachments,Home & Kitchen > Household Cleaning > Drain Openers
780,595,professor amos 9-piece chamois kit,Home & Kitchen > Household Cleaning > Drain Openers
781,595,drain weasel hair clog tool starter kit for drain cleaning (3-piece),Home & Kitchen > Household Cleaning > Drain Openers
782,595,128 oz. main line cleaner,Home & Kitchen > Household Cleaning > Drain Openers
783,595,drano max gel professional maximum strength (32fl oz),Home & Kitchen > Household Cleaning > Drain Openers
784,595,liquid-plumr professional strength - 80 fl. oz.,Home & Kitchen > Household Cleaning > Drain Openers
785,595,clorox liquid-plumr professional strength liquid drain cleaner prof,Home & Kitchen > Household Cleaning > Drain Openers
786,595,roebic laboratories quart mainline cleaner k97-q-12,Home & Kitchen > Household Cleaning > Drain Openers
787,595,"drano drano advanced septic treatment clog removing pouches, 3 ...",Home & Kitchen > Household Cleaning > Drain Openers
788,595,"drano drano commercial line max build-up remover, 64 oz",Home & Kitchen > Household Cleaning > Drain Openers
789,595,"drano drano max gel clog remover, 32 oz. bottle",Home & Kitchen > Household Cleaning > Drain Openers
790,595,drano drano commercial line max gel clog remover 42 fl. oz. jug,Home & Kitchen > Household Cleaning > Drain Openers
791,595,drano liquid drain cleaner - 32 fl oz jug,Home & Kitchen > Household Cleaning > Drain Openers
792,595,liquid-plumr pro strength hair clog eliminator 16 oz,Home & Kitchen > Household Cleaning > Drain Openers
793,595,"rooto corp.: 1lb drain cleaner, 1030""",Home & Kitchen > Household Cleaning > Drain Openers
794,595,"drano clog remover, pro strength, max gel - 32 fl oz",Home & Kitchen > Household Cleaning > Drain Openers
795,595,drano foam clog remover - 17 fl oz,Home & Kitchen > Household Cleaning > Drain Openers
796,595,s c johnson j30 14768 drano pr,Home & Kitchen > Household Cleaning > Drain Openers
797,595,liquid plumber heavy duty drain opener - 80 oz,Home & Kitchen > Household Cleaning > Drain Openers
798,595,drano max gel clog remover - 80 fl oz bottle,Home & Kitchen > Household Cleaning > Drain Openers
799,595,liquid plumr professional strength foaming pipe snake,Home & Kitchen > Household Cleaning > Drain Openers
800,595,drano clog remover - dual fo - 17.00 fl oz,Home & Kitchen > Household Cleaning > Drain Openers
801,595,"scotch 1503 instant power disposal and drain cleaner, orange scent",Home & Kitchen > Household Cleaning > Drain Openers
802,595,thrift t-200 2lb,Home & Kitchen > Household Cleaning > Drain Openers
803,595,Drain Cleaner and Septic Tank Treatment 2 lb. Safe Natural Enzymes. Powerful Bacteria.Nature's Soldiers.,Home & Kitchen > Household Cleaning > Drain Openers
804,595,"liquid-plumr original drain cleaner, 80-fluid ounce bottles (pack of 6)",Home & Kitchen > Household Cleaning > Drain Openers
805,595,johnson s c inc 14768 drano foaming liquid health and beauty,Home & Kitchen > Household Cleaning > Drain Openers
806,595,drano kitchen crystals drain opener-18 oz. kitchen,Home & Kitchen > Household Cleaning > Drain Openers
807,595,pure lye drain opener 1 lb (3) new,Home & Kitchen > Household Cleaning > Drain Openers
808,595,"Oatey Oatey Hercules 20412 Glug Crystals Drain Opener, 16 Ounces",Home & Kitchen > Household Cleaning > Drain Openers
809,595,"Sodium Hydroxide (Caustic Soda, Lye) Beads FCC/ Food Grade 1 Lb",Home & Kitchen > Household Cleaning > Drain Openers
810,595,Kleer Drain 100 Instant Drain Opener,Home & Kitchen > Household Cleaning > Drain Openers
811,595,S Well Bottle Titanium 17 oz Bottle,Home & Kitchen > Household Cleaning > Drain Openers
812,595,thrift t600 alkaline based 6 lb granular drain cleaner,Home & Kitchen > Household Cleaning > Drain Openers
813,595,Daixers 2PCS Hair Drain Clog Remover Drain Relief Tool for Drain Cleaning Blue17'' Yellow 20''(2 Pairs),Home & Kitchen > Household Cleaning > Drain Openers
814,595,green gobbler drain opening pac's - 5 pack new,Home & Kitchen > Household Cleaning > Drain Openers
815,595,greenpig solutions 53,Home & Kitchen > Household Cleaning > Drain Openers
816,595,"rid-x septic tank system treatment, 8 ounce",Home & Kitchen > Household Cleaning > Drain Openers
817,595,"Earth Friendly Products Earth Enzymes Drain Opener, 32 oz",Home & Kitchen > Household Cleaning > Drain Openers
818,595,invade bio drain gel gallon,Home & Kitchen > Household Cleaning > Drain Openers
819,595,roebic k-67bag 16-ounce granular drain and trap cleaner,Home & Kitchen > Household Cleaning > Drain Openers
820,595,"pure lye drain opener, 1 lb kitchen",Home & Kitchen > Household Cleaning > Drain Openers
821,595,"Sani Sticks, As Seen on TV Drain Cleaner and Deodorizer, Orange Scent, 24 Pack",Home & Kitchen > Household Cleaning > Drain Openers
822,595,drano max gel clog remover-80 oz.,Home & Kitchen > Household Cleaning > Drain Openers
823,595,"liquid-plumr pro-strength clog remover, slow flow fighter, 17 fluid ounces",Home & Kitchen > Household Cleaning > Drain Openers
824,595,"rid-x powder 3-month septic tank system treatment, 29.4 oz.",Home & Kitchen > Household Cleaning > Drain Openers
825,595,clog remover power gel liquid-plumr 1.0 qt,Home & Kitchen > Household Cleaning > Drain Openers
826,595,"liquid-plumr(reg) heavy-duty clog remover drain cleaner, 80 oz.",Home & Kitchen > Household Cleaning > Drain Openers
827,595,liquid plummer profession,Home & Kitchen > Household Cleaning > Drain Openers
828,595,drain weasel 3-pack refill for drain cleaning,Home & Kitchen > Household Cleaning > Drain Openers
829,595,10-minute hair clog remover 64-oz drain cleaner,Home & Kitchen > Household Cleaning > Drain Openers
830,595,1-gallon drain cleaner,Home & Kitchen > Household Cleaning > Drain Openers
831,595,earth friendly natural earth enzymes drain opener -- 2 lbs,Home & Kitchen > Household Cleaning > Drain Openers
832,595,"earthworm septic system treatment, 10.3 oz",Home & Kitchen > Household Cleaning > Drain Openers
833,595,liquid-plumr pro-strength foaming clog fighter 17 oz btl,Home & Kitchen > Household Cleaning > Drain Openers
834,595,earthworm drain cleaner family safe 32 oz btl,Home & Kitchen > Household Cleaning > Drain Openers
835,595,liquid-plumr slow flow fighter clog remover 17 oz btl,Home & Kitchen > Household Cleaning > Drain Openers
836,595,drano max gel clog remover professional strength 80 oz btl,Home & Kitchen > Household Cleaning > Drain Openers
837,595,liquid-plumr clorox/home cleaning liquid-plumr professional strength d...,Home & Kitchen > Household Cleaning > Drain Openers
838,595,liquid plumr power gel pro-strength clog remover,Home & Kitchen > Household Cleaning > Drain Openers
839,595,drano ultra,Home & Kitchen > Household Cleaning > Drain Openers
840,595,liquid-plumr pro-strength hair clog eliminator,Home & Kitchen > Household Cleaning > Drain Openers
841,595,"liquid-plumr clog remover, gel, professional strength - 80 fl oz",Home & Kitchen > Household Cleaning > Drain Openers
842,595,liquid-plumr clog and odor remover - 1 qt bottle,Home & Kitchen > Household Cleaning > Drain Openers
843,595,"drano max gel clog remover, unscented, 1 qt. bottle - drkcb001176",Home & Kitchen > Household Cleaning > Drain Openers
844,595,32oz liquid plumber,Home & Kitchen > Household Cleaning > Drain Openers
845,595,liquid plumr professional strength power gel,Home & Kitchen > Household Cleaning > Drain Openers
846,595,"rid-x septic tank system treatment, 6 month supply liquid, 24 ounce",Home & Kitchen > Household Cleaning > Drain Openers
847,595,earth friendly products drain opener,Home & Kitchen > Household Cleaning > Drain Openers
848,595,liquid-plumr pro-strength urgent cl - 17.00 fl oz,Home & Kitchen > Household Cleaning > Drain Openers
849,595,liquid-plumr clog remover - power g - 80.00 fl oz,Home & Kitchen > Household Cleaning > Drain Openers
850,595,dual-force foamer clog remover,Home & Kitchen > Household Cleaning > Drain Openers
851,595,vastar hair drain clog,Home & Kitchen > Household Cleaning > Drain Openers
852,595,"RID-X Septic Tank System Treatment, 9.8 Ounce",Home & Kitchen > Household Cleaning > Drain Openers
853,595,"drain gel - 1 quart (kill drain fly, fruit fly control)",Home & Kitchen > Household Cleaning > Drain Openers
854,595,"Drano Professional Strength Kitchen Crystals Clog Remover, 18 Oz",Home & Kitchen > Household Cleaning > Drain Openers
855,595,drano snake plus drain cleaning tool + gel kit,Home & Kitchen > Household Cleaning > Drain Openers
856,595,"Sani Sticks, the Superior Odor Killer and Drain Cleaner Solution, Orange Scent, 24 Pack",Home & Kitchen > Household Cleaning > Drain Openers
857,595,"Perfect Life Ideas Drain Drain Opener Toilet Plunger,green",Home & Kitchen > Household Cleaning > Drain Openers
858,595,"Happy Campers Organic RV Holding Tank Treatment - large 64oz tub (64-treatments) for RV, Marine, Camping, Portable",Home & Kitchen > Household Cleaning > Drain Openers
859,595,sc johnson #40109 80oz drano clog remover,Home & Kitchen > Household Cleaning > Drain Openers
860,595,"greenpig solutions 58 drain restore, maintainer and odor eliminator",Home & Kitchen > Household Cleaning > Drain Openers
861,595,"drano liquid clog remover, regular formula - 32 oz - 2 pk new",Home & Kitchen > Household Cleaning > Drain Openers
862,595,"bi-o-kleen bac-out drain care gel, 32 ounce",Home & Kitchen > Household Cleaning > Drain Openers
863,595,drano kitchen crystals drain opener-18 oz.,Home & Kitchen > Household Cleaning > Drain Openers
864,595,Professor Amos' Toilet/ Tank Cleaner,Home & Kitchen > Household Cleaning > Drain Openers
865,595,green gobbler drain opening,Home & Kitchen > Household Cleaning > Drain Openers
866,595,"roebic laboratories, inc. hd-cry-6 2-pound heavy duty crystal drain opener",Home & Kitchen > Household Cleaning > Drain Openers
867,595,"Rid-X Septic Tank System Treatment, 39.2 Ounce",Home & Kitchen > Household Cleaning > Drain Openers
868,595,"rid-x septic tank system treatment powder, 1-dose powder, 9.8 ounce (case of 12)",Home & Kitchen > Household Cleaning > Drain Openers
869,595,Thrift Marketing Inc Ty-0400879 Thrift Drain Cleaner 2 Lb -Pack of 3,Home & Kitchen > Household Cleaning > Drain Openers
870,595,drano dual force foamer clog remover - 17 oz,Home & Kitchen > Household Cleaning > Drain Openers
871,595,"scotch 1501 instant power disposal and drain cleaner, lemon scent",Home & Kitchen > Household Cleaning > Drain Openers
872,595,"Enzytabs Septic Tank System Treatment, Billions of Enzyme Producing Bacteria Reduce Bad Odors and Help Prevent Backups, 12 Month Supply (12 tablets)",Home & Kitchen > Household Cleaning > Drain Openers
873,595,liquid-plumr pro-strength clog remover full clog destroyer - 32 oz,Home & Kitchen > Household Cleaning > Drain Openers
874,595,drano max clog remover twin pack 160 ounces,Home & Kitchen > Household Cleaning > Drain Openers
875,595,drainpro gel drain opener,Home & Kitchen > Household Cleaning > Drain Openers
876,595,johnson wax drano max build-up remover 70240 - pack of 4,Home & Kitchen > Household Cleaning > Drain Openers
877,595,bac-out drain care gel biokleen 32.0 fl oz,Home & Kitchen > Household Cleaning > Drain Openers
878,595,drano advanced septic treatment 3.0 ea,Home & Kitchen > Household Cleaning > Drain Openers
879,595,green gobbler supersized 10 drain opener packets,Home & Kitchen > Household Cleaning > Drain Openers
880,595,green gobbler set of 6 drain opener packets wit h drain stick,Home & Kitchen > Household Cleaning > Drain Openers
881,595,professor amos superfast max drain-opening powder - 16 oz.,Home & Kitchen > Household Cleaning > Drain Openers
882,595,baam! drain blaster high-pressure drain opener,Home & Kitchen > Household Cleaning > Drain Openers
883,595,professor amos superfast drain cleaner 2-pack with fast pm powder,Home & Kitchen > Household Cleaning > Drain Openers
884,595,drano max gel drain cleaner 80 oz,Home & Kitchen > Household Cleaning > Drain Openers
885,595,"drano dual force foam, 17 oz",Home & Kitchen > Household Cleaning > Drain Openers
886,595,"liquid-plumr® pro-strength clog remover, full clog destroyer, 32 fl oz",Home & Kitchen > Household Cleaning > Drain Openers
887,595,"liquid-plumr liquid plumr urgent clear clog remover, 17 fl oz (pack of 2)",Home & Kitchen > Household Cleaning > Drain Openers
888,595,"liquid-plumr liquid plumr double impact clog remover with clorox, 18 f...",Home & Kitchen > Household Cleaning > Drain Openers
889,595,s c johnson commercial line drano max liquid drain cleaner clog remov...,Home & Kitchen > Household Cleaning > Drain Openers
890,595,"drano drano max gel clog remover, 128 fl oz",Home & Kitchen > Household Cleaning > Drain Openers
891,595,drano snake plus drain cleaning kit 16 oz,Home & Kitchen > Household Cleaning > Drain Openers
892,595,drano foam clog remover,Home & Kitchen > Household Cleaning > Drain Openers
