,category_id,description,category_path
446,595,lemi shine disposal & drain cleaner-lemon,Home & Kitchen > Household Cleaning > Drain Openers
447,595,drano clean clog remover - (32oz),Home & Kitchen > Household Cleaning > Drain Openers
448,595,rid-x septic system treatment monthly dose 9.8 oz pkg,Home & Kitchen > Household Cleaning > Drain Openers
449,595,instant power hair clog remover - 33.8 fl. oz.,Home & Kitchen > Household Cleaning > Drain Openers
450,595,signature home drain clog remover max gel - 80 fl. oz.,Home & Kitchen > Household Cleaning > Drain Openers
451,595,"roebic laboratories roebic main line cleaner, 32 fl oz",Home & Kitchen > Household Cleaning > Drain Openers
452,595,drano 42-ounce drain opener,Home & Kitchen > Household Cleaning > Drain Openers
453,595,"rid-x rid-x septi-pacs tank treatment pacs, 3 pacs",Home & Kitchen > Household Cleaning > Drain Openers
454,595,drano liquid maximum strength clog remover 12 oz,Home & Kitchen > Household Cleaning > Drain Openers
455,595,"liquid-plumr pro-strength clog remover double impact, snake + gel",Home & Kitchen > Household Cleaning > Drain Openers
456,595,drano foaming liquid,Home & Kitchen > Household Cleaning > Drain Openers
457,595,publix clog remover gel,Home & Kitchen > Household Cleaning > Drain Openers
458,595,liquid plumr liquid plumr professional strength power gel,Home & Kitchen > Household Cleaning > Drain Openers
459,595,"rid-x septic tank system treatment, 3 month supply liquid, 24 ounce",Home & Kitchen > Household Cleaning > Drain Openers
460,595,sani sticks lavender scent  keep your drains clear and odorfree 24 pack,Home & Kitchen > Household Cleaning > Drain Openers
461,595,green gobbler dissolve liquid hair  grease clog remover  drain opener  32 oz,Home & Kitchen > Household Cleaning > Drain Openers
462,595,green gobbler ultimate main drain opener + hair 76 0z.,Home & Kitchen > Household Cleaning > Drain Openers
463,595,64OZ Pequa Drain Opener,Home & Kitchen > Household Cleaning > Drain Openers
464,595,"clr power plumber pressurized drain opener plunger kit, 4.5-ounce can",Home & Kitchen > Household Cleaning > Drain Openers
465,595,roebic k-37-q-c1500-4 32-ounce septic tank treatment concentrate,Home & Kitchen > Household Cleaning > Drain Openers
466,595,2-pack: Professor Amos' Superfast Drain Cleaner - 32oz Each,Home & Kitchen > Household Cleaning > Drain Openers
467,595,"roebic k-87-q-c1500-4 sgp 32-ounce soap, grease and paper digester concentrate",Home & Kitchen > Household Cleaning > Drain Openers
468,595,"Drain and Septic Tank Bacteria - Bio Cleaner - 2-lb Jar - Safe and Natural Household Enzyme Pipe Cleaner - Works for sinks, showers, toilets and more",Home & Kitchen > Household Cleaning > Drain Openers
469,595,liquid-plumr pro stength,Home & Kitchen > Household Cleaning > Drain Openers
470,595,liquid-plumr garbage disposal cleaner and drain cleaner,Home & Kitchen > Household Cleaning > Drain Openers
471,595,"green gobbler ggdc3pacbox drain opener, hair grabber tool, 3 piece",Home & Kitchen > Household Cleaning > Drain Openers
472,595,"FASTFLOW family friendly, super concentrated eco-friendly 3-in-1 microbial drain cleaner, septic maintainer, and fruit fly eliminator. 16 uses in one bottle.",Home & Kitchen > Household Cleaning > Drain Openers
473,595,bio-clean drain septic bacteria (2 lb.),Home & Kitchen > Household Cleaning > Drain Openers
474,595,"drano max gel clog remover, 80 oz-2 pk new",Home & Kitchen > Household Cleaning > Drain Openers
475,595,johnson s c inc 00117 drano max clog remover grocery,Home & Kitchen > Household Cleaning > Drain Openers
476,595,drano dual force foamer,Home & Kitchen > Household Cleaning > Drain Openers
477,595,"GreenPig Solutions 53 Concentrated Formula Live Septic Tank Treatment, 2 Year Supply - Chemical Drain Openers",Home & Kitchen > Household Cleaning > Drain Openers
478,595,easy-to-use sink drain clog cleaner brush - flex cable,Home & Kitchen > Household Cleaning > Drain Openers
479,595,drain and septic tank,Home & Kitchen > Household Cleaning > Drain Openers
480,595,green gobbler septic treat plus  6 month supply 1 lb,Home & Kitchen > Household Cleaning > Drain Openers
481,595,drano gel clog remover - 80,Home & Kitchen > Household Cleaning > Drain Openers
482,595,biokleen bac-out drain care gel - 32 fl oz,Home & Kitchen > Household Cleaning > Drain Openers
483,595,earth friendly products natural earth enzymes drain opener - 2 lb,Home & Kitchen > Household Cleaning > Drain Openers
484,595,liquid-plumr double impact snake-gel system 18 oz,Home & Kitchen > Household Cleaning > Drain Openers
485,595,ridx septic tank system treatment 1 month supply powder 98 ounce,Home & Kitchen > Household Cleaning > Drain Openers
486,595,"liquid-plumr power gel clog remover, 80oz",Home & Kitchen > Household Cleaning > Drain Openers
487,595,"liquid-plumr pro-strength clog remover, full clog destroyer, 80 fluid ounces 10.7"" x 3.8"" x 6.9""",Home & Kitchen > Household Cleaning > Drain Openers
488,595,drano max gel clog remover 128 ounces,Home & Kitchen > Household Cleaning > Drain Openers
489,595,"liquid-plumr pro-strength clog remover, double impact 23 inch snake plus gel system, 18 fluid ounces",Home & Kitchen > Household Cleaning > Drain Openers
490,595,"drano clog remover, 32 fl oz",Home & Kitchen > Household Cleaning > Drain Openers
491,595,set of 2 plumb-away one-second drain openers,Home & Kitchen > Household Cleaning > Drain Openers
492,595,ultralite greenboxes 56-piece set,Home & Kitchen > Household Cleaning > Drain Openers
493,595,professor amos superfast drain cleaner 2-pack with fast pm powder - autoship,Home & Kitchen > Household Cleaning > Drain Openers
494,595,professor amos superfast drain cleaner with accelerated formula,Home & Kitchen > Household Cleaning > Drain Openers
495,595,dc liquid plummr profess,Home & Kitchen > Household Cleaning > Drain Openers
496,595,"refresh 32 oz. concentrate garbage disposal, drain cleaner and deodorizer",Home & Kitchen > Household Cleaning > Drain Openers
497,595,plink® 6-tab drain freshener and cleaner multi 6 ct,Home & Kitchen > Household Cleaning > Drain Openers
498,595,earthworm family safe drain cleaner-fresh citrus & sage-32 oz,Home & Kitchen > Household Cleaning > Drain Openers
499,595,"drano max gel clog remover, 80 oz-2 pack",Home & Kitchen > Household Cleaning > Drain Openers
500,595,citra drain drain maintainer-valencia orange-22 oz,Home & Kitchen > Household Cleaning > Drain Openers
501,595,drano dual force foamer clog remover,Home & Kitchen > Household Cleaning > Drain Openers
502,595,liquid-plumr full clog destroyer (32fl oz),Home & Kitchen > Household Cleaning > Drain Openers
503,595,drano dual-force foamer clog removal 17 oz btl,Home & Kitchen > Household Cleaning > Drain Openers
504,595,liquid-plumr urgent clear gel clog remover 17 oz btl,Home & Kitchen > Household Cleaning > Drain Openers
505,595,liquid plummer professional strength - 80 fl. oz.,Home & Kitchen > Household Cleaning > Drain Openers
506,595,"liquid-plumr liquid-plumr pro-strength clog remover double impact, sna...",Home & Kitchen > Household Cleaning > Drain Openers
507,595,"drano drano professional strength crystals clog remover, 18 oz",Home & Kitchen > Household Cleaning > Drain Openers
508,595,clean earth earthworm family safe drain cleaner - 32 fl oz jug,Home & Kitchen > Household Cleaning > Drain Openers
509,595,"liquid plumr professional strength, 2-pack, 80-ounce",Home & Kitchen > Household Cleaning > Drain Openers
510,595,liquid-plumr clog remover - 1 qt,Home & Kitchen > Household Cleaning > Drain Openers
511,595,cobra products zip-it drain opener,Home & Kitchen > Household Cleaning > Drain Openers
512,595,drano max gel clog remover - 32 fl oz bottle,Home & Kitchen > Household Cleaning > Drain Openers
513,595,liquid plumr clog remover power gel professional strength,Home & Kitchen > Household Cleaning > Drain Openers
514,595,liquid plumr hair clog remover,Home & Kitchen > Household Cleaning > Drain Openers
515,595,drano clog remover - 32.00 fl oz,Home & Kitchen > Household Cleaning > Drain Openers
516,595,drano max gel professional strength -80 ounces,Home & Kitchen > Household Cleaning > Drain Openers
517,595,"bio kleen, bac-out drain care, gel coating action, 32 fl oz (946 ml)",Home & Kitchen > Household Cleaning > Drain Openers
518,595,"citra-solv, homesolv, citradrain, natural enzyme drain cleaner, valencia orange, 22 fl oz (650 ml)",Home & Kitchen > Household Cleaning > Drain Openers
519,595,liquid-plumr pro-strength clog rem...,Home & Kitchen > Household Cleaning > Drain Openers
520,595,"liquid-plumr clog remover gel, professional strength - 80 fl oz jug",Home & Kitchen > Household Cleaning > Drain Openers
521,595,liquid-plumr pro-strength full clog destroyer,Home & Kitchen > Household Cleaning > Drain Openers
522,595,"earth friendly products natural earth enzymes drain opener, 32 oz",Home & Kitchen > Household Cleaning > Drain Openers
523,595,boxed natural earth enzymes drain opener,Home & Kitchen > Household Cleaning > Drain Openers
524,595,drano snake plus,Home & Kitchen > Household Cleaning > Drain Openers
525,595,Drano Advanced Septic Treatment - 3 pk,Home & Kitchen > Household Cleaning > Drain Openers
526,595,glisten dplm12t disposer care disposer and drain freshener-0.81 fluid ounces-lemon scented disposal odor remover,Home & Kitchen > Household Cleaning > Drain Openers
527,595,introducing drainwig! catches hair and prevents clogs in shower drain. single pack (1),Home & Kitchen > Household Cleaning > Drain Openers
528,595,green gobbler septic saver bacteria enzyme pacs - 6 month septic tank supply,Home & Kitchen > Household Cleaning > Drain Openers
529,595,thrift marketing 6lb insta-flo drain cleaner mam-is-600,Home & Kitchen > Household Cleaning > Drain Openers
530,595,"Rid-X Septic Tank System Treatment, 24 Fluid Ounce",Home & Kitchen > Household Cleaning > Drain Openers
531,595,invade bio drain 1 quart,Home & Kitchen > Household Cleaning > Drain Openers
532,595,"unique natural products marine digest it holding tank treatment, 32-ounce",Home & Kitchen > Household Cleaning > Drain Openers
533,595,green gobbler drain opening pacs  825 oz 5 pack,Home & Kitchen > Household Cleaning > Drain Openers
534,595,bio-rem e-d sewer & drain line treatment bacteria bio-clean(1 lb. container) bio rem e-d bioremed,Home & Kitchen > Household Cleaning > Drain Openers
535,595,Green Gobbler SEPTIC SAVER Enzyme Pacs - 6 Month Supply,Home & Kitchen > Household Cleaning > Drain Openers
536,595,"glisten disposer care dplm12t disposer and drain freshener, 0.81-ounce",Home & Kitchen > Household Cleaning > Drain Openers
537,595,liquidplumr prostrength clog remover full clog destroyer 32 fluid ounces liquid plumr,Home & Kitchen > Household Cleaning > Drain Openers
538,595,drano pipe and septic 32-ounce,Home & Kitchen > Household Cleaning > Drain Openers
539,595,"earth friendly products earth enzymes, drain opener, 32-ounces (pack of 3)",Home & Kitchen > Household Cleaning > Drain Openers
540,595,Best Drain Cleaner & Septic Tank Treatment - 2-in-1 Professional Cleaning Supplies Formula - 1 Year Supply - Natural Enzyme Cleaner Prevents Backups G,Home & Kitchen > Household Cleaning > Drain Openers
541,595,950ml bottle of concentrated sulfuric acid drain cleaning cleaner biodiesel battery acid,Home & Kitchen > Household Cleaning > Drain Openers
542,595,"Happy Campers Organic RV Holding Tank Treatment - large tub, 64 treatments for RV, Marine, Camping, Portable Toilets",Home & Kitchen > Household Cleaning > Drain Openers
543,595,Bio-Clean Drain Septic Bacteria (25lb Bulk),Home & Kitchen > Household Cleaning > Drain Openers
544,595,Drain Weasel Plus Dwpsk2 Drain Weasel Plus Hair Clog Wand 2 Count Starter Kit,Home & Kitchen > Household Cleaning > Drain Openers
545,595,drano max gel drain cleaner 42oz,Home & Kitchen > Household Cleaning > Drain Openers
546,595,drain pipe opener 80 oz - up & up™,Home & Kitchen > Household Cleaning > Drain Openers
547,595,liquid-plumber pro-strength clog remover hair clog eliminator - 16 oz,Home & Kitchen > Household Cleaning > Drain Openers
548,595,drano® snake plus drain cleaning kit,Home & Kitchen > Household Cleaning > Drain Openers
549,595,"drano max build-up remover, 64 fl oz",Home & Kitchen > Household Cleaning > Drain Openers
550,595,instant power hair clog remover,Home & Kitchen > Household Cleaning > Drain Openers
551,595,drano max gel clog remover 32 ounces.,Home & Kitchen > Household Cleaning > Drain Openers
552,595,"instant power hair clog remover, 33.8 fl oz",Home & Kitchen > Household Cleaning > Drain Openers
553,595,ridx septic tank system treatment 6dose liquid 48 ounce,Home & Kitchen > Household Cleaning > Drain Openers
554,595,roebic main line bacteria enzyme drain cleaner,Home & Kitchen > Household Cleaning > Drain Openers
555,595,green gobbler set/6 drain opener packets & 16oz refresh drain,Home & Kitchen > Household Cleaning > Drain Openers
556,595,professor amos superfast max drain cleaner 12 oz. with fast pm powder,Home & Kitchen > Household Cleaning > Drain Openers
557,595,professor amos 48 oz. superfast drain cleaner 2-pack auto-ship,Home & Kitchen > Household Cleaning > Drain Openers
558,595,fast pm drain maintenance powder,Home & Kitchen > Household Cleaning > Drain Openers
559,595,67.6 oz. septic shock,Home & Kitchen > Household Cleaning > Drain Openers
560,595,drano snake plus - 16 oz,Home & Kitchen > Household Cleaning > Drain Openers
561,595,septic tank treatment - 1-year supply,Home & Kitchen > Household Cleaning > Drain Openers
562,595,drano max gel clog remover - 128 oz,Home & Kitchen > Household Cleaning > Drain Openers
563,595,drano clean clog remover - (32fl oz),Home & Kitchen > Household Cleaning > Drain Openers
564,595,liquid-plumr® gel clog remover - 2/80 oz. jugs,Home & Kitchen > Household Cleaning > Drain Openers
565,595,liquid-plumr power,Home & Kitchen > Household Cleaning > Drain Openers
566,595,"drano drano max gel clog remover, 32 oz. bottle (pack of 2)",Home & Kitchen > Household Cleaning > Drain Openers
567,595,"drano drano max gel clog remover, 80 fl oz",Home & Kitchen > Household Cleaning > Drain Openers
568,595,"liquid-plumr liquid-plumr pro-strength clog remover, hair clog elimina...",Home & Kitchen > Household Cleaning > Drain Openers
569,595,"drano drano max gel clog remover, 42 fl oz",Home & Kitchen > Household Cleaning > Drain Openers
570,595,drano drano dual-force foamer clog remover 17 fl. oz. bottle,Home & Kitchen > Household Cleaning > Drain Openers
571,595,drano snake plus diy,Home & Kitchen > Household Cleaning > Drain Openers
572,595,"rid-x septic system treatment, 24oz",Home & Kitchen > Household Cleaning > Drain Openers
573,595,"drano max gel clog remover, unscented - 32 fl oz bottle",Home & Kitchen > Household Cleaning > Drain Openers
574,595,liquid-plumr clog remover power gel,Home & Kitchen > Household Cleaning > Drain Openers
575,595,"green gobbler ggdc3semr drain opener, 24.8 oz",Home & Kitchen > Household Cleaning > Drain Openers
576,595,clorox liquid-plumr penetrex gel clog remover,Home & Kitchen > Household Cleaning > Drain Openers
577,595,"drano dual force clog remover, foamer - 17 fl oz",Home & Kitchen > Household Cleaning > Drain Openers
578,595,clorox liquid-plumr penetrex gel clog remover - 17 oz.,Home & Kitchen > Household Cleaning > Drain Openers
579,595,"zep commercial zuttu20 toilet care tune up, 20 oz",Home & Kitchen > Household Cleaning > Drain Openers
580,595,"liquid-plumr pro-strength clog remover, urgent clear - 17 fl oz bottle",Home & Kitchen > Household Cleaning > Drain Openers
581,595,"Earthworm® Fragrance Free Drain Cleaner - Drain Opener - Natural Enzymes, Environmentally Responsible, Safer for",Home & Kitchen > Household Cleaning > Drain Openers
582,595,2 lb sodium hydroxide food grade red hot devil lye caustic soda beads,Home & Kitchen > Household Cleaning > Drain Openers
583,595,non-acid odorless drain cleaner 2 lb 25-2200 thrift marketing 25-2200,Home & Kitchen > Household Cleaning > Drain Openers
584,595,Legacy Snake Drain Cleaner Clog Remover Opener Tool with Storage Unit,Home & Kitchen > Household Cleaning > Drain Openers
585,595,"unique natural products rv digest-it holding tank cleaner, 128-ounce",Home & Kitchen > Household Cleaning > Drain Openers
586,595,whink 06217 hair clog,Home & Kitchen > Household Cleaning > Drain Openers
587,595,sani sticks lemon scent  keep your drains clear and odorfree 24 pack,Home & Kitchen > Household Cleaning > Drain Openers
588,595,drano® max gel clog remover - 32 oz,Home & Kitchen > Household Cleaning > Drain Openers
589,595,sani sticks unscented 48pk  superior drain odor solution,Home & Kitchen > Household Cleaning > Drain Openers
590,595,"GrabEASY PF0401 Flexible, Reusuable 4 Claw Grabber, Clog Remover & Jewelry Retriever",Home & Kitchen > Household Cleaning > Drain Openers
591,595,simpleair sacf-tabs ac condensate pump and drain line treatment,Home & Kitchen > Household Cleaning > Drain Openers
592,595,rooto 1030 corp. 1 lb,Home & Kitchen > Household Cleaning > Drain Openers
593,595,sani sticks the superior odor killer and drain cleaner solution unscented  48 pack,Home & Kitchen > Household Cleaning > Drain Openers
594,595,rid-x septic tank system,Home & Kitchen > Household Cleaning > Drain Openers
595,595,oatey 20410 glug drain opener,Home & Kitchen > Household Cleaning > Drain Openers
596,595,"scotch corporation 1510 instant power commercial drain cleaner, 1-gallon",Home & Kitchen > Household Cleaning > Drain Openers
597,595,"Evelots Green Unclog Ease - Powerful Enzyme Drain Pipe Cleaners, 12 per pack",Home & Kitchen > Household Cleaning > Drain Openers
598,595,"pure lye drain opener, 1 lb (2) with a pair safety gloves",Home & Kitchen > Household Cleaning > Drain Openers
599,595,Drain Cleaner & Septic Tank Treatment - 1 Year Supply - Safe Natural Enzymes Clean Pipes - Stop Sewer Smell & Toilet Overflow - For Bathtub Shower & Kitchen PlumbClear,Home & Kitchen > Household Cleaning > Drain Openers
600,595,liquid plumr pro-strength penetrex clog remover - 17 oz - 2 pk,Home & Kitchen > Household Cleaning > Drain Openers
601,595,"liquid-plumr clog remover, professional strength 17 fl oz (1 pt 1 oz) 503 ml",Home & Kitchen > Household Cleaning > Drain Openers
602,595,Perfect Life Ideas Drain Buster Drain Opener,Home & Kitchen > Household Cleaning > Drain Openers
603,595,"drano max gel clog remover, 80 fl oz, (pack of 2)",Home & Kitchen > Household Cleaning > Drain Openers
604,595,liquid-plumber pro-strength clog remover full clog destroyer - 32 oz,Home & Kitchen > Household Cleaning > Drain Openers
605,595,liquid-plumber pro-strength clog remover full clog destroyer - 80 oz,Home & Kitchen > Household Cleaning > Drain Openers
606,595,liquid-plumr full clog destroyer 128oz,Home & Kitchen > Household Cleaning > Drain Openers
607,595,"clr power plumber pressurized drain opener, 4.5 oz",Home & Kitchen > Household Cleaning > Drain Openers
608,595,"clorox liquid-plumr foaming pipe snake clog remover, 1.06 pt",Home & Kitchen > Household Cleaning > Drain Openers
609,595,"drano max professional strength clog remover gel, 32oz",Home & Kitchen > Household Cleaning > Drain Openers
610,595,"drano max professional strength clog remover gel, 32 fl oz",Home & Kitchen > Household Cleaning > Drain Openers
611,595,"rid-x powder 4-month septic tank system treatment, 39.2 oz.",Home & Kitchen > Household Cleaning > Drain Openers
612,595,"drano crystals? 18 oz 6.2"" x 2.6"" x 2.6""",Home & Kitchen > Household Cleaning > Drain Openers
613,595,instant power heavy duty drain opener,Home & Kitchen > Household Cleaning > Drain Openers
614,595,green gobbler supersized set of (9) pacs drain cleaner,Home & Kitchen > Household Cleaning > Drain Openers
615,595,green gobbler supersized set of (9) pacs drain cleaner w/3 dra,Home & Kitchen > Household Cleaning > Drain Openers
616,595,green gobbler set of 6 pre-measured drain opener packets,Home & Kitchen > Household Cleaning > Drain Openers
617,595,professor amos superfast drain cleaner 2-pack w/fast pm powder,Home & Kitchen > Household Cleaning > Drain Openers
618,595,cloroxreg liquidplumrreg heavy duty clog remover 80 oz,Home & Kitchen > Household Cleaning > Drain Openers
619,595,drano gel clog remover - 80 oz,Home & Kitchen > Household Cleaning > Drain Openers
620,595,peapod drain opener gel professional strength 80 oz btl,Home & Kitchen > Household Cleaning > Drain Openers
621,595,liquid-plumr full clog destroyer clog remover 32 oz btl,Home & Kitchen > Household Cleaning > Drain Openers
622,595,drano commercial line max gel clog remover 42 fl. oz. jug,Home & Kitchen > Household Cleaning > Drain Openers
623,595,"drano drano dual-force foamer clog remover, 17 fl oz",Home & Kitchen > Household Cleaning > Drain Openers
624,595,"drano clog remover, pro strength 32 fl oz (1 qt) 946 ml",Home & Kitchen > Household Cleaning > Drain Openers
625,595,liquid plumber gel clog remover - 32 fl oz bottle,Home & Kitchen > Household Cleaning > Drain Openers
626,595,liquid plumr foaming pipe snake clog remover - 17 oz bottle,Home & Kitchen > Household Cleaning > Drain Openers
627,595,"liquid-plumr clog remover gel, professional strength - 80 oz jug",Home & Kitchen > Household Cleaning > Drain Openers
628,595,zep 10 minute hair clog remover - 64 fl oz bottle,Home & Kitchen > Household Cleaning > Drain Openers
629,595,johnson s c inc 117 drano max clog remover_speedy deliv,Home & Kitchen > Household Cleaning > Drain Openers
630,595,johnson 00117 drano max gel clog remover unscented 1 qt. bottle 80 oz,Home & Kitchen > Household Cleaning > Drain Openers
631,595,"clorox liquid plumr drain opener, 32 oz",Home & Kitchen > Household Cleaning > Drain Openers
632,595,drano max - 32.00 fl oz,Home & Kitchen > Household Cleaning > Drain Openers
633,595,"liquid-plumr pro-strength double impact, snake + gel system",Home & Kitchen > Household Cleaning > Drain Openers
634,595,liquid plumr liquid drain cleaner,Home & Kitchen > Household Cleaning > Drain Openers
635,595,"clorox company, the 00228 ""liquid-plumr"" professional strength drain opener 80 oz",Home & Kitchen > Household Cleaning > Drain Openers
636,595,liquid-plumr clog remover - power gel professional strength - 80.00 fl oz,Home & Kitchen > Household Cleaning > Drain Openers
637,595,rid-x septic system treatmen - 10.30 fl oz,Home & Kitchen > Household Cleaning > Drain Openers
638,595,1L Grease Drain Opener,Home & Kitchen > Household Cleaning > Drain Openers
639,595,"roebic laboratories, inc. k-87-4 32-ounce soap digester",Home & Kitchen > Household Cleaning > Drain Openers
640,595,iit 49720 sink and drain cleaner,Home & Kitchen > Household Cleaning > Drain Openers
641,595,pure lye drain opener 1 lb. (2 pack) (2),Home & Kitchen > Household Cleaning > Drain Openers
642,595,cloroxhome cleaning 00228 liquidplumr professional strength drain opener,Home & Kitchen > Household Cleaning > Drain Openers
643,595,"Sani Sticks, As Seen on TV Drain Cleaner and Deodorizer, Unscented - 24 Pack",Home & Kitchen > Household Cleaning > Drain Openers
644,595,Earthworm Commercial Drain Line and Grease Trap Cleaner Treatment - Clog Remover - Drain Opener / Deodorizer -,Home & Kitchen > Household Cleaning > Drain Openers
645,595,drainwig bathtub drain hair,Home & Kitchen > Household Cleaning > Drain Openers
646,595,"Happy Campers Organic RV Holding Tank Treatment - small jar, 18 treatments for RV, Marine, Camping, Portable Toilets",Home & Kitchen > Household Cleaning > Drain Openers
647,595,"Shefko UNBELIEVABLE Industrial Strength Drain Opener and Cleaner and Septic Cleaner 100% All Natural - The Most Powerful Natural Drain Cleaner - Continuous, Protective BioActive Solution - 32 oz fl",Home & Kitchen > Household Cleaning > Drain Openers
648,595,"drano max gel clog remover, 80 oz-2 pk",Home & Kitchen > Household Cleaning > Drain Openers
649,595,liquidplumr 00228 professional strength drain opener 80 fl oz bottle,Home & Kitchen > Household Cleaning > Drain Openers
650,595,sodium hydroxide food grade,Home & Kitchen > Household Cleaning > Drain Openers
651,595,Drain Weasel Hair Clog Tool with 2 Pack Disposable Wands Starter Kit for Drain Cleaning,Home & Kitchen > Household Cleaning > Drain Openers
652,595,"rid-x septic tank system treatment, 4-dose powder, 39.2 ounce",Home & Kitchen > Household Cleaning > Drain Openers
653,595,johnson s c inc 00117 drano max clog remover,Home & Kitchen > Household Cleaning > Drain Openers
654,595,green gobbler drain opener  3 pac  hair grabber tool,Home & Kitchen > Household Cleaning > Drain Openers
655,595,drano max gel clog remover,Home & Kitchen > Household Cleaning > Drain Openers
656,595,Bio-Tab® for Septic System (Tablet),Home & Kitchen > Household Cleaning > Drain Openers
657,595,Pequa P-10264 1-2 Gallon Heavy Duty Drain Opener - Pack of 6,Home & Kitchen > Household Cleaning > Drain Openers
658,595,"drano liquid clog remover, regular formula - 32 oz - 2 pk",Home & Kitchen > Household Cleaning > Drain Openers
659,595,"waterdrills® drain opener produces a powerful water jet that blasts through the toughest clogs! unclogs and cleans sink drains & traps, tubs, toilets",Home & Kitchen > Household Cleaning > Drain Openers
660,595,earthworm® drain cleaner - drain deodorizer - natural and safer for families - one (1) 1 gallon bottle new,Home & Kitchen > Household Cleaning > Drain Openers
661,595,invade bio drain gel- 1 qt,Home & Kitchen > Household Cleaning > Drain Openers
662,595,Rooto 1030 Corp. 1 Lb. Drain Cleaner With Lye,Home & Kitchen > Household Cleaning > Drain Openers
663,595,insta-flo odorless drain cleaner,Home & Kitchen > Household Cleaning > Drain Openers
664,595,"bio-active septic tank treatment, 1 year supply",Home & Kitchen > Household Cleaning > Drain Openers
665,595,earth friendly products natural earth enzymes drain opener - 32 oz,Home & Kitchen > Household Cleaning > Drain Openers
