,category_id,description,category_path
215,595,johnson s c inc 00117 drano max clog remover  pack of 2,Home & Kitchen > Household Cleaning > Drain Openers
216,595,"Green Gobbler HEAVY DUTY Oven, Grill, BBQ & Range Hood Cleaner - 32 oz with",Home & Kitchen > Household Cleaning > Drain Openers
217,595,Green Gobbler Drain Opener - 3 Pac,Home & Kitchen > Household Cleaning > Drain Openers
218,595,"drain opener, 16-oz drain opener",Home & Kitchen > Household Cleaning > Drain Openers
219,595,LB Insta Drain Cleaner,Home & Kitchen > Household Cleaning > Drain Openers
220,595,tresalto drain cleaning,Home & Kitchen > Household Cleaning > Drain Openers
221,595,clr pp4-5 power plumber,Home & Kitchen > Household Cleaning > Drain Openers
222,595,Drain and Septic Tank Bacteria - Bio Cleaner - 2-lb Jar - Safe and Natural Household Enzyme Pipe Cleaner - Works,Home & Kitchen > Household Cleaning > Drain Openers
223,595,"clr pp4-5 power plumber drain opener, 4.5 oz pressurized can",Home & Kitchen > Household Cleaning > Drain Openers
224,595,crystal drano,Home & Kitchen > Household Cleaning > Drain Openers
225,595,invade bio cleaner drain gel gallon,Home & Kitchen > Household Cleaning > Drain Openers
226,595,"liquid-plumr disposal + drain foaming cleaner, foaming power packs - 5 ea",Home & Kitchen > Household Cleaning > Drain Openers
227,595,liquid-plumr pro-strength clog remover full clog destroyer - 80 oz,Home & Kitchen > Household Cleaning > Drain Openers
228,595,drano max gel value pack - 160 fl oz,Home & Kitchen > Household Cleaning > Drain Openers
229,595,ridx septic tank system treatment 3dose powder 29.4 ounce,Home & Kitchen > Household Cleaning > Drain Openers
230,595,"drano max gel clog remover, 80 fl oz",Home & Kitchen > Household Cleaning > Drain Openers
231,595,superior tool 03819 drain stik drain auger opener-drain stik drain opener,Home & Kitchen > Household Cleaning > Drain Openers
232,595,prostrength liquidplumr full clog destroyer 80 fl oz,Home & Kitchen > Household Cleaning > Drain Openers
233,595,drano max gel clog remover 32 fl oz,Home & Kitchen > Household Cleaning > Drain Openers
234,595,green gobbler 8 ultra pacs cleaning spray conc. kit,Home & Kitchen > Household Cleaning > Drain Openers
235,595,professor amos 48 oz. superfast drain cleaner 2-pack,Home & Kitchen > Household Cleaning > Drain Openers
236,595,professor amos superfast max drain-opener and fast pm drain maintenance powder,Home & Kitchen > Household Cleaning > Drain Openers
237,595,10-minute hair clog remover 32-oz drain cleaner,Home & Kitchen > Household Cleaning > Drain Openers
238,595,"liquid plumr pro-strength penetrex clog remover, 17 oz-2 pack",Home & Kitchen > Household Cleaning > Drain Openers
239,595,drano snake plus tool + gel system 1.0 ea 1.30 lbs,Home & Kitchen > Household Cleaning > Drain Openers
240,595,drano max gel professional maximum strength - (32oz),Home & Kitchen > Household Cleaning > Drain Openers
241,595,stop & shop drain opener gel professional strength 80 oz btl,Home & Kitchen > Household Cleaning > Drain Openers
242,595,"liquid-plumr® pro-strength clog remover, full clog destroyer, 80 fl oz",Home & Kitchen > Household Cleaning > Drain Openers
243,595,as seen on tv wonder snake drain hair remover,Home & Kitchen > Household Cleaning > Drain Openers
244,595,"drano drano max gel clog remover, 80 fl oz (pack of 2)",Home & Kitchen > Household Cleaning > Drain Openers
245,595,"drano drano max gel clog remover, 32 fl oz",Home & Kitchen > Household Cleaning > Drain Openers
246,595,drano dual force foam clog remover 17 oz,Home & Kitchen > Household Cleaning > Drain Openers
247,595,"liquid plumr clog remover, gel - 32 fl oz bottle",Home & Kitchen > Household Cleaning > Drain Openers
248,595,liquid-plumr penetrex gel liquid drain cleaner - 17 oz bottle,Home & Kitchen > Household Cleaning > Drain Openers
249,595,liquid plumr penetrex gel drain opener - 17 oz,Home & Kitchen > Household Cleaning > Drain Openers
250,595,clorox pro-strength liquid-plumr full clog destroyer - 32 fl oz jug,Home & Kitchen > Household Cleaning > Drain Openers
251,595,drainbo drain cleaner,Home & Kitchen > Household Cleaning > Drain Openers
252,595,"drano max gel, clog remover, 80-ounce",Home & Kitchen > Household Cleaning > Drain Openers
253,595,green gobbler powder plunger toilet clog remover,Home & Kitchen > Household Cleaning > Drain Openers
254,595,Instant Power 1907 Slow Drain Build Up Remover,Home & Kitchen > Household Cleaning > Drain Openers
255,595,drain gel - 1 gallon (drain fly control),Home & Kitchen > Household Cleaning > Drain Openers
256,595,"20"" drain clog remover",Home & Kitchen > Household Cleaning > Drain Openers
257,595,Roebic K-67L-Q-12 32-Ounce Liquid Drain And Trap Cleaner,Home & Kitchen > Household Cleaning > Drain Openers
258,595,"Daixers 2PCS Hair Drain Clog Remover Drain Relief Tool for Drain Cleaning,24.4-Inch",Home & Kitchen > Household Cleaning > Drain Openers
259,595,Shefko UNBELIEVABLE Industrial Strength Drain Opener and Cleaner and Septic,Home & Kitchen > Household Cleaning > Drain Openers
260,595,zep commercial 10 minute pipe & drain opener hair clog remover gel (1 gallon - 128 oz.),Home & Kitchen > Household Cleaning > Drain Openers
261,595,SC Johnson Drano Max Build-Up Remover,Home & Kitchen > Household Cleaning > Drain Openers
262,595,"drano max gel, clog remover, 80-ounce health and beauty",Home & Kitchen > Household Cleaning > Drain Openers
263,595,sani sticks the superior odor killer and drain cleaner solution original  48 pack,Home & Kitchen > Household Cleaning > Drain Openers
264,595,johnson s c inc 00117 drano max clog remover - 32 oz.(pack of 2),Home & Kitchen > Household Cleaning > Drain Openers
265,595,roebic k-570-q-4 32-ounce leach and drain field opener concentrate,Home & Kitchen > Household Cleaning > Drain Openers
266,595,summit brands dp06n-pb disposer care-four packets,Home & Kitchen > Household Cleaning > Drain Openers
267,595,flexisnake drain weasel 3pack refill disposable drain cleaning wands,Home & Kitchen > Household Cleaning > Drain Openers
268,595,drano max clog remover liquid drain cleaner pack of 3,Home & Kitchen > Household Cleaning > Drain Openers
269,595,"Liquid-Plumr Pro Stength Full Clog Destroyer, 32 Fl Oz (2 Pack)",Home & Kitchen > Household Cleaning > Drain Openers
270,595,drano max gel clog remover 160 fluid ounce,Home & Kitchen > Household Cleaning > Drain Openers
271,595,cloroxhome cleaning 00228 liquidplumr professional strength drain opener new,Home & Kitchen > Household Cleaning > Drain Openers
272,595,liquid plumber double,Home & Kitchen > Household Cleaning > Drain Openers
273,595,flexisnake drain weasel,Home & Kitchen > Household Cleaning > Drain Openers
274,595,green gobbler drain opening pacs  5 pack,Home & Kitchen > Household Cleaning > Drain Openers
275,595,Amazing Liquid Fire Pipe & Drain Opener Hair Clog Remover (1 Quart -- 32 Oz.),Home & Kitchen > Household Cleaning > Drain Openers
276,595,"green gobbler ""refresh",Home & Kitchen > Household Cleaning > Drain Openers
277,595,"Happy Campers Organic RV Holding Tank Treatment - medium jar, 40 treatments for RV, Marine, Camping, Portable Toilets",Home & Kitchen > Household Cleaning > Drain Openers
278,595,"drano dual force foamer clog remover, 17 fl oz",Home & Kitchen > Household Cleaning > Drain Openers
279,595,"drano max gel, 42 oz",Home & Kitchen > Household Cleaning > Drain Openers
280,595,"liquid-plumr professional strength gel, clog remover - 1 qt",Home & Kitchen > Household Cleaning > Drain Openers
281,595,ridx septic tank system treatment 3 month supply dual action septipacs 3 count,Home & Kitchen > Household Cleaning > Drain Openers
282,595,"great value professional strength drain clog remover gel, 80 fl oz",Home & Kitchen > Household Cleaning > Drain Openers
283,595,drano dual force foamer 17 ounces,Home & Kitchen > Household Cleaning > Drain Openers
284,595,green gobbler set of 6 drain opener packets w/ drain stick,Home & Kitchen > Household Cleaning > Drain Openers
285,595,dranoreg liquid drain cleaner 32 oz,Home & Kitchen > Household Cleaning > Drain Openers
286,595,67-3/5 oz. septic system treatment,Home & Kitchen > Household Cleaning > Drain Openers
287,595,128-oz 10 minute hair clog remover,Home & Kitchen > Household Cleaning > Drain Openers
288,595,42-fl oz drain cleaner,Home & Kitchen > Household Cleaning > Drain Openers
289,595,liquid plumr pro-strength urgent clear clog remover - 17 oz,Home & Kitchen > Household Cleaning > Drain Openers
290,595,clean earth brands earthworm® family safe drain cleaner -- 32 fl oz,Home & Kitchen > Household Cleaning > Drain Openers
291,595,liquid-plumr thick liquid drain opener - (32oz),Home & Kitchen > Household Cleaning > Drain Openers
292,595,liquid-plumr thick liquid drain opener - (32fl oz),Home & Kitchen > Household Cleaning > Drain Openers
293,595,"liquid-plumr liquid-plumr professional strength drain opener, 80 fl oz",Home & Kitchen > Household Cleaning > Drain Openers
294,595,"drano glade - drk cb001176 - max gel clog remover, 32oz bottle",Home & Kitchen > Household Cleaning > Drain Openers
295,595,"drano drano snake plus, 16 oz",Home & Kitchen > Household Cleaning > Drain Openers
296,595,"drano max gel clog remover, pro strength - 80 fl oz jar",Home & Kitchen > Household Cleaning > Drain Openers
297,595,ace pro drain cleaner - 32 oz bottle,Home & Kitchen > Household Cleaning > Drain Openers
298,595,liquid plumber or drano for full clog,Home & Kitchen > Household Cleaning > Drain Openers
299,595,liquid plumr foaming pipe snake professional strength,Home & Kitchen > Household Cleaning > Drain Openers
300,595,drano drain unclogger - rapid acting (small to medium size),Home & Kitchen > Household Cleaning > Drain Openers
301,595,liquid-plumr pro-strength full clog - 80.00 fl oz,Home & Kitchen > Household Cleaning > Drain Openers
302,595,clorox professional 00243: liquid plumr heavy-duty clog remov,Home & Kitchen > Household Cleaning > Drain Openers
303,595,"drano max gel clog remover, pro strength, value size",Home & Kitchen > Household Cleaning > Drain Openers
304,595,dual force foamer clog remover,Home & Kitchen > Household Cleaning > Drain Openers
305,595,drano max clog remover - 80.00 fl oz,Home & Kitchen > Household Cleaning > Drain Openers
306,595,"drain opener, professional formula, 32 fl oz (946 ml)",Home & Kitchen > Household Cleaning > Drain Openers
307,595,"pure lye drain opener, 1 lb 2-pack new",Home & Kitchen > Household Cleaning > Drain Openers
308,595,thrift t-200 drain cleaner,Home & Kitchen > Household Cleaning > Drain Openers
309,595,Green Gobbler ULTIMATE VINEGAR Home & Garden - 30% Vinegar Concentrate (Hundreds,Home & Kitchen > Household Cleaning > Drain Openers
310,595,pro-lab inc one flush septic and leachfield treatment concentrate on102,Home & Kitchen > Household Cleaning > Drain Openers
311,595,ccls septic bacteria additive/single gallon,Home & Kitchen > Household Cleaning > Drain Openers
312,595,drano 00117-2pk max clog,Home & Kitchen > Household Cleaning > Drain Openers
313,595,liquid-plumr pro-strength,Home & Kitchen > Household Cleaning > Drain Openers
314,595,"sani sticks, the superior odor killer and drain cleaner solution, lemon scent - 24 pack",Home & Kitchen > Household Cleaning > Drain Openers
315,595,"drano liquid clog remover, regular formula-32 oz. new",Home & Kitchen > Household Cleaning > Drain Openers
316,595,earthwormâ® drain cleaner - drain deodorizer - natural and family-safe - 32 fl oz,Home & Kitchen > Household Cleaning > Drain Openers
317,595,invade bio drain 1 gallon,Home & Kitchen > Household Cleaning > Drain Openers
318,595,"drano liquid clog remover, regular formula-32 oz.",Home & Kitchen > Household Cleaning > Drain Openers
319,595,zep commercial citrus garbage disposal drain cleaner 32 oz.,Home & Kitchen > Household Cleaning > Drain Openers
320,595,Septic System Treatment Conc,Home & Kitchen > Household Cleaning > Drain Openers
321,595,"Roebic Laboratories, Inc. K-37-4-Q Septic Tank Treatment, 32-Ounce",Home & Kitchen > Household Cleaning > Drain Openers
322,595,"comstar 30-620 ""pure lye"" crystal drain opener, 2lb",Home & Kitchen > Household Cleaning > Drain Openers
323,595,2L Grease Drain Opener,Home & Kitchen > Household Cleaning > Drain Openers
324,595,earthwormdrain cleaner - drain deodorizer - natural and family-safe - 32 fl oz new,Home & Kitchen > Household Cleaning > Drain Openers
325,595,hair drain clog remover,Home & Kitchen > Household Cleaning > Drain Openers
326,595,"liquid-plumr clog remover, professional strength, 17 oz",Home & Kitchen > Household Cleaning > Drain Openers
327,595,Instant Power 1868 Septic Shock,Home & Kitchen > Household Cleaning > Drain Openers
328,595,"clorox liquid plumr - heavy-duty clog remover, gel, 80oz bottle 35286ea (dmi ea",Home & Kitchen > Household Cleaning > Drain Openers
329,595,SC Johnson 70240 Drano Max Build-Up Remover (4 Pack),Home & Kitchen > Household Cleaning > Drain Openers
330,595,g t water prod 501 drain king waterpressure drain opener12 drain opener,Home & Kitchen > Household Cleaning > Drain Openers
331,595,drano max gel 128 fl oz,Home & Kitchen > Household Cleaning > Drain Openers
332,595,"liquid-plumr pro-strength clog remover, full cl...",Home & Kitchen > Household Cleaning > Drain Openers
333,595,liquid-plumr pro-strength clog remover urgent clear 17 oz,Home & Kitchen > Household Cleaning > Drain Openers
334,595,cobra drain opener,Home & Kitchen > Household Cleaning > Drain Openers
335,595,"drano snake plus drain cleaning tool + gel kit, 1ct",Home & Kitchen > Household Cleaning > Drain Openers
336,595,drano foam clog remover 17.0 fl oz,Home & Kitchen > Household Cleaning > Drain Openers
337,595,green gobbler supersized 10 drain opener packet s w/ drain stic,Home & Kitchen > Household Cleaning > Drain Openers
338,595,32 fl. oz. superfast drain cleaner 2-pack,Home & Kitchen > Household Cleaning > Drain Openers
339,595,67.6 oz. hair and grease drain opener,Home & Kitchen > Household Cleaning > Drain Openers
340,595,42-oz gel clog remover diy,Home & Kitchen > Household Cleaning > Drain Openers
341,595,root kill 32-oz drain cleaner,Home & Kitchen > Household Cleaning > Drain Openers
342,595,clean shot drain opener,Home & Kitchen > Household Cleaning > Drain Openers
343,595,"mister plumber drain opener, 32 oz.",Home & Kitchen > Household Cleaning > Drain Openers
344,595,drano dual-force foamer clog remover 17 fl. oz. bottle,Home & Kitchen > Household Cleaning > Drain Openers
345,595,drano max gel clog remover 80 fl. oz. jug,Home & Kitchen > Household Cleaning > Drain Openers
346,595,drano max professional strength gel 64 oz,Home & Kitchen > Household Cleaning > Drain Openers
347,595,nice! gel drain opener,Home & Kitchen > Household Cleaning > Drain Openers
348,595,liquid-plumr pro-strength hair clog eliminator - 16 oz bottle,Home & Kitchen > Household Cleaning > Drain Openers
349,595,clorox liquid-plumr pro-strength hair clog eliminator,Home & Kitchen > Household Cleaning > Drain Openers
350,595,"drano ultra, 2-80 oz. bottles - sale price limit 5",Home & Kitchen > Household Cleaning > Drain Openers
351,595,1 mark consumer plumb-away 6 oz. drain opener refill (set of 12),Home & Kitchen > Household Cleaning > Drain Openers
352,595,liquid plumr clog destroyer 2/128 ounce - sale price limit 5,Home & Kitchen > Household Cleaning > Drain Openers
353,595,liquid-plumr clog remover power gel - 1 qt,Home & Kitchen > Household Cleaning > Drain Openers
354,595,drano max gel,Home & Kitchen > Household Cleaning > Drain Openers
355,595,liquid plumr pro-strength liquid plumr penetrex gel,Home & Kitchen > Household Cleaning > Drain Openers
356,595,liquid-plumr foaming pipe snake liquid drain cleaner,Home & Kitchen > Household Cleaning > Drain Openers
357,595,"unique natural products super digest-it safe drain opener, 128-ounce",Home & Kitchen > Household Cleaning > Drain Openers
358,595,green gobbler drain opening pac's - 5 pack health and beauty,Home & Kitchen > Household Cleaning > Drain Openers
359,595,drano kitchen crystals drain opener - 18 oz - 2 pk,Home & Kitchen > Household Cleaning > Drain Openers
360,595,roebic k-67bag-4-16oz 16-ounce granular drain and trap cleaner,Home & Kitchen > Household Cleaning > Drain Openers
361,595,"liquid-plumr gel clog remover, professional strength 2.5 qts (80 fl oz) 2.36 lt",Home & Kitchen > Household Cleaning > Drain Openers
362,595,norweco fsb50005 septic tank treatment,Home & Kitchen > Household Cleaning > Drain Openers
363,595,drain clog remover,Home & Kitchen > Household Cleaning > Drain Openers
364,595,green gobbler ultimate,Home & Kitchen > Household Cleaning > Drain Openers
365,595,nu line nl1 8-oz drain cleaner,Home & Kitchen > Household Cleaning > Drain Openers
366,595,odorezetm eco drain odor control spray: makes 64 gallons,Home & Kitchen > Household Cleaning > Drain Openers
367,595,"rid-x septic tank system treatment, 3-dose powder, 29.4 ounce",Home & Kitchen > Household Cleaning > Drain Openers
368,595,drano max clog remover liquid drain cleaner pack of 3 was removed from shopping cart,Home & Kitchen > Household Cleaning > Drain Openers
369,595,"pure lye drain opener, 1 lb (3) with a pair of safety loves",Home & Kitchen > Household Cleaning > Drain Openers
370,595,2 lb potassium hydroxide food grade red hot devil caustic potash flakes,Home & Kitchen > Household Cleaning > Drain Openers
371,595,"Sani Sticks, As Seen on TV Drain Cleaner and Deodorizer, Lemon Scent - 48 Pack",Home & Kitchen > Household Cleaning > Drain Openers
372,595,invade bio zap odor eliminator -qt,Home & Kitchen > Household Cleaning > Drain Openers
373,595,"Rid-X Septic Tank System Treatment, 29.4 Ounce",Home & Kitchen > Household Cleaning > Drain Openers
374,595,invade bio cleaner drain,Home & Kitchen > Household Cleaning > Drain Openers
375,595,"roebic laboratories, inc. k-97 main line cleaner, 32-ounce",Home & Kitchen > Household Cleaning > Drain Openers
376,595,"Sani Sticks, As Seen on TV Drain Cleaner and Deodorizer, Orange Scent, 48 Pack",Home & Kitchen > Household Cleaning > Drain Openers
377,595,Professor Amos' Fast Preventative Maintenance,Home & Kitchen > Household Cleaning > Drain Openers
378,595,"pure lye drain opener, 1 lb (2) with a pair of safety gloves",Home & Kitchen > Household Cleaning > Drain Openers
379,595,"DF 5000 Drain Gel Drain Treatment 1 Quart Drummond Enviropro DF5000 - ""Great to kill them pesty ole' sewer flies""",Home & Kitchen > Household Cleaning > Drain Openers
380,595,"liquid-plumr hair clog eliminator, 16 fluid ounce health and beauty",Home & Kitchen > Household Cleaning > Drain Openers
381,595,invade bio drain gelqt,Home & Kitchen > Household Cleaning > Drain Openers
382,595,"Roebic Laboratories, Inc. K-57-4 Septic System Treatment, 32-Ounce",Home & Kitchen > Household Cleaning > Drain Openers
383,595,flo-kem 5195 flo-zyme,Home & Kitchen > Household Cleaning > Drain Openers
384,595,GEL HAIR CLOG ELIMN 16OZ by LIQUID PLUMR MfrPartNo 31019,Home & Kitchen > Household Cleaning > Drain Openers
385,595,happy campers organic rv holding tank treatment - small 18oz jar (18-treatments),Home & Kitchen > Household Cleaning > Drain Openers
386,595,green-world - drain snake,Home & Kitchen > Household Cleaning > Drain Openers
387,595,2 lb potassium hydroxide,Home & Kitchen > Household Cleaning > Drain Openers
388,595,glisten dplm12t disposer care disposer and drain freshener081 fluid ounceslemon scented disposal odor remover 3 pack,Home & Kitchen > Household Cleaning > Drain Openers
389,595,"drano kitchen crystals drain opener, 18 oz-2 pack - 2 pk.",Home & Kitchen > Household Cleaning > Drain Openers
390,595,drain gel - 1 gallon (drain,Home & Kitchen > Household Cleaning > Drain Openers
391,595,up & up™ drain pipe opener - 80 oz,Home & Kitchen > Household Cleaning > Drain Openers
392,595,drano 160 floz unscented drain cleaners,Home & Kitchen > Household Cleaning > Drain Openers
393,595,liquidplumr professional strength foaming pipe snake clog remover 17 oz,Home & Kitchen > Household Cleaning > Drain Openers
394,595,drano® advanced septic treatment - 3 count,Home & Kitchen > Household Cleaning > Drain Openers
395,595,"rid-x powder 1-month septic tank system treatment, 9.8 oz.",Home & Kitchen > Household Cleaning > Drain Openers
396,595,ridx septic tank system treatment 4dose powder 392 ounce,Home & Kitchen > Household Cleaning > Drain Openers
397,595,drano max gel clog remover 80 ounces,Home & Kitchen > Household Cleaning > Drain Openers
398,595,64 oz. hair clog remover gel,Home & Kitchen > Household Cleaning > Drain Openers
399,595,64 oz. septic system and cesspool treatment,Home & Kitchen > Household Cleaning > Drain Openers
400,595,"auto-clean k-30 sink, tub and shower drain cleaner",Home & Kitchen > Household Cleaning > Drain Openers
401,595,42 oz. industrial strength gel drain opener,Home & Kitchen > Household Cleaning > Drain Openers
402,595,12 oz. septi-pak concentrated septic system treatment,Home & Kitchen > Household Cleaning > Drain Openers
403,595,1 gal. 10-minute hair clog remover,Home & Kitchen > Household Cleaning > Drain Openers
404,595,foaming root killer 16-oz drain cleaner,Home & Kitchen > Household Cleaning > Drain Openers
405,595,17 fl-oz drain cleaner,Home & Kitchen > Household Cleaning > Drain Openers
406,595,drano liquid clog remover - (32fl oz),Home & Kitchen > Household Cleaning > Drain Openers
407,595,"drano liquid, 32 oz",Home & Kitchen > Household Cleaning > Drain Openers
408,595,"liquid-plumr® pro-strength clog remover 23"" snake plus gel system, 18 fl oz",Home & Kitchen > Household Cleaning > Drain Openers
409,595,liquid-plumr clorox the 00242 liquid-plumr maintenance 32oz,Home & Kitchen > Household Cleaning > Drain Openers
410,595,liquid-plumr liquid-plumr foaming pipe snake liquid drain cleaner slow...,Home & Kitchen > Household Cleaning > Drain Openers
411,595,"biokleen biokleen bac-out drain care gel, 32 fl oz",Home & Kitchen > Household Cleaning > Drain Openers
412,595,"drano ultra, 2-80 oz. bottles",Home & Kitchen > Household Cleaning > Drain Openers
413,595,liquid-plumr power gel clog remover 32 oz,Home & Kitchen > Household Cleaning > Drain Openers
414,595,ez zip drain cleaner - 2 pack,Home & Kitchen > Household Cleaning > Drain Openers
415,595,clorox liquid-plumr heavy duty clog remover gel - 32 oz bottle,Home & Kitchen > Household Cleaning > Drain Openers
416,595,zep 10 minute hair clog remover - 128 fl oz bottle,Home & Kitchen > Household Cleaning > Drain Openers
417,595,liquid plumr professional strength gel clog remover,Home & Kitchen > Household Cleaning > Drain Openers
418,595,"drano, professional strength clog remover, 32 ounce",Home & Kitchen > Household Cleaning > Drain Openers
419,595,drano drain cleaner snake pl - 1.00 ct,Home & Kitchen > Household Cleaning > Drain Openers
420,595,50 lb Red Hot Devil Lye Sodium Hydroxide Meets Food Chemical Codex High Grade Caustic Soda Beads,Home & Kitchen > Household Cleaning > Drain Openers
421,595,"liquid-plumr pro stength 2-in-1 foaming slow flow fighter, 17 fl oz (2 pack)",Home & Kitchen > Household Cleaning > Drain Openers
422,595,"happy campers organic rv holding tank treatment - large 64oz tub (64-treatments) for rv, marine, camping, portable toilets.",Home & Kitchen > Household Cleaning > Drain Openers
423,595,"liquid-plumr gel clog remover, professional strength 2.5 qts (80 fl oz) 2.37 lt",Home & Kitchen > Household Cleaning > Drain Openers
424,595,thrift t200 drain cleaner 2pound,Home & Kitchen > Household Cleaning > Drain Openers
425,595,"drano drain cleaner professional strength, 32 oz",Home & Kitchen > Household Cleaning > Drain Openers
426,595,drano drain cleaner professional strength 32 oz drano,Home & Kitchen > Household Cleaning > Drain Openers
427,595,liquid plumber foam pipe snake 17 fl oz,Home & Kitchen > Household Cleaning > Drain Openers
428,595,4 lb sodium hydroxide food grade red hot devil lye caustic soda beads,Home & Kitchen > Household Cleaning > Drain Openers
429,595,"green gobbler w/ free ""hair grabber"" - money back gaurantee 1/2 gallon jug",Home & Kitchen > Household Cleaning > Drain Openers
430,595,drain cleaner & septic tank treatment - 16 month supply - 2-in-1 professional cleaning supplies formula - natural enzyme pipe cleaner prevents backups guaranteed,Home & Kitchen > Household Cleaning > Drain Openers
431,595,drain snake cleaner and,Home & Kitchen > Household Cleaning > Drain Openers
432,595,Insta-Flo Odorless Drain Cleaner Odorless 16 Oz,Home & Kitchen > Household Cleaning > Drain Openers
433,595,"earth friendly products earth enzymes, drain opener, 32 ounce",Home & Kitchen > Household Cleaning > Drain Openers
434,595,johnson s c inc 00117 drano max clog remover - pack of 2 new,Home & Kitchen > Household Cleaning > Drain Openers
435,595,drano crystals? 18 oz,Home & Kitchen > Household Cleaning > Drain Openers
436,595,Whink 06216 Hair Clog Blaster,Home & Kitchen > Household Cleaning > Drain Openers
437,595,ridx liquid 6month septic tank system treatment 48 oz,Home & Kitchen > Household Cleaning > Drain Openers
438,595,"drano kitchen crystals clog remover, 18 oz",Home & Kitchen > Household Cleaning > Drain Openers
439,595,drano max clog remover twin pack 160 oz,Home & Kitchen > Household Cleaning > Drain Openers
440,595,professor amos superfast drain cleaner 48 oz. with fast pm powder,Home & Kitchen > Household Cleaning > Drain Openers
441,595,"liquid plumr® restroom cleaner heavy duty clog remover, 80 oz.",Home & Kitchen > Household Cleaning > Drain Openers
442,595,17 oz. urgent clear drain opener,Home & Kitchen > Household Cleaning > Drain Openers
443,595,64-fl oz drain cleaner,Home & Kitchen > Household Cleaning > Drain Openers
444,595,64-oz heavy duty drain opener,Home & Kitchen > Household Cleaning > Drain Openers
445,595,rid-x septic system treatment 1-dose powder-9.8 oz,Home & Kitchen > Household Cleaning > Drain Openers
