,category_id,description,category_path
0,727,highquality pasnew water-proof children girls sport watch n3,Jewelry & Watches > Watches > Girls
1,727,gone bananas - crazy for cherries analog girls' waterproof watch with animated cherry second hand and light green band - 3 atm water resistant by gone bananas,Jewelry & Watches > Watches > Girls
2,727,gp by brinley co kid's,Jewelry & Watches > Watches > Girls
3,727,"disney kids' doc mcstuffins, hallie, stuffy, lambie, plastic case, w001685, pink nylon strap, analog display, pink watch",Jewelry & Watches > Watches > Girls
4,727,disney princess digital lcd watch for girls blue on blue,Jewelry & Watches > Watches > Girls
5,727,red balloon kids' w000333 red balloon love owl stainless steel time teacher purple velcro strap watch,Jewelry & Watches > Watches > Girls
6,727,disney kids' mn1157 minnie mouse pink watch with rubber band,Jewelry & Watches > Watches > Girls
7,727,"LOVO Gazing Tuzki Decorative Throw Pillow Square Cushion Cover Insert 20""x20""",Jewelry & Watches > Watches > Girls
8,727,"frenzy kids' fr2006 ""lion",Jewelry & Watches > Watches > Girls
9,727,Disney Kids' W000853 Tween Mickey and Minnie Mouse Stainless Steel Watch with Red Glitter Band,Jewelry & Watches > Watches > Girls
10,727,"disney kids' minnie mouse time teacher watch w001181, with red stretch nylon band",Jewelry & Watches > Watches > Girls
11,727,my little pony girls lcd watch with molded flip top,Jewelry & Watches > Watches > Girls
12,727,Timex Kids T89022 Time Teacher Purple/Pink Flowers Resin Watch Elastic Fabric Strap,Jewelry & Watches > Watches > Girls
13,727,tiim pink faux ceramic ladies and girls watch t228-spk,Jewelry & Watches > Watches > Girls
14,727,"disney kids' mn1064 ""minnie mouse"" watch with white rubber band",Jewelry & Watches > Watches > Girls
15,727,u-beauty hello kitty girls wristwatch wrist watch blue,Jewelry & Watches > Watches > Girls
16,727,disney kids' fzn3579,Jewelry & Watches > Watches > Girls
17,727,tikkers kids purple rubber/silicone strap watch with bright funky coloured numbers tk0010,Jewelry & Watches > Watches > Girls
18,727,"disney kids' w000228 ""time teacher"" stainless steel watch with blue nylon band",Jewelry & Watches > Watches > Girls
19,727,disney kids' w001228 frozen elsa & anna analog watch with purple nylon strap,Jewelry & Watches > Watches > Girls
20,727,girls children digital lcd wrist sports alarm watch stopwatch pink,Jewelry & Watches > Watches > Girls
21,727,genuine guess watch time viva female - w0111l5,Jewelry & Watches > Watches > Girls
22,727,shower-mate water resistant,Jewelry & Watches > Watches > Girls
23,727,sprout women's st/5512mplg light green organic cotton strap blue owl dial watch,Jewelry & Watches > Watches > Girls
24,727,Kids Girls Watch - FSX-519G Water Resistant Digital Sports Wrist Watches for Ages 5-15 Girl with Back Light Alarm,Jewelry & Watches > Watches > Girls
25,727,Disney Infinity Kids' W002500 Minnie Mouse Analog Display Analog Quartz Pink Watch,Jewelry & Watches > Watches > Girls
26,727,Disney Kids' W000971 Frozen Tween Snow Queen Elsa Watch with Blue Band,Jewelry & Watches > Watches > Girls
27,727,"disney kids' w001790 ""frozen"" elsa and anna watch with pink nylon band",Jewelry & Watches > Watches > Girls
28,727,"Red Balloon Kids' W000357 ""Paris L 'Amour Tween"" Stainless Steel Watch with Silver Glitter Band",Jewelry & Watches > Watches > Girls
29,727,Hiwatch Waterproof Digital Sports Watch Kids Watches For Boys Girls Blue,Jewelry & Watches > Watches > Girls
30,727,hasbro kids' mlpkd069 my little pony digital display quartz pink watch,Jewelry & Watches > Watches > Girls
31,727,como girls children digital lcd wrist sports alarm watch stopwatch pink,Jewelry & Watches > Watches > Girls
32,727,disney kids' munkd012 molded bendable lcd watch,Jewelry & Watches > Watches > Girls
33,727,sprout unisex st1011lvivpr corn resin & purple organic cotton strap watch,Jewelry & Watches > Watches > Girls
34,727,Frenzy Kids' FR802B Peace Print Purple Analog Watch,Jewelry & Watches > Watches > Girls
35,727,19mm red smooth leather gold-tone buckle watch band cyber monday special,Jewelry & Watches > Watches > Girls
36,727,Kipling Pink Butterfly Girl's Quartz Watch,Jewelry & Watches > Watches > Girls
37,727,boxx girls easy read analogue white dial & yellow fabric strap buckle watch,Jewelry & Watches > Watches > Girls
38,727,disney kids' w002431 frozen,Jewelry & Watches > Watches > Girls
39,727,red balloon kids' w000332 red balloon love owl stainless steel time teacher printed strap watch,Jewelry & Watches > Watches > Girls
40,727,Disney Kids' FZN3568 Frozen Anna and Elsa Digital Watch with Pink Band,Jewelry & Watches > Watches > Girls
41,727,skmei fashion binary,Jewelry & Watches > Watches > Girls
42,727,disney kids' prs492 classic analog watch,Jewelry & Watches > Watches > Girls
43,727,skmei boys and girls water,Jewelry & Watches > Watches > Girls
44,727,"disney kids' pn1009 ""princess"" watch",Jewelry & Watches > Watches > Girls
45,727,disney frozen queen elsa and princess anna digital lcd wrist watch boys stocking stuffer - 2 piece,Jewelry & Watches > Watches > Girls
46,727,slap back,Jewelry & Watches > Watches > Girls
47,727,hello kitty lcd watch,Jewelry & Watches > Watches > Girls
48,727,olivia pratt kids' flower watch hot pink,Jewelry & Watches > Watches > Girls
49,727,girls' disney snow white stainless steel glitz case watch - multicolor,Jewelry & Watches > Watches > Girls
50,727,girls' red balloon plastic time teacher watch - purple,Jewelry & Watches > Watches > Girls
51,727,xhilaration® girls' strap watch - multicolor multicolor,Jewelry & Watches > Watches > Girls
52,727,tween multicolor cheeta print face flashing watch white rubber band,Jewelry & Watches > Watches > Girls
53,727,red balloon butterflies girls stainless steel watch purple strap,Jewelry & Watches > Watches > Girls
54,727,"hello kitty girl's watch, pink rubber strap",Jewelry & Watches > Watches > Girls
55,727,red balloon girls pink plastic time teacher watch printed pink and purple nylon strap,Jewelry & Watches > Watches > Girls
56,727,disney princess lcd interchangeable slider watch one color,Jewelry & Watches > Watches > Girls
57,727,my little pony lcd watch with dangling charm one color,Jewelry & Watches > Watches > Girls
58,727,storytelling embellishment (pattern band) - kelli marie hall,Jewelry & Watches > Watches > Girls
59,727,disney princess time teacher stainless steel watch - kids,Jewelry & Watches > Watches > Girls
60,727,disney minnie mouse time teacher stainless steel watch - kids purple no size,Jewelry & Watches > Watches > Girls
61,727,disney kids minnie mouse stainless steel time t eacher,Jewelry & Watches > Watches > Girls
62,727,disney kids time teacher minnie purple watch,Jewelry & Watches > Watches > Girls
63,727,"love, cross, chain or bow wraparound leather bracelet watch - assorted styles",Jewelry & Watches > Watches > Girls
64,727,ashley princess women's rhinestone watch in gift box - assorted styles,Jewelry & Watches > Watches > Girls
65,727,kid's stride rite lesley brown 1.5 w,Jewelry & Watches > Watches > Girls
66,727,miss penny's dree multi,Jewelry & Watches > Watches > Girls
67,727,carvel cake,Jewelry & Watches > Watches > Girls
68,727,disney frozen analog watch,Jewelry & Watches > Watches > Girls
69,727,minnie mouse pink analog watch,Jewelry & Watches > Watches > Girls
70,727,lthr station neck,Jewelry & Watches > Watches > Girls
71,727,forgotten princess pink & red flower leather bootie 0-6 months,Jewelry & Watches > Watches > Girls
72,727,Girl's Piper Ankle Strap Ballet 6 GOLD,Jewelry & Watches > Watches > Girls
73,727,Girls Piper Ankle Strap Ballet Shoes 7 SILVER,Jewelry & Watches > Watches > Girls
74,727,Kids Girls Watch - FSX-519G Water Resistant Digital Sports Wrist Watches for Ages 5-15 Girl with Back Light Alarm Stopwatch Date and Day (Pink),Jewelry & Watches > Watches > Girls
75,727,PASNEW 351 HighQuality Waterproof Analog-Digital Chronograph Sport Watch for boys and girls pink,Jewelry & Watches > Watches > Girls
76,727,flashing lights lcd watch,Jewelry & Watches > Watches > Girls
77,727,pink hello kitty girls ladys wrist quartz watch faux leather,Jewelry & Watches > Watches > Girls
78,727,nike kids' r0017-005 triax,Jewelry & Watches > Watches > Girls
79,727,disney sofia the first kids,Jewelry & Watches > Watches > Girls
80,727,Hiwatch Waterproof Digital Sports Watch Kids Watches For Boys Girls Grey,Jewelry & Watches > Watches > Girls
81,727,"disney fairies kid's far122 ""classic"" watch",Jewelry & Watches > Watches > Girls
82,727,ravel little gems kids ballerina watch & jewellery gift set for girls r2208,Jewelry & Watches > Watches > Girls
83,727,Sprout Women's ST1009TQIVTQ Corn Resin and Turquoise Organic Cotton Strap Watch,Jewelry & Watches > Watches > Girls
84,727,Esprit Kids' ES106414005 Little Nomad Analog Watch,Jewelry & Watches > Watches > Girls
85,727,disney kids' fzn3560 frozen anna and elsa digital-display pink watch,Jewelry & Watches > Watches > Girls
86,727,50m digital-analog water-proof sport swimming digital watch for boys girls (blue),Jewelry & Watches > Watches > Girls
87,727,Disney Princess Digital LCD Watch For Girls (assorted colors) Disney,Jewelry & Watches > Watches > Girls
88,727,disney kids' ariel time,Jewelry & Watches > Watches > Girls
89,727,mokingtop(tm) fashion children girls digital led quartz alarm date waterproof sports wrist watch,Jewelry & Watches > Watches > Girls
90,727,red balloon kids' w000343 red balloon speed racing tween stainless steel printed bezel printed strap watch,Jewelry & Watches > Watches > Girls
91,727,"disney kids' w001197 ""time teacher"" cars watch with checkerboard nylon band",Jewelry & Watches > Watches > Girls
92,727,Disney Kids' W000276 Tinker Bell Glitz Stainless Steel Time Teacher Watch,Jewelry & Watches > Watches > Girls
93,727,Girls Hello Kitty Flashing Lights LCD Watch,Jewelry & Watches > Watches > Girls
94,727,Disney Kids' PN1133 Princess Watch,Jewelry & Watches > Watches > Girls
95,727,steinhausen kids' sl1p-jup slap jumbo pink watch,Jewelry & Watches > Watches > Girls
96,727,hello kitty girls wristwatch wrist watch pink by hello kitty,Jewelry & Watches > Watches > Girls
97,727,"disney kids' w000972 ""frozen tween anna snow queen elsa"" stainless steel watch with purple band",Jewelry & Watches > Watches > Girls
98,727,boxx girls time teacher analogue blue & white dial velcro pu strap kids watch,Jewelry & Watches > Watches > Girls
99,727,Disney Kids' W002431 Frozen Anna & Elsa Time Teacher Analog Display Analog Quartz Purple Watch,Jewelry & Watches > Watches > Girls
100,727,disney princesses kid's prs492 classic analog watch,Jewelry & Watches > Watches > Girls
101,727,multifunctional led waterproof outside sports electronic digital watch for children girls boy (black with yellow),Jewelry & Watches > Watches > Girls
102,727,disney kids' pn1051 watch,Jewelry & Watches > Watches > Girls
103,727,"disney kids' sof1451 ""sofia the first"" quartz watch with pink band",Jewelry & Watches > Watches > Girls
104,727,Shopkins Lippy Lips Kid's Digital Watch with Light Up Feature KIN4033,Jewelry & Watches > Watches > Girls
105,727,Crazy Cats Mug,Jewelry & Watches > Watches > Girls
106,727,sprout men's st3004bngybn brown organic cotton strap watch,Jewelry & Watches > Watches > Girls
107,727,Disney Inside Out Girls Flashing Lights LCD Watch,Jewelry & Watches > Watches > Girls
108,727,red balloon kids' w000337 pretty girl monkey stainless steel time teacher pink velcro strap watch,Jewelry & Watches > Watches > Girls
109,727,speedo kids' silicone,Jewelry & Watches > Watches > Girls
110,727,disney kids' sof1497 sofia,Jewelry & Watches > Watches > Girls
111,727,ravel girls lilac hibiscus velcro strap watch r1507.20,Jewelry & Watches > Watches > Girls
112,727,Red Balloon Kids' W000356 Paris L 'Amour Tween Glitz Stainless Steel Printed Strap Watch,Jewelry & Watches > Watches > Girls
113,727,hasbro kids' mlpkd072 my little pony plastic watch,Jewelry & Watches > Watches > Girls
114,727,hasbro kids' mlpkd058 my little pony digital display quartz pink watch,Jewelry & Watches > Watches > Girls
115,727,frenzy kids' fr285 peace novelty analog cuff watch,Jewelry & Watches > Watches > Girls
116,727,disney beauty and the beast stained glass watch in collectible tin,Jewelry & Watches > Watches > Girls
117,727,spongebob gold over,Jewelry & Watches > Watches > Girls
118,727,"disney kids' min188 ""easy read"" watch",Jewelry & Watches > Watches > Girls
119,727,new lovely hello kitty girls ladies wrist watch quartz fashion best gift 3pcs,Jewelry & Watches > Watches > Girls
120,727,"casual waterproof children girls digital sport watches with alarm, chronograph, date (purple)",Jewelry & Watches > Watches > Girls
121,727,"Red Balloon Kids' W001889 ""Time Teacher"" Plastic Watch with Striped Nylon Band",Jewelry & Watches > Watches > Girls
122,727,funky pastel flower summer,Jewelry & Watches > Watches > Girls
123,727,disney kids' fnf005t frozen,Jewelry & Watches > Watches > Girls
124,727,"disney kids' w000969 ""frozen anna snow queen time teacher"" stainless steel watch with pink nylon band",Jewelry & Watches > Watches > Girls
125,727,me to we womens braided,Jewelry & Watches > Watches > Girls
126,727,Disney Kids' W000970 Frozen Snow Queen Watch with Pink Nylon Band,Jewelry & Watches > Watches > Girls
127,727,slide kids' sl3p-juylugr,Jewelry & Watches > Watches > Girls
128,727,disney kids' mn1139 minnie mouse white rubber strap watch,Jewelry & Watches > Watches > Girls
129,727,hello kitty girls pink hearts flashing lights lcd watch,Jewelry & Watches > Watches > Girls
130,727,disney kid's tinker bell time teacher velcro watch in pink,Jewelry & Watches > Watches > Girls
131,727,red balloon pink/purple analog watch with elastic pink strap one color,Jewelry & Watches > Watches > Girls
132,727,disney ariel time teacher stainless steel watch - kids nosize purple,Jewelry & Watches > Watches > Girls
133,727,disney princess watch - kids' ariel nylon time teacher pink no size,Jewelry & Watches > Watches > Girls
134,727,disney watch - kids' princesses rubber nosize purple,Jewelry & Watches > Watches > Girls
135,727,disney tiana kids time teacher purple nylon strap watch,Jewelry & Watches > Watches > Girls
136,727,disney cinderella womens crystal-accent bracelet watch with charms,Jewelry & Watches > Watches > Girls
137,727,disney time teacher tinker bell kids green watch,Jewelry & Watches > Watches > Girls
138,727,"disney watch, kid's glitz princess time teacher pink velcro strap 31mm w000385 no color",Jewelry & Watches > Watches > Girls
139,727,"disney watch, kid's minnie mouse time teacher pink velcro strap 31mm w000024 no color",Jewelry & Watches > Watches > Girls
140,727,free gift light blue,Jewelry & Watches > Watches > Girls
141,727,"red balloon boys' ""time teacher"" watch",Jewelry & Watches > Watches > Girls
142,727,rousseau cantoni fashion watch - assorted styles,Jewelry & Watches > Watches > Girls
143,727,me to we moccasins 9.5m/brown,Jewelry & Watches > Watches > Girls
144,727,anchors away watch,Jewelry & Watches > Watches > Girls
145,727,"hello kitty watch, cat face",Jewelry & Watches > Watches > Girls
146,727,teen girl sport multis c,Jewelry & Watches > Watches > Girls
147,727,frozen frozen anna crown - kids,Jewelry & Watches > Watches > Girls
148,727,disney princess — pink disney princess led digital watch,Jewelry & Watches > Watches > Girls
149,727,accutime watches — pink & green buckle watch,Jewelry & Watches > Watches > Girls
150,727,highquality pasnew water-proof dual time teens boys and girls sport watch-pse-331-n4,Jewelry & Watches > Watches > Girls
151,727,timex kids' t89001 analog hearts and butterflies elastic fabric strap children's watch by timex,Jewelry & Watches > Watches > Girls
152,727,frenzy kids' fr303 mood dial peace analog multi-colored rubber strap watch,Jewelry & Watches > Watches > Girls
153,727,disney frozen projection watch,Jewelry & Watches > Watches > Girls
154,727,disney kids' w000080 fairies stainless steel time teacher watch,Jewelry & Watches > Watches > Girls
155,727,disney kids' pn1173 watch with blue rubber band,Jewelry & Watches > Watches > Girls
156,727,"disney princesses kid's prs492 ""classic"" watch",Jewelry & Watches > Watches > Girls
157,727,digital girls sports watch date alarm stopwatch with luminous dial in pretty blue,Jewelry & Watches > Watches > Girls
158,727,disney kids' pn1157 watch,Jewelry & Watches > Watches > Girls
159,727,Nike Kids' R0017-005 Triax Junior Watch,Jewelry & Watches > Watches > Girls
160,727,playful ponies (pink band) - gone bananas analog girls' watch with animated flowers - time teacher,Jewelry & Watches > Watches > Girls
161,727,jovana fashion character,Jewelry & Watches > Watches > Girls
162,727,disney kids' w000033 minnie mouse stainless steel time teacher watch,Jewelry & Watches > Watches > Girls
163,727,sprout unisex st3001gygyor corn resin orange organic cotton strap watch,Jewelry & Watches > Watches > Girls
164,727,Slide Kids' SL1P-JUR Slap Jumbo Red Watch,Jewelry & Watches > Watches > Girls
165,727,"disney kids' w000053 ""multi-princess time teacher"" stainless steel watch",Jewelry & Watches > Watches > Girls
166,727,lego kids' 9005220 friends olivia accessories link watch,Jewelry & Watches > Watches > Girls
167,727,green guru climbing rope zipper pulls (colors may vary),Jewelry & Watches > Watches > Girls
168,727,casio white strawberries analog girls watch #ltr13b-7bv,Jewelry & Watches > Watches > Girls
169,727,Disney Kids' W000039 Minnie Mouse Time Teacher Stainless Steel Watch with Purple Leather Band,Jewelry & Watches > Watches > Girls
170,727,Disney Kids' The Muppets Kermit Stainless Steel Watch with Nylon Strap,Jewelry & Watches > Watches > Girls
171,727,disney kids' sof1496 watch with pink rubber band,Jewelry & Watches > Watches > Girls
172,727,wise® girls watch,Jewelry & Watches > Watches > Girls
173,727,geneva puppy theme purple,Jewelry & Watches > Watches > Girls
174,727,timex kids' t7b151 time teacher pink ballerina elastic fabric strap watch,Jewelry & Watches > Watches > Girls
175,727,shopkins girl's quartz,Jewelry & Watches > Watches > Girls
176,727,timex kids t79081 my first timex easy reader pink strap watch,Jewelry & Watches > Watches > Girls
177,727,gp by brinley co. kids princess design yellow silicone watch,Jewelry & Watches > Watches > Girls
178,727,disney kids' fzn3588 frozen anna and elsa digital display analog quartz blue watch,Jewelry & Watches > Watches > Girls
179,727,Disney Kids' W002032 Olaf Analog Display Analog Quartz Purple Watch,Jewelry & Watches > Watches > Girls
180,727,ggi international kids' sla-white slap on silicone watch,Jewelry & Watches > Watches > Girls
181,727,"Red Balloon Kids' W000175 ""Time Teacher"" Stainless Steel Watch with Pink Nylon Band",Jewelry & Watches > Watches > Girls
182,727,disney kids' fnfkd041,Jewelry & Watches > Watches > Girls
183,727,"Disney Kids' W002204 Spot,Arlo,Ramsey,Butch and Nash Analog Display Analog Quartz Blue Watch",Jewelry & Watches > Watches > Girls
184,727,paw patrol flashing lights lcd watch,Jewelry & Watches > Watches > Girls
185,727,ever after high flashing lights lcd watch,Jewelry & Watches > Watches > Girls
186,727,Disney Kids' W001928 Tinker Bell Time Teacher Watch With Printed Purple Nylon Band,Jewelry & Watches > Watches > Girls
187,727,Zeiger Kids' KW009 Analog Display for Easy Read Time Teacher Young Girls Children Teen Plastic Wrist Watch with,Jewelry & Watches > Watches > Girls
188,727,olivia pratt kids' soaring planes watch orange,Jewelry & Watches > Watches > Girls
189,727,kid's timex watch with floral strap - purple,Jewelry & Watches > Watches > Girls
190,727,girl's disney frozen flashing watch - white,Jewelry & Watches > Watches > Girls
191,727,kid's disney® ariel watch - pink,Jewelry & Watches > Watches > Girls
192,727,kid's timex® watch butterflies and hearts - purple,Jewelry & Watches > Watches > Girls
193,727,disney princess girls plastic watch pink strap,Jewelry & Watches > Watches > Girls
194,727,paw patrol boy's blue multicolored flashing lights lcd watch,Jewelry & Watches > Watches > Girls
195,727,disney frozen watch - kids' anna and elsa time teacher pink no size,Jewelry & Watches > Watches > Girls
196,727,disney princess belle time teacher stainless steel watch - kids nosize purple,Jewelry & Watches > Watches > Girls
197,727,hello kitty® kids white strap watch,Jewelry & Watches > Watches > Girls
198,727,disney cinderella kids silicone strap watch 0398076 cinderella glitz strap blue,Jewelry & Watches > Watches > Girls
199,727,"disney watch, kid's glitz princess pink glitter leather strap 31mm w000408 no color",Jewelry & Watches > Watches > Girls
200,727,disney frozen mini dial & blue strap watch fzn3559 blue,Jewelry & Watches > Watches > Girls
201,727,me to we grey crop tank,Jewelry & Watches > Watches > Girls
202,727,pura vida beanie,Jewelry & Watches > Watches > Girls
203,727,edutab — pink lcd edutab,Jewelry & Watches > Watches > Girls
204,727,disney hot pink disney princess digital watch,Jewelry & Watches > Watches > Girls
205,727,olivia pratt — navy owl watch,Jewelry & Watches > Watches > Girls
206,727,the kids watch company turquoise & pink prince & princess watch,Jewelry & Watches > Watches > Girls
207,727,WATCH GUMMY STRETCH,Jewelry & Watches > Watches > Girls
208,727,boxx girls easy read analogue white dial & white fabric strap buckle funky watch,Jewelry & Watches > Watches > Girls
209,727,disney kids' prs052b princesses giftable backpack tiara watch set,Jewelry & Watches > Watches > Girls
210,727,disney kids' pn1133,Jewelry & Watches > Watches > Girls
211,727,Hello Kitty CT.7896LS-41 Stainless Steel Red Watch,Jewelry & Watches > Watches > Girls
212,727,esprit kids' es105264003 digital-swap pink watch set,Jewelry & Watches > Watches > Girls
213,727,disney kids' sof1454,Jewelry & Watches > Watches > Girls
214,727,Disney Kids' PN1048 Time Teacher Watch with Pink Rubber Band,Jewelry & Watches > Watches > Girls
215,727,"pasnew fashion waterproof children boys girls digital sport watch with alarm, chronograph, date (pink)pse-219pink",Jewelry & Watches > Watches > Girls
216,727,"Zeiger Time Teacher Teen Young Girls Children Kids Watches, Colorful Flower Resin Band",Jewelry & Watches > Watches > Girls
217,727,Christmas Gifts Pink Girls Butterfly Animal Flower Kids Watch Stainless Steel Back,Jewelry & Watches > Watches > Girls
218,727,disney kids' pn1171 watch,Jewelry & Watches > Watches > Girls
219,727,Disney Infinity Kids' W002506 Frozen Elsa & Anna Analog Display Analog Quartz Purple Watch,Jewelry & Watches > Watches > Girls
220,727,pasnew led digital waterproof outside sports watch for children girls boys -black,Jewelry & Watches > Watches > Girls
221,727,Sannysis Boys Girls Students Digital LCD Watch Black,Jewelry & Watches > Watches > Girls
222,727,"Joe Jonas Personalized Pillowcase With Name. Pillow Case for Teen Girl, Boy, Child, Ladies, Kids. Christmas Xmas",Jewelry & Watches > Watches > Girls
223,727,disney kids' w000059 belle stainless steel time teacher watch,Jewelry & Watches > Watches > Girls
224,727,genuine mercedes benz women's crystal watch with pink leather strap,Jewelry & Watches > Watches > Girls
225,727,Frenzy Kids' FR808B Cat Print Purple Analog Watch,Jewelry & Watches > Watches > Girls
226,727,Voberry® Sports Digital LED Watches Alarm Date Rubber Wrist Watch for Children,Jewelry & Watches > Watches > Girls
227,727,disney kids' pn1172 watch with white band,Jewelry & Watches > Watches > Girls
228,727,"disney kids' w000038 ""minnie mouse time teacher"" stainless steel watch with pink leather band",Jewelry & Watches > Watches > Girls
229,727,swatch women's gb750 quartz black dial plastic measures seconds watch,Jewelry & Watches > Watches > Girls
230,727,disney minnie mouse bow-tique girls lcd watch with molded flip-top,Jewelry & Watches > Watches > Girls
231,727,Water Resistant Swimming Led Digital Sport Watch for Boys Girls (Light Blue),Jewelry & Watches > Watches > Girls
232,727,Hiwatch Pink Waterproof Sports Kids Watch Girls Led Digital Boys Watches with Light Alarm Stopwatch Day Week,Jewelry & Watches > Watches > Girls
233,727,red balloon kids' w000338 red balloon pretty girl monkey stainless steel time teacher pink velcro strap watch,Jewelry & Watches > Watches > Girls
234,727,Disney Kids' W001192 Time Teacher Princess Watch with Pink Nylon Band,Jewelry & Watches > Watches > Girls
235,727,bling jewelry white black baby panda animal kids watch stainless steel back,Jewelry & Watches > Watches > Girls
236,727,disney kids' w000024 minnie,Jewelry & Watches > Watches > Girls
237,727,esprit kids' es106414007 little nomad analog watch,Jewelry & Watches > Watches > Girls
238,727,Disney Kids' W001228 Frozen Elsa & Anna Stainless Steel Watch With Purple Nylon Strap,Jewelry & Watches > Watches > Girls
239,727,red balloon kids' w000182 butterflies stainless steel time teacher watch,Jewelry & Watches > Watches > Girls
240,727,"Red Balloon Kids' W000334 ""Love Owl Time Teacher"" Stainless Steel Watch with Purple Nylon Band",Jewelry & Watches > Watches > Girls
241,727,geneva black and brown horse theme rubber band kids watch #ch-36,Jewelry & Watches > Watches > Girls
242,727,disney kids' w000035 minnie mouse stainless steel time teacher watch,Jewelry & Watches > Watches > Girls
243,727,disney frozen led watch,Jewelry & Watches > Watches > Girls
244,727,disney kids' w000958 ariel stainless steel pink nylon strap watch,Jewelry & Watches > Watches > Girls
245,727,hello kitty girls wristwatch wrist watch black,Jewelry & Watches > Watches > Girls
246,727,bling jewelry purple analog baseball sports kids watch stainless steel back,Jewelry & Watches > Watches > Girls
247,727,ravel girls blue hibiscus velcro strap watch r1507.21,Jewelry & Watches > Watches > Girls
248,727,3d cartoon moschno cute,Jewelry & Watches > Watches > Girls
