,category_id,description,category_path
499,727,superior fashion alarm chronograph 30m waterproof digital sport watch for boys girls (blue),Jewelry & Watches > Watches > Girls
500,727,Princess Analog Watch with printed Band in Long PVC Box,Jewelry & Watches > Watches > Girls
501,727,Disney Minnie Mouse LCD Kids Watch,Jewelry & Watches > Watches > Girls
502,727,Disney Rhinestone Belle Watch 104788P with Pink Band,Jewelry & Watches > Watches > Girls
503,727,Disney Kids' FNF004T Frozen Digital Pink Watch with Bracelet Gift Set,Jewelry & Watches > Watches > Girls
504,727,Disney Kids' W000972 Frozen Tween Watch with Purple Sparkle Band,Jewelry & Watches > Watches > Girls
505,727,multifunction water-proof sport digital watch with alarm stopwatch for boys and girls /blue,Jewelry & Watches > Watches > Girls
506,727,ravel little gem kids kitten watch & jewellery gift set for girls r2212,Jewelry & Watches > Watches > Girls
507,727,Disney Girls' W000042 Time Teacher Disney Princess Watch with Pink Nylon Band,Jewelry & Watches > Watches > Girls
508,727,disney kids' fzn3598 frozen anna and elsa digital watch with purple snowflake band,Jewelry & Watches > Watches > Girls
509,727,sprout womens st/1060oryl,Jewelry & Watches > Watches > Girls
510,727,"disney kids' w001793 ""frozen elsa and anna"" stainless steel watch with pink leather band",Jewelry & Watches > Watches > Girls
511,727,pasnew highquality,Jewelry & Watches > Watches > Girls
512,727,u-beauty white hello kitty girls ladys wrist quartz watch faux leather,Jewelry & Watches > Watches > Girls
513,727,"disney kids' w000051 ""multi-princess time teacher"" stainless steel watch with purple nylon band",Jewelry & Watches > Watches > Girls
514,727,"disney kids' w000971 ""frozen tween snow queen elsa"" stainless steel watch with blue band",Jewelry & Watches > Watches > Girls
515,727,disney kids' fzn3630 frozen anna and elsa digital display analog quartz blue watch,Jewelry & Watches > Watches > Girls
516,727,"disney kids' frozen elsa and anna watch, w001789, purple nylon band",Jewelry & Watches > Watches > Girls
517,727,Neff Unisex NF0223GMMR Nightly Stainless Steel Watch with Nylon Band,Jewelry & Watches > Watches > Girls
518,727,"Speedo Kids' Silicone Earplugs, Multi",Jewelry & Watches > Watches > Girls
519,727,"Disney Kids' W001003 ""Time Teacher"" Cars Lightning McQueen Stainless Steel Watch with Red Nylon Strap",Jewelry & Watches > Watches > Girls
520,727,olivia pratt kids' flower watch white,Jewelry & Watches > Watches > Girls
521,727,kid's disney® princess watch - pink,Jewelry & Watches > Watches > Girls
522,727,my little pony girls multicolored flashing lights lcd watch,Jewelry & Watches > Watches > Girls
523,727,disney frozen flashing flower case lcd watch,Jewelry & Watches > Watches > Girls
524,727,ravel recorder with cleaning rod and bag nosize pink,Jewelry & Watches > Watches > Girls
525,727,disney watch - kids' minnie mouse flexible rubber nosize black,Jewelry & Watches > Watches > Girls
526,727,disney tiana kids time teacher purple strap watch,Jewelry & Watches > Watches > Girls
527,727,"disney watch, kid's glitz minnie mouse red glitter leather strap 31mm w000285 no color",Jewelry & Watches > Watches > Girls
528,727,m.z. berger & co inc the little mermaid lcd watch os,Jewelry & Watches > Watches > Girls
529,727,teen hearts stay weird stay you rubber bracelet,Jewelry & Watches > Watches > Girls
530,727,disney kid's princess time teacher watch in pink,Jewelry & Watches > Watches > Girls
531,727,"disney disney ariel girls' stainless steel watch, pink strap",Jewelry & Watches > Watches > Girls
532,727,accutime youth frozen elsa bracelet stone watch,Jewelry & Watches > Watches > Girls
533,727,hello kitty watch pink,Jewelry & Watches > Watches > Girls
534,727,sterling silver wizards of waverly place peace sign pendant,Jewelry & Watches > Watches > Girls
535,727,hello kitty girls' hkaq2871,Jewelry & Watches > Watches > Girls
536,727,disney kids' fzn3554,Jewelry & Watches > Watches > Girls
537,727,sprout kids' st/1050bluset blue organic cotton strap bamboo dial and time teacher clock set watch,Jewelry & Watches > Watches > Girls
538,727,sprout kids st/1061mpbl swarovski crystal accented owl dial blue organic cotton strap watch,Jewelry & Watches > Watches > Girls
539,727,disney kids' fnfkq039,Jewelry & Watches > Watches > Girls
540,727,sprout women's st/5512mpgy grey organic cotton strap blue owl dial watch,Jewelry & Watches > Watches > Girls
541,727,disney kids' minkd550,Jewelry & Watches > Watches > Girls
542,727,frenzy kids' fr376 white rubber band penguin watch,Jewelry & Watches > Watches > Girls
543,727,disney kids' pn1051 disney princess watch with pink band,Jewelry & Watches > Watches > Girls
544,727,"disney kids' w000912 ""doc mcstuffins"" stainless steel time teacher watch",Jewelry & Watches > Watches > Girls
545,727,disney kids' w002437 frozen,Jewelry & Watches > Watches > Girls
546,727,Disney Kids' W000390 Cinderella Glitz Stainless Steel Time Teacher Watch With Purple Nylon Band,Jewelry & Watches > Watches > Girls
547,727,"disney girls' w000025 ""time teacher"" stainless steel watch with pink nylon band",Jewelry & Watches > Watches > Girls
548,727,red balloon kids' w000179 butterflies stainless steel time teacher watch,Jewelry & Watches > Watches > Girls
549,727,Disney Kids' FZN3598 Frozen Anna and Elsa Digital Watch with Purple Snowflake Band Disney,Jewelry & Watches > Watches > Girls
550,727,disney kids' sof1497 digital display analog quartz purple watch,Jewelry & Watches > Watches > Girls
551,727,"red balloon kids' w000191 ""butterflies time teacher"" stainless steel watch with purple leather band",Jewelry & Watches > Watches > Girls
552,727,sprout women's st/1036gygyor orange organic cotton strap dark bamboo dial watch,Jewelry & Watches > Watches > Girls
553,727,"Red Balloon Kids' W001895 ""Time Teacher"" Plastic Watch with Adjustable Pink Nylon Strap",Jewelry & Watches > Watches > Girls
554,727,Pasnew LED Waterproof 100m Sports Digital Watch for Children Girls Boys (Pink),Jewelry & Watches > Watches > Girls
555,727,time100 kids' multifunction lcd fragrant pink strap digital watches#w40007g.06a,Jewelry & Watches > Watches > Girls
556,727,disney kids' fnfsk062,Jewelry & Watches > Watches > Girls
557,727,disney kids' minnie mouse minkd550 digital display quartz pink watch with pencil tin,Jewelry & Watches > Watches > Girls
558,727,Zeiger Girls' KW010 Analog Easy Read Young Children Kids Teen Wrist Watch with Rainbow Silicon Strap,Jewelry & Watches > Watches > Girls
559,727,"disney kids' frozen anna and elsa musical ""let it go"" digital watch with pink band",Jewelry & Watches > Watches > Girls
560,727,Disney Kids' W001032 Tinker Bell Glitz Stainless Steel Time Teacher Printed Strap Watch,Jewelry & Watches > Watches > Girls
561,727,"Disney Kids' W000228 ""Mickey Mouse Time Teacher"" Stainless Steel Watch with Blue Nylon Band",Jewelry & Watches > Watches > Girls
562,727,Disney Kids' FZN3630 Frozen Anna and Elsa Watch With Graphic Band,Jewelry & Watches > Watches > Girls
563,727,Jurassic World Flashing Lights LCD Watch,Jewelry & Watches > Watches > Girls
564,727,ouku water resistant children's kids heart pattern pink silicone band quartz analog lovely wrist watch casual watches,Jewelry & Watches > Watches > Girls
565,727,"timex kids' t7b151 ""time",Jewelry & Watches > Watches > Girls
566,727,PASNEW LED Digital Waterproof Outside Sports Watch for Children Girls Boys -Yellow,Jewelry & Watches > Watches > Girls
567,727,Disney Girls' W000025 Minnie Mouse Watch with Pink Nylon Band,Jewelry & Watches > Watches > Girls
568,727,Dickies Big Boys' Uniform and one other item,Jewelry & Watches > Watches > Girls
569,727,geneva pink piggy theme pink rubber band kids watch #ch-118,Jewelry & Watches > Watches > Girls
570,727,gp by brinley co. kids princess design teal silicone watch,Jewelry & Watches > Watches > Girls
571,727,disney girls' w000042 time,Jewelry & Watches > Watches > Girls
572,727,pythons (lp+cd),Jewelry & Watches > Watches > Girls
573,727,disney frozen lcd watch for girls with slide-on character,Jewelry & Watches > Watches > Girls
574,727,"Disney Kids' W001576 Minnie Mouse Stainless Steel Time Teacher Watch, Pink Nylon Band",Jewelry & Watches > Watches > Girls
575,727,casual waterproof children,Jewelry & Watches > Watches > Girls
576,727,olivia pratt kids' flower watch lime,Jewelry & Watches > Watches > Girls
577,727,sofia the first: the floating palace (widescreen),Jewelry & Watches > Watches > Girls
578,727,disney® girls' red balloon stainless steel time teacher watch - pink,Jewelry & Watches > Watches > Girls
579,727,kid's hello kitty watch - pink,Jewelry & Watches > Watches > Girls
580,727,girls' timex® ironkids digital watch - pink,Jewelry & Watches > Watches > Girls
581,727,home character dial flashing lights lcd watch,Jewelry & Watches > Watches > Girls
582,727,lego time teacher girls' watch,Jewelry & Watches > Watches > Girls
583,727,disney princess lcd watch in collectible tin one color,Jewelry & Watches > Watches > Girls
584,727,disney princess ariel light up watch - kids nosize turq/aqua,Jewelry & Watches > Watches > Girls
585,727,hello kitty® kids flashing digital watch,Jewelry & Watches > Watches > Girls
586,727,disney fairies kids time teacher purple print nylon fast strap watch,Jewelry & Watches > Watches > Girls
587,727,fashionista case,Jewelry & Watches > Watches > Girls
588,727,sofia the first® light up watch,Jewelry & Watches > Watches > Girls
589,727,timex kids t79081 my first timex easy reader watch with pink band,Jewelry & Watches > Watches > Girls
590,727,grain lthr rhyder,Jewelry & Watches > Watches > Girls
591,727,Girl's Piper Ankle Strap Ballet 12 GOLD,Jewelry & Watches > Watches > Girls
592,727,Girls Piper Ankle Strap Ballet Shoes 5 GOLD,Jewelry & Watches > Watches > Girls
593,727,Molded flip flops brown 8-9 (S),Jewelry & Watches > Watches > Girls
594,727,girls watch (g500) lilac - girls interchangeable watch set - girls watch set,Jewelry & Watches > Watches > Girls
595,727,Disney Kids' FZN3581 Frozen Anna and Elsa Watch with Blue Rubber Band,Jewelry & Watches > Watches > Girls
596,727,disney kids' w000292 minnie mouse stainless steel time teacher printed strap watch,Jewelry & Watches > Watches > Girls
597,727,disney princess watch - purple,Jewelry & Watches > Watches > Girls
598,727,8years unisex sport runner's fit child digital wrist watch pink waterproof outdoor new 215.5mm x36.0mm,Jewelry & Watches > Watches > Girls
599,727,disney kids' pn1009 princess digital dial pink jelly strap watch,Jewelry & Watches > Watches > Girls
600,727,pasnew highquality water-proof children girls sport watch (blue),Jewelry & Watches > Watches > Girls
601,727,disney kids' tk2015 tinker bell digital dial heart link bracelet watch,Jewelry & Watches > Watches > Girls
602,727,ravel guardian angel girls stone set bezel & charm pink pu strap watch jnw092g,Jewelry & Watches > Watches > Girls
603,727,disney kids' w000036 minnie mouse stainless steel time teacher watch,Jewelry & Watches > Watches > Girls
604,727,Disney Kids' FZN3579 Frozen Anna and Elsa Rhinestone-Accented Watch with White Rubber Band,Jewelry & Watches > Watches > Girls
605,727,Disney Girl's Quartz Pink Casual Watch (Model: PRSKD852CT),Jewelry & Watches > Watches > Girls
606,727,Bling Jewelry Pink Girls Butterfly Animal Flower Kids Watch Stainless Steel Back,Jewelry & Watches > Watches > Girls
607,727,new ohsen digital date alarm stop sport girls quartz wrist water resistant watch pink,Jewelry & Watches > Watches > Girls
608,727,disney kids' far122 classic analog watch,Jewelry & Watches > Watches > Girls
609,727,"casual waterproof children girls digital sport watches with alarm, chronograph, date (blue)",Jewelry & Watches > Watches > Girls
610,727,Disney Kids' W002469 Princess Time Teacher Analog Display Analog Quartz Pink Watch,Jewelry & Watches > Watches > Girls
611,727,"""peace love rescue"" ceramic",Jewelry & Watches > Watches > Girls
612,727,disney kids' fzn3630 frozen,Jewelry & Watches > Watches > Girls
613,727,disney kids' fnfkd042,Jewelry & Watches > Watches > Girls
614,727,Timex Kids' TW7C061009J QA Purple Stainless Steel Watch With Purple Striped Band,Jewelry & Watches > Watches > Girls
615,727,"disney kids' w000050 ""multi-princess"" stainless steel time teacher watch",Jewelry & Watches > Watches > Girls
616,727,disney kids' sof1497,Jewelry & Watches > Watches > Girls
617,727,monster high watch in a tin,Jewelry & Watches > Watches > Girls
618,727,kids girls watch - fsx-519g,Jewelry & Watches > Watches > Girls
619,727,girls watch kids watch,Jewelry & Watches > Watches > Girls
620,727,highquality pasnew water-proof children girls sport watch n1,Jewelry & Watches > Watches > Girls
621,727,Disney Kids' FZN3554 Frozen Anna and Elsa Rhinestone-Accented Watch with Glittered Pink Band,Jewelry & Watches > Watches > Girls
622,727,disney kids' fzn3579 frozen anna and elsa digital display analog quartz white watch,Jewelry & Watches > Watches > Girls
623,727,timermall water resistant hello kitty pattern green strap cartoon children's watches,Jewelry & Watches > Watches > Girls
624,727,disney princess digital lcd watch for girls (assorted colors) new,Jewelry & Watches > Watches > Girls
625,727,Hello Kitty CT.7105LS-16M Stainless Steel Pink Watch,Jewelry & Watches > Watches > Girls
626,727,disney kids' fkfkd004 frozen digital display quartz purple watch with interchangable characters in a gift tin,Jewelry & Watches > Watches > Girls
627,727,Disney Kids' FZN3588 Frozen Anna and Elsa Blue Watch,Jewelry & Watches > Watches > Girls
628,727,nike kids' wr0017-411 triax junior watch,Jewelry & Watches > Watches > Girls
629,727,disney kids' w001598 cinderella stainless steel watch with blue leather band,Jewelry & Watches > Watches > Girls
630,727,fairy magic (pink band) - gone bananas analog girls' waterproof watch with animated fairy for second hand - 3 atm water resistant,Jewelry & Watches > Watches > Girls
631,727,"fashion waterproof children boys girls lcd digital sport watch with alarm, chronograph, date (blue)",Jewelry & Watches > Watches > Girls
632,727,Shopkins Girl's Quartz Pink Casual Watch (Model: KIN4001),Jewelry & Watches > Watches > Girls
633,727,"disney kids' ra1025 ""tangled rapunzel"" watch",Jewelry & Watches > Watches > Girls
634,727,"sprout unisex sc/1001orwtbl easy-to-read steve ""the original tree hugger"" dial blue organic cotton strap watch",Jewelry & Watches > Watches > Girls
635,727,lovely children hello kitty cartoon watch wp@222151647r,Jewelry & Watches > Watches > Girls
636,727,Zeiger Cute First Kids' KW005 Time Teacher Cartoon Heart Little Girls Children Wrist Watch with Analog Pink Silicone,Jewelry & Watches > Watches > Girls
637,727,disney tinker bell kids watch - purple,Jewelry & Watches > Watches > Girls
638,727,disney princess kid's watch pink,Jewelry & Watches > Watches > Girls
639,727,kid's timex watch with butterflies and hearts strap - pink/blue t89001xy,Jewelry & Watches > Watches > Girls
640,727,girls' hello kitty watch with hidden lip gloss,Jewelry & Watches > Watches > Girls
641,727,girl's peace watch set,Jewelry & Watches > Watches > Girls
642,727,storytelling embellishment (pattern band) - yours truly,Jewelry & Watches > Watches > Girls
643,727,disney minnie mouse time teacher stainless steel watch - kids nosize pink,Jewelry & Watches > Watches > Girls
644,727,elle sasha wristlet nosize black,Jewelry & Watches > Watches > Girls
645,727,disney minnie mouse kids' time teacher watch red no size,Jewelry & Watches > Watches > Girls
646,727,disney princess kids time teacher pink nylon fast strap watch,Jewelry & Watches > Watches > Girls
647,727,kid's stride rite blaire pewter 1.5 w,Jewelry & Watches > Watches > Girls
648,727,bling jewelry pink kitty cat paw prints animal girls watch stainless steel back,Jewelry & Watches > Watches > Girls
649,727,dblwrap stud&stn lthr brc,Jewelry & Watches > Watches > Girls
650,727,disney princess — blue disney princess projection digital watch,Jewelry & Watches > Watches > Girls
651,727,olivia pratt — mustard stripe-strap watch,Jewelry & Watches > Watches > Girls
652,727,Girl's Piper Ankle Strap Ballet 11 GOLD,Jewelry & Watches > Watches > Girls
653,727,Girl's Piper Ankle Strap Ballet SILVER 5,Jewelry & Watches > Watches > Girls
654,727,Sofia the First Flying With Friends Cheer Bow Pony Holder MULTI CLR ONE SIZE,Jewelry & Watches > Watches > Girls
655,727,disney kids' w000076 tinker bell stainless steel time teacher watch,Jewelry & Watches > Watches > Girls
656,727,Peppa Pig Kids Flashing Lights LCD Watch,Jewelry & Watches > Watches > Girls
657,727,disney frozen watch with,Jewelry & Watches > Watches > Girls
658,727,thomas and friends kids' w000723 stainless steel time teacher red velcro strap watch,Jewelry & Watches > Watches > Girls
659,727,"disney girls' w000025 ""time teacher"" stainless steel and nylon minnie mouse watch",Jewelry & Watches > Watches > Girls
660,727,u-beauty hello kitty girls wristwatch wrist watch black,Jewelry & Watches > Watches > Girls
661,727,disney kids' w000863 princess stainless steel printed strap watch,Jewelry & Watches > Watches > Girls
662,727,slide kids' sl3p-jrpwl slap,Jewelry & Watches > Watches > Girls
663,727,"Disney Kids' W001523 Disney Minnie Mouse 3D Plastic Watch, Pink 3D Plastic Strap, W001523 Analog Display Analog Quartz Pink Watch",Jewelry & Watches > Watches > Girls
664,727,mattel kids' bar004t digital display quartz pink watch set,Jewelry & Watches > Watches > Girls
665,727,pokemon bw2 black and white 2 digital wrist watch full smile ver. - snivy,Jewelry & Watches > Watches > Girls
666,727,disney kids' fzn3560 frozen,Jewelry & Watches > Watches > Girls
667,727,Geneva Flower Theme Pink Rubber Band Kids Watch #CH-50,Jewelry & Watches > Watches > Girls
668,727,disney kid's far051t,Jewelry & Watches > Watches > Girls
669,727,HighQuality PASNEW Water-proof Children Girls Sport Watch N2 (Pink),Jewelry & Watches > Watches > Girls
670,727,Disney Kids' W001959 Sofia Analog Display Analog Quartz Pink Watch,Jewelry & Watches > Watches > Girls
671,727,boxx girls easy read analogue white dial & purple fabric strap buckle watch,Jewelry & Watches > Watches > Girls
672,727,sparkling flowers (blue band) - gone bananas analog girls' watch with animated flower second hand and stone accents,Jewelry & Watches > Watches > Girls
673,727,minnie mouse lcd digital watch disney girls wrist watch gift stocking stuffer,Jewelry & Watches > Watches > Girls
674,727,Super Mario Flashing Lights LCD Watch,Jewelry & Watches > Watches > Girls
675,727,highquality pasnew water-proof children girls sport watch n4,Jewelry & Watches > Watches > Girls
676,727,"Disney Kids' W000959 ""Ariel Glitz"" Stainless Steel Watch with Pink Nylon Band",Jewelry & Watches > Watches > Girls
677,727,disney kids' w000970 frozen,Jewelry & Watches > Watches > Girls
678,727,disney princess oval shape girl's watch,Jewelry & Watches > Watches > Girls
679,727,disney kids' fnfkd009 frozen rhinestone bezel watch with pink strap,Jewelry & Watches > Watches > Girls
680,727,Disney Kids' FZN6000SR Digital Display Analog Quartz Pink Watch,Jewelry & Watches > Watches > Girls
681,727,time100 kids' fancy lcd multifunction pink strap digital watches#w40010l.04a,Jewelry & Watches > Watches > Girls
682,727,red balloon kids' w000182 butterflies stainless steel time teacher children's watch,Jewelry & Watches > Watches > Girls
683,727,Disney Princess LCD Watch & Mix n' Match Slide-Ons,Jewelry & Watches > Watches > Girls
684,727,"disney kids' pn1002 ""princess"" flower watch with leather band",Jewelry & Watches > Watches > Girls
685,727,disney minnie mouse kid's minkd435 molded bendable lcd watch,Jewelry & Watches > Watches > Girls
686,727,Disney Princess LCD Watch with Lipgloss,Jewelry & Watches > Watches > Girls
687,727,bling jewelry green analog tennis sports kids watch stainless steel back,Jewelry & Watches > Watches > Girls
688,727,time100 kids' lcd cold light multifunction purple strap digital watches#w40009l.05a,Jewelry & Watches > Watches > Girls
689,727,disney kids' w001790 frozen analog display analog quartz pink watch,Jewelry & Watches > Watches > Girls
690,727,disney kids' fkfkq018 frozen elsa and anna digital display quartz pink watch in a gift tin,Jewelry & Watches > Watches > Girls
691,727,disney kids' w000392 disney tween glitz cinderella stainless steel silver glitter leather strap watch,Jewelry & Watches > Watches > Girls
692,727,Pink Rubber Strap Resin Case Kids Digital Watches Hello Kitty Motif,Jewelry & Watches > Watches > Girls
693,727,"disney kids' pn2002 ""princess"" rhinestone-accented watch",Jewelry & Watches > Watches > Girls
694,727,Disney Kids' MINKD552 Minnie Mouse Digital Watch,Jewelry & Watches > Watches > Girls
695,727,hacbiwa fashion womens ladies girls weave leather hollow band wrist watch dark brown,Jewelry & Watches > Watches > Girls
696,727,Time100 Kids' Multifunction LCD Fragrant Purple Strap Digital Watches#W40007G.04A,Jewelry & Watches > Watches > Girls
697,727,mokingtop fashion children girls digital led quartz alarm date waterproof sports wrist watch,Jewelry & Watches > Watches > Girls
698,727,wonder woman flashing lights lcd watch,Jewelry & Watches > Watches > Girls
699,727,boxx girls easy read analogue white dial & pink fabric strap buckle funky watch,Jewelry & Watches > Watches > Girls
700,727,Disney Toy Story Kids Camo Velcro Band Time Teacher Watch,Jewelry & Watches > Watches > Girls
701,727,disney kids' w000970 anna snow queen stainless steel watch,Jewelry & Watches > Watches > Girls
702,727,crocodile creek horses watch,Jewelry & Watches > Watches > Girls
703,727,Sprout Womens ST/1061MPGN Swarovski Crystal Accented Owl Dial Green Organic Cotton Strap Watch,Jewelry & Watches > Watches > Girls
704,727,disney® girls' red balloon plastic watch interchangeable strap - pink/purple,Jewelry & Watches > Watches > Girls
705,727,minnie wristwatch watches pnk,Jewelry & Watches > Watches > Girls
706,727,disney® minnie mouse analog wristwatch - white,Jewelry & Watches > Watches > Girls
707,727,disney minnie mouse stainless steel watch nosize silver,Jewelry & Watches > Watches > Girls
708,727,disney minnie mouse time teacher stainless steel watch - kids nosize blue,Jewelry & Watches > Watches > Girls
709,727,disney minnie mouse time teacher stainless steel watch - kids nosize purple,Jewelry & Watches > Watches > Girls
710,727,disney princess kids time teacher pink nylon fast strap watch 0398341,Jewelry & Watches > Watches > Girls
711,727,disney cinderella tween glitz time teacher kids stainless steel watch,Jewelry & Watches > Watches > Girls
712,727,lulu castagnette color: grey,Jewelry & Watches > Watches > Girls
713,727,my chemical romance three cheers rubber bracelet,Jewelry & Watches > Watches > Girls
714,727,suede drivers 10 light blue,Jewelry & Watches > Watches > Girls
715,727,wraparound women's genuime leather bracelet watch - assorted styles,Jewelry & Watches > Watches > Girls
716,727,accutime watches — purple buckle watch,Jewelry & Watches > Watches > Girls
717,727,lakhay's collection — turquoise organic cotton suzie love headband one-size,Jewelry & Watches > Watches > Girls
718,727,"trudi kid's fuzzy band koala watch, beige",Jewelry & Watches > Watches > Girls
719,727,ravel little gems kids butterfly watch & jewellery gift set for girls r2217,Jewelry & Watches > Watches > Girls
720,727,Happy Cherry Outdoor Boys Girls Students Cool Digital Sport LED Quartz Alarm Stopwatch Chronograph Wrist Watch,Jewelry & Watches > Watches > Girls
721,727,Marvel Kids' SPMKD581FL Digital Spider-Man Watch with Printed Band,Jewelry & Watches > Watches > Girls
722,727,red balloon kids' w000191 butterflies stainless steel time teacher watch,Jewelry & Watches > Watches > Girls
723,727,disney kids' fzn3560 frozen anna and elsa digital display analog quartz pink watch,Jewelry & Watches > Watches > Girls
724,727,Disney Kids' FZN3560 Frozen Anna and Elsa Pink Watch with Plastic Band,Jewelry & Watches > Watches > Girls
725,727,sparkling flowers (light blue band) - gone bananas analog girls' watch with animated flower second hand and stone accentss,Jewelry & Watches > Watches > Girls
726,727,disney princesses kid's prs1113t lcd watch set with gift box,Jewelry & Watches > Watches > Girls
727,727,"timex girls' t89022 ""time teacher"" floral elastic strap watch by timex",Jewelry & Watches > Watches > Girls
728,727,"disney kids' w001192 ""time teacher"" watch with pink nylon band",Jewelry & Watches > Watches > Girls
729,727,girls cartoon purple,Jewelry & Watches > Watches > Girls
730,727,Pasnew LED Waterproof 100m Sports Digital Watch for Children Girls Boys (Yellow),Jewelry & Watches > Watches > Girls
731,727,"disney kids' fzn3630 ""frozen"" anna and elsa digital display watch with graphic band",Jewelry & Watches > Watches > Girls
732,727,disney kids' fnfkd040,Jewelry & Watches > Watches > Girls
733,727,"Disney Kids' W000913 ""Doc McStuffins Time Teacher"" Stainless Steel Watch with Pink Nylon Band",Jewelry & Watches > Watches > Girls
734,727,disney kids' w000912 doc mcstuffins stainless steel purple nylon strap watch,Jewelry & Watches > Watches > Girls
735,727,"Timex Kids' T7B151 ""Time Teacher"" Plastic Watch with Pink Ballerina-Print Canvas Strap by Timex",Jewelry & Watches > Watches > Girls
736,727,hello kitty girls lcd watch with slide on character,Jewelry & Watches > Watches > Girls
737,727,red balloon kids' w001234 interchangeable strap red balloon plastic printed stretch nylon watch set,Jewelry & Watches > Watches > Girls
738,727,disney princess kids rapunzel purple leather band time teacher watch,Jewelry & Watches > Watches > Girls
739,727,"Marvel Kids' W000104 ""Spider-Man Time Teacher"" Stainless Steel Watch",Jewelry & Watches > Watches > Girls
740,727,"disney kids' w001068 ""sofia",Jewelry & Watches > Watches > Girls
741,727,"disney fairies kid's farkq198 ""time teacher"" watch",Jewelry & Watches > Watches > Girls
