,category_id,description,category_path
742,727,TimerMall Hello Kitty Cartoon Children's Analogue Quartz Blue Genuine Leather Strap Watches,Jewelry & Watches > Watches > Girls
743,727,wise® teenage girls watch,Jewelry & Watches > Watches > Girls
744,727,time100 kids' multifunction lcd fragrant green strap digital watches#w40007g.03a,Jewelry & Watches > Watches > Girls
745,727,esprit kids' es105264004,Jewelry & Watches > Watches > Girls
746,727,Disney Frozen with Slide-On Characters LCD Watch,Jewelry & Watches > Watches > Girls
747,727,"pasnew fashion waterproof children boys girls digital sport watch with alarm, chronograph, date (blue)",Jewelry & Watches > Watches > Girls
748,727,ravel little gems kids horse watch & jewellery gift set for girls r2213,Jewelry & Watches > Watches > Girls
749,727,frenzy kids' fr248 peace novelty analog bracelet watch,Jewelry & Watches > Watches > Girls
750,727,"20mm extralong brn alligator grain gld-tone bkle watch band, best quality free gift box satisfaction guaranteed",Jewelry & Watches > Watches > Girls
751,727,"disney kids' w000058 ""cinderella time teacher"" stainless steel watch with blue leather band",Jewelry & Watches > Watches > Girls
752,727,red balloon kids' w000188 butterflies stainless steel time teacher watch,Jewelry & Watches > Watches > Girls
753,727,disney hannah montana junior girls purple crystal fashion quartz watch hhm35,Jewelry & Watches > Watches > Girls
754,727,"disney kids' fzn3556 ""frozen"" anna and elsa digital display watch with white rubber band",Jewelry & Watches > Watches > Girls
755,727,disney kids' tk1167 digital display analog quartz purple watch,Jewelry & Watches > Watches > Girls
756,727,Disney Princess Heart Shape Pink Rhinestone Bezel Watch with Charms,Jewelry & Watches > Watches > Girls
757,727,changeshopping(tm)fashion children girls digital led quartz alarm date sports waterproof wrist watch,Jewelry & Watches > Watches > Girls
758,727,"myiddr - boys, girls, kids",Jewelry & Watches > Watches > Girls
759,727,mokingtop(tm) fashion new waterproof girl's sports waterproof led electronic wrist watch,Jewelry & Watches > Watches > Girls
760,727,disney kids' w000972 tween anna snow queen elsa analog display quartz purple watch,Jewelry & Watches > Watches > Girls
761,727,"disney kids' w000292 ""minnie mouse"" stainless steel time teacher watch",Jewelry & Watches > Watches > Girls
762,727,"Hiwatch Kids Digital Watches Waterproof Led Sport Watches with Alarm for Boys and Girls, Blue",Jewelry & Watches > Watches > Girls
763,727,disney kids' w000971 tween snow queen elsa stainless steel blue watch,Jewelry & Watches > Watches > Girls
764,727,"disney kids' w001271 disney tween cinderella plastic watch, pink nylon strap,w001271 analog display analog quartz pink watch",Jewelry & Watches > Watches > Girls
765,727,Disney Kids' SOF1454 Light-Up Sofia the First Watch with Pink Band,Jewelry & Watches > Watches > Girls
766,727,disney kids' sof1497 sofia the first digital purple watch,Jewelry & Watches > Watches > Girls
767,727,funky pastel flower summer ladies - girls slap on analogue silicone sports watch,Jewelry & Watches > Watches > Girls
768,727,girls' disney princess ariel clear plastic time teacher wristwatch - green,Jewelry & Watches > Watches > Girls
769,727,kid's disney® wristwatch watches rubber - pink,Jewelry & Watches > Watches > Girls
770,727,disney tinker kid's watch pink,Jewelry & Watches > Watches > Girls
771,727,girls' hello kitty wristwatch,Jewelry & Watches > Watches > Girls
772,727,kid's disney tinker bell watch - blue,Jewelry & Watches > Watches > Girls
773,727,girls' red balloon plastic time teacher wristwatch - purple,Jewelry & Watches > Watches > Girls
774,727,disney princess kid's watch purple,Jewelry & Watches > Watches > Girls
775,727,kids paw patrol digital watch - pink,Jewelry & Watches > Watches > Girls
776,727,"disney princess snow white, cinderella & aurora girls' time teacher watch purple no size",Jewelry & Watches > Watches > Girls
777,727,camp shirt-w pm peridot ggr,Jewelry & Watches > Watches > Girls
778,727,"disney watch, kid's glitz tinker bell purple printed nylon strap 32mm w000412 no color",Jewelry & Watches > Watches > Girls
779,727,disney princess projection watch,Jewelry & Watches > Watches > Girls
780,727,goldtone multicolor interchangeable glitter strap watch . glitter multicolor,Jewelry & Watches > Watches > Girls
781,727,ashley princess women's rhinestone-accented watch - assorted styles,Jewelry & Watches > Watches > Girls
782,727,chronotech women's heart watch - assorted styles,Jewelry & Watches > Watches > Girls
783,727,"disney kid's glitz tinker bell steel time teacher, printed strap, w000278",Jewelry & Watches > Watches > Girls
784,727,loose gems,Jewelry & Watches > Watches > Girls
785,727,olivia pratt — gray astrology-strap watch,Jewelry & Watches > Watches > Girls
786,727,Girl Kailey Glitter T Strap Ballet GOLD 13,Jewelry & Watches > Watches > Girls
787,727,mokingtop rhinestone,Jewelry & Watches > Watches > Girls
788,727,"timex kids' t7b151 ""time teacher pink ballerina"" watch with pink canvas band",Jewelry & Watches > Watches > Girls
789,727,disney kids' mn1104 watch,Jewelry & Watches > Watches > Girls
790,727,Monster High Strap Watch - Pink,Jewelry & Watches > Watches > Girls
791,727,"timex girls' t89022 ""time teacher"" floral elastic strap watch",Jewelry & Watches > Watches > Girls
792,727,Disney Princess Bride Kids' W002377 Princess Analog Display Analog Quartz Purple Watch,Jewelry & Watches > Watches > Girls
793,727,disney kids' pn1048 watch,Jewelry & Watches > Watches > Girls
794,727,disney kids' w000161 muppets 'miss piggy' stainless steel time teacher watch,Jewelry & Watches > Watches > Girls
795,727,wobl 8 alarm vibrating watch - pink,Jewelry & Watches > Watches > Girls
796,727,Digital Girls Sports Watch Date Alarm Stopwatch with Luminous Dial in Pretty Pink,Jewelry & Watches > Watches > Girls
797,727,disney kids' w001179 interchangeable strap minnie mouse plastic stretch nylon watch set,Jewelry & Watches > Watches > Girls
798,727,esprit kids' es000u54005 pretty in pink interchangeable strap watch,Jewelry & Watches > Watches > Girls
799,727,"disney kids' fzn3568 ""frozen anna and elsa"" digital display watch with pink band",Jewelry & Watches > Watches > Girls
800,727,disney frozen singing digital watch,Jewelry & Watches > Watches > Girls
801,727,"disney kids' w000392 ""tween cinderella glitz"" stainless steel watch with silver glitter band",Jewelry & Watches > Watches > Girls
802,727,pasnew led waterproof 100m sports digital watch for children girls boys (orange),Jewelry & Watches > Watches > Girls
803,727,super cute hello kitty wrist watch girls gift free shipping- white,Jewelry & Watches > Watches > Girls
804,727,girls children digital lcd,Jewelry & Watches > Watches > Girls
805,727,lego friends watch - purple stephanie,Jewelry & Watches > Watches > Girls
806,727,TimerMall Hello Kitty Kids Fashion Cartoon White Dial Stainless Steel Case Quartz Pink Watches,Jewelry & Watches > Watches > Girls
807,727,disney kids' w000910 doc mcstuffins stainless steel printed bezel pink nylon strap watch,Jewelry & Watches > Watches > Girls
808,727,disney kids' w002033 elsa,Jewelry & Watches > Watches > Girls
809,727,disney kids' fzn3554 frozen anna and elsa rhinestone-accented watch,Jewelry & Watches > Watches > Girls
810,727,disney princesses kid's prs1113t watch with bracelet and giftbox,Jewelry & Watches > Watches > Girls
811,727,Disney Kids' W000051 Disney Princess Time Teacher Stainless Steel Watch with Purple Nylon Band,Jewelry & Watches > Watches > Girls
812,727,thomas and friends kids' w000729 stainless steel time teacher red bezel red velcro strap watch,Jewelry & Watches > Watches > Girls
813,727,pasnew cool digital-analog waterproof dual time sport wrist watches for boys girls (black) pse-149a,Jewelry & Watches > Watches > Girls
814,727,Disney Kids' W000026 Minnie Mouse Time Teacher Watch With Two-Tone Nylon Band,Jewelry & Watches > Watches > Girls
815,727,disney kids' dockd020 doc mcstuffins digital display quartz purple watch,Jewelry & Watches > Watches > Girls
816,727,Disney Kids' W001951 Tiana Analog Display Analog Quartz Purple Watch,Jewelry & Watches > Watches > Girls
817,727,Disney Women's W001877 Minnie Mouse Analog Display Analog Quartz Red Watch,Jewelry & Watches > Watches > Girls
818,727,Time100 Kids' Digital Timing Multifunctional Purple Strap Sport Electronic Watch #W40011L.06A by Time100,Jewelry & Watches > Watches > Girls
819,727,Kids LED Digital Unusual Electrical Luminescent Silicone Outdoor Sport Waterproof Alarm Children Dress Wrist Watch with Stopwatch for Boys Girls - Purple,Jewelry & Watches > Watches > Girls
820,727,doc mcstuffins analog watch with printed band in long pvc box,Jewelry & Watches > Watches > Girls
821,727,timex kids' t79081 my first timex easy reader pink leather strap watch,Jewelry & Watches > Watches > Girls
822,727,lego friends watch - pink olivia,Jewelry & Watches > Watches > Girls
823,727,disney frozen watch,Jewelry & Watches > Watches > Girls
824,727,boxx girls time teacher analogue red & white dial velcro pu strap kids watch,Jewelry & Watches > Watches > Girls
825,727,disney kids' sof1495 digital display analog quartz white watch,Jewelry & Watches > Watches > Girls
826,727,frenzy kids' fr2005 owl critter face with pink rubber band watch,Jewelry & Watches > Watches > Girls
827,727,girl's nike spree watch #wk0014612,Jewelry & Watches > Watches > Girls
828,727,"Disney kids' W001196 ""Time Teacher"" Cars Watch With Checkerboard Nylon Band",Jewelry & Watches > Watches > Girls
829,727,olivia pratt kids' basketball watch,Jewelry & Watches > Watches > Girls
830,727,shopkins girls' digital wristwatch - purple,Jewelry & Watches > Watches > Girls
831,727,"disney princess cinderella, jasmine and belle girls' pink plastic time teacher watch, purple hook and loop stretchy nylon strap with pink backing",Jewelry & Watches > Watches > Girls
832,727,"disney cinderella girls' plastic watch, pink strap",Jewelry & Watches > Watches > Girls
833,727,nina: metro silver,Jewelry & Watches > Watches > Girls
834,727,disney frozen flashing flower case lcd watch one color,Jewelry & Watches > Watches > Girls
835,727,disney phineas and ferb candace and isabella stainless steel time teacher watch - kids pink,Jewelry & Watches > Watches > Girls
836,727,disney frozen watch - kids' elsa & anna digital pink no size,Jewelry & Watches > Watches > Girls
837,727,disney tinker bell stainless steel watch silver,Jewelry & Watches > Watches > Girls
838,727,camp shirt-w 1x peridot ggr,Jewelry & Watches > Watches > Girls
839,727,disney kids time teacher isabella fast strap watch 0509967,Jewelry & Watches > Watches > Girls
840,727,hello kittyâ® rhinestone & charms watch,Jewelry & Watches > Watches > Girls
841,727,"disney watch, kid's belle time teacher pink leather strap 30mm w000059 no color",Jewelry & Watches > Watches > Girls
842,727,"hello kitty kids watch, girls princess watch",Jewelry & Watches > Watches > Girls
843,727,my little pony my little pony digital wrist watch,Jewelry & Watches > Watches > Girls
844,727,minnie mouse kids' minnie mouse white/pink 6.0 m,Jewelry & Watches > Watches > Girls
845,727,Girl Kailey Glitter T Strap Ballet GOLD 9,Jewelry & Watches > Watches > Girls
846,727,Girl's Piper Ankle Strap Ballet 3 GOLD,Jewelry & Watches > Watches > Girls
847,727,disney kids' w000038 minnie mouse stainless steel time teacher watch,Jewelry & Watches > Watches > Girls
848,727,"disney kids' fzn3554 ""frozen anna and elsa"" rhinestone-accented watch with pink band",Jewelry & Watches > Watches > Girls
849,727,disney kids' w000962 aurora glitz stainless steel time teacher pink nylon strap watch,Jewelry & Watches > Watches > Girls
850,727,high school musical kids' hsm107 crystal accented watch,Jewelry & Watches > Watches > Girls
851,727,"Disney Kids' W000097 ""Winnie the Pooh & Friends Time Teacher"" Stainless Steel Watch",Jewelry & Watches > Watches > Girls
852,727,Disney Kids' W001667 Princess Analog Display Analog Quartz Pink Watch,Jewelry & Watches > Watches > Girls
853,727,Paw Patrol Skye Flashing Lights Girls LCD Watch,Jewelry & Watches > Watches > Girls
854,727,"Disney Kids' W001789 Frozen Elsa and Anna Watch, Purple Nylon Band",Jewelry & Watches > Watches > Girls
855,727,"Disney Kids' W001790 Frozen Elsa and Anna Watch, Pink Nylon Band",Jewelry & Watches > Watches > Girls
856,727,"Slide Kids' SL3P-JUUWL Slap 3PAQ Jumbo Blue, White and Black Watch",Jewelry & Watches > Watches > Girls
857,727,lalaloopsy girls lcd watch with molded flip top,Jewelry & Watches > Watches > Girls
858,727,"frenzy kids' fr302 ""mood dial heart"" watch",Jewelry & Watches > Watches > Girls
859,727,Disney Kids' PN2000 Cinderella Rhinestone-Accented Watch,Jewelry & Watches > Watches > Girls
860,727,Disney Minnie Mouse Digital LCD Wrist Watch Boys Stocking Stuffer - 2 Piece,Jewelry & Watches > Watches > Girls
861,727,Disney Kids' Ariel Little Mermaid Time Teacher Watch with Blue Nylon Band,Jewelry & Watches > Watches > Girls
862,727,Bloomin' Beads,Jewelry & Watches > Watches > Girls
863,727,cool digital-analog waterproof dual time sport wrist watches for boys girls (black),Jewelry & Watches > Watches > Girls
864,727,"disney kids' w001228 frozen princess stainless steel watch, purple stretch nylon strap,w001228 analog display analog quartz purple watch",Jewelry & Watches > Watches > Girls
865,727,red balloon kids' w000333 love owl stainless steel time teacher purple velcro strap watch,Jewelry & Watches > Watches > Girls
866,727,disney kids' mn1097 minnie,Jewelry & Watches > Watches > Girls
867,727,ampm24 fashion red big case pencil pointer girl lady quartz leather wrist watch gift waa175,Jewelry & Watches > Watches > Girls
868,727,disney kids' w002375 minnie,Jewelry & Watches > Watches > Girls
869,727,geiiyda girls watches w1387,Jewelry & Watches > Watches > Girls
870,727,bling jewelry purple analog,Jewelry & Watches > Watches > Girls
871,727,disney kids' w000026 minnie,Jewelry & Watches > Watches > Girls
872,727,"disney minnie mouse kid's min189 ""classic"" watch with pink band",Jewelry & Watches > Watches > Girls
873,727,disney kids' mn1172 analog display analog quartz pink watch,Jewelry & Watches > Watches > Girls
874,727,Christmas Gifts Girls Pink Ladybug Clover Kids Watch Stainless Steel Back,Jewelry & Watches > Watches > Girls
875,727,pasnew highquality water-proof dual time children boys girls sport watch black and green,Jewelry & Watches > Watches > Girls
876,727,sandpaper pencil pointer,Jewelry & Watches > Watches > Girls
877,727,my little pony flashing,Jewelry & Watches > Watches > Girls
878,727,disney kids' w000971 frozen tween snow queen elsa stainless steel blue watch,Jewelry & Watches > Watches > Girls
879,727,silly puppies (neon pink,Jewelry & Watches > Watches > Girls
880,727,disney kids' pn1051 disney,Jewelry & Watches > Watches > Girls
881,727,disney kids' tnk579 fairies molded digital watch,Jewelry & Watches > Watches > Girls
882,727,sprout kids' st/1050pnkset purple organic cotton strap bamboo dial and time teacher clock set watch,Jewelry & Watches > Watches > Girls
883,727,disney kids' w000055 multi-princess stainless steel time teacher watch,Jewelry & Watches > Watches > Girls
884,727,disney kids' pn1051 disney princess pink band watch,Jewelry & Watches > Watches > Girls
885,727,highquality pasnew water-proof dual time children boys girls sport watch,Jewelry & Watches > Watches > Girls
886,727,"red balloon kids' w000182 ""butterflies time teacher"" stainless steel watch with pink nylon band",Jewelry & Watches > Watches > Girls
887,727,disney kids' w000050 multi-princess time teacher watch,Jewelry & Watches > Watches > Girls
888,727,viliysun 3pcs new lovely hello kitty girls ladies wrist watch quartz fashion best gift,Jewelry & Watches > Watches > Girls
889,727,ravel girls baby pink heart time teacher velcro strap watch r1507.22,Jewelry & Watches > Watches > Girls
890,727,frenzy kids' fr154 frog novelty analog bracelet watch,Jewelry & Watches > Watches > Girls
891,727,frenzy kids' fr2004 butterfly critter face with purple rubber band watch,Jewelry & Watches > Watches > Girls
892,727,disney kids' fzn3579 frozen,Jewelry & Watches > Watches > Girls
893,727,"Shopkins Girl's Quartz Plastic Casual Watch, Color:Pink (Model: KIN4001)",Jewelry & Watches > Watches > Girls
894,727,disney kids' mn1097 watch,Jewelry & Watches > Watches > Girls
895,727,"disney kids' ariel time teacher watch w001190, blue nylon band",Jewelry & Watches > Watches > Girls
896,727,Frenzy Kids' FR795 Blue Rubber Band Penguin Children's Watch,Jewelry & Watches > Watches > Girls
897,727,girls' disney princess rapunzel pink plastic time teacher wristwatch - purple,Jewelry & Watches > Watches > Girls
898,727,my little pony girls mlpkd121 pink plastic quartz watch,Jewelry & Watches > Watches > Girls
899,727,disney kid's ariel plastic watch with printed stretch nylon strap one color,Jewelry & Watches > Watches > Girls
900,727,storytelling embellishment (pattern band) - lure,Jewelry & Watches > Watches > Girls
901,727,disney princess sofia stainless steel time teacher watch - kids pink no size,Jewelry & Watches > Watches > Girls
902,727,disney tinker bell stainless steel simulated crystal time teacher watch - kids purple,Jewelry & Watches > Watches > Girls
903,727,"hello kitty kids watch, girls princess watch white bow os",Jewelry & Watches > Watches > Girls
904,727,"hello kitty kids watch, girls or little girls flip-top watch hello kitty os",Jewelry & Watches > Watches > Girls
905,727,m.z. berger & co inc disney princess lcd character watch os,Jewelry & Watches > Watches > Girls
906,727,monster factory,Jewelry & Watches > Watches > Girls
907,727,puma don't run out of steam original,Jewelry & Watches > Watches > Girls
908,727,disney kids' minnie mouse flashing watch with rubber strap - assorted colors,Jewelry & Watches > Watches > Girls
909,727,louis arden women's analog watch - assorted styles,Jewelry & Watches > Watches > Girls
910,727,disney kids' frozen anna & elsa watch with rubber strap - assorted styles,Jewelry & Watches > Watches > Girls
911,727,me to we moccasins 6.5m/brown,Jewelry & Watches > Watches > Girls
912,727,disney disney kids time teacher minnie pink watch,Jewelry & Watches > Watches > Girls
913,727,disney — pink princess analog watch,Jewelry & Watches > Watches > Girls
914,727,olivia pratt — black tom cat watch,Jewelry & Watches > Watches > Girls
915,727,Girls Buckle Bootie 1 Black,Jewelry & Watches > Watches > Girls
916,727,u-beauty rose hello kitty girls ladys wrist quartz watch faux leather,Jewelry & Watches > Watches > Girls
917,727,bling jewelry pink girls princess butterfly kids watch stainless steel back,Jewelry & Watches > Watches > Girls
918,727,disney kids' mn1157 minnie mouse pink watch,Jewelry & Watches > Watches > Girls
919,727,the little mermaid art of ariel watch in collector tin,Jewelry & Watches > Watches > Girls
920,727,2 X Relda Time Teacher Quartz White Dial Childrens Blue/Pink Velcro Strap Watch,Jewelry & Watches > Watches > Girls
921,727,HighQuality PASNEW Water-proof Children Girls Sport Watch,Jewelry & Watches > Watches > Girls
922,727,disney kids' w000969 frozen anna and elsa time teacher watch with pink nylon band,Jewelry & Watches > Watches > Girls
923,727,golden hello kitty girls ladys wrist watch,Jewelry & Watches > Watches > Girls
924,727,"disney kids' frozen elsa and anna watch, w001790, pink nylon band",Jewelry & Watches > Watches > Girls
925,727,Flashing Lights LCD Watch - Paw Patrol,Jewelry & Watches > Watches > Girls
926,727,"1 - 7.5"" winx club girls themed wrist watch (colors may vary)",Jewelry & Watches > Watches > Girls
927,727,Disney Princess Childrens Digital LCD Wrist Watch (Blue),Jewelry & Watches > Watches > Girls
928,727,Timex Kids' TW7C058009J QA Blue Stainless Steel Watch With Blue Striped Band,Jewelry & Watches > Watches > Girls
929,727,Ravel Festival Girls White Dial Lilac Flower Velcro Strap Watch R1507.35,Jewelry & Watches > Watches > Girls
930,727,speedo active swim grey digital dial kid's watch #sd55179bx,Jewelry & Watches > Watches > Girls
931,727,disney kids' fzn3550 frozen anna and elsa watch with white rubber band,Jewelry & Watches > Watches > Girls
932,727,frenzy kids' fr2006 lion critter face with yellow rubber band watch,Jewelry & Watches > Watches > Girls
933,727,disney kids' fzn3581 frozen anna and elsa digital display analog quartz blue watch,Jewelry & Watches > Watches > Girls
934,727,Disney Kids' W000955 Tween Ariel Stainless Steel Watch with Glitter Strap,Jewelry & Watches > Watches > Girls
935,727,Hiwatch Kids Sport Watches Waterproof Digital Watch for Boys and Girls Led Watch for Toddler Blue,Jewelry & Watches > Watches > Girls
936,727,My Little Pony Girls Watch / Gold Case with Pink Rubber Strap,Jewelry & Watches > Watches > Girls
937,727,"casual waterproof children girls digital sport watches with alarm, chronograph, date (red)",Jewelry & Watches > Watches > Girls
938,727,Disney Kids' W001684 Doc McStuffins Analog Display Analog Quartz Purple Watch,Jewelry & Watches > Watches > Girls
939,727,"disney kids' fzn3550 ""frozen anna and elsa"" watch with pink rubber band",Jewelry & Watches > Watches > Girls
940,727,hello kitty girls wristwatch wrist watch pink new,Jewelry & Watches > Watches > Girls
941,727,disney kids' prs527 princess molded digital watch,Jewelry & Watches > Watches > Girls
942,727,disney kids' pn2002,Jewelry & Watches > Watches > Girls
943,727,"disney girls' w000042 ""time teacher"" stainless steel watch with pink nylon band",Jewelry & Watches > Watches > Girls
944,727,cool digital-analog waterproof dual time sport wrist watches for boys girls (blue),Jewelry & Watches > Watches > Girls
945,727,disney kids' w000970 frozen anna snow queen stainless steel watch,Jewelry & Watches > Watches > Girls
946,727,"Timex Kids' T7B151 ""Time Teacher"" Plastic Watch with Pink Ballerina-Print Canvas Strap",Jewelry & Watches > Watches > Girls
947,727,disney kids' w001793 frozen elsa and anna stainless steel pink leather strap watch,Jewelry & Watches > Watches > Girls
948,727,"frenzy kids' fr303 ""mood dial peace"" watch",Jewelry & Watches > Watches > Girls
949,727,time100 kids' fancy lcd multifunction light blue strap digital watches#w40010l.03a,Jewelry & Watches > Watches > Girls
950,727,disney kids' fzn3550 frozen,Jewelry & Watches > Watches > Girls
951,727,disney kids' far051t lcd watch set with gift box,Jewelry & Watches > Watches > Girls
952,727,3d cartoon spiderman pattern girl's boy's kids wrist quartz watch silicone bands for party,Jewelry & Watches > Watches > Girls
953,727,casio blue candy analog girls watch #ltr15b-2av,Jewelry & Watches > Watches > Girls
954,727,disney kids' fzn3598 frozen,Jewelry & Watches > Watches > Girls
955,727,"disney girls' w000042 princess ""time teacher"" watch",Jewelry & Watches > Watches > Girls
956,727,bling jewelry orange puppy pawprints animal kids watch stainless steel back,Jewelry & Watches > Watches > Girls
957,727,ravel little gems kids flower watch & jewellery gift set for girls r2214,Jewelry & Watches > Watches > Girls
958,727,slap watch junior kids watch popstar pink bling,Jewelry & Watches > Watches > Girls
959,727,disney kids' fzn3606 frozen,Jewelry & Watches > Watches > Girls
960,727,Disney Kids' Minnie MINKD450 LCD Watch,Jewelry & Watches > Watches > Girls
961,727,girls' disney princess cinderella-rapunzel-ariel pink plastic time teacher watch - purple,Jewelry & Watches > Watches > Girls
962,727,disney® kid's minnie watch - pink,Jewelry & Watches > Watches > Girls
963,727,disney® girls' red balloon stainless steel time teacher with bezel watch - pink,Jewelry & Watches > Watches > Girls
964,727,christmas gifts pink kitty cat paw prints girls watch stainless steel back,Jewelry & Watches > Watches > Girls
965,727,storytelling embellishment (pattern band) - paper plains,Jewelry & Watches > Watches > Girls
966,727,disney princess sofia stainless steel time teacher watch - kids nosize pink,Jewelry & Watches > Watches > Girls
967,727,"cars"" kid's time teacher watch- red printed strap",Jewelry & Watches > Watches > Girls
968,727,sterling silver wizards of waverly place peace sign earrings,Jewelry & Watches > Watches > Girls
969,727,disney light purple flower watch,Jewelry & Watches > Watches > Girls
970,727,frozen — pink anna & snow queen elsa time teacher watch,Jewelry & Watches > Watches > Girls
971,727,accutime watches — purple disney princess watch,Jewelry & Watches > Watches > Girls
972,727,scout watch red,Jewelry & Watches > Watches > Girls
973,727,disney kids' w000039 time teacher minnie mouse leather watch,Jewelry & Watches > Watches > Girls
974,727,disney kids' w002033 time teacher elsa and anna plastic watch,Jewelry & Watches > Watches > Girls
975,727,disney kids' sof1451 sofia,Jewelry & Watches > Watches > Girls
976,727,goodruler@ highquality pasnew water-proof dual time children boys girls sport watch boys sport waist watch,Jewelry & Watches > Watches > Girls
977,727,"Disney Kids' W002437 Frozen Elsa & Anna Time Teacher Analog Display Analog Quartz Purple Watch, Model: W002437",Jewelry & Watches > Watches > Girls
978,727,adventure time adjustable watch green beemo,Jewelry & Watches > Watches > Girls
979,727,disney kids' w000974 frozen,Jewelry & Watches > Watches > Girls
980,727,Chickens! Chickens!,Jewelry & Watches > Watches > Girls
981,727,disney kids' pn1136 watch,Jewelry & Watches > Watches > Girls
982,727,disney kids' pn1009,Jewelry & Watches > Watches > Girls
983,727,sprout women's st/1057ylck swarovski crystal-accented yellow cork strap watch,Jewelry & Watches > Watches > Girls
984,727,Adventure Time Kids' ATW001-OR Jake Watch,Jewelry & Watches > Watches > Girls
985,727,timermall lovely hello kitty pattern while band water resistant cute children's watches,Jewelry & Watches > Watches > Girls
