,category_id,description,category_path
249,727,"Hiwatch Kids Digital Watches Waterproof Led Sport Watches with Alarm for Boys and Girls, Red",Jewelry & Watches > Watches > Girls
250,727,red balloon kids' w000338 pretty girl monkey stainless steel time teacher pink velcro strap watch,Jewelry & Watches > Watches > Girls
251,727,disney kids' pn1066 rhinestone-accented watch with turquoise rubber band,Jewelry & Watches > Watches > Girls
252,727,disney kids' w000057 multi-princess stainless steel time teacher watch,Jewelry & Watches > Watches > Girls
253,727,"pasnew fashion waterproof children boys girls digital sport watch with alarm, chronograph, date (pink)",Jewelry & Watches > Watches > Girls
254,727,Disney Kids' Minnie Mouse Digital Sport Watch,Jewelry & Watches > Watches > Girls
255,727,disney kids' min188 easy read first analog watch,Jewelry & Watches > Watches > Girls
256,727,all over the sky star laser,Jewelry & Watches > Watches > Girls
257,727,Disney Infinity Kids' W002432 Frozen Elsa & Anna Analog Display Analog Quartz Purple Watch,Jewelry & Watches > Watches > Girls
258,727,disney kids' mn1130 analog,Jewelry & Watches > Watches > Girls
259,727,disney kids' w000075 tinker bell stainless steel time teacher watch,Jewelry & Watches > Watches > Girls
260,727,disney kids' w001623 the,Jewelry & Watches > Watches > Girls
261,727,pokemon boys' printed strap watch,Jewelry & Watches > Watches > Girls
262,727,red balloon kids watch - pink,Jewelry & Watches > Watches > Girls
263,727,kid's coleman® digital sportwrap watch - pink/turquoise,Jewelry & Watches > Watches > Girls
264,727,disney kids wristwatch green,Jewelry & Watches > Watches > Girls
265,727,disney doc mcstuffins stainless steel time teacher watch - kids pink no size,Jewelry & Watches > Watches > Girls
266,727,disney watch - kids' princesses rubber purple,Jewelry & Watches > Watches > Girls
267,727,disney princesses easy-read plastic strap watch,Jewelry & Watches > Watches > Girls
268,727,disney kids princesses digital lcd watch,Jewelry & Watches > Watches > Girls
269,727,disney girl's princess time teacher watch,Jewelry & Watches > Watches > Girls
270,727,disney kids' fzn3554 frozen anna and elsa rhinestone-accented watch with glittered pink band,Jewelry & Watches > Watches > Girls
271,727,hello kitty watch,Jewelry & Watches > Watches > Girls
272,727,pink glitter swatch watch,Jewelry & Watches > Watches > Girls
273,727,princess sophia flashing musical lcd watch,Jewelry & Watches > Watches > Girls
274,727,accutime watches — frog green critter watch,Jewelry & Watches > Watches > Girls
275,727,Girl's Piper Ankle Strap Ballet GOLD 6,Jewelry & Watches > Watches > Girls
276,727,Girl's Piper Ankle Strap Ballet SILVER 13,Jewelry & Watches > Watches > Girls
277,727,cute digital sport waterproof wrist watch with alarm stopwatch for kids girls (blue),Jewelry & Watches > Watches > Girls
278,727,Hello Kitty Cartoon Fashionable Ashtray W/ Small Night-light Pink 1pc,Jewelry & Watches > Watches > Girls
279,727,disney kids' tk1034b tinker,Jewelry & Watches > Watches > Girls
280,727,disney kids' w000911 doc mcstuffins stainless steel printed bezel purple nylon strap watch,Jewelry & Watches > Watches > Girls
281,727,Tinkerbell Watch,Jewelry & Watches > Watches > Girls
282,727,disney princesses kid's prskq741 time teacher watch,Jewelry & Watches > Watches > Girls
283,727,nike kids' wk0010-021 gorge watch,Jewelry & Watches > Watches > Girls
284,727,disney kids' mn1157 minnie,Jewelry & Watches > Watches > Girls
285,727,disney kids' wz2014 wizards of waverly place bracelet watch,Jewelry & Watches > Watches > Girls
286,727,timex kids' t79091 my first timex purple leather strap watch,Jewelry & Watches > Watches > Girls
287,727,disney princess lcd watch,Jewelry & Watches > Watches > Girls
288,727,Disney Kids' W002437 Frozen Elsa & Anna Time Teacher Analog Display Analog Quartz Purple Watch,Jewelry & Watches > Watches > Girls
289,727,Disney Kids' W002374 Minnie Mouse Time Teacher Watch with Multicolor Band,Jewelry & Watches > Watches > Girls
290,727,disney kids' w001523 disney,Jewelry & Watches > Watches > Girls
291,727,u-beauty hello kitty girls wristwatch wrist watch rose,Jewelry & Watches > Watches > Girls
292,727,disney kids' w000051 multi-princess stainless steel time teacher watch,Jewelry & Watches > Watches > Girls
293,727,hacbiwa fashion womens ladies girls weave leather hollow band wrist watch orange brown,Jewelry & Watches > Watches > Girls
294,727,"timex unisex t2n648 ""weekender"" watch with purple nylon band",Jewelry & Watches > Watches > Girls
295,727,disney princess digital lcd watch for girls (assorted colors),Jewelry & Watches > Watches > Girls
296,727,"disney kids' 51078-e ""my first diamond"" multi-princess watch with yellow leather band",Jewelry & Watches > Watches > Girls
297,727,the olivia collection kids flower watch & jewellery gift set for girls ks005,Jewelry & Watches > Watches > Girls
298,727,2013newestseller wholesale lot of 5pcs womens girls butterfly bracelet wrist watches,Jewelry & Watches > Watches > Girls
299,727,Timex Kids' T7B9819J IronKids Watch with Nylon Band,Jewelry & Watches > Watches > Girls
300,727,Red Balloon Kids' W002303 Red Balloon Analog Display Analog Quartz Pink Watch,Jewelry & Watches > Watches > Girls
301,727,Disney Infinity Kids' W002504 Frozen Elsa & Anna Analog Display Analog Quartz Blue Watch,Jewelry & Watches > Watches > Girls
302,727,como pink digital sports wrist watch with cold light for girls,Jewelry & Watches > Watches > Girls
303,727,"disney girls' w000025 ""minnie mouse time teacher"" stainless steel watch",Jewelry & Watches > Watches > Girls
304,727,disney kids' fzn3588 frozen,Jewelry & Watches > Watches > Girls
305,727,Garfield Kids' W000604 Time Teacher Pink Velcro Strap Watch,Jewelry & Watches > Watches > Girls
306,727,Disney Kids' MINKD550 Minnie Mouse Digital Watch with Pencil Tin,Jewelry & Watches > Watches > Girls
307,727,butterflies & blooms (fuchsia band) - gone bananas analog girls' watch with animated butterfly for second hand,Jewelry & Watches > Watches > Girls
308,727,pasnew led waterproof 100m sports digital watch for children girls boys (purple),Jewelry & Watches > Watches > Girls
309,727,Disney Kids' W000958 Ariel Stainless Steel Watch with Pink Nylon Band,Jewelry & Watches > Watches > Girls
310,727,mokingtop(tm) fashion,Jewelry & Watches > Watches > Girls
311,727,scout dr checkyl bagette,Jewelry & Watches > Watches > Girls
312,727,wise® kids girls watches,Jewelry & Watches > Watches > Girls
313,727,"disney kids' w001187 ""time teacher"" watch with floral nylon band",Jewelry & Watches > Watches > Girls
314,727,disney sofia the first kids' sof1561sr digital display analog quartz purple watch,Jewelry & Watches > Watches > Girls
315,727,Disney Kids' W001791 Elsa Time Teacher Watch with Purple Band,Jewelry & Watches > Watches > Girls
316,727,disney kids' fzn3580,Jewelry & Watches > Watches > Girls
317,727,disney doc mcstuffins girls lcd watch with molded flip top,Jewelry & Watches > Watches > Girls
318,727,Bling Jewelry Pink Girls Butterfly Flower Kids Watch Stainless Steel Back,Jewelry & Watches > Watches > Girls
319,727,hello kitty girls wristwatch wrist watch pink,Jewelry & Watches > Watches > Girls
320,727,"disney kids' w000036 minnie mouse ""time teacher"" watch",Jewelry & Watches > Watches > Girls
321,727,Bamboo Watch with Pink Leather Strap,Jewelry & Watches > Watches > Girls
322,727,disney kids' w000039 minnie mouse stainless steel time teacher watch,Jewelry & Watches > Watches > Girls
323,727,disney kids' w000969 frozen anna snow queen stainless steel time teacher pink watch,Jewelry & Watches > Watches > Girls
324,727,"timex kids' t89022 ""time teacher"" floral elastic strap watch",Jewelry & Watches > Watches > Girls
325,727,disney princess heart shape hot pink strap crystal girl's watch,Jewelry & Watches > Watches > Girls
326,727,"Teacher Appreciation Day Gift! ""I'm A Teacher, What's Your SuperPower?"" 12oz Coffee Mug; Limited Edition for Teacher",Jewelry & Watches > Watches > Girls
327,727,digital girls sports watch,Jewelry & Watches > Watches > Girls
328,727,disney wizards of waverly kids' d854s402 max time teacher purple leather strap watch,Jewelry & Watches > Watches > Girls
329,727,disney® girls' princess plastic watch - pink,Jewelry & Watches > Watches > Girls
330,727,boys' pokemon printed strap watch,Jewelry & Watches > Watches > Girls
331,727,kid's coleman® digital sportwrap watch - purple,Jewelry & Watches > Watches > Girls
332,727,disney princess flashing light up watch,Jewelry & Watches > Watches > Girls
333,727,lego friends watch - stephanie one color,Jewelry & Watches > Watches > Girls
334,727,disney doc mcstuffins lambie kids time teacher pink strap watch,Jewelry & Watches > Watches > Girls
335,727,disney ariel time teacher kids stainless steel pink strap watch,Jewelry & Watches > Watches > Girls
336,727,woven link watch with stone accents,Jewelry & Watches > Watches > Girls
337,727,disney kids' character watch - assorted styles,Jewelry & Watches > Watches > Girls
338,727,disney kids' frozen character watch with rubber strap - assorted styles,Jewelry & Watches > Watches > Girls
339,727,nakamol clr mx lthr strnd nck,Jewelry & Watches > Watches > Girls
340,727,me to we moccasins 8m/brown,Jewelry & Watches > Watches > Girls
341,727,olivia pratt — teal tom cat watch,Jewelry & Watches > Watches > Girls
342,727,Girl's Piper Ankle Strap Ballet 3 SILVER,Jewelry & Watches > Watches > Girls
343,727,Girl Kailey Glitter T Strap Ballet 12 GOLD,Jewelry & Watches > Watches > Girls
344,727,Frozen Anna and Elsa Bow Pony Holder 2-Pack MULTI CLR ONE SIZE,Jewelry & Watches > Watches > Girls
345,727,vibralite 3 pink leather band,Jewelry & Watches > Watches > Girls
346,727,yellow sailor moon cat watch - sailor moon watch,Jewelry & Watches > Watches > Girls
347,727,disney princess watch - pink watch w/ interchangeable bands and tops,Jewelry & Watches > Watches > Girls
348,727,super cute hello kitty wrist watch girls gift free shipping- pink,Jewelry & Watches > Watches > Girls
349,727,Timex Kids' TW7C061009J QA Analog Display Quartz Purple Watch,Jewelry & Watches > Watches > Girls
350,727,disney kids' w000409 tween rapunzel stainless steel and purple glitter strap watch,Jewelry & Watches > Watches > Girls
351,727,Bling Jewelry Pink Kitty Cat Paw prints Animal Girls Watch Stainless Steel Back,Jewelry & Watches > Watches > Girls
352,727,the olivia collection kids flower watch & jewellery gift set for girls ks001,Jewelry & Watches > Watches > Girls
353,727,"girl's sports digital watch, pink strap",Jewelry & Watches > Watches > Girls
354,727,Kezzi Kids' Wrist Watches K667 Quartz Analog Cartoon Leather Strap Watch Boys Girls White,Jewelry & Watches > Watches > Girls
355,727,barbie slap-band bracelets digital led watch pink for girls,Jewelry & Watches > Watches > Girls
356,727,disney kids' pn1133 watch,Jewelry & Watches > Watches > Girls
357,727,"timex kids' t7b151 ""time teacher pink ballerina"" watch with pink canvas band by timex",Jewelry & Watches > Watches > Girls
358,727,sofia the first: the,Jewelry & Watches > Watches > Girls
359,727,14mm Black Suede Leather Gold-tone Buckle Watch Band,Jewelry & Watches > Watches > Girls
360,727,"disney kids' w000022 ""time teacher"" stainless steel watch with blue nylon band",Jewelry & Watches > Watches > Girls
361,727,hacbiwa fashion womens ladies girls weave leather hollow band wrist watch black,Jewelry & Watches > Watches > Girls
362,727,disney kids' w000056 multi-princess stainless steel time teacher watch,Jewelry & Watches > Watches > Girls
363,727,disney kids' fzn3630,Jewelry & Watches > Watches > Girls
364,727,Kids' Waterproof Sports Watch Luminous Dial Velcro Nylon Strap Time Teacher Gift for Boys Girls Red,Jewelry & Watches > Watches > Girls
365,727,"Red Balloon Kids' W000175 ""Time Teacher"" Stainless Steel Watch with Pink Nylon Strap",Jewelry & Watches > Watches > Girls
366,727,disney kids' w000038 minnie,Jewelry & Watches > Watches > Girls
367,727,Peppa Pig Girl's Watch with Velcro Band,Jewelry & Watches > Watches > Girls
368,727,disney princess digital watch,Jewelry & Watches > Watches > Girls
369,727,uniqu highquality pasnew,Jewelry & Watches > Watches > Girls
370,727,Disney Kids' FNFKD042 Frozen Olaf Musical Watch,Jewelry & Watches > Watches > Girls
371,727,Ravel Girls Analogue Surfer Silver Dial Green Velcro Strap Watch R5-13.6L,Jewelry & Watches > Watches > Girls
372,727,Disney Kids' W000971 Frozen Snow Queen Elsa Stainless Steel Watch with Blue Faux Leather Band,Jewelry & Watches > Watches > Girls
373,727,mattel barbie kid's bar004t digital display quartz pink watch set,Jewelry & Watches > Watches > Girls
374,727,disney kids' prs1113t lcd watch set with gift box,Jewelry & Watches > Watches > Girls
375,727,disney kids' w000959 ariel glitz stainless steel pink nylon strap watch,Jewelry & Watches > Watches > Girls
376,727,disney kids' fzn3554 frozen,Jewelry & Watches > Watches > Girls
377,727,sprout womens st/1057blck swarovski crystal accented blue dial natural cork strap watch,Jewelry & Watches > Watches > Girls
378,727,"Slide Kids' SL3P-JRPWL Slap 3PAQ Junior Pink, White and Black Watch",Jewelry & Watches > Watches > Girls
379,727,disney kids' fzn3580 frozen,Jewelry & Watches > Watches > Girls
380,727,disney kids' w000036 minnie,Jewelry & Watches > Watches > Girls
381,727,disney kids' fzn3588 frozen anna and elsa digital-display blue watch,Jewelry & Watches > Watches > Girls
382,727,highquality pasnew water-proof children girls sport watch n1 (purple),Jewelry & Watches > Watches > Girls
383,727,rumbatime kids' firefly pink x-small watch,Jewelry & Watches > Watches > Girls
384,727,Disney Kids' PN1067 Light-Up Disney Princess Watch with Pink Glitter Band,Jewelry & Watches > Watches > Girls
385,727,pasnew cool digital-analog waterproof dual time sport wrist watches for boys girls (silver blue) pse-149b,Jewelry & Watches > Watches > Girls
386,727,disney kids' w001790 frozen,Jewelry & Watches > Watches > Girls
387,727,frenzy kids' fr240 monkey novelty analog bracelet watch,Jewelry & Watches > Watches > Girls
388,727,Hiwatch TM Pink Waterproof 30M Cold-Light Easy Reader Time Teacher Lcd Digital Sports watch for Children Girls,Jewelry & Watches > Watches > Girls
389,727,Kids' Waterproof Sports Watch Luminous Dial Velcro Nylon Strap Time Teacher Gift for Boys Girls,Jewelry & Watches > Watches > Girls
390,727,"Disney Girl's Quartz Plastic Casual Watch, Color:Pink (Model: MBT3714SR)",Jewelry & Watches > Watches > Girls
391,727,tiim white faux ceramic ladies and girls watch t228-swt,Jewelry & Watches > Watches > Girls
392,727,Disney Kids' FZN3580 Frozen Anna and Elsa Flashing-Dial Watch with Glitter Pink Rubber Band,Jewelry & Watches > Watches > Girls
393,727,fusion kids' monkey watch,Jewelry & Watches > Watches > Girls
394,727,disney® girls' frozen anna stainless steel with bezel watch - pink,Jewelry & Watches > Watches > Girls
395,727,timex® kids wristwatch - pink,Jewelry & Watches > Watches > Girls
396,727,disney® girls' ariel stainless steel with bezel watch - purple,Jewelry & Watches > Watches > Girls
397,727,lego friends watch - olivia mini one color,Jewelry & Watches > Watches > Girls
398,727,storytelling embellishment (pattern band) - float paperie,Jewelry & Watches > Watches > Girls
399,727,disney frozen watch - kids' anna time teacher pink no size,Jewelry & Watches > Watches > Girls
400,727,disney's frozen kids' anna and elsa digital light-up watch pink no size,Jewelry & Watches > Watches > Girls
401,727,disney princess sofia stainless steel time teacher watch - kids nosize purple,Jewelry & Watches > Watches > Girls
402,727,elle felicity wristlet nosize black,Jewelry & Watches > Watches > Girls
403,727,disney's frozen anna & elsa kids' time teacher watch pink no size,Jewelry & Watches > Watches > Girls
404,727,disney frozen watch - kids' anna time teacher pink,Jewelry & Watches > Watches > Girls
405,727,disney frozen anna kids time teacher pink strap watch,Jewelry & Watches > Watches > Girls
406,727,disney tinker bell glitz silver glitter strap watch,Jewelry & Watches > Watches > Girls
407,727,"disney watch, kid's daisy duck time teacher pink velcro strap 31mm w000146 no color",Jewelry & Watches > Watches > Girls
408,727,"hello kitty kids watch, girls or little girls star interchangeable watch hello kitty os",Jewelry & Watches > Watches > Girls
409,727,ravel recorder purple,Jewelry & Watches > Watches > Girls
410,727,kids’ minnie mouse time teacher watch w/ pink strap,Jewelry & Watches > Watches > Girls
411,727,disney kid's tinker bell & friends time teacher quartz purple leather strap watch,Jewelry & Watches > Watches > Girls
412,727,accutime watches — blue snowflake elsa & anna watch,Jewelry & Watches > Watches > Girls
413,727,Girl's Piper Ankle Strap Ballet 5 GOLD,Jewelry & Watches > Watches > Girls
414,727,Girls' Piper Ankle Strap Ballet Shoes 1 Gold,Jewelry & Watches > Watches > Girls
415,727,slvr rhinestone mngram-h,Jewelry & Watches > Watches > Girls
416,727,"Slide Kids' SL3P-JUURL Slap 3PAQ Jumbo Blue, Red and Black Watch",Jewelry & Watches > Watches > Girls
417,727,disney kids' w001193 cinderella time teacher watch,Jewelry & Watches > Watches > Girls
418,727,disney kids' mn1106 watch with white rubber band,Jewelry & Watches > Watches > Girls
419,727,disney kids' fzn3580 frozen anna and elsa digital display analog quartz purple watch,Jewelry & Watches > Watches > Girls
420,727,frenzy kids' fr792 purple rubber band peace watch,Jewelry & Watches > Watches > Girls
421,727,disney kids' w000424 tween tiana stainless steel printed strap watch,Jewelry & Watches > Watches > Girls
422,727,U-beauty Newest Arrival Rose Flowers Design Quartz Wristwatch Watches Student Watch (White),Jewelry & Watches > Watches > Girls
423,727,Timex Kids T7B151 Time Teacher Pink Ballerina Resin Watch Elastic Fabric Strap by Timex,Jewelry & Watches > Watches > Girls
424,727,cactus flowers southwestern,Jewelry & Watches > Watches > Girls
425,727,u-beauty hello kitty girls wristwatch wrist watch yellow,Jewelry & Watches > Watches > Girls
426,727,frenzy kids' fr803b monkey print pink analog children's watch,Jewelry & Watches > Watches > Girls
427,727,disney kids' w000078 tinker bell stainless steel time teacher watch,Jewelry & Watches > Watches > Girls
428,727,iduoduo girls outdoor sweet,Jewelry & Watches > Watches > Girls
429,727,"red balloon kids' w000188 ""butterflies"" stainless steel watch",Jewelry & Watches > Watches > Girls
430,727,MinElect(TM) Green Digital Cold Light Sports Alarm Wrist Watch for Girls Children,Jewelry & Watches > Watches > Girls
431,727,disney kids' w000054 multi-princess stainless steel time teacher watch,Jewelry & Watches > Watches > Girls
432,727,frenzy kids' fr782 rhinestone-accented watch with white rubber band,Jewelry & Watches > Watches > Girls
433,727,disney kids' w000955 tween ariel glitz stainless steel light pink glitter leather strap watch,Jewelry & Watches > Watches > Girls
434,727,Disney Kids Frozen Anna and Elsa Rhinestone-Accented Watch With Green Silicone Band,Jewelry & Watches > Watches > Girls
435,727,Disney Kids' Frozen Elsa Light Up Snow-globe Digital White Watch,Jewelry & Watches > Watches > Girls
436,727,"Disney Kids' FNFKD019 ""Frozen"" Plastic Watch",Jewelry & Watches > Watches > Girls
437,727,3d cartoon lovely panda,Jewelry & Watches > Watches > Girls
438,727,"fashion waterproof children boys girls lcd digital sport watch with alarm, chronograph, date (purple)",Jewelry & Watches > Watches > Girls
439,727,red balloon kids' w000196 stainless steel watch with leather band,Jewelry & Watches > Watches > Girls
440,727,frenzy kids' fr160 skull novelty analog bracelet watch,Jewelry & Watches > Watches > Girls
441,727,disney kids' fzn3550,Jewelry & Watches > Watches > Girls
442,727,disney kids' sofia the firststfkd025 digital watch,Jewelry & Watches > Watches > Girls
443,727,TimerMall Hello Kitty Face Slap On Snap Round Dial Pink Silicone Band Watches,Jewelry & Watches > Watches > Girls
444,727,"disney kids' frozen elsa & anna stainless steel watch, w001228, purple stretch nylon strap, analog display, analog quartz, purple watch",Jewelry & Watches > Watches > Girls
445,727,disney kids' w002443 frozen,Jewelry & Watches > Watches > Girls
446,727,sprout womens st/1060prdp easy-to-read dial dark pink organic cotton strap watch,Jewelry & Watches > Watches > Girls
447,727,disney kids' w000970 frozen anna snow queen stainless steel watch with pink nylon band,Jewelry & Watches > Watches > Girls
448,727,disney kids' w000969 frozen,Jewelry & Watches > Watches > Girls
449,727,WUTONYU(TM) Boys and Girls Sport Design Dual Time Display Analog Digital Waterproof Wrist Watch(Gold),Jewelry & Watches > Watches > Girls
450,727,disney kids' mn1097 watch with pink rubber band,Jewelry & Watches > Watches > Girls
451,727,timex kids' t89001 analog hearts and butterflies elastic fabric strap children's watch,Jewelry & Watches > Watches > Girls
452,727,frenzy kids' fr319 penguin analog orange strap watch,Jewelry & Watches > Watches > Girls
453,727,cool digital-analog waterproof dual time sport wrist watches for boys girls (silver blue),Jewelry & Watches > Watches > Girls
454,727,20mm brown italian leather gold-tone buckle watch band,Jewelry & Watches > Watches > Girls
455,727,kids lalaloopsy lololoopsy lcd digital watch with slide-on characters,Jewelry & Watches > Watches > Girls
456,727,frenzy kids' fr302 mood dial heart analog purple rubber strap watch,Jewelry & Watches > Watches > Girls
457,727,disney kids' tk1034b tinker bell purple dial purple strap watch,Jewelry & Watches > Watches > Girls
458,727,disney kids' pn1131 rhinestone-accented watch,Jewelry & Watches > Watches > Girls
459,727,"Disney Kids' W000074 ""Tinker Bell Time Teacher"" Stainless Steel Watch with Pink Leather Band",Jewelry & Watches > Watches > Girls
460,727,Timex Kids' T7B9819J IronKids Watch with Nylon Band by Timex,Jewelry & Watches > Watches > Girls
461,727,olivia pratt kids' flower watch with silvertone bezel,Jewelry & Watches > Watches > Girls
462,727,olivia pratt kids' flower watch,Jewelry & Watches > Watches > Girls
463,727,xhilaration® girls' strap watch - multicolor,Jewelry & Watches > Watches > Girls
464,727,girls' fusion analog watch - pink,Jewelry & Watches > Watches > Girls
465,727,kid's disney® wristwatch watches rubber - blue,Jewelry & Watches > Watches > Girls
466,727,disney tinker bell kids' time teacher watch purple no size,Jewelry & Watches > Watches > Girls
467,727,disney kids' minnie mouse digital watch white no size,Jewelry & Watches > Watches > Girls
468,727,disney frozen 3 musical instrument set,Jewelry & Watches > Watches > Girls
469,727,disney kids' frozen light-up musical watch with rubber strap - assorted styles,Jewelry & Watches > Watches > Girls
470,727,slap happy — pink & purple heart slap watch set,Jewelry & Watches > Watches > Girls
471,727,frozen frozen elsa lcd snow globe watch,Jewelry & Watches > Watches > Girls
472,727,Girl's Piper Ankle Strap Ballet GOLD 5,Jewelry & Watches > Watches > Girls
473,727,glitter heart se,Jewelry & Watches > Watches > Girls
474,727,Disney Kids' MN1097 Minnie Mouse Watch with Pink Rubber Band,Jewelry & Watches > Watches > Girls
475,727,disney kids' w000971 frozen,Jewelry & Watches > Watches > Girls
476,727,cutebox girls wrist watch,Jewelry & Watches > Watches > Girls
477,727,"disney girls' w000025 minnie mouse ""time teacher"" watch",Jewelry & Watches > Watches > Girls
478,727,red balloon kids' w001235 interchangeable strap red balloon plastic printed stretch nylon watch set,Jewelry & Watches > Watches > Girls
479,727,"wise® girls watch, boys",Jewelry & Watches > Watches > Girls
480,727,"disney kids' fzn3580 ""frozen anna and elsa"" plastic watch with glitter pink rubber band",Jewelry & Watches > Watches > Girls
481,727,Hello Kitty Flashing Lights LCD Watch,Jewelry & Watches > Watches > Girls
482,727,Disney Kids' FZN3569 Frozen Elsa Anna Olaf Projection Digital Watch with Pink Band,Jewelry & Watches > Watches > Girls
483,727,pasnew fashion waterproof,Jewelry & Watches > Watches > Girls
484,727,disney kids' mn1097 analog display analog quartz pink watch,Jewelry & Watches > Watches > Girls
485,727,Pasnew LED Waterproof 100m Sports Digital Watch for Children Girls Boys (Red),Jewelry & Watches > Watches > Girls
486,727,timex t78401 kids purple time teacher flowers watch,Jewelry & Watches > Watches > Girls
487,727,disney kids' pn2002 princess pink dial bracelet watch,Jewelry & Watches > Watches > Girls
488,727,jewtme kids' jw0034,Jewelry & Watches > Watches > Girls
489,727,sparkling flowers (half pink/half blue band) - gone bananas analog girls' watch with animated flower second hand and stone accents,Jewelry & Watches > Watches > Girls
490,727,"disney kids' tk1167 ""tinker",Jewelry & Watches > Watches > Girls
491,727,disney kids' fnfkd046 frozen digital watch,Jewelry & Watches > Watches > Girls
492,727,Thomas and Friends Kids' W000729 Stainless Steel Time Teacher Watch,Jewelry & Watches > Watches > Girls
493,727,Disney Kids' FNFKD013 Frozen Elsa and Anna Digital Display Quartz Pink Watch in an Ornament Gift Bulb,Jewelry & Watches > Watches > Girls
494,727,disney kids' fzn3556 frozen anna and elsa digital display analog quartz white watch,Jewelry & Watches > Watches > Girls
495,727,disney kids' w001178 interchangeable strap mickey mouse plastic stretch nylon watch set,Jewelry & Watches > Watches > Girls
496,727,Disney Kids' FZN3550 Frozen Anna and Elsa Watch with Rubber Band,Jewelry & Watches > Watches > Girls
497,727,Disney Kids' W002443 Frozen Elsa & Anna Time Teacher Analog Display Analog Quartz Purple Watch,Jewelry & Watches > Watches > Girls
498,727,"disney kids' frozen kristoff, sven character watch, w001784, woven blue band",Jewelry & Watches > Watches > Girls
